LU1681042609;Amundi MSCI Europe ESG Broad Transition UCITS ETF - EUR (C);https://www.justetf.com/en/etf-profile.html?isin=LU1681042609;The Amundi MSCI Europe ESG Broad Transition UCITS ETF - EUR (C) seeks to track the MSCI Europe ESG Broad CTB Select index. The MSCI Europe ESG Broad CTB Select index tracks stocks from Europe. Securities are selected and weighted according to sustainability criteria and EU directives on climate protection. The parent index is the MSCI Europe. The ETF's TER (total expense ratio) amounts to 0.12% p.a.. The Amundi MSCI Europe ESG Broad Transition UCITS ETF - EUR (C) is the cheapest and largest ETF that tracks the MSCI Europe ESG Broad CTB Select index. The ETF replicates the performance of the underlying index by full replication (buying all the index constituents). The dividends in the ETF are accumulated and reinvested in the ETF. The Amundi MSCI Europe ESG Broad Transition UCITS ETF - EUR (C) is a very large ETF with 2,089m Euro assets under management. The ETF was launched on 16 September 2008 and is domiciled in Luxembourg.;Amundi MSCI Europe ESG Broad Transition UCITS ETF - EUR (C) se snaží sledovat index MSCI Europe ESG Broad CTB Select. MSCI Europe ESG ESG Broad CTB Select Index akcie z Evropy. Cenné papíry jsou vybírány a váženy podle kritérií udržitelnosti a směrnic EU o ochraně klimatu. Index nadřazení je MSCI Evropa. TER (celkový poměr nákladů) ETF činí 0,12% P.A .. Amundi MSCI Europe ESG Broad Transition UCITS ETF - EUR (C) je nejlevnější a největší ETF, který sleduje index MSCI Europe ESG Broad CTB Select. ETF replikuje výkon podkladového indexu plnou replikací (nákup všech složek indexu). dividenday v ETF jsou akumulovány a reinvestovány do ETF. Amundi MSCI Europe ESG Broad Transition UCITS ETF - EUR (C) je velmi velký ETF s managementem 2 089 milionů euro. ETF byl spuštěn 16. září 2008 a je bydliště v Lucemburku.;0.12%;0.12;EUR 2089m;2089.0;EUR;EUR;Luxembourg;Amundi ETF;16 September 2008;Accumulating;;Physical;UCITS;MSCI Europe;Equity, Europe, Social/Environmental;Yes;EUR    Currency risk  Currency;1;Akcie;False;Evropa;376.0;8.04;45.37;69.0;10.45;-0.82;3.67;2.13;25.32;-11.62;15.9;9.9;220.84;14.19;12.67;14.09;0.57;1.05;0.78;-16.1;-16.1;-21.08;-42.56;;;;;Bolsa Mexicana de Valores;-;11;;;;;;;2025-09-22T01:09:51.592497;success;0;ASML Holding NV;2.39;Novartis AG;2.09;AstraZeneca PLC;1.93;HSBC Holdings Plc;1.88;Roche Holding AG;1.87;Novo Nordisk A/S;1.79;Allianz SE;1.69;Schneider Electric SE;1.63;Siemens AG;1.53;;;Other;36.94;United Kingdom;19.48;Switzerland;15.27;Germany;14.76;France;13.55;Financials;24.31;Industrials;17.53;Health Care;10.72;Consumer Staples;9.03;;;gettex;EUR;CEUG;;;;Stuttgart Stock Exchange;EUR;CEUG;;;;Bolsa Mexicana de Valores;MXN;-;CEU3N MM;;;Bolsa Mexicana de Valores;EUR;-;INCEU;INCEUINAV.PA;;Borsa Italiana;EUR;CEU;CEU IMINCEU;CEU.MIINCEUINAV.PA;;Borsa Italiana;EUR;-;CEU IMINCEU;CEU.MIINCEU=BNPP;;Euronext Amsterdam;USD;UCEU;UCEU NAINCEU;CEU.ASINCEUINAV.PA;;Euronext Paris;EUR;CEU;CEU FPINCEU;CEU.PAINCEU=BNPP;;London Stock Exchange;GBX;CEUR;CEUR LNINCEU;ACEUR.LINCEUINAV.PA;;SIX Swiss Exchange;EUR;CEU;CEU SWINCEU;CEU.SINCEU=BNPP;;5.0;80.0;22.0;13.0;15.0;10.0;20.0
LU1681042864;Amundi PEA MSCI USA ESG Leaders UCITS ETF EUR (C);https://www.justetf.com/en/etf-profile.html?isin=LU1681042864;The Amundi PEA MSCI USA ESG Leaders UCITS ETF EUR (C) seeks to track the MSCI USA ESG Leaders Select 5% Issuer Capped index. The MSCI USA ESG Leaders Select 5% Issuer Capped index tracks large- and mid-cap US-securities. Only companies with a high ESG (environmental, social and governance) rating, compared to their sector peers, are considered. The parent index is the MSCI USA. The maximum weight of a company is capped to 5%. The ETF's TER (total expense ratio) amounts to 0.35% p.a.. The ETF replicates the performance of the underlying index by full replication (buying all the index constituents). The dividends in the ETF are accumulated and reinvested in the ETF. The Amundi PEA MSCI USA ESG Leaders UCITS ETF EUR (C) has 432m Euro assets under management. The ETF was launched on 4 December 2008 and is domiciled in Luxembourg.;Amundi Pea MSCI USA ESG Leaders UCITS ETF EUR (C) se snaží sledovat vedoucí MSCI USA ESG, kteří vybrali index 5% emitenta. Vedoucí MSCI USA ESG vybrali indexové skladby 5% stisknuté skladby s velkými a středními kapitalizací. Ve srovnání s jejich vrstevníky sektoru se zvažují pouze společnosti s vysokým hodnocením ESG (environmentální, sociální a správa věcí veřejných). Index nadřazení je MSCI USA. Maximální hmotnost společnosti je omezena na 5%. TER (celkový poměr nákladů) ETF činí 0,35% p.a. ETF replikuje výkon podkladového indexu plnou replikací (nákup všech složek indexu). dividenday v ETF jsou akumulovány a reinvestovány do ETF. Vůdci Amundi Pea MSCI USA ESG UCITS ETF EUR (C) mají spravovány aktiva 432 mil. EUR. ETF byla spuštěna 4. prosince 2008 a je bydliště v Lucemburku.;0.35%;0.35;EUR 432m;432.0;EUR;EUR;Luxembourg;Amundi ETF;4 December 2008;Accumulating;;Physical;UCITS;MSCI USA ESG Leaders  EUR;Equity, United States, Social/Environmental;Yes;EUR    Currency risk  Currency;1;Akcie;False;Severní Amerika;;4.4;37.3;92.62;-3.92;2.58;6.36;5.29;36.19;-14.56;22.0;27.01;885.12;19.59;16.88;17.58;0.22;0.66;0.8;-22.79;-22.79;-22.79;-33.95;;;;;Borsa Italiana;-;7;;;;;;;2025-09-22T01:09:58.685320;success;0;;;;;;;;;;;;;;;;;;;;;;;;;;;;;;;IT;3.92;;;;;;;;;gettex;EUR;ACU2;;;;Stuttgart Stock Exchange;EUR;ACU2;;;;Borsa Italiana;EUR;CU2;CU2 IMINCU2;CU2.MIINCU2INAV.PA;;Borsa Italiana;EUR;-;CU2 IMINCU2;CU2.MIINCU2=BNPP;;Euronext Paris;EUR;CU2;CU2 FPINCU2;CU2.PAINCU2=BNPP;;SIX Swiss Exchange;EUR;CU2E;CU2E SWINCU2;CU2E.SINCU2=BNPP;;XETRA;EUR;ACU2;ACU2 GYINCU2;ACU2.DEINCU2=BNPP;;;;;;;;;;;;;;;;;;;;3.0;62.0;12.0;5.0;15.0;10.0;20.0
LU1681042948;Amundi PEA MSCI USA ESG Leaders UCITS ETF USD;https://www.justetf.com/en/etf-profile.html?isin=LU1681042948;The Amundi PEA MSCI USA ESG Leaders UCITS ETF USD seeks to track the MSCI USA ESG Leaders Select 5% Issuer Capped index. The MSCI USA ESG Leaders Select 5% Issuer Capped index tracks large- and mid-cap US-securities. Only companies with a high ESG (environmental, social and governance) rating, compared to their sector peers, are considered. The parent index is the MSCI USA. The maximum weight of a company is capped to 5%. The ETF's TER (total expense ratio) amounts to 0.35% p.a.. The ETF replicates the performance of the underlying index by full replication (buying all the index constituents). The dividends in the ETF are accumulated and reinvested in the ETF. The Amundi PEA MSCI USA ESG Leaders UCITS ETF USD has 129m Euro assets under management. The ETF was launched on 17 June 2010 and is domiciled in Luxembourg.;Amundi Pea MSCI USA ESG vůdci UCITS ETF USD se snaží sledovat vedoucí MSCI USA ESG vybrané index 5% emitenta. Vedoucí MSCI USA ESG vybrali indexové skladby 5% stisknuté skladby s velkými a středními kapitalizací. Ve srovnání s jejich vrstevníky sektoru se zvažují pouze společnosti s vysokým hodnocením ESG (environmentální, sociální a správa věcí veřejných). Index nadřazení je MSCI USA. Maximální hmotnost společnosti je omezena na 5%. TER (celkový poměr nákladů) ETF činí 0,35% p.a. ETF replikuje výkon podkladového indexu plnou replikací (nákup všech složek indexu). dividenday v ETF jsou akumulovány a reinvestovány do ETF. Vůdci Amundi Pea MSCI USA ESG UCITS ETF USD má ve správě 129 milionů euro aktiv. ETF byl spuštěn 17. června 2010 a má bydliště v Lucemburku.;0.35%;0.35;EUR 129m;129.0;EUR;USD;Luxembourg;Amundi ETF;17 June 2010;;;Physical;UCITS;MSCI USA ESG Leaders  USD;Equity, United States, Social/Environmental;Yes;USD    Currency risk  Currency;1;Akcie;False;Severní Amerika;;4.52;36.85;91.99;-3.74;2.52;6.29;5.34;37.14;-14.85;21.95;26.62;601.95;19.81;17.71;18.16;0.23;0.62;0.77;-23.01;-23.01;-23.01;-34.05;;;;;London Stock Exchange;CU2G;5;;;;;;;2025-09-22T01:10:05.964563;success;0;;;;;;;;;;;;;;;;;;;;;;;;;;;;;;;IT;3.74;;;;;;;;;gettex;EUR;XAMX;;;;Euronext Paris;USD;CU2U;CU2U FPICU2U;CU2U.PAICU2U=BNPP;;London Stock Exchange;GBX;CU2G;CU2G LNICU2U;CU2G.LICU2UINAV.PA;;London Stock Exchange;USD;CU2U;CU2U LNICU2U;CU2U.LICU2U=BNPP;;SIX Swiss Exchange;USD;CU2USD;CU2USD SWICU2U;CU2USD.SICU2U=BNPP;;;;;;;;;;;;;;;;;;;;;;;;;;;;;;;;3.0;62.0;12.0;5.0;15.0;10.0;20.0
LU1681043086;Amundi MSCI India Swap II UCITS ETF EUR Acc;https://www.justetf.com/en/etf-profile.html?isin=LU1681043086;The Amundi MSCI India Swap II UCITS ETF EUR Acc seeks to track the MSCI India index. The MSCI India index tracks the leading Indian stocks. The ETF's TER (total expense ratio) amounts to 0.80% p.a.. The ETF replicates the performance of the underlying index synthetically with a swap. The dividends in the ETF are accumulated and reinvested in the ETF. The Amundi MSCI India Swap II UCITS ETF EUR Acc has 163m Euro assets under management. The ETF was launched on 26 February 2009 and is domiciled in Luxembourg.;Amundi MSCI India Swap II UCITS ETF EUR ACC se snaží sledovat index MSCI India. Index MSCI India sleduje přední indické akcie. TER (celkový poměr nákladů) ETF činí 0,80% p.a. ETF replikuje výkon podkladového indexu synteticky s výměnou. dividenday v ETF jsou akumulovány a reinvestovány do ETF. Amundi MSCI India Swap II UCITS ETF EUR ACC má ve správě aktiv 163 milionů euro. ETF byla spuštěna 26. února 2009 a je bydliště v Lucemburku.;0.80%;0.8;EUR 163m;163.0;EUR;EUR;Luxembourg;Amundi ETF;26 February 2009;Accumulating;;Synthetic (Unfunded swap);UCITS;MSCI India Swap II  EUR Acc;Equity, India;;EUR    Currency risk  Currency;1;Akcie;False;Celosvětově;;-13.71;9.44;77.42;-10.59;-0.61;-1.56;0.24;33.55;-3.19;15.22;17.08;433.32;17.13;15.33;16.36;-0.8;0.2;0.74;-20.75;-20.75;-21.54;-43.26;;;;;Borsa Italiana;-;7;;;;;;;2025-09-22T01:10:13.537966;success;0;;;;;;;;;;;;;;;;;;;;;;;;;;;;;;;;;;;;;;;;;gettex;EUR;18MK;;;;Stuttgart Stock Exchange;EUR;18MK;;;;Borsa Italiana;EUR;CI2;CI2 IMINCI2;CI2.MIINCI2INAV.PA;;Borsa Italiana;EUR;-;CI2 IMINCI2;CI2.MIINCI2=BNPP;;Euronext Paris;EUR;CI2;CI2 FPINCI2;CI2.PAINCI2=BNPP;;SIX Swiss Exchange;EUR;CI2E;CI2E SWINCI2;CI2E.SINCI2=BNPP;;XETRA;EUR;18MK;18MK GYINCI2;CI2.DEINCI2=BNPP;;;;;;;;;;;;;;;;;;;;2.0;45.0;1.0;5.0;15.0;10.0;14.0
LU1681043169;Amundi MSCI India Swap II UCITS ETF USD Acc;https://www.justetf.com/en/etf-profile.html?isin=LU1681043169;The Amundi MSCI India Swap II UCITS ETF USD Acc seeks to track the MSCI India index. The MSCI India index tracks the leading Indian stocks. The ETF's TER (total expense ratio) amounts to 0.80% p.a.. The ETF replicates the performance of the underlying index synthetically with a swap. The dividends in the ETF are accumulated and reinvested in the ETF. The Amundi MSCI India Swap II UCITS ETF USD Acc is a small ETF with 70m Euro assets under management. The ETF was launched on 17 June 2010 and is domiciled in Luxembourg.;Amundi MSCI India Swap II UCITS ETF USD ACC se snaží sledovat index MSCI India. Index MSCI India sleduje přední indické akcie. TER (celkový poměr nákladů) ETF činí 0,80% p.a. ETF replikuje výkon podkladového indexu synteticky s výměnou. dividenday v ETF jsou akumulovány a reinvestovány do ETF. AMUNDI MSCI India Swap II UCITS ETF USD ACC je malý ETF s spravováním 70 milionů euro. ETF byl spuštěn 17. června 2010 a má bydliště v Lucemburku.;0.80%;0.8;EUR 70m;70.0;EUR;USD;Luxembourg;Amundi ETF;17 June 2010;Accumulating;;Synthetic (Unfunded swap);UCITS;MSCI India Swap II  USD Acc;Equity, India;;USD    Currency risk  Currency;1;Akcie;False;Celosvětově;;-13.6;9.06;76.81;-10.4;-0.64;-1.58;0.32;34.48;-3.53;15.11;16.72;125.8;16.79;14.82;15.83;-0.81;0.2;0.76;-20.21;-20.21;-20.91;-42.98;;;;;gettex;10A3;5;;;;;;;2025-09-22T01:10:19.319091;success;0;;;;;;;;;;;;;;;;;;;;;;;;;;;;;;;;;;;;;;;;;gettex;EUR;10A3;;;;Euronext Paris;USD;CI2U;CI2U FPICI2U;CI2U.PAICI2U=BNPP;;London Stock Exchange;GBX;CI2G;CI2G LNICI2U;CI2G.LICI2UINAV.PA;;London Stock Exchange;USD;CI2U;CI2U LNICI2U;CI2U.LICI2U=BNPP;;SIX Swiss Exchange;USD;CI2USD;CI2USD SWICI2U;CI2USD.SICI2U=BNPP;;;;;;;;;;;;;;;;;;;;;;;;;;;;;;;;2.0;41.0;1.0;1.0;15.0;10.0;14.0
LU1681043599;Amundi MSCI World Swap UCITS ETF EUR Acc;https://www.justetf.com/en/etf-profile.html?isin=LU1681043599;The Amundi MSCI World Swap UCITS ETF EUR Acc seeks to track the MSCI World index. The MSCI World index tracks stocks from 23 developed countries worldwide. The ETF's TER (total expense ratio) amounts to 0.38% p.a.. The ETF replicates the performance of the underlying index synthetically with a swap. The dividends in the ETF are accumulated and reinvested in the ETF. The Amundi MSCI World Swap UCITS ETF EUR Acc is a very large ETF with 5,059m Euro assets under management. The ETF was launched on 16 June 2009 and is domiciled in Luxembourg.;Světový svět Amundi MSCI SWAP UCITS ETF EUR ACC se snaží sledovat světový index MSCI. Světový index MSCI sleduje akcie z 23 rozvinutých zemí po celém světě. ETF TER (celkový poměr nákladů) činí 0,38% p.a. ETF replikuje výkon podkladového indexu synteticky s výměnou. dividenday v ETF jsou akumulovány a reinvestovány do ETF. Amundi MSCI World Swap UCITS ETF EUR ACC je velmi velký ETF s spravováním 5 059 milionů euro. ETF byl spuštěn 16. června 2009 a má bydliště v Lucemburku.;0.38%;0.38;EUR 5059m;5059.0;EUR;EUR;Luxembourg;Amundi ETF;16 June 2009;Accumulating;;Synthetic (Unfunded swap);UCITS;MSCI World;Equity, World;;EUR    Currency risk  Currency;1;Akcie;False;Celosvětově;;11.07;47.08;95.27;2.62;2.47;7.71;7.8;30.94;-12.87;19.46;26.33;595.44;15.81;13.61;14.13;0.7;1.01;1.01;-20.23;-20.23;-20.23;-33.77;;;;;Borsa Italiana;-;8;;;;;;;2025-09-22T01:10:26.182714;success;0;;;;;;;;;;;;;;;;;;;;;;;;;;;;;;;;;;;;;;;;;gettex;EUR;AMEW;;;;Stuttgart Stock Exchange;EUR;AMEW;;;;Borsa Italiana;EUR;CW8;CW8 IMINCW8;CW8.MIINCW8INAV.PA;;Borsa Italiana;EUR;-;CW8 IMINCW8;CW8.MIINCW8=BNPP;;Euronext Paris;EUR;CW8;CW8 FPINCW8;CW8.PAINCW8=BNPP;;SIX Swiss Exchange;EUR;CW8E;CW8E SWINCW8;CW8E.SINCW8=BNPP;;XETRA;USD;AMEX;AMEX GYCW8USDIV;AMEWUSD.DECW8USDINAV=SOLA;;XETRA;EUR;AMEW;AMEW GYINCW8;AMEW.DEINCW8=BNPP;;;;;;;;;;;;;;4.0;73.0;12.0;16.0;15.0;10.0;20.0
LU1681043672;Amundi MSCI World Swap UCITS ETF USD Acc;https://www.justetf.com/en/etf-profile.html?isin=LU1681043672;The Amundi MSCI World Swap UCITS ETF USD Acc seeks to track the MSCI World index. The MSCI World index tracks stocks from 23 developed countries worldwide. The ETF's TER (total expense ratio) amounts to 0.38% p.a.. The ETF replicates the performance of the underlying index synthetically with a swap. The dividends in the ETF are accumulated and reinvested in the ETF. The Amundi MSCI World Swap UCITS ETF USD Acc has 128m Euro assets under management. The ETF was launched on 17 June 2010 and is domiciled in Luxembourg.;Světový svět Amundi MSCI Swap UCITS ETF USD ACC se snaží sledovat světový index MSCI. Světový index MSCI sleduje akcie z 23 rozvinutých zemí po celém světě. ETF TER (celkový poměr nákladů) činí 0,38% p.a. ETF replikuje výkon podkladového indexu synteticky s výměnou. dividenday v ETF jsou akumulovány a reinvestovány do ETF. Světový swap UCITS ETF USD ACC ACC ACC ACC ACC AMSI má 128 milionů euro. ETF byl spuštěn 17. června 2010 a má bydliště v Lucemburku.;0.38%;0.38;EUR 128m;128.0;EUR;USD;Luxembourg;Amundi ETF;17 June 2010;Accumulating;;Synthetic (Unfunded swap);UCITS;MSCI World;Equity, World;;USD    Currency risk  Currency;1;Akcie;False;Celosvětově;;11.22;46.59;94.61;2.85;2.45;7.68;7.89;31.85;-13.17;19.35;25.96;424.25;16.46;14.83;15.08;0.68;0.92;0.94;-20.44;-20.44;-20.44;-33.87;;;;;London Stock Exchange;CW8G;5;;;;;;;2025-09-22T01:10:33.068928;success;0;;;;;;;;;;;;;;;;;;;;;;;;;;;;;;;;;;;;;;;;;gettex;EUR;XAMZ;;;;Euronext Paris;USD;CW8U;CW8U FPICW8U;CW8U.PAICW8U=BNPP;;London Stock Exchange;GBX;CW8G;CW8G LNICW8U;CW8G.LICW8UINAV.PA;;London Stock Exchange;USD;CW8U;CW8U LNICW8U;CW8U.LICW8U=BNPP;;SIX Swiss Exchange;USD;CW8USD;CW8USD SWICW8U;CW8USD.SICW8U=BNPP;;;;;;;;;;;;;;;;;;;;;;;;;;;;;;;;3.0;62.0;12.0;5.0;15.0;10.0;20.0
LU1681043912;Amundi MSCI China Tech UCITS ETF EUR Acc;https://www.justetf.com/en/etf-profile.html?isin=LU1681043912;The Amundi MSCI China Tech UCITS ETF EUR Acc seeks to track the MSCI China Tech IMI All Share Stock Connect Filtered index. The MSCI China Tech IMI All Share Stock Connect Filtered index tracks Chinese companies active in the development of new products and services associated to technology innovations. The stocks included are filtered according to ESG criteria (environmental, social and corporate governance). The ETF's TER (total expense ratio) amounts to 0.55% p.a.. The Amundi MSCI China Tech UCITS ETF EUR Acc is the cheapest and largest ETF that tracks the MSCI China Tech IMI All Share Stock Connect Filtered index. The ETF replicates the performance of the underlying index by full replication (buying all the index constituents). The dividends in the ETF are accumulated and reinvested in the ETF. The Amundi MSCI China Tech UCITS ETF EUR Acc has 103m Euro assets under management. The ETF was launched on 26 February 2009 and is domiciled in Luxembourg.;AMUNDI MSCI China Tech UCITS ETF EUR ACC se snaží sledovat MSCI China Tech IMI všechny sdílení akcií Connect filtrovaný index. MSCI China Tech IMI všechny sdílení akcií Connect Filtrované indexové stopy čínské společnosti aktivní ve vývoji nových produktů a služeb spojených s technologickými inovacemi. Zahrnuté akcie jsou filtrovány podle kritérií ESG (environmentální, sociální a správa a společností). TER (celkový poměr nákladů) ETF činí 0,55% P.A .. Amundi MSCI China Tech UCITS ETF EUR ACC je nejlevnější a největší ETF, který sleduje MSCI China Tech IMI všechny sdílení akciových filtrovaných indexů. ETF replikuje výkon podkladového indexu plnou replikací (nákup všech složek indexu). dividenday v ETF jsou akumulovány a reinvestovány do ETF. Amundi MSCI China Tech UCITS ETF EUR ACC má ve správě aktiva 103 milionů EUR. ETF byla spuštěna 26. února 2009 a je bydliště v Lucemburku.;0.55%;0.55;EUR 103m;103.0;EUR;EUR;Luxembourg;Amundi ETF;26 February 2009;Accumulating;;Physical;UCITS;MSCI China Tech  EUR Acc;Equity, China, Social/Environmental;Yes;EUR    Currency risk  Currency;1;Akcie;False;Celosvětově;96.0;67.05;18.84;31.65;28.76;12.92;34.94;14.07;3.78;-2.93;-14.17;8.7;161.54;29.96;26.04;23.99;2.24;0.23;0.24;-25.28;-38.33;-39.44;-50.56;;;;;Borsa Italiana;-;6;;;;;;;2025-09-22T01:10:39.728216;success;0;Foxconn Industrial Internet Co., Ltd.;2.16;LONGi Green Energy Tech;1.9;CHINA MOLYBDENUM ORD SHS A;1.85;Kingdee Intl Software Grp;1.85;Victory Giant Technology (HuiZhou) Co., Ltd.;1.8;Tencent Music;1.79;NIO;1.78;Sungrow Power Supply;1.74;Sunny Optical Tech Grp;1.74;;;China;85.21;Other;9.86;;;;;;;Consumer Discretionary;21.22;Industrials;10.35;Technology;2.18;Energy;1.9;;;gettex;EUR;18MG;;;;Stuttgart Stock Exchange;EUR;18MG;;;;Borsa Italiana;EUR;CC1;CC1 IMINCC1;CC1.MIINCC1INAV.PA;;Borsa Italiana;EUR;-;CC1 IMINCC1;CC1.MIINCC1=BNPP;;Euronext Paris;EUR;CC1;CC1 FPINCC1;CC1.PAINCC1=BNPP;;SIX Swiss Exchange;EUR;CC1E;CC1E SWINCC1;CC1E.SINCC1=BNPP;;;;;;;;;;;;;;;;;;;;;;;;;;3.0;54.0;6.0;5.0;15.0;10.0;18.0
LU1681044050;Amundi MSCI China Tech UCITS ETF USD Acc;https://www.justetf.com/en/etf-profile.html?isin=LU1681044050;The Amundi MSCI China Tech UCITS ETF USD Acc seeks to track the MSCI China Tech IMI All Share Stock Connect Filtered index. The MSCI China Tech IMI All Share Stock Connect Filtered index tracks Chinese companies active in the development of new products and services associated to technology innovations. The stocks included are filtered according to ESG criteria (environmental, social and corporate governance). The ETF's TER (total expense ratio) amounts to 0.55% p.a.. The Amundi MSCI China Tech UCITS ETF USD Acc is the cheapest ETF that tracks the MSCI China Tech IMI All Share Stock Connect Filtered index. The ETF replicates the performance of the underlying index by full replication (buying all the index constituents). The dividends in the ETF are accumulated and reinvested in the ETF. The Amundi MSCI China Tech UCITS ETF USD Acc is a small ETF with 36m Euro assets under management. The ETF was launched on 17 June 2010 and is domiciled in Luxembourg.;AMCINI MSCI China Tech UCITS ETF USD ACC se snaží sledovat filtrovaný index MSCI China Tech IMI. MSCI China Tech IMI všechny sdílení akcií Connect Filtrované indexové stopy čínské společnosti aktivní ve vývoji nových produktů a služeb spojených s technologickými inovacemi. Zahrnuté akcie jsou filtrovány podle kritérií ESG (environmentální, sociální a správa a společností). TER (celkový poměr nákladů) ETF činí 0,55% p.a. Amundi MSCI China Tech UCITS ETF USD ACC je nejlevnější ETF, který sleduje MSCI China Tech IMI všechny sdílení akcií Connect Filtred Index. ETF replikuje výkon podkladového indexu plnou replikací (nákup všech složek indexu). dividenday v ETF jsou akumulovány a reinvestovány do ETF. AMD ACC ACC ACC ACC ACC ACC ACC AMCINI MSCI je malý ETF s managementem 36 milionů euro. ETF byl spuštěn 17. června 2010 a má bydliště v Lucemburku.;0.55%;0.55;EUR 36m;36.0;EUR;USD;Luxembourg;Amundi ETF;17 June 2010;Accumulating;;Physical;UCITS;MSCI China Tech  USD Acc;Equity, China, Social/Environmental;Yes;USD    Currency risk  Currency;1;Akcie;False;Celosvětově;96.0;67.15;18.36;31.11;28.95;12.81;34.81;14.07;4.5;-3.27;-14.25;8.38;46.72;29.64;25.52;23.38;2.27;0.23;0.24;-25.51;-38.3;-39.54;-50.79;;;;;London Stock Exchange;CC1G;5;;;;;;;2025-09-22T01:10:46.396574;success;0;Foxconn Industrial Internet Co., Ltd.;2.16;LONGi Green Energy Tech;1.9;CHINA MOLYBDENUM ORD SHS A;1.85;Kingdee Intl Software Grp;1.85;Victory Giant Technology (HuiZhou) Co., Ltd.;1.8;Tencent Music;1.79;NIO;1.78;Sungrow Power Supply;1.74;Sunny Optical Tech Grp;1.74;;;China;85.21;Other;9.86;;;;;;;Consumer Discretionary;21.22;Industrials;10.35;Technology;2.18;Energy;1.9;;;gettex;EUR;XAME;;;;Euronext Paris;USD;CC1U;CC1U FPICC1U;CC1U.PAICC1U=BNPP;;London Stock Exchange;GBX;CC1G;CC1G LNICC1U;CC1G.LICC1UINAV.PA;;London Stock Exchange;USD;CC1U;CC1U LNICC1U;CC1U.LICC1U=BNPP;;SIX Swiss Exchange;USD;CC1USD;CC1USD SWICC1U;CC1USD.SICC1U=BNPP;;;;;;;;;;;;;;;;;;;;;;;;;;;;;;;;3.0;50.0;6.0;1.0;15.0;10.0;18.0
LU1681044308;Amundi MSCI Europe ex Switzerland ESG Leaders UCITS ETF DR (C);https://www.justetf.com/en/etf-profile.html?isin=LU1681044308;The Amundi MSCI Europe ex Switzerland ESG Leaders UCITS ETF DR (C) seeks to track the MSCI Europe ex Switzerland ESG Leaders Select 5% Issuer Capped index. The MSCI Europe ex Switzerland ESG Leaders Select 5% Issuer Capped index tracks the leading stocks from European industrial countries, excluding Switzerland. Only companies with a high ESG (environmental, social and governance) rating, compared to their sector peers, are considered. The maximum weight of a company is capped to 5%. The ETF's TER (total expense ratio) amounts to 0.15% p.a.. The Amundi MSCI Europe ex Switzerland ESG Leaders UCITS ETF DR (C) is the only ETF that tracks the MSCI Europe ex Switzerland ESG Leaders Select 5% Issuer Capped index. The ETF replicates the performance of the underlying index by full replication (buying all the index constituents). The dividends in the ETF are accumulated and reinvested in the ETF. The Amundi MSCI Europe ex Switzerland ESG Leaders UCITS ETF DR (C) is a large ETF with 522m Euro assets under management. The ETF was launched on 15 December 2009 and is domiciled in Luxembourg.;Amundi MSCI Europe Ex Švýcarsko ESG Vedoucí UCITS ETF DR (C) se snaží sledovat MSCI Europe Ex Švýcarsko ESG vůdci ESG vybrali 5% index emitenta. Vedoucí představitelé ESG MSCI Europe Exwitzerland vybírají index 5% emitenta, který sleduje přední akciíy z evropských průmyslových zemí, s výjimkou Švýcarska. Ve srovnání s jejich vrstevníky sektoru se zvažují pouze společnosti s vysokým hodnocením ESG (environmentální, sociální a správa věcí veřejných). Maximální hmotnost společnosti je omezena na 5%. TER (celkový poměr nákladů) činí 0,15% P.A. Amundi MSCI Europe Evropský vůdce ESG ESG UCITS ETF DR (C) je jediný ETF, který sleduje MSCI Europe Ex Švýcarsko ESG vůdci vybírat index 5% emitenta. ETF replikuje výkon podkladového indexu plnou replikací (nákup všech složek indexu). dividenday v ETF jsou akumulovány a reinvestovány do ETF. Vedoucí Amundi MSCI Europe Ex Švýcarsko ESG UCITS ETF DR (C) je velký ETF s managementem 522 milionů euro. ETF byla spuštěna 15. prosince 2009 a je bydliště v Lucemburku.;0.15%;0.15;EUR 522m;522.0;EUR;EUR;Luxembourg;Amundi ETF;15 December 2009;Accumulating;;Physical;UCITS;MSCI Europe;Equity, Europe, Social/Environmental;Yes;EUR    Currency risk  Currency;1;Akcie;False;Evropa;204.0;3.56;39.75;64.55;6.81;0.51;1.59;0.91;24.64;-8.64;16.51;6.4;198.72;14.62;13.11;14.75;0.24;0.9;0.71;-16.68;-16.68;-20.31;-37.23;;;2.697;;Euronext Paris;CS9;3;;;;;;;2025-09-22T01:10:50.962483;success;0;HSBC Holdings Plc;4.18;AstraZeneca PLC;4.17;Novo Nordisk A/S;4.14;Schneider Electric SE;2.79;Unilever Plc;2.76;LVMH Moët Hennessy Louis Vuitton SE;2.76;Spotify Technology SA;1.91;Iberdrola SA;1.89;RELX;1.8;;;Other;34.95;United Kingdom;25.25;France;20.84;Netherlands;11.77;Germany;7.19;Financials;22.76;Industrials;18.61;Consumer Discretionary;10.78;Consumer Staples;8.82;IT;2.76;gettex;EUR;X13Z;;;;Euronext Paris;EUR;CS9;CS9 FPINCS9;CS9.PAINCS9=BNPP;;SIX Swiss Exchange;EUR;CS9;CS9 SWINCS9;CS9.SINCS9=BNPP;;;;;;;;;;;;;;;;;;;;;;;;;;;;;;;;;;;;;;;;;;;;5.0;77.0;22.0;10.0;15.0;10.0;20.0
