isin;name;url;description_en;description_cs;ter;ter_numeric;fund_size;fund_size_numeric;fund_size_currency;fund_currency;fund_domicile;fund_provider;inception_date;distribution_policy;distribution_frequency;replication;legal_structure;index_name;investment_focus;sustainability;currency_risk;strategy_risk;category;is_leveraged;region;total_holdings;return_1y;return_3y;return_5y;return_ytd;return_1m;return_3m;return_6m;return_2021;return_2022;return_2023;return_2024;return_inception;volatility_1y;volatility_3y;volatility_5y;return_per_risk_1y;return_per_risk_3y;return_per_risk_5y;max_drawdown_1y;max_drawdown_3y;max_drawdown_5y;max_drawdown_inception;beta;correlation;tracking_error;information_ratio;primary_exchange;primary_ticker;total_exchanges;current_dividend_yield;current_dividend_yield_numeric;dividends_12m;dividends_12m_numeric;dividends_12m_currency;dividend_extraction_method;scraping_date;scraping_status;retry_count;holding_1_name;holding_1_weight;holding_2_name;holding_2_weight;holding_3_name;holding_3_weight;holding_4_name;holding_4_weight;holding_5_name;holding_5_weight;holding_6_name;holding_6_weight;holding_7_name;holding_7_weight;holding_8_name;holding_8_weight;holding_9_name;holding_9_weight;holding_10_name;holding_10_weight;country_1_name;country_1_weight;country_2_name;country_2_weight;country_3_name;country_3_weight;country_4_name;country_4_weight;country_5_name;country_5_weight;sector_1_name;sector_1_weight;sector_2_name;sector_2_weight;sector_3_name;sector_3_weight;sector_4_name;sector_4_weight;sector_5_name;sector_5_weight;exchange_1_name;exchange_1_currency;exchange_1_ticker;exchange_1_bloomberg;exchange_1_reuters;exchange_1_market_maker;exchange_2_name;exchange_2_currency;exchange_2_ticker;exchange_2_bloomberg;exchange_2_reuters;exchange_2_market_maker;exchange_3_name;exchange_3_currency;exchange_3_ticker;exchange_3_bloomberg;exchange_3_reuters;exchange_3_market_maker;exchange_4_name;exchange_4_currency;exchange_4_ticker;exchange_4_bloomberg;exchange_4_reuters;exchange_4_market_maker;exchange_5_name;exchange_5_currency;exchange_5_ticker;exchange_5_bloomberg;exchange_5_reuters;exchange_5_market_maker;exchange_6_name;exchange_6_currency;exchange_6_ticker;exchange_6_bloomberg;exchange_6_reuters;exchange_6_market_maker;exchange_7_name;exchange_7_currency;exchange_7_ticker;exchange_7_bloomberg;exchange_7_reuters;exchange_7_market_maker;exchange_8_name;exchange_8_currency;exchange_8_ticker;exchange_8_bloomberg;exchange_8_reuters;exchange_8_market_maker;exchange_9_name;exchange_9_currency;exchange_9_ticker;exchange_9_bloomberg;exchange_9_reuters;exchange_9_market_maker;exchange_10_name;exchange_10_currency;exchange_10_ticker;exchange_10_bloomberg;exchange_10_reuters;exchange_10_market_maker;rating;rating_score;rating_ter_score;rating_size_score;rating_track_record_score;rating_provider_score;rating_performance_score
IE00BP46NG52;SPDR ICE BofA 0-5 Year EM USD Government Bond UCITS ETF;https://www.justetf.com/en/etf-profile.html?isin=IE00BP46NG52;The SPDR ICE BofA 0-5 Year EM USD Government Bond UCITS ETF seeks to track the ICE BofA Emerging Markets USD Government Bond 0-5 ex-144a index. The ICE BofA Emerging Markets USD Government Bond 0-5 Year ex-144a index tracks US dollar-denominated emerging markets government debt publicly issued in the US domestic market. The ETF's TER (total expense ratio) amounts to 0.42% p.a.. The SPDR ICE BofA 0-5 Year EM USD Government Bond UCITS ETF is the only ETF that tracks the ICE BofA Emerging Markets USD Government Bond 0-5 ex-144a index. The ETF replicates the performance of the underlying index by sampling technique (buying a selection of the most relevant index constituents). The interest income (coupons) in the ETF is distributed to the investors (Semi annually). The SPDR ICE BofA 0-5 Year EM USD Government Bond UCITS ETF is a small ETF with 30m Euro assets under management. The ETF was launched on 12 November 2014 and is domiciled in Ireland.;SPDR ICE BOFA 0-5 Year EM USD Vládní dluhopis UCITS ETF se snaží sledovat rozvíjející se trhy ICE BOFA vládní dluhopis USD 0-5 EX-144A. ICE BOFA Emerging Markets USD Vládní dluhopis 0-5 let EX-144A Index sleduje americký rozvíjející se trhy denominovaný do dolaru veřejně vydávaný na americkém domácím trhu. TER (celkový poměr výdajů) ETF činí 0,42% p.a. ETF replikuje výkon základního indexu technikou vzorkování (nákup výběru nejdůležitějších složek indexu). Úrokové výnosy (kupóny) v ETF jsou distribuovány investorům (semifinále každoročně). SPDR ICE BOFA 0-5 Year EM USD vládní dluhopis UCITS ETF je malý ETF s 30m euro managementu. ETF byl spuštěn 12. listopadu 2014 a má bydliště v Irsku.;0.42%;0.42;EUR 30m;30.0;EUR;USD;Ireland;SPDR ETF;12 November 2014;;Semi annually;Physical;UCITS;Government Bond;risk  Long-only    Sustainability  No;;USD    Currency risk  Currency;1;Dluhopisy;False;Rozvíjející se trhy;243.0;0.09;0.67;11.5;-6.53;-0.72;0.0;-4.4;7.95;-1.09;2.44;11.74;36.73;8.0;7.46;7.09;0.01;0.03;0.31;-9.83;-10.45;-10.45;-14.38;;;;;Borsa Italiana;EMH5;7;5.22%;5.22;EUR 1.22;1.22;EUR;method2_regex;2025-09-24T02:35:34.511172;success;0;XS1696892295;1.32;XS2689091846;1.1;XS2247216174;1.1;XS2155352664;1.09;XS1936302865;1.08;XS1944412748;1.01;XS2523929474;1.0;;;;;;;Other;71.85;;;;;;;;;IT;5.13;;;;;;;;;gettex;EUR;ZPR5;;;;Stuttgart Stock Exchange;EUR;ZPR5;;;;Borsa Italiana;EUR;EMH5;EMH5 IMINZPR5E;EMH5.MI;;London Stock Exchange;USD;EMH5;EMH5 LNINZPR5U;EMH5.L;;London Stock Exchange;GBP;SEMH;SEMH LNINZPR5P;SEMH.L;;SIX Swiss Exchange;CHF;EMH5;EMH5 SEINZPR5C;EMH5.S;;XETRA;EUR;ZPR5;ZPR5 GYINZPR5E;ZPR5.DE;;;;;;;;;;;;;;;;;;;;3;53;12;1;13;10;17
IE00BP8FKB21;Xtrackers FTSE Developed Europe Ex UK Property UCITS ETF 1C;https://www.justetf.com/en/etf-profile.html?isin=IE00BP8FKB21;The Xtrackers FTSE Developed Europe Ex UK Property UCITS ETF 1C seeks to track the FTSE EPRA/NAREIT Developed Europe ex UK Capped index. The FTSE EPRA/NAREIT Developed Europe ex UK capped index tracks listed real estate companies and Real Estate Investment Trusts (REITS) from developed European countries excluding the UK. The ETF's TER (total expense ratio) amounts to 0.33% p.a.. The Xtrackers FTSE Developed Europe Ex UK Property UCITS ETF 1C is the only ETF that tracks the FTSE EPRA/NAREIT Developed Europe ex UK Capped index. The ETF replicates the performance of the underlying index by full replication (buying all the index constituents). The dividends in the ETF are accumulated and reinvested in the ETF. The Xtrackers FTSE Developed Europe Ex UK Property UCITS ETF 1C is a very small ETF with 19m Euro assets under management. The ETF was launched on 27 August 2014 and is domiciled in Ireland.;The Xtrackers FTSE vyvinuli Europe Exk Property UCITS ETF 1C se snaží sledovat FTSE EPRA/Nareit vyvinuté Europe Ex Intex Index. FTSE EPRA/Nareit vyvinula evropské indexové skladby Evropské britské indexové skladby uvedené realitní společnosti a důvěry investic do nemovitostí (REIT) z rozvinutých evropských zemí s výjimkou Velké Británie. TER (celkový poměr nákladů) činí 0,33% P.A .. Xtrackers FTSE vyvinul Europe Exk Property UCITS ETF 1C je jediným ETF, který sleduje index FTSE Epra/Nareit. ETF replikuje výkon podkladového indexu plnou replikací (nákup všech složek indexu). dividenday v ETF jsou akumulovány a reinvestovány do ETF. Xtrackers FTSE vyvinuli Europe Exk Property UCITS ETF 1C je velmi malý ETF s managementem 19m euro. ETF byl spuštěn 27. srpna 2014 a je se sídlem v Irsku.;0.33%;0.33;EUR 19m;19.0;EUR;EUR;Ireland;Xtrackers;27 August 2014;;;Physical;UCITS;FTSE Developed Europe Ex UK Property  1C;Real Estate, Europe;;EUR    Currency risk  Currency;1;Nemovitosti;False;Evropa;70.0;-3.79;28.28;2.01;5.65;-4.92;-4.05;7.34;13.04;-35.46;18.52;-1.36;49.68;16.94;22.28;21.75;-0.22;0.39;0.02;-19.32;-24.68;-47.58;-47.58;;;;;gettex;XREA;3;;;;;;;2025-09-24T02:35:43.076585;success;0;Swiss Prime Site;7.03;Unibail-Rodamco-Westfield;6.1;Klépierre SA;5.23;PSP Swiss Property;5.08;LEG Immobilien;3.89;MERLIN Properties SOCIMI SA;3.37;Gecina SA;3.34;Fastighets AB Balder;3.11;Castellum AB;3.03;;;Other;25.68;France;20.48;Switzerland;16.71;Germany;16.64;;;;;;;;;;;;;gettex;EUR;XREA;;;;Stuttgart Stock Exchange;EUR;XREA;;;;XETRA;EUR;XREA;XREA GYXREAINVE;XREA.DE0J0DINAV.DE;;;;;;;;;;;;;;;;;;;;;;;;;;;;;;;;;;;;;;;;;;;;3;55;12;1;13;10;19
IE00BP9F2H18;PIMCO US Low Duration Corporate Bond UCITS ETF Dist;https://www.justetf.com/en/etf-profile.html?isin=IE00BP9F2H18;The PIMCO US Low Duration Corporate Bond UCITS ETF Dist seeks to track the PIMCO Low Duration US Corporate Bond index. The PIMCO Low Duration US Corporate Bond strategy is actively managed by PIMCO and invests primarily in a diversified portfolio of US Dollar denominated investment grade corporate fixed income instruments. The ETF's TER (total expense ratio) amounts to 0.49% p.a.. The PIMCO US Low Duration Corporate Bond UCITS ETF Dist is the only ETF that tracks the PIMCO Low Duration US Corporate Bond index. The ETF replicates the performance of the underlying index by sampling technique (buying a selection of the most relevant index constituents). The interest income (coupons) in the ETF is distributed to the investors (Quarterly). The PIMCO US Low Duration Corporate Bond UCITS ETF Dist has 128m Euro assets under management. The ETF was launched on 17 November 2014 and is domiciled in Ireland.;Společnost PIMCO USA s nízkým trváním firemní dluhopisy UCITS ETF Dist se snaží sledovat index firemních dluhopisů v USA s nízkým trváním PIMCO. Strategie amerických podnikových dluhopisů v USA PIMCO je aktivně spravována společností PIMCO a investuje především do diverzifikovaného portfolia amerických dolarových denominovaných investičních nástrojů pro firemní výnosy s pevným výnosem. TER (celkový poměr nákladů) ETF činí 0,49% P.A. Společnost PIMCO USA s nízkým trváním firemní dluhopisy UCITS ETF Dist je jediným ETF, který sleduje index firemních dluhopisů PIMCO s nízkým trváním amerických podnikových dluhopisů. ETF replikuje výkon základního indexu technikou vzorkování (nákup výběru nejdůležitějších složek indexu). Úrokové výnosy (kupóny) v ETF jsou distribuovány investorům (čtvrtletně). Společnost PIMCO USA s nízkým trváním podnikového dluhopisu UCITS ETF Dist má ve správě aktiva 128 milionů euro. ETF byl spuštěn 17. listopadu 2014 a je se sídlem v Irsku.;0.49%;0.49;EUR 128m;128.0;EUR;USD;Ireland;PIMCO;17 November 2014;Distributing;Quarterly;Physical;UCITS;;risk  Long-only    Sustainability  No;;USD    Currency risk  Currency;1;Dluhopisy;False;Celosvětově;323.0;-0.15;0.36;12.45;-6.73;-0.6;0.24;-4.69;7.99;0.55;2.56;11.57;45.71;8.41;8.19;7.73;-0.02;0.01;0.31;-10.25;-11.41;-11.41;-14.46;;;;;Borsa Italiana;LDCU;4;4.63%;4.63;EUR 4.01;4.01;EUR;method2_regex;2025-09-24T02:35:53.226714;success;0;;;;;;;;;;;;;;;;;;;;;Other;61.32;United States;33.16;United Kingdom;2.53;;;;;;;;;;;;;;;gettex;EUR;PM9J;;;;Borsa Italiana;EUR;LDCU;LDCU IMINLDCUE;LDCU.MIINLDCUEiv.P;;London Stock Exchange;USD;LDCU;LDCU LNINLDCU;LDCU.LINLDCUiv.P;;SIX Swiss Exchange;USD;LDCU;LDCU SWINLDCU;LDCU.SINLDCUiv.P;;;;;;;;;;;;;;;;;;;;;;;;;;;;;;;;;;;;;;3;52;12;5;13;5;17
IE00BP9F2J32;PIMCO Euro Low Duration Corporate Bond UCITS ETF Dist;https://www.justetf.com/en/etf-profile.html?isin=IE00BP9F2J32;The PIMCO Euro Low Duration Corporate Bond UCITS ETF Dist seeks to track the PIMCO Low Duration Euro Corporate Bond index. The PIMCO Low Duration Euro Corporate Bond strategy is actively managed by PIMCO and invests primarily in a diversified portfolio of Euro denominated investment grade corporate fixed income instruments. The ETF's TER (total expense ratio) amounts to 0.49% p.a.. The PIMCO Euro Low Duration Corporate Bond UCITS ETF Dist is the only ETF that tracks the PIMCO Low Duration Euro Corporate Bond index. The ETF replicates the performance of the underlying index by sampling technique (buying a selection of the most relevant index constituents). The interest income (coupons) in the ETF is distributed to the investors (Quarterly). The PIMCO Euro Low Duration Corporate Bond UCITS ETF Dist has 294m Euro assets under management. The ETF was launched on 17 November 2014 and is domiciled in Ireland.;Společnost PIMCO Euro s nízkým trváním podnikového dluhopisu UCITS ETF Dist se snaží sledovat index společnosti Euro Corporate Bond z Pimco s nízkým trváním. Strategie společnosti PIMCO s nízkým trváním Euro Corporate Bond je aktivně spravována společností PIMCO a investuje především do diverzifikovaného portfolia podnikových nástrojů pro firemní výnosy denominované euro. TER (celkový poměr výdajů) ETF činí 0,49% P.A. Společnost PIMCO Euro s nízkým trváním podnikového dluhopisu UCITS ETF Dist je jediným ETF, který sleduje index společnosti Euro Corporate Bond společnosti Pimco s nízkým trváním. ETF replikuje výkon základního indexu technikou vzorkování (nákup výběru nejdůležitějších složek indexu). Úrokové výnosy (kupóny) v ETF jsou distribuovány investorům (čtvrtletně). Společnost PIMCO Euro s nízkým trváním podnikového dluhopisu UCITS ETF Dist má ve spravování aktiva 294 milionů euro. ETF byl spuštěn 17. listopadu 2014 a je se sídlem v Irsku.;0.49%;0.49;EUR 294m;294.0;EUR;EUR;Ireland;PIMCO;17 November 2014;Distributing;Quarterly;Physical;UCITS;;risk  Long-only    Sustainability  No;;EUR    Currency risk  Currency;1;Dluhopisy;False;Celosvětově;231.0;4.95;16.28;7.41;3.56;0.2;1.13;2.74;0.22;-8.6;6.78;4.69;16.51;1.76;2.26;2.21;2.81;2.28;0.65;-1.08;-1.74;-10.9;-10.9;;;;;gettex;LDCE;5;3.10%;3.1;EUR 3.18;3.18;EUR;method2_regex;2025-09-24T02:36:01.309308;success;0;XS2209794408;1.64;CH1214797172;1.24;XS2390506546;1.12;XS2317069685;0.93;XS2385791046;0.91;;;;;;;;;;;Other;55.42;United States;13.03;United Kingdom;12.47;France;11.8;Netherlands;7.28;;;;;;;;;;;gettex;EUR;LDCE;;;;Stuttgart Stock Exchange;EUR;LDCE;;;;Borsa Italiana;EUR;LDCE;LDCE IMINLDCE;LDCE.MIINLDCEiv.P;;SIX Swiss Exchange;EUR;LDCE;LDCE SWINLDCE;LDCE.SINLDCEiv.P;;XETRA;EUR;LDCE;LDCE GYINLDCE;LDCE.DEINLDCEiv.P;;;;;;;;;;;;;;;;;;;;;;;;;;;;;;;;3;55;12;5;13;5;20
IE00BPRCH686;Invesco JPX-Nikkei 400 UCITS ETF;https://www.justetf.com/en/etf-profile.html?isin=IE00BPRCH686;The Invesco JPX-Nikkei 400 UCITS ETF seeks to track the JPX-Nikkei 400 index. The JPX-Nikkei 400 index tracks 400 Japanese stocks. The stocks are mainly selected by return on equity and cumulative operating profit. The ETF's TER (total expense ratio) amounts to 0.19% p.a.. The Invesco JPX-Nikkei 400 UCITS ETF is the largest ETF that tracks the JPX-Nikkei 400 index. The ETF replicates the performance of the underlying index synthetically with a swap. The dividends in the ETF are accumulated and reinvested in the ETF. The Invesco JPX-Nikkei 400 UCITS ETF has 118m Euro assets under management. The ETF was launched on 10 September 2014 and is domiciled in Ireland.;Invesco JPX-Nikkei 400 UCITS ETF se snaží sledovat index JPX-Nikkei 400. INDEX INDEX JPX-NIKKEI 400 sleduje 400 japonských akcií. Akcie jsou vybírány hlavně návratností vlastního kapitálu a kumulativního provozního zisku. TER (celkový poměr nákladů) ETF činí 0,19% p.a. Invesco JPX-Nikkei 400 UCITS ETF je největší ETF, který sleduje index JPX-Nikkei 400. ETF replikuje výkon podkladového indexu synteticky s výměnou. dividenday v ETF jsou akumulovány a reinvestovány do ETF. Invesco JPX-Nikkei 400 UCITS ETF má ve správě aktiv 118 milionů euro. ETF byl spuštěn 10. září 2014 a je se sídlem v Irsku.;0.19%;0.19;EUR 118m;118.0;EUR;JPY;Ireland;Invesco;10 September 2014;;;Synthetic (Unfunded swap);UCITS;;Equity, Japan;;JPY    Currency risk  Currency;1;Akcie;False;Celosvětově;;11.38;40.17;48.88;6.99;1.38;9.2;5.03;8.47;-10.31;15.12;14.99;130.33;19.87;19.14;17.82;0.57;0.62;0.46;-17.57;-17.57;-21.04;-26.74;;;;;London Stock Exchange;-;6;;;;;;;2025-09-24T02:36:12.058583;success;0;;;;;;;;;;;;;;;;;;;;;;;;;;;;;;;;;;;;;;;;;London Stock Exchange;GBX;S400;;;;gettex;EUR;SMLN;;;;Borsa Italiana;EUR;N400;N400 IMSMLNIN;N400.MIX2ISINAV.DE;;London Stock Exchange;USD;N400;N400 LNN400IN;N400.L0J0XINAV.DE;;London Stock Exchange;GBP;-;S400 LNS400IN;S400.L0J0XINAV.DE;;XETRA;EUR;SMLN;SMLN GYSMLNIN;SMLN.DEX2ISINAV.DE;;;;;;;;;;;;;;;;;;;;;;;;;;4;65;17;5;13;10;20
IE00BPVLQD13;Xtrackers MSCI Japan Screened UCITS ETF 1D;https://www.justetf.com/en/etf-profile.html?isin=IE00BPVLQD13;The Xtrackers MSCI Japan Screened UCITS ETF 1D seeks to track the MSCI Japan Select Screened index. The MSCI Japan Select Screened index tracks large and mid-cap securities of the Japanese equity markets. The stocks included are filtered according to ESG criteria (environmental, social and corporate governance). Excluded sectors and companies: weapons, tobacco, thermal coal, oil sands, non-compliance with UN Global Compact. The ETF's TER (total expense ratio) amounts to 0.15% p.a.. The Xtrackers MSCI Japan Screened UCITS ETF 1D is the only ETF that tracks the MSCI Japan Select Screened index. The ETF replicates the performance of the underlying index by full replication (buying all the index constituents). The dividends in the ETF are distributed to the investors (Annually). The Xtrackers MSCI Japan Screened UCITS ETF 1D has 299m Euro assets under management. The ETF was launched on 31 March 2015 and is domiciled in Ireland.;Xtrackers MSCI Japan Screened UCITS ETF 1D se snaží sledovat index Screening MSCI Japan Select. Indexové indexové skladby MSCI Japonsko vybírá velké a cenné papíry na střední kapitálové trhy. Zahrnuté akcie jsou filtrovány podle kritérií ESG (environmentální, sociální a správa a společností). Vyloučené odvětví a společnosti: Zbraně, tabák, tepelné uhlí, ropné písky, nedodržování globálního kompaktního oSN. TER (celkový poměr nákladů) ETF činí 0,15% p.a. ETF replikuje výkon podkladového indexu plnou replikací (nákup všech složek indexu). dividenday v ETF jsou distribuovány investorům (každoročně). XTrackers MSCI Japan Screet UCITS ETF 1D má ve spravování aktiva 299 milionů euro. ETF byl spuštěn 31. března 2015 a má bydliště v Irsku.;0.15%;0.15;EUR 299m;299.0;EUR;JPY;Ireland;Xtrackers;31 March 2015;;Annually;Physical;UCITS;MSCI Japan Screened  1D;Equity, Japan, Social/Environmental;Yes;JPY    Currency risk  Currency;1;Akcie;False;Celosvětově;169.0;11.39;36.84;44.57;5.75;1.3;10.02;4.61;9.08;-12.22;14.8;14.9;74.76;21.76;19.86;19.14;0.52;0.55;0.4;-19.04;-19.04;-21.24;-26.72;;;1.691;;London Stock Exchange;XDNS;6;1.72%;1.72;EUR 0.28;0.28;EUR;method2_regex;2025-09-24T02:36:22.482356;success;0;Mitsubishi UFJ Financial Group, Inc.;4.22;Sony Group Corp.;3.95;Hitachi Ltd.;3.71;Sumitomo Mitsui Financial Group, Inc.;2.5;Nintendo Co., Ltd.;2.47;Recruit Holdings Co., Ltd.;2.22;Tokyo Electron Ltd.;2.15;Tokio Marine Holdings, Inc.;1.95;SoftBank Group Corp.;1.94;;;Japan;99.92;;;;;;;;;Industrials;23.42;Financials;17.53;Consumer Discretionary;17.31;Technology;14.14;;;gettex;EUR;XDNY;;;;Stuttgart Stock Exchange;EUR;XDNY;;;;Borsa Italiana;EUR;XDNY;XDNY IMXDNYINVG;XDNY.MI0J0PINAV.DE;;London Stock Exchange;GBX;XDNS;XDNS LNXDNYINVE;XDNS.L0J0NINAV.DE;;London Stock Exchange;USD;XDNY;XDNY LNXDNYINVU;XDNY.L0J0WINAV.DE;;XETRA;EUR;XDNY;XDNY GY;XDNY.DE;;;;;;;;;;;;;;;;;;;;;;;;;;4;70;22;5;13;10;20
IE00BPVLQF37;Xtrackers MSCI Japan Screened UCITS ETF 2D - GBP Hedged;https://www.justetf.com/en/etf-profile.html?isin=IE00BPVLQF37;The Xtrackers MSCI Japan Screened UCITS ETF 2D - GBP Hedged seeks to track the MSCI Japan Select Screened (GBP Hedged) index. The MSCI Japan Select Screened (GBP Hedged) index tracks large and mid-cap securities of the Japanese equity markets. The stocks included are filtered according to ESG criteria (environmental, social and corporate governance). Excluded sectors and companies: weapons, tobacco, thermal coal, oil sands, non-compliance with UN Global Compact. Currency hedged to British Pound (GBP). The ETF's TER (total expense ratio) amounts to 0.25% p.a.. The Xtrackers MSCI Japan Screened UCITS ETF 2D - GBP Hedged is the only ETF that tracks the MSCI Japan Select Screened (GBP Hedged) index. The ETF replicates the performance of the underlying index by full replication (buying all the index constituents). The dividends in the ETF are distributed to the investors (Annually). The Xtrackers MSCI Japan Screened UCITS ETF 2D - GBP Hedged is a small ETF with 22m Euro assets under management. The ETF was launched on 31 March 2015 and is domiciled in Ireland.;Xtrackers MSCI Japan Screed UCITS ETF 2D - GBP Hedged se snaží sledovat index MSCI Japan Select Screened (GBP Hedged). Indexové indexové cenné papíry japonských kapitálových trhů vybírají indexové skladby MSCI Japonsko. Zahrnuté akcie jsou filtrovány podle kritérií ESG (environmentální, sociální a správa a společností). Vyloučené odvětví a společnosti: Zbraně, tabák, tepelné uhlí, ropné písky, nedodržování globálního kompaktního oSN. Měna zajišťovala britskou libru (GBP). TER (celkový poměr nákladů) činí 0,25% p.a. Xtrackers MSCI Japan prověřoval UCITS ETF 2D - GBP Hedged je jediný ETF, který sleduje index MSCI Japan Select (GBP Hedged). ETF replikuje výkon podkladového indexu plnou replikací (nákup všech složek indexu). dividenday v ETF jsou distribuovány investorům (každoročně). XTrackers MSCI Japan Screeked UCITS ETF 2D - GBP Hedged je malý ETF s managementem 22 milionů euro. ETF byl spuštěn 31. března 2015 a má bydliště v Irsku.;0.25%;0.25;EUR 22m;22.0;EUR;GBP;Ireland;Xtrackers;31 March 2015;;Annually;Physical;UCITS;MSCI Japan Screened  2D - GBP Hedged;Equity, Japan, Social/Environmental;Yes;GBP    Currency risk  Currency;1;Akcie;False;Celosvětově;169.0;20.48;90.8;140.75;10.09;2.1;12.64;10.59;18.93;-8.95;35.88;30.49;110.74;23.77;22.43;21.49;0.86;1.07;0.89;-20.82;-27.09;-27.09;-42.15;;;1.691;;gettex;XDNG;2;1.51%;1.51;EUR 0.54;0.54;EUR;method2_regex;2025-09-24T02:36:29.777472;success;0;Mitsubishi UFJ Financial Group, Inc.;4.22;Sony Group Corp.;3.95;Hitachi Ltd.;3.71;Sumitomo Mitsui Financial Group, Inc.;2.5;Nintendo Co., Ltd.;2.47;Recruit Holdings Co., Ltd.;2.22;Tokyo Electron Ltd.;2.15;Tokio Marine Holdings, Inc.;1.95;SoftBank Group Corp.;1.94;;;Japan;99.92;;;;;;;;;Industrials;23.42;Financials;17.53;Consumer Discretionary;17.31;Technology;14.14;;;gettex;EUR;XDNG;;;;London Stock Exchange;GBX;XDNG;XDNG LNXDNGINVG;XDNG.L0J0SINAV.DE;;;;;;;;;;;;;;;;;;;;;;;;;;;;;;;;;;;;;;;;;;;;;;;;;;3;61;17;1;13;10;20
IE00BQ70R696;Invesco Nasdaq Biotech UCITS ETF;https://www.justetf.com/en/etf-profile.html?isin=IE00BQ70R696;The Invesco Nasdaq Biotech UCITS ETF seeks to track the Nasdaq Biotechnology index. The Nasdaq Biotechnology index tracks Nasdaq listed companies primarily engaged in biomedical research to develop new treatments and cures for human disease. The ETF's TER (total expense ratio) amounts to 0.40% p.a.. The ETF replicates the performance of the underlying index synthetically with a swap. The dividends in the ETF are accumulated and reinvested in the ETF. The Invesco Nasdaq Biotech UCITS ETF has 292m Euro assets under management. The ETF was launched on 6 November 2014 and is domiciled in Ireland.;Invesco NASDAQ Biotech UCITS ETF se snaží sledovat index biotechnologie NASDAQ. Index biotechnologie NASDAQ sleduje společnosti NASDAQ uvedené primárně zapojené do biomedicínského výzkumu, aby vyvinuly nové ošetření a léky na lidské onemocnění. TER (celkový poměr nákladů) ETF činí 0,40% p.a. ETF replikuje výkon podkladového indexu synteticky s výměnou. dividenday v ETF jsou akumulovány a reinvestovány do ETF. Invesco NASDAQ Biotech UCITS ETF má ve správě aktiv 292 milionů EUR. ETF byl spuštěn 6. listopadu 2014 a má bydliště v Irsku.;0.40%;0.4;EUR 292m;292.0;EUR;USD;Ireland;Invesco;6 November 2014;;;Synthetic (Unfunded swap);UCITS;Nasdaq Biotech;Equity, United States, Health Care;;USD    Currency risk  Currency;1;Akcie;False;Severní Amerika;;-5.37;9.99;17.1;-0.47;0.85;12.93;0.47;7.96;-4.94;0.54;5.34;72.0;23.29;20.78;22.77;-0.23;0.16;0.14;-25.53;-25.53;-30.95;-41.4;;;;;Borsa Italiana;-;8;;;;;;;2025-09-24T02:36:38.988141;success;0;;;;;;;;;;;;;;;;;;;;;;;;;;;;;;;;;;;;;;;;;gettex;EUR;NBTK;;;;Borsa Italiana;USD;-;SBIO IMSBIOINE;SBIO.MI0J1KINAV.DE;;Borsa Italiana;EUR;SBIO;SBIO IMSBIOINE;SBIO.MISBIOUSiv.P;;Euronext Amsterdam;EUR;SBIO;SBIO NASBIOINE;SBIO.ASSBIOUSiv.P;;London Stock Exchange;GBX;SBIX;SBIX LNSBIOGBIV;SBIX.LSBIOGBiv.P;;London Stock Exchange;USD;SBIO;SBIO LNSBIOIN;SBIO.LSBIOUSiv.P;;SIX Swiss Exchange;USD;SBIO;SBIO SWSBIOIN;SBIO.SSBIOUSiv.P;;XETRA;EUR;NBTK;NBTK GRSBIOINE;NBTKG.DESBIOUSiv.P;;;;;;;;;;;;;;3;54;12;5;13;10;14
