IE00BGPP6697;iShares $ Treasury Bond 7-10yr UCITS ETF EUR Hedged (Dist);https://www.justetf.com/en/etf-profile.html?isin=IE00BGPP6697;The iShares $ Treasury Bond 7-10yr UCITS ETF EUR Hedged (Dist) seeks to track the ICE US Treasury 7-10 Year (EUR Hedged) index. The ICE US Treasury 7-10 Year (EUR Hedged) index tracks US Dollar denominated government bonds issued by the US Treasury. Time to maturity: 7-10 years. Currency hedged to Euro (EUR). The ETF's TER (total expense ratio) amounts to 0.10% p.a.. The iShares $ Treasury Bond 7-10yr UCITS ETF EUR Hedged (Dist) is the cheapest and largest ETF that tracks the ICE US Treasury 7-10 Year (EUR Hedged) index. The ETF replicates the performance of the underlying index by sampling technique (buying a selection of the most relevant index constituents). The interest income (coupons) in the ETF is distributed to the investors (Semi annually). The iShares $ Treasury Bond 7-10yr UCITS ETF EUR Hedged (Dist) is a very large ETF with 1,302m Euro assets under management. The ETF was launched on 25 February 2019 and is domiciled in Ireland.;IShares $ Treasury Bond 7-10yr UCITS ETF EUR Hedged (Dist) se snaží sledovat index Ice US Treasury 7-10 Year (EUR Hedged). Index ICE US Treasury 7-10 Year (EUR Hedged) sleduje vládní dluhopisy vydané americkým státní pokladnou. Čas do zralosti: 7-10 let. Měna zajišťovala euro (EUR). TER (celkový poměr výdajů) činí 0,10% P.A .. IShares $ Treasury Bond 7-10yr UCITS ETF EUR (dist) je nejlevnější a největší ETF, který sleduje index ledu US Treasury 7-10 let (Eur Hedged). ETF replikuje výkon základního indexu technikou vzorkování (nákup výběru nejdůležitějších složek indexu). Úrokové výnosy (kupóny) v ETF jsou distribuovány investorům (semifinále každoročně). IShares $ Treasury Bond 7-10yr UCITS ETF EUR Hedged (dist) je velmi velký ETF s 1 302 miliony euro pod správou. ETF byl spuštěn 25. února 2019 a je se sídlem v Irsku.;0.10%;0.1;EUR 1302m;1302.0;EUR;EUR;Ireland;iShares;25 February 2019;Distributing;Semi annually;Physical;UCITS;;risk  Long-only    Sustainability  No;;EUR    Currency risk  Currency;1;Dluhopisy;False;Celosvětově;13.0;0.16;4.26;-18.36;5.9;0.0;2.52;2.5;-4.15;-16.9;0.96;-2.49;-4.98;8.92;11.6;10.86;0.02;0.12;-0.37;-7.31;-11.35;-27.32;-27.83;;;;;gettex;IBB1;3;3.94%;3.94;EUR 0.16;0.16;EUR;method2_regex;2025-09-24T01:28:01.889778;success;0;;;;;;;;;;;;;;;;;;;;;Other;54.22;United States;45.78;;;;;;;IT;45.78;;;;;;;;;gettex;EUR;IBB1;;;;Stuttgart Stock Exchange;EUR;IBB1;;;;XETRA;EUR;IBB1;IBB1 GYINAVIBBE;IBB1.DE0XR8INAV.DE;;;;;;;;;;;;;;;;;;;;;;;;;;;;;;;;;;;;;;;;;;;;4;67;26;13;8;10;10
IE00BGQ0J979;iShares J.P. Morgan USD EM Bond UCITS ETF CHF (Acc);https://www.justetf.com/en/etf-profile.html?isin=IE00BGQ0J979;The iShares J.P. Morgan USD EM Bond UCITS ETF CHF (Acc) seeks to track the JP Morgan EMBI Global Core (CHF Hedged) index. The JP Morgan EMBI Global Core (CHF Hedged) index tracks US Dollar denominated sovereign and quasi-sovereign bonds from Emerging Markets countries. Currency hedged to Swiss Francs (CHF). The ETF's TER (total expense ratio) amounts to 0.50% p.a.. The iShares J.P. Morgan USD EM Bond UCITS ETF CHF (Acc) is the cheapest ETF that tracks the JP Morgan EMBI Global Core (CHF Hedged) index. The ETF replicates the performance of the underlying index by sampling technique (buying a selection of the most relevant index constituents). The interest income (coupons) in the ETF is accumulated and reinvested in the ETF. The iShares J.P. Morgan USD EM Bond UCITS ETF CHF (Acc) is a small ETF with 48m Euro assets under management. The ETF was launched on 14 May 2019 and is domiciled in Ireland.;Ishares J.P. Morgan USD EM Bond UCITS ETF CHF (ACC) se snaží sledovat index JP Morgan Embi Global Core (CHF Hedged). Index JP Morgan Embi Global Core (CHF Hedged) sleduje americký dolar denominovaný suverénní a kvazi-sovereign dluhopisy ze zemí rozvíjejících se trhů. Měna byla zajištěna švýcarským frankům (CHF). TER (celkový poměr výdajů) ETF činí 0,50% p.a. ISShares J.P. Morgan USD EM Bond UCITS ETF CHF (ACC) je nejlevnější ETF, který sleduje index JP Morgan Embi Global (CHF Hedged). ETF replikuje výkon základního indexu technikou vzorkování (nákup výběru nejdůležitějších složek indexu). Úrokové výnosy (kupóny) v ETF se nashromáždí a reinvestují do ETF. Ishares J.P. Morgan USD EM Bond UCITS ETF CHF (ACC) je malý ETF s vedením 48 milionů euro. ETF byl spuštěn 14. května 2019 a je se sídlem v Irsku.;0.50%;0.5;EUR 48m;48.0;EUR;CHF;Ireland;iShares;14 May 2019;Accumulating;;Physical;UCITS;;Bonds, USD, Emerging Markets, Government, All maturities;;CHF    Currency risk  Currency;1;Dluhopisy;False;Rozvíjející se trhy;660.0;3.89;17.87;3.46;7.4;1.8;4.96;7.4;0.4;-16.93;11.85;0.21;14.41;8.32;10.67;10.46;0.47;0.53;0.07;-6.06;-10.67;-24.36;-24.8;;;;;gettex;AYE8;2;;;;;;;2025-09-24T01:28:09.662863;success;0;XS2214238441;0.69;XS2893151287;0.47;XS1750114396;0.42;;;;;;;;;;;;;;;Other;82.43;;;;;;;;;;;;;;;;;;;gettex;EUR;AYE8;;;;SIX Swiss Exchange;CHF;EMCH;EMCH SEiNAVEMC2;EMCH.S;;;;;;;;;;;;;;;;;;;;;;;;;;;;;;;;;;;;;;;;;;;;;;;;;;3;51;12;1;8;10;20
IE00BGQYRQ28;Xtrackers MSCI USA Consumer Staples UCITS ETF 1D;https://www.justetf.com/en/etf-profile.html?isin=IE00BGQYRQ28;The Xtrackers MSCI USA Consumer Staples UCITS ETF 1D seeks to track the MSCI USA Consumer Staples index. The MSCI USA Consumer Staples index tracks large and medium sized US-American companies from the consumer staples sector. The ETF's TER (total expense ratio) amounts to 0.12% p.a.. The Xtrackers MSCI USA Consumer Staples UCITS ETF 1D is the only ETF that tracks the MSCI USA Consumer Staples index. The ETF replicates the performance of the underlying index by full replication (buying all the index constituents). The dividends in the ETF are distributed to the investors (Annually). The Xtrackers MSCI USA Consumer Staples UCITS ETF 1D has 128m Euro assets under management. The ETF was launched on 12 September 2017 and is domiciled in Ireland.;Xtrackers MSCI USA Consumer Staples UCITS ETF 1D se snaží sledovat index spotřebitelů MSCI USA. Index spotřebitelů společnosti MSCI USA spotřebitelů sleduje velké a středně velké USA-americké společnosti z sektoru spotřebitelských spon. TER (celkový poměr nákladů) činí 0,12% P.A .. Xtrackers MSCI USA Consumer Staples UCITS ETF 1D je jediný ETF, který sleduje index spotřebitelů MSCI USA Consumer Staples. ETF replikuje výkon podkladového indexu plnou replikací (nákup všech složek indexu). dividenday v ETF jsou distribuovány investorům (každoročně). Xtrackers MSCI USA Consumer Staples UCITS ETF 1D má 128 milionů euro aktiv. ETF byl spuštěn 12. září 2017 a má bydliště v Irsku.;0.12%;0.12;EUR 128m;128.0;EUR;USD;Ireland;Xtrackers;12 September 2017;;Annually;Physical;UCITS;MSCI USA Consumer Staples  1D;Equity, United States, Consumer Staples;;USD    Currency risk  Currency;1;Akcie;False;Severní Amerika;37.0;-4.84;6.17;48.74;-8.62;-4.57;-3.82;-6.36;27.35;4.99;-2.64;21.15;85.42;14.67;14.17;14.59;-0.33;0.14;0.57;-15.15;-15.15;-15.15;-24.42;;;;;London Stock Exchange;XSCS;7;2.19%;2.19;EUR 0.86;0.86;EUR;method2_regex;2025-09-24T01:28:15.816467;success;0;Costco Wholesale;14.43;Procter & Gamble Co.;12.58;The Coca-Cola Co.;9.86;Philip Morris International, Inc.;8.86;PepsiCo, Inc.;6.88;Altria Group, Inc.;3.64;Mondelez International, Inc.;2.96;Colgate-Palmolive Co.;2.32;Target;1.65;;;United States;98.16;Other;1.84;;;;;;;Consumer Discretionary;3.28;;;;;;;;;gettex;EUR;XUCS;;;;Stuttgart Stock Exchange;EUR;XUCS;;;;London Stock Exchange;GBX;XSCS;XSCS LNXUCSUSIV;XSCS.LXUCSUSDINAV=SOLA;;London Stock Exchange;USD;XUCS;XUCS LNXUCSEUIV;XUCS.LXUCSEURINAV=SOLA;;SIX Swiss Exchange;USD;XUCS;XSCSGBIV;XSCSINAV=SOLA;;SIX Swiss Exchange;CHF;XUCS;XUCS SWXSCSGBIV;XUCS.SXSCSINAV=SOLA;;XETRA;EUR;XUCS;XUCS GY;XUCS.DE;;;;;;;;;;;;;;;;;;;;3;60;22;5;11;10;12
IE00BGQYRR35;Xtrackers MSCI USA Consumer Discretionary UCITS ETF 1D;https://www.justetf.com/en/etf-profile.html?isin=IE00BGQYRR35;The Xtrackers MSCI USA Consumer Discretionary UCITS ETF 1D seeks to track the MSCI USA Consumer Discretionary 20/35 Custom index. The MSCI USA Consumer Discretionary 20/35 Custom index tracks large and medium sized US-American consumer discretionary sector. The weight of the largest constituent is constrained to 35% and the weights of all other constituents are constrained to a maximum of 20%. The ETF's TER (total expense ratio) amounts to 0.12% p.a.. The Xtrackers MSCI USA Consumer Discretionary UCITS ETF 1D is the only ETF that tracks the MSCI USA Consumer Discretionary 20/35 Custom index. The ETF replicates the performance of the underlying index by full replication (buying all the index constituents). The dividends in the ETF are distributed to the investors (Annually). The Xtrackers MSCI USA Consumer Discretionary UCITS ETF 1D has 456m Euro assets under management. The ETF was launched on 12 September 2017 and is domiciled in Ireland.;XTrackers MSCI USA Consumer Discorention UCITS ETF 1D se snaží sledovat vlastní index 4/35 MSCI USA. Vlastní index MSCI USA spotřebitelů 20/35 Sleduje velké a středně velké americké americké spotřebitelské diskreční sektor. Hmotnost největší složky je omezena na 35% a hmotnosti všech ostatních složek jsou omezeny na maximálně 20%. TER (celkový poměr nákladů) činí 0,12% P.A. ETF replikuje výkon podkladového indexu plnou replikací (nákup všech složek indexu). dividenday v ETF jsou distribuovány investorům (každoročně). Xtrackers MSCI USA Consumer Discretery UCITS ETF 1D má pod správou aktiva 456 milionů euro. ETF byl spuštěn 12. září 2017 a má bydliště v Irsku.;0.12%;0.12;EUR 456m;456.0;EUR;USD;Ireland;Xtrackers;12 September 2017;Distributing;Annually;Physical;UCITS;MSCI USA Consumer Discretionary  1D;Equity, United States, Consumer Discretionary;;USD    Currency risk  Currency;1;Akcie;False;Severní Amerika;50.0;18.62;44.63;74.15;-4.54;2.78;12.44;14.29;31.57;-33.97;36.98;38.77;228.51;26.87;23.72;25.67;0.69;0.55;0.46;-30.07;-30.07;-38.41;-38.41;;;;;London Stock Exchange;XSCD;7;0.46%;0.46;EUR 0.38;0.38;EUR;method2_regex;2025-09-24T01:28:21.136032;success;0;Tesla;16.05;Home Depot;6.74;McDonald's Corp.;3.96;Booking Holdings, Inc.;3.38;The TJX Cos;2.56;Lowe's;2.32;MercadoLibre;1.99;Starbucks Corp;1.92;NIKE;1.65;;;United States;95.72;Other;2.29;;;;;;;;;;;;;;;;;gettex;EUR;XUCD;;;;Stuttgart Stock Exchange;EUR;XUCD;;;;London Stock Exchange;GBX;XSCD;XSCD LNXUCDUSIV;XSCD.LXUCDUSDINAV=SOLA;;London Stock Exchange;USD;XUCD;XUCD LNXSCDGBIV;XUCD.LXSCDINAV=SOLA;;SIX Swiss Exchange;USD;XUCD;XUCDEUIV;XUCDEURINAV=SOLA;;SIX Swiss Exchange;CHF;XUCD;XUCD SWXUCDEUIV;XUCD.SXUCDEURINAV=SOLA;;XETRA;EUR;XUCD;XUCD GY;XUCD.DE;;;;;;;;;;;;;;;;;;;;4;68;22;5;11;10;20
IE00BGQYRS42;Xtrackers MSCI USA Information Technology UCITS ETF 1D;https://www.justetf.com/en/etf-profile.html?isin=IE00BGQYRS42;The Xtrackers MSCI USA Information Technology UCITS ETF 1D seeks to track the MSCI USA Information Technology 20/35 Custom index. The MSCI USA Information Technology 20/35 Custom index tracks the US information technology sector (GICS sector classification). The weight of the largest constituent is constrained to 35% and the weights of all other constituents are constrained to a maximum of 20%. The ETF's TER (total expense ratio) amounts to 0.12% p.a.. The Xtrackers MSCI USA Information Technology UCITS ETF 1D is the only ETF that tracks the MSCI USA Information Technology 20/35 Custom index. The ETF replicates the performance of the underlying index by full replication (buying all the index constituents). The dividends in the ETF are distributed to the investors (Annually). The Xtrackers MSCI USA Information Technology UCITS ETF 1D is a very large ETF with 1,304m Euro assets under management. The ETF was launched on 12 September 2017 and is domiciled in Ireland.;Informační technologie Xtrackers MSCI USA UCITS ETF 1D se snaží sledovat vlastní index MSCI USA 20/35. Informační technologie MSCI USA 20/35 Vlastní index sleduje sektor amerických informačních technologií (klasifikace sektoru GICS). Hmotnost největší složky je omezena na 35% a hmotnosti všech ostatních složek jsou omezeny na maximálně 20%. The ETF's TER (celkový poměr nákladů) amounts to 0.12% p.a.. The Xtrackers MSCI USA Information Technology UCITS ETF 1D is the only ETF that sleduje the MSCI USA Information Technology 20/35 Custom index. ETF replikuje výkon podkladového indexu plnou replikací (nákup všech složek indexu). dividenday v ETF jsou distribuovány investorům (každoročně). Informační technologie Xtrackers MSCI USA UCITS ETF 1D je velmi velká ETF s spravováním 1 304 milionů euro. ETF byl spuštěn 12. září 2017 a má bydliště v Irsku.;0.12%;0.12;EUR 1304m;1304.0;EUR;USD;Ireland;Xtrackers;12 September 2017;;Annually;Physical;UCITS;MSCI USA Information Technology  1D;Equity, United States, Technology;;USD    Currency risk  Currency;1;Akcie;False;Severní Amerika;84.0;23.07;111.3;168.65;6.9;5.04;16.11;22.9;42.24;-25.77;50.26;44.32;461.52;28.9;25.72;26.14;0.8;1.1;0.84;-30.66;-30.66;-30.66;-32.05;;;;;London Stock Exchange;XSTC;8;0.36%;0.36;EUR 0.42;0.42;EUR;method2_regex;2025-09-24T01:28:26.455576;success;0;Microsoft;17.56;Apple;15.85;Broadcom;7.51;Oracle Corp.;2.34;Palantir Technologies, Inc.;1.89;AMD;1.62;Cisco Systems, Inc.;1.51;Salesforce, Inc.;1.41;IBM;1.34;;;United States;96.44;Other;2.43;;;;;;;;;;;;;;;;;Borsa Italiana;EUR;XUTC;;;;gettex;EUR;XUTC;;;;Stuttgart Stock Exchange;EUR;XUTC;;;;London Stock Exchange;GBX;XSTC;XSTC LNXUTCUSIV;XSTC.LXUTCUSDINAV=SOLA;;London Stock Exchange;USD;XUTC;XUTC LNXSTCGBIV;XUTC.LXSTCINAV=SOLA;;SIX Swiss Exchange;USD;XUTC;XUTCEUIV;XUTCEURINAV=SOLA;;SIX Swiss Exchange;CHF;XUTC;XUTC SWXUTCEUIV;XUTC.SXUTCEURINAV=SOLA;;XETRA;EUR;XUTC;XUTC GY;XUTC.DE;;;;;;;;;;;;;;5;76;22;13;11;10;20
IE00BGR7L912;iShares USD Treasury Bond 0-1yr UCITS ETF USD (Dist);https://www.justetf.com/en/etf-profile.html?isin=IE00BGR7L912;The iShares USD Treasury Bond 0-1yr UCITS ETF USD (Dist) seeks to track the IDC US Treasury Short Term index. The IDC US Treasury Short Term index tracks US Dollar denominated government bonds issued by the US Treasury. Time to maturity: 0-1 year. The ETF's TER (total expense ratio) amounts to 0.07% p.a.. The iShares USD Treasury Bond 0-1yr UCITS ETF USD (Dist) is the cheapest ETF that tracks the IDC US Treasury Short Term index. The ETF replicates the performance of the underlying index by sampling technique (buying a selection of the most relevant index constituents). The interest income (coupons) in the ETF is distributed to the investors (Semi annually). The iShares USD Treasury Bond 0-1yr UCITS ETF USD (Dist) has 413m Euro assets under management. The ETF was launched on 20 February 2019 and is domiciled in Ireland.;Treasury Bond IShares USD 0-1YR UCITS ETF USD (DIST) se snaží sledovat krátkodobý index pokladny IDC US Treasury. Krátkodobý index Treasury IDC USA sleduje vládní dluhopisy vydané americkým ministerstvem pokladny. Čas do splatnosti: 0-1 rok. TER (celkový poměr nákladů) činí 0,07% P.A .. ISShares USD Treasury Bond 0-1yr UCITS ETF USD (DIST) je nejlevnější ETF, který sleduje krátkodobý index IDC US Treasury. ETF replikuje výkon základního indexu technikou vzorkování (nákup výběru nejdůležitějších složek indexu). Úrokové výnosy (kupóny) v ETF jsou distribuovány investorům (semifinále každoročně). IShares USD Treasury Bond 0-1YR UCITS ETF USD (Dist) má spravování 413 milionů euro. ETF byl spuštěn 20. února 2019 a je se sídlem v Irsku.;0.07%;0.07;EUR 413m;413.0;EUR;USD;Ireland;iShares;20 February 2019;Distributing;Semi annually;Physical;UCITS;;risk  Long-only    Sustainability  No;;USD    Currency risk  Currency;1;Dluhopisy;False;Celosvětově;72.0;-0.88;-3.37;14.86;-8.9;-0.94;-0.94;-5.93;8.42;7.25;1.43;11.87;14.02;9.01;8.36;7.82;-0.1;-0.14;0.36;-11.81;-12.2;-12.2;-13.23;;;3.22;;gettex;IBCC;3;4.70%;4.7;EUR 0.20;0.2;EUR;method2_regex;2025-09-24T01:28:32.410984;success;0;;;;;;;;;;;;;;;;;;;;;Other;73.43;United States;26.57;USA;4.875;;;;;IT;26.57;;;;;;;;;gettex;EUR;IBCC;;;;London Stock Exchange;USD;IBTU;IBTU LNINAVIT1U;IBTU.L0XRZINAV.DE;;XETRA;EUR;IBCC;IBCC GYINAVIT1U;IBC1.DE0XRZINAV.DE;;;;;;;;;;;;;;;;;;;;;;;;;;;;;;;;;;;;;;;;;;;;3;57;26;5;8;10;8
IE00BGSF1X88;iShares USD Treasury Bond 0-1yr UCITS ETF (Acc);https://www.justetf.com/en/etf-profile.html?isin=IE00BGSF1X88;The iShares USD Treasury Bond 0-1yr UCITS ETF (Acc) seeks to track the IDC US Treasury Short Term index. The IDC US Treasury Short Term index tracks US Dollar denominated government bonds issued by the US Treasury. Time to maturity: 0-1 year. The ETF's TER (total expense ratio) amounts to 0.07% p.a.. The iShares USD Treasury Bond 0-1yr UCITS ETF (Acc) is the cheapest and largest ETF that tracks the IDC US Treasury Short Term index. The ETF replicates the performance of the underlying index by sampling technique (buying a selection of the most relevant index constituents). The interest income (coupons) in the ETF is accumulated and reinvested in the ETF. The iShares USD Treasury Bond 0-1yr UCITS ETF (Acc) is a very large ETF with 14,493m Euro assets under management. The ETF was launched on 20 February 2019 and is domiciled in Ireland.;Treasury Bond IShares USD 0-1YR UCITS ETF (ACC) se snaží sledovat krátkodobý index Treasury IDC US TRAIZURY. Krátkodobý index Treasury IDC USA sleduje vládní dluhopisy vydané americkým ministerstvem pokladny. Čas do splatnosti: 0-1 rok. TER (celkový poměr nákladů) činí 0,07% P.A .. ISShares USD Treasury Bond 0-1yr UCITS ETF (ACC) je nejlevnější a největší ETF, který sleduje krátkodobý index Treasury IDC US. ETF replikuje výkon základního indexu technikou vzorkování (nákup výběru nejdůležitějších složek indexu). Úrokové výnosy (kupóny) v ETF se nashromáždí a reinvestují do ETF. IShares USD Treasury Bond 0-1YR UCITS ETF (ACC) je velmi velký ETF s vedením 14 493 milionů euro. ETF byl spuštěn 20. února 2019 a je se sídlem v Irsku.;0.07%;0.07;EUR 14493m;14493.0;EUR;USD;Ireland;iShares;20 February 2019;Accumulating;;Physical;UCITS;;risk  Long-only    Sustainability  No;;USD    Currency risk  Currency;1;Dluhopisy;False;Celosvětově;72.0;-0.91;-3.38;14.89;-8.93;-0.99;-1.02;-5.99;8.33;7.22;1.39;11.92;14.05;8.54;8.06;7.6;-0.11;-0.14;0.37;-11.94;-12.2;-12.2;-13.14;;;3.22;;Bolsa Mexicana de Valores;-;4;;;;;;;2025-09-24T01:28:38.025202;success;0;;;;;;;;;;;;;;;;;;;;;Other;73.43;United States;26.57;USA;4.875;;;;;IT;26.57;;;;;;;;;gettex;EUR;IBC1;;;;Bolsa Mexicana de Valores;MXN;-;IB01N MM;IB01N.MX;;London Stock Exchange;USD;IB01;IB01 LNINAVIB0U;IB01.L0XR4INAV.DE;;SIX Swiss Exchange;USD;IB01;IB01 SEINAVIB0U;IB01.S0XR4INAV.DE;;;;;;;;;;;;;;;;;;;;;;;;;;;;;;;;;;;;;;4;71;26;19;8;10;8
IE00BGV5VM45;Xtrackers S&P Europe ex UK UCITS ETF;https://www.justetf.com/en/etf-profile.html?isin=IE00BGV5VM45;The Xtrackers S&P Europe ex UK UCITS ETF seeks to track the S&P Europe ex UK index. The S&P Europe ex UK index tracks European stocks in developed markets, except stocks from the UK. The ETF's TER (total expense ratio) amounts to 0.09% p.a.. The Xtrackers S&P Europe ex UK UCITS ETF is the only ETF that tracks the S&P Europe ex UK index. The ETF replicates the performance of the underlying index by full replication (buying all the index constituents). The dividends in the ETF are distributed to the investors (Quarterly). The Xtrackers S&P Europe ex UK UCITS ETF is a large ETF with 505m Euro assets under management. The ETF was launched on 14 January 2019 and is domiciled in Ireland.;Xtrackers S&P Europe Ex UK UCITS ETF se snaží sledovat index S&P Europe Ex UK. Index S&P Europe Ex Index sleduje evropské akcie na rozvinutých trzích, s výjimkou akcií z Velké Británie. Ter (celkový poměr nákladů) ETF činí 0,09% P.A .. Xtrackers S&P Europe Ex UK UCITS ETF je jediný ETF, který sleduje index S&P Europe EX Index. ETF replikuje výkon podkladového indexu plnou replikací (nákup všech složek indexu). dividenday v ETF jsou distribuovány investorům (čtvrtletně). Xtrackers S&P Europe Ex UK UCITS ETF je velký ETF s 505 miliony euro. ETF byl spuštěn 14. ledna 2019 a je se sídlem v Irsku.;0.09%;0.09;EUR 505m;505.0;EUR;EUR;Ireland;Xtrackers;14 January 2019;;Quarterly;Physical;UCITS;;Equity, Europe;;EUR    Currency risk  Currency;1;Akcie;False;Evropa;311.0;11.07;55.06;74.48;12.68;-0.94;3.51;2.28;25.29;-12.94;18.42;8.02;99.37;14.4;12.97;14.75;0.77;1.21;0.8;-16.18;-16.18;-22.79;-34.43;;;;;gettex;XUEK;3;2.57%;2.57;EUR 1.98;1.98;EUR;method2_regex;2025-09-24T01:28:43.571051;success;0;ASML Holding NV;3.1;Nestlé SA;2.48;Roche Holding AG;2.46;Novartis AG;2.44;Siemens AG;2.16;Novo Nordisk A/S;1.72;Allianz SE;1.68;Schneider Electric SE;1.63;LVMH Moët Hennessy Louis Vuitton SE;1.54;;;Other;34.03;Germany;19.91;France;19.28;Switzerland;17.14;Netherlands;9.64;Financials;22.81;Industrials;19.44;Health Care;10.38;Technology;9.67;;;gettex;EUR;XUEK;;;;London Stock Exchange;GBX;XUEK;XUEK LNXUEKGBIV;XUEK.LXUEKGBPINAV=SOLA;;XETRA;EUR;XUEK;XUEK GY;XUEK.DE;;;;;;;;;;;;;;;;;;;;;;;;;;;;;;;;;;;;;;;;;;;;4;74;26;10;8;10;20
IE00BGV5VN51;Xtrackers Artificial Intelligence & Big Data UCITS ETF 1C 1C;https://www.justetf.com/en/etf-profile.html?isin=IE00BGV5VN51;The Xtrackers Artificial Intelligence & Big Data UCITS ETF 1C 1C seeks to track the Nasdaq Global Artificial Intelligence and Big Data index. The Nasdaq Global Artificial Intelligence and Big Data index tracks international companies of the sectors artificial intelligence, big data and cyber security. The stocks included are filtered according to ESG criteria (environmental, social and corporate governance). The ETF's TER (total expense ratio) amounts to 0.35% p.a.. The Xtrackers Artificial Intelligence & Big Data UCITS ETF 1C 1C is the only ETF that tracks the Nasdaq Global Artificial Intelligence and Big Data index. The ETF replicates the performance of the underlying index by full replication (buying all the index constituents). The dividends in the ETF are accumulated and reinvested in the ETF. The Xtrackers Artificial Intelligence & Big Data UCITS ETF 1C 1C is a very large ETF with 5,498m Euro assets under management. The ETF was launched on 29 January 2019 and is domiciled in Ireland.;Xtrackers Artificial Intelligence & Big Data UCITS ETF 1C 1C se snaží sledovat globální umělou inteligenci NASDAQ a index velkých dat. Globální umělá inteligence NASDAQ a index velkých dat sleduje mezinárodní společnosti umělé inteligence odvětví, velkých dat a kybernetické bezpečnosti. Zahrnuté akcie jsou filtrovány podle kritérií ESG (environmentální, sociální a správa a společností). TER ETF (celkový poměr nákladů) činí 0,35% p.a .. Xtrackers Artificial Intelligence & Big Data UCITS ETF 1C 1C je jediný ETF, který sleduje globální umělou inteligenci NASDAQ a index velkých dat. ETF replikuje výkon podkladového indexu plnou replikací (nákup všech složek indexu). dividenday v ETF jsou akumulovány a reinvestovány do ETF. Xtrackers Artificial Intelligence & Big Data UCITS ETF 1C 1C je velmi velký ETF s managementem 5 498 milionů euro. ETF byl spuštěn 29. ledna 2019 a je se sídlem v Irsku.;0.35%;0.35;EUR 5498m;5498.0;EUR;USD;Ireland;Xtrackers;29 January 2019;;;Physical;UCITS;;Equity, World, Technology, Social/Environmental;Yes;USD    Currency risk  Currency;1;Akcie;False;Celosvětově;88.0;26.84;127.79;170.94;11.55;7.3;12.96;19.34;34.38;-30.71;61.68;34.81;243.66;22.7;20.99;20.64;1.18;1.5;1.07;-27.08;-27.08;-33.32;-33.5;;;;;SIX Swiss Exchange;-;7;;;;;;;2025-09-24T01:28:49.494915;success;0;NVIDIA Corp.;5.02;Alphabet, Inc. A;4.93;Amazon.com, Inc.;4.64;Microsoft;4.57;Apple;4.51;Palantir Technologies, Inc.;4.38;Bank of America Corp.;4.31;Meta Platforms;4.17;SAP SE;4.07;;;United States;80.86;Other;8.24;Germany;4.07;China;1.57;;;Financials;8.9;Consumer Discretionary;5.08;;;;;;;gettex;EUR;XAIX;;;;Borsa Italiana;EUR;XAIX;XAIX IMXAIXEUIV;XAIX.MIXAIXEURINAV=SOLA;;London Stock Exchange;USD;XAID;XAID LN;XAID.L;;London Stock Exchange;GBP;XAIX;;;;SIX Swiss Exchange;CHF;-;XAIX SWXAIXUSIV;XAIX.SXAIXUSDINAV=SOLA;;SIX Swiss Exchange;USD;XAIX;XAIXUSIV;XAIXUSDINAV=SOLA;;XETRA;EUR;XAIX;XAIX GYXAIXEUIV;XAIX.DEXAIXEURINAV=SOLA;;;;;;;;;;;;;;;;;;;;4;66;12;16;8;10;20
