LU0292097317;Xtrackers FTSE 250 UCITS ETF 1D;https://www.justetf.com/en/etf-profile.html?isin=LU0292097317;The Xtrackers FTSE 250 UCITS ETF 1D seeks to track the FTSE 250 index. The FTSE 250 index tracks 250 of the largest mid-cap companies based in the United Kingdom that are not included in the FTSE 100. The ETF's TER (total expense ratio) amounts to 0.15% p.a.. The ETF replicates the performance of the underlying index by full replication (buying all the index constituents). The dividends in the ETF are distributed to the investors (Quarterly). The Xtrackers FTSE 250 UCITS ETF 1D is a small ETF with 33m Euro assets under management. The ETF was launched on 15 June 2007 and is domiciled in Luxembourg.;Xtrackers FTSE 250 UCITS ETF 1D se snaží sledovat index FTSE 250. Index FTSE 250 sleduje 250 největších společností středních kapitálů se sídlem ve Velké Británii, které nejsou zahrnuty do FTSE 100. ETF TER (poměr celkových nákladů) činí 0,15% P.A. ETF replikuje výkon podkladového indexu plnou replikací plnou replikací. dividenday v ETF jsou distribuovány investorům (čtvrtletně). Xtrackers FTSE 250 UCITS ETF 1D je malý ETF s managementem 33 milionů EUR. ETF byl spuštěn 15. června 2007 a je se sídlem v Lucemburku.;0.15%;0.15;EUR 33m;33.0;EUR;GBP;Luxembourg;Xtrackers;15 June 2007;;Quarterly;Physical;UCITS;FTSE 250  1D;Equity, United Kingdom, Mid Cap;;GBP    Currency risk  Currency;1;Akcie;False;Evropa;250.0;1.52;26.9;47.3;2.3;-1.53;1.42;5.94;24.74;-21.93;9.98;13.01;119.62;15.83;15.94;16.9;0.1;0.52;0.48;-18.07;-18.07;-33.05;-62.26;;;;;Stuttgart Stock Exchange;DBXY;4;3.80%;3.8;EUR 0.88;0.88;EUR;method2_regex;2025-09-22T00:23:33.973520;success;0;Spectris;1.32;IG Group Holdings;1.25;Aberdeen Group Plc;1.21;Tritax Big Box REIT;1.16;The British Land;1.15;Investec Plc;1.11;JPMorgan Global Growth;1.06;Carnival;1.01;Johnson Matthey Plc;1.0;;;United Kingdom;78.06;Other;13.71;;;;;;;Financials;27.4;Consumer Discretionary;13.08;Industrials;11.7;Real Estate;9.62;IT;1.16;gettex;EUR;XMCX;;;;London Stock Exchange;GBX;XMCX;XMCX LNXMCXINAV;XMCX.LXMCXNAV.DE;;Stuttgart Stock Exchange;EUR;DBXY;XMCX GSXMCXINVG;XMCX.SGXMCXINAVGBP.DE;;XETRA;EUR;XMCX;XMCX GY;XMCX.DE;;;;;;;;;;;;;;;;;;;;;;;;;;;;;;;;;;;;;;4;68;22;1;15;10;20
LU0292097747;Xtrackers MSCI UK ESG UCITS ETF 1D;https://www.justetf.com/en/etf-profile.html?isin=LU0292097747;The Xtrackers MSCI UK ESG UCITS ETF 1D seeks to track the MSCI UK IMI Low Carbon SRI Selection Capped index. The MSCI UK IMI Low Carbon SRI Selection Capped index tracks the UK equity market performance. Only companies with low carbon emissions and a high ESG (environmental, social and governance) rating are considered. The parent index is the MSCI UK IMI. The ETF's TER (total expense ratio) amounts to 0.18% p.a.. The Xtrackers MSCI UK ESG UCITS ETF 1D is the only ETF that tracks the MSCI UK IMI Low Carbon SRI Selection Capped index. The ETF replicates the performance of the underlying index by full replication (buying all the index constituents). The dividends in the ETF are distributed to the investors (Quarterly). The Xtrackers MSCI UK ESG UCITS ETF 1D is a large ETF with 546m Euro assets under management. The ETF was launched on 15 June 2007 and is domiciled in Luxembourg.;Xtrackers MSCI UK ESG UCITS ETF 1D se snaží sledovat index výběru MSCI UK IMI Low Carbon SRI. Výběr MSCI UK IMI IMI Low Carbon SRI s omezením indexu sleduje výkonnost britského akciového trhu. Zvažují se pouze společnosti s emisemi s nízkým uhlíkem a vysokým hodnocením ESG (environmentální, sociální a správa věcí veřejných). Index nadřazení je MSCI UK IMI. TER (celkový poměr nákladů) ETF činí 0,18% P.A .. Xtrackers MSCI UK ESG UCITS ETF 1D je jediný ETF, který sleduje index výběru SRI s nízkým uhlíkem MSCI IMI. ETF replikuje výkon podkladového indexu plnou replikací (nákup všech složek indexu). dividenday v ETF jsou distribuovány investorům (čtvrtletně). Xtrackers MSCI UK ESG UCITS ETF 1D je velký ETF s managementem 546 milionů euro. ETF byl spuštěn 15. června 2007 a je se sídlem v Lucemburku.;0.18%;0.18;EUR 546m;546.0;EUR;GBP;Luxembourg;Xtrackers;15 June 2007;;Quarterly;Physical;UCITS;MSCI UK ESG  1D;Equity, United Kingdom, Social/Environmental;Yes;GBP    Currency risk  Currency;1;Akcie;False;Celosvětově;123.0;8.04;41.95;74.9;8.44;0.94;3.11;5.05;21.65;-8.94;11.04;16.88;92.88;14.29;13.34;14.53;0.56;0.93;0.81;-15.59;-15.59;-18.85;-59.42;;;;;Stuttgart Stock Exchange;DBXZ;4;3.38%;3.38;EUR 0.18;0.18;EUR;method2_regex;2025-09-22T00:23:40.124635;success;0;Unilever Plc;11.19;RELX;7.24;GSK Plc;6.04;3i Group Plc;4.05;Reckitt Benckiser Group;3.88;Haleon;3.31;Prudential Plc;2.46;Ashtead Group;2.2;Aviva;1.96;;;United Kingdom;97.56;Other;2.44;;;;;;;Financials;31.2;Consumer Staples;20.85;Industrials;17.39;Health Care;8.21;;;gettex;EUR;XASX;;;;London Stock Exchange;GBX;XASX;XASX LNXASXINAV;XASX.LXASXNAV.DE;;Stuttgart Stock Exchange;EUR;DBXZ;XASX GSXASXINVG;XASX.SGXASXINAVGBP.DE;;XETRA;EUR;XASX;XASX GY;XASX.DE;;;;;;;;;;;;;;;;;;;;;;;;;;;;;;;;;;;;;;4;72;17;10;15;10;20
LU0292100046;Xtrackers MSCI Korea UCITS ETF 1C 1C;https://www.justetf.com/en/etf-profile.html?isin=LU0292100046;The Xtrackers MSCI Korea UCITS ETF 1C 1C seeks to track the MSCI Korea 20/35 Custom index. The MSCI Korea 20/35 Custom index tracks large and mid cap Korean stocks. The weight of the largest constituent is constrained to 35% and the weights of all other constituents are constrained to a maximum of 20%. A buffer of 10% is applied on these limits at each index rebalancing. The ETF's TER (total expense ratio) amounts to 0.45% p.a.. The Xtrackers MSCI Korea UCITS ETF 1C 1C is the only ETF that tracks the MSCI Korea 20/35 Custom index. The ETF replicates the performance of the underlying index by full replication (buying all the index constituents). The dividends in the ETF are accumulated and reinvested in the ETF. The Xtrackers MSCI Korea UCITS ETF 1C 1C is a small ETF with 44m Euro assets under management. The ETF was launched on 5 July 2007 and is domiciled in Luxembourg.;Xtrackers MSCI Korea UCITS ETF 1C 1C se snaží sledovat vlastní index MSCI Korea 20/35. Vlastní index MSCI Korea 20/35 sleduje velké a střední korejské akcie. Hmotnost největší složky je omezena na 35% a hmotnosti všech ostatních složek jsou omezeny na maximálně 20%. Na tyto limity se při každém vyvážení indexu použije vyrovnávací paměť 10%. TER (celkový poměr nákladů) činí 0,45% p.a. Xtrackers MSCI Korea UCITS ETF 1C 1C je jediný ETF, který sleduje vlastní index MSCI 20/35. ETF replikuje výkon podkladového indexu plnou replikací (nákup všech složek indexu). dividenday v ETF jsou akumulovány a reinvestovány do ETF. Xtrackers MSCI Korea UCITS ETF 1C 1C je malý ETF s spravováním 44 milionů euro. ETF byl spuštěn 5. července 2007 a je bydliště v Lucemburku.;0.45%;0.45;EUR 44m;44.0;EUR;USD;Luxembourg;Xtrackers;5 July 2007;;;Physical;UCITS;MSCI Korea  1C 1C;Equity, South Korea;;USD    Currency risk  Currency;1;Akcie;False;Celosvětově;81.0;22.69;31.78;27.53;38.11;10.44;16.6;29.53;-0.85;-24.5;17.84;-18.11;89.63;25.29;24.05;22.88;0.9;0.4;0.22;-23.76;-30.99;-42.25;-67.94;;;;;Hong Kong Stock Exchange;-;10;;;;;;;2025-09-22T00:23:46.844796;success;0;SK hynix, Inc.;10.56;Samsung Electronics Co., Ltd.;3.52;KB Financial Group, Inc.;3.1;HANWHA AEROSPACE Co., Ltd.;2.46;NAVER Corp.;2.45;Hyundai Motor Co., Ltd.;2.23;Shinhan Financial Group Co., Ltd.;2.16;Celltrion, Inc.;2.15;Doosan Enerbility Co., Ltd.;2.1;;;;;;;;;;;;;Technology;43.06;Industrials;16.99;Financials;12.92;Consumer Discretionary;7.97;;;gettex;EUR;DBX8;;;;Borsa Italiana;EUR;XMKO;XMKO IMINXKO;XMKO.MIINXKOINAV.PA;;Hong Kong Stock Exchange;HKD;-;2848 HKXMKOINAV;2848.HKXMKONAV.DE;;London Stock Exchange;GBX;XKS2;XKS2 LNXMKOINVG;XKS2.LXMKOINAVGBP.DE;;London Stock Exchange;USD;XKSD;XKSD LNXMKOINVU;XKSD.LXMKOINAVUSD.DE;;Singapore Stock Exchange;USD;-;XMKO SP;DMKO.SIXMKOUSDINAV=SOLA;;SIX Swiss Exchange;CHF;XMKO;XMKO SW;XKSI.S;;SIX Swiss Exchange;USD;XMKO;;;;Stuttgart Stock Exchange;EUR;DBX8;XMKO GS;XMKO.SG;;XETRA;EUR;DBX8;XMKO GY;XMKO.DE;;3;57;12;1;15;10;19
LU0292100806;Xtrackers MSCI Europe Materials Screened UCITS ETF 1C 1C;https://www.justetf.com/en/etf-profile.html?isin=LU0292100806;The Xtrackers MSCI Europe Materials Screened UCITS ETF 1C 1C seeks to track the MSCI Europe Materials Screened 20-35 index. The MSCI Europe Materials Screened 20-35 index tracks the European materials sector. The stocks included are filtered according to ESG criteria (environmental, social and corporate governance). Excluded sectors and companies: weapons, tobacco, thermal coal, oil sands, non-compliance with UN Global Compact. The weight of the largest constituent is constrained to 35% and the weights of all other constituents are constrained to a maximum of 20%. The ETF's TER (total expense ratio) amounts to 0.17% p.a.. The Xtrackers MSCI Europe Materials Screened UCITS ETF 1C 1C is the only ETF that tracks the MSCI Europe Materials Screened 20-35 index. The ETF replicates the performance of the underlying index by full replication (buying all the index constituents). The dividends in the ETF are accumulated and reinvested in the ETF. The Xtrackers MSCI Europe Materials Screened UCITS ETF 1C 1C is a small ETF with 41m Euro assets under management. The ETF was launched on 26 June 2007 and is domiciled in Luxembourg.;Materiály XTrackers MSCI Europe Screened UCITS ETF 1C 1C se snaží sledovat materiály MSCI Europe promítané index 20-35. Materiály MSCI Europe promítly 20-35 indexů sleduje evropský sektor materiálů. Zahrnuté akcie jsou filtrovány podle kritérií ESG (environmentální, sociální a správa a společností). Vyloučené odvětví a společnosti: Zbraně, tabák, tepelné uhlí, ropné písky, nedodržování globálního kompaktního oSN. Hmotnost největší složky je omezena na 35% a hmotnosti všech ostatních složek jsou omezeny na maximálně 20%. TER (celkový poměr výdajů) činí 0,17% p.a. Materiály Xtrackers MSCI Europe promítané UCITS ETF 1C 1C je jediný ETF, který sleduje materiály MSCI Europe promítané index 20-35. ETF replikuje výkon podkladového indexu plnou replikací (nákup všech složek indexu). dividenday v ETF jsou akumulovány a reinvestovány do ETF. Materiály XTrackers MSCI Europe Screened UCITS ETF 1C 1C je malá ETF s spravováním 41 milionů euro. ETF byl spuštěn 26. června 2007 a je se sídlem v Lucemburku.;0.17%;0.17;EUR 41m;41.0;EUR;EUR;Luxembourg;Xtrackers;26 June 2007;;;Physical;UCITS;MSCI Europe;Equity, Europe, Basic Materials, Social/Environmental;Yes;EUR    Currency risk  Currency;1;Akcie;False;Evropa;25.0;-3.96;31.61;58.72;3.87;-1.53;-0.45;-4.24;26.39;-12.9;19.26;-0.56;42.21;15.25;14.96;18.95;-0.26;0.64;0.51;-17.48;-17.48;-25.92;-73.94;;;;;gettex;DXSC;5;;;;;;;2025-09-22T00:23:53.852857;success;0;Holcim Ltd.;8.97;Givaudan SA;8.12;Sika AG;7.4;Anglo American Plc;6.93;Heidelberg Materials AG;6.64;Novonesis (Novozymes A/S);4.53;DSM-Firmenich AG;3.75;UPM-Kymmene Oyj;3.27;Symrise AG;2.64;;;Other;32.67;Switzerland;26.67;France;25.6;Germany;10.33;;;IT;26.67;;;;;;;;;gettex;EUR;DXSC;;;;Borsa Italiana;EUR;XSPR;XSPR IMXSPRINVG;XSPR.MIXSPRINAVGBP.DE;;London Stock Exchange;GBX;XSPR;XSPR LNXSPRINAV;XSPR.LXSPRNAV.DE;;Stuttgart Stock Exchange;EUR;DXSC;XSPR GS;XSPR.SG;;XETRA;EUR;DXSC;XSPR GY;XSPR.DE;;;;;;;;;;;;;;;;;;;;;;;;;;;;;;;;3;63;17;1;15;10;20
LU0292103222;Xtrackers MSCI Europe Health Care Screened UCITS ETF 1C 1C;https://www.justetf.com/en/etf-profile.html?isin=LU0292103222;The Xtrackers MSCI Europe Health Care Screened UCITS ETF 1C 1C seeks to track the MSCI Europe Health Care Screened 20-35 index. The MSCI Europe Health Care Screened 20-35 index tracks large and mid cap European companies from the health care sector. The stocks included are filtered according to ESG criteria (environmental, social and corporate governance). Excluded sectors and companies: weapons, tobacco, thermal coal, oil sands, non-compliance with UN Global Compact. The weight of the largest constituent is constrained to 35% and the weights of all other constituents are constrained to a maximum of 20%. The ETF's TER (total expense ratio) amounts to 0.17% p.a.. The Xtrackers MSCI Europe Health Care Screened UCITS ETF 1C 1C is the only ETF that tracks the MSCI Europe Health Care Screened 20-35 index. The ETF replicates the performance of the underlying index by full replication (buying all the index constituents). The dividends in the ETF are accumulated and reinvested in the ETF. The Xtrackers MSCI Europe Health Care Screened UCITS ETF 1C 1C has 235m Euro assets under management. The ETF was launched on 26 June 2007 and is domiciled in Luxembourg.;Xtrackers MSCI Europe Health Care Screeked UCITS ETF 1C 1C se snaží sledovat index MSCI Europe Health Care promítán 20-35. Zdravotní péče MSCI Europe promítla 20-35 indexových indexů velkých a středních evropských společností ze zdravotnického sektoru. Zahrnuté akcie jsou filtrovány podle kritérií ESG (environmentální, sociální a správa a společností). Vyloučené odvětví a společnosti: Zbraně, tabák, tepelné uhlí, ropné písky, nedodržování globálního kompaktního oSN. Hmotnost největší složky je omezena na 35% a hmotnosti všech ostatních složek jsou omezeny na maximálně 20%. TER (celkový poměr nákladů) činí 0,17% p.a. Xtrackers MSCI Europe Health Care Screedate UCITS ETF 1C 1C je jediný ETF, který sleduje index zdravotní péče MSCI Europe 20-35. ETF replikuje výkon podkladového indexu plnou replikací (nákup všech složek indexu). dividenday v ETF jsou akumulovány a reinvestovány do ETF. Xtrackers MSCI Europe Health Care Screeked UCITS ETF 1C 1C má 235 milionů euro aktiv pod správou. ETF byl spuštěn 26. června 2007 a je se sídlem v Lucemburku.;0.17%;0.17;EUR 235m;235.0;EUR;EUR;Luxembourg;Xtrackers;26 June 2007;;;Physical;UCITS;MSCI Europe;Equity, Europe, Health Care, Social/Environmental;Yes;EUR    Currency risk  Currency;1;Akcie;False;Evropa;29.0;-15.5;15.09;25.02;-4.15;0.4;0.34;-8.75;25.25;-5.71;10.05;5.09;269.96;18.78;15.42;15.16;-0.83;0.31;0.3;-23.93;-27.29;-27.29;-34.62;;;;;gettex;DXSE;5;;;;;;;2025-09-22T00:24:00.099663;success;0;Novartis AG;15.52;Roche Holding AG;14.68;Novo Nordisk A/S;11.44;Sanofi;7.23;EssilorLuxottica SA;5.97;GSK Plc;5.28;Lonza Group AG;3.37;Haleon;2.82;argenx;2.76;;;Switzerland;38.68;United Kingdom;24.19;Other;20.07;France;14.3;Netherlands;2.76;IT;38.68;Consumer Discretionary;5.97;Consumer Staples;2.82;;;;;gettex;EUR;DXSE;;;;Borsa Italiana;EUR;XSDR;XSDR IMXSDRINVG;XSDR.MIXSDRINAVGBP.DE;;London Stock Exchange;GBX;XSDR;XSDR LNXSDRINAV;XSDR.LXSDRNAV.DE;;Stuttgart Stock Exchange;EUR;DXSE;XSDR GS;XSDR.SG;;XETRA;EUR;DXSE;DXSE GY;DXSE.DE;;;;;;;;;;;;;;;;;;;;;;;;;;;;;;;;4;66;17;5;15;10;19
LU0292103651;Xtrackers MSCI Europe Financials Screened UCITS ETF 1C 1C;https://www.justetf.com/en/etf-profile.html?isin=LU0292103651;The Xtrackers MSCI Europe Financials Screened UCITS ETF 1C 1C seeks to track the MSCI Europe Financials Screened 20-35 index. The MSCI Europe Financials Screened 20-35 index tracks large and mid cap European companies from the financial sector. The stocks included are filtered according to ESG criteria (environmental, social and corporate governance). Excluded sectors and companies: weapons, tobacco, thermal coal, oil sands, non-compliance with UN Global Compact. The weight of the largest constituent is constrained to 35% and the weights of all other constituents are constrained to a maximum of 20%. The ETF's TER (total expense ratio) amounts to 0.17% p.a.. The Xtrackers MSCI Europe Financials Screened UCITS ETF 1C 1C is the only ETF that tracks the MSCI Europe Financials Screened 20-35 index. The ETF replicates the performance of the underlying index by full replication (buying all the index constituents). The dividends in the ETF are accumulated and reinvested in the ETF. The Xtrackers MSCI Europe Financials Screened UCITS ETF 1C 1C is a small ETF with 95m Euro assets under management. The ETF was launched on 26 June 2007 and is domiciled in Luxembourg.;Xtrackers MSCI Europe Financials Scheed UCITS ETF 1C 1C se snaží sledovat finanční prostředky MSCI Europe promítané index 20-35. Finanční prostředky MSCI Europe promítly 20-35 indexových indexů velkých a středních evropských společností z finančního sektoru. Zahrnuté akcie jsou filtrovány podle kritérií ESG (environmentální, sociální a správa a společností). Vyloučené odvětví a společnosti: Zbraně, tabák, tepelné uhlí, ropné písky, nedodržování globálního kompaktního oSN. Hmotnost největší složky je omezena na 35% a hmotnosti všech ostatních složek jsou omezeny na maximálně 20%. TER ETF TER (celkový poměr nákladů) činí 0,17% P.A .. Xtrackers MSCI Europe Financials Screened UCITS ETF 1C 1C je jediný ETF, který sleduje finanční prostředky MSCI Europe promítal index 20-35. ETF replikuje výkon podkladového indexu plnou replikací (nákup všech složek indexu). dividenday v ETF jsou akumulovány a reinvestovány do ETF. Xtrackers MSCI Europe Financial Screened UCITS ETF 1C 1C je malá ETF s spravováním 95 milionů euro. ETF byl spuštěn 26. června 2007 a je se sídlem v Lucemburku.;0.17%;0.17;EUR 95m;95.0;EUR;EUR;Luxembourg;Xtrackers;26 June 2007;;;Physical;UCITS;MSCI Europe;Equity, Europe, Financials, Social/Environmental;Yes;EUR    Currency risk  Currency;1;Akcie;False;Evropa;55.0;32.47;103.45;224.01;26.0;-1.19;7.94;8.22;36.14;-2.75;23.61;24.77;-18.75;17.86;16.13;20.58;1.82;1.65;1.29;-17.19;-17.19;-23.13;-81.65;;;;;Stockholm Stock Exchange;-;6;;;;;;;2025-09-22T00:24:05.829293;success;0;Banco Santander SA;7.44;UBS Group AG;6.82;Zurich Insurance Group AG;5.45;BNP Paribas SA;4.72;AXA SA;4.19;Barclays PLC;3.72;Deutsche Bank AG;3.5;Lloyds Banking Group;3.48;London Stock Exchange Group plc;3.16;;;Other;34.58;United Kingdom;30.9;Switzerland;17.03;France;9.52;;;IT;30.9;Technology;3.2;;;;;;;gettex;EUR;XS7R;;;;Borsa Italiana;EUR;XS7R;XS7R IM;XS7R.MI;;London Stock Exchange;GBX;XS7R;XS7R LNXS7RINAV;XS7R.LXS7RNAV.DE;;Stockholm Stock Exchange;SEK;-;XS7R SS;XS7R.ST;;Stuttgart Stock Exchange;EUR;DXSF;XS7R GS;XS7R.SG;;XETRA;EUR;XS7R;XS7R GY;XS7R.DE;;;;;;;;;;;;;;;;;;;;;;;;;;3;63;17;1;15;10;20
LU0292104030;Xtrackers MSCI Europe Communication Services Screened UCITS ETF 1C 1C;https://www.justetf.com/en/etf-profile.html?isin=LU0292104030;The Xtrackers MSCI Europe Communication Services Screened UCITS ETF 1C 1C seeks to track the MSCI Europe Communication Services Screened 20-35 index. The MSCI Europe Communication Services Screened 20-35 index tracks large and mid cap stocks from Europe. All securities in the index are classified in the Communication Services sector as per the Global Industry Classification Standard (GICS). The stocks included are filtered according to ESG criteria (environmental, social and corporate governance). Excluded sectors and companies: weapons, tobacco, thermal coal, oil sands, non-compliance with UN Global Compact. The weight of the largest constituent is constrained to 35% and the weights of all other constituents are constrained to a maximum of 20%. The ETF's TER (total expense ratio) amounts to 0.17% p.a.. The Xtrackers MSCI Europe Communication Services Screened UCITS ETF 1C 1C is the only ETF that tracks the MSCI Europe Communication Services Screened 20-35 index. The ETF replicates the performance of the underlying index by full replication (buying all the index constituents). The dividends in the ETF are accumulated and reinvested in the ETF. The Xtrackers MSCI Europe Communication Services Screened UCITS ETF 1C 1C is a very small ETF with 7m Euro assets under management. The ETF was launched on 29 June 2007 and is domiciled in Luxembourg.;Komunikační služby XTrackers MSCI Europe Spólované uCITS ETF 1C 1C se snaží sledovat komunikační služby MSCI Europe promítané index 20-35. Komunikační služby MSCI Europe promítly 20-35 indexových skladby velké a střední kapitálové akciíy z Evropy. Všechny cenné papíry v indexu jsou klasifikovány v sektoru komunikačních služeb podle globálního standardu klasifikace průmyslu (GIC). Zahrnuté akcie jsou filtrovány podle kritérií ESG (environmentální, sociální a správa a společností). Vyloučené odvětví a společnosti: Zbraně, tabák, tepelné uhlí, ropné písky, nedodržování globálního kompaktního oSN. Hmotnost největší složky je omezena na 35% a hmotnosti všech ostatních složek jsou omezeny na maximálně 20%. TER (celkový poměr výdajů) činí 0,17% P.A .. Komunikační služby Xtrackers MSCI Europe Spótily UCITS ETF 1C 1C je jediným ETF, který sleduje komunikační služby MSCI Europe promítáno 20-35 index. ETF replikuje výkon podkladového indexu plnou replikací (nákup všech složek indexu). dividenday v ETF jsou akumulovány a reinvestovány do ETF. Komunikační služby Xtrackers MSCI Europe Spólované UCITS ETF 1C 1C je velmi malá ETF s správou 7m euro. ETF byla spuštěna 29. června 2007 a je bydliště v Lucemburku.;0.17%;0.17;EUR 7m;7.0;EUR;EUR;Luxembourg;Xtrackers;29 June 2007;;;Physical;UCITS;MSCI Europe;Equity, Europe, Telecommunication, Social/Environmental;Yes;EUR    Currency risk  Currency;1;Akcie;False;Evropa;14.0;12.62;48.0;65.32;13.8;-2.51;-0.98;3.52;15.41;-11.86;17.46;16.9;76.96;14.76;12.64;13.49;0.86;1.1;0.78;-8.93;-12.39;-20.44;-47.79;;;;;gettex;DXSG;5;;;;;;;2025-09-22T00:24:13.612966;success;0;Spotify Technology SA;17.0;Swisscom;7.28;Royal KPN NV;6.99;Cellnex Telecom SA;6.79;Informa Plc;5.99;Telenor ASA;3.87;Scout24 SE;3.84;Auto Trader Group;3.72;Tele2 AB;3.61;;;Germany;37.23;Other;28.79;United Kingdom;9.7;Switzerland;7.28;;;Technology;17.0;IT;9.7;;;;;;;gettex;EUR;DXSG;;;;Borsa Italiana;EUR;XSKR;XSKR IMXSKRINVG;XSKR.MIXSKRINAVGBP.DE;;London Stock Exchange;GBX;XSKR;XSKR LNXSKRINAV;XSKR.LXSKRNAV.DE;;Stuttgart Stock Exchange;EUR;DXSG;XSKR GS;XSKR.SG;;XETRA;EUR;DXSG;XSKR GY;XSKR.DE;;;;;;;;;;;;;;;;;;;;;;;;;;;;;;;;3;63;17;1;15;10;20
LU0292104469;Xtrackers MSCI Europe Information Technology Screened UCITS ETF 1C 1C;https://www.justetf.com/en/etf-profile.html?isin=LU0292104469;The Xtrackers MSCI Europe Information Technology Screened UCITS ETF 1C 1C seeks to track the MSCI Europe Information Technology Screened 20-35 index. The MSCI Europe Information Technology Screened 20-35 index tracks large and mid cap European companies from the information technology sector. The stocks included are filtered according to ESG criteria (environmental, social and corporate governance). Excluded sectors and companies: weapons, tobacco, thermal coal, oil sands, non-compliance with UN Global Compact. The weight of the largest constituent is constrained to 35% and the weights of all other constituents are constrained to a maximum of 20%. The ETF's TER (total expense ratio) amounts to 0.17% p.a.. The Xtrackers MSCI Europe Information Technology Screened UCITS ETF 1C 1C is the only ETF that tracks the MSCI Europe Information Technology Screened 20-35 index. The ETF replicates the performance of the underlying index by full replication (buying all the index constituents). The dividends in the ETF are accumulated and reinvested in the ETF. The Xtrackers MSCI Europe Information Technology Screened UCITS ETF 1C 1C is a small ETF with 42m Euro assets under management. The ETF was launched on 29 June 2007 and is domiciled in Luxembourg.;Informační technologie XTrackers MSCI Europe Screened UCITS ETF 1C 1C se snaží sledovat informační technologii MSCI Europe promítané index 20-35. Informační technologie MSCI Europe promítána 20-35 indexů sleduje velké a střední evropské společnosti z sektoru informačních technologií. Zahrnuté akcie jsou filtrovány podle kritérií ESG (environmentální, sociální a správa a společností). Vyloučené odvětví a společnosti: Zbraně, tabák, tepelné uhlí, ropné písky, nedodržování globálního kompaktního oSN. Hmotnost největší složky je omezena na 35% a hmotnosti všech ostatních složek jsou omezeny na maximálně 20%. TER (celkový poměr výdajů) činí 0,17% P.A .. Informační technologie Xtrackers MSCI Europe Screedated UCITS ETF 1C 1C je jediným ETF, který sleduje informační technologii MSCI Europe promítnuté 20-35 index. ETF replikuje výkon podkladového indexu plnou replikací (nákup všech složek indexu). dividenday v ETF jsou akumulovány a reinvestovány do ETF. Informační technologie XTrackers MSCI Europe Screened UCITS ETF 1C 1C je malá ETF s spravováním 42 milionů euro. ETF byla spuštěna 29. června 2007 a je bydliště v Lucemburku.;0.17%;0.17;EUR 42m;42.0;EUR;EUR;Luxembourg;Xtrackers;29 June 2007;;;Physical;UCITS;MSCI Europe;Equity, Europe, Technology, Social/Environmental;Yes;EUR    Currency risk  Currency;1;Akcie;False;Evropa;;-11.17;27.9;25.89;-9.73;-0.44;-6.59;-10.21;34.9;-28.82;37.31;0.7;156.28;24.21;22.8;24.06;-0.46;0.37;0.2;-25.81;-27.7;-38.01;-62.66;;;;;Stuttgart Stock Exchange;DXSH;5;;;;;;;2025-09-22T00:24:20.881621;success;0;Hexagon AB;13.24;Capgemini SE;13.15;ASM International NV;12.67;Dassault Systèmes SE;11.7;The Sage Group;8.15;BE Semiconductor Industries NV;6.46;Nemetschek;4.53;Temenos AG;2.77;;;;;Germany;31.85;France;24.85;Netherlands;19.13;Other;10.93;;;IT;9.73;;;;;;;;;gettex;EUR;XS8R;;;;Borsa Italiana;EUR;XS8R;XS8R IMXS8RINVG;XS8R.MIXS8RINAVGBP.DE;;London Stock Exchange;GBX;XS8R;XS8R LNXS8RINAV;XS8R.LXS8RNAV.DE;;Stuttgart Stock Exchange;EUR;DXSH;XS8R GS;XS8R.SG;;XETRA;EUR;XS8R;XS8R GY;XS8R.DE;;;;;;;;;;;;;;;;;;;;;;;;;;;;;;;;3;62;17;1;15;10;19
