DE000ETF9074;Amundi MDAX ESG II UCITS ETF Dist;https://www.justetf.com/en/etf-profile.html?isin=DE000ETF9074;The Amundi MDAX ESG II UCITS ETF Dist seeks to track the MDAX® ESG+ index. The MDAX® ESG+ index tracks German mid cap stocks while taking into account ESG exclusion filters (environmental, social and corporate governance). Companies involved in weapons, armaments, tobacco, thermal coal, oil sands or nuclear power and companies that violate the principles of the United Nations Global Compact or the OECD Guidelines for Multinational Enterprises are excluded. The parent index is the MDAX®. Excluded companies are not replaced. The ETF's TER (total expense ratio) amounts to 0.30% p.a.. The Amundi MDAX ESG II UCITS ETF Dist is the cheapest ETF that tracks the MDAX® ESG+ index. The ETF replicates the performance of the underlying index by full replication (buying all the index constituents). The dividends in the ETF are distributed to the investors (Annually). The Amundi MDAX ESG II UCITS ETF Dist has 102m Euro assets under management. The ETF was launched on 30 October 2015 and is domiciled in Germany.;Amundi MDAX ESG II UCITS ETF Dist se snaží sledovat index MDAX® ESG+. Index MDAX® ESG+ sleduje německé akciíy středních kapitálů při zohlednění vylučovacích filtrů ESG (environmentální, sociální a správa a řízení společností). Vyloučeny jsou společnosti zapojené do zbraní, vyzbrojování, tabáku, tepelného uhlí, ropných písků nebo jaderné energie a společnosti, které porušují zásady globálního kompaktního nebo pokynů OECD pro nadnárodní podniky OSN. Index nadřazení je MDAX®. Vyloučené společnosti nejsou nahrazeny. TER (celkový poměr nákladů) ETF činí 0,30% P.A .. Amundi MDAX ESG II UCITS ETF Dist je nejlevnější ETF, který sleduje index MDAX® ESG+. ETF replikuje výkon podkladového indexu plnou replikací (nákup všech složek indexu). dividenday v ETF jsou distribuovány investorům (každoročně). Amundi MDAX ESG II UCITS ETF Dist má ve správě aktiva 102 milionů euro. ETF byl spuštěn 30. října 2015 a je bydliště v Německu.;0.30%;0.3;EUR 102m;102.0;EUR;EUR;Germany;Amundi;30 October 2015;Distributing;Annually;Physical;Contractual;;Equity, Germany, Mid Cap;Yes;Ostatní;False;Evropa;40.0;11.94;20.74;4.4;12.95;19.09;31.1;27.02;0.63;0.21;0.03;-18.61;-20.32;-40.05;-40.05;;;;;Frankfurt Stock Exchange;-;5;1.58%;1.58;EUR 2.24;2.24;EUR;method2_regex;2025-09-19T06:41:51.289243;success;0;GEA Group;6.93;Deutsche Lufthansa AG;6.1;Nemetschek;5.58;Talanx AG;5.5;Knorr-Bremse;4.59;LEG Immobilien;4.11;Evonik Industries AG;3.48;KION GROUP AG;2.86;Hochtief AG;2.86;;;Germany;94.03;Other;2.82;Netherlands;1.4;;;;;Industrials;34.35;Materials;12.54;Technology;10.54;;;;;gettex;EUR;E907;;;;Frankfurt Stock Exchange;EUR;-;E907 GFCNAVE907;E907.FE907NAV=COBA;;SIX Swiss Exchange;CHF;CB1MDX;CB1MDX SWCB1MDXCH;CB1MDX.SCB1MDXCHFINAV=SOLA;;Stuttgart Stock Exchange;EUR;E907;E907 GSCNAVE907;E907.SGE907NAV=COBA;;XETRA;EUR;E907;E907 GYCNAVE907;E907.DEE907EURINAV=SOLA;;3.0;56.0;12.0;5.0;11.0;10.0;18.0
DE000ETF9082;Amundi TecDAX UCITS ETF Dist;https://www.justetf.com/en/etf-profile.html?isin=DE000ETF9082;The Amundi TecDAX UCITS ETF Dist seeks to track the TecDAX® index. The TecDAX® index tracks the 30 largest and most traded technology companies which are listed on the Prime Standard segment of the Frankfurt Stock Exchange and rank below the DAX® Index in terms of size and turnover. The ETF's TER (total expense ratio) amounts to 0.40% p.a.. The Amundi TecDAX UCITS ETF Dist is the cheapest ETF that tracks the TecDAX® index. The ETF replicates the performance of the underlying index by full replication (buying all the index constituents). The dividends in the ETF are distributed to the investors (Annually). The Amundi TecDAX UCITS ETF Dist is a small ETF with 76m Euro assets under management. The ETF was launched on 27 October 2016 and is domiciled in Germany.;Amundi Tecdax UCITS ETF Dist se snaží sledovat index Tecdax®. Index Tecdax® sleduje 30 největších a nejvíce obchodovaných technologických společností, které jsou uvedeny v hlavním standardním segmentu frankfurtské burzy a jsou umístěny pod indexem DAX® z hlediska velikosti a obratu. TER (celkový poměr nákladů) ETF činí 0,40% p.a. Amundi Tecdax UCITS ETF Dist je nejlevnější ETF, který sleduje index Tecdax®. ETF replikuje výkon podkladového indexu plnou replikací (nákup všech složek indexu). dividenday v ETF jsou distribuovány investorům (každoročně). Amundi Tecdax UCITS ETF Dist je malý ETF s managementem 76 milionů euro. ETF byl spuštěn 27. října 2016 a je se sídlem v Německu.;0.40%;0.4;EUR 76m;76.0;EUR;EUR;Germany;Amundi;27 October 2016;Distributing;Annually;Physical;Contractual;;Equity, Germany, Technology;;Ostatní;False;Evropa;30.0;9.86;27.58;14.03;6.42;18.18;25.7;23.69;0.54;0.33;0.11;-17.88;-17.88;-34.9;-34.9;;;;;Extracted (method 1);E908;0;0.99%;0.99;EUR 0.26;0.26;EUR;method2_regex;2025-09-19T06:41:58.761440;success;0;Infineon Technologies AG;14.48;SAP SE;14.14;Siemens Healthineers AG;11.55;QIAGEN;7.53;Nemetschek;5.67;HENSOLDT;4.62;Sartorius AG;3.87;freenet AG;2.66;Bechtle;2.65;;;Germany;89.82;Other;9.14;;;;;;;Technology;44.88;Health Care;19.14;Industrials;7.11;IT;6.42;;;;;;;;;;;;;;;;;;;;;;;;;;;;;;;;;3.0;53.0;12.0;1.0;11.0;10.0;19.0
DE000ETF9090;Amundi DAX 50 ESG II UCITS ETF Dist;https://www.justetf.com/en/etf-profile.html?isin=DE000ETF9090;The Amundi DAX 50 ESG II UCITS ETF Dist seeks to track the DAX® 50 ESG+ index. The DAX® 50 ESG+ index tracks the 50 largest, most liquid German stocks that are classified as particularly sustainable according to ESG criteria (environmental, social and corporate governance). Companies involved in the production or trade of controversial weapons, tobacco, thermal coal and nuclear energy are categorically excluded. The ETF's TER (total expense ratio) amounts to 0.15% p.a.. The Amundi DAX 50 ESG II UCITS ETF Dist is the cheapest and largest ETF that tracks the DAX® 50 ESG+ index. The ETF replicates the performance of the underlying index by full replication (buying all the index constituents). The dividends in the ETF are distributed to the investors (Annually). The Amundi DAX 50 ESG II UCITS ETF Dist has 278m Euro assets under management. The ETF was launched on 6 April 2020 and is domiciled in Germany.;Amundi Dax 50 ESG II UCITS ETF Dist se snaží sledovat index DAX® 50 ESG+. Index DAX® 50 ESG+ sleduje 50 největších a nejvíce likvidnějších německých akcií, které jsou klasifikovány jako zvláště udržitelné podle kritérií ESG (environmentální, sociální a správa a společností). Kategoricky jsou vyloučeny společnosti zapojené do výroby nebo obchodu kontroverzních zbraní, tabáku, tepelného uhlí a jaderné energie. TER (celkový poměr nákladů) ETF činí 0,15% p.a. Amundi Dax 50 ESG II UCITS ETF Dist je nejlevnější a největší ETF, který sleduje index ESG+ Dax® 50. ETF replikuje výkon podkladového indexu plnou replikací (nákup všech složek indexu). dividenday v ETF jsou distribuovány investorům (každoročně). Amundi Dax 50 ESG II UCITS ETF Dist má pod správou aktiva 278 milionů EUR. ETF byl spuštěn 6. dubna 2020 a má bydliště v Německu.;0.15%;0.15;EUR 278m;278.0;EUR;EUR;Germany;Amundi;6 April 2020;Distributing;Annually;Physical;Contractual;;;Yes;Ostatní;False;Evropa;50.0;19.7;70.49;61.56;14.67;16.79;22.17;21.08;1.17;0.88;0.48;-15.87;-15.87;-28.52;-28.52;;;;;gettex;E909;3;2.34%;2.34;EUR 1.09;1.09;EUR;method2_regex;2025-09-19T06:42:05.106216;success;0;Deutsche Telekom AG;7.01;Allianz SE;6.83;Münchener Rückversicherungs-Gesellschaft AG;6.78;SAP SE;6.41;Siemens Energy AG;5.96;Deutsche Bank AG;5.07;Deutsche Börse AG;4.4;Infineon Technologies AG;4.05;BASF SE;3.69;;;Germany;98.17;Other;1.83;;;;;;;Financials;28.02;Industrials;17.99;Consumer Discretionary;12.92;Technology;10.76;;;gettex;EUR;E909;;;;SIX Swiss Exchange;CHF;E909;E909 SWE909CHIV;E909.SE909CHFINAV=SOLA;;XETRA;EUR;E909;E909 GYEDAXEUIV;E909.DEEDAXEURINAV=SOLA;;;;;;;;;;;;;;4.0;65.0;22.0;5.0;8.0;10.0;20.0
DE000ETF9603;Amundi STOXX Europe 600 ESG II UCITS ETF Dist;https://www.justetf.com/en/etf-profile.html?isin=DE000ETF9603;The Amundi STOXX Europe 600 ESG II UCITS ETF Dist seeks to track the STOXX® Europe 600 ESG+ index. The STOXX® Europe 600 ESG+ index tracks European companies. The stocks included are filtered according to ESG criteria (environmental, social and corporate governance). The parent index is the STOXX® Europe 600. The ETF's TER (total expense ratio) amounts to 0.19% p.a.. The ETF replicates the performance of the underlying index by full replication (buying all the index constituents). The dividends in the ETF are distributed to the investors (Annually). The Amundi STOXX Europe 600 ESG II UCITS ETF Dist has 275m Euro assets under management. The ETF was launched on 29 January 2018 and is domiciled in Germany.;Amundi Stoxx Europe 600 ESG II UCITS ETF Dist se snaží sledovat index ESG+ Stoxx® Europe 600 ESG+. Index ESG+ Stoxx® Europe 600 sleduje evropské společnosti. Zahrnuté akcie jsou filtrovány podle kritérií ESG (environmentální, sociální a správa a společností). Index nadřazení je Stoxx® Europe 600. ETF TER (celkový poměr nákladů) činí 0,19% P.A. ETF replikuje výkon podkladového indexu plnou replikací (nákup všech složek indexu). dividenday v ETF jsou distribuovány investorům (každoročně). Amundi Stoxx Europe 600 ESG II UCITS ETF Dist má pod správou aktiva 275 milionů EUR. ETF byl spuštěn 29. ledna 2018 a má bydliště v Německu.;0.19%;0.19;EUR 275m;275.0;EUR;EUR;Germany;Amundi;29 January 2018;Distributing;Annually;Physical;Contractual;;;Yes;Akcie;False;Evropa;477.0;8.88;45.55;69.48;10.99;14.17;20.6;18.9;0.63;0.65;0.59;-16.0;-16.0;-20.95;-34.98;;;;;Frankfurt Stock Exchange;-;5;2.71%;2.71;EUR 1.49;1.49;EUR;method2_regex;2025-09-19T06:42:11.870557;success;0;ASML Holding NV;2.53;Nestlé SA;2.13;Roche Holding AG;2.08;Novartis AG;2.03;AstraZeneca PLC;2.03;HSBC Holdings Plc;2.03;Novo Nordisk A/S;2.01;Siemens AG;1.78;Schneider Electric SE;1.44;;;Other;34.51;United Kingdom;18.63;Germany;16.08;France;15.55;Switzerland;15.23;Financials;25.42;IT;18.63;Industrials;16.11;Health Care;11.54;Consumer Discretionary;9.84;gettex;EUR;E960;;;;Frankfurt Stock Exchange;EUR;-;E960 GFCNAVE960;E960.FE960NAV=COBA;;SIX Swiss Exchange;CHF;CB1EU6;CB1EUCHF SWCB1EUCCH;CB1EU6.SCB1EUCHFINAV=SOLA;;Stuttgart Stock Exchange;EUR;E960;E960 GSCNAVE960;E960.SGE960NAV=COBA;;XETRA;EUR;E960;E960 GYE960EUIV;E960.DEE960EURINAV=SOLA;;3.0;63.0;17.0;5.0;11.0;10.0;20.0
DE000ETFL011;Deka DAX UCITS ETF;https://www.justetf.com/en/etf-profile.html?isin=DE000ETFL011;The Deka DAX UCITS ETF seeks to track the DAX® index. The DAX® index tracks the 40 largest and most traded German stocks listed on the Prime Standard segment of the Frankfurt Stock Exchange. The ETF's TER (total expense ratio) amounts to 0.15% p.a.. The ETF replicates the performance of the underlying index by full replication (buying all the index constituents). The dividends in the ETF are accumulated and reinvested in the ETF. The Deka DAX UCITS ETF is a very large ETF with 1,643m Euro assets under management. The ETF was launched on 14 March 2008 and is domiciled in Germany.;Deka Dax UCITS ETF se snaží sledovat index DAX®. Index DAX® sleduje 40 největších a nejvíce obchodovaných německých akcií uvedených v hlavním standardním segmentu frankfurtské burzy. TER (celkový poměr nákladů) ETF činí 0,15% p.a. ETF replikuje výkon podkladového indexu plnou replikací (nákup všech složek indexu). dividenday v ETF jsou akumulovány a reinvestovány do ETF. DEKA DAX UCITS ETF je velmi velký ETF s 1 643 miliony euro. ETF byl spuštěn 14. března 2008 a má bydliště v Německu.;0.15%;0.15;EUR 1643m;1643.0;EUR;EUR;Germany;;14 March 2008;;;Physical;Contractual;;Equity, Germany;;Ostatní;False;Evropa;40.0;25.81;82.66;75.55;18.41;17.5;14.8;17.02;1.47;1.5;0.7;-16.02;-16.02;-26.81;-49.1;;;;;Extracted (method 1);EL4A;0;;;;;;;2025-09-19T06:42:17.101098;success;0;Siemens AG;10.09;Allianz SE;8.0;Deutsche Telekom AG;6.76;Airbus SE;6.18;Rheinmetall AG;4.73;Münchener Rückversicherungs-Gesellschaft AG;4.49;Siemens Energy AG;4.14;Deutsche Bank AG;3.37;Deutsche Börse AG;2.86;;;Germany;92.91;Netherlands;6.18;Other;0.91;;;;;Industrials;30.38;Financials;21.66;IT;18.41;Technology;16.92;Consumer Discretionary;7.76;;;;;;;;;;;;;;;;;;;;;;;;;;;;;;;5.0;75.0;22.0;13.0;15.0;5.0;20.0
DE000ETFL029;Deka EURO STOXX 50 UCITS ETF;https://www.justetf.com/en/etf-profile.html?isin=DE000ETFL029;The Deka EURO STOXX 50 UCITS ETF seeks to track the EURO STOXX® 50 index. The EURO STOXX® 50 index tracks the 50 largest companies in the eurozone. The ETF's TER (total expense ratio) amounts to 0.15% p.a.. The ETF replicates the performance of the underlying index by full replication (buying all the index constituents). The dividends in the ETF are distributed to the investors (Quarterly). The Deka EURO STOXX 50 UCITS ETF is a very large ETF with 1,025m Euro assets under management. The ETF was launched on 14 March 2008 and is domiciled in Germany.;Deka Euro Stoxx 50 UCITS ETF se snaží sledovat index Euro Stoxx® 50. Index Euro Stoxx® 50 sleduje 50 největších společností v eurozóně. TER (celkový poměr nákladů) ETF činí 0,15% p.a. ETF replikuje výkon podkladového indexu plnou replikací (nákup všech složek indexu). dividenday v ETF jsou distribuovány investorům (čtvrtletně). DEKA EURO STOXX 50 UCITS ETF je velmi velký ETF s 1 025 miliony euro. ETF byl spuštěn 14. března 2008 a má bydliště v Německu.;0.15%;0.15;EUR 1025m;1025.0;EUR;EUR;Germany;;14 March 2008;;Quarterly;Physical;Contractual;;Equity, Europe;;Akcie;False;Evropa;50.0;15.61;69.0;89.59;14.01;17.01;15.2;17.18;0.92;1.26;0.79;-16.38;-16.38;-23.29;-52.09;;;;;gettex;EL4B;3;1.98%;1.98;EUR 1.09;1.09;EUR;method2_regex;2025-09-19T06:42:24.270134;success;0;ASML Holding NV;6.39;Siemens AG;4.47;Allianz SE;3.55;Schneider Electric SE;3.48;LVMH Moët Hennessy Louis Vuitton SE;3.19;TotalEnergies SE;3.12;Banco Santander SA;3.02;Deutsche Telekom AG;3.0;Safran SA;2.87;;;France;33.56;Germany;29.98;Netherlands;15.83;Other;11.75;;;Financials;23.97;Industrials;20.69;Technology;16.05;Consumer Discretionary;14.82;IT;3.19;gettex;EUR;EL4B;;;;Stuttgart Stock Exchange;EUR;EL4B;;;;XETRA;EUR;EL4B;ETFSX5E GRISX5E;ETFSTOXX50E.DEISTOXX50E.DE;;;;;;;;;;;;;;5.0;75.0;22.0;13.0;15.0;5.0;20.0
DE000ETFL037;Deka STOXX Europe Strong Growth 20 UCITS ETF;https://www.justetf.com/en/etf-profile.html?isin=DE000ETFL037;The Deka STOXX Europe Strong Growth 20 UCITS ETF seeks to track the STOXX® Europe Strong Growth 20 index. The STOXX® Europe Strong Growth 20 index tracks the 20 'purest' growth companies in Europe. The growth characteristic of the individual companies is calculated by analysing 6 fundamental indicators, e.g. price-profit ratio, market value-book value ratio, dividend yield, profit growth. The ETF's TER (total expense ratio) amounts to 0.65% p.a.. The Deka STOXX Europe Strong Growth 20 UCITS ETF is the only ETF that tracks the STOXX® Europe Strong Growth 20 index. The ETF replicates the performance of the underlying index by full replication (buying all the index constituents). The dividends in the ETF are distributed to the investors (Quarterly). The Deka STOXX Europe Strong Growth 20 UCITS ETF has 161m Euro assets under management. The ETF was launched on 14 March 2008 and is domiciled in Germany.;Silný růst Deka Stoxx Europe Europe 20 UCITS ETF se snaží sledovat index Stoxx® Europe Strong Growth 20. Index Stoxx® Europe Strong Growth 20 sleduje 20 „nejčistších“ růstových společností v Evropě. Růstová charakteristika jednotlivých společností se počítá analýzou 6 základních ukazatelů, např. Poměr cenového zisku, poměr hodnoty hodnoty tržní hodnoty, výnos dividenda, růst zisku. TER (celkový poměr nákladů) ETF činí 0,65% p.a. Deka Stoxx Europe silný růst 20 UCITS ETF je jediný ETF, který sleduje index Stoxx® Europe Strong Growth 20. ETF replikuje výkon podkladového indexu plnou replikací (nákup všech složek indexu). dividenday v ETF jsou distribuovány investorům (čtvrtletně). Silný růst Deka Stoxx Europe 20 UCITS ETF má ve správě aktiv 161 milionů euro. ETF byl spuštěn 14. března 2008 a má bydliště v Německu.;0.65%;0.65;EUR 161m;161.0;EUR;EUR;Germany;;14 March 2008;;Quarterly;Physical;Contractual;;Equity, Europe, Growth;;Akcie;False;Evropa;20.0;-0.67;11.36;-6.63;-1.78;20.25;19.7;21.43;-0.03;0.19;-0.06;-24.02;-27.89;-44.69;-51.32;;;;;gettex;EL4C;3;0.25%;0.25;EUR 0.11;0.11;EUR;method2_regex;2025-09-19T06:42:30.306680;success;0;Kongsberg Gruppen ASA;7.93;Safran SA;7.53;Brunello Cucinelli SpA;6.36;Adyen;6.26;Hermès International SCA;5.92;Addtech AB;5.89;BE Semiconductor Industries NV;5.77;Partners Group Holding AG;4.78;Ferrari;4.62;;;Other;31.07;Netherlands;20.79;France;18.05;Switzerland;16.49;;;Consumer Discretionary;20.8;Technology;20.79;Industrials;17.33;Health Care;14.66;;;gettex;EUR;EL4C;;;;Stuttgart Stock Exchange;EUR;EL4C;;;;XETRA;EUR;EL4C;ETFSG2P GRISG2P;ETFSG2P.DEISG2P.DE;;;;;;;;;;;;;;2.0;47.0;6.0;5.0;15.0;5.0;16.0
DE000ETFL045;Deka STOXX Europe Strong Value 20 UCITS ETF;https://www.justetf.com/en/etf-profile.html?isin=DE000ETFL045;The Deka STOXX Europe Strong Value 20 UCITS ETF seeks to track the STOXX® Europe Strong Value 20 index. The STOXX® Europe Strong Value 20 index tracks the 20 'purest' value companies in Europe. The value characteristic of the individual companies is calculated by analysing six fundamental indicators, e.g. price-profit ratio, market value-book value ratio, dividend yield, profit growth. The ETF's TER (total expense ratio) amounts to 0.66% p.a.. The Deka STOXX Europe Strong Value 20 UCITS ETF is the only ETF that tracks the STOXX® Europe Strong Value 20 index. The ETF replicates the performance of the underlying index by full replication (buying all the index constituents). The dividends in the ETF are distributed to the investors (Quarterly). The Deka STOXX Europe Strong Value 20 UCITS ETF is a small ETF with 49m Euro assets under management. The ETF was launched on 14 March 2008 and is domiciled in Germany.;Silná hodnota Deka Stoxx Europe 20 UCITS ETF se snaží sledovat index STOXX® Europe Europe Europe 20. Index STOXX® Europe Europe Strong Value 20 sleduje 20 „nejčistší“ hodnotové společnosti v Evropě. Hodnota charakteristiky jednotlivých společností se počítá analýzou šesti základních ukazatelů, např. Poměr cenového zisku, poměr hodnoty hodnoty tržní hodnoty, výnos dividenda, růst zisku. TER (celkový poměr výdajů) ETF činí 0,66% P.A. Deka Stoxx Europe Evropská silná hodnota 20 UCITS ETF je jediným ETF, který sleduje index STOXX® Europe Europe 20. ETF replikuje výkon podkladového indexu plnou replikací (nákup všech složek indexu). dividenday v ETF jsou distribuovány investorům (čtvrtletně). Silná hodnota Deka Stoxx Europe 20 UCITS ETF je malá ETF s spravováním 49m euro. ETF byl spuštěn 14. března 2008 a má bydliště v Německu.;0.66%;0.66;EUR 49m;49.0;EUR;EUR;Germany;;14 March 2008;;Quarterly;Physical;Contractual;;Equity, Europe, Value;;Akcie;False;Evropa;20.0;27.65;83.18;118.83;18.33;21.19;21.54;23.86;1.31;1.04;0.71;-22.46;-25.03;-38.26;-60.83;;;;;gettex;EL4D;3;0.33%;0.33;EUR 0.11;0.11;EUR;method2_regex;2025-09-19T06:42:34.706376;success;0;International Consolidated Airlines Group SA;7.95;St James's Place;7.31;Alstom SA;6.59;Air France-KLM SA;6.33;Banca Monte dei Paschi;6.22;Fresenius SE & Co. KGaA;5.56;ArcelorMittal SA;5.35;Forvia SE;5.27;Bayer AG;4.65;;;Other;32.76;Germany;26.94;France;18.05;United Kingdom;15.26;;;Financials;19.37;Industrials;14.55;Materials;14.08;Health Care;10.2;;;gettex;EUR;EL4D;;;;Stuttgart Stock Exchange;EUR;EL4D;;;;XETRA;EUR;EL4D;ETFSV2P GRISV2P;ETFSV2P.DEISV2P.DE;;;;;;;;;;;;;;2.0;47.0;6.0;1.0;15.0;5.0;20.0
DE000ETFL052;Deka STOXX Europe Strong Style Composite 40 UCITS ETF;https://www.justetf.com/en/etf-profile.html?isin=DE000ETFL052;The Deka STOXX Europe Strong Style Composite 40 UCITS ETF seeks to track the STOXX® Europe Strong Style Composite 40 index. The STOXX® Europe Strong Style Composite 40 index tracks the 20 'purest' growth and the 20 'purest' value companies in Europe. The value/growth characteristic of the individual companies is calculated by analysing 6 fundamental indicators, e.g. price-profit ratio, market value-book value ratio, dividend yield, profit growth. The ETF's TER (total expense ratio) amounts to 0.66% p.a.. The Deka STOXX Europe Strong Style Composite 40 UCITS ETF is the only ETF that tracks the STOXX® Europe Strong Style Composite 40 index. The ETF replicates the performance of the underlying index by full replication (buying all the index constituents). The dividends in the ETF are distributed to the investors (Quarterly). The Deka STOXX Europe Strong Style Composite 40 UCITS ETF is a small ETF with 39m Euro assets under management. The ETF was launched on 14 March 2008 and is domiciled in Germany.;Deka Stoxx Europe Europe Strong Style Composite 40 UCITS ETF se snaží sledovat index Stoxx® Europe Strong Style Composite 40. Index Stoxx® Europe Strong Style Composite 40 sleduje 20 „nejčistší“ růst a 20 „nejčistší“ hodnotové společnosti v Evropě. Hodnota/růst charakteristiky jednotlivých společností se počítá analýzou 6 základních ukazatelů, např. Poměr cenového zisku, poměr hodnoty hodnoty tržní hodnoty, výnos dividenda, růst zisku. TER (celkový poměr nákladů) ETF činí 0,66% P.A. Deka Stoxx Europe Europe Silný styl kompozitní 40 UCITS ETF je jediný ETF, který sleduje index Stoxx® Europe Strong Style Composite 40. ETF replikuje výkon podkladového indexu plnou replikací (nákup všech složek indexu). dividenday v ETF jsou distribuovány investorům (čtvrtletně). Deka Stoxx Europe Europe Strong Style Composite 40 UCITS ETF je malý ETF s managementem 39M euro. ETF byl spuštěn 14. března 2008 a má bydliště v Německu.;0.66%;0.66;EUR 39m;39.0;EUR;EUR;Germany;;14 March 2008;;Quarterly;Physical;Contractual;;Equity, Europe, Value;;Akcie;False;Evropa;40.0;13.17;45.32;47.3;8.39;19.24;19.02;19.99;0.68;0.7;0.4;-22.97;-22.97;-40.57;-55.82;;;;;gettex;EL4E;3;0.41%;0.41;EUR 0.17;0.17;EUR;method2_regex;2025-09-19T06:42:41.970342;success;0;International Consolidated Airlines Group SA;4.41;St James's Place;4.05;Alstom SA;3.66;CD Projekt;3.58;Kongsberg Gruppen ASA;3.54;Air France-KLM SA;3.51;Banca Monte dei Paschi;3.45;Safran SA;3.36;Fresenius SE & Co. KGaA;3.08;;;Other;47.52;France;18.06;Germany;16.68;Netherlands;9.27;United Kingdom;8.47;Industrials;15.8;Consumer Discretionary;14.4;Financials;12.87;Health Care;12.2;;;gettex;EUR;EL4E;;;;Stuttgart Stock Exchange;EUR;EL4E;;;;XETRA;EUR;EL4E;ETFSS4P GRISS4P;ETFSS4P.DEISS4P.DE;;;;;;;;;;;;;;2.0;47.0;6.0;1.0;15.0;5.0;20.0
DE000ETFL060;Deka DAX (ausschüttend) UCITS ETF;https://www.justetf.com/en/etf-profile.html?isin=DE000ETFL060;The Deka DAX (ausschüttend) UCITS ETF seeks to track the DAX® index. The DAX® index tracks the 40 largest and most traded German stocks listed on the Prime Standard segment of the Frankfurt Stock Exchange. The ETF's TER (total expense ratio) amounts to 0.15% p.a.. The ETF replicates the performance of the underlying index by full replication (buying all the index constituents). The dividends in the ETF are distributed to the investors (Quarterly). The Deka DAX (ausschüttend) UCITS ETF is a large ETF with 955m Euro assets under management. The ETF was launched on 23 June 2008 and is domiciled in Germany.;Deka Dax (Ausschüttend) UCITS ETF se snaží sledovat index DAX®. Index DAX® sleduje 40 největších a nejvíce obchodovaných německých akcií uvedených v hlavním standardním segmentu frankfurtské burzy. TER (celkový poměr nákladů) ETF činí 0,15% p.a. ETF replikuje výkon podkladového indexu plnou replikací (nákup všech složek indexu). dividenday v ETF jsou distribuovány investorům (čtvrtletně). DEKA DAX (Ausschüttend) UCITS ETF je velká ETF s spravováním 955 milionů euro. ETF byl spuštěn 23. června 2008 a je bydliště v Německu.;0.15%;0.15;EUR 955m;955.0;EUR;EUR;Germany;;23 June 2008;;Quarterly;Physical;Contractual;;Equity, Germany;;Ostatní;False;Evropa;40.0;25.23;81.65;74.55;17.82;17.49;14.8;16.97;1.44;1.49;0.69;-15.98;-15.98;-26.76;-44.41;;;;;Extracted (method 1);EL4F;0;1.45%;1.45;EUR 1.29;1.29;EUR;method2_regex;2025-09-19T06:42:48.317656;success;0;Siemens AG;10.09;Allianz SE;8.0;Deutsche Telekom AG;6.76;Airbus SE;6.18;Rheinmetall AG;4.73;Münchener Rückversicherungs-Gesellschaft AG;4.49;Siemens Energy AG;4.14;Deutsche Bank AG;3.37;Deutsche Börse AG;2.86;;;Germany;92.91;Netherlands;6.18;Other;0.91;;;;;Industrials;30.38;Financials;21.66;IT;17.82;Technology;16.92;Consumer Discretionary;7.76;;;;;;;;;;;;;;;;;;;;;;;;;;;;;;;4.0;72.0;22.0;10.0;15.0;5.0;20.0
