IE00BKSCBW67;UBS MSCI World Small Cap Socially Responsible UCITS ETF USD dis;https://www.justetf.com/en/etf-profile.html?isin=IE00BKSCBW67;The UBS MSCI World Small Cap Socially Responsible UCITS ETF USD dis seeks to track the MSCI World Small Cap SRI Low Carbon Select 5% Issuer Capped index. The MSCI World Small Cap SRI Low Carbon Select 5% Issuer Capped index tracks small cap companies from developed markets worldwide. The index only considers companies with high Environmental, Social and Governance (ESG) ratings relative to their sector peers, to ensure the inclusion of the best of class companies from an ESG perspective. Companies that generate significant portions of their revenues in non-sustainable activities are excluded. The weight of each company is capped to 5%. The ETF's TER (total expense ratio) amounts to 0.23% p.a.. The UBS MSCI World Small Cap Socially Responsible UCITS ETF USD dis is the only ETF that tracks the MSCI World Small Cap SRI Low Carbon Select 5% Issuer Capped index. The ETF replicates the performance of the underlying index by full replication (buying all the index constituents). The dividends in the ETF are distributed to the investors (Semi annually). The UBS MSCI World Small Cap Socially Responsible UCITS ETF USD dis is a small ETF with 22m Euro assets under management. The ETF was launched on 19 August 2021 and is domiciled in Ireland.;Světový čepice UBS MSCI SLODA SOCIÁLNĚ odpovědný UCITS ETF USD DIS se snaží sledovat index MSCI World Small Cap Sri Low Carbon Select 5% Emitent. Světový MSCI Světový čepice Sri Low Carbon Select 5% Emitent Index index skladby malých společností CAP z rozvinutých trhů po celém světě. Index zvažuje pouze společnosti s vysokým hodnocením environmentálního, sociálního a správy (ESG) ve vztahu k jejich vrstevníkům jejich sektoru, aby zajistily zahrnutí nejlepších společností ve třídě z pohledu ESG. Vyloučeny jsou společnosti, které generují významné části svých příjmů v neudržitelných činnostech. Hmotnost každé společnosti je omezena na 5%. TER (celkový poměr výdajů) ETF činí 0,23% p.a. ETF replikuje výkon podkladového indexu plnou replikací (nákup všech složek indexu). dividenday v ETF jsou distribuovány investorům (polo každoročně). Světový limit UBS MSCI Světový společensky odpovědný UCITS ETF USD DIS je malý ETF s managementem 22 milionů euro. ETF byl spuštěn 19. srpna 2021 a je sídlí v Irsku.;0.23%;0.23;EUR 22m;22.0;EUR;USD;Ireland;UBS;19 August 2021;Distributing;Semi annually;Physical;;MSCI World;Equity, World, Small Cap;Yes;Akcie;False;Globální;730.0;4.02;21.57;;-0.44;17.42;16.37;;0.23;0.41;;-23.49;-23.49;;-23.49;;;;;London Stock Exchange;WSCR;2;0.82%;0.82;EUR 0.08;0.08;EUR;method2_regex;2025-09-19T09:59:43.285334;success;0;Tapestry;1.06;US Foods;0.91;Guidewire Software;0.85;TechnipFMC plc;0.72;Sprouts Farmers Market;0.71;BJs Wholesale Club Hldgs;0.66;East West Bancorp;0.65;Jones Lang LaSalle, Inc.;0.6;Reinsurance Gp of America;0.6;;;United States;56.33;Other;18.9;Japan;10.48;United Kingdom;8.28;Australia;6.01;Industrials;20.57;Financials;15.21;Consumer Discretionary;12.71;Technology;12.17;;;London Stock Exchange;GBX;WSCR;WSCR LNWSCEEUIV;WSCR.LWSCRGBXINAV=SOLA;;SIX Swiss Exchange;USD;WSCSR;WSCSR SWWSCSRUIV;WSCSR.SWSCSRUSDINAV=SOLA;;;;;;;;;;;;;;;;;;;;2.0;48.0;17.0;1.0;6.0;5.0;19.0
IE00BKSCBX74;UBS MSCI World Small Cap Socially Responsible UCITS ETF USD acc;https://www.justetf.com/en/etf-profile.html?isin=IE00BKSCBX74;The UBS MSCI World Small Cap Socially Responsible UCITS ETF USD acc seeks to track the MSCI World Small Cap SRI Low Carbon Select 5% Issuer Capped index. The MSCI World Small Cap SRI Low Carbon Select 5% Issuer Capped index tracks small cap companies from developed markets worldwide. The index only considers companies with high Environmental, Social and Governance (ESG) ratings relative to their sector peers, to ensure the inclusion of the best of class companies from an ESG perspective. Companies that generate significant portions of their revenues in non-sustainable activities are excluded. The weight of each company is capped to 5%. The ETF's TER (total expense ratio) amounts to 0.23% p.a.. The UBS MSCI World Small Cap Socially Responsible UCITS ETF USD acc is the only ETF that tracks the MSCI World Small Cap SRI Low Carbon Select 5% Issuer Capped index. The ETF replicates the performance of the underlying index by full replication (buying all the index constituents). The dividends in the ETF are accumulated and reinvested in the ETF. The UBS MSCI World Small Cap Socially Responsible UCITS ETF USD acc is a large ETF with 524m Euro assets under management. The ETF was launched on 19 August 2021 and is domiciled in Ireland.;Světový limit UBS MSCI Světový spojeně zodpovědný UCITS ETF USD ACC se snaží sledovat index MSCI World Small Cap Sri Low Carbon Select 5%. Světový MSCI Světový čepice Sri Low Carbon Select 5% Emitent Index index skladby malých společností CAP z rozvinutých trhů po celém světě. Index zvažuje pouze společnosti s vysokým hodnocením environmentálního, sociálního a správy (ESG) ve vztahu k jejich vrstevníkům jejich sektoru, aby zajistily zahrnutí nejlepších společností ve třídě z pohledu ESG. Vyloučeny jsou společnosti, které generují významné části svých příjmů v neudržitelných činnostech. Hmotnost každé společnosti je omezena na 5%. TER (celkový poměr výdajů) ETF činí 0,23% p.a. ETF replikuje výkon podkladového indexu plnou replikací (nákup všech složek indexu). dividenday v ETF jsou akumulovány a reinvestovány do ETF. Světový limit UBS MSCI Světový čepice společensky odpovědný UCITS ETF USD ACC je velký ETF s managementem 524 milionů euro. ETF byl spuštěn 19. srpna 2021 a je sídlí v Irsku.;0.23%;0.23;EUR 524m;524.0;EUR;USD;Ireland;UBS;19 August 2021;Accumulating;;Physical;;MSCI World;Equity, World, Small Cap;Yes;Akcie;False;Globální;730.0;3.72;21.39;;-0.71;16.74;16.18;;0.22;0.41;;-23.47;-23.47;;-23.47;;;;;Borsa Italiana;WSC;4;;;;;;;2025-09-19T09:59:48.687796;success;0;Tapestry;1.06;US Foods;0.91;Guidewire Software;0.85;TechnipFMC plc;0.72;Sprouts Farmers Market;0.71;BJs Wholesale Club Hldgs;0.66;East West Bancorp;0.65;Jones Lang LaSalle, Inc.;0.6;Reinsurance Gp of America;0.6;;;United States;56.33;Other;18.9;Japan;10.48;United Kingdom;8.28;Australia;6.01;Industrials;20.57;Financials;15.21;Consumer Discretionary;12.71;Technology;12.17;;;gettex;EUR;UIMS;;;;Borsa Italiana;EUR;WSC;WSC IMUIMSEUIV;WSC.MIUIMSUSDINAV=SOLA;;SIX Swiss Exchange;USD;WSCSRI;WSCSRI SWWSCSRIIV;WSCSRI.SWSCSRIUSDINAV=SOLA;;XETRA;EUR;UIMS;UIMS GYUIMSEUIV;UIMS.DEUIMSUSDINAV=SOLA;;;;;;;;3.0;57.0;17.0;10.0;6.0;5.0;19.0
IE00BKT1CS59;iShares J.P. Morgan USD EM Corp Bond UCITS ETF EUR Hedged (Acc);https://www.justetf.com/en/etf-profile.html?isin=IE00BKT1CS59;The iShares J.P. Morgan USD EM Corp Bond UCITS ETF EUR Hedged (Acc) seeks to track the JP Morgan CEMBI Broad Diversified Core (EUR Hedged) index. The JP Morgan CEMBI Broad Diversified Core (EUR Hedged) index tracks corporate bonds from emerging market countries of all maturities, denominated in USD. Rating: Mixed ratings. Currency hedged to Euro (EUR). The ETF's TER (total expense ratio) amounts to 0.53% p.a.. The iShares J.P. Morgan USD EM Corp Bond UCITS ETF EUR Hedged (Acc) is the only ETF that tracks the JP Morgan CEMBI Broad Diversified Core (EUR Hedged) index. The ETF replicates the performance of the underlying index by sampling technique (buying a selection of the most relevant index constituents). The interest income (coupons) in the ETF is accumulated and reinvested in the ETF. The iShares J.P. Morgan USD EM Corp Bond UCITS ETF EUR Hedged (Acc) has 304m Euro assets under management. The ETF was launched on 9 March 2020 and is domiciled in Ireland.;IShares J.P. Morgan USD EM Corp Bond UCITS ETF EUR Hedged (ACC) se snaží sledovat index JP Morgan Cembi Broad Diversified Core (EUR Hedged). Index JP Morgan Cembi Broad Diversified Core (EUR Hedged) sleduje firemní dluhopisy z rozvíjejících se zemí trhu všech splatností, denominované v USD. Hodnocení: Smíšené hodnocení. Měna zajišťovala euro (EUR). TER (celkový poměr nákladů) činí 0,53% P.A .. Ishares J.P. Morgan USD EM Corp Bond UCITS ETF EUR (ACC) je jediný ETF, který sleduje index JP Morgan Cembi Broad Diversified Core (Eur Hedged). ETF replikuje výkon základního indexu technikou vzorkování (nákup výběru nejdůležitějších složek indexu). Úrokové výnosy (kupóny) v ETF se nashromáždí a reinvestují do ETF. IShares J.P. Morgan USD EM Corp Bond UCITS ETF EUR Hedged (ACC) má 304 milionů euro aktiv. ETF byl spuštěn 9. března 2020 a je bydliště v Irsku.;0.53%;0.53;EUR 304m;304.0;EUR;EUR;Ireland;iShares;9 March 2020;Accumulating;;Physical;;;Bonds, USD, Emerging Markets, Corporate, All maturities;;Dluhopisy;False;Rozvíjející se země;1200.0;4.54;16.28;1.81;6.29;6.54;7.81;7.61;0.69;0.66;0.05;-3.46;-7.34;-22.31;-22.31;;;;;gettex;SNAZ;2;;;;;;;2025-09-19T09:59:54.632032;success;0;XS2383421711;0.35;XS1807299331;0.29;XS1551355149;0.29;XS2810168737;0.29;;;;;;;;;;;;;Other;73.67;United States;5.37;Netherlands;3.97;;;;;;;;;;;;;;;gettex;EUR;SNAZ;;;;XETRA;EUR;SNAZ;SNAZ GYINVSNAZ1;SNAZ.DE3Q56EUR=INAV;;;;;;;;;;;;;;;;;;;;2.0;49.0;6.0;5.0;8.0;10.0;20.0
IE00BKT6BH25;iShares EUR Corporate Bond ex-Financials 1-5yr ESG SRI UCITS ETF EUR (Acc);https://www.justetf.com/en/etf-profile.html?isin=IE00BKT6BH25;The iShares EUR Corporate Bond ex-Financials 1-5yr ESG SRI UCITS ETF EUR (Acc) seeks to track the Bloomberg MSCI Euro Corporate Bond ex-Financials 1-5 Year ESG SRI index. The Bloomberg MSCI Euro Corporate Bond ex-Financials 1-5 Year ESG SRI index tracks Euro denominated corporate bonds issued by industrial and utility corporations. The index consists of ESG (environmental, social and governance) screened bonds. Time to maturity: 1-5 years. Rating: Investment Grade. The ETF's TER (total expense ratio) amounts to 0.20% p.a.. The iShares EUR Corporate Bond ex-Financials 1-5yr ESG SRI UCITS ETF EUR (Acc) is the cheapest ETF that tracks the Bloomberg MSCI Euro Corporate Bond ex-Financials 1-5 Year ESG SRI index. The ETF replicates the performance of the underlying index by sampling technique (buying a selection of the most relevant index constituents). The interest income (coupons) in the ETF is accumulated and reinvested in the ETF. The iShares EUR Corporate Bond ex-Financials 1-5yr ESG SRI UCITS ETF EUR (Acc) is a small ETF with 50m Euro assets under management. The ETF was launched on 26 September 2019 and is domiciled in Ireland.;Ishares EUR Corporate Bond Ex-Financials 1-5yr ESG SRI UCITS ETF EUR (ACC) se snaží sledovat Bloomberg MSCI Euro Corporate Bond Ex-financials 1-5 Year ESG SRI Index. Bloomberg MSCI Euro Corporate Bond Ex-financials 1-5 Year ESG SRI Index skladby euro denominované firemní dluhopisy vydané průmyslovými a užitkovými korporacemi. Index se skládá z ESG (environmentální, sociální a správa věcí veřejných) prověřených dluhopisů. Čas do zralosti: 1-5 let. Hodnocení: Investiční třída. TER (celkový poměr nákladů) činí 0,20% P.A .. Ishares Eur Corporate Bond Ex-financials 1-5yr Esg Sri UCITS ETF EUR (ACC) je nejlevnější ETF, který sleduje Bloomberg MSCI Euro Corporační dluhopisy ex-financials 1-5 let. ETF replikuje výkon základního indexu technikou vzorkování (nákup výběru nejdůležitějších složek indexu). Úrokové výnosy (kupóny) v ETF se nashromáždí a reinvestují do ETF. Ishares EUR Corporate Bond Ex-Financials 1-5yr ESG Sri UCITS ETF EUR (ACC) je malý ETF s 50m euro managementu. ETF byl spuštěn 26. září 2019 a je se sídlem v Irsku.;0.20%;0.2;EUR 50m;50.0;EUR;EUR;Ireland;iShares;26 September 2019;Accumulating;;Physical;;;;Yes;Dluhopisy;False;Globální;820.0;3.81;10.92;3.6;2.57;1.95;2.66;2.61;1.95;1.32;0.27;-0.99;-1.93;-9.49;-9.49;;;;;Extracted (method 1);AYEJ;0;;;;;;;2025-09-19T10:00:01.728881;success;0;XS1001749289;0.34;XS2235996217;0.34;XS2180007549;0.31;XS1843449122;0.29;XS3064418687;0.28;FR0013216926;0.28;FR0013463668;0.28;XS1197833053;0.28;XS1948611840;0.27;;;Other;39.43;United States;20.06;France;18.41;Netherlands;13.38;Germany;8.72;IT;20.06;;;;;;;;;;;;;;;;;;;;;;;;;;;;;;;;;;;;;;;3.0;54.0;17.0;1.0;8.0;10.0;18.0
IE00BKT6FT27;iShares Global Government Bond UCITS ETF EUR Hedged (Dist);https://www.justetf.com/en/etf-profile.html?isin=IE00BKT6FT27;The iShares Global Government Bond UCITS ETF EUR Hedged (Dist) seeks to track the FTSE G7 Government Bond (EUR Hedged) index. The FTSE G7 Government Bond (EUR Hedged) index tracks government bonds from G7 countries: Canada, France, Germany, Italy, Japan, United Kingdom and United States. All maturities are included. Rating: Investment Grade. Currency hedged to Euro (EUR). The ETF's TER (total expense ratio) amounts to 0.25% p.a.. The iShares Global Government Bond UCITS ETF EUR Hedged (Dist) is the only ETF that tracks the FTSE G7 Government Bond (EUR Hedged) index. The ETF replicates the performance of the underlying index by sampling technique (buying a selection of the most relevant index constituents). The interest income (coupons) in the ETF is distributed to the investors (Semi annually). The iShares Global Government Bond UCITS ETF EUR Hedged (Dist) has 248m Euro assets under management. The ETF was launched on 26 September 2019 and is domiciled in Ireland.;Globální vládní dluhopis Ishares UCITS ETF EUR HEDGED (DIST) se snaží sledovat index vládního dluhopisu FTSE G7 (EUR Hedged). Index vládních dluhopisů FTSE G7 (EUR Hedged) sleduje vládní dluhopisy ze zemí G7: Kanada, Francie, Německo, Itálie, Japonsko, Velká Británie a Spojené státy. Zahrnuty jsou všechna splatností. Hodnocení: Investiční třída. Měna zajišťovala euro (EUR). TER (celkový poměr nákladů) činí 0,25% P.A. Globální vládní dluhopis Ishares UCITS ETF EUR HEDGED (DIST) je jediným ETF, který sleduje index vládního dluhopisu FTSE G7 (EUR Hedged). ETF replikuje výkon základního indexu technikou vzorkování (nákup výběru nejdůležitějších složek indexu). Úrokové výnosy (kupóny) v ETF jsou distribuovány investorům (semifinále každoročně). Globální vládní dluhopis IShares UCITS ETF EUR Hedged (Dist) má ve spravování aktiva 248 milionů EUR. ETF byl spuštěn 26. září 2019 a je se sídlem v Irsku.;0.25%;0.25;EUR 248m;248.0;EUR;EUR;Ireland;iShares;26 September 2019;Distributing;Semi annually;Physical;;Government Bond;Bonds, World, Government, All maturities;;Dluhopisy;False;Globální;869.0;-1.24;0.45;-14.08;1.9;7.15;9.08;8.51;-0.17;0.02;-0.35;-4.5;-6.77;-20.42;-21.3;;;;;gettex;AYEK;2;2.85%;2.85;EUR 0.12;0.12;EUR;method2_regex;2025-09-19T10:00:09.520533;success;0;;;;;;;;;;;;;;;;;;;;;Other;41.31;United States;30.15;Japan;14.24;France;7.93;;;;;;;;;;;;;gettex;EUR;AYEK;;;;Euronext Amsterdam;EUR;IGLE;IGLE NA;IGLE.AS;;;;;;;;;;;;;;;;;;;;3.0;57.0;17.0;5.0;8.0;10.0;17.0
IE00BKT6FV49;iShares Core MSCI Japan IMI UCITS ETF EUR Hedged (Acc);https://www.justetf.com/en/etf-profile.html?isin=IE00BKT6FV49;The iShares Core MSCI Japan IMI UCITS ETF EUR Hedged (Acc) seeks to track the MSCI Japan IMI (EUR Hedged) index. The MSCI Japan IMI (EUR Hedged) index tracks stocks from Japan. It covers securities across large, mid and small cap size segments. Currency hedged to Euro (EUR). The ETF's TER (total expense ratio) amounts to 0.17% p.a.. The iShares Core MSCI Japan IMI UCITS ETF EUR Hedged (Acc) is the only ETF that tracks the MSCI Japan IMI (EUR Hedged) index. The ETF replicates the performance of the underlying index by sampling technique (buying a selection of the most relevant index constituents). The dividends in the ETF are accumulated and reinvested in the ETF. The iShares Core MSCI Japan IMI UCITS ETF EUR Hedged (Acc) is a small ETF with 47m Euro assets under management. The ETF was launched on 26 September 2019 and is domiciled in Ireland.;IShares Core MSCI Japan IMI UCITS ETF EUR HEDGED (ACC) se snaží sledovat index MSCI Japan IMI (EUR Hedged). Indexové akciíy MSCI Japan IMI (Hedged) Stopy z Japonska. Pokrývá cenné papíry ve velkých, středních a malých segmentech velikosti čepice. Měna zajišťovala euro (EUR). Ter (celkový poměr nákladů) ETF činí 0,17% p.a .. Ishares Core MSCI Japan IMI UCITS ETF EUR (ACC) je jediný ETF, který sleduje index MSCI Japan IMI (EUR Hedged). ETF replikuje výkon základního indexu technikou vzorkování (nákup výběru nejdůležitějších složek indexu). dividenday v ETF jsou akumulovány a reinvestovány do ETF. IShares Core MSCI Japan IMI UCITS ETF EUR Hedged (ACC) je malý ETF s vedením 47 milionů euro. ETF byl spuštěn 26. září 2019 a je se sídlem v Irsku.;0.17%;0.17;EUR 47m;47.0;EUR;EUR;Ireland;iShares;26 September 2019;Accumulating;;Physical;;MSCI Japan IMI  EUR Hedged;Equity, Japan;;Akcie;False;Japonsko;976.0;28.2;81.41;120.66;15.63;21.53;20.53;19.04;1.31;1.07;0.9;-18.11;-24.53;-24.53;-29.28;;;;;gettex;AYEI;3;;;;;;;2025-09-19T10:00:15.961843;success;0;Mitsubishi UFJ Financial Group, Inc.;3.1;Sony Group Corp.;2.91;Hitachi Ltd.;2.76;Sumitomo Mitsui Financial Group, Inc.;1.82;Nintendo Co., Ltd.;1.8;Recruit Holdings Co., Ltd.;1.64;Tokyo Electron Ltd.;1.57;Mitsubishi Heavy Industries, Ltd.;1.49;SoftBank Group Corp.;1.45;;;Japan;98.65;Other;1.35;;;;;;;Industrials;24.8;Consumer Discretionary;17.04;Financials;14.29;Technology;12.71;;;gettex;EUR;AYEI;;;;Borsa Italiana;EUR;SPJE;;;;Euronext Amsterdam;EUR;SJPE;SJPE NAINAVIJAU;SJPE.ASISJPDINAV.PA;;;;;;;;;;;;;;3.0;56.0;17.0;1.0;8.0;10.0;20.0
IE00BKT6RT64;iShares China CNY Bond UCITS ETF USD Hedged (Dist);https://www.justetf.com/en/etf-profile.html?isin=IE00BKT6RT64;The iShares China CNY Bond UCITS ETF USD Hedged (Dist) seeks to track the Bloomberg China Treasury + Policy Bank (USD Hedged) index. The Bloomberg China Treasury + Policy Bank (USD Hedged) index tracks bonds quoted on the China Interbank Bond Market (CIBM) and that have been issued by the Chinese State or state-owned banks. Currency hedged to US-Dollar (USD). The ETF's TER (total expense ratio) amounts to 0.40% p.a.. The iShares China CNY Bond UCITS ETF USD Hedged (Dist) is the only ETF that tracks the Bloomberg China Treasury + Policy Bank (USD Hedged) index. The ETF replicates the performance of the underlying index by full replication (buying all the index constituents). The interest income (coupons) in the ETF is distributed to the investors (Semi annually). The iShares China CNY Bond UCITS ETF USD Hedged (Dist) is a large ETF with 596m Euro assets under management. The ETF was launched on 4 November 2019 and is domiciled in Ireland.;IShares China CNY Bond UCITS ETF USD Hedged (Dist) se snaží sledovat index Bloomberg China Treasury + Policy Bank (USD Hedged). Bloomberg China Treasury + Policy Bank (USD Hedged) Index sleduje dluhopisy citované na čínském mezibankovním dluhopisovém trhu (CIBM) ​​a které byly vydány čínským státem nebo státními bankami. Měna byla zajištěna do amerického dolaru (USD). TER (celkový poměr nákladů) činí 0,40% P.A .. Ishares China CNY Bond UCITS ETF USD Hedged (Dist) je jediný ETF, který sleduje index Bloomberg China Treasury + Policy Bank (USD Hedged). ETF replikuje výkon podkladového indexu plnou replikací (nákup všech složek indexu). Úrokové výnosy (kupóny) v ETF jsou distribuovány investorům (semifinále každoročně). Ishares China CNY Bond UCITS ETF USD Hedged (Dist) je velký ETF s 596 miliony euro. ETF byl spuštěn 4. listopadu 2019 a je se sídlem v Irsku.;0.40%;0.4;EUR 596m;596.0;EUR;USD;Ireland;iShares;4 November 2019;Distributing;Semi annually;Physical;;;Bonds, CNY, China, Government, All maturities;;Dluhopisy;False;Čína;89.0;-1.22;3.3;28.81;-10.59;8.55;8.07;7.76;-0.14;0.13;0.67;-12.34;-12.44;-12.44;-15.84;;;;;Extracted (method 1);AYEQ;0;2.14%;2.14;EUR 0.10;0.1;EUR;method2_regex;2025-09-19T10:00:22.734272;success;0;;;;;;;;;;;;;;;;;;;;;China;78.38;Other;21.62;;;;;;;;;;;;;;;;;;;;;;;;;;;;;;;;;;;;;;;;;;;;;;;3.0;50.0;12.0;10.0;8.0;10.0;10.0
IE00BKT6VQ12;iShares China CNY Bond UCITS ETF EUR Hedged (Acc);https://www.justetf.com/en/etf-profile.html?isin=IE00BKT6VQ12;The iShares China CNY Bond UCITS ETF EUR Hedged (Acc) seeks to track the Bloomberg China Treasury + Policy Bank (EUR Hedged) index. The Bloomberg China Treasury + Policy Bank (EUR Hedged) index tracks bonds quoted on the China Interbank Bond Market (CIBM) and that have been issued by the Chinese State or state-owned banks. Currency hedged to Euro (EUR). The ETF's TER (total expense ratio) amounts to 0.40% p.a.. The iShares China CNY Bond UCITS ETF EUR Hedged (Acc) is the largest ETF that tracks the Bloomberg China Treasury + Policy Bank (EUR Hedged) index. The ETF replicates the performance of the underlying index by full replication (buying all the index constituents). The interest income (coupons) in the ETF is accumulated and reinvested in the ETF. The iShares China CNY Bond UCITS ETF EUR Hedged (Acc) has 220m Euro assets under management. The ETF was launched on 24 February 2021 and is domiciled in Ireland.;Ishares China CNY Bond UCITS ETF EUR Hedged (ACC) se snaží sledovat index Bloomberg China Treasury + Policy Bank (EUR Hedged). Indexová index Bloomberg China Treasury + Policy Bank (EUR Hedged) sleduje dluhopisy citované na čínském mezibankovním dluhopisovém trhu (CIBM) ​​a které byly vydány čínským státem nebo státními bankami. Měna zajišťovala euro (EUR). TER (celkový poměr nákladů) činí 0,40% P.A .. Ishares China CNY Bond UCITS ETF EUR HEDGED (ACC) je největší ETF, který sleduje index Treasury + Policy Bank Bloomberg China (EUR Hedged). ETF replikuje výkon podkladového indexu plnou replikací (nákup všech složek indexu). Úrokové výnosy (kupóny) v ETF se nashromáždí a reinvestují do ETF. Ishares China CNY Bond UCITS ETF EUR Hedged (ACC) má pod správou aktiva 220 milionů euro. ETF byl spuštěn 24. února 2021 a má bydliště v Irsku.;0.40%;0.4;EUR 220m;220.0;EUR;EUR;Ireland;iShares;24 February 2021;Accumulating;;Physical;;;Bonds, CNY, China, Government, All maturities;;Dluhopisy;False;Čína;89.0;3.28;15.19;;0.67;5.97;6.58;;0.55;0.73;;-2.32;-3.79;;-3.79;;;;;Extracted (method 1);83J0;0;;;;;;;2025-09-19T10:00:27.944471;success;0;;;;;;;;;;;;;;;;;;;;;China;78.38;Other;21.62;;;;;;;;;;;;;;;;;;;;;;;;;;;;;;;;;;;;;;;;;;;;;;;3.0;53.0;12.0;5.0;6.0;10.0;20.0
IE00BKTLJB70;iShares Smart City Infrastructure UCITS ETF USD (Dist);https://www.justetf.com/en/etf-profile.html?isin=IE00BKTLJB70;The iShares Smart City Infrastructure UCITS ETF USD (Dist) seeks to track the STOXX® Global Smart City Infrastructure index. The STOXX® Global Smart City Infrastructure index tracks companies that are directly related to the development of smart cities. This includes smart mobility, e-commerce, smart infrastructure, smart waste management solutions, smart security, Internet of Things (IOT), entertainment, healthcare and wireless connectivity. The ETF's TER (total expense ratio) amounts to 0.40% p.a.. The iShares Smart City Infrastructure UCITS ETF USD (Dist) is the cheapest ETF that tracks the STOXX® Global Smart City Infrastructure index. The ETF replicates the performance of the underlying index by sampling technique (buying a selection of the most relevant index constituents). The dividends in the ETF are distributed to the investors (Semi annually). The iShares Smart City Infrastructure UCITS ETF USD (Dist) is a small ETF with 33m Euro assets under management. The ETF was launched on 3 March 2020 and is domiciled in Ireland.;Infrastruktura infrastruktury Ishares Smart City UCITS ETF USD (DIST) se snaží sledovat index Stoxx® Global Smart City Infrastructure Index. Index indexu STOXX® Global Smart City Index sleduje společnosti, které přímo souvisejí s rozvojem inteligentních měst. To zahrnuje inteligentní mobilitu, elektronický obchod, inteligentní infrastrukturu, řešení pro nakládání s odpady, inteligentní zabezpečení, internet věcí (IoT), zábavu, zdravotní péči a bezdrátové připojení. TER (celkový poměr nákladů) činí 0,40% p.a. Infrastruktura infrastruktury Ishares UCITS ETF USD (DIST) je nejlevnější ETF, který sleduje index Global Smart City STRAGRAstruktury STOXX®. ETF replikuje výkon základního indexu technikou vzorkování (nákup výběru nejdůležitějších složek indexu). dividenday v ETF jsou distribuovány investorům (polo každoročně). Ishares Smart City Infrastructure UCITS ETF USD (dist) je malá ETF s managementem 33 milionů euro. ETF byl spuštěn 3. března 2020 a je bydliště v Irsku.;0.40%;0.4;EUR 33m;33.0;EUR;USD;Ireland;iShares;3 March 2020;Distributing;Semi annually;Physical;;;;Yes;Nemovitosti;False;Globální;149.0;13.55;36.74;73.63;6.01;16.15;15.45;15.22;0.84;0.71;0.77;-20.99;-20.99;-21.79;-29.07;;;4.09;;gettex;AYEV;4;0.89%;0.89;EUR 0.07;0.07;EUR;method2_regex;2025-09-19T10:00:35.132047;success;0;Ciena;1.63;TopBuild;1.52;Palantir Technologies, Inc.;1.52;Ebara Corp.;1.51;Legrand SA;1.51;Eaton Corp. Plc;1.51;SPIE SA;1.49;nVent Electric;1.47;Emerson Electric;1.46;;;United States;44.86;Other;32.09;Japan;10.5;Canada;6.3;United Kingdom;6.25;Technology;32.37;Real Estate;4.09;Consumer Discretionary;2.42;;;;;gettex;EUR;AYEV;;;;Euronext Amsterdam;USD;CT2B;CT2B NAINAVCT25;CT2B.AS3O97INAV.DE;;London Stock Exchange;GBP;CT2B;CT2B LNINAVCT25;CT2B.L3O97INAV.DE;;XETRA;EUR;AYEV;AYEV GYINAVCT21;AYEV.DE3O93EUR=INAV;;;;;;;;3.0;51.0;12.0;1.0;8.0;10.0;20.0
