IE00B57X3V84;iShares Dow Jones Global Leaders Screened UCITS ETF USD (Acc);https://www.justetf.com/en/etf-profile.html?isin=IE00B57X3V84;The iShares Dow Jones Global Leaders Screened UCITS ETF USD (Acc) seeks to track the Dow Jones Global Best-In-Class index. The Dow Jones Global Best-In-Class Index ex Alcohol, Tobacco, Gambling, Armaments & Firearms and Adult Entertainment index tracks 20% of the largest 2500 global sustainability companies of the Dow Jones Global Total Stock Market Index. The companies are selected for the index based on long term economic, environmental and social criteria. The ETF's TER (total expense ratio) amounts to 0.60% p.a.. The iShares Dow Jones Global Leaders Screened UCITS ETF USD (Acc) is the only ETF that tracks the Dow Jones Global Best-In-Class index. The ETF replicates the performance of the underlying index by full replication (buying all the index constituents). The dividends in the ETF are accumulated and reinvested in the ETF. The iShares Dow Jones Global Leaders Screened UCITS ETF USD (Acc) is a very large ETF with 1,493m Euro assets under management. The ETF was launched on 25 February 2011 and is domiciled in Ireland.;Ishares Dow Jones Global Leaders Scheed UCITS ETF USD (ACC) se snaží sledovat globální index Dow Jones Global ve třídě. Dow Jones Global Best ve třídě indexu ext alkoholu, tabák, hazardní hry, výzbroje a střelné zbraně a index zábavy pro dospělé sleduje 20% největších 2500 globálních udržitelnosti v indexu Dow Jones Global Accut Market Index. Společnosti jsou vybírány pro index na základě dlouhodobých ekonomických, environmentálních a sociálních kritérií. Ter (celkový poměr nákladů) ETF činí 0,60% p.a. Ishares Dow Jones Global Leaders Screeked UCITS ETF USD (ACC) je jediný ETF, který sleduje globální index Dow Jones Global ve třídě. ETF replikuje výkon podkladového indexu plnou replikací (nákup všech složek indexu). dividenday v ETF jsou akumulovány a reinvestovány do ETF. Ishares Dow Jones Global Leaders Scheed UCITS ETF USD (ACC) je velmi velký ETF s 1 493 mil. EUR. ETF byl spuštěn 25. února 2011 a je se sídlem v Irsku.;0.60%;0.6;EUR 1493m;1493.0;EUR;USD;Ireland;iShares;25 February 2011;Accumulating;;Physical;UCITS;;Equity, World, Social/Environmental;Yes;USD    Currency risk  Currency;1;Akcie;False;Celosvětově;570.0;8.85;47.48;86.76;4.53;2.88;6.94;6.86;31.22;-12.06;21.96;17.72;301.2;13.25;12.93;13.53;0.67;1.07;0.98;-18.1;-18.1;-18.1;-33.42;;;;;Bolsa Mexicana de Valores;-;8;;;;;;;2025-09-21T22:13:39.934182;success;0;Alphabet, Inc. A;5.24;Taiwan Semiconductor Manufacturing Co., Ltd.;4.4;Visa;2.77;Mastercard, Inc.;2.16;Tencent Holdings Ltd.;2.02;AbbVie, Inc.;1.57;SAP SE;1.37;ASML Holding NV;1.3;Cisco Systems, Inc.;1.27;;;United States;47.4;Other;35.08;Japan;7.1;United Kingdom;4.39;;;Technology;35.22;Financials;14.44;Health Care;10.96;Industrials;9.76;;;London Stock Exchange;GBX;IGSG;;;;gettex;EUR;IUSL;;;;Stuttgart Stock Exchange;EUR;IUSL;;;;Bolsa Mexicana de Valores;MXN;-;IGSUN MM;IGSUN.MX;;Euronext Amsterdam;EUR;IGSG;IGSG NAINAVGSUE;IGSG.ASIGSGEINAV.DE;;London Stock Exchange;USD;IGSU;IGSU LNINAVGSUU;IGSU.LIGSGUINAV.DE;;London Stock Exchange;GBP;-;IGSG LNINAVGSUG;IGSG.LIGSGGINAV.DE;;XETRA;EUR;IUSL;IUSL GYINAVGSUU;IUSL.DEIGSGUINAV.DE;;;;;;;;;;;;;;3;62;6;13;13;10;20
IE00B58FQX63;UBS CMCI Composite SF UCITS ETF hCHF acc;https://www.justetf.com/en/etf-profile.html?isin=IE00B58FQX63;The UBS CMCI Composite SF UCITS ETF hCHF acc seeks to track the UBS CMCI (CHF Hedged) index. The UBS CMCI (CHF Hedged) index tracks commodities representing 5 broad sectors including energy, precious metals, base metals, agriculture and livestock. The index diversifies its futures across the maturity curve and thus offers constant maturities. Therewith, the index tries to minimise the risk of a negative roll yield. Currency hedged to Swiss Francs (CHF). The ETF's TER (total expense ratio) amounts to 0.34% p.a.. The ETF replicates the performance of the underlying index synthetically with a swap. The UBS CMCI Composite SF UCITS ETF hCHF acc has 340m Euro assets under management. The ETF was launched on 8 February 2011 and is domiciled in Ireland.;UBS CMCI Composite SF UCITS ETF HCHF ACC se snaží sledovat index UBS CMCI (CHF Hedged). Indexové skladby UBS CMCI (Hedged) UBS (CHF Hedged) představují komodity představující 5 širokých odvětví včetně energie, drahých kovů, základních kovů, zemědělství a hospodářských zvířat. Index diverzifikuje svou budoucnost přes křivku zralosti a nabízí tak konstantní splatnosti. S tím se index snaží minimalizovat riziko negativního výnosu role. Měna byla zajištěna švýcarským frankům (CHF). TER (celkový poměr nákladů) ETF činí 0,34% p.a. ETF replikuje výkon podkladového indexu synteticky s výměnou. UBS CMCI Composite SF UCITS ETF HCHF ACC má ve správě aktiva 340 milionů euro. ETF byl spuštěn 8. února 2011 a je se sídlem v Irsku.;0.34%;0.34;EUR 340m;340.0;EUR;CHF;Ireland;UBS ETF;8 February 2011;Accumulating;;Synthetic;UCITS;;Commodities, Broad market;;CHF    Currency risk  Currency;1;Komodity;False;Celosvětově;;6.14;3.44;86.9;4.41;3.36;-0.29;2.74;37.88;18.71;-0.57;0.01;13.5;13.03;14.14;16.07;0.47;0.08;0.83;-9.79;-10.4;-16.82;-62.03;;;;;SIX Swiss Exchange;CCCHA;1;;;;;;;2025-09-21T22:13:47.561034;success;0;;;;;;;;;;;;;;;;;;;;;;;;;;;;;;;;;;;;;;;;;SIX Swiss Exchange;CHF;CCCHA;CCCHAS SWICCCHASS;CCCHAS.SCCCHASCHFINAV=SOLA;;;;;;;;;;;;;;;;;;;;;;;;;;;;;;;;;;;;;;;;;;;;;;;;;;;;;;;;2;44;12;5;13;5;9
IE00B58HMN42;UBS CMCI Composite SF UCITS ETF hEUR acc;https://www.justetf.com/en/etf-profile.html?isin=IE00B58HMN42;The UBS CMCI Composite SF UCITS ETF hEUR acc seeks to track the UBS CMCI (EUR Hedged) index. The UBS CMCI (EUR Hedged) index tracks commodities representing sectors including energy, precious metals, base metals, agriculture and livestock. The index diversifies its futures across the maturity curve and thus offers constant maturities. Therewith, the index tries to minimise the risk of a negative roll yield. Currency hedged to Euro (EUR). The ETF's TER (total expense ratio) amounts to 0.34% p.a.. The ETF replicates the performance of the underlying index synthetically with a swap. The UBS CMCI Composite SF UCITS ETF hEUR acc has 242m Euro assets under management. The ETF was launched on 8 February 2011 and is domiciled in Ireland.;UBS CMCI Composite SF UCITS ETF HEUR ACC se snaží sledovat index UBS CMCI (EUR Hedged). Indexová indexová skladby UBS CMCI (EUR Hedged) Stojí komodity představující odvětví včetně energie, drahých kovů, základních kovů, zemědělství a hospodářských zvířat. Index diverzifikuje svou budoucnost přes křivku zralosti a nabízí tak konstantní splatnosti. S tím se index snaží minimalizovat riziko negativního výnosu role. Měna zajišťovala euro (EUR). TER (celkový poměr nákladů) ETF činí 0,34% p.a. ETF replikuje výkon podkladového indexu synteticky s výměnou. UBS CMCI Composite SF UCITS ETF HEUR ACC má ve správě aktiv 242 milionů EUR. ETF byl spuštěn 8. února 2011 a je se sídlem v Irsku.;0.34%;0.34;EUR 242m;242.0;EUR;EUR;Ireland;UBS ETF;8 February 2011;Accumulating;;Synthetic;UCITS;;Commodities, Broad market;;EUR    Currency risk  Currency;1;Komodity;False;Celosvětově;;7.4;6.16;72.49;5.21;2.34;-0.53;0.51;32.56;13.23;-4.46;3.37;-8.89;13.27;13.87;15.58;0.56;0.14;0.74;-10.25;-12.03;-19.98;-64.82;;;;;SIX Swiss Exchange;CCEUA;2;;;;;;;2025-09-21T22:13:53.373206;success;0;;;;;;;;;;;;;;;;;;;;;;;;;;;;;;;;;;;;;;;;;Borsa Italiana;EUR;CCEUAS;CCEUAS IMUETF0012;CCEUAS.MIICCEUASINAV=SOLA;;SIX Swiss Exchange;EUR;CCEUA;CCEUAS SWUETF0012;CCEUAS.SICCEUASINAV=SOLA;;;;;;;;;;;;;;;;;;;;;;;;;;;;;;;;;;;;;;;;;;;;;;;;;;2;47;12;5;13;5;12
IE00B58ZM503;UBS BBG Commodity Index SF UCITS ETF hEUR acc;https://www.justetf.com/en/etf-profile.html?isin=IE00B58ZM503;The UBS BBG Commodity Index SF UCITS ETF hEUR acc seeks to track the Bloomberg Commodity (EUR Hedged) index. The Bloomberg Commodity (EUR Hedged) index tracks the price of futures contracts on commodities, representing the following commodity sectors: energy, precious metals, industrial metals, livestock and agriculture. Currency hedged to Euro (EUR). The ETF's TER (total expense ratio) amounts to 0.19% p.a.. The ETF replicates the performance of the underlying index synthetically with a swap. The UBS BBG Commodity Index SF UCITS ETF hEUR acc is a small ETF with 29m Euro assets under management. The ETF was launched on 6 April 2011 and is domiciled in Ireland.;UBS BBG Commodity Index SF UCITS ETF HEUR ACC se snaží sledovat index Bloomberg Commodity (EUR Hedged). Index Bloomberg Commodity (EUR Hedged) sleduje cenu futures kontraktů na komodity, což představuje následující komoditní sektory: energie, drahé kovy, průmyslové kovy, hospodářská zvířata a zemědělství. Měna zajišťovala euro (EUR). ETF TER (celkový poměr nákladů) činí 0,19% p.a. ETF replikuje výkon podkladového indexu synteticky s výměnou. Index UBS BBG Commodity Index SF UCITS ETF Heur ACC je malý ETF s managementem 29 milionů euro. ETF byl spuštěn 6. dubna 2011 a má bydliště v Irsku.;0.19%;0.19;EUR 29m;29.0;EUR;EUR;Ireland;UBS ETF;6 April 2011;Accumulating;;Synthetic;UCITS;;Commodities, Broad market;;EUR    Currency risk  Currency;1;Komodity;False;Celosvětově;;10.25;-4.39;51.69;7.67;3.85;-1.51;-0.05;25.62;13.06;-10.4;3.28;-44.71;14.52;15.0;17.0;0.71;-0.1;0.51;-9.96;-17.18;-28.58;-70.46;;;;;Extracted (method 1);DCEUAS;0;;;;;;;2025-09-21T22:14:00.997819;success;0;;;;;;;;;;;;;;;;;;;;;;;;;;;;;;;;;;;;;;;;;;;;;;;;;;;;;;;;;;;;;;;;;;;;;;;;;;;;;;;;;;;;;;;;;;;;;;;;;;;;;2;44;17;1;13;5;8
IE00B598DX38;UBS BBG Commodity Index SF UCITS ETF hCHF acc;https://www.justetf.com/en/etf-profile.html?isin=IE00B598DX38;The UBS BBG Commodity Index SF UCITS ETF hCHF acc seeks to track the Bloomberg Commodity (CHF Hedged) index. The Bloomberg Commodity (CHF Hedged) index tracks the price of futures contracts on commodities, representing the following commodity sectors: energy, precious metals, industrial metals, livestock and agriculture. Currency hedged to Swiss Francs (CHF). The ETF's TER (total expense ratio) amounts to 0.19% p.a.. The ETF replicates the performance of the underlying index synthetically with a swap. The UBS BBG Commodity Index SF UCITS ETF hCHF acc is a small ETF with 71m Euro assets under management. The ETF was launched on 6 April 2011 and is domiciled in Ireland.;Index UBS BBG Commodity Index SF UCITS ETF HCHF ACC se snaží sledovat index Bloomberg Commodity (CHF Hedged). Index komodity Bloomberg (CHF Hedged) sleduje cenu futures kontraktů na komoditami, což představuje následující komoditní sektory: energie, drahé kovy, průmyslové kovy, hospodářská zvířata a zemědělství. Měna byla zajištěna švýcarským frankům (CHF). ETF TER (celkový poměr nákladů) činí 0,19% p.a. ETF replikuje výkon podkladového indexu synteticky s výměnou. UBS BBG Commodity Index SF UCITS ETF HCHF ACC je malý ETF s managementem 71 milionů euro. ETF byl spuštěn 6. dubna 2011 a má bydliště v Irsku.;0.19%;0.19;EUR 71m;71.0;EUR;CHF;Ireland;UBS ETF;6 April 2011;Accumulating;;Synthetic;UCITS;;Commodities, Broad market;;CHF    Currency risk  Currency;1;Komodity;False;Celosvětově;;8.95;-6.95;63.96;6.82;4.86;-1.28;2.13;30.74;18.38;-6.79;-0.12;-28.45;14.6;15.44;17.64;0.61;-0.15;0.59;-9.45;-18.26;-24.09;-67.71;;;;;Extracted (method 1);DCCHAS;0;;;;;;;2025-09-21T22:14:06.576883;success;0;;;;;;;;;;;;;;;;;;;;;;;;;;;;;;;;;;;;;;;;;;;;;;;;;;;;;;;;;;;;;;;;;;;;;;;;;;;;;;;;;;;;;;;;;;;;;;;;;;;;;2;44;17;1;13;5;8
IE00B5993T22;UBS BBG Commodity Index SF UCITS ETF hGBP acc;https://www.justetf.com/en/etf-profile.html?isin=IE00B5993T22;The UBS BBG Commodity Index SF UCITS ETF hGBP acc seeks to track the Bloomberg Commodity (GBP Hedged) index. The Bloomberg Commodity (GBP Hedged) index tracks the price of futures contracts on commodities, representing the following commodity sectors: energy, precious metals, industrial metals, livestock and agriculture. Currency hedged to British Pound (GBP). The ETF's TER (total expense ratio) amounts to 0.19% p.a.. The ETF replicates the performance of the underlying index synthetically with a swap. The UBS BBG Commodity Index SF UCITS ETF hGBP acc is a very small ETF with 3m Euro assets under management. The ETF was launched on 6 April 2011 and is domiciled in Ireland.;UBS BBG Commodity Index SF UCITS ETF HGBP ACC se snaží sledovat index Bloomberg Commodity (GBP Hedged). Index komodity Bloomberg (GBP Hedged) sleduje cenu futures kontraktů na komodity, což představuje následující komoditní odvětví: energie, drahé kovy, průmyslové kovy, hospodářská zvířata a zemědělství. Měna zajišťovala britskou libru (GBP). ETF TER (celkový poměr nákladů) činí 0,19% p.a. ETF replikuje výkon podkladového indexu synteticky s výměnou. Index UBS BBG Commodity Index SF UCITS ETF HGBP ACC je velmi malý ETF s managementem 3M euro. ETF byl spuštěn 6. dubna 2011 a má bydliště v Irsku.;0.19%;0.19;EUR 3m;3.0;EUR;GBP;Ireland;UBS ETF;6 April 2011;Accumulating;;Synthetic;UCITS;;Commodities, Broad market;;GBP    Currency risk  Currency;1;Komodity;False;Celosvětově;;9.16;1.35;69.92;4.12;3.57;-2.69;-2.1;35.19;8.1;-6.77;9.66;-37.9;14.94;16.44;18.68;0.61;0.03;0.6;-12.66;-15.22;-28.26;-70.66;;;;;Extracted (method 1);DCGBAS;0;;;;;;;2025-09-21T22:14:14.053902;success;0;;;;;;;;;;;;;;;;;;;;;;;;;;;;;;;;;;;;;;;;;;;;;;;;;;;;;;;;;;;;;;;;;;;;;;;;;;;;;;;;;;;;;;;;;;;;;;;;;;;;;2;45;17;1;13;5;9
IE00B5B3W843;UBS BBG Commodity Index SF UCITS ETF USD acc;https://www.justetf.com/en/etf-profile.html?isin=IE00B5B3W843;The UBS BBG Commodity Index SF UCITS ETF USD acc seeks to track the Bloomberg Commodity index. The Bloomberg Commodity index tracks the price of futures contracts on commodities, representing the following commodity sectors: energy, precious metals, industrial metals, livestock and agriculture. The ETF's TER (total expense ratio) amounts to 0.19% p.a.. The ETF replicates the performance of the underlying index synthetically with a swap. The UBS BBG Commodity Index SF UCITS ETF USD acc is a small ETF with 91m Euro assets under management. The ETF was launched on 1 February 2011 and is domiciled in Ireland.;UBS BBG Commodity Index SF UCITS ETF USD ACC se snaží sledovat index komodit Bloomberg. Index komodit Bloomberg sleduje cenu futures kontraktů na komodity, což představuje následující komoditní odvětví: energie, drahé kovy, průmyslové kovy, hospodářská zvířata a zemědělství. ETF TER (celkový poměr nákladů) činí 0,19% p.a. ETF replikuje výkon podkladového indexu synteticky s výměnou. Index UBS BBG Commodity Index SF UCITS ETF USD ACC je malý ETF s spravováním 91 milionů euro. ETF byl spuštěn 1. února 2011 a je se sídlem v Irsku.;0.19%;0.19;EUR 91m;91.0;EUR;USD;Ireland;UBS ETF;1 February 2011;Accumulating;;Synthetic;UCITS;;Commodities, Broad market;;USD    Currency risk  Currency;1;Komodity;False;Celosvětově;;5.73;-13.26;66.58;-4.39;2.92;-3.53;-6.85;37.32;23.1;-11.24;12.08;-11.12;14.76;14.15;16.25;0.39;-0.33;0.66;-15.58;-22.29;-26.86;-56.04;;;;;Extracted (method 1);DCUSAS;0;;;;;;;2025-09-21T22:14:21.426029;success;0;;;;;;;;;;;;;;;;;;;;;;;;;;;;;;;;;;;;;;;;;;;;;;;;;;;;;;;;;;;;;;;;;;;;;;;;;;;;;;;;;;;;;;;;;;;;;;;;;;;;;2;44;17;1;13;5;8
IE00B5B5TG76;Invesco EURO STOXX 50 UCITS ETF Dist;https://www.justetf.com/en/etf-profile.html?isin=IE00B5B5TG76;The Invesco EURO STOXX 50 UCITS ETF Dist seeks to track the EURO STOXX® 50 index. The EURO STOXX® 50 index tracks the 50 largest companies in the eurozone. The ETF's TER (total expense ratio) amounts to 0.05% p.a.. The Invesco EURO STOXX 50 UCITS ETF Dist is the cheapest ETF that tracks the EURO STOXX® 50 index. The ETF replicates the performance of the underlying index synthetically with a swap. The dividends in the ETF are distributed to the investors (Semi annually). The Invesco EURO STOXX 50 UCITS ETF Dist is a small ETF with 47m Euro assets under management. The ETF was launched on 25 November 2009 and is domiciled in Ireland.;Invesco Euro Stoxx 50 UCITS ETF Dist se snaží sledovat index Euro Stoxx® 50. Index Euro Stoxx® 50 sleduje 50 největších společností v eurozóně. TER (celkový poměr nákladů) ETF činí 0,05% P.A .. Invesco Euro Stoxx 50 UCITS ETF Dist je nejlevnější ETF, který sleduje index Euro Stoxx® 50. ETF replikuje výkon podkladového indexu synteticky s výměnou. dividenday v ETF jsou distribuovány investorům (polo každoročně). Invesco Euro Stoxx 50 UCITS ETF Dist je malý ETF s managementem 47 milionů euro. ETF byl spuštěn 25. listopadu 2009 a je se sídlem v Irsku.;0.05%;0.05;EUR 47m;47.0;EUR;EUR;Ireland;Invesco;25 November 2009;Distributing;Semi annually;Synthetic (Unfunded swap);UCITS;;Equity, Europe;;EUR    Currency risk  Currency;1;Akcie;False;Evropa;;13.68;70.1;90.57;14.42;-0.3;5.33;1.52;23.57;-9.08;22.72;11.48;204.46;17.01;15.22;17.27;0.8;1.27;0.8;-16.44;-16.44;-23.39;-38.26;;;;;London Stock Exchange;OSX5;7;3.04%;3.04;EUR 1.62;1.62;EUR;method2_regex;2025-09-21T22:14:28.490361;success;0;;;;;;;;;;;;;;;;;;;;;;;;;;;;;;;;;;;;;;;;;London Stock Exchange;EUR;OSX5;;;;gettex;EUR;S6X0;;;;Stuttgart Stock Exchange;EUR;S6X0;;;;London Stock Exchange;CHF;OSXF;;;;Borsa Italiana;EUR;SDJE5D;SDJE5D IMSDJE5DIN;PSSE5D.MISDJE5DINAV.DE;;SIX Swiss Exchange;EUR;SX5D;SX5D SWSDJE5DIN;SX5D.SSDJE5DINAV.DE;;XETRA;EUR;S6X0;SDJE5D GYSDJE5DIN;SDJE5D.DESDJE5DINAV.DE;;;;;;;;;;;;;;;;;;;;5;76;30;1;15;10;20
IE00B5BD5K76;HSBC MSCI Europe UCITS ETF EUR;https://www.justetf.com/en/etf-profile.html?isin=IE00B5BD5K76;The HSBC MSCI Europe UCITS ETF EUR seeks to track the MSCI Europe index. The MSCI Europe index tracks the leading stocks from 15 European industrial countries. The ETF's TER (total expense ratio) amounts to 0.10% p.a.. The ETF replicates the performance of the underlying index by full replication (buying all the index constituents). The dividends in the ETF are distributed to the investors (Semi annually). The HSBC MSCI Europe UCITS ETF EUR has 290m Euro assets under management. The ETF was launched on 1 June 2010 and is domiciled in Ireland.;HSBC MSCI Europe UCITS ETF EUR se snaží sledovat index MSCI Europe. Index MSCI Europe sleduje přední akciíy z 15 evropských průmyslových zemí. TER (celkový poměr výdajů) ETF činí 0,10% p.a. ETF replikuje výkon podkladového indexu plnou replikací (nákup všech indexových složek). dividenday v ETF jsou distribuovány investorům (polo každoročně). HSBC MSCI Europe UCITS ETF EUR má ve správě aktiv 290 milionů EUR. ETF byla spuštěna 1. června 2010 a je bydliště v Irsku.;0.10%;0.1;EUR 290m;290.0;EUR;EUR;Ireland;HSBC ETF;1 June 2010;;Semi annually;Physical;UCITS;MSCI Europe;Equity, Europe;;EUR    Currency risk  Currency;1;Akcie;False;Evropa;402.0;9.2;47.44;74.67;11.85;-0.37;3.75;1.77;25.45;-9.26;16.14;8.82;237.74;13.98;12.42;13.9;0.66;1.11;0.85;-16.24;-16.24;-19.29;-35.24;;;;;London Stock Exchange;-;8;2.77%;2.77;EUR 0.52;0.52;EUR;method2_regex;2025-09-21T22:14:34.934998;success;0;ASML Holding NV;2.26;AstraZeneca PLC;1.9;Nestlé SA;1.87;Roche Holding AG;1.81;Novartis AG;1.81;HSBC Holdings Plc;1.76;Shell Plc;1.75;Siemens AG;1.6;Novo Nordisk A/S;1.27;;;Other;33.93;United Kingdom;21.08;France;15.43;Germany;15.42;Switzerland;14.14;Financials;22.34;IT;21.08;Industrials;18.59;Health Care;10.45;Consumer Staples;9.97;London Stock Exchange;GBX;HMEU;;;;gettex;EUR;H4ZE;;;;Borsa Italiana;EUR;HMEU;HMEU IMHEUEUIV;HMEU.MIHEUEUiv.P;;Euronext Paris;EUR;HEU;HEU FPHMEUEURI;HEU.PAHMEUINAVEUR=HSBL;;London Stock Exchange;GBP;-;HMEU LNHMEUGBPI;HMEU.LHMEUINAVGBP=HSBL;;SIX Swiss Exchange;USD;HMEU;HMEU SWHMEUUSDI;HMEU.SHMEUINAVUSD=HSBL;;SIX Swiss Exchange;EUR;HMEU;HMEUEUR SWHMEUEURI;HMEUS.SHMEUINAVEUR=HSBL;;XETRA;EUR;H4ZE;H4ZE GYHMEUEURI;H4ZE.DEHMEUINAVEUR=HSBL;;;;;;;;;;;;;;4;71;26;5;15;5;20
IE00B5BMR087;iShares Core S&P 500 UCITS ETF USD (Acc);https://www.justetf.com/en/etf-profile.html?isin=IE00B5BMR087;The iShares Core S&P 500 UCITS ETF USD (Acc) seeks to track the S&P 500® index. The S&P 500® index tracks the 500 largest US stocks. The ETF's TER (total expense ratio) amounts to 0.07% p.a.. The iShares Core S&P 500 UCITS ETF USD (Acc) is the largest ETF that tracks the S&P 500® index. The ETF replicates the performance of the underlying index by full replication (buying all the index constituents). The dividends in the ETF are accumulated and reinvested in the ETF. The iShares Core S&P 500 UCITS ETF USD (Acc) is a very large ETF with 108,538m Euro assets under management. The ETF was launched on 19 May 2010 and is domiciled in Ireland.;Ishares Core S&P 500 UCITS ETF USD (ACC) se snaží sledovat index S&P 500®. Index S&P 500® sleduje 500 největších amerických akcií. TER (celkový poměr nákladů) činí 0,07% p.a. Core Core S&P 500 UCITS ETF USD (ACC) je největší ETF, který sleduje index S&P 500®. ETF replikuje výkon podkladového indexu plnou replikací (nákup všech složek indexu). dividenday v ETF jsou akumulovány a reinvestovány do ETF. IShares Core S&P 500 UCITS ETF USD (ACC) je velmi velký ETF s 108 538 mil. EUR. ETF byl spuštěn 19. května 2010 a je se sídlem v Irsku.;0.07%;0.07;EUR 108538m;108538.0;EUR;USD;Ireland;iShares;19 May 2010;Accumulating;;Physical;UCITS;S&P 500;Equity, United States;;USD    Currency risk  Currency;1;Akcie;False;Severní Amerika;503.0;11.47;51.61;114.04;0.56;3.05;9.08;9.05;39.07;-13.3;21.54;32.62;683.68;19.89;17.55;17.84;0.58;0.85;0.92;-22.6;-22.6;-22.6;-33.71;;;;;Euronext Amsterdam;CSPX;10;;;;;;;2025-09-21T22:14:39.984322;success;0;Microsoft;7.37;Apple;5.76;Amazon.com, Inc.;4.11;Meta Platforms;3.12;Broadcom;2.57;Alphabet, Inc. A;2.08;Alphabet, Inc. C;1.68;Berkshire Hathaway, Inc.;1.61;Tesla;1.61;;;United States;95.78;Other;2.83;;;;;;;Technology;36.3;Financials;10.98;Consumer Discretionary;10.53;;;;;London Stock Exchange;GBX;CSP1;;;;gettex;EUR;SXR8;;;;Stuttgart Stock Exchange;EUR;SXR8;;;;Bolsa Mexicana de Valores;MXN;-;CSPX MM;CSPXN.MX;;Borsa Italiana;EUR;CSSPX;CSSPX IMIXM0461;CSSPX.MIIXM0461.DE;;Euronext Amsterdam;EUR;CSPX;CSPX NAIXM0461;CSPX.ASIXM0461.DE;;London Stock Exchange;USD;CSPX;CSPX LNIXM046;CSPX.LIXM046.DE;;London Stock Exchange;GBP;-;CSP1 LNIXM0462;CSP1.L;;SIX Swiss Exchange;USD;CSSPX;CSSPX SEIXM046;CSSPX.SIXM046.DE;;XETRA;EUR;SXR8;SXR8 GYIXM0461;SXR8.DEIXM0461.DE;;5;96;26;25;15;10;20
IE00B5KQNG97;HSBC S&P 500 UCITS ETF USD;https://www.justetf.com/en/etf-profile.html?isin=IE00B5KQNG97;The HSBC S&P 500 UCITS ETF USD seeks to track the S&P 500® index. The S&P 500® index tracks the 500 largest US stocks. The ETF's TER (total expense ratio) amounts to 0.09% p.a.. The ETF replicates the performance of the underlying index by full replication (buying all the index constituents). The dividends in the ETF are distributed to the investors (Semi annually). The HSBC S&P 500 UCITS ETF USD is a very large ETF with 6,688m Euro assets under management. The ETF was launched on 14 May 2010 and is domiciled in Ireland.;HSBC S&P 500 UCITS ETF USD se snaží sledovat index S&P 500®. Index S&P 500® sleduje 500 největších amerických akcií. TER (celkový poměr nákladů) ETF činí 0,09% p.a. ETF replikuje výkon podkladového indexu plnou replikací (nákup všech složek indexu). dividenday v ETF jsou distribuovány investorům (polo každoročně). HSBC S&P 500 UCITS ETF USD je velmi velký ETF s managementem 6 688 milionů euro. ETF byl spuštěn 14. května 2010 a je se sídlem v Irsku.;0.09%;0.09;EUR 6688m;6688.0;EUR;USD;Ireland;HSBC ETF;14 May 2010;;Semi annually;Physical;UCITS;S&P 500;Equity, United States;;USD    Currency risk  Currency;1;Akcie;False;Severní Amerika;502.0;11.36;50.63;113.92;0.46;2.94;8.92;8.94;39.08;-13.47;21.71;32.62;685.91;19.98;17.63;17.97;0.57;0.83;0.91;-22.63;-22.63;-22.63;-33.73;;;;;London Stock Exchange;-;8;1.00%;1.0;EUR 0.57;0.57;EUR;method2_regex;2025-09-21T22:14:45.029212;success;0;Microsoft;7.38;Apple;5.77;Amazon.com, Inc.;4.11;Meta Platforms;3.13;Broadcom;2.57;Alphabet, Inc. A;2.08;Alphabet, Inc. C;1.68;Berkshire Hathaway, Inc.;1.61;Tesla;1.61;;;United States;95.84;Other;2.77;;;;;;;Technology;36.34;Financials;11.01;Consumer Discretionary;10.54;;;;;London Stock Exchange;GBX;HSPX;;;;gettex;EUR;H4ZF;;;;Borsa Italiana;EUR;HSPD;HSPD IMHSPXEURI;HSPD.MIHSPXINAVEUR=HSBL;;Euronext Paris;EUR;HHH;HHH FPHSPXEURI;HHH.PAHSPXINAVEUR=HSBL;;London Stock Exchange;USD;HSPD;HSPD LNHSPXUSDI;HSPD.LHSPXINAVUSD=HSBL;;London Stock Exchange;GBP;-;HSPX LNHSPXGBPI;HSPX.LHSPXINAVGBP=HSBL;;SIX Swiss Exchange;USD;HSPX;HSPX SWHSPXUSDI;HSPX.SHSPXINAVUSD=HSBL;;XETRA;EUR;H4ZF;H4ZF GYHSPXEURI;H4ZF.DEHSPXINAVEUR=HSBL;;;;;;;;;;;;;;5;82;26;16;15;5;20
