IE0001FQFU60;Amundi MSCI World Momentum Advanced UCITS ETF Acc;https://www.justetf.com/en/etf-profile.html?isin=IE0001FQFU60;The Amundi MSCI World Momentum Advanced UCITS ETF Acc seeks to track the MSCI World Momentum Advanced Target index. The MSCI World Momentum Advanced Target index tracks stocks from developed countries worldwide which are selected according to the momentum factor strategy and ESG criteria (environmental, social and corporate governance). The index targets a reduction in greenhouse gas emissions and an improved ESG score compared to the benchmark index. The benchmark index is the MSCI World index. The ETF's TER (total expense ratio) amounts to 0.25% p.a.. The Amundi MSCI World Momentum Advanced UCITS ETF Acc is the only ETF that tracks the MSCI World Momentum Advanced Target index. The ETF replicates the performance of the underlying index by full replication (buying all the index constituents). The dividends in the ETF are accumulated and reinvested in the ETF. The ETF was launched on 30 October 2024 and is domiciled in Ireland.;Amundi MSCI World Momentum Advanced UCITS ETF ACC se snaží sledovat index momentu MSCI World Momentum Advanced Target Index. MSCI World Momentum Advanced Target Index sleduje akcie z rozvinutých zemí po celém světě, které jsou vybírány podle strategie hybného faktoru a kritéria ESG (environmentální, sociální a správa a řízení). Index se zaměřuje na snížení emisí skleníkových plynů a zlepšené skóre ESG ve srovnání s indexem benchmarku. Index benchmark je index MSCI World. TER (celkový poměr výdajů) ETF činí 0,25% p.a. Amundi MSCI World Momentum Advanced UCITS ETF ACC je jediným ETF, který sleduje index cílového momentu MSCI World Momentum. ETF replikuje výkon podkladového indexu plnou replikací (nákup všech složek indexu). dividenday v ETF jsou akumulovány a reinvestovány do ETF. ETF byla zahájena 30. října 2024 a je v Irsku bydliště.;0.25%;0.25;;;;USD;Ireland;Amundi;30 October 2024;Accumulating;;Physical;;MSCI World;Equity, World, Momentum;Yes;Akcie;False;Globální;180.0;;;;7.85;;;;;;;;;;;;;;;gettex;WMSE;3;;;;;;;2025-09-18T15:35:15.452476;success;0;Nvidia;6.33;Microsoft;2.58;Apple;2.22;;;;;;;;;;;;;;;United States;52.6;Other;29.22;Japan;6.79;Germany;6.07;;;Financials;27.04;Technology;24.71;Consumer Discretionary;8.52;;;;;gettex;EUR;WMSE;;;;XETRA;EUR;WMSE;WMSE GYWMSEEUIV;WMSE.DEIWMSEEURINAV=SOLA;;XETRA;GBP;WMSF;WMSF GYWMSEGBIV;WMSEGBP.DEIWMSEGBPINAV=SOLA;;;;;;;;;;;;;;;;;;;;
CH1390861214;Leonteq CHF Overnight Return Index ETP;https://www.justetf.com/en/etf-profile.html?isin=CH1390861214;The Leonteq CHF Overnight Return Index ETP seeks to track the Leonteq CHF Overnight Return index. The Leonteq CHF Overnight Return index tracks the Swiss money market and returns 1/360 of the reference interest rate Swiss Average Rate Overnight Zinssatz (SARON) per calendar day. The ETN's TER (total expense ratio) amounts to 0.10% p.a.. The Leonteq CHF Overnight Return Index ETP is the only ETN that tracks the Leonteq CHF Overnight Return index. The ETN replicates the performance of the underlying index synthetically with a swap. The ETN was launched on 4 November 2024 and is domiciled in Switzerland.;Leonteq CHF přes noc index návratu ETP se snaží sledovat index návratu Leonteq CHF přes noc. Index Leonteq CHF přes noc sleduje švýcarský peněžní trh a vrací 1/360 referenční úrokové sazby Swiss Průměrná sazba přes noc Zinssatz (Saron) za kalendářní den. ETN TER (celkový poměr nákladů) činí 0,10% p.a. Leonteq CHF přes noc index návratu ETP je jediný ETN, který sleduje index Leonteq CHF přes noc. ETN replikuje výkon podkladového indexu synteticky s výměnou. ETN byl spuštěn 4. listopadu 2024 a je se sídlem ve Švýcarsku.;0.10%;0.1;;;;CHF;Switzerland;;4 November 2024;;;Synthetic;;;Money Market, CHF;;Ostatní;False;Ostatní;;;;;;;;;;;;;;;;;;;;XETRA;ONCC;1;;;;;;;2025-09-18T15:35:22.378387;success;0;;;;;;;;;;;;;;;;;;;;;;;;;;;;;;;;;;;;;;;;;XETRA;CHF;ONCC;;;;;;;;;;;;;;;;;;;;;;;;;;;;;;;;;;
IE000UZZ5D45;Amundi MSCI World Small Cap ESG Broad Transition UCITS ETF Acc;https://www.justetf.com/en/etf-profile.html?isin=IE000UZZ5D45;The Amundi MSCI World Small Cap ESG Broad Transition UCITS ETF Acc seeks to track the MSCI World Small Cap ESG Broad CTB Select index. The MSCI World Small Cap ESG Broad CTB Select index tracks small cap companies from developed markets worldwide. Securities are selected and weighted according to sustainability criteria and EU directives on climate protection. The parent index is the MSCI World Small Cap. The ETF's TER (total expense ratio) amounts to 0.25% p.a.. The Amundi MSCI World Small Cap ESG Broad Transition UCITS ETF Acc is the only ETF that tracks the MSCI World Small Cap ESG Broad CTB Select index. The ETF replicates the performance of the underlying index by full replication (buying all the index constituents). The dividends in the ETF are accumulated and reinvested in the ETF. The ETF was launched on 30 October 2024 and is domiciled in Ireland.;Svět amundi MSCI Světový malý čepice ESG Broad Transition UCITS ETF ACC se snaží sledovat index MSCI World Small CAP ESG Broad CTB Select Index. Světový MSCI World Small CAP ESG Broad CTB Select Index skladby malé kapitálové společnosti z rozvinutých trhů po celém světě. Cenné papíry jsou vybírány a váženy podle kritérií udržitelnosti a směrnic EU o ochraně klimatu. Rodičovským indexem je malá čepice MSCI. TER (celkový poměr nákladů) ETF činí 0,25% p.a. ETF replikuje výkon podkladového indexu plnou replikací (nákup všech složek indexu). dividenday v ETF jsou akumulovány a reinvestovány do ETF. ETF byla zahájena 30. října 2024 a je v Irsku bydliště.;0.25%;0.25;;;;USD;Ireland;Amundi;30 October 2024;Accumulating;;Physical;;MSCI World;Equity, World, Small Cap;Yes;Akcie;False;Globální;1761.0;;;;0.52;;;;;;;;;;;;;;;gettex;WMFS;3;;;;;;;2025-09-18T15:35:29.590041;success;0;;;;;;;;;;;;;;;;;;;;;United States;52.94;Other;25.87;Japan;11.71;United Kingdom;5.85;Australia;3.63;Industrials;19.24;Financials;14.45;Technology;13.0;Consumer Discretionary;12.97;;;gettex;EUR;WMFS;;;;XETRA;EUR;WMFS;WMFS GYWMFSEUIV;WMFS.DEIWMFSEURINAV=SOLA;;XETRA;GBP;WMFT;WMFT GYWMFSGBIV;WMFSGBP.DEIWMFSGBPINAV=SOLA;;;;;;;;;;;;;;;;;;;;
IE000IEGVMH6;Amundi Core MSCI USA UCITS ETF Dist;https://www.justetf.com/en/etf-profile.html?isin=IE000IEGVMH6;The Amundi Core MSCI USA UCITS ETF Dist seeks to track the MSCI USA index. The MSCI USA index tracks the leading stocks on the US market. The ETF's TER (total expense ratio) amounts to 0.03% p.a.. The Amundi Core MSCI USA UCITS ETF Dist is the cheapest ETF that tracks the MSCI USA index. The ETF replicates the performance of the underlying index by full replication (buying all the index constituents). The dividends in the ETF are distributed to the investors (Annually). The ETF was launched on 5 February 2019 and is domiciled in Ireland.;Amundi Core MSCI USA UCITS ETF Dist se snaží sledovat index MSCI USA. Index MSCI USA sleduje přední akciíy na americkém trhu. TER (celkový poměr nákladů) ETF činí 0,03% p.a. Amundi Core MSCI USA UCITS ETF Dist je nejlevnější ETF, který sleduje index MSCI USA. ETF replikuje výkon podkladového indexu plnou replikací (nákup všech složek indexu). dividenday v ETF jsou distribuovány investorům (každoročně). ETF byl spuštěn 5. února 2019 a je sídlem v Irsku.;0.03%;0.03;;;;USD;Ireland;Amundi;5 February 2019;Distributing;Annually;Physical;;MSCI USA  Dist;Equity, United States;;Akcie;False;US;543.0;11.99;46.6;96.94;-0.67;20.54;17.72;18.18;0.58;0.77;0.8;-23.28;-23.28;-23.28;;;;;;Borsa Italiana;-;6;0.90%;0.9;EUR 0.39;0.39;EUR;method2_regex;2025-09-18T15:35:35.600613;success;0;Nvidia;7.65;Microsoft;6.51;Apple;5.79;Amazon;4.0;Meta;2.83;Alphabet;2.02;Tesla;1.59;JPMorgan;1.5;;;;;United States;95.21;Other;3.21;;;;;;;Technology;35.69;Financials;10.88;Consumer Discretionary;10.71;;;;;Borsa Italiana;EUR;ETFUSA;;;;gettex;EUR;WEBI;;;;Borsa Italiana;EUR;-;ETFUSA IMIPR1UEIV;ETFUSA.MIIPR1UEURINAV=SOLA;;London Stock Exchange;GBP;MSCU;MSCU LNIPR1UGIV;MSCU.LIPR1UGBPINAV=SOLA;;XETRA;GBP;WEBM;WEBM GYIPR1UGIV;WEBIGBP.DEIPR1UGBPINAV=SOLA;;4.0;69.0;30.0;1.0;8.0;10.0;20.0
DE000ETC0696;SG ETC Brent Crude Oil Futures-Kontrakt;https://www.justetf.com/en/etf-profile.html?isin=DE000ETC0696;The SG ETC Brent Crude Oil Futures-Kontrakt seeks to track the Brent Crude Oil Futures index. The product tracks the price of futures contracts on Brent Crude Oil. The ETC's TER (total expense ratio) amounts to 0.90% p.a.. The SG ETC Brent Crude Oil Futures-Kontrakt is the only ETC that tracks the Brent Crude Oil Futures index. The ETC replicates the performance of the underlying index synthetically with a swap. The ETC was launched on 9 December 2022 and is domiciled in Germany.;SG atd. Brent Crude Oil Futures-Konntrakt se snaží sledovat index futures na ropu Brent. Produkt sleduje cenu futures kontraktů na ropu Brent. TER (celkový poměr nákladů) ETC činí 0,90% P.A .. SG atd. Brent Fude Oil Futures-Konntrakt je jediný atd., Který sleduje index futures na ropu Brent. ETC replikuje výkon podkladového indexu synteticky s výměnou. ETC bylo zahájeno 9. prosince 2022 a má bydliště v Německu.;0.90%;0.9;;;;EUR;Germany;;9 December 2022;;;Synthetic;;;Commodities, Energy, Crude Oil;;Komodity;False;Globální;;0.45;;;-9.64;31.94;;;0.01;;;-30.33;;;;;;;;XETRA;SGS2;1;;;;;;;2025-09-18T15:35:42.043740;success;0;;;;;;;;;;;;;;;;;;;;;;;;;;;;;;;;;;;;;;;;;XETRA;EUR;SGS2;;;;;;;;;;;;;;;;;;;;;;;;;;;;;;;;;;
CH1390861305;Leonteq USD Overnight Return Index (EUR) ETP;https://www.justetf.com/en/etf-profile.html?isin=CH1390861305;The Leonteq USD Overnight Return Index (EUR) ETP seeks to track the Leonteq USD Overnight Return (EUR Hedged) index. The Leonteq USD Overnight Return (EUR Hedged) index tracks the US money market and returns 1/360 of the reference interest rate United States Secured Overnight Financing Rate (US-SOFR) per calendar day. Currency hedged to Euro (EUR). The ETN's TER (total expense ratio) amounts to 0.10% p.a.. The Leonteq USD Overnight Return Index (EUR) ETP is the only ETN that tracks the Leonteq USD Overnight Return (EUR Hedged) index. The ETN replicates the performance of the underlying index synthetically with a swap. The ETN was launched on 4 November 2024 and is domiciled in Switzerland.;Leonteq USD přes noc index návratnosti (EUR) ETP se snaží sledovat index Leonteq USD přes noc (EUR Hedged). Index Leonteq USD přes noc (Hedged) sleduje peněžní trh v USA a vrací 1/360 referenční úrokové sazby Spojené státy zajištěné mírou financování přes noc (US-SOFR) za kalendářní den. Měna zajišťovala euro (EUR). ETN TER (celkový poměr nákladů) činí 0,10% P.A .. Leonteq USD přes noc index návratnosti (EUR) ETP je jediný ETN, který sleduje index Leonteq USD přes noc (EUR Hedged). ETN replikuje výkon podkladového indexu synteticky s výměnou. ETN byl spuštěn 4. listopadu 2024 a je se sídlem ve Švýcarsku.;0.10%;0.1;;;;EUR;Switzerland;;4 November 2024;;;Synthetic;;;Money Market, USD;;Ostatní;False;Ostatní;;;;;-9.26;;;;;;;;;;;;;;;XETRA;ONUE;1;;;;;;;2025-09-18T15:35:48.487407;success;0;;;;;;;;;;;;;;;;;;;;;;;;;;;;;;;;;;;;;;;;;XETRA;EUR;ONUE;;;;;;;;;;;;;;;;;;;;;;;;;;;;;;;;;;
