IE00BQN1K562;iShares Edge MSCI Europe Quality Factor UCITS ETF;https://www.justetf.com/en/etf-profile.html?isin=IE00BQN1K562;"The iShares Edge MSCI Europe Quality Factor UCITS ETF seeks to track the MSCI Europe Sector Neutral Quality index. The MSCI Europe Sector Neutral Quality index tracks stocks with a high quality factor from Europe. The constituents are selected by three main equally weighted indicators of whether a company is demonstrating high quality characteristics: high percentage of company earnings allocated to shareholders; low levels of debt; and low year on year earnings variability. The ETF's TER (total expense ratio) amounts to 0.25% p.a.. The iShares Edge MSCI Europe Quality Factor UCITS ETF is the cheapest and largest ETF that tracks the MSCI Europe Sector Neutral Quality index. The ETF replicates the performance of the underlying index by sampling technique (buying a selection of the most relevant index constituents). The dividends in the ETF are accumulated and reinvested in the ETF. The iShares Edge MSCI Europe Quality Factor UCITS ETF has 448m Euro assets under management. The ETF was launched on 16 January 2015 and is domiciled in Ireland.";"Ishares Edge MSCI Europe Europe Factor UCITS ETF se snaží sledovat index neutrální kvality sektoru MSCI Europe. Index neutrální kvality sektoru MSCI Europe sleduje akcie s vysoce kvalitním faktorem z Evropy. Složky jsou vybírány třemi hlavními stejně váženými ukazateli toho, zda společnost prokazuje vysoce kvalitní charakteristiky: vysoké procento výdělků společnosti přidělených akcionářům; nízká úroveň dluhu; a nízká roční variabilita příjmů. TER (celkový poměr nákladů) činí 0,25% p.a. Ishares Edge MSCI Europe Factor UCITS ETF je nejlevnější a největší ETF, který sleduje index neutrální kvality sektoru MSCI Europe. ETF replikuje výkon základního indexu technikou vzorkování (nákup výběru nejdůležitějších složek indexu). dividenday v ETF jsou akumulovány a reinvestovány do ETF. Ishares Edge MSCI Europe Europe Factor UCITS ETF má 448 milionů euro aktiv pod správou. ETF byl spuštěn 16. ledna 2015 a je se sídlem v Irsku.";0.25%;0.25;EUR 448m;448.0;EUR;EUR;Ireland;iShares;16 January 2015;;;Physical;UCITS;MSCI Europe;Equity, Europe,;;EUR    Currency risk  Currency;1;Akcie;False;Evropa;126.0;1.73;33.54;54.37;4.33;-0.28;0.38;-1.3;27.44;-12.53;15.03;4.42;109.29;13.43;12.45;13.81;0.13;0.81;0.66;-14.73;-14.73;-19.86;-33.33;;;;;Bolsa Mexicana de Valores;-;9;;;;;;;2025-09-24T02:36:46.853991;success;0;Allianz SE;3.99;Shell Plc;3.71;ABB Ltd.;3.18;Roche Holding AG;3.17;Nestlé SA;2.93;RELX;2.88;AstraZeneca PLC;2.85;Zurich Insurance Group AG;2.84;Novartis AG;2.78;;;Other;30.62;United Kingdom;24.47;Switzerland;22.98;Germany;11.34;Netherlands;10.59;Financials;21.09;Industrials;18.62;Health Care;10.9;Consumer Staples;9.7;;;London Stock Exchange;GBX;IEFQ;;;;gettex;EUR;CEMQ;;;;Stuttgart Stock Exchange;EUR;CEMQ;;;;Bolsa Mexicana de Valores;MXN;-;CEMQN MM;CEMQN.MX;;Borsa Italiana;EUR;IEQU;IEQU IMINAVEQUE;0J1NINAV.DE;;London Stock Exchange;GBP;-;IEFQ LNINAVEQUG;IEFQ.L0J1QINAV.DE;;London Stock Exchange;EUR;IEQU;IEQU LNINAVEQUE;IEQU.L;;SIX Swiss Exchange;EUR;IEQU;IEQU SEINAVEQUE;IEQU.S0J1NINAV.DE;;XETRA;EUR;CEMQ;CEMQ GYINAVEQUE;CEMQ.DE0J1NINAV.DE;;;;;;;;4;65;17;5;13;10;20
IE00BQN1K786;iShares Edge MSCI Europe Momentum Factor UCITS ETF;https://www.justetf.com/en/etf-profile.html?isin=IE00BQN1K786;The iShares Edge MSCI Europe Momentum Factor UCITS ETF seeks to track the MSCI Europe Momentum index. The MSCI Europe Momentum index tracks stocks with a high price momentum from Europe. The index consists of titles that have experienced price increases over the past 6 and past 12 months with the assumption that increases will continue in the future. The ETF's TER (total expense ratio) amounts to 0.25% p.a.. The iShares Edge MSCI Europe Momentum Factor UCITS ETF is the largest ETF that tracks the MSCI Europe Momentum index. The ETF replicates the performance of the underlying index by sampling technique (buying a selection of the most relevant index constituents). The dividends in the ETF are accumulated and reinvested in the ETF. The iShares Edge MSCI Europe Momentum Factor UCITS ETF is a large ETF with 736m Euro assets under management. The ETF was launched on 16 January 2015 and is domiciled in Ireland.;Ishares Edge MSCI Europe Faktor UCITS ETF se snaží sledovat index hybnosti MSCI Europe. Index hybnosti MSCI Europe sleduje akcie s vysokou cenou z Evropy. Index se skládá z titulů, které zažily zvýšení cen za posledních 6 a za posledních 12 měsíců s předpokladem, že zvýšení bude v budoucnu pokračovat. TER (celkový poměr nákladů) činí 0,25% p.a. Ishares Edge MSCI Europe Momentum Faktor UCITS ETF je největší ETF, který sleduje index hybnosti MSCI Europe. ETF replikuje výkon základního indexu technikou vzorkování (nákup výběru nejdůležitějších složek indexu). dividenday v ETF jsou akumulovány a reinvestovány do ETF. Ishares Edge MSCI Europe Momentum Factor UCITS ETF je velký ETF s spravováním 736 milionů euro. ETF byl spuštěn 16. ledna 2015 a je se sídlem v Irsku.;0.25%;0.25;EUR 736m;736.0;EUR;EUR;Ireland;iShares;16 January 2015;;;Physical;UCITS;MSCI Europe;Equity, Europe, Momentum;;EUR    Currency risk  Currency;1;Akcie;False;Evropa;127.0;21.91;70.7;82.29;19.25;-0.73;5.31;7.54;22.28;-15.82;13.44;20.34;171.09;15.58;13.3;15.53;1.41;1.47;0.82;-15.37;-15.37;-23.67;-30.87;;;;;Bolsa Mexicana de Valores;-;9;;;;;;;2025-09-24T02:36:54.363340;success;0;Allianz SE;3.81;Rheinmetall AG;3.5;Siemens Energy AG;2.96;Deutsche Telekom AG;2.95;Rolls-Royce Holdings;2.94;Spotify Technology SA;2.92;Roche Holding AG;2.81;Iberdrola SA;2.66;Banco Santander SA;2.64;;;Other;31.02;Germany;30.51;United Kingdom;17.83;Switzerland;10.51;France;10.13;Financials;38.94;Industrials;22.36;Consumer Staples;7.74;Energy;2.96;Technology;2.92;London Stock Exchange;GBX;IEFM;;;;gettex;EUR;CEMR;;;;Stuttgart Stock Exchange;EUR;CEMR;;;;Bolsa Mexicana de Valores;MXN;-;CEMRN MM;CEMRN.MX;;Borsa Italiana;EUR;IEMO;IEMO IMINAVEMOE;0J1TINAV.DE;;London Stock Exchange;GBP;-;IEFM LNINAVEMOG;IEFM.L0J1VINAV.DE;;London Stock Exchange;EUR;IEMO;IEMO LNINAVEMOE;IEMO.L;;SIX Swiss Exchange;EUR;IEMO;IEMO SEINAVEMOE;IEMO.S0J1TINAV.DE;;XETRA;EUR;CEMR;CEMR GYINAVEMOE;CEMR.DE0J1TINAV.DE;;;;;;;;4;70;17;10;13;10;20
IE00BQN1K901;iShares Edge MSCI Europe Value Factor UCITS ETF;https://www.justetf.com/en/etf-profile.html?isin=IE00BQN1K901;The iShares Edge MSCI Europe Value Factor UCITS ETF seeks to track the MSCI Europe Enhanced Value index. The MSCI Europe Enhanced Value index tracks the value stocks from European industrial countries. The stock selection is based on the value factor of three variables: price-to-book value, price-to-forward earnings and enterprise value-to-cash flow from operations. The weight of each sector in this index is equated with the weight of that sector in the MSCI Europe. The ETF's TER (total expense ratio) amounts to 0.25% p.a.. The iShares Edge MSCI Europe Value Factor UCITS ETF is the largest ETF that tracks the MSCI Europe Enhanced Value index. The ETF replicates the performance of the underlying index by sampling technique (buying a selection of the most relevant index constituents). The dividends in the ETF are accumulated and reinvested in the ETF. The iShares Edge MSCI Europe Value Factor UCITS ETF is a very large ETF with 2,009m Euro assets under management. The ETF was launched on 16 January 2015 and is domiciled in Ireland.;Ishares Edge MSCI Europe Factor UCITS ETF se snaží sledovat index hodnoty MSCI Europe Enhered. Index MSCI Europe Enhered Hodnota sleduje hodnotové akciíy z evropských průmyslových zemí. Výběr akcií je založen na hodnotovém faktoru tří proměnných: hodnota ceny k knize, výdělky z ceny a podnikového hodnoty z provozu z operací. Hmotnost každého sektoru v tomto indexu se rovná hmotnosti tohoto sektoru v Evropě MSCI. TER (celkový poměr výdajů) ETF činí 0,25% p.a. Ishares Edge MSCI Europe Value Factor UCITS ETF je největší ETF, který sleduje index vylepšené hodnoty MSCI Europe. ETF replikuje výkon základního indexu technikou vzorkování (nákup výběru nejdůležitějších složek indexu). dividenday v ETF jsou akumulovány a reinvestovány do ETF. Ishares Edge MSCI Europe Value Factor UCITS ETF je velmi velký ETF s managementem 2 009 milionů euro. ETF byl spuštěn 16. ledna 2015 a je se sídlem v Irsku.;0.25%;0.25;EUR 2009m;2009.0;EUR;EUR;Ireland;iShares;16 January 2015;;;Physical;UCITS;MSCI Europe;Equity, Europe, Value;;EUR    Currency risk  Currency;1;Akcie;False;Evropa;152.0;21.44;60.45;117.9;20.48;-3.55;5.9;6.75;27.75;-5.05;14.53;10.43;108.88;15.24;13.52;15.5;1.41;1.26;1.09;-17.36;-17.36;-19.35;-39.97;;;;;Bolsa Mexicana de Valores;-;9;;;;;;;2025-09-24T02:37:06.039263;success;0;Siemens AG;3.75;Novartis AG;3.44;HSBC Holdings Plc;2.83;Sanofi;2.8;Banco Santander SA;2.39;VINCI SA;1.99;GSK Plc;1.94;Infineon Technologies AG;1.92;BNP Paribas SA;1.87;;;Other;29.12;United Kingdom;23.65;Germany;21.85;France;19.07;;;Financials;22.84;Industrials;18.46;Health Care;12.61;Consumer Staples;10.77;;;London Stock Exchange;GBX;IEFV;;;;gettex;EUR;CEMS;;;;Stuttgart Stock Exchange;EUR;CEMS;;;;Bolsa Mexicana de Valores;MXN;-;IEVLN MM;IEVLN.MX;;Borsa Italiana;EUR;IEVL;IEVL IMINAVEVLE;0J1YINAV.DE;;London Stock Exchange;GBP;-;IEFV LNINAVEVLG;IEFV.L0J10INAV.DE;;London Stock Exchange;EUR;IEVL;IEVL LNINAVEVLE;IEVL.L0J1YINAV.DE;;SIX Swiss Exchange;EUR;IEVL;IEVL SEINAVEVLE;IEVL.S0J1YINAV.DE;;XETRA;EUR;CEMS;CEMS GYINAVEVLE;CEMS.DE0J1YINAV.DE;;;;;;;;4;73;17;13;13;10;20
IE00BQN1KC32;iShares Edge MSCI Europe Size Factor UCITS ETF;https://www.justetf.com/en/etf-profile.html?isin=IE00BQN1KC32;The iShares Edge MSCI Europe Size Factor UCITS ETF seeks to track the MSCI Europe Mid Cap Equal Weighted index. The MSCI Europe Mid Cap Equal Weighted index tracks mid cap stocks from European industrial countries. All constituents in the index are equally weighted. The ETF's TER (total expense ratio) amounts to 0.25% p.a.. The iShares Edge MSCI Europe Size Factor UCITS ETF is the only ETF that tracks the MSCI Europe Mid Cap Equal Weighted index. The ETF replicates the performance of the underlying index by sampling technique (buying a selection of the most relevant index constituents). The dividends in the ETF are accumulated and reinvested in the ETF. The iShares Edge MSCI Europe Size Factor UCITS ETF is a small ETF with 29m Euro assets under management. The ETF was launched on 16 January 2015 and is domiciled in Ireland.;Ishares Edge MSCI Europe Factor UCITS ETF se snaží sledovat MSCI Europe Mid Cap stejný vážený index. MSCI Europe Mid Cap stejná vážená indexová indexová sleduje akciíy středních kapitálů z evropských průmyslových zemí. Všechny složky v indexu jsou stejně váženy. TER (celkový poměr nákladů) ETF činí 0,25% p.a. Ishares Edge MSCI Europe Faktor UCITS ETF je jediný ETF, který sleduje MSCI Europe Mid Cap stejný vážený index. ETF replikuje výkon základního indexu technikou vzorkování (nákup výběru nejdůležitějších složek indexu). dividenday v ETF jsou akumulovány a reinvestovány do ETF. Ishares Edge MSCI Europe Factor UCITS ETF je malý ETF s managementem 29m euro. ETF byl spuštěn 16. ledna 2015 a je se sídlem v Irsku.;0.25%;0.25;EUR 29m;29.0;EUR;EUR;Ireland;iShares;16 January 2015;;;Physical;UCITS;MSCI Europe;Equity, Europe, Mid Cap;;EUR    Currency risk  Currency;1;Akcie;False;Evropa;220.0;11.68;47.5;57.51;12.98;-2.89;2.74;6.09;19.7;-18.63;14.75;5.63;93.45;13.58;13.95;15.16;0.86;0.99;0.63;-14.07;-14.07;-29.35;-37.89;;;;;Bolsa Mexicana de Valores;-;9;;;;;;;2025-09-24T02:37:12.171488;success;0;Neste Corp.;0.63;Barry Callebaut;0.62;Acciona SA;0.6;Entain;0.6;Wärtsilä Oyj Abp;0.6;Evolution AB;0.59;Galderma Group;0.58;Prysmian SpA;0.57;Commerzbank AG;0.56;;;Other;54.55;United Kingdom;15.51;France;10.97;Germany;9.75;;;Industrials;20.76;Financials;17.83;Consumer Discretionary;9.0;Health Care;7.3;;;London Stock Exchange;GBX;IEFS;;;;gettex;EUR;CEMT;;;;Stuttgart Stock Exchange;EUR;CEMT;;;;Bolsa Mexicana de Valores;MXN;-;CEMTN MM;CEMTN.MX;;Borsa Italiana;EUR;IESZ;IESZ IMINAVESZE;0J13INAV.DE;;London Stock Exchange;EUR;IESZ;IESZ LNINAVESZE;IESZ.L;;London Stock Exchange;GBP;-;IEFS LNINAVESZG;IEFS.L0J15INAV.DE;;SIX Swiss Exchange;EUR;IESZ;IESZ SEINAVESZE;IESZ.S0J13INAV.DE;;XETRA;EUR;CEMT;CEMT GYINAVESZE;CEMT.DE0J13INAV.DE;;;;;;;;3;61;17;1;13;10;20
IE00BQQ3Q067;WisdomTree Emerging Markets Equity Income UCITS ETF;https://www.justetf.com/en/etf-profile.html?isin=IE00BQQ3Q067;The WisdomTree Emerging Markets Equity Income UCITS ETF seeks to track the WisdomTree Emerging Markets Equity Income index. The WisdomTree Emerging Markets Equity Income index tracks Emerging Markets stocks with high dividend yields. The stocks included are filtered according to ESG criteria (environmental, social and corporate governance). The index is weighted by fundamental criteria. The ETF's TER (total expense ratio) amounts to 0.46% p.a.. The WisdomTree Emerging Markets Equity Income UCITS ETF is the cheapest and largest ETF that tracks the WisdomTree Emerging Markets Equity Income index. The ETF replicates the performance of the underlying index by sampling technique (buying a selection of the most relevant index constituents). The dividends in the ETF are distributed to the investors (Quarterly). The WisdomTree Emerging Markets Equity Income UCITS ETF has 143m Euro assets under management. The ETF was launched on 14 November 2014 and is domiciled in Ireland.;WisdomTree Emerging Markets Equity Income UCITS ETF se snaží sledovat index příjmů příjmů WisdomTree Emerging Markets. Wisdomtree Emerging Markets Markets Equity Income Index skladby na trhu s vysokými dividendaovými výnosy. Zahrnuté akcie jsou filtrovány podle kritérií ESG (environmentální, sociální a správa a společností). Index je vážen podle základních kritérií. TER (celkový poměr nákladů) ETF činí 0,46% P.A .. Wisdomtree Emerging Markets Equity Income UCITS ETF je nejlevnější a největší ETF, který sleduje index příjmů z příjmů WisdomTree. ETF replikuje výkon základního indexu technikou vzorkování (nákup výběru nejdůležitějších složek indexu). dividenday v ETF jsou distribuovány investorům (čtvrtletně). WisdomTree Emerging Markets Equity Income UCITS ETF má pod správou aktiva 143 milionů euro. ETF byl spuštěn 14. listopadu 2014 a je se sídlem v Irsku.;0.46%;0.46;EUR 143m;143.0;EUR;USD;Ireland;WisdomTree;14 November 2014;;Quarterly;Physical;UCITS;;Equity, Emerging Markets, Dividend;Yes;USD    Currency risk  Currency;1;Akcie;False;Rozvíjející se trhy;489.0;8.83;33.09;70.58;4.08;-0.21;3.67;2.99;23.26;-8.48;18.47;11.98;84.67;12.75;12.49;12.41;0.69;0.8;0.91;-15.74;-15.74;-16.94;-40.25;;;;;Borsa Italiana;DEM;6;5.03%;5.03;EUR 0.71;0.71;EUR;method2_regex;2025-09-24T02:37:21.491602;success;0;MediaTek, Inc.;3.18;Industrial & Commercial Bank of China Ltd.;2.56;China Merchants Bank Co., Ltd.;2.43;Petróleo Brasileiro SA;2.43;Bank of China Ltd.;2.15;Hyundai Motor Co., Ltd.;1.27;Ping An Insurance (Group) Co. of China Ltd.;1.21;Industrial Bank Co., Ltd.;1.14;PKO Bank Polski;1.02;;;Other;34.75;China;26.43;;;;;;;Financials;27.47;Technology;13.32;Industrials;10.02;Consumer Discretionary;8.61;;;gettex;EUR;WTEI;;;;Borsa Italiana;EUR;DEM;DEM IMDEMEIV;WTDEM.MI.FTDEMEIV;;London Stock Exchange;GBX;DEM;DEM LNDEMEIV;WTDEM.L.FTDEMEIV;;London Stock Exchange;USD;DEMD;DEMD LNDEMEIV;DEMD.L.FTDEMEIV;;SIX Swiss Exchange;CHF;DEM;DEM SWDEMEIV;WTDEM.S.FTDEMEIV;;XETRA;EUR;WTEI;WTEI GYDEMEIV;WTEI.DE.FTDEMEIV;;;;;;;;;;;;;;;;;;;;;;;;;;3;55;12;5;13;5;20
IE00BQQP9F84;VanEck Gold Miners UCITS ETF;https://www.justetf.com/en/etf-profile.html?isin=IE00BQQP9F84;The VanEck Gold Miners UCITS ETF seeks to track the NYSE Arca Gold Miners index. The NYSE Arca Gold Miners index tracks companies in the global gold and silver mining industry, that generate at least 50% of their revenues from this sector. The ETF's TER (total expense ratio) amounts to 0.53% p.a.. The VanEck Gold Miners UCITS ETF is the only ETF that tracks the NYSE Arca Gold Miners index. The ETF replicates the performance of the underlying index by full replication (buying all the index constituents). The dividends in the ETF are accumulated and reinvested in the ETF. The VanEck Gold Miners UCITS ETF is a very large ETF with 2,215m Euro assets under management. The ETF was launched on 25 March 2015 and is domiciled in Ireland.;The Vaneck Gold Miners UCITS ETF se snaží sledovat index NYSE Arca Gold Miners Index. Index NYSE Arca Gold Miners sleduje společnosti v globálním průmyslu těžby zlata a stříbra, které z tohoto odvětví vytvářejí nejméně 50% jejich příjmů. TER (celkový poměr nákladů) ETF činí 0,53% P.A .. Vaneck Gold Miners UCITS ETF je jediný ETF, který sleduje index NYSE Arca Gold Miners Index. ETF replikuje výkon podkladového indexu plnou replikací (nákup všech složek indexu). dividenday v ETF jsou akumulovány a reinvestovány do ETF. The Vaneck Gold Miners UCITS ETF je velmi velký ETF s managementem spravováním 2 215 milionů euro. ETF byl spuštěn 25. března 2015 a je se sídlem v Irsku.;0.53%;0.53;EUR 2215m;2215.0;EUR;USD;Ireland;VanEck;25 March 2015;;;Physical;UCITS;;Equity, World, Basic Materials;;USD    Currency risk  Currency;1;Akcie;False;Celosvětově;62.0;74.86;171.32;95.46;91.36;21.06;36.93;51.66;-2.18;-3.28;6.24;17.08;285.45;29.55;28.37;28.53;2.53;1.39;0.5;-19.69;-25.42;-39.16;-45.32;;;;;BATS Chi-X Europe;-;13;;;;;;;2025-09-24T02:37:30.497083;success;0;Agnico Eagle Mines Ltd.;12.49;Wheaton Precious Metals Corp.;8.25;Barrick Mining Corp.;7.21;Franco-Nevada Corp.;6.1;Gold Fields Ltd.;4.33;Anglogold Ashanti Plc;4.32;Kinross Gold Corp.;3.9;Zijin Mining Group Co., Ltd.;3.18;Northern Star Resources Ltd.;2.84;;;Canada;44.35;Other;22.23;United States;18.02;Australia;9.07;China;4.6;IT;18.02;;;;;;;;;gettex;EUR;G2X;;;;Stuttgart Stock Exchange;EUR;G2X;;;;BATS Chi-X Europe;GBP;-;GDXINAV;GDXINAV.SG;;BATS Chi-X Europe;USD;-;GDXINAV;GDXINAV.SG;;Chi-X Europe;USD;-;GDXL IXGDXINAV;GDXl.CHIGDXEURINAV=IHSM;;Chi-X Europe;GBP;-;GDGXX IXGDXINAV;GDGXx.CHIGDXEURINAV=IHSM;;Borsa Italiana;EUR;GDX;GDXEUIV;GDXEURINAV.SG;;Borsa Italiana;EUR;-;GDX IMGDXEUIV;GDX.MIGDXEURINAV=IHSM;;Euronext Paris;EUR;GDX;GDX FPGDXEUIV;GDX .PAGDXEURINAV=IHSM;;London Stock Exchange;USD;GDX;GDX LNGDXINAV;GDX.LGDXINAV=SOLA;;3;57;6;13;13;5;20
IE00BQQP9G91;VanEck Junior Gold Miners UCITS;https://www.justetf.com/en/etf-profile.html?isin=IE00BQQP9G91;The VanEck Junior Gold Miners UCITS seeks to track the MVIS Global Junior Gold Miners index. The MVIS Global Junior Gold Miners index tracks the most liquid junior companies in the global gold and silver mining industry, that generate at least 50% of their revenues from this sector. The ETF's TER (total expense ratio) amounts to 0.55% p.a.. The VanEck Junior Gold Miners UCITS is the only ETF that tracks the MVIS Global Junior Gold Miners index. The ETF replicates the performance of the underlying index by full replication (buying all the index constituents). The dividends in the ETF are accumulated and reinvested in the ETF. The VanEck Junior Gold Miners UCITS is a large ETF with 938m Euro assets under management. The ETF was launched on 25 March 2015 and is domiciled in Ireland.;The Vaneck Junior Gold Miners UCITS se snaží sledovat index MVIS Global Junior Gold Miners. Index MVIS Global Junior Gold Miners sleduje nejvíce likvidší juniorské společnosti v globálním průmyslu zlata a stříbra, které z tohoto odvětví vytvářejí nejméně 50% svých příjmů. TER (celkový poměr výdajů) ETF činí 0,55% P.A .. Vaneck Junior Gold Miners UCITS je jediný ETF, který sleduje index MVIS Global Junior Gold Miners Index. ETF replikuje výkon podkladového indexu plnou replikací (nákup všech složek indexu). dividenday v ETF jsou akumulovány a reinvestovány do ETF. The Vaneck Junior Gold Miners UCITS je velký ETF s managementem 938 milionů euro. ETF byl spuštěn 25. března 2015 a je se sídlem v Irsku.;0.55%;0.55;EUR 938m;938.0;EUR;USD;Ireland;VanEck;25 March 2015;;;Physical;UCITS;;Equity, World, Basic Materials;;USD    Currency risk  Currency;1;Akcie;False;Celosvětově;80.0;85.15;184.08;75.91;94.35;22.31;35.74;55.52;-14.91;-9.38;4.16;22.23;295.0;30.83;30.1;31.35;2.76;1.38;0.38;-18.38;-26.18;-44.37;-48.82;;;;;BATS Chi-X Europe;-;13;;;;;;;2025-09-24T02:37:36.652082;success;0;Pan American Silver Corp.;6.55;Harmony Gold Mining;6.01;B2Gold Corp.;5.02;Evolution Mining Ltd.;4.84;Industrias Penoles;3.17;Coeur Mining;2.91;Lundin Gold;2.54;OR Royalties, Inc.;2.32;Equinox Gold Corp.;2.29;;;Canada;46.47;Other;25.39;Australia;15.09;United States;7.73;;;IT;7.73;;;;;;;;;gettex;EUR;G2XJ;;;;Stuttgart Stock Exchange;EUR;G2XJ;;;;BATS Chi-X Europe;GBP;-;GDXJINAV;GDXJINAV.SG;;BATS Chi-X Europe;USD;-;GDXJINAV;GDXJINAV.SG;;Chi-X Europe;USD;-;GDXJL IXGDXJINAV;GDXJl.CHIGDXJEURINAV=IHSM;;Chi-X Europe;GBP;-;GDGJX IXGDXJINAV;GDGJx.CHIGDXJEURINAV=IHSM;;Borsa Italiana;EUR;GDXJ;GDXJEUIV;;;Borsa Italiana;EUR;-;GDXJ IMGDXJEUIV;GDXJ.MIGDXJEURINAV=IHSM;;Euronext Paris;EUR;GDXJ;GDXJ FPGDXJEUIV;GDXJ.PAGDXJEURINAV=IHSM;;London Stock Exchange;USD;GDXJ;GDXJ LNGDXJINAV;GDXJ.LGDXJINAV=SOLA;;3;54;6;10;13;5;20
IE00BQQP9H09;VanEck Morningstar US ESG Wide Moat UCITS ETF A;https://www.justetf.com/en/etf-profile.html?isin=IE00BQQP9H09;The VanEck Morningstar US ESG Wide Moat UCITS ETF A seeks to track the Morningstar US Sustainability Moat Focus index. The Morningstar US Sustainability Moat Focus index tracks securities in the Morningstar US Market Index with the lowest market price to fair value ratios. The stocks included are filtered according to ESG criteria (environmental, social and corporate governance). All constituents are equally weighted. The ETF's TER (total expense ratio) amounts to 0.49% p.a.. The VanEck Morningstar US ESG Wide Moat UCITS ETF A is the only ETF that tracks the Morningstar US Sustainability Moat Focus index. The ETF replicates the performance of the underlying index by full replication (buying all the index constituents). The dividends in the ETF are accumulated and reinvested in the ETF. The VanEck Morningstar US ESG Wide Moat UCITS ETF A has 329m Euro assets under management. The ETF was launched on 16 October 2015 and is domiciled in Ireland.;The Vaneck Morningstar US ESG Wide Moat UCITS ETF A usiluje o sledování indexu zaostřování ranního udržitelnosti. Index udržitelnosti MorningStar Usvizovatelnosti Moat Focus sleduje cenné papíry v americkém indexu amerického trhu Morningstar s nejnižší tržní cenou a reálnou hodnotou. Zahrnuté akcie jsou filtrovány podle kritérií ESG (environmentální, sociální a správa a společností). Všechny složky jsou stejně váženy. TER (celkový poměr nákladů) ETF činí 0,49% P.A .. Vaneck Morningstar US ESG Wide Moat UCITS ETF A je jediný ETF, který sleduje index Moat Focus pro udržitelnost Morningstar USA. ETF replikuje výkon podkladového indexu plnou replikací (nákup všech složek indexu). dividenday v ETF jsou akumulovány a reinvestovány do ETF. The Vaneck Morningstar US ESG Wide Moat UCITS ETF A má 329 milionů euro aktiv pod správou. ETF byla spuštěna 16. října 2015 a je bydliště v Irsku.;0.49%;0.49;EUR 329m;329.0;EUR;USD;Ireland;VanEck;16 October 2015;;;Physical;UCITS;;Equity, United States;;USD    Currency risk  Currency;1;Akcie;False;Severní Amerika;62.0;-2.23;21.01;59.13;-8.63;-2.25;5.96;-0.04;35.39;-13.75;13.85;18.15;198.92;19.71;17.65;17.96;-0.11;0.37;0.54;-24.68;-24.68;-24.68;-32.9;;;;;Borsa Italiana;-;9;;;;;;;2025-09-24T02:37:46.885207;success;0;Emerson Electric;2.72;Intercontinental Exchange, Inc.;2.65;KLA Corp.;2.65;Roper Technologies;2.64;State Street Corp.;2.61;Mondelez International, Inc.;2.57;Clorox;2.55;The Bank of New York Mellon Corp.;2.55;Kellanova;2.45;;;United States;95.17;;;;;;;;;Technology;30.61;Financials;21.73;Consumer Staples;13.8;Industrials;11.32;;;gettex;EUR;GMVM;;;;Stuttgart Stock Exchange;EUR;GMVM;;;;Borsa Italiana;EUR;MOAT;GMVMINAV;;;Borsa Italiana;EUR;-;MOAT IMGMVMINAV;MOAT.MIGMVMEURINAV=IHSM;;Euronext Paris;EUR;MOAT;MOAT FPGMVMINAV;MOAT.PAGMVMINAV=SOLA;;London Stock Exchange;USD;MOAT;MOATINAV;MOATINAV=SOLA;;London Stock Exchange;GBP;MOGB;MOGB LNMOATINAV;MOGB.LMOATINAV=SOLA;;SIX Swiss Exchange;CHF;MOAT;MOAT SEMOATINAV;MOAT.SMOATINAV=SOLA;;XETRA;EUR;GMVM;GMVM GYGMVMINAV;GMVM.DEGMVMINAV=SOLA;;;;;;;;3;52;12;5;11;5;19
