IE000LYBU7X5;HSBC MSCI WORLD VALUE SCREENED UCITS ETF USD (Acc);https://www.justetf.com/en/etf-profile.html?isin=IE000LYBU7X5;The HSBC MSCI WORLD VALUE SCREENED UCITS ETF USD (Acc) seeks to track the MSCI World Value Select Screens Advanced index. The MSCI World Value Select Screens Advanced index tracks stocks from developed countries worldwide which are selected according to the value factor strategy and ESG criteria (environmental, social and corporate governance). The parent index is the MSCI World index. The ETF's TER (total expense ratio) amounts to 0.25% p.a.. The HSBC MSCI WORLD VALUE SCREENED UCITS ETF USD (Acc) is the only ETF that tracks the MSCI World Value Select Screens Advanced index. The ETF replicates the performance of the underlying index by full replication (buying all the index constituents). The dividends in the ETF are accumulated and reinvested in the ETF. The HSBC MSCI WORLD VALUE SCREENED UCITS ETF USD (Acc) has 225m Euro assets under management. The ETF was launched on 18 October 2022 and is domiciled in Ireland.;Světová hodnota HSBC MSCI SVESKED SHECKED UCITS ETF USD (ACC) se snaží sledovat pokročilý index Světové hodnoty MSCI Světovou hodnotu. Světová hodnota MSCI Select Screaks Advanced Index sleduje akcie z rozvinutých zemí po celém světě, které jsou vybírány podle strategie hodnotového faktoru a kritérií ESG (environmentální, sociální a správa věcí veřejných). Index nadřazení je index MSCI World. TER (celkový poměr nákladů) činí 0,25% p.a. Světová hodnota HSBC MSCI prověřená UCITS ETF USD (ACC) je jediným ETF, který sleduje pokročilý index Světové hodnoty MSCI. ETF replikuje výkon podkladového indexu plnou replikací (nákup všech složek indexu). dividenday v ETF jsou akumulovány a reinvestovány do ETF. Světová hodnota HSBC MSCI promítána UCITS ETF USD (ACC) má pod správou aktiva 225 milionů EUR. ETF byl spuštěn 18. října 2022 a je sídlem v Irsku.;0.25%;0.25;EUR 225m;225.0;EUR;USD;Ireland;HSBC;18 October 2022;Accumulating;;Physical;;MSCI WORLD;Equity, World, Value;Yes;Akcie;False;Globální;242.0;12.02;;;6.02;15.43;;;0.78;;;-18.42;;;-18.42;;;;;gettex;H41D;6;;;;;;;2025-09-19T07:59:01.567473;success;0;Microsoft;5.25;Apple;2.75;Citigroup, Inc.;2.65;Cisco Systems, Inc.;2.4;Merck & Co., Inc.;2.23;Applied Materials, Inc.;2.2;Verizon Communications;2.14;Sony Group Corp.;2.04;Gilead Sciences, Inc.;2.03;;;United States;63.66;Other;18.56;Japan;8.34;Switzerland;5.47;United Kingdom;3.97;Technology;31.76;Financials;19.09;Health Care;13.43;Industrials;10.92;Materials;2.2;Euronext Paris;EUR;HWVS;;;;gettex;EUR;H41D;;;;Borsa Italiana;EUR;HWVL;;;;London Stock Exchange;GBP;HWVS;HWVS LN;;;London Stock Exchange;USD;HWVL;HWVL LN;;;;;;;;;
IE000LZ7BZW8;iShares iBonds Dec 2026 Term EUR Italy Government Bond UCITS ETF EUR (Dist);https://www.justetf.com/en/etf-profile.html?isin=IE000LZ7BZW8;The iShares iBonds Dec 2026 Term EUR Italy Government Bond UCITS ETF EUR (Dist) seeks to track the ICE 2026 Maturity Italy UCITS index. The ICE 2026 Maturity Italy UCITS index tracks Italian government bonds. The index does not reflect a constant maturity range (as is the case with most other bond indices). Instead, only bonds that mature during the designated year (here: 2026) are included in the index. Rating: BBB. Maturity: December 2026 (the ETF will be closed afterwards). The ETF's TER (total expense ratio) amounts to 0.12% p.a.. The iShares iBonds Dec 2026 Term EUR Italy Government Bond UCITS ETF EUR (Dist) is the only ETF that tracks the ICE 2026 Maturity Italy UCITS index. The ETF replicates the performance of the underlying index by sampling technique (buying a selection of the most relevant index constituents). The interest income (coupons) in the ETF is distributed to the investors (Quarterly). The iShares iBonds Dec 2026 Term EUR Italy Government Bond UCITS ETF EUR (Dist) is a very small ETF with 6m Euro assets under management. The ETF was launched on 23 April 2024 and is domiciled in Ireland.;IBONDS IBONDS IBONDS VÝSLEDKY EUR Itálie Vládní dluhopis UCITS ETF EUR (DIST) se snaží sledovat index Itálie UCITS ILIETU ILY 2026. Indexová index ILIETY ILUTY ICE 2026 Sleduje italské vládní dluhopisy. Index neodráží konstantní rozsah zralosti (jako je tomu u většiny ostatních indexů Bond). Místo toho jsou do indexu zahrnuty pouze vazby, které dozrávají během určeného roku (zde: 2026). Hodnocení: BBB. Dospívání: prosinec 2026 (ETF bude poté uzavřen). TER (celkový poměr nákladů) činí 0,12% p.a. IShares Ibonds prosinec 2026 Vládní dluhopis EUR Itálie UCITS ETF EUR (DIST) je jediný ETF, který sleduje index zralosti ICE 2026 ITALY UCITS. ETF replikuje výkon základního indexu technikou vzorkování (nákup výběru nejdůležitějších složek indexu). Úrokové výnosy (kupóny) v ETF jsou distribuovány investorům (čtvrtletně). IBONDS ISHARES IBONDS prosinec 2026 Vládní dluhopis EUR Itálie UCITS ETF EUR (DIST) je velmi malý ETF s managementem 6 milionů euro. ETF byl spuštěn 23. dubna 2024 a má bydliště v Irsku.;0.12%;0.12;EUR 6m;6.0;EUR;EUR;Ireland;iShares;23 April 2024;Distributing;Quarterly;Physical;;Government Bond;;;Dluhopisy;False;Globální;13.0;2.99;;;1.84;1.25;;;2.4;;;-0.39;;;-0.4;;;;;Euronext Paris;26TP;4;2.76%;2.76;EUR 0.14;0.14;EUR;method2_regex;2025-09-19T07:59:07.191044;success;0;IT0005170839;9.71;IT0005556011;8.87;IT0005437147;8.87;IT0005210650;8.78;IT0005514473;8.45;IT0005419848;8.02;IT0005370306;7.85;IT0005454241;7.48;IT0005607269;7.24;;;Other;100.0;;;;;;;;;IT;1.84;;;;;;;;;Euronext Paris;EUR;26TP;;;;gettex;EUR;26TP;;;;Borsa Italiana;EUR;26TP;;;;XETRA;EUR;26TP;;;;;;;;;;;;;;;;
IE000LZC9NM0;Janus Henderson Haitong Asia ex-Japan High Yield Corp USD Bond Screened Core UCITS ETF USD Acc.;https://www.justetf.com/en/etf-profile.html?isin=IE000LZC9NM0;The Janus Henderson Haitong Asia ex-Japan High Yield Corp USD Bond Screened Core UCITS ETF USD Acc. seeks to track the iBoxx® MSCI Scored & Screened Tilted USD Asia ex-Japan High Yield Capped TCA index. The iBoxx® MSCI Scored & Screened Tilted USD Asia ex-Japan High Yield Capped TCA index tracks ESG (environmental, social and governance) screened, USD denominated high yield corporate bonds from Asia (excluding Japan). All maturities are included. Rating: Sub-Investment Grade. The ETF's TER (total expense ratio) amounts to 0.60% p.a.. The ETF replicates the performance of the underlying index by full replication (buying all the index constituents). The interest income (coupons) in the ETF is accumulated and reinvested in the ETF. The ETF was launched on 2 September 2021 and is domiciled in Ireland.;Bonda Janus Henderson Haitong Asia EX-Japan High Corp Corp. usiluje o sledování skóre IBOXX® MSCI skóre a promítaného nakloněného USD Asia Ex-Japan s vysokým výtěžkem TCA s vysokým výnosem. IBOXX® MSCI skóroval a prověřil nakloněnou USD Asia Ex-Japan s vysokým výnosem s omezeným indexovým indexovým stopům TCA ESG (environmentální, sociální a správa věcí veřejných), což je USD denominované firemní dluhopisy s vysokým výnosem z Asie (s výjimkou Japonska). Zahrnuty jsou všechna splatností. Hodnocení: stupeň sub-investice. TER (celkový poměr nákladů) ETF činí 0,60% p.a. ETF replikuje výkon podkladového indexu plnou replikací (nákup všech složek indexu). Úrokové výnosy (kupóny) v ETF se nashromáždí a reinvestují do ETF. ETF byl spuštěn 2. září 2021 a je bydliště v Irsku.;0.60%;0.6;;;;USD;Ireland;;2 September 2021;Accumulating;;Physical;;;;Yes;Dluhopisy;False;Japonsko;;5.86;7.86;;-3.92;9.69;11.3;;0.6;0.23;;-10.75;-23.31;;-41.84;;;;;London Stock Exchange;TAGT;2;;;;;;;2025-09-19T07:59:11.901936;success;0;;;;;;;;;;;;;;;;;;;;;Japan;0.6;;;;;;;;;;;;;;;;;;;London Stock Exchange;GBP;TAGT;;;;London Stock Exchange;USD;TAHY;TAHY LNTAHYINAV;TAHY.LAAZRINAV.DE;;;;;;;;;;;;;;;;;;;;1.0;32.0;6.0;1.0;6.0;5.0;14.0
IE000LZI2UH4;JPMorgan USD High Yield Bond Active UCITS ETF USD (acc);https://www.justetf.com/en/etf-profile.html?isin=IE000LZI2UH4;The JPMorgan USD High Yield Bond Active UCITS ETF USD (acc) is an actively managed ETF. The ETF invests in USD denominated high yield corporate bonds from issuers worldwide. The securities included are filtered according to ESG criteria (environmental, social and corporate governance). All maturities are included. Rating: Sub-Investment Grade. The ETF's TER (total expense ratio) amounts to 0.45% p.a.. The interest income (coupons) in the ETF is accumulated and reinvested in the ETF. The JPMorgan USD High Yield Bond Active UCITS ETF USD (acc) has 203m Euro assets under management. The ETF was launched on 26 November 2024 and is domiciled in Ireland.;Aktivní UCITS ETF USD (ACC) je aktivně spravovaná ETF. ETF investuje do USD denominoval firemní dluhopisy s vysokým výnosem od emitentů po celém světě. Zahrnuté cenné papíry jsou filtrovány podle kritérií ESG (environmentální, sociální a správa a řízení společností). Zahrnuty jsou všechna splatností. Hodnocení: stupeň sub-investice. TER (celkový poměr nákladů) ETF činí 0,45% p.a. Úrokové výnosy (kupóny) v ETF se nashromáždí a reinvestují do ETF. Společnost JPMorgan USD s vysokým výnosem Active UCITS ETF USD (ACC) má ve správě aktiv 203 milionů EUR. ETF byl spuštěn 26. listopadu 2024 a má bydliště v Irsku.;0.45%;0.45;EUR 203m;203.0;EUR;USD;Ireland;JPMorgan;26 November 2024;Accumulating;;Physical;;;risk  Actively managed    Sustainability  Yes;Yes;Dluhopisy;False;Globální;419.0;;;;-5.03;;;;;;;;;;-11.55;;;;;Borsa Italiana;JPHY;6;;;;;;;2025-09-19T07:59:16.967230;success;0;;;;;;;;;;;;;;;;;;;;;Other;100.0;;;;;;;;;;;;;;;;;;;gettex;EUR;JPUA;;;;Borsa Italiana;EUR;JPHY;JPHY IMJPHYEUIV;JPHY.MIJPHYEUiv.P;;London Stock Exchange;GBP;JPYH;JPYH LNJPHYGBIV;JPYH.LJPHYGBiv.P;;London Stock Exchange;USD;JPHY;JPHY LNJPHYUSIV;JPHY.LJPHYUSiv.P;;SIX Swiss Exchange;USD;JPHY;JPHY SWJPHYUSIV;JPHY.SJPHYUSiv.P;;;;;;;;
IE000M02BVY5;Goldman Sachs EUR High Yield Bond Active UCITS ETF CLASS EUR (Dist);https://www.justetf.com/en/etf-profile.html?isin=IE000M02BVY5;The Goldman Sachs EUR High Yield Bond Active UCITS ETF CLASS EUR (Dist) is an actively managed ETF. The ETF invests in EUR denominated high yield corporate bonds from issuers worldwide. Rating: Sub-Investment Grade. The ETF's TER (total expense ratio) amounts to 0.35% p.a.. The interest income (coupons) in the ETF is distributed to the investors (Semi annually). The Goldman Sachs EUR High Yield Bond Active UCITS ETF CLASS EUR (Dist) has 133m Euro assets under management. The ETF was launched on 30 January 2025 and is domiciled in Ireland.;Společnost Goldman Sachs EUR EUR s vysokým výnosem Active UCITS ETF EUR EUR (DIST) je aktivně spravovaná ETF. ETF investuje do EUR denominovaných podnikových dluhopisů s vysokým výnosem od emitentů po celém světě. Hodnocení: stupeň sub-investice. TER (celkový poměr nákladů) ETF činí 0,35% P.A .. Úrokový výnosy (kupóny) v ETF jsou distribuovány investorům (semifikaci ročně). Společnost Goldman Sachs EUR EUR High výnos Active UCITS ETF EUR EUR (DIST) má 133 milionů euro aktiv. ETF byl spuštěn 30. ledna 2025 a je se sídlem v Irsku.;0.35%;0.35;EUR 133m;133.0;EUR;EUR;Ireland;;30 January 2025;Distributing;Semi annually;Physical;;;Bonds, EUR, World, Corporate, All maturities;;Dluhopisy;False;Globální;;;;;;;;;;;;;;;-4.1;;;;;Borsa Italiana;EUHY;3;;;;;;;2025-09-19T07:59:24.306646;success;0;;;;;;;;;;;;;;;;;;;;;;;;;;;;;;;;;;;;;;;;;Borsa Italiana;EUR;EUHY;;;;SIX Swiss Exchange;CHF;EUHY;;;;XETRA;EUR;GXHY;;;;;;;;;;;;;;;;;;;;;;
IE000M4Z0RA5;AXA IM MSCI Emerging Markets ex-China Equity PAB UCITS ETF USD Acc;https://www.justetf.com/en/etf-profile.html?isin=IE000M4Z0RA5;The AXA IM MSCI Emerging Markets ex-China Equity PAB UCITS ETF USD Acc seeks to track the MSCI Emerging Markets ex China Climate Paris Aligned index. The MSCI Emerging Markets ex China Climate Paris Aligned index tracks stocks from Emerging Market countries (excluding China). The index aims to give greater weight to companies that benefit from the transition to a lower carbon economy. In addition, EU directives on climate protection are taken into account. The parent index is the MSCI Emerging Markets ex China. The ETF's TER (total expense ratio) amounts to 0.27% p.a.. The AXA IM MSCI Emerging Markets ex-China Equity PAB UCITS ETF USD Acc is the cheapest and largest ETF that tracks the MSCI Emerging Markets ex China Climate Paris Aligned index. The ETF replicates the performance of the underlying index by full replication (buying all the index constituents). The dividends in the ETF are accumulated and reinvested in the ETF. The AXA IM MSCI Emerging Markets ex-China Equity PAB UCITS ETF USD Acc is a very small ETF with 11m Euro assets under management. The ETF was launched on 5 February 2025 and is domiciled in Ireland.;AXA IM MSCI Emerging Markets Ex-China Equity PAB UCITS ETF USD ACC se snaží sledovat index MSCI Emerging Markets Ex China Climate Paříž. Na rozvíjející se trhy MSCI Ex China Climate Paříž sladí indexové akciíy z rozvíjejících se tržních zemí (s výjimkou Číny). Cílem indexu je poskytnout větší váhu společnostem, které těží z přechodu na nižší uhlíkovou ekonomiku. Kromě toho se berou v úvahu směrnice EU o ochraně klimatu. Rodičovským indexem jsou rozvíjející se trhy MSCI Ex Čína. TER (celkový poměr nákladů) ETF činí 0,27% p.a .. AXA IM MSCI Emerging Markets Ex-China Equity PAB UCITS ETF USD ACC je nejlevnější a největší ETF, který sleduje rozvíjející se trhy MSCI, která je v Číně Climate Paris Aligned Index. ETF replikuje výkon podkladového indexu plnou replikací (nákup všech složek indexu). dividenday v ETF jsou akumulovány a reinvestovány do ETF. Axa IM MSCI Emerging Markets Ex-China Equity PAB UCITS ETF USD ACC je velmi malý ETF s managementem 11 milionů euro. ETF byl spuštěn 5. února 2025 a má bydliště v Irsku.;0.27%;0.27;EUR 11m;11.0;EUR;USD;Ireland;;5 February 2025;Accumulating;;Physical;;MSCI Emerging Markets;;Yes;Akcie;False;Čína;193.0;;;;;;;;;;;;;;-16.92;;;;;gettex;AXQT;5;;;;;;;2025-09-19T07:59:30.131914;success;0;Samsung Electronics Co., Ltd.;2.97;MediaTek, Inc.;2.87;Delta Electronics, Inc.;2.14;Aselsan Elektronik Sanayi;1.71;Naspers Ltd.;1.71;HDFC Bank Ltd.;1.63;Bharat Electronics;1.57;SK hynix, Inc.;1.52;Al Rajhi Bank;1.49;;;Other;32.0;;;;;;;;;Technology;33.8;Financials;23.08;Industrials;10.03;Materials;5.32;;;Borsa Italiana;EUR;AXQU;;;;XETRA;USD;AXQU;;;;gettex;EUR;AXQT;;;;SIX Swiss Exchange;USD;AXQU;;;;XETRA;EUR;AXQT;;;;;;;;;;
IE000M7V94E1;VanEck Uranium and Nuclear Technologies UCITS ETF A;https://www.justetf.com/en/etf-profile.html?isin=IE000M7V94E1;The VanEck Uranium and Nuclear Technologies UCITS ETF A seeks to track the MarketVector Global Uranium and Nuclear Energy Infrastructure index. The MarketVector Global Uranium and Nuclear Energy Infrastructure index tracks companies worldwide that are involved in the uranium mining and nuclear energy infrastructure industries. The ETF's TER (total expense ratio) amounts to 0.55% p.a.. The VanEck Uranium and Nuclear Technologies UCITS ETF A is the only ETF that tracks the MarketVector Global Uranium and Nuclear Energy Infrastructure index. The ETF replicates the performance of the underlying index by full replication (buying all the index constituents). The dividends in the ETF are accumulated and reinvested in the ETF. The VanEck Uranium and Nuclear Technologies UCITS ETF A is a large ETF with 948m Euro assets under management. The ETF was launched on 3 February 2023 and is domiciled in Ireland.;UCITS UCITS ETF A usiluje o sledování globálního indexu uranu a jaderné energie UCITS ETF. Globální index indexu uraniové a jaderné energie MarketVector sleduje společnosti po celém světě, které se podílejí na infrastruktuře těžby uranu a infrastruktury jaderné energie. TER (celkový poměr nákladů) ETF činí 0,55% p.a. Vaneck uranium a jaderné technologie UCITS ETF A je jediný ETF, který sleduje globální index infrastruktury uranu a jaderné energie. ETF replikuje výkon podkladového indexu plnou replikací (nákup všech složek indexu). dividenday v ETF jsou akumulovány a reinvestovány do ETF. UCITS ETF A je uranium a jaderné technologie Vaneck uranium a jaderné technologie je velký ETF s spravováním 948 milionů euro. ETF byla zahájena 3. února 2023 a má bydliště v Irsku.;0.55%;0.55;EUR 948m;948.0;EUR;USD;Ireland;VanEck;3 February 2023;;;Physical;focus   Equity, World;;Equity, World;;Ostatní;False;Ostatní;25.0;88.77;;;51.73;34.32;;;2.59;;;-37.63;;;-37.63;;;;;Borsa Italiana;-;8;;;;;;;2025-09-19T07:59:37.650995;success;0;Oklo;10.06;NuScale Power Corp;8.63;NexGen Energy Ltd.;5.69;IHI Corp.;5.02;Jacobs Solutions;4.99;Hitachi Ltd.;4.9;Uranium Energy Corp.;4.88;Fuji Electric Co., Ltd.;4.87;Mitsubishi Heavy Industries, Ltd.;4.77;;;United States;30.58;Canada;26.58;Japan;21.37;Other;15.47;UK;0.55;Energy;39.1;Industrials;36.97;Financials;3.22;;;;;Borsa Italiana;EUR;NUCL;;;;gettex;EUR;NUKL;;;;Borsa Italiana;EUR;-;NUCL IMNUCLEUIV;NUCL.MINUCLEURINAV=IHSM;;Euronext Paris;EUR;NUCL;NUCL FPNUCLEUIV;NUCLEURINAV=IHSMNUCLEURINAV=IHSM;;London Stock Exchange;USD;NUCL;NUCL LNNUCLUSIV;NUCL.LNUCLINAV=IHSM;;;;;;;;
IE000M86QRT4;Amundi S&P 500 Equal Weight ESG Leaders UCITS ETF EUR Hedged Acc;https://www.justetf.com/en/etf-profile.html?isin=IE000M86QRT4;The Amundi S&P 500 Equal Weight ESG Leaders UCITS ETF EUR Hedged Acc seeks to track the S&P 500 Equal Weight ESG Leaders Select (EUR Hedged) index. The S&P 500 Equal Weight ESG Leaders Select (EUR Hedged) index tracks the largest US companies. The stocks included are filtered according to ESG criteria (environmental, social and corporate governance). All constituents are equally weighted. The sector allocation of the index is adjusted to the sector allocation of the S&P 500 Equal Weight. Currency hedged to Euro (EUR). The ETF's TER (total expense ratio) amounts to 0.20% p.a.. The Amundi S&P 500 Equal Weight ESG Leaders UCITS ETF EUR Hedged Acc is the only ETF that tracks the S&P 500 Equal Weight ESG Leaders Select (EUR Hedged) index. The ETF replicates the performance of the underlying index by full replication (buying all the index constituents). The dividends in the ETF are accumulated and reinvested in the ETF. The Amundi S&P 500 Equal Weight ESG Leaders UCITS ETF EUR Hedged Acc is a small ETF with 48m Euro assets under management. The ETF was launched on 22 June 2023 and is domiciled in Ireland.;Amundi S&P 500 ESG vůdci ESG UCITS ETF EUR EUR HEDGED ACC se snaží sledovat index S&P 500 ESG Leaders (EUR Hedged). Vůdci S&P 500 ESG ESG vybírají (EUR Hedged) Index sleduje největší americké společnosti. Zahrnuté akcie jsou filtrovány podle kritérií ESG (environmentální, sociální a správa a společností). Všechny složky jsou stejně váženy. Přidělení indexu sektoru je upraveno na přidělování sektoru stejné hmotnosti S&P 500. Měna zajišťovala euro (EUR). TER (celkový poměr výdajů) činí 0,20% p.a. Amundi S&P 500 ESG vůdci ESG UCIT ETF EUR EUR ACC je jediným ETF, který sleduje index S&P 500 ESG VELECT (EUR Hedged). ETF replikuje výkon podkladového indexu plnou replikací (nákup všech složek indexu). dividenday v ETF jsou akumulovány a reinvestovány do ETF. Vedoucí Amundi S&P 500 ESG ESG UCITS ETF EUR Hedged ACC je malý ETF s vedením 48 milionů euro. ETF byl spuštěn 22. června 2023 a je se sídlem v Irsku.;0.20%;0.2;EUR 48m;48.0;EUR;EUR;Ireland;Amundi;22 June 2023;Accumulating;;Physical;;S&P 500;Equity, United States, Equal Weighted;Yes;Akcie;False;US;319.0;5.83;;;7.84;18.49;;;0.32;;;-19.54;;;-19.54;;;;;Euronext Paris;-;3;;;;;;;2025-09-19T07:59:43.543911;success;0;Oracle Corp.;0.42;AMD;0.4;Tapestry;0.4;Royal Caribbean Group;0.39;Warner Bros Discovery;0.39;Albemarle;0.39;Carnival;0.38;Moderna, Inc.;0.38;Estee Lauder;0.38;;;United States;92.32;Other;4.77;;;;;;;Technology;17.11;Financials;14.76;Industrials;13.92;Health Care;13.3;;;gettex;EUR;MWOQ;;;;Euronext Paris;EUR;-;MWOQ FPIMWOEUIV;MWOQ.PAIMWOQINAV=SOLA;;XETRA;EUR;MWOQ;MWOQ GYIMWOEUIV;MWOQ.DEIMWOQINAV=SOLA;;;;;;;;;;;;;;;;;;;;
IE000MAO75G5;iShares Core MSCI Europe UCITS ETF EUR (Acc);https://www.justetf.com/en/etf-profile.html?isin=IE000MAO75G5;The iShares Core MSCI Europe UCITS ETF EUR (Acc) seeks to track the MSCI Europe index. The MSCI Europe index tracks the leading stocks from 15 European industrial countries. The ETF's TER (total expense ratio) amounts to 0.12% p.a.. The ETF replicates the performance of the underlying index by sampling technique (buying a selection of the most relevant index constituents). The dividends in the ETF are accumulated and reinvested in the ETF. The iShares Core MSCI Europe UCITS ETF EUR (Acc) is a very large ETF with 1,114m Euro assets under management. The ETF was launched on 20 March 2024 and is domiciled in Ireland.;Ishares Core MSCI Europe UCITS ETF EUR (ACC) se snaží sledovat index MSCI Europe. Index MSCI Europe sleduje přední akciíy z 15 evropských průmyslových zemí. TER (celkový poměr nákladů) ETF činí 0,12% p.a. ETF replikuje výkon základního indexu technikou vzorkování (nákup výběru nejdůležitějších složek indexu). dividenday v ETF jsou akumulovány a reinvestovány do ETF. Ishares Core MSCI Europe UCITS ETF EUR (ACC) je velmi velký ETF s spravováním 1 114 milionů euro. ETF byl spuštěn 20. března 2024 a je se sídlem v Irsku.;0.12%;0.12;EUR 1114m;1114.0;EUR;EUR;Ireland;iShares;20 March 2024;Accumulating;;Physical;;MSCI Europe;Equity, Europe;;Akcie;False;Evropa;403.0;10.98;;;12.06;13.93;;;0.79;;;-16.23;;;-16.23;;;;;gettex;CEBZ;2;;;;;;;2025-09-19T07:59:50.101071;success;0;ASML Holding NV;2.25;AstraZeneca PLC;1.89;Nestlé SA;1.87;Roche Holding AG;1.81;Novartis AG;1.79;HSBC Holdings Plc;1.75;Shell Plc;1.75;Siemens AG;1.59;Novo Nordisk A/S;1.26;;;Other;34.14;United Kingdom;21.0;Germany;15.37;France;15.37;Switzerland;14.12;Financials;22.28;IT;21.0;Industrials;18.53;Health Care;10.4;Consumer Staples;9.97;gettex;EUR;CEBZ;;;;XETRA;EUR;CEBZ;;;;;;;;;;;;;;;;;;;;;;;;;;;;
IE000MCVFK47;Xtrackers EUR Corporate Green Bond UCITS ETF 1C;https://www.justetf.com/en/etf-profile.html?isin=IE000MCVFK47;The Xtrackers EUR Corporate Green Bond UCITS ETF 1C seeks to track the Bloomberg MSCI EUR Corporate and Agency Green Bond index. The Bloomberg MSCI EUR Corporate and Agency Green Bond index tracks ESG (environmental, social and governance) screened, EUR denominated bonds issued by companies and government agencies worldwide. All maturities are included. Rating: Investment Grade. The ETF's TER (total expense ratio) amounts to 0.25% p.a.. The Xtrackers EUR Corporate Green Bond UCITS ETF 1C is the only ETF that tracks the Bloomberg MSCI EUR Corporate and Agency Green Bond index. The ETF replicates the performance of the underlying index by sampling technique (buying a selection of the most relevant index constituents). The interest income (coupons) in the ETF is accumulated and reinvested in the ETF. The Xtrackers EUR Corporate Green Bond UCITS ETF 1C has 152m Euro assets under management. The ETF was launched on 24 June 2021 and is domiciled in Ireland.;Xtrackers Eur Corporate Green Bond UCITS ETF 1C se snaží sledovat společnost Bloomberg MSCI EUR Corporate and Agency Green Bond Index. Společnost Bloomberg MSCI EUR Corporate and Agency Green Bond Index sleduje ESG (environmentální, sociální a správa věcí veřejných) promítané, EUR denominované dluhopisy vydané společnostmi a vládními agenturami po celém světě. Zahrnuty jsou všechna splatností. Hodnocení: Investiční třída. TER (celkový poměr nákladů) činí 0,25% P.A .. Xtrackers Eur Corporate Green Bond UCITS ETF 1C je jediný ETF, který sleduje společnost Bloomberg MSCI EUR Corporate and Agency Green Bond Index. ETF replikuje výkon základního indexu technikou vzorkování (nákup výběru nejdůležitějších složek indexu). Úrokové výnosy (kupóny) v ETF se nashromáždí a reinvestují do ETF. Xtrackers EUR Corporate Green Bond UCITS ETF 1C má ve správě aktiv 152 milionů EUR. ETF byl spuštěn 24. června 2021 a má bydliště v Irsku.;0.25%;0.25;EUR 152m;152.0;EUR;EUR;Ireland;Xtrackers;24 June 2021;;;Physical;;;;Yes;Dluhopisy;False;Globální;608.0;3.71;12.1;;2.48;2.69;4.35;;1.38;0.89;;-1.94;-4.61;;-20.53;;;;;Extracted (method 1);XGBE;0;;;;;;;2025-09-19T07:59:54.811828;success;0;FR0013213295;0.42;FR0013507647;0.39;XS2613821300;0.37;FR0013422383;0.36;FR0013409612;0.36;XS1909186451;0.35;XS2459544339;0.34;;;;;;;Other;58.47;France;16.84;Netherlands;14.41;Germany;4.02;;;;;;;;;;;;;;;;;;;;;;;;;;;;;;;;;;;;;;;;;;;3.0;56.0;17.0;5.0;6.0;10.0;18.0
