IE00BD0B9B76;iShares Refinitiv Inclusion and Diversity UCITS ETF USD (Acc);https://www.justetf.com/en/etf-profile.html?isin=IE00BD0B9B76;The iShares Refinitiv Inclusion and Diversity UCITS ETF USD (Acc) seeks to track the Refinitiv Global Large/Mid Diversity & Inclusion ex Controversial Weapons Equal Weight index. The Refinitiv Global Large/Mid Diversity & Inclusion ex Controversial Weapons Equal Weight index tracks companies which are selected and weighted by their in diversity, inclusion, development of human resources, and lack of controversial news. Producers of controversial weapons are generally excluded from the index. The ETF's TER (total expense ratio) amounts to 0.25% p.a.. The iShares Refinitiv Inclusion and Diversity UCITS ETF USD (Acc) is the only ETF that tracks the Refinitiv Global Large/Mid Diversity & Inclusion ex Controversial Weapons Equal Weight index. The ETF replicates the performance of the underlying index by sampling technique (buying a selection of the most relevant index constituents). The dividends in the ETF are accumulated and reinvested in the ETF. The iShares Refinitiv Inclusion and Diversity UCITS ETF USD (Acc) is a small ETF with 41m Euro assets under management. The ETF was launched on 7 September 2018 and is domiciled in Ireland.;Ishares Refinitiv Inkluze a rozmanitost UCITS ETF USD (ACC) se snaží sledovat refinitiv globální velkou/střední rozmanitost a inklusion ex kontroverzní zbraně stejné hmotnosti. Refinitiv globální velká/střední rozmanitost a inkluze ex kontroverzní zbraně, které indexové indexe sleduje společnosti, které jsou vybírány a váženy jejich rozmanitostí, začleněním, rozvojem lidských zdrojů a nedostatkem kontroverzních zpráv. Producenti kontroverzních zbraní jsou obecně vyloučeni z indexu. TER (celkový poměr výdajů) ETF činí 0,25% p.a .. Ishares Refinitiv zahrnutí a rozmanitost UCITS ETF USD (ACC) je jediný ETF, který sleduje refinitiv globální diverzitu a inkluzi ex -kontroverzní index zbraní. ETF replikuje výkon základního indexu technikou vzorkování (nákup výběru nejdůležitějších složek indexu). dividenday v ETF jsou akumulovány a reinvestovány do ETF. Ishares Refinitiv Inkluze a rozmanitost UCITS ETF USD (ACC) je malá ETF s vedením 41 milionů euro. ETF byl spuštěn 7. září 2018 a je se sídlem v Irsku.;0.25%;0.25;EUR 41m;41.0;EUR;USD;Ireland;iShares;7 September 2018;Accumulating;;Physical;UCITS;;Equity, World, Social/Environmental;Yes;USD    Currency risk  Currency;1;Akcie;False;Celosvětově;96.0;8.49;35.66;91.12;5.14;-1.45;4.6;3.15;27.25;-3.78;11.46;14.24;88.91;13.33;12.09;12.56;0.64;0.88;1.1;-17.74;-17.74;-17.74;-33.72;;;;;Bolsa Mexicana de Valores;-;6;;;;;;;2025-09-24T00:46:44.367198;success;0;Banco Santander SA;1.63;National Bank of Greece SA;1.57;Coca-Cola HBC;1.46;Delta Electronics, Inc.;1.38;Gold Fields Ltd.;1.37;Intesa Sanpaolo SpA;1.36;Wiwynn;1.32;Mediobanca Banca di Credito Finanziario SpA;1.31;Banco Bradesco SA;1.3;;;Other;49.58;United States;22.18;France;8.62;United Kingdom;8.27;Greece;1.57;Financials;33.08;Consumer Staples;14.77;Industrials;9.44;Technology;9.38;;;gettex;EUR;OPEN;;;;Stuttgart Stock Exchange;EUR;OPEN;;;;Bolsa Mexicana de Valores;MXN;-;OPENN MM;OPENN.MX;;Euronext Amsterdam;EUR;OPEN;OPEN NA;;;London Stock Exchange;USD;OPEN;OPEN LNINAVOPEU;OPEN.L0K5WINAV.DE;;XETRA;EUR;OPEN;OPEN GYINAVOPEE;OPEN.DE0K5SINAV.DE;;;;;;;;;;;;;;;;;;;;;;;;;;3;59;17;1;11;10;20
IE00BD0Q9673;Invesco US High Yield Fallen Angels UCITS ETF Dist;https://www.justetf.com/en/etf-profile.html?isin=IE00BD0Q9673;The Invesco US High Yield Fallen Angels UCITS ETF Dist seeks to track the FTSE Time-Weighted US Fallen Angel Bond Select index. The FTSE Time-Weighted US Fallen Angel Bond Select index tracks US high yield corporate bonds that have been downgraded from investment grade. The ETF's TER (total expense ratio) amounts to 0.45% p.a.. The Invesco US High Yield Fallen Angels UCITS ETF Dist is the only ETF that tracks the FTSE Time-Weighted US Fallen Angel Bond Select index. The ETF replicates the performance of the underlying index by sampling technique (buying a selection of the most relevant index constituents). The interest income (coupons) in the ETF is distributed to the investors (Quarterly). The Invesco US High Yield Fallen Angels UCITS ETF Dist is a small ETF with 81m Euro assets under management. The ETF was launched on 1 September 2016 and is domiciled in Ireland.;Invesco USA s vysokým výnosem Fallen Angels UCITS ETF dist se snaží sledovat index FTSE časově váženi USA Fallen Angel Bond Select. Časově vážená FTSE USA Fallen Angel Bond Select Index sleduje americké firemní dluhopisy s vysokým výnosem, které byly sníženy z investiční třídy. TER (celkový poměr nákladů) ETF činí 0,45% p.a. Invex Invesco USA s vysokým výnosem UCITS ETF Dist je jediný ETF, který sleduje index FTSE časově váženým US Fallen Angel Bond Select Index. ETF replikuje výkon základního indexu technikou vzorkování (nákup výběru nejdůležitějších složek indexu). Úrokové výnosy (kupóny) v ETF jsou distribuovány investorům (čtvrtletně). Invesco USA s vysokým výnosem Fallen Angels UCITS ETF Dist je malý ETF s managementem 81 milionů euro. ETF byla spuštěna 1. září 2016 a je bydliště v Irsku.;0.45%;0.45;EUR 81m;81.0;EUR;USD;Ireland;Invesco;1 September 2016;Distributing;Quarterly;Physical;UCITS;;Bonds, USD, United States, Corporate, All maturities;;USD    Currency risk  Currency;1;Dluhopisy;False;Severní Amerika;76.0;2.32;6.84;25.69;-4.04;0.71;2.12;-2.03;14.81;-8.57;6.59;11.42;42.5;9.06;8.29;7.91;0.26;0.27;0.59;-12.31;-12.31;-12.31;-26.2;;;;;London Stock Exchange;-;9;7.00%;7.0;EUR 1.30;1.3;EUR;method2_regex;2025-09-24T00:46:54.009065;success;0;;;;;;;;;;;;;;;;;;;;;United States;83.18;Other;4.18;Canada;2.96;;;;;;;;;;;;;;;gettex;EUR;FAHY;;;;Stuttgart Stock Exchange;EUR;FAHY;;;;Borsa Italiana;EUR;HYFA;HYFA IMIHYFAEU;HYFA.MI;;Euronext Paris;EUR;HYFA;HYFA FPIHYFAEU;HYFA.PA;;London Stock Exchange;GBX;FAHY;FAHY LN;FAHY.L;;London Stock Exchange;USD;HYFA;HYFA LNIHYFAUS;HYFA.L;;London Stock Exchange;GBP;-;FAHY LNHYFAGBIV;FAHY.L;;SIX Swiss Exchange;USD;HYFA;HYFA SWIHYFAUS;HYFA.S;;XETRA;EUR;FAHY;FAHY GYIHYFAEU;FAHY.DE;;;;;;;;2;46;12;1;11;10;12
IE00BD1F4K20;iShares MSCI USA Mid-Cap Equal Weight UCITS ETF USD (Acc);https://www.justetf.com/en/etf-profile.html?isin=IE00BD1F4K20;The iShares MSCI USA Mid-Cap Equal Weight UCITS ETF USD (Acc) seeks to track the MSCI USA Mid-Cap Equal Weighted index. The MSCI USA Mid-Cap Equal Weighted index tracks US mid cap stocks. The ETF's TER (total expense ratio) amounts to 0.20% p.a.. The iShares MSCI USA Mid-Cap Equal Weight UCITS ETF USD (Acc) is the only ETF that tracks the MSCI USA Mid-Cap Equal Weighted index. The ETF replicates the performance of the underlying index by sampling technique (buying a selection of the most relevant index constituents). The dividends in the ETF are accumulated and reinvested in the ETF. The iShares MSCI USA Mid-Cap Equal Weight UCITS ETF USD (Acc) has 270m Euro assets under management. The ETF was launched on 13 October 2016 and is domiciled in Ireland.;IShares MSCI USA Mid-Cap stejná hmotnost UCITS ETF USD (ACC) se snaží sledovat MSCI USA Mid-Cap stejný vážený index. MSCI USA Mid-Cap rovný vážený index nás sleduje akciíy středních kapitálů. TER (celkový poměr nákladů) ETF činí 0,20% p.a. IShares MSCI USA Mid-Cap stejná hmotnost UCITS ETF USD (ACC) je jediným ETF, který sleduje index MSCI USA střední váha. ETF replikuje výkon základního indexu technikou vzorkování (nákup výběru nejdůležitějších složek indexu). dividenday v ETF jsou akumulovány a reinvestovány do ETF. IShares MSCI USA Mid-Cap stejná hmotnost UCITS ETF USD (ACC) má 270 milionů euro aktiv. ETF byl spuštěn 13. října 2016 a je se sídlem v Irsku.;0.20%;0.2;EUR 270m;270.0;EUR;USD;Ireland;iShares;13 October 2016;Accumulating;;Physical;UCITS;MSCI USA Mid-Cap Equal Weight  USD;Equity, United States, Mid Cap;;USD    Currency risk  Currency;1;Akcie;False;Severní Amerika;305.0;2.79;23.27;77.49;-5.66;-1.53;4.87;1.57;36.1;-13.16;11.95;20.46;129.05;19.86;18.82;19.15;0.14;0.38;0.63;-23.97;-23.97;-23.97;-40.9;;;;;Bolsa Mexicana de Valores;-;8;;;;;;;2025-09-24T00:47:02.291800;success;0;Robinhood Markets;0.53;Western Digital Corp.;0.5;Reddit;0.49;Seagate Technology Hldgs;0.47;Warner Bros Discovery;0.46;Estee Lauder;0.45;Block, Inc.;0.45;The Carlyle Group Inc.;0.44;Vertiv Holdings;0.44;;;United States;90.05;Other;6.85;United Kingdom;1.59;;;;;Technology;16.67;Industrials;14.62;Financials;12.03;Health Care;10.19;;;London Stock Exchange;GBX;IUSF;;;;gettex;EUR;QDVC;;;;Stuttgart Stock Exchange;EUR;QDVC;;;;Bolsa Mexicana de Valores;MXN;-;IUSZN MM;IUSZN.MX;;London Stock Exchange;USD;IUSZ;IUSZ LNINAVUSZU;IUSZ.L309NINAV.DE;;London Stock Exchange;GBP;-;IUSF LNINAVUSZG;IUSF.L309LINAV.DE;;SIX Swiss Exchange;USD;IUSZ;IUSZ SEINAVUSZU;IUSZ.S309NINAV.DE;;XETRA;EUR;QDVC;QDVC GYINAVUSZE;QDVC.DE309JINAV.DE;;;;;;;;;;;;;;3;62;17;5;11;10;19
IE00BD1F4L37;iShares Edge MSCI USA Quality Factor UCITS ETF;https://www.justetf.com/en/etf-profile.html?isin=IE00BD1F4L37;The iShares Edge MSCI USA Quality Factor UCITS ETF seeks to track the MSCI USA Sector Neutral Quality index. The MSCI USA Sector Neutral Quality index tracks the leading stocks on the US market. The constituents are selected by three main equally weighted indicators: high return on equity, low levels of debt and low year on year earnings variability. The ETF's TER (total expense ratio) amounts to 0.20% p.a.. The iShares Edge MSCI USA Quality Factor UCITS ETF is the largest ETF that tracks the MSCI USA Sector Neutral Quality index. The ETF replicates the performance of the underlying index by full replication (buying all the index constituents). The dividends in the ETF are accumulated and reinvested in the ETF. The iShares Edge MSCI USA Quality Factor UCITS ETF is a very large ETF with 1,722m Euro assets under management. The ETF was launched on 13 October 2016 and is domiciled in Ireland.;Ishares Edge MSCI USA Faktor kvality UCITS ETF se snaží sledovat index neutrální kvality sektoru MSCI USA. Index neutrální kvality sektoru MSCI USA sleduje přední akcie na americkém trhu. Složky jsou vybírány třemi hlavními stejně váženými ukazateli: vysoká návratnost vlastního kapitálu, nízká úroveň dluhu a nízká roční variabilita příjmů. TER (celkový poměr výdajů) ETF činí 0,20% P.A .. Ishares Edge MSCI USA Faktor UCITS ETF je největší ETF, který sleduje index neutrální kvality sektoru MSCI USA. ETF replikuje výkon podkladového indexu plnou replikací (nákup všech složek indexu). dividenday v ETF jsou akumulovány a reinvestovány do ETF. Ishares Edge MSCI USA Factor UCITS ETF je velmi velký ETF s řízením 1 722 mil. EUR. ETF byl spuštěn 13. října 2016 a je se sídlem v Irsku.;0.20%;0.2;EUR 1722m;1722.0;EUR;USD;Ireland;iShares;13 October 2016;;;Physical;UCITS;MSCI USA Quality Factor;Equity, United States,;;USD    Currency risk  Currency;1;Akcie;False;Severní Amerika;126.0;3.78;53.92;98.7;-3.78;0.73;7.69;3.86;37.22;-15.64;25.86;29.73;203.76;18.88;17.6;18.27;0.2;0.88;0.81;-21.98;-21.98;-21.98;-33.86;;;;;Bolsa Mexicana de Valores;-;8;;;;;;;2025-09-24T00:47:10.397169;success;0;Microsoft;6.87;Apple;5.92;Visa;4.09;Mastercard, Inc.;3.94;Meta Platforms;3.84;Eli Lilly & Co.;3.42;Netflix;2.51;The TJX Cos;2.29;Alphabet, Inc. A;1.99;;;United States;92.33;Other;5.69;;;;;;;Technology;42.07;Consumer Discretionary;10.29;Health Care;9.2;;;;;London Stock Exchange;GBX;IUQF;;;;gettex;EUR;QDVB;;;;Stuttgart Stock Exchange;EUR;QDVB;;;;Bolsa Mexicana de Valores;MXN;-;IUQAN MM;IUQAN.MX;;London Stock Exchange;USD;IUQA;IUQA LNINAVUQAU;IUQA.L3099INAV.DE;;London Stock Exchange;GBP;-;IUQF LNINAVUQAG;IUQF.L3097INAV.DE;;SIX Swiss Exchange;USD;IUQA;IUQA SEINAVUQAU;IUQA.S3099INAV.DE;;XETRA;EUR;QDVB;QDVB GYINAVUQAE;QDVB.DE3095INAV.DE;;;;;;;;;;;;;;4;71;17;13;11;10;20
IE00BD1F4M44;iShares Edge MSCI USA Value Factor UCITS ETF;https://www.justetf.com/en/etf-profile.html?isin=IE00BD1F4M44;The iShares Edge MSCI USA Value Factor UCITS ETF seeks to track the MSCI USA Enhanced Value index. The MSCI USA Enhanced Value index tracks the US value stocks. These are U.S. equities which are determined as value stocks using eight historical and forward-looking fundamental data points. The ETF's TER (total expense ratio) amounts to 0.20% p.a.. The iShares Edge MSCI USA Value Factor UCITS ETF is the cheapest and largest ETF that tracks the MSCI USA Enhanced Value index. The ETF replicates the performance of the underlying index by full replication (buying all the index constituents). The dividends in the ETF are accumulated and reinvested in the ETF. The iShares Edge MSCI USA Value Factor UCITS ETF is a very large ETF with 1,875m Euro assets under management. The ETF was launched on 13 October 2016 and is domiciled in Ireland.;Ishares Edge MSCI USA Hodnotový faktor UCITS ETF se snaží sledovat index vylepšeného hodnoty MSCI USA. Index MSCI USA vylepšená hodnota sleduje akciíy hodnoty USA. Jedná se o americké akcie, které jsou určovány jako hodnotové akciíy pomocí osmi historických a dopředu vypadajících základních datových bodů. TER (celkový poměr výdajů) ETF činí 0,20% P.A .. Ishares Edge MSCI USA hodnotový faktor UCITS ETF je nejlevnější a největší ETF, který sleduje index vylepšené hodnoty MSCI USA. ETF replikuje výkon podkladového indexu plnou replikací (nákup všech složek indexu). dividenday v ETF jsou akumulovány a reinvestovány do ETF. Ishares Edge MSCI USA Hodnotový faktor UCITS ETF je velmi velký ETF s řízením 1 875 milionů euro. ETF byl spuštěn 13. října 2016 a je se sídlem v Irsku.;0.20%;0.2;EUR 1875m;1875.0;EUR;USD;Ireland;iShares;13 October 2016;;;Physical;UCITS;MSCI USA Value Factor;Equity, United States, Value;;USD    Currency risk  Currency;1;Akcie;False;Severní Amerika;149.0;10.67;28.42;87.62;4.34;2.07;10.18;6.72;38.94;-9.22;9.76;13.46;118.4;19.67;17.63;18.11;0.54;0.49;0.74;-21.48;-21.48;-21.48;-38.67;;;;;Bolsa Mexicana de Valores;-;8;;;;;;;2025-09-24T00:47:19.709345;success;0;Intel Corp.;3.65;General Motors Co.;3.61;Micron Technology;3.29;AT&T, Inc.;3.23;Applied Materials, Inc.;2.9;Bank of America Corp.;2.53;Verizon Communications;2.42;Citigroup, Inc.;2.31;Ford Motor Co.;2.19;;;United States;94.45;Other;4.4;Netherlands;1.15;;;;;Financials;14.33;Consumer Discretionary;11.09;Technology;3.29;Materials;2.9;;;London Stock Exchange;GBX;IUVF;;;;gettex;EUR;QDVI;;;;Stuttgart Stock Exchange;EUR;QDVI;;;;Bolsa Mexicana de Valores;MXN;-;IUVLN MM;IUVLN.MX;;London Stock Exchange;USD;IUVL;IUVL LNINAVUVLU;IUVL.L421IINAV.DE;;London Stock Exchange;GBP;-;IUVF LNINAVUVLG;IUVF.L421GINAV.DE;;SIX Swiss Exchange;USD;IUVL;IUVL SEINAVUVLU;IUVL.S421IINAV.DE;;XETRA;EUR;QDVI;QDVI GYINAVUVLE;QDVI.DE421EINAV.DE;;;;;;;;;;;;;;4;70;17;13;11;10;19
IE00BD1F4N50;iShares Edge MSCI USA Momentum Factor UCITS ETF;https://www.justetf.com/en/etf-profile.html?isin=IE00BD1F4N50;The iShares Edge MSCI USA Momentum Factor UCITS ETF seeks to track the MSCI USA Momentum index. The MSCI USA Momentum index tracks stocks with a high price momentum from the United States. The index consists of titles that have experienced price increases over the past 6 and past 12 months with the assumption that increases will continue in the future. The ETF's TER (total expense ratio) amounts to 0.20% p.a.. The iShares Edge MSCI USA Momentum Factor UCITS ETF is the cheapest and largest ETF that tracks the MSCI USA Momentum index. The ETF replicates the performance of the underlying index by full replication (buying all the index constituents). The dividends in the ETF are accumulated and reinvested in the ETF. The iShares Edge MSCI USA Momentum Factor UCITS ETF is a large ETF with 526m Euro assets under management. The ETF was launched on 13 October 2016 and is domiciled in Ireland.;Ishares Edge MSCI USA Momentum Factor UCITS ETF se snaží sledovat index hybnosti MSCI USA. Index hybnosti MSCI USA sleduje akcie s vysokou cenou ze Spojených států. Index se skládá z titulů, které zažily zvýšení cen za posledních 6 a za posledních 12 měsíců s předpokladem, že zvýšení bude v budoucnu pokračovat. TER (celkový poměr nákladů) ETF činí 0,20% p.a. Ishares Edge MSCI USA Momentum Faktor UCITS ETF je nejlevnější a největší ETF, který sleduje index hybnosti MSCI USA. ETF replikuje výkon podkladového indexu plnou replikací (nákup všech složek indexu). dividenday v ETF jsou akumulovány a reinvestovány do ETF. Ishares Edge MSCI USA Momentum Factor UCITS ETF je velký ETF s managementem 526 milionů euro. ETF byl spuštěn 13. října 2016 a je se sídlem v Irsku.;0.20%;0.2;EUR 526m;526.0;EUR;USD;Ireland;iShares;13 October 2016;;;Physical;UCITS;MSCI USA Momentum Factor;Equity, United States, Momentum;;USD    Currency risk  Currency;1;Akcie;False;Severní Amerika;126.0;14.66;53.32;74.91;4.3;2.78;6.87;9.56;21.84;-12.65;5.21;40.3;226.27;22.22;19.78;21.24;0.66;0.77;0.56;-24.73;-24.73;-25.52;-33.64;;;;;Bolsa Mexicana de Valores;-;8;;;;;;;2025-09-24T00:47:26.567311;success;0;JPMorgan Chase & Co.;4.87;Netflix;4.68;Visa;4.53;Berkshire Hathaway, Inc.;4.47;Walmart, Inc.;4.41;Palantir Technologies, Inc.;4.41;Philip Morris International, Inc.;3.32;Costco Wholesale;2.99;Mastercard, Inc.;2.7;;;United States;95.65;Other;4.35;;;;;;;Technology;25.86;Financials;18.28;Consumer Staples;13.79;;;;;London Stock Exchange;GBX;IUMF;;;;gettex;EUR;QDVA;;;;Stuttgart Stock Exchange;EUR;QDVA;;;;Bolsa Mexicana de Valores;MXN;-;IUMON MM;IUMON.MX;;London Stock Exchange;USD;IUMO;IUMO LNINAVUMOU;IUMO.L421NINAV.DE;;London Stock Exchange;GBP;-;IUMF LNINAVUMOG;IUMF.L421LINAV.DE;;SIX Swiss Exchange;USD;IUMO;IUMO SEINAVUMOU;IUMO.S421NINAV.DE;;XETRA;EUR;QDVA;QDVA GYINAVUMOE;QDVA.DE421JINAV.DE;;;;;;;;;;;;;;4;68;17;10;11;10;20
IE00BD26N851;PIMCO US Short-Term High Yield Corporate Bond UCITS ETF EUR Hedged Acc;https://www.justetf.com/en/etf-profile.html?isin=IE00BD26N851;The PIMCO US Short-Term High Yield Corporate Bond UCITS ETF EUR Hedged Acc seeks to track the BofA Merrill Lynch US High Yield Constrained 0-5 (EUR Hedged) index. The BofA Merrill Lynch US High Yield Constrained 0-5 (EUR Hedged) index tracks high yield bonds from developed markets with focus on USA. Time to maturity: 0-5 years. Rating: Sub-Investment Grade. Currency hedged to Euro (EUR). The ETF's TER (total expense ratio) amounts to 0.60% p.a.. The PIMCO US Short-Term High Yield Corporate Bond UCITS ETF EUR Hedged Acc is the only ETF that tracks the BofA Merrill Lynch US High Yield Constrained 0-5 (EUR Hedged) index. The ETF replicates the performance of the underlying index by sampling technique (buying a selection of the most relevant index constituents). The interest income (coupons) in the ETF is accumulated and reinvested in the ETF. The PIMCO US Short-Term High Yield Corporate Bond UCITS ETF EUR Hedged Acc is a small ETF with 50m Euro assets under management. The ETF was launched on 11 December 2017 and is domiciled in Ireland.;Společnost PIMCO USA krátkodobá firemní dluhopis s vysokým výnosem UCITS ETF EUR HEDGED ACC se snaží sledovat index Bofa Merrill Lynch s vysokým výnosem, který je omezen 0-5 (Hedged). Indexová indexová pokladna s vysokým výnosem z rozvinutých trhů se zaměřením na USA. Čas do zralosti: 0-5 let. Hodnocení: stupeň sub-investice. Měna zajišťovala euro (EUR). TER (celkový poměr výdajů) ETF činí 0,60% p.a. PIMCO USA krátkodobý vysoký výnos firemní dluhopis UCITS ETF EUR EUR ACC je jediným ETF, který sleduje index BOFA Merrill Lynch s vysokým výnosem omezený 0-5 (EUR Hedged) index. ETF replikuje výkon základního indexu technikou vzorkování (nákup výběru nejdůležitějších složek indexu). Úrokové výnosy (kupóny) v ETF se nashromáždí a reinvestují do ETF. Společnost PIMCO USA krátkodobá firemní dluhopis UCITS ETF EUR ACC je malý ETF s spravováním 50 milionů euro. ETF byl spuštěn 11. prosince 2017 a má bydliště v Irsku.;0.60%;0.6;EUR 50m;50.0;EUR;EUR;Ireland;PIMCO;11 December 2017;Accumulating;;Physical;UCITS;;risk  Long-only    Sustainability  No;;EUR    Currency risk  Currency;1;Dluhopisy;False;Celosvětově;739.0;6.22;25.22;25.27;5.85;0.08;3.02;4.51;4.23;-7.48;9.3;6.32;23.73;6.72;7.95;7.68;0.93;0.98;0.6;-5.07;-5.07;-10.45;-20.27;;;;;London Stock Exchange;STEA;2;;;;;;;2025-09-24T00:47:33.324642;success;0;;;;;;;;;;;;;;;;;;;;;United States;67.49;Other;27.2;Canada;2.09;United Kingdom;1.74;;;;;;;;;;;;;London Stock Exchange;EUR;STEA;STEA LNINSTEA;STEA.LINSTYCiv.P;;SIX Swiss Exchange;EUR;STEA;STEA SWINSTEA;STEA.SINSTYCiv.P;;;;;;;;;;;;;;;;;;;;;;;;;;;;;;;;;;;;;;;;;;;;;;;;;;2;43;6;1;11;5;20
IE00BD34DB16;UBS Core S&P 500 UCITS ETF hCHF acc;https://www.justetf.com/en/etf-profile.html?isin=IE00BD34DB16;The UBS Core S&P 500 UCITS ETF hCHF acc seeks to track the S&P 500® (CHF Hedged) index. The S&P 500® (CHF Hedged) index tracks the largest US stocks. Currency hedged to Swiss Francs (CHF). The ETF's TER (total expense ratio) amounts to 0.06% p.a.. The ETF replicates the performance of the underlying index by full replication (buying all the index constituents). The dividends in the ETF are accumulated and reinvested in the ETF. The UBS Core S&P 500 UCITS ETF hCHF acc has 364m Euro assets under management. The ETF was launched on 2 November 2016 and is domiciled in Ireland.;UBS Core S&P 500 UCITS ETF HCHF ACC se snaží sledovat index S&P 500® (CHF Hedged). Index S&P 500® (CHF Hedged) sleduje největší americké akcie. Měna byla zajištěna švýcarským frankům (CHF). TER (celkový poměr nákladů) ETF činí 0,06% p.a. ETF replikuje výkon podkladového indexu plnou replikací (nákup všech složek indexu). dividenday v ETF jsou akumulovány a reinvestovány do ETF. UBS Core S&P 500 UCITS ETF HCHF ACC má ve správě aktiv 364 milionů euro. ETF byla spuštěna 2. listopadu 2016 a je bydliště v Irsku.;0.06%;0.06;EUR 364m;364.0;EUR;CHF;Ireland;UBS ETF;2 November 2016;Accumulating;;Physical;UCITS;S&P 500;Equity, United States;;CHF    Currency risk  Currency;1;Akcie;False;Severní Amerika;503.0;14.44;59.31;105.05;11.68;4.5;11.3;18.4;32.96;-17.58;26.74;18.05;208.06;18.97;18.03;18.63;0.76;0.93;0.83;-19.87;-19.87;-24.21;-34.24;;;;;Bolsa Mexicana de Valores;-;2;;;;;;;2025-09-24T00:47:40.590652;success;0;Microsoft;7.36;Apple;5.75;Amazon.com, Inc.;4.11;Meta Platforms;3.12;Broadcom;2.56;Alphabet, Inc. A;2.07;Alphabet, Inc. C;1.68;Berkshire Hathaway, Inc.;1.61;Tesla;1.6;;;United States;95.6;Other;3.01;;;;;;;Technology;36.21;Financials;10.96;Consumer Discretionary;10.51;;;;;Bolsa Mexicana de Valores;MXN;-;SP500SN MM;SP500SN.MX;;SIX Swiss Exchange;CHF;SP500S;SP500S SWISP500S;SP500S.SSP500SCHFINAV=SOLA;;;;;;;;;;;;;;;;;;;;;;;;;;;;;;;;;;;;;;;;;;;;;;;;;;4;67;26;5;11;5;20
IE00BD34DK07;UBS Core S&P 500 UCITS ETF hEUR acc;https://www.justetf.com/en/etf-profile.html?isin=IE00BD34DK07;The UBS Core S&P 500 UCITS ETF hEUR acc seeks to track the S&P 500® (EUR Hedged) index. The S&P 500® (EUR Hedged) index tracks the largest US stocks. Currency hedged to Euro (EUR). The ETF's TER (total expense ratio) amounts to 0.06% p.a.. The ETF replicates the performance of the underlying index by full replication (buying all the index constituents). The dividends in the ETF are accumulated and reinvested in the ETF. The UBS Core S&P 500 UCITS ETF hEUR acc has 136m Euro assets under management. The ETF was launched on 2 November 2016 and is domiciled in Ireland.;UBS Core S&P 500 UCITS ETF HEUR ACC se snaží sledovat index S&P 500® (EUR Hedged). Index S&P 500® (EUR Hedged) sleduje největší americké akcie. Měna zajišťovala euro (EUR). TER (celkový poměr nákladů) ETF činí 0,06% p.a. ETF replikuje výkon podkladového indexu plnou replikací (nákup všech složek indexu). dividenday v ETF jsou akumulovány a reinvestovány do ETF. UBS Core S&P 500 UCITS ETF HEUR ACC má ve správě 136 milionů euro aktiv. ETF byla spuštěna 2. listopadu 2016 a je bydliště v Irsku.;0.06%;0.06;EUR 136m;136.0;EUR;EUR;Ireland;UBS ETF;2 November 2016;Accumulating;;Physical;UCITS;S&P 500;Equity, United States;;EUR    Currency risk  Currency;1;Akcie;False;Severní Amerika;503.0;16.44;73.0;91.96;13.18;2.2;11.42;17.26;27.48;-21.17;22.14;22.26;191.04;19.21;17.88;18.51;0.86;1.12;0.75;-19.01;-19.01;-26.81;-34.65;;;;;gettex;UEQD;4;;;;;;;2025-09-24T00:47:47.568103;success;0;Microsoft;7.36;Apple;5.75;Amazon.com, Inc.;4.11;Meta Platforms;3.12;Broadcom;2.56;Alphabet, Inc. A;2.07;Alphabet, Inc. C;1.68;Berkshire Hathaway, Inc.;1.61;Tesla;1.6;;;United States;95.6;Other;3.01;;;;;;;Technology;36.21;Financials;10.96;Consumer Discretionary;10.51;;;;;gettex;EUR;UEQD;;;;Stuttgart Stock Exchange;EUR;UEQD;;;;SIX Swiss Exchange;EUR;SP500E;SP500E SWISP500E;SP500E.SISP500EINAV=SOLA;;XETRA;EUR;UEQD;UEQD GYISP500E;UEQD.DEISP500EINAV=SOLA;;;;;;;;;;;;;;;;;;;;;;;;;;;;;;;;;;;;;;4;67;26;5;11;5;20
