IE00BC7GZW19;SPDR Bloomberg 0-3 Year Euro Corporate Bond UCITS ETF;https://www.justetf.com/en/etf-profile.html?isin=IE00BC7GZW19;The SPDR Bloomberg 0-3 Year Euro Corporate Bond UCITS ETF seeks to track the Bloomberg Euro Corporate Bond 0-3 index. The Bloomberg Euro Corporate Bond 0-3 index tracks Euro denominated corporate bonds. Rating: Investment grade. Time to maturity: 0-3 years. The ETF's TER (total expense ratio) amounts to 0.20% p.a.. The SPDR Bloomberg 0-3 Year Euro Corporate Bond UCITS ETF is the cheapest and largest ETF that tracks the Bloomberg Euro Corporate Bond 0-3 index. The ETF replicates the performance of the underlying index by sampling technique (buying a selection of the most relevant index constituents). The interest income (coupons) in the ETF is distributed to the investors (Semi annually). The SPDR Bloomberg 0-3 Year Euro Corporate Bond UCITS ETF is a large ETF with 757m Euro assets under management. The ETF was launched on 27 August 2013 and is domiciled in Ireland.;SPDR Bloomberg 0-3 Year Euro Corporate Bond UCITS ETF se snaží sledovat index Bloomberg Euro Corporate Bond 0-3. Bloomberg Euro Corporate Bond 0-3 Index sleduje firemní dluhopisy euro. Hodnocení: Investiční třída. Čas do zralosti: 0-3 roky. TER (celkový poměr nákladů) činí 0,20% P.A. ETF replikuje výkon základního indexu technikou vzorkování (nákup výběru nejdůležitějších složek indexu). Úrokové výnosy (kupóny) v ETF jsou distribuovány investorům (semifinále každoročně). SPDR Bloomberg 0-3 Year Euro Corporate Bond UCITS ETF je velký ETF s managementem 757 milionů euro. ETF byl spuštěn 27. srpna 2013 a je se sídlem v Irsku.;0.20%;0.2;EUR 757m;757.0;EUR;EUR;Ireland;SPDR ETF;27 August 2013;;Semi annually;Physical;UCITS;Bloomberg 0-3 Year Euro Corporate Bond;risk  Long-only    Sustainability  No;;EUR    Currency risk  Currency;1;Dluhopisy;False;Celosvětově;1612.0;3.65;11.73;7.43;2.46;0.23;0.75;1.76;-0.23;-3.81;4.36;4.35;11.23;2.07;1.61;1.41;1.77;2.33;1.02;-1.45;-1.45;-4.98;-4.98;;;;;Extracted (method 1);SYBD;0;3.07%;3.07;EUR 0.92;0.92;EUR;method2_regex;2025-09-24T00:44:27.497203;success;0;XS2193661324;0.22;XS2710354544;0.2;XS2486589596;0.2;XS1615079974;0.2;XS1458408561;0.19;BE0002839208;0.18;XS2180007549;0.18;;;;;;;Other;45.55;France;16.38;United States;16.06;Netherlands;13.53;United Kingdom;8.48;IT;16.06;;;;;;;;;;;;;;;;;;;;;;;;;;;;;;;;;;;;;;;;;;;;;;;;;;;;;;;;;;;;;;;;;;;;;4;68;17;10;13;10;18
IE00BC7GZX26;SPDR Bloomberg 0-3 Year U.S. Corporate Bond UCITS ETF USD;https://www.justetf.com/en/etf-profile.html?isin=IE00BC7GZX26;The SPDR Bloomberg 0-3 Year U.S. Corporate Bond UCITS ETF USD seeks to track the Bloomberg US Corporate 0-3 index. The Bloomberg US Corporate 0-3 index tracks U.S. Dollar-denominated corporate bond market for fixed-rate, investment grade securities with a maturity of less than 3 years. The ETF's TER (total expense ratio) amounts to 0.12% p.a.. The SPDR Bloomberg 0-3 Year U.S. Corporate Bond UCITS ETF USD is the only ETF that tracks the Bloomberg US Corporate 0-3 index. The ETF replicates the performance of the underlying index by sampling technique (buying a selection of the most relevant index constituents). The interest income (coupons) in the ETF is distributed to the investors (Semi annually). The SPDR Bloomberg 0-3 Year U.S. Corporate Bond UCITS ETF USD is a small ETF with 86m Euro assets under management. The ETF was launched on 27 August 2013 and is domiciled in Ireland.;SPDR Bloomberg 0-3 Year US Corporate Bond UCITS ETF USD se snaží sledovat index Bloomberg US Corporate 0-3. Společnost Bloomberg US Corporate 0-3 Index sleduje americký trh s firemními dluhopisy v americkém dolaru s cennými papíry s pevnou sazbou, investiční cenné papíry se splatností méně než 3 roky. TER (celkový poměr nákladů) ETF činí 0,12% p.a. ETF replikuje výkon základního indexu technikou vzorkování (nákup výběru nejdůležitějších složek indexu). Úrokové výnosy (kupóny) v ETF jsou distribuovány investorům (semifinále každoročně). Společnost SPDR Bloomberg 0-3 Year US Corporate Bond UCITS ETF USD je malá ETF s managementem 86 milionů euro. ETF byl spuštěn 27. srpna 2013 a je se sídlem v Irsku.;0.12%;0.12;EUR 86m;86.0;EUR;USD;Ireland;SPDR ETF;27 August 2013;;Semi annually;Physical;UCITS;Bloomberg 0-3 Year U;risk  Long-only    Sustainability  No;;USD    Currency risk  Currency;1;Dluhopisy;False;Celosvětově;927.0;-0.68;-1.97;13.22;-8.06;-0.89;-0.58;-5.47;8.22;3.85;1.78;12.03;47.59;8.65;8.13;7.66;-0.08;-0.08;0.33;-11.2;-12.24;-12.24;-15.86;;;;;Extracted (method 1);SYBF;0;5.13%;5.13;EUR 2.17;2.17;EUR;method2_regex;2025-09-24T00:44:36.168636;success;0;;;;;;;;;;;;;;;;;;;;;United States;65.36;Other;24.18;United Kingdom;3.94;Canada;3.94;Japan;2.58;;;;;;;;;;;;;;;;;;;;;;;;;;;;;;;;;;;;;;;;;;;;;;;;;;;;;;;;;;;;;;;;;;;;;;;3;54;22;1;13;10;8
IE00BCBJF711;SPDR Bloomberg 0-5 Year Sterling Corporate Bond UCITS ETF;https://www.justetf.com/en/etf-profile.html?isin=IE00BCBJF711;The SPDR Bloomberg 0-5 Year Sterling Corporate Bond UCITS ETF seeks to track the Bloomberg Sterling Corporate Bond 0-5 index. The Bloomberg Sterling Corporate Bond 0-5 index tracks Sterling-denominated corporate bonds from industrial, utility and financial issuers publicly issued. Rating: Investment Grade. Time to maturity: 0-5 years. The ETF's TER (total expense ratio) amounts to 0.20% p.a.. The SPDR Bloomberg 0-5 Year Sterling Corporate Bond UCITS ETF is the only ETF that tracks the Bloomberg Sterling Corporate Bond 0-5 index. The ETF replicates the performance of the underlying index by sampling technique (buying a selection of the most relevant index constituents). The interest income (coupons) in the ETF is distributed to the investors (Semi annually). The SPDR Bloomberg 0-5 Year Sterling Corporate Bond UCITS ETF has 220m Euro assets under management. The ETF was launched on 17 February 2014 and is domiciled in Ireland.;SPDR Bloomberg 0-5 Year Sterling Corporate Bond UCITS ETF se snaží sledovat index Bloomberg Sterling Corporate Bond 0-5. Společnost Bloomberg Sterling Corporate Bond 0-5 indexová skladby firemní dluhopisy denominované Sterlingem od průmyslových, veřejných a finančních emitentů veřejně vydaných. Hodnocení: Investiční třída. Čas do zralosti: 0-5 let. TER (celkový poměr nákladů) ETF činí 0,20% p.a. ETF replikuje výkon základního indexu technikou vzorkování (nákup výběru nejdůležitějších složek indexu). Úrokové výnosy (kupóny) v ETF jsou distribuovány investorům (semifinále každoročně). SPDR Bloomberg 0-5 Year Sterling Corporate Bond UCITS ETF má ve správě 220m euro aktiv. ETF byl spuštěn 17. února 2014 a je se sídlem v Irsku.;0.20%;0.2;EUR 220m;220.0;EUR;GBP;Ireland;SPDR ETF;17 February 2014;;Semi annually;Physical;UCITS;Bloomberg 0-5 Year Sterling Corporate Bond;risk  Long-only    Sustainability  No;;GBP    Currency risk  Currency;1;Dluhopisy;False;Celosvětově;463.0;1.54;19.81;17.31;-0.56;-0.3;-0.63;-0.63;6.15;-11.0;9.87;9.84;23.56;5.52;6.08;6.27;0.28;1.02;0.52;-4.88;-5.86;-16.54;-20.7;;;;;Extracted (method 1);SYBQ;0;4.81%;4.81;EUR 1.61;1.61;EUR;method2_regex;2025-09-24T00:44:44.162873;success;0;XS1939253917;0.57;XS2193663619;0.56;XS0379947236;0.55;XS2552367687;0.54;XS2553549903;0.54;XS2348234936;0.54;XS1961843171;0.53;XS2570940226;0.5;XS2346516250;0.5;;;United Kingdom;41.06;Other;32.27;United States;13.31;Netherlands;7.26;France;6.1;IT;41.06;;;;;;;;;;;;;;;;;;;;;;;;;;;;;;;;;;;;;;;;;;;;;;;;;;;;;;;;;;;;;;;;;;;;;4;65;17;5;13;10;20
IE00BCBJG560;SPDR MSCI World Small Cap UCITS ETF;https://www.justetf.com/en/etf-profile.html?isin=IE00BCBJG560;The SPDR MSCI World Small Cap UCITS ETF seeks to track the MSCI World Small Cap index. The MSCI World Small Cap index tracks small sized companies in developed equity markets globally The ETF's TER (total expense ratio) amounts to 0.45% p.a.. The ETF replicates the performance of the underlying index by sampling technique (buying a selection of the most relevant index constituents). The dividends in the ETF are accumulated and reinvested in the ETF. The SPDR MSCI World Small Cap UCITS ETF is a very large ETF with 1,318m Euro assets under management. The ETF was launched on 25 November 2013 and is domiciled in Ireland.;Světový svět SPDR MSCI Small Cap UCITS ETF se snaží sledovat index malé čepice MSCI. Světový index MSCI Světový index Small Cap sleduje malé společnosti na rozvinutých akciových trzích po celém světě celosvětově ETF TER (celkový poměr nákladů) činí 0,45% p.a. dividenday v ETF jsou akumulovány a reinvestovány do ETF. Světový SPDR MSCI Small Cap UCITS ETF je velmi velký ETF s managementem 1 318 mil. EUR. ETF byl spuštěn 25. listopadu 2013 a je se sídlem v Irsku.;0.45%;0.45;EUR 1318m;1318.0;EUR;USD;Ireland;SPDR ETF;25 November 2013;;;Physical;UCITS;MSCI World;Equity, World, Small Cap;;USD    Currency risk  Currency;1;Akcie;False;Celosvětově;3512.0;8.97;29.86;70.42;2.95;0.81;9.97;9.18;25.11;-13.79;11.7;14.68;183.08;16.92;16.38;16.61;0.53;0.56;0.68;-22.76;-22.76;-22.76;-40.4;;;;;Bolsa Mexicana de Valores;-;7;;;;;;;2025-09-24T00:44:51.117331;success;0;SoFi Technologies;0.27;Tapestry;0.25;Casey's General Stores;0.23;Flex Ltd;0.22;Insmed;0.22;US Foods;0.21;Guidewire Software;0.21;Curtiss-Wright;0.21;Rocket Lab Corp;0.2;;;United States;54.03;Other;25.63;Japan;12.13;United Kingdom;4.85;Australia;3.36;Industrials;19.04;Financials;14.5;Consumer Discretionary;12.07;Technology;11.28;;;gettex;EUR;ZPRS;;;;Stuttgart Stock Exchange;EUR;ZPRS;;;;Bolsa Mexicana de Valores;MXN;-;WDSCN MM;WDSCN.MX;;London Stock Exchange;USD;WDSC;WDCS LNINZPRSU;WDSC.LINZPRSC.ivOQ;;London Stock Exchange;GBP;WOSC;WOSC LNINZPRSP;WOSC.LINZPRSC.ivOQ;;SIX Swiss Exchange;CHF;WOSC;WOSC SEINZPRSC;WOSC.SINZPRSC.ivOQ;;XETRA;EUR;ZPRS;ZPRS GYINZPRSE;ZPRS.DEINZPRSC.ivOQ;;;;;;;;;;;;;;;;;;;;4;68;12;13;13;10;20
IE00BCHWNQ94;Xtrackers MSCI World Screened UCITS ETF 1D;https://www.justetf.com/en/etf-profile.html?isin=IE00BCHWNQ94;The Xtrackers MSCI World Screened UCITS ETF 1D seeks to track the MSCI World Select Screened index. The MSCI World Select Screened index tracks large and midcap securities across 23 developed markets countries. The stocks included are filtered according to ESG criteria (environmental, social and corporate governance). Excluded sectors and companies: weapons, tobacco, thermal coal, oil sands, non-compliance with UN Global Compact. The ETF's TER (total expense ratio) amounts to 0.19% p.a.. The Xtrackers MSCI World Screened UCITS ETF 1D is the cheapest and largest ETF that tracks the MSCI World Select Screened index. The ETF replicates the performance of the underlying index by full replication (buying all the index constituents). The dividends in the ETF are distributed to the investors (Quarterly). The Xtrackers MSCI World Screened UCITS ETF 1D has 116m Euro assets under management. The ETF was launched on 26 March 2018 and is domiciled in Ireland.;Směrovězená uCITS ETF 1D SPOLEČNOST SVĚTOVÁNÍ MSCI MSCI se snaží sledovat index Screening MSCI Select. Světový indexový index MSCI vybírá velké a cenné papíry MidCap na 23 rozvinutých zemích. Zahrnuté akcie jsou filtrovány podle kritérií ESG (environmentální, sociální a správa a společností). Vyloučené odvětví a společnosti: Zbraně, tabák, tepelné uhlí, ropné písky, nedodržování globálního kompaktního oSN. TER (celkový poměr nákladů) ETF činí 0,19% p.a. ETF replikuje výkon podkladového indexu plnou replikací (nákup všech složek indexu). dividenday v ETF jsou distribuovány investorům (čtvrtletně). Světovaný svět XTrackers MSCI UCITS ETF 1D má ve správě 116 milionů euro aktiv. ETF byl spuštěn 26. března 2018 a je se sídlem v Irsku.;0.19%;0.19;EUR 116m;116.0;EUR;USD;Ireland;Xtrackers;26 March 2018;;Quarterly;Physical;UCITS;MSCI World;Equity, World, Social/Environmental;Yes;USD    Currency risk  Currency;1;Akcie;False;Celosvětově;1195.0;12.25;51.83;78.73;2.93;1.32;8.92;8.29;24.47;-14.58;20.49;26.4;100.85;16.58;14.94;16.04;0.74;1.0;0.77;-21.12;-21.12;-21.12;-32.06;;;;;gettex;XDWY;5;1.23%;1.23;EUR 0.29;0.29;EUR;method2_regex;2025-09-24T00:44:56.145866;success;0;Microsoft;4.91;Apple;4.25;Amazon.com, Inc.;3.08;Meta Platforms;2.13;Broadcom;1.83;Alphabet, Inc. A;1.6;Alphabet, Inc. C;1.37;Tesla;1.29;JPMorgan Chase & Co.;1.18;;;United States;68.54;Other;19.54;Japan;5.43;United Kingdom;3.31;Canada;3.18;Technology;29.72;Financials;15.43;Consumer Discretionary;10.85;Health Care;9.35;;;gettex;EUR;XDWY;;;;Stuttgart Stock Exchange;EUR;XDWY;;;;Borsa Italiana;EUR;XDWY;XDWY IMXDWYEUIV;XDWY.MIXDWYEURINAV=SOLA;;London Stock Exchange;USD;XDWY;XDWY LNXDWYUSIV;XDWY.LXDWYUSDINAV=SOLA;;XETRA;EUR;XDWY;XDWY GY;XDWY.DE;;;;;;;;;;;;;;;;;;;;;;;;;;;;;;;;3;63;17;5;11;10;20
IE00BCHWNS19;Xtrackers MSCI USA Energy UCITS ETF 1D;https://www.justetf.com/en/etf-profile.html?isin=IE00BCHWNS19;The Xtrackers MSCI USA Energy UCITS ETF 1D seeks to track the MSCI USA Energy 20/35 Custom index. The MSCI USA Energy 20/35 Custom index tracks large and medium sized US-American companies from the energy sector. The weight of the largest constituent is constrained to 35% and the weights of all other constituents are constrained to a maximum of 20%. The ETF's TER (total expense ratio) amounts to 0.12% p.a.. The Xtrackers MSCI USA Energy UCITS ETF 1D is the only ETF that tracks the MSCI USA Energy 20/35 Custom index. The ETF replicates the performance of the underlying index by full replication (buying all the index constituents). The dividends in the ETF are distributed to the investors (Annually). The Xtrackers MSCI USA Energy UCITS ETF 1D is a small ETF with 63m Euro assets under management. The ETF was launched on 12 September 2017 and is domiciled in Ireland.;Xtrackers MSCI USA Energy UCITS ETF 1D se snaží sledovat vlastní index MSCI USA Energy 20/35. Vlastní index MSCI USA Energy 20/35 sleduje velké a středně velké USA-americké společnosti z energetického sektoru. Hmotnost největší složky je omezena na 35% a hmotnosti všech ostatních složek jsou omezeny na maximálně 20%. TER (celkový poměr nákladů) činí 0,12% p.a. ETF replikuje výkon podkladového indexu plnou replikací (nákup všech složek indexu). dividenday v ETF jsou distribuovány investorům (každoročně). Xtrackers MSCI USA Energy UCITS ETF 1D je malý ETF s managementem 63 milionů euro. ETF byl spuštěn 12. září 2017 a má bydliště v Irsku.;0.12%;0.12;EUR 63m;63.0;EUR;USD;Ireland;Xtrackers;12 September 2017;;Annually;Physical;UCITS;MSCI USA Energy  1D;Equity, United States, Energy;;USD    Currency risk  Currency;1;Akcie;False;Severní Amerika;22.0;-2.07;6.09;221.95;-7.6;-1.27;-2.29;-10.82;63.64;73.95;-5.36;13.1;82.73;26.36;24.52;28.85;-0.08;0.08;0.91;-23.89;-23.89;-23.89;-65.9;;;;;London Stock Exchange;XSEN;7;2.88%;2.88;EUR 1.12;1.12;EUR;method2_regex;2025-09-24T00:45:06.683783;success;0;Chevron Corp.;17.96;ConocoPhillips;7.29;The Williams Cos;4.31;EOG Resources;3.99;Kinder Morgan;3.34;Marathon Petroleum Corp.;3.17;Cheniere Energy, Inc.;3.1;ONEOK;3.06;Schlumberger Ltd.;3.06;;;United States;100.0;;;;;;;;;;;;;;;;;;;gettex;EUR;XUEN;;;;Stuttgart Stock Exchange;EUR;XUEN;;;;London Stock Exchange;GBX;XSEN;XSEN LNXUENEUIV;XSEN.LXUENEURINAV=SOLA;;London Stock Exchange;USD;XUEN;XUEN LNXUENUSIV;XUEN.LXUENUSDINAV=SOLA;;SIX Swiss Exchange;USD;XUEN;XSENGBIV;XSENINAV=SOLA;;SIX Swiss Exchange;CHF;XUEN;XUEN SWXSENGBIV;XUEN.SXSENINAV=SOLA;;XETRA;EUR;XUEN;XUEN GY;XUEN.DE;;;;;;;;;;;;;;;;;;;;3;55;22;1;11;10;11
IE00BCHWNT26;Xtrackers MSCI USA Financials UCITS ETF 1D;https://www.justetf.com/en/etf-profile.html?isin=IE00BCHWNT26;The Xtrackers MSCI USA Financials UCITS ETF 1D seeks to track the MSCI USA Financials index. The MSCI USA Financials index tracks large- and mid-cap US-American financials. The ETF's TER (total expense ratio) amounts to 0.12% p.a.. The Xtrackers MSCI USA Financials UCITS ETF 1D is the only ETF that tracks the MSCI USA Financials index. The ETF replicates the performance of the underlying index by full replication (buying all the index constituents). The dividends in the ETF are distributed to the investors (Annually). The Xtrackers MSCI USA Financials UCITS ETF 1D is a very large ETF with 1,306m Euro assets under management. The ETF was launched on 12 September 2017 and is domiciled in Ireland.;Xtrackers MSCI USA Financials UCITS ETF 1D se snaží sledovat index MSCI USA Financials. Index MSCI USA Finanční index sleduje americké a americké finanční prostředky na střední a střední kapitalizaci. TER (celkový poměr nákladů) ETF činí 0,12% P.A .. Xtrackers MSCI USA Financials UCITS ETF 1D je jediný ETF, který sleduje index MSCI USA Financials. ETF replikuje výkon podkladového indexu plnou replikací (nákup všech složek indexu). dividenday v ETF jsou distribuovány investorům (každoročně). Xtrackers MSCI USA Financials UCITS ETF 1D je velmi velký ETF s spravováním 1 306 milionů euro. ETF byl spuštěn 12. září 2017 a má bydliště v Irsku.;0.12%;0.12;EUR 1306m;1306.0;EUR;USD;Ireland;Xtrackers;12 September 2017;;Annually;Physical;UCITS;MSCI USA Financials  1D;Equity, United States, Financials;;USD    Currency risk  Currency;1;Akcie;False;Severní Amerika;83.0;16.1;54.54;150.86;0.11;-0.29;6.06;2.89;46.43;-7.16;10.23;39.55;156.36;22.46;19.52;21.36;0.72;0.8;0.94;-21.46;-21.46;-21.87;-43.78;;;;;London Stock Exchange;XSFN;7;1.21%;1.21;EUR 0.41;0.41;EUR;method2_regex;2025-09-24T00:45:15.392137;success;0;Berkshire Hathaway, Inc.;8.46;Visa;8.02;Mastercard, Inc.;6.04;Bank of America Corp.;4.6;Wells Fargo & Co.;3.54;The Goldman Sachs Group, Inc.;3.01;Citigroup, Inc.;2.39;Morgan Stanley;2.32;American Express Co.;2.26;;;United States;93.97;Other;4.69;Switzerland;1.34;;;;;Technology;17.84;IT;2.39;;;;;;;gettex;EUR;XUFN;;;;Stuttgart Stock Exchange;EUR;XUFN;;;;London Stock Exchange;GBX;XSFN;XSFN LNXUFNUSIV;XSFN.LXUFNUSDINAV=SOLA;;London Stock Exchange;USD;XUFN;XUFN LNXSFNGBIV;XUFN.LXSFNINAV=SOLA;;SIX Swiss Exchange;USD;XUFN;XUFN SWXUFNEUIV;XUFNEURINAV=SOLA;;SIX Swiss Exchange;CHF;XUFN;XUFNEUIV;XUFN.SXUFNEURINAV=SOLA;;XETRA;EUR;XUFN;XUFN GY;XUFN.DE;;;;;;;;;;;;;;;;;;;;5;76;22;13;11;10;20
IE00BCHWNV48;Xtrackers MSCI USA Industrials UCITS ETF 1D;https://www.justetf.com/en/etf-profile.html?isin=IE00BCHWNV48;The Xtrackers MSCI USA Industrials UCITS ETF 1D seeks to track the MSCI USA Industrials index. The MSCI USA Industrials index tracks the US industrials sector. The ETF's TER (total expense ratio) amounts to 0.12% p.a.. The Xtrackers MSCI USA Industrials UCITS ETF 1D is the only ETF that tracks the MSCI USA Industrials index. The ETF replicates the performance of the underlying index by full replication (buying all the index constituents). The dividends in the ETF are distributed to the investors (Annually). The Xtrackers MSCI USA Industrials UCITS ETF 1D has 418m Euro assets under management. The ETF was launched on 21 January 2021 and is domiciled in Ireland.;Xtrackers MSCI USA Industrials UCITS ETF 1D se snaží sledovat index MSCI USA Industrials. Index MSCI USA Industrials sleduje americký průmyslový sektor. TER (celkový poměr nákladů) činí 0,12% p.a. Xtrackers MSCI USA Industrials UCITS ETF 1D je jediný ETF, který sleduje index MSCI USA Industrials. ETF replikuje výkon podkladového indexu plnou replikací (nákup všech složek indexu). dividenday v ETF jsou distribuovány investorům (každoročně). Xtrackers MSCI USA Industrials UCITS ETF 1D má pod správou aktiva 418 milionů euro. ETF byl spuštěn 21. ledna 2021 a je se sídlem v Irsku.;0.12%;0.12;EUR 418m;418.0;EUR;USD;Ireland;Xtrackers;21 January 2021;;Annually;Physical;UCITS;MSCI USA Industrials  1D;Equity, United States, Industrials;;USD    Currency risk  Currency;1;Akcie;False;Severní Amerika;88.0;8.91;54.63;;2.43;-1.52;4.8;6.54;;-1.64;16.4;24.05;87.56;20.86;18.28;;0.43;0.85;;-22.06;-22.06;;-22.06;;;;;gettex;XUIN;3;1.11%;1.11;EUR 0.92;0.92;EUR;method2_regex;2025-09-24T00:45:23.169258;success;0;RTX;4.33;Caterpillar;4.25;GE Vernova;3.66;The Boeing Co.;3.48;Uber Technologies, Inc.;3.38;Eaton Corp. Plc;3.13;Honeywell International, Inc.;2.95;Union Pacific;2.76;Deere & Co;2.68;;;United States;86.05;Other;7.14;;;;;;;Technology;4.79;;;;;;;;;gettex;EUR;XUIN;;;;London Stock Exchange;USD;XUIN;XUIN LNXUINUSIV;XUIN.LXUINUSDINAV=SOLA;;XETRA;EUR;XUIN;XUIN GYXUINEUIV;XUIN.DEXUINEURINAV=SOLA;;;;;;;;;;;;;;;;;;;;;;;;;;;;;;;;;;;;;;;;;;;;3;63;22;5;6;10;20
IE00BCHWNW54;Xtrackers MSCI USA Health Care UCITS ETF 1D;https://www.justetf.com/en/etf-profile.html?isin=IE00BCHWNW54;The Xtrackers MSCI USA Health Care UCITS ETF 1D seeks to track the MSCI USA Health Care index. The MSCI USA Health Care index tracks large and medium sized US-American companies from the health care sector The ETF's TER (total expense ratio) amounts to 0.12% p.a.. The Xtrackers MSCI USA Health Care UCITS ETF 1D is the only ETF that tracks the MSCI USA Health Care index. The ETF replicates the performance of the underlying index by full replication (buying all the index constituents). The dividends in the ETF are distributed to the investors (Annually). The Xtrackers MSCI USA Health Care UCITS ETF 1D is a large ETF with 583m Euro assets under management. The ETF was launched on 12 September 2017 and is domiciled in Ireland.;Xtrackers MSCI USA Health Care UCITS ETF 1D se snaží sledovat index MSCI USA Health Care. Index zdravotní péče MSCI USA sleduje velké a středně velké USA-americké společnosti ze zdravotnického sektoru ETF TER (celkový poměr nákladů) činí 0,12% P.A. Xtrackers MSCI USA Health Care UCITS ETF 1D je jediným ETF, který sleduje index péče o MSCI USA. ETF replikuje výkon podkladového indexu plnou replikací (nákup všech složek indexu). dividenday v ETF jsou distribuovány investorům (každoročně). Xtrackers MSCI USA Health Care UCITS ETF 1D je velký ETF s managementem 583 milionů euro. ETF byl spuštěn 12. září 2017 a má bydliště v Irsku.;0.12%;0.12;EUR 583m;583.0;EUR;USD;Ireland;Xtrackers;12 September 2017;;Annually;Physical;UCITS;MSCI USA Health Care  1D;Equity, United States, Health Care;;USD    Currency risk  Currency;1;Akcie;False;Severní Amerika;64.0;-14.12;-1.74;41.52;-10.49;-1.6;2.39;-12.17;35.25;2.98;-1.64;8.81;89.07;17.3;15.4;16.11;-0.82;-0.04;0.45;-21.84;-21.84;-21.84;-27.86;;;;;London Stock Exchange;XSHC;7;1.46%;1.46;EUR 0.69;0.69;EUR;method2_regex;2025-09-24T00:45:31.984483;success;0;Johnson & Johnson;8.01;AbbVie, Inc.;6.66;UnitedHealth Group;4.84;Abbott Laboratories;4.43;Merck & Co., Inc.;4.09;Thermo Fisher Scientific, Inc.;3.58;Intuitive Surgical;3.57;Amgen, Inc.;3.22;Boston Scientific Corp.;3.14;;;United States;95.62;Other;1.6;;;;;;;IT;4.84;;;;;;;;;gettex;EUR;XUHC;;;;Stuttgart Stock Exchange;EUR;XUHC;;;;London Stock Exchange;GBX;XSHC;XSHC LNXUHCEUIV;XSHC.LXUHCEURINAV=SOLA;;London Stock Exchange;USD;XUHC;XUHC LNXUHCUSIV;XUHC.LXUHCUSDINAV=SOLA;;SIX Swiss Exchange;USD;XUHC;XSHCGBIV;XSHCINAV=SOLA;;SIX Swiss Exchange;CHF;XUHC;XUHC SWXSHCGBIV;XUHC.SXSHCINAV=SOLA;;XETRA;EUR;XUHC;XUHC GY;XUHC.DE;;;;;;;;;;;;;;;;;;;;3;61;22;10;11;10;8
