IE00B9F5YL18;Vanguard FTSE Developed Asia Pacific ex Japan UCITS ETF Distributing;https://www.justetf.com/en/etf-profile.html?isin=IE00B9F5YL18;The Vanguard FTSE Developed Asia Pacific ex Japan UCITS ETF Distributing seeks to track the FTSE Developed Asia Pacific ex Japan index. The FTSE Developed Asia Pacific ex Japan index tracks large and mid cap stocks from developed countries in the Asia Pacific region excluding Japan. The ETF's TER (total expense ratio) amounts to 0.15% p.a.. The Vanguard FTSE Developed Asia Pacific ex Japan UCITS ETF Distributing is the cheapest and largest ETF that tracks the FTSE Developed Asia Pacific ex Japan index. The ETF replicates the performance of the underlying index by full replication (buying all the index constituents). The dividends in the ETF are distributed to the investors (Quarterly). The Vanguard FTSE Developed Asia Pacific ex Japan UCITS ETF Distributing is a very large ETF with 1,169m Euro assets under management. The ETF was launched on 21 May 2013 and is domiciled in Ireland.;Vanguard FTSE vyvinula Asia Pacific Ex Japan UCITS ETF distribuující usiluje o sledování indexu FTSE vyvinutého Asia Pacific Ex Japan. FTSE vyvinula index Asie Pacific Ex Japan Index skladby velké a střední kapitálové akciíy z rozvinutých zemí v asijsko -pacifickém regionu s výjimkou Japonska. TER (celkový poměr nákladů) ETF činí 0,15% P.A .. Vanguard FTSE vyvinul Asia Pacific Ex Japan UCITS ETF distribuující je nejlevnější a největší ETF, který sleduje index Asie Pacific v Asic Pacific. ETF replikuje výkon podkladového indexu plnou replikací (nákup všech složek indexu). dividenday v ETF jsou distribuovány investorům (čtvrtletně). Společnost Vanguard FTSE vyvinula Asia Pacific Ex Japan UCITS ETF distribuující je velmi velká ETF s 1 169 miliony euro. ETF byl spuštěn 21. května 2013 a je se sídlem v Irsku.;0.15%;0.15;EUR 1169m;1169.0;EUR;USD;Ireland;Vanguard;21 May 2013;Distributing;Quarterly;Physical;UCITS;FTSE Developed Asia Pacific ex Japan  Distributing;Equity, Asia Pacific;;USD    Currency risk  Currency;1;Akcie;False;Asie a Pacifik;362.0;10.88;23.55;50.24;14.0;2.26;8.25;14.22;9.46;-7.26;7.2;0.3;97.88;16.56;15.27;15.1;0.66;0.48;0.56;-19.89;-19.89;-19.89;-37.77;;;;;Bolsa Mexicana de Valores;-;11;3.14%;3.14;EUR 0.80;0.8;EUR;method2_regex;2025-09-24T00:43:17.318332;success;0;Commonwealth Bank of Australia;5.7;BHP Group Ltd.;3.69;SK hynix, Inc.;3.18;AIA Group;2.98;CSL Ltd.;2.51;National Australia Bank Ltd.;2.28;Westpac Banking;2.22;DBS Group Holdings Ltd.;2.21;HKEX;1.93;;;Other;7.6;Australia;5.7;;;;;;;Financials;30.67;Technology;14.99;Industrials;10.82;Materials;8.81;;;Euronext Paris;EUR;VAPX;;;;gettex;EUR;VGEJ;;;;Stuttgart Stock Exchange;EUR;VGEJ;;;;Bolsa Mexicana de Valores;USD;-;VDPXN MM;VDPXN.MX;;Borsa Italiana;EUR;VAPX;IVAPX;;;Frankfurt Stock Exchange;EUR;-;IVAPX;;;Euronext Amsterdam;EUR;VAPX;VAPX NAIVAPXEUR;VAPX.AS;;London Stock Exchange;USD;VDPX;VDPX LNIVDPXUSD;VDPX.L;;London Stock Exchange;GBP;VAPX;VAPX LNIVAPXGBP;VAPX.L;;SIX Swiss Exchange;CHF;VAPX;VAPX SWIVAPXCHF;VAPX.S;;5;77;22;13;13;10;19
IE00B9KNR336;SPDR S&P Pan Asia Dividend Aristocrats UCITS ETF (Dist);https://www.justetf.com/en/etf-profile.html?isin=IE00B9KNR336;The SPDR S&P Pan Asia Dividend Aristocrats UCITS ETF (Dist) seeks to track the S&P Pan Asia Dividend Aristocrats index. The S&P Pan Asia Dividend Aristocrats index tracks stocks from the Asia-Pacific region whose dividends have risen in the last 7 consecutive years. The ETF's TER (total expense ratio) amounts to 0.55% p.a.. The SPDR S&P Pan Asia Dividend Aristocrats UCITS ETF (Dist) is the only ETF that tracks the S&P Pan Asia Dividend Aristocrats index. The ETF replicates the performance of the underlying index by full replication (buying all the index constituents). The dividends in the ETF are distributed to the investors (Semi annually). The SPDR S&P Pan Asia Dividend Aristocrats UCITS ETF (Dist) has 175m Euro assets under management. The ETF was launched on 14 May 2013 and is domiciled in Ireland.;Aristokraty SPDR S&P Pan Asia Aristocrats UCITS ETF (DIST) se snaží sledovat index dividenda Aristokrats S&P Pan Asia. Index Aristokratů S&P Pan Asia Aristocrats sleduje akciíy z asijsko-tichomořské oblasti, jejichž dividenday vzrostly v posledních 7 po sobě jdoucích letech. TER (celkový poměr nákladů) činí 0,55% p.a. SPDR S&P Pan Asia dividenda Aristocrats UCITS ETF (dist) je jediný ETF, který sleduje index dividenda Aristocrats S&P Pan Asia. ETF replikuje výkon podkladového indexu plnou replikací (nákup všech složek indexu). dividenday v ETF jsou distribuovány investorům (polo každoročně). SPDR S&P Pan Asia dividenda Aristocrats UCITS ETF (DIST) má 175m euro aktiv. ETF byl spuštěn 14. května 2013 a je se sídlem v Irsku.;0.55%;0.55;EUR 175m;175.0;EUR;USD;Ireland;SPDR ETF;14 May 2013;Distributing;Semi annually;Physical;UCITS;;Equity, Asia Pacific, Dividend;;USD    Currency risk  Currency;1;Akcie;False;Asie a Pacifik;96.0;15.0;32.0;40.88;7.02;-1.22;4.92;5.3;11.39;-10.43;11.58;11.78;102.03;13.2;13.35;13.03;1.14;0.73;0.54;-12.57;-12.57;-21.63;-32.39;;;;;London Stock Exchange;ASDV;7;3.06%;3.06;EUR 1.39;1.39;EUR;method2_regex;2025-09-24T00:43:25.413003;success;0;APA Group;4.95;CSPC Pharmaceutical Group Ltd.;3.78;ENN Energy Holdings Ltd.;3.64;CK Infrastructure Holdings Ltd.;2.64;Bosideng Intl Holdings;2.61;China Construction Bank Corp.;2.6;Industrial & Commercial Bank of China Ltd.;2.41;China Resources Land Ltd.;2.41;AIA Group;2.33;;;Japan;29.94;China;28.58;Australia;17.46;Other;8.98;;;Financials;26.71;IT;13.14;Utilities;13.14;Real Estate;12.76;Health Care;11.25;gettex;EUR;ZPRA;;;;Stuttgart Stock Exchange;EUR;ZPRA;;;;Borsa Italiana;EUR;PADV;PADV IMINZPRAE;PADV.MIINZPRAC.ivOQ;;London Stock Exchange;USD;ASDV;ASDV LNINZPRAU;ASDV.LINZPRAC.ivOQ;;London Stock Exchange;GBP;PADV;PADV LNINZPRAP;PADV.LINZPRAC.ivOQ;;SIX Swiss Exchange;CHF;PADV;PADV SEINZPRAC;PADV.SINZPRAC.ivOQ;;XETRA;EUR;ZPRA;ZPRA GYINZPRAE;ZPRA.DEINZPRAC.ivOQ;;;;;;;;;;;;;;;;;;;;3;54;6;5;13;10;20
IE00B9M04V95;iShares J.P. Morgan USD EM Bond CHF Hedged UCITS ETF (Dist);https://www.justetf.com/en/etf-profile.html?isin=IE00B9M04V95;The iShares J.P. Morgan USD EM Bond CHF Hedged UCITS ETF (Dist) seeks to track the JP Morgan EMBI Global Core (CHF Hedged) index. The JP Morgan EMBI Global Core (CHF Hedged) index tracks US Dollar denominated sovereign and quasi-sovereign bonds from Emerging Markets countries. Currency hedged to Swiss Francs (CHF). The ETF's TER (total expense ratio) amounts to 0.50% p.a.. The iShares J.P. Morgan USD EM Bond CHF Hedged UCITS ETF (Dist) is the cheapest and largest ETF that tracks the JP Morgan EMBI Global Core (CHF Hedged) index. The ETF replicates the performance of the underlying index by sampling technique (buying a selection of the most relevant index constituents). The interest income (coupons) in the ETF is distributed to the investors (Monthly). The iShares J.P. Morgan USD EM Bond CHF Hedged UCITS ETF (Dist) has 248m Euro assets under management. The ETF was launched on 14 April 2015 and is domiciled in Ireland.;Ishares J.P. Morgan USD EM Bond Chf Hedged UCITS ETF (dist) se snaží sledovat index JP Morgan Embi Global Core (CHF Hedged). Index JP Morgan Embi Global Core (CHF Hedged) sleduje americký dolar denominovaný suverénní a kvazi-sovereign dluhopisy ze zemí rozvíjejících se trhů. Měna byla zajištěna švýcarským frankům (CHF). TER (celkový poměr výdajů) ETF činí 0,50% p.a. ETF replikuje výkon základního indexu technikou vzorkování (nákup výběru nejdůležitějších složek indexu). Úrokové výnosy (kupóny) v ETF jsou distribuovány investorům (měsíčně). Ishares J.P. Morgan USD EM Bond CHF Hedged UCITS ETF (DIST) má spravující aktiva 248 milionů EUR. ETF byl spuštěn 14. dubna 2015 a je se sídlem v Irsku.;0.50%;0.5;EUR 248m;248.0;EUR;CHF;Ireland;iShares;14 April 2015;Distributing;Monthly;Physical;UCITS;;Bonds, USD, Emerging Markets, Government, All maturities;;CHF    Currency risk  Currency;1;Dluhopisy;False;Rozvíjející se trhy;645.0;3.55;17.23;3.22;7.05;1.71;4.67;7.2;0.17;-16.54;12.15;-0.37;10.35;6.01;8.17;8.39;0.59;0.67;0.08;-5.18;-11.22;-24.4;-25.15;;;;;SIX Swiss Exchange;EMBC;2;5.56%;5.56;EUR 0.18;0.18;EUR;method2_regex;2025-09-24T00:43:31.969427;success;0;XS2214238441;0.68;XS2893151287;0.47;;;;;;;;;;;;;;;;;Other;81.77;;;;;;;;;;;;;;;;;;;gettex;EUR;IS0B;;;;SIX Swiss Exchange;CHF;EMBC;EMBC SEINAVMBCC;EMBC.SX221INAV.DE;;;;;;;;;;;;;;;;;;;;;;;;;;;;;;;;;;;;;;;;;;;;;;;;;;3;60;12;5;13;10;20
IE00B9M6RS56;iShares J.P. Morgan USD EM Bond EUR Hedged UCITS ETF (Dist);https://www.justetf.com/en/etf-profile.html?isin=IE00B9M6RS56;The iShares J.P. Morgan USD EM Bond EUR Hedged UCITS ETF (Dist) seeks to track the JP Morgan EMBI Global Core (EUR Hedged) index. The JP Morgan EMBI Global Core (EUR Hedged) index tracks US Dollar denominated sovereign and quasi-sovereign bonds from Emerging Markets countries. Currency hedged to Euro (EUR). The ETF's TER (total expense ratio) amounts to 0.50% p.a.. The iShares J.P. Morgan USD EM Bond EUR Hedged UCITS ETF (Dist) is the cheapest and largest ETF that tracks the JP Morgan EMBI Global Core (EUR Hedged) index. The ETF replicates the performance of the underlying index by sampling technique (buying a selection of the most relevant index constituents). The interest income (coupons) in the ETF is distributed to the investors (Monthly). The iShares J.P. Morgan USD EM Bond EUR Hedged UCITS ETF (Dist) is a very large ETF with 2,060m Euro assets under management. The ETF was launched on 8 July 2013 and is domiciled in Ireland.;Ishares J.P. Morgan USD EM Bond Eur Hedged UCITS ETF (Dist) se snaží sledovat index JP Morgan Embi Global (EUR Hedged). Index JP Morgan Embi Global (EUR Hedged) sleduje americký dolar denominovaný suverénní a kvazi-sovereign dluhopisy ze zemí rozvíjejících se trhů. Měna zajišťovala euro (EUR). TER (celkový poměr nákladů) činí 0,50% P.A .. Ishares J.P. Morgan USD EM Bond Eur Hedged UCITS ETF (DIST) je nejlevnější a největší ETF, který sleduje index JP Morgan Embi Global Core (EUR Hedged). ETF replikuje výkon základního indexu technikou vzorkování (nákup výběru nejdůležitějších složek indexu). Úrokové výnosy (kupóny) v ETF jsou distribuovány investorům (měsíčně). Ishares J.P. Morgan USD EM Bond Eur Hedged UCITS ETF (DIST) je velmi velký ETF s managementem 2 060 milionů euro. ETF byl spuštěn 8. července 2013 a je se sídlem v Irsku.;0.50%;0.5;EUR 2060m;2060.0;EUR;EUR;Ireland;iShares;8 July 2013;Distributing;Monthly;Physical;UCITS;;Bonds, USD, Emerging Markets, Government, All maturities;;EUR    Currency risk  Currency;1;Dluhopisy;False;Rozvíjející se trhy;656.0;5.6;24.87;-1.8;8.49;1.6;5.3;6.15;-3.06;-20.85;7.74;4.19;26.1;4.96;6.8;7.02;1.13;1.13;-0.05;-4.85;-8.47;-30.89;-30.89;;;;;Borsa Italiana;EMBE;6;5.48%;5.48;EUR 3.77;3.77;EUR;method2_regex;2025-09-24T00:43:39.546408;success;0;XS2214238441;0.7;XS2893151287;0.47;XS1750114396;0.43;;;;;;;;;;;;;;;Other;82.43;;;;;;;;;;;;;;;;;;;gettex;EUR;IS3C;;;;Stuttgart Stock Exchange;EUR;IS3C;;;;Borsa Italiana;EUR;EMBE;EMBE IMINAVMBEE;EMBE.MIDN21INAV.DE;;London Stock Exchange;EUR;EMBE;EMBE LNINAVMBEE;EMBE.LDN21INAV.DE;;SIX Swiss Exchange;EUR;EMBE;EMBE SEINAVMBEE;EMBE.SDN21INAV.DE;;XETRA;EUR;IS3C;IS3C GYINAVMBEE;IS3C.DEDN21INAV.DE;;;;;;;;;;;;;;;;;;;;;;;;;;4;68;12;13;13;10;20
IE00B9M6SJ31;iShares Global Corporate Bond EUR Hedged UCITS ETF (Dist);https://www.justetf.com/en/etf-profile.html?isin=IE00B9M6SJ31;The iShares Global Corporate Bond EUR Hedged UCITS ETF (Dist) seeks to track the Bloomberg Global Aggregate Corporate (EUR Hedged) index. The Bloomberg Global Aggregate Corporate (EUR Hedged) index tracks corporate bonds issued by companies worldwide. All maturities are included. Rating: Investment Grade. Currency hedged to Euro (EUR). The ETF's TER (total expense ratio) amounts to 0.25% p.a.. The iShares Global Corporate Bond EUR Hedged UCITS ETF (Dist) is the largest ETF that tracks the Bloomberg Global Aggregate Corporate (EUR Hedged) index. The ETF replicates the performance of the underlying index by sampling technique (buying a selection of the most relevant index constituents). The interest income (coupons) in the ETF is distributed to the investors (Semi annually). The iShares Global Corporate Bond EUR Hedged UCITS ETF (Dist) is a very large ETF with 1,127m Euro assets under management. The ETF was launched on 25 June 2013 and is domiciled in Ireland.;Ishares Global Corporate Bond Eur Hedged UCITS ETF (DIST) se snaží sledovat index Global Corporate (EUR Hedged) Bloomberg Global. Bloomberg Global Agregate Corporate (EUR Hedged) Index sleduje firemní dluhopisy vydané společnostmi po celém světě. Zahrnuty jsou všechna splatností. Hodnocení: Investiční třída. Měna zajišťovala euro (EUR). TER (celkový poměr nákladů) činí 0,25% P.A .. Ishares Global Corporate Bond Eur Hedged UCITS ETF (DIST) je největší ETF, který sleduje index Bloomberg Global Corporate (EUR Hedged). ETF replikuje výkon základního indexu technikou vzorkování (nákup výběru nejdůležitějších složek indexu). Úrokové výnosy (kupóny) v ETF jsou distribuovány investorům (semifinále každoročně). Ishares Global Corporate Bond Eur Hedged UCITS ETF (DIST) je velmi velký ETF s 1 127 miliony euro. ETF byl spuštěn 25. června 2013 a má bydliště v Irsku.;0.25%;0.25;EUR 1127m;1127.0;EUR;EUR;Ireland;iShares;25 June 2013;Distributing;Semi annually;Physical;UCITS;;Bonds, World, Corporate, All maturities;;EUR    Currency risk  Currency;1;Dluhopisy;False;Celosvětově;8864.0;2.25;13.11;-5.7;4.4;0.96;2.38;3.02;-2.13;-16.38;6.44;1.69;21.61;3.81;5.23;5.11;0.59;0.8;-0.23;-3.48;-6.41;-21.71;-21.71;;;;;Extracted (method 1);IBCQ;0;3.81%;3.81;EUR 3.34;3.34;EUR;method2_regex;2025-09-24T00:43:49.884107;success;0;XS0306605956;0.05;;;;;;;;;;;;;;;;;;;United States;48.87;Other;35.92;United Kingdom;6.12;France;4.89;Canada;4.2;;;;;;;;;;;;;;;;;;;;;;;;;;;;;;;;;;;;;;;;;;;;;;;;;;;;;;;;;;;;;;;;;;;;;;;4;71;17;13;13;10;18
IE00B9MRHC27;Xtrackers MSCI Nordic UCITS ETF 1D;https://www.justetf.com/en/etf-profile.html?isin=IE00B9MRHC27;The Xtrackers MSCI Nordic UCITS ETF 1D seeks to track the MSCI Nordic Countries index. The MSCI Nordic Countries index tracks leading stocks on the Nordic market, including Denmark, Norway, Finland and Sweden. The ETF's TER (total expense ratio) amounts to 0.30% p.a.. The Xtrackers MSCI Nordic UCITS ETF 1D is the largest ETF that tracks the MSCI Nordic Countries index. The ETF replicates the performance of the underlying index by full replication (buying all the index constituents). The dividends in the ETF are distributed to the investors (Annually). The Xtrackers MSCI Nordic UCITS ETF 1D is a large ETF with 839m Euro assets under management. The ETF was launched on 4 September 2013 and is domiciled in Ireland.;Xtrackers MSCI Nordic UCITS ETF 1D se snaží sledovat index zemí MSCI Nordic. Index zemí MSCI Nordic sleduje přední akcie na severském trhu, včetně Dánska, Norska, Finska a Švédska. TER ETF (celkový poměr nákladů) činí 0,30% P.A .. Xtrackers MSCI Nordic UCITS ETF 1D je největší ETF, který sleduje index MSCI Nordic zemí. ETF replikuje výkon podkladového indexu plnou replikací (nákup všech složek indexu). dividenday v ETF jsou distribuovány investorům (každoročně). Xtrackers MSCI Nordic UCITS ETF 1D je velký ETF s managementem 839 milionů euro. ETF byl spuštěn 4. září 2013 a je se sídlem v Irsku.;0.30%;0.3;EUR 839m;839.0;EUR;EUR;Ireland;Xtrackers;4 September 2013;;Annually;Physical;UCITS;MSCI Nordic  1D;Equity, Europe;;EUR    Currency risk  Currency;1;Akcie;False;Evropa;80.0;-8.53;30.66;48.42;1.76;0.02;-0.46;-3.16;28.82;-11.86;17.14;-1.04;158.93;18.25;15.95;17.41;-0.47;0.58;0.47;-22.71;-26.26;-26.26;-32.67;;;;;gettex;XDN0;5;2.99%;2.99;EUR 1.43;1.43;EUR;method2_regex;2025-09-24T00:43:58.181259;success;0;Spotify Technology SA;7.38;Investor AB;3.81;DSV A/S;3.58;Nordea Bank Abp;3.43;Volvo;3.42;Atlas Copco AB;3.12;ASSA ABLOY AB;2.48;Skandinaviska Enskilda Banken AB;2.09;Danske Bank A/S;2.05;;;Other;17.09;;;;;;;;;Industrials;29.65;Financials;19.09;Technology;7.38;Materials;5.16;IT;1.76;gettex;EUR;XDN0;;;;Stuttgart Stock Exchange;EUR;XDN0;;;;London Stock Exchange;GBX;XDN0;XDN0 LNXDN0INVG;XDN0.LX2DTINAV.DE;;SIX Swiss Exchange;CHF;XDN0;XDN0 SWXDN0CHIV;XDN0.SXDN0CHFINAV=SOLA;;XETRA;EUR;XDN0;XDN0 GY;XDN0.DE;;;;;;;;;;;;;;;;;;;;;;;;;;;;;;;;4;65;12;10;13;10;20
IE00B9MRJJ36;Xtrackers MDAX ESG Screened UCITS ETF 1D;https://www.justetf.com/en/etf-profile.html?isin=IE00B9MRJJ36;The Xtrackers MDAX ESG Screened UCITS ETF 1D seeks to track the MDAX® ESG Screened index. The MDAX® ESG Screened index tracks German mid cap stocks while taking into account ESG exclusion filters (environmental, social and corporate governance). Companies involved in weapons, armaments, tobacco, thermal coal, oil sands or nuclear power and companies that violate the principles of the United Nations Global Compact are excluded. The parent index is the MDAX®. Excluded companies are not replaced. The maximum weight of a company is capped at 10%. The ETF's TER (total expense ratio) amounts to 0.40% p.a.. The Xtrackers MDAX ESG Screened UCITS ETF 1D is the only ETF that tracks the MDAX® ESG Screened index. The ETF replicates the performance of the underlying index by full replication (buying all the index constituents). The dividends in the ETF are distributed to the investors (Annually). The Xtrackers MDAX ESG Screened UCITS ETF 1D has 104m Euro assets under management. The ETF was launched on 9 January 2014 and is domiciled in Ireland.;Xtrackers MDAX ESG Screened UCITS ETF 1D se snaží sledovat index Screening MDAX® ESG. Indexový index MDAX® ESG sleduje německé akciíy středních kapitálů při zohlednění vylučovacích filtrů ESG (environmentální, sociální a správa a řízení společností). Vyloučeny jsou společnosti podílející se na zbraních, výzbrojích, tabáku, tepelném uhlí, ropném písku nebo jaderné energii a společnosti, které porušují principy Global Compact OSN Global Compact. Index nadřazení je MDAX®. Vyloučené společnosti nejsou nahrazeny. Maximální hmotnost společnosti je omezena na 10%. TER (celkový poměr nákladů) činí 0,40% p.a. ETF replikuje výkon podkladového indexu plnou replikací (nákup všech složek indexu). dividenday v ETF jsou distribuovány investorům (každoročně). Xtrackers MDAX ESG Screeked UCITS ETF 1D má ve správě aktiv EURO 104 milionů euro. ETF byl spuštěn 9. ledna 2014 a má bydliště v Irsku.;0.40%;0.4;EUR 104m;104.0;EUR;EUR;Ireland;Xtrackers;9 January 2014;;Annually;Physical;UCITS;;Equity, Germany, Mid Cap;Yes;EUR    Currency risk  Currency;1;Akcie;False;Celosvětově;44.0;7.67;15.62;2.55;9.03;-5.57;1.16;0.12;13.38;-27.76;6.03;-6.89;64.9;18.64;17.89;18.64;0.41;0.28;0.03;-18.94;-22.43;-39.22;-39.3;;;;;gettex;XDGM;4;1.75%;1.75;EUR 0.39;0.39;EUR;method2_regex;2025-09-24T00:44:05.448930;success;0;Scout24 SE;6.18;Deutsche Lufthansa AG;5.37;Nemetschek;5.17;Talanx AG;4.89;CTS Eventim AG & Co. KGaA;4.15;Knorr-Bremse;4.05;Delivery Hero SE;4.03;LEG Immobilien;3.65;Evonik Industries AG;3.1;;;Germany;93.8;Other;2.52;Netherlands;1.19;;;;;Industrials;30.62;Materials;10.76;Consumer Discretionary;10.6;IT;9.03;;;gettex;EUR;XDGM;;;;Stuttgart Stock Exchange;EUR;XDGM;;;;London Stock Exchange;GBX;XDGM;XDGM LNXDGMINVG;XDGM.L274KINAV.DE;;XETRA;EUR;XDGM;XDGM GY;XDGM.DE;;;;;;;;;;;;;;;;;;;;;;;;;;;;;;;;;;;;;;3;58;12;5;13;10;18
IE00BBQ2W338;HSBC MSCI AC Far East ex Japan UCITS ETF USD;https://www.justetf.com/en/etf-profile.html?isin=IE00BBQ2W338;The HSBC MSCI AC Far East ex Japan UCITS ETF USD seeks to track the MSCI AC Far East ex Japan index. The MSCI AC Far East ex Japan index tracks equity markets of the emerging and developed countries of the East Asian region, excluding Japan. The ETF's TER (total expense ratio) amounts to 0.45% p.a.. The HSBC MSCI AC Far East ex Japan UCITS ETF USD is the cheapest ETF that tracks the MSCI AC Far East ex Japan index. The ETF replicates the performance of the underlying index by full replication (buying all the index constituents). The dividends in the ETF are accumulated and reinvested in the ETF. The HSBC MSCI AC Far East ex Japan UCITS ETF USD has 258m Euro assets under management. The ETF was launched on 27 September 2013 and is domiciled in Ireland.;HSBC MSCI AC Far East Ex Japan UCITS ETF USD se snaží sledovat index MSCI AC Far East Ex Japan. Index MSCI AC AC Far East Exa Japan sleduje akciové trhy rozvíjejících se a rozvinutých zemí východoasijské oblasti, s výjimkou Japonska. TER (celkový poměr nákladů) činí 0,45% p.a. ETF replikuje výkon podkladového indexu plnou replikací (nákup všech složek indexu). dividenday v ETF jsou akumulovány a reinvestovány do ETF. HSBC MSCI AC Far East Ex Japan UCITS ETF USD má ve správě aktiv EURO 258 milionů EUR. ETF byl spuštěn 27. září 2013 a je se sídlem v Irsku.;0.45%;0.45;EUR 258m;258.0;EUR;USD;Ireland;HSBC ETF;27 September 2013;;;Physical;UCITS;MSCI AC Far East ex Japan  USD;Equity, Asia Pacific;;USD    Currency risk  Currency;1;Akcie;False;Asie a Pacifik;853.0;29.72;38.21;29.6;18.25;6.36;15.06;14.99;-1.1;-17.0;-1.03;19.1;126.22;19.32;17.78;17.77;1.54;0.64;0.3;-21.61;-21.61;-38.51;-38.51;;;;;gettex;H411;5;;;;;;;2025-09-24T00:44:15.079890;success;0;Tencent Holdings Ltd.;7.06;Alibaba Group Holding Ltd.;3.97;Samsung Electronics Co., Ltd.;3.82;Xiaomi Corp.;1.82;SK hynix, Inc.;1.69;AIA Group;1.57;China Construction Bank Corp.;1.55;PDD Holdings;1.23;DBS Group Holdings Ltd.;1.23;;;China;37.58;Other;12.5;;;;;;;Technology;32.04;Financials;19.99;Consumer Discretionary;13.37;;;;;gettex;EUR;H411;;;;London Stock Exchange;USD;HMAD;HMAD LNHMAFUSDI;HMAD.LHMAFINAVUSD=HSBL;;London Stock Exchange;GBP;HMAF;HMAF LNHMAFGBPI;HMAF.LHMAFINAVGBP=HSBL;;SIX Swiss Exchange;USD;HMAF;HMAF SWHMAFUSDI;HMAF.SHMAFINAVUSD=HSBL;;XETRA;EUR;H411;H411 GYHMAFEURI;H411.DEHMAFINAVEUR=HSBL;;;;;;;;;;;;;;;;;;;;;;;;;;;;;;;;3;55;12;5;13;5;20
IE00BC7GZJ81;SPDR Bloomberg 1-3 Year US Treasury Bond UCITS ETF;https://www.justetf.com/en/etf-profile.html?isin=IE00BC7GZJ81;The SPDR Bloomberg 1-3 Year US Treasury Bond UCITS ETF seeks to track the Bloomberg US 1-3 Year Treasury Bond index. The Bloomberg US 1-3 Year Treasury Bond index tracks US Dollar denominated government bonds issued by the US Treasury. Time to maturity: 1-3 years. Rating: AA. The ETF's TER (total expense ratio) amounts to 0.15% p.a.. The SPDR Bloomberg 1-3 Year US Treasury Bond UCITS ETF is the largest ETF that tracks the Bloomberg US 1-3 Year Treasury Bond index. The ETF replicates the performance of the underlying index by sampling technique (buying a selection of the most relevant index constituents). The interest income (coupons) in the ETF is distributed to the investors (Semi annually). The SPDR Bloomberg 1-3 Year US Treasury Bond UCITS ETF has 118m Euro assets under management. The ETF was launched on 27 August 2013 and is domiciled in Ireland.;SPDR Bloomberg 1-3 rok US Treasury Bond UCITS ETF se snaží sledovat index Bloomberg US 1-3 Year Treasury Bond. Index Treasury Bond Bloomberg US 1-3 roky sleduje vládní dluhopisy vydané americkým státní pokladnou. Čas do zralosti: 1-3 roky. Hodnocení: AA. TER (celkový poměr nákladů) ETF činí 0,15% p.a. ETF replikuje výkon základního indexu technikou vzorkování (nákup výběru nejdůležitějších složek indexu). Úrokové výnosy (kupóny) v ETF jsou distribuovány investorům (semifinále každoročně). SPDR Bloomberg 1-3 Year US Treasury Bond UCITS ETF má 118 milionů euro aktiv. ETF byl spuštěn 27. srpna 2013 a je se sídlem v Irsku.;0.15%;0.15;EUR 118m;118.0;EUR;USD;Ireland;SPDR ETF;27 August 2013;;Semi annually;Physical;UCITS;Bloomberg 1-3 Year US Treasury Bond;risk  Long-only    Sustainability  No;;USD    Currency risk  Currency;1;Dluhopisy;False;Celosvětově;94.0;-1.57;-4.95;7.05;-8.25;-0.94;-0.7;-5.75;7.53;1.97;0.53;10.6;34.18;8.38;8.2;7.76;-0.19;-0.2;0.18;-11.18;-13.43;-13.43;-16.98;;;;;Extracted (method 1);SYBW;0;4.44%;4.44;EUR 1.82;1.82;EUR;method2_regex;2025-09-24T00:44:22.041560;success;0;;;;;;;;;;;;;;;;;;;;;United States;57.71;Other;42.29;;;;;;;;;;;;;;;;;;;;;;;;;;;;;;;;;;;;;;;;;;;;;;;;;;;;;;;;;;;;;;;;;;;;;;;;;;;;;3;58;22;5;13;10;8
