IE00BZ163H91;Vanguard EUR Eurozone Government Bond UCITS ETF Distributing;https://www.justetf.com/en/etf-profile.html?isin=IE00BZ163H91;The Vanguard EUR Eurozone Government Bond UCITS ETF Distributing seeks to track the Bloomberg Euro Aggregate Treasury index. The Bloomberg Euro Aggregate Treasury index tracks Euro denominated government bonds issued by members of the eurozone. All maturities are included. Rating: Investment Grade. The ETF's TER (total expense ratio) amounts to 0.07% p.a.. The Vanguard EUR Eurozone Government Bond UCITS ETF Distributing is the cheapest ETF that tracks the Bloomberg Euro Aggregate Treasury index. The ETF replicates the performance of the underlying index by sampling technique (buying a selection of the most relevant index constituents). The interest income (coupons) in the ETF is distributed to the investors (Monthly). The Vanguard EUR Eurozone Government Bond UCITS ETF Distributing is a very large ETF with 1,319m Euro assets under management. The ETF was launched on 24 February 2016 and is domiciled in Ireland.;Vanguard EUR Eurozóne vládní dluhopis UCITS ETF distribuující se snaží sledovat index Bloomberg Euro Agregate Treasury Index. Bloomberg Euro Agregate Treasury Index sleduje vládní dluhopisy vydané členy eurozóny. Zahrnuty jsou všechna splatností. Hodnocení: Investiční třída. TER (celkový poměr výdajů) ETF činí 0,07% P.A .. Vanguard Euro Eurozone Vládní dluhopis UCITS ETF distribuující je nejlevnější ETF, který sleduje agregovaný index Treasury Bloomberg Euro. ETF replikuje výkon základního indexu technikou vzorkování (nákup výběru nejdůležitějších složek indexu). Úrokové výnosy (kupóny) v ETF jsou distribuovány investorům (měsíčně). Vládní dluhopis EUR EUR EURON EUROSONE UCITS ETF distribuující je velmi velký ETF s spravováním 1 319 milionů euro. ETF byla spuštěna 24. února 2016 a je bydliště v Irsku.;0.07%;0.07;EUR 1319m;1319.0;EUR;EUR;Ireland;Vanguard;24 February 2016;Distributing;Monthly;Physical;;Government Bond;Bonds, EUR, Europe, Government, All maturities;;Dluhopisy;False;Evropa;485.0;0.37;4.07;-12.81;0.07;4.42;6.37;6.15;0.08;0.21;-0.44;-4.02;-6.81;-22.41;-22.41;;;;;Extracted (method 1);VGEB;0;2.62%;2.62;EUR 0.58;0.58;EUR;method2_regex;2025-09-19T10:54:08.967008;success;0;FR0013407236;0.91;FR0013313582;0.85;FR0013250560;0.79;FR0012993103;0.78;FR0013341682;0.75;;;;;;;;;;;Other;43.6;France;25.76;Germany;12.79;Netherlands;5.07;;;;;;;;;;;;;;;;;;;;;;;;;;;;;;;;;;;;;;;;;;;4;70;26;13;11;10;10
IE00BZ163K21;Vanguard USD Corporate Bond UCITS ETF Distributing;https://www.justetf.com/en/etf-profile.html?isin=IE00BZ163K21;The Vanguard USD Corporate Bond UCITS ETF Distributing seeks to track the Bloomberg Global Aggregate Corporate USD index. The Bloomberg Global Aggregate Corporate USD index tracks US dollar denominated bonds issued in emerging and developed markets worldwide. All maturities are included. Rating: Investment Grade. The ETF's TER (total expense ratio) amounts to 0.07% p.a.. The Vanguard USD Corporate Bond UCITS ETF Distributing is the cheapest ETF that tracks the Bloomberg Global Aggregate Corporate USD index. The ETF replicates the performance of the underlying index by sampling technique (buying a selection of the most relevant index constituents). The interest income (coupons) in the ETF is distributed to the investors (Monthly). The Vanguard USD Corporate Bond UCITS ETF Distributing is a large ETF with 520m Euro assets under management. The ETF was launched on 24 February 2016 and is domiciled in Ireland.;Společnost Vanguard USD Corporate Bond UCITS ETF distribuující usiluje o sledování globálního indexu USD Bloomberg Global Agregate. Bloomberg Global Agregate Corporate USD index USD sleduje dluhopisy denominované dolarem vydané na rozvíjejících se a rozvíjejících se trzích po celém světě. Zahrnuty jsou všechna splatností. Hodnocení: Investiční třída. TER (celkový poměr nákladů) činí 0,07% p.a. Vanguard USD Corporate Bond UCITS ETF distribuující je nejlevnější ETF, který sleduje globální agregovaný index USD Bloomberg. ETF replikuje výkon základního indexu technikou vzorkování (nákup výběru nejdůležitějších složek indexu). Úrokové výnosy (kupóny) v ETF jsou distribuovány investorům (měsíčně). Společnost Vanguard USD Corporate Bond UCITS ETF distribuující je velká ETF s managementem 520 milionů euro. ETF byla spuštěna 24. února 2016 a je bydliště v Irsku.;0.07%;0.07;EUR 520m;520.0;EUR;USD;Ireland;Vanguard;24 February 2016;Distributing;Monthly;Physical;;;Bonds, World, Corporate, All maturities;;Dluhopisy;False;Globální;8891.0;-2.17;0.2;2.27;-5.94;9.17;9.7;9.44;-0.24;0.01;0.05;-11.43;-11.43;-12.49;-14.06;;;;;Extracted (method 1);VUCP;0;5.10%;5.1;EUR 2.09;2.09;EUR;method2_regex;2025-09-19T10:54:15.002031;success;0;;;;;;;;;;;;;;;;;;;;;United States;59.66;Other;33.72;United Kingdom;2.98;Canada;1.85;Japan;1.79;;;;;;;;;;;;;;;;;;;;;;;;;;;;;;;;;;;;;;;;;4;74;26;10;11;10;17
IE00BZ163L38;Vanguard USD Emerging Markets Government Bond UCITS ETF Distributing;https://www.justetf.com/en/etf-profile.html?isin=IE00BZ163L38;The Vanguard USD Emerging Markets Government Bond UCITS ETF Distributing seeks to track the Bloomberg EM USD Sovereign + Quasi-Sov index. The Bloomberg EM USD Sovereign + Quasi-Sov index tracks US dollar-denominated bonds issued by governments and semi-public institutions in emerging markets. All maturities are included. Rating: Mixed. The ETF's TER (total expense ratio) amounts to 0.23% p.a.. The Vanguard USD Emerging Markets Government Bond UCITS ETF Distributing is the cheapest ETF that tracks the Bloomberg EM USD Sovereign + Quasi-Sov index. The ETF replicates the performance of the underlying index by sampling technique (buying a selection of the most relevant index constituents). The interest income (coupons) in the ETF is distributed to the investors (Monthly). The Vanguard USD Emerging Markets Government Bond UCITS ETF Distributing is a large ETF with 567m Euro assets under management. The ETF was launched on 6 December 2016 and is domiciled in Ireland.;Vanguard USD Emerging Markets Government Bond UCITS ETF distribuující usiluje o sledování indexu Bloomberg EM USD USD Sovereign + Quasi-SOV. Bloomberg EM USD Sovereign + Quasi-SOV index sleduje americké dluhopisy denominované dolarem vydané vládami a poloveřejnými institucemi na rozvíjejících se trzích. Zahrnuty jsou všechna splatností. Hodnocení: smíšené. TER (celkový poměr nákladů) ETF činí 0,23% P.A .. Vanguard USD Emerging Markets Government Bond UCITS ETF distribuující je nejlevnější ETF, který sleduje index Bloomberg EM USD + kvazi-SOV. ETF replikuje výkon základního indexu technikou vzorkování (nákup výběru nejdůležitějších složek indexu). Úrokové výnosy (kupóny) v ETF jsou distribuovány investorům (měsíčně). Vanguard USD Emerging Markets Government Bond UCITS ETF distribuující je velký ETF s 567 miliony euro spravovaných aktiv. ETF byl spuštěn 6. prosince 2016 a je se sídlem v Irsku.;0.23%;0.23;EUR 567m;567.0;EUR;USD;Ireland;Vanguard;6 December 2016;Distributing;Monthly;Physical;;Government Bond;Bonds, USD, Emerging Markets, Government, All maturities;;Dluhopisy;False;Rozvíjející se země;1136.0;0.7;8.69;9.04;-4.62;8.77;8.5;8.16;0.08;0.33;0.21;-11.39;-11.39;-11.62;-17.11;;;;;Extracted (method 1);VGEM;0;6.07%;6.07;EUR 2.25;2.25;EUR;method2_regex;2025-09-19T10:54:23.211017;success;0;AR0314171247;0.39;XS1807174559;0.36;;;;;;;;;;;;;;;;;Other;77.41;;;;;;;;;;;;;;;;;;;;;;;;;;;;;;;;;;;;;;;;;;;;;;;;;3;63;17;10;11;10;15
IE00BZ163M45;Vanguard USD Treasury Bond UCITS ETF Distributing;https://www.justetf.com/en/etf-profile.html?isin=IE00BZ163M45;The Vanguard USD Treasury Bond UCITS ETF Distributing seeks to track the Bloomberg Global Aggregate US Treasury Float Adjusted index. The Bloomberg Global Aggregate US Treasury Float Adjusted index tracks US sovereign debt, issued by the US government. 'Float adjusted' means, the index does not consider bonds that are unavailable to the public. The ETF's TER (total expense ratio) amounts to 0.05% p.a.. The Vanguard USD Treasury Bond UCITS ETF Distributing is the cheapest ETF that tracks the Bloomberg Global Aggregate US Treasury Float Adjusted index. The ETF replicates the performance of the underlying index by sampling technique (buying a selection of the most relevant index constituents). The interest income (coupons) in the ETF is distributed to the investors (Monthly). The Vanguard USD Treasury Bond UCITS ETF Distributing is a large ETF with 544m Euro assets under management. The ETF was launched on 24 February 2016 and is domiciled in Ireland.;Vanguard USD Treasury Bond UCITS ETF distribuující usiluje o sledování globálního agregátu Bloomberg Global US Treasury Float Index. Globální agregát Bloomberg Global agregát US Treasury Float upravený index sleduje americký suverénní dluh, vydaný vládou USA. „Float upravené“ znamená, že index nepovažuje dluhopisy, které nejsou pro veřejnost k dispozici. TER (celkový poměr výdajů) ETF činí 0,05% p.a. Vanguard USD Treasury Bond UCITS ETF distribuující je nejlevnější ETF, který sleduje globální agregovaný americký pokladniční float v Bloombergu. ETF replikuje výkon základního indexu technikou vzorkování (nákup výběru nejdůležitějších složek indexu). Úrokové výnosy (kupóny) v ETF jsou distribuovány investorům (měsíčně). Vanguard USD Treasury Bond UCITS ETF distribuující je velký ETF s managementem 544 milionů euro. ETF byla spuštěna 24. února 2016 a je bydliště v Irsku.;0.05%;0.05;EUR 544m;544.0;EUR;USD;Ireland;Vanguard;24 February 2016;Distributing;Monthly;Physical;;;Bonds, USD, United States, Government, All maturities;;Dluhopisy;False;Globální;285.0;-4.24;-8.26;-6.49;-7.34;9.04;9.65;9.4;-0.47;-0.29;-0.14;-11.23;-13.34;-13.34;-17.66;;;;;Extracted (method 1);VGTY;0;4.26%;4.26;EUR 0.79;0.79;EUR;method2_regex;2025-09-19T10:54:31.397030;success;0;;;;;;;;;;;;;;;;;;;;;United States;56.83;Other;43.17;;;;;;;;;;;;;;;;;;;;;;;;;;;;;;;;;;;;;;;;;;;;;;;4;69;30;10;11;10;8
IE00BZ171348;iShares Global AAA-AA Government Bond UCITS USD (Acc);https://www.justetf.com/en/etf-profile.html?isin=IE00BZ171348;The iShares Global AAA-AA Government Bond UCITS USD (Acc) seeks to track the Bloomberg Global Government AAA-AA Capped Bond index. The Bloomberg Global Government AAA-AA Capped Bond index tracks local currency bonds issued by governments of developed countries worldwide. Rating: minimum AA. The ETF's TER (total expense ratio) amounts to 0.20% p.a.. The iShares Global AAA-AA Government Bond UCITS USD (Acc) is the cheapest ETF that tracks the Bloomberg Global Government AAA-AA Capped Bond index. The ETF replicates the performance of the underlying index by sampling technique (buying a selection of the most relevant index constituents). The interest income (coupons) in the ETF is accumulated and reinvested in the ETF. The iShares Global AAA-AA Government Bond UCITS USD (Acc) is a small ETF with 32m Euro assets under management. The ETF was launched on 3 July 2018 and is domiciled in Ireland.;Global AAA-AA vládní dluhopis UCITS USD (ACC) se snaží sledovat globální vládu Bloomberg AAA-AA Clapped Bond Index. Globální vláda Bloomberg AAA-AA omezuje index dluhopisů místní měnové dluhopisy vydané vládami rozvinutých zemí po celém světě. Hodnocení: Minimální AA. TER (celkový poměr nákladů) činí 0,20% p.a. ETF replikuje výkon základního indexu technikou vzorkování (nákup výběru nejdůležitějších složek indexu). Úrokové výnosy (kupóny) v ETF se nashromáždí a reinvestují do ETF. Global AAA-AA vládní dluhopis UCITS USD (ACC) ISShares Global AAA-AA je malý ETF s managementem 32 milionů euro. ETF byl spuštěn 3. července 2018 a má bydliště v Irsku.;0.20%;0.2;EUR 32m;32.0;EUR;USD;Ireland;iShares;3 July 2018;Accumulating;;Physical;;Government Bond;Bonds, World, Government, All maturities;;Dluhopisy;False;Globální;771.0;-2.38;-3.29;-14.02;-1.91;6.96;9.01;8.65;-0.34;-0.12;-0.34;-5.13;-8.94;-19.71;-21.18;;;;;Extracted (method 1);OM3H;0;;;;;;;2025-09-19T10:54:37.128721;success;0;DE0001141869;0.66;AU0000087454;0.53;DE0001102499;0.51;;;;;;;;;;;;;;;Other;52.43;Germany;15.56;United States;13.79;France;9.26;United Kingdom;8.96;;;;;;;;;;;;;;;;;;;;;;;;;;;;;;;;;;;;;;;;;2;47;17;1;11;10;8
IE00BZ173T46;iShares MSCI USA SRI UCITS ETF USD (Dist);https://www.justetf.com/en/etf-profile.html?isin=IE00BZ173T46;The iShares MSCI USA SRI UCITS ETF USD (Dist) seeks to track the MSCI USA SRI Select Reduced Fossil Fuels index. The MSCI USA SRI Select Reduced Fossil Fuels index tracks US stocks considering only companies with very high Environmental, Social and Governance (ESG) ratings relative to their sector peers, to ensure the inclusion of the best of class companies from an ESG perspective and avoiding companies incompatible with values screen or having exposure to fossil fuels through extraction and production activities, power generation activities or reserves ownership. The weight of each company is capped to 5%. The ETF's TER (total expense ratio) amounts to 0.20% p.a.. The iShares MSCI USA SRI UCITS ETF USD (Dist) is the cheapest ETF that tracks the MSCI USA SRI Select Reduced Fossil Fuels index. The ETF replicates the performance of the underlying index by full replication (buying all the index constituents). The dividends in the ETF are distributed to the investors (Semi annually). The iShares MSCI USA SRI UCITS ETF USD (Dist) has 299m Euro assets under management. The ETF was launched on 6 December 2018 and is domiciled in Ireland.;Ishares MSCI USA SRI UCITS ETF USD (dist) se snaží sledovat MSCI USA SRI Select Reduction Fossil Fuels Index. MSCI USA SRI vyberou redukované index fosilních paliv sleduje americké akcie s ohledem na pouze společnosti s velmi vysokou environmentální, sociální a správní hodnotou (ESG) hodnocení ve srovnání s jejich vrstevníky sektoru, aby zajistily zahrnutí nejlepších ze třídních společností z perspektivy ESG a vyhýbaly se společnosti nekompatibilními s hodnotami nebo mají vystavení fosilním účinkům a výrobními činnostmi nebo rezervacemi nebo rezervacemi nebo rezervacemi nebo rezervacemi nebo rezervacemi nebo rezervacemi nebo rezervacemi nebo rezervacemi nebo rezervacemi nebo rezervacemi nebo rezervacemi nebo rezervacemi nebo rezervací nebo rezervacemi nebo rezervováním. Hmotnost každé společnosti je omezena na 5%. TER (celkový poměr nákladů) činí 0,20% p.a. IShares MSCI USA Sri UCITS ETF USD (DIST) je nejlevnější ETF, který sleduje MSCI USA SRI Select Reduction Fossil Fuels Index. ETF replikuje výkon podkladového indexu plnou replikací (nákup všech složek indexu). dividenday v ETF jsou distribuovány investorům (polo každoročně). IShares MSCI USA SRI UCITS ETF USD (DIST) má ve správě aktiv 299 milionů euro. ETF byl spuštěn 6. prosince 2018 a je se sídlem v Irsku.;0.20%;0.2;EUR 299m;299.0;EUR;USD;Ireland;iShares;6 December 2018;Distributing;Semi annually;Physical;;MSCI USA SRI  USD;;Yes;Akcie;False;US;161.0;6.17;30.96;84.09;-3.72;19.65;17.77;17.76;0.31;0.53;0.73;-23.05;-23.05;-23.05;-33.0;;;;;gettex;36B6;3;1.07%;1.07;EUR 0.11;0.11;EUR;method2_regex;2025-09-19T10:54:45.081922;success;0;Intuit;3.56;Tesla;3.54;Walt Disney;3.53;Verizon Communications;3.19;ServiceNow;3.09;Home Depot;2.68;Texas Instruments;2.67;Adobe;2.47;Applied Materials, Inc.;2.37;;;United States;89.94;Other;7.94;;;;;;;Technology;34.07;Financials;12.59;Consumer Discretionary;11.48;Health Care;9.5;IT;3.56;gettex;EUR;36B6;;;;Euronext Amsterdam;USD;SRIL;SRIL NAISRIL;ISSRIL.ASISRILINAV.PA;;XETRA;EUR;36B6;36B6 GYINAVSRIE;36B6.DE0XRQEUR=INAV;;;;;;;;;;;;;;3;60;17;5;8;10;20
IE00BZ173V67;iShares MSCI USA SRI UCITS ETF EUR Hedged (Dist);https://www.justetf.com/en/etf-profile.html?isin=IE00BZ173V67;The iShares MSCI USA SRI UCITS ETF EUR Hedged (Dist) seeks to track the MSCI USA SRI Select Reduced Fossil Fuels (EUR Hedged) index. The MSCI USA SRI Select Reduced Fossil Fuels (EUR Hedged) index tracks US stocks considering only companies with very high Environmental, Social and Governance (ESG) ratings relative to their sector peers, to ensure the inclusion of the best of class companies from an ESG perspective and avoiding companies incompatible with values screen or having exposure to fossil fuels through extraction and production activities, power generation activities or reserves ownership. Currency hedged to Euro (EUR). The ETF's TER (total expense ratio) amounts to 0.23% p.a.. The iShares MSCI USA SRI UCITS ETF EUR Hedged (Dist) is the cheapest and largest ETF that tracks the MSCI USA SRI Select Reduced Fossil Fuels (EUR Hedged) index. The ETF replicates the performance of the underlying index by full replication (buying all the index constituents). The dividends in the ETF are distributed to the investors (Semi annually). The iShares MSCI USA SRI UCITS ETF EUR Hedged (Dist) has 286m Euro assets under management. The ETF was launched on 10 July 2018 and is domiciled in Ireland.;Ishares MSCI USA Sri UCITS ETF EUR HEDGED (dist) se snaží sledovat index MSCI USA SRI Select Reduction Fossil Fuels (Eur Hedged). Indexová index MSCI USA SRI vybrala redukované fosilní paliva (EUR Hedged), které sleduje americké akcie s ohledem na pouze společnosti s velmi vysokým hodnocením environmentálních, sociálních a správních hodnot (ESG) ve srovnání s vrstevníky jejich sektoru, aby zajistily zahrnutí nejlepších ze třídních společností z esg a vyhýbaly se společností ESG nebo vystavením aktivity a výrobních aktivit a výrobních aktivit, a produkční aktivity, a produkční aktivity, a výrobní aktivity, a produkční aktivity, a vyrábějí aktivity, nebo si vyvíjejí výhradní aktivity, a vytvářejí si záložku nebo si vyhrazují aktivity, nebo se vyvíjejí. Měna zajišťovala euro (EUR). TER (celkový poměr nákladů) činí 0,23% p.a. Ishares MSCI USA Sri UCITS ETF EUR (dist) je nejlevnější a největší ETF, který sleduje index MSCI USA SRI vybraný index Fuels (Eur Hedged). ETF replikuje výkon podkladového indexu plnou replikací (nákup všech složek indexu). dividenday v ETF jsou distribuovány investorům (polo každoročně). Ishares MSCI USA Sri UCITS ETF EUR Hedged (Dist) má 286 milionů euro aktiv. ETF byl spuštěn 10. července 2018 a je bytí v Irsku.;0.23%;0.23;EUR 286m;286.0;EUR;EUR;Ireland;iShares;10 July 2018;Distributing;Semi annually;Physical;;MSCI USA SRI  EUR Hedged;;Yes;Akcie;False;US;161.0;10.37;42.85;63.4;8.02;19.08;18.25;18.45;0.54;0.69;0.56;-20.57;-20.57;-28.23;-33.45;;;;;gettex;3SUR;4;0.98%;0.98;EUR 18.95;18.95;EUR;method2_regex;2025-09-19T10:54:51.724354;success;0;Intuit;3.56;Tesla;3.54;Walt Disney;3.53;Verizon Communications;3.19;ServiceNow;3.09;Home Depot;2.68;Texas Instruments;2.67;Adobe;2.47;Applied Materials, Inc.;2.37;;;United States;89.94;Other;7.94;;;;;;;Technology;34.07;Financials;12.59;Consumer Discretionary;11.48;Health Care;9.5;IT;3.56;gettex;EUR;3SUR;;;;Stuttgart Stock Exchange;EUR;3SUR;;;;Borsa Italiana;EUR;3SUR;3SUR IM;;;XETRA;EUR;3SUR;3SUR GYINAV3SUE;3SUR.DE0DJXINAV.DE;;;;;;;;3;63;17;5;11;10;20
IE00BZ173W74;iShares USD Corporate Bond Interest Rate Hedged UCITS ETF USD (Acc);https://www.justetf.com/en/etf-profile.html?isin=IE00BZ173W74;The iShares USD Corporate Bond Interest Rate Hedged UCITS ETF USD (Acc) seeks to track the iBoxx® USD Liquid Investment Grade Interest Rate Hedged index. The iBoxx® USD Liquid Investment Grade Interest Rate Hedged index tracks the most liquid US Dollar denominated corporate bonds. The underlying interest rate risk is hedged. Rating: Investment Grade. The ETF's TER (total expense ratio) amounts to 0.25% p.a.. The iShares USD Corporate Bond Interest Rate Hedged UCITS ETF USD (Acc) is the cheapest and largest ETF that tracks the iBoxx® USD Liquid Investment Grade Interest Rate Hedged index. The ETF replicates the performance of the underlying index by sampling technique (buying a selection of the most relevant index constituents). The interest income (coupons) in the ETF is accumulated and reinvested in the ETF. The iShares USD Corporate Bond Interest Rate Hedged UCITS ETF USD (Acc) is a small ETF with 91m Euro assets under management. The ETF was launched on 3 July 2018 and is domiciled in Ireland.;Úroková sazba ISShares USD USD zajišťovala UCITS ETF USD (ACC) usilovat o sledování indexu úrokové sazby IBOXX® USD Liquid Investment. Index indexu IBOXX® USD Liquid Investment Investment Stupence Sleduje nejvíce likvidní firemní dluhopisy v americkém dolaru. Základní úrokové riziko je zajištěno. Hodnocení: Investiční třída. TER (celkový poměr nákladů) činí 0,25% P.A .. Úroková sazba IShares USD zajišťovaná společností UCITS ETF USD (ACC) je nejlevnější a největší ETF, která sleduje index úrokové sazby IBOXX® Liquid Investment Index. ETF replikuje výkon základního indexu technikou vzorkování (nákup výběru nejdůležitějších složek indexu). Úrokové výnosy (kupóny) v ETF se nashromáždí a reinvestují do ETF. Úroková sazba ISShares USD podnikových dluhopisů Hedged UCITS ETF USD (ACC) je malá ETF s managementem 91 milionů euro. ETF byl spuštěn 3. července 2018 a má bydliště v Irsku.;0.25%;0.25;EUR 91m;91.0;EUR;USD;Ireland;iShares;3 July 2018;Accumulating;;Physical;;;Bonds, USD, World, Corporate, All maturities;;Dluhopisy;False;Globální;2552.0;1.87;9.89;33.33;-7.69;8.92;8.51;8.02;0.21;0.37;0.74;-11.76;-11.76;-11.76;-20.71;;;;;Bolsa Mexicana de Valores;-;3;;;;;;;2025-09-19T10:54:58.957487;success;0;;;;;;;;;;;;;;;;;;;;;United States;59.71;Other;34.06;United Kingdom;3.04;Japan;1.26;;;;;;;;;;;;;gettex;EUR;OM3I;;;;Bolsa Mexicana de Valores;MXN;-;HLQDN MM;HLQDN.MX;;London Stock Exchange;USD;HLQD;HLQD LNINAVHLQU;HLQD.L0X3VINAV.DE;;;;;;;;;;;;;;3;54;17;1;11;10;15
IE00BZ17CN18;iShares USD Short Duration High Yield Corporate Bond UCITS ETF USD (Acc);https://www.justetf.com/en/etf-profile.html?isin=IE00BZ17CN18;The iShares USD Short Duration High Yield Corporate Bond UCITS ETF USD (Acc) seeks to track the iBoxx® USD Liquid High Yield 0-5 Capped index. The iBoxx® USD Liquid High Yield 0-5 Capped index tracks the most liquid USD denominated corporate bonds with a sub-investment grade rating. Time to maturity: 0-5 years. The ETF's TER (total expense ratio) amounts to 0.45% p.a.. The iShares USD Short Duration High Yield Corporate Bond UCITS ETF USD (Acc) is the cheapest and largest ETF that tracks the iBoxx® USD Liquid High Yield 0-5 Capped index. The ETF replicates the performance of the underlying index by sampling technique (buying a selection of the most relevant index constituents). The interest income (coupons) in the ETF is accumulated and reinvested in the ETF. The iShares USD Short Duration High Yield Corporate Bond UCITS ETF USD (Acc) is a large ETF with 811m Euro assets under management. The ETF was launched on 29 June 2018 and is domiciled in Ireland.;Krátkodobý výnos iShares USD s vysokým výnosem UCITS ETF USD (ACC) se snaží sledovat vysoký výnos IBOXX® USD s vysokým výnosem 0-5. Indexový index s vysokým výnosem IBOXX® USD s vysokým výnosem s vysokým výtěžkem s likvidnicky denominovanými firemními dluhopisy s hodnocením třídy dílčích investic. Čas do zralosti: 0-5 let. TER (celkový poměr výdajů) ETF činí 0,45% p.a. Ishares USD krátký výnos s vysokým výnosem firemní dluhopisy UCITS ETF USD (ACC) je nejlevnější a největší ETF, který sleduje index s vysokým výnosem IBOXX® USD s vysokým výnosem 0-5. ETF replikuje výkon základního indexu technikou vzorkování (nákup výběru nejdůležitějších složek indexu). Úrokové výnosy (kupóny) v ETF se nashromáždí a reinvestují do ETF. IShares USD krátký trvání s vysokým výnosem Corporate Bond UCITS ETF USD (ACC) je velký ETF s managementem 811 milionů euro. ETF byl spuštěn 29. června 2018 a je se sídlem v Irsku.;0.45%;0.45;EUR 811m;811.0;EUR;USD;Ireland;iShares;29 June 2018;Accumulating;;Physical;;;;;Dluhopisy;False;Globální;1165.0;2.05;7.18;30.63;-5.09;8.52;8.16;7.73;0.24;0.29;0.71;-11.01;-11.01;-11.01;-16.83;;;;;Bolsa Mexicana de Valores;-;3;;;;;;;2025-09-19T10:55:06.309025;success;0;;;;;;;;;;;;;;;;;;;;;United States;83.7;Other;8.56;Netherlands;2.83;Canada;1.22;;;;;;;;;;;;;gettex;EUR;OM3J;;;;Bolsa Mexicana de Valores;MXN;-;SDHAN MM;SDHAN.MX;;London Stock Exchange;USD;SDHA;SDHA LNINAVSDHU;SDHA.L0X30INAV.DE;;;;;;;;;;;;;;3;57;12;10;11;10;14
