IE00BSPLC413;SPDR MSCI USA Small Cap Value Weighted UCITS ETF;https://www.justetf.com/en/etf-profile.html?isin=IE00BSPLC413;The SPDR MSCI USA Small Cap Value Weighted UCITS ETF seeks to track the MSCI USA Small Cap Value Weighted index. The MSCI USA Small Cap Value Weighted index tracks small cap US stocks weighted by four fundamental accounting variables: sales, earnings, cash earnings and book value. The ETF's TER (total expense ratio) amounts to 0.30% p.a.. The SPDR MSCI USA Small Cap Value Weighted UCITS ETF is the only ETF that tracks the MSCI USA Small Cap Value Weighted index. The ETF replicates the performance of the underlying index by sampling technique (buying a selection of the most relevant index constituents). The dividends in the ETF are accumulated and reinvested in the ETF. The SPDR MSCI USA Small Cap Value Weighted UCITS ETF is a large ETF with 683m Euro assets under management. The ETF was launched on 18 February 2015 and is domiciled in Ireland.;SPDR MSCI USA Hodnota Hodnota malé čepice UCITS ETF se snaží sledovat index váženého hodnoty MSCI USA. Indexové indexové skladby MSCI USA Small Cap Hodnota skladby Small Cap US akcie vážené čtyřmi základními účetními proměnnými: prodej, výdělky, výdělky v hotovosti a účetní hodnota. TER (celkový poměr výdajů) ETF činí 0,30% p.a. ETF replikuje výkon základního indexu technikou vzorkování (nákup výběru nejdůležitějších složek indexu). dividenday v ETF jsou akumulovány a reinvestovány do ETF. Hodnota SPDR MSCI USA Hodnota UCITS ETF je velká ETF s řízením 683 milionů euro. ETF byl spuštěn 18. února 2015 a je se sídlem v Irsku.;0.30%;0.3;EUR 683m;683.0;EUR;USD;Ireland;SPDR ETF;18 February 2015;;;Physical;UCITS;MSCI USA Small Cap Value Weighted;Equity, United States, Small Cap;;USD    Currency risk  Currency;1;Akcie;False;Severní Amerika;1660.0;4.92;30.26;143.29;-2.52;0.66;11.64;7.41;46.71;-4.68;16.95;16.65;174.51;24.59;22.7;23.15;0.2;0.41;0.84;-29.3;-29.3;-29.3;-46.52;;;;0.58;London Stock Exchange;USSC;4;;;;;;;2025-09-24T02:40:31.441952;success;0;TD SYNNEX Corp;0.64;Viatris;0.61;Ovintiv;0.59;HF Sinclair;0.58;Performance Food Group;0.57;SanDisk;0.56;APA;0.52;Mosaic Co;0.48;Plains GP Holdings LP;0.47;;;United States;89.77;Other;8.75;;;;;;;Financials;21.26;Consumer Discretionary;15.12;Industrials;14.37;Energy;8.28;;;gettex;EUR;ZPRV;;;;Stuttgart Stock Exchange;EUR;ZPRV;;;;London Stock Exchange;USD;USSC;USSC LNINZPRVU;USSC.L;;XETRA;EUR;ZPRV;ZPRV GYINZPRVE;ZPRV.DE;;;;;;;;;;;;;;;;;;;;;;;;;;;;;;;;;;;;;;3;64;12;10;13;10;19
IE00BSPLC520;SPDR MSCI USA Value Weighted UCITS ETF;https://www.justetf.com/en/etf-profile.html?isin=IE00BSPLC520;The SPDR MSCI USA Value Weighted UCITS ETF seeks to track the MSCI USA Value Weighted index. The MSCI USA Value Weighted index tracks US stocks weighted by four fundamental accounting variables: sales, earnings, cash earnings and book value. The ETF's TER (total expense ratio) amounts to 0.20% p.a.. The SPDR MSCI USA Value Weighted UCITS ETF is the only ETF that tracks the MSCI USA Value Weighted index. The ETF replicates the performance of the underlying index by full replication (buying all the index constituents). The dividends in the ETF are accumulated and reinvested in the ETF. The SPDR MSCI USA Value Weighted UCITS ETF has 136m Euro assets under management. The ETF was launched on 18 February 2015 and is domiciled in Ireland.;Hodnota SPDR MSCI USA vážená uCITS ETF se snaží sledovat index váženého hodnoty MSCI USA. Index váženého MSCI USA Index sleduje americké akcie vážené čtyřmi základními proměnnými účetních účetních: prodej, výdělky, výdělky v hotovosti a účetní hodnota. TER (celkový poměr nákladů) ETF činí 0,20% p.a. Hodnota SPDR MSCI USA vážená UCITS ETF je jediným ETF, který sleduje index váženého hodnoty MSCI USA. ETF replikuje výkon podkladového indexu plnou replikací (nákup všech složek indexu). dividenday v ETF jsou akumulovány a reinvestovány do ETF. Hodnota SPDR MSCI USA vážená UCITS ETF má ve správě aktiv 136 milionů euro. ETF byl spuštěn 18. února 2015 a je se sídlem v Irsku.;0.20%;0.2;EUR 136m;136.0;EUR;USD;Ireland;SPDR ETF;18 February 2015;;;Physical;UCITS;MSCI USA Value Weighted;Equity, United States, Value;;USD    Currency risk  Currency;1;Akcie;False;Severní Amerika;124.0;5.85;23.5;81.69;1.99;1.53;9.21;4.97;39.71;-9.43;10.97;11.82;152.18;19.8;17.92;18.14;0.3;0.41;0.7;-22.1;-22.1;-22.1;-39.34;;;;;London Stock Exchange;USVL;6;;;;;;;2025-09-24T02:40:46.487144;success;0;QUALCOMM, Inc.;4.69;Applied Materials, Inc.;4.1;General Motors Co.;3.67;Micron Technology;3.39;Bank of America Corp.;3.12;Intel Corp.;2.98;AT&T, Inc.;2.84;Citigroup, Inc.;2.82;Verizon Communications;2.69;;;United States;96.21;Other;3.79;;;;;;;Financials;14.52;Consumer Discretionary;11.13;Materials;4.1;Technology;3.39;;;gettex;EUR;ZPRU;;;;Stuttgart Stock Exchange;EUR;ZPRU;;;;London Stock Exchange;USD;USVL;USVL LNINZPRUU;USVL.L;;London Stock Exchange;GBP;UVAL;UVAL LNINZPRUG;UVAL.L;;SIX Swiss Exchange;CHF;UVAL;UVAL SEINZPRUC;UVAL.S;;XETRA;EUR;ZPRU;ZPRU GYINZPRUE;ZPRU.DE;;;;;;;;;;;;;;;;;;;;;;;;;;3;64;17;5;13;10;19
IE00BT9PVG14;First Trust Dow Jones International Internet UCITS ETF Acc;https://www.justetf.com/en/etf-profile.html?isin=IE00BT9PVG14;The First Trust Dow Jones International Internet UCITS ETF Acc seeks to track the Dow Jones International Internet index. The Dow Jones International Internet index tracks companies worldwide whose main business is in internet-related sectors. The ETF's TER (total expense ratio) amounts to 0.65% p.a.. The ETF replicates the performance of the underlying index by full replication (buying all the index constituents). The dividends in the ETF are accumulated and reinvested in the ETF. The First Trust Dow Jones International Internet UCITS ETF Acc is a very small ETF with 9m Euro assets under management. The ETF was launched on 17 January 2017 and is domiciled in Ireland.;První Trust Dow Jones International Internet UCITS ETF ACC se snaží sledovat mezinárodní internetový index Dow Jones. Index Dow Jones Internet Internet Index sleduje společnosti po celém světě, jejichž hlavní podnikání je v sektoru souvisejících s internetem. TER (celkový poměr nákladů) ETF činí 0,65% p.a. ETF replikuje výkon podkladového indexu plnou replikací (nákup všech složek indexu). dividenday v ETF jsou akumulovány a reinvestovány do ETF. První Trust Dow Jones International Internet UCITS ETF ACC je velmi malá ETF s spravováním 9m euro. ETF byl spuštěn 17. ledna 2017 a je se sídlem v Irsku.;0.65%;0.65;EUR 9m;9.0;EUR;USD;Ireland;First Trust;17 January 2017;Accumulating;;Physical;UCITS;;Equity, World, Technology;;USD    Currency risk  Currency;1;Akcie;False;Celosvětově;40.0;43.44;60.98;-7.1;23.94;6.33;14.92;9.72;-18.63;-34.71;-1.41;29.98;14.37;24.51;24.7;28.34;1.77;0.7;-0.05;-24.23;-24.49;-63.9;-63.9;;;;;London Stock Exchange;FDIU;4;;;;;;;2025-09-24T02:40:54.822798;success;0;Alibaba Group Holding Ltd.;9.71;Shopify, Inc.;8.59;Spotify Technology SA;5.53;Meituan;5.11;PDD Holdings;4.95;Prosus NV;4.72;Naspers Ltd.;4.55;Sea Ltd. (Singapore);4.53;JD.com, Inc.;4.05;;;China;43.89;Other;30.48;Canada;9.42;Netherlands;8.62;;;Consumer Discretionary;35.05;Technology;17.93;;;;;;;Borsa Italiana;EUR;FDNI;FDNI IM;;;London Stock Exchange;GBX;FDNI;FDNI LNFTSZINAV;;;London Stock Exchange;USD;FDIU;FDIU LNFTSZINAV;;;SIX Swiss Exchange;CHF;FTSZ;FTSZ SWFTSZINAV;;;;;;;;;;;;;;;;;;;;;;;;;;;;;;;;;;;;;;;2;43;6;1;11;5;20
IE00BTGD1B38;Xtrackers MSCI Japan Screened UCITS ETF 4C - USD Hedged;https://www.justetf.com/en/etf-profile.html?isin=IE00BTGD1B38;The Xtrackers MSCI Japan Screened UCITS ETF 4C - USD Hedged seeks to track the MSCI Japan Select Screened (USD Hedged) index. The MSCI Japan Select Screened (USD Hedged) index tracks large and mid-cap securities of the Japanese equity markets. The stocks included are filtered according to ESG criteria (environmental, social and corporate governance). Excluded sectors and companies: weapons, tobacco, thermal coal, oil sands, non-compliance with UN Global Compact. Currency hedged to US-Dollar (USD). The ETF's TER (total expense ratio) amounts to 0.25% p.a.. The Xtrackers MSCI Japan Screened UCITS ETF 4C - USD Hedged is the only ETF that tracks the MSCI Japan Select Screened (USD Hedged) index. The ETF replicates the performance of the underlying index by full replication (buying all the index constituents). The dividends in the ETF are accumulated and reinvested in the ETF. The Xtrackers MSCI Japan Screened UCITS ETF 4C - USD Hedged is a very small ETF with 4m Euro assets under management. The ETF was launched on 31 July 2015 and is domiciled in Ireland.;XTrackers MSCI Japan Screened UCITS ETF 4C - USD Hedged se snaží sledovat index MSCI Japan Select Screened (USD Hedged). Indexové indexové cenné papíry japonských akciových trhů vybírají MSCI Japan Screebed (USD Hedged). Zahrnuté akcie jsou filtrovány podle kritérií ESG (environmentální, sociální a správa a společností). Vyloučené odvětví a společnosti: Zbraně, tabák, tepelné uhlí, ropné písky, nedodržování globálního kompaktního oSN. Měna byla zajištěna do amerického dolaru (USD). TER ETF TER (celkový poměr výdajů) činí 0,25% P.A .. Xtrackers MSCI Japan prověřoval UCITS ETF 4C - USD Hedged je jediný ETF, který sleduje index Screening MSCI Japan (USD Hedged). ETF replikuje výkon podkladového indexu plnou replikací (nákup všech složek indexu). dividenday v ETF jsou akumulovány a reinvestovány do ETF. Xtrackers MSCI Japan Screened UCITS ETF 4C - USD Hedged je velmi malý ETF s spravováním 4 milionů euro. ETF byl spuštěn 31. července 2015 a je se sídlem v Irsku.;0.25%;0.25;EUR 4m;4.0;EUR;USD;Ireland;Xtrackers;31 July 2015;;;Physical;UCITS;MSCI Japan Screened  4C - USD Hedged;Equity, Japan, Social/Environmental;Yes;USD    Currency risk  Currency;1;Akcie;False;Celosvětově;169.0;19.24;64.45;135.89;2.69;1.11;12.81;6.28;20.84;3.05;29.95;32.67;148.03;23.79;22.41;20.18;0.81;0.8;0.93;-22.62;-27.09;-27.09;-31.6;;;1.691;;gettex;XDNU;2;;;;;;;2025-09-24T02:41:05.740951;success;0;Mitsubishi UFJ Financial Group, Inc.;4.22;Sony Group Corp.;3.95;Hitachi Ltd.;3.71;Sumitomo Mitsui Financial Group, Inc.;2.5;Nintendo Co., Ltd.;2.47;Recruit Holdings Co., Ltd.;2.22;Tokyo Electron Ltd.;2.15;Tokio Marine Holdings, Inc.;1.95;SoftBank Group Corp.;1.94;;;Japan;99.92;;;;;;;;;Industrials;23.42;Financials;17.53;Consumer Discretionary;17.31;Technology;14.14;;;gettex;EUR;XDNU;;;;London Stock Exchange;USD;XDNU;XDNU LNXDNUINVE;XDNU.L0JG3INAV.DE;;;;;;;;;;;;;;;;;;;;;;;;;;;;;;;;;;;;;;;;;;;;;;;;;;3;61;17;1;13;10;20
IE00BTJRMP35;Xtrackers MSCI Emerging Markets UCITS ETF 1C;https://www.justetf.com/en/etf-profile.html?isin=IE00BTJRMP35;The Xtrackers MSCI Emerging Markets UCITS ETF 1C seeks to track the MSCI Emerging Markets index. The MSCI Emerging Markets index tracks stocks from emerging markets worldwide. The ETF's TER (total expense ratio) amounts to 0.18% p.a.. The Xtrackers MSCI Emerging Markets UCITS ETF 1C is the largest ETF that tracks the MSCI Emerging Markets index. The ETF replicates the performance of the underlying index by sampling technique (buying a selection of the most relevant index constituents). The dividends in the ETF are accumulated and reinvested in the ETF. The Xtrackers MSCI Emerging Markets UCITS ETF 1C is a very large ETF with 7,225m Euro assets under management. The ETF was launched on 21 June 2017 and is domiciled in Ireland.;The Xtrackers MSCI Emerging Markets UCITS ETF 1C se snaží sledovat index rozvíjejících se trhů MSCI. Index indexu MSCI Emerging Markets sleduje akciíy z rozvíjejících se trhů po celém světě. TER ETF TER (celkový poměr výdajů) činí 0,18% p.a .. Xtrackers MSCI Emerging Markets UCITS ETF 1C je největší ETF, který sleduje index rozvíjejících se trhů MSCI. ETF replikuje výkon základního indexu technikou vzorkování (nákup výběru nejdůležitějších složek indexu). dividenday v ETF jsou akumulovány a reinvestovány do ETF. The Xtrackers MSCI Emerging Markets UCITS ETF 1C je velmi velký ETF s managementem 7 225 milionů euro. ETF byl spuštěn dne 21. června 2017 a má bydliště v Irsku.;0.18%;0.18;EUR 7225m;7225.0;EUR;USD;Ireland;Xtrackers;21 June 2017;;;Physical;UCITS;MSCI Emerging Markets;Equity, Emerging Markets;;USD    Currency risk  Currency;1;Akcie;False;Rozvíjející se trhy;1223.0;18.0;31.48;39.2;12.67;4.92;11.46;11.18;5.39;-15.28;5.75;14.36;53.13;15.17;13.91;14.61;1.19;0.69;0.47;-17.6;-17.6;-25.98;-31.87;;;;;gettex;XMME;7;;;;;;;2025-09-24T02:41:15.882100;success;0;Tencent Holdings Ltd.;5.47;Alibaba Group Holding Ltd.;2.91;Samsung Electronics Co., Ltd.;2.59;HDFC Bank Ltd.;1.37;Xiaomi Corp.;1.27;SK hynix, Inc.;1.11;Reliance Industries Ltd.;1.05;China Construction Bank Corp.;1.01;PDD Holdings;0.93;;;China;28.03;Other;27.99;;;;;;;Technology;24.1;Financials;22.29;IT;12.67;Consumer Discretionary;12.25;;;gettex;EUR;XMME;;;;Stuttgart Stock Exchange;EUR;XMME;;;;Borsa Italiana;EUR;XMME;XMME IMXXMSGBIV;XMME.MIXXMSGBINAV=SOLA;;London Stock Exchange;GBX;XMMS;XMMS LNXMMEEUIV;XMMS.LXMMEEURINAV=SOLA;;London Stock Exchange;USD;XMME;XMME LNXMMEUSIV;XMME.LXMMEUSDINAV=SOLA;;SIX Swiss Exchange;CHF;XMME;XMME SW;XMME.S;;XETRA;EUR;XMME;XMME GY;XMME.DE;;;;;;;;;;;;;;;;;;;;4;74;17;16;11;10;20
IE00BVFZGC04;WisdomTree Bloomberg WTI Crude Oil;https://www.justetf.com/en/etf-profile.html?isin=IE00BVFZGC04;The WisdomTree Bloomberg WTI Crude Oil seeks to track the Bloomberg WTI Crude Oil index. The Bloomberg WTI Crude Oil index tracks the price of futures contracts on WTI Crude Oil. The ETC's TER (total expense ratio) amounts to 0.25% p.a.. The WisdomTree Bloomberg WTI Crude Oil is the only ETC that tracks the Bloomberg WTI Crude Oil index. The ETC replicates the performance of the underlying index synthetically with a swap. The WisdomTree Bloomberg WTI Crude Oil is a very small ETC with 11m Euro assets under management. The ETC was launched on 9 April 2015 and is domiciled in Ireland.;Wisdomtree Bloomberg WTI surový olej se snaží sledovat index ropy Bloomberg WTI. Index ropy Bloomberg WTI sleduje cenu futures kontraktů na ropu WTI. TER (celkový poměr výdajů) činí 0,25% p.a. ETC replikuje výkon podkladového indexu synteticky s výměnou. Ropná ropa Wisdomtree Bloomberg WTI je velmi malá atd. S managementem 11 metrů euro. ETC byl spuštěn 9. dubna 2015 a je se sídlem v Irsku.;0.25%;0.25;EUR 11m;11.0;EUR;USD;Ireland;WisdomTree;9 April 2015;;;Synthetic;UCITS;Bloomberg WTI Crude Oil;Commodities, Energy, Crude Oil;;USD    Currency risk  Currency;1;Komodity;False;Celosvětově;;-4.36;-10.71;149.63;-14.45;-2.67;-12.85;-8.39;73.65;31.34;-6.11;20.37;-26.68;33.61;31.98;35.58;-0.13;-0.12;0.56;-32.29;-32.29;-39.86;-88.98;;;;;Extracted (method 1);0LJC;0;;;;;;;2025-09-24T02:41:21.301544;success;0;;;;;;;;;;;;;;;;;;;;;;;;;;;;;;;;;;;;;;;;;;;;;;;;;;;;;;;;;;;;;;;;;;;;;;;;;;;;;;;;;;;;;;;;;;;;;;;;;;;;;2;44;17;1;13;5;8
IE00BVFZGD11;WisdomTree Bloomberg Brent Crude Oil;https://www.justetf.com/en/etf-profile.html?isin=IE00BVFZGD11;The WisdomTree Bloomberg Brent Crude Oil seeks to track the Bloomberg Brent Crude index. The Bloomberg Brent Crude index tracks the price of futures contracts on Brent Crude Oil. The ETC's TER (total expense ratio) amounts to 0.25% p.a.. The WisdomTree Bloomberg Brent Crude Oil is the cheapest ETC that tracks the Bloomberg Brent Crude index. The ETC replicates the performance of the underlying index synthetically with a swap. The WisdomTree Bloomberg Brent Crude Oil is a very small ETC with 6m Euro assets under management. The ETC was launched on 9 April 2015 and is domiciled in Ireland.;Wisdomtree Bloomberg Brent surový olej se snaží sledovat surový index Bloomberg Brent. INDEX BLOOMBERG BRENT sleduje cenu futures kontraktů na Brent Crude Oil. TER (celkový poměr nákladů) ETC činí 0,25% p.a. ETC replikuje výkon podkladového indexu synteticky s výměnou. Wisdomtree Bloomberg Brentární ropa je velmi malá atd., S managementem 6m euro. ETC byl spuštěn 9. dubna 2015 a je se sídlem v Irsku.;0.25%;0.25;EUR 6m;6.0;EUR;USD;Ireland;WisdomTree;9 April 2015;;;Synthetic;UCITS;Bloomberg Brent Crude Oil;Commodities, Energy, Crude Oil;;USD    Currency risk  Currency;1;Komodity;False;Celosvětově;;-3.25;-10.49;186.95;-13.3;-2.63;-10.94;-9.13;77.25;49.07;-5.1;15.79;26.33;31.44;29.43;32.94;-0.1;-0.12;0.71;-29.45;-30.4;-33.03;-72.22;;;;;Extracted (method 1);0LJD;0;;;;;;;2025-09-24T02:41:32.678055;success;0;;;;;;;;;;;;;;;;;;;;;;;;;;;;;;;;;;;;;;;;;;;;;;;;;;;;;;;;;;;;;;;;;;;;;;;;;;;;;;;;;;;;;;;;;;;;;;;;;;;;;2;44;17;1;13;5;8
IE00BVGC6645;Invesco JPX-Nikkei 400 EUR Hedged UCITS ETF;https://www.justetf.com/en/etf-profile.html?isin=IE00BVGC6645;The Invesco JPX-Nikkei 400 EUR Hedged UCITS ETF seeks to track the JPX-Nikkei 400 (EUR Hedged) index. The JPX-Nikkei 400 Daily (EUR Hedged) index tracks 400 Japanese stocks. The stocks are mainly selected by return on equity and cumulative operating profit. Daily Currency hedged to Euro (EUR). The ETF's TER (total expense ratio) amounts to 0.19% p.a.. The ETF replicates the performance of the underlying index synthetically with a swap. The dividends in the ETF are accumulated and reinvested in the ETF. The Invesco JPX-Nikkei 400 EUR Hedged UCITS ETF is a very small ETF with 9m Euro assets under management. The ETF was launched on 10 March 2015 and is domiciled in Ireland.;Invesco JPX-Nikkei 400 EUR zajišťuje UCITS ETF usiluje o sledování indexu JPX-Nikkei 400 (EUR Hedged). Indexové indexové akciíy JPX-Nikkei 400 (EUR Hedged) 400 japonských akcií. Akcie jsou vybírány hlavně návratností vlastního kapitálu a kumulativního provozního zisku. Denní měna zajišťovala euro (EUR). ETF TER (celkový poměr nákladů) činí 0,19% p.a. ETF replikuje výkon podkladového indexu synteticky s výměnou. dividenday v ETF jsou akumulovány a reinvestovány do ETF. Invesco JPX-Nikkei 400 EUR Hedged UCITS ETF je velmi malá ETF s spravováním 9m euro. ETF byl spuštěn 10. března 2015 a je se sídlem v Irsku.;0.19%;0.19;EUR 9m;9.0;EUR;EUR;Ireland;Invesco;10 March 2015;;;Synthetic (Unfunded swap);UCITS;;Equity, Japan;;EUR    Currency risk  Currency;1;Akcie;False;Celosvětově;;22.97;89.31;124.89;15.79;2.63;13.43;14.46;11.4;-3.58;31.36;24.2;148.83;19.76;20.06;18.76;1.16;1.18;0.94;-17.14;-24.28;-24.28;-33.71;;;;;gettex;NS4E;3;;;;;;;2025-09-24T02:41:41.866537;success;0;;;;;;;;;;;;;;;;;;;;;;;;;;;;;;;;;;;;;;;;;gettex;EUR;NS4E;;;;Stuttgart Stock Exchange;EUR;NS4E;;;;XETRA;EUR;NS4E;NS4E GYNS4EIN;NS4E.DE2745INAV.DE;;;;;;;;;;;;;;;;;;;;;;;;;;;;;;;;;;;;;;;;;;;;3;61;17;1;13;10;20
IE00BVGC6751;Invesco JPX-Nikkei 400 USD Hedged UCITS ETF;https://www.justetf.com/en/etf-profile.html?isin=IE00BVGC6751;The Invesco JPX-Nikkei 400 USD Hedged UCITS ETF seeks to track the JPX-Nikkei 400 (USD Hedged) index. The JPX-Nikkei 400 Daily (USD Hedged) index tracks 400 Japanese stocks. The stocks are mainly selected by return on equity and cumulative operating profit. Currency hedged to US dollar. The ETF's TER (total expense ratio) amounts to 0.19% p.a.. The ETF replicates the performance of the underlying index synthetically with a swap. The dividends in the ETF are accumulated and reinvested in the ETF. The Invesco JPX-Nikkei 400 USD Hedged UCITS ETF is a very small ETF with 13m Euro assets under management. The ETF was launched on 10 March 2015 and is domiciled in Ireland.;Invesco JPX-Nikkei 400 USD Hedged UCITS ETF se snaží sledovat index JPX-Nikkei 400 (USD Hedged). Indexové indexové akciíy JPX-Nikkei 400 (USD Hedged) 400 japonských akcií. Akcie jsou vybírány hlavně návratností vlastního kapitálu a kumulativního provozního zisku. Měna zajistila americký dolar. ETF TER (celkový poměr nákladů) činí 0,19% p.a. ETF replikuje výkon podkladového indexu synteticky s výměnou. dividenday v ETF jsou akumulovány a reinvestovány do ETF. Invesco JPX-Nikkei 400 USD Hedged UCITS ETF je velmi malý ETF s 13 miliony euro. ETF byl spuštěn 10. března 2015 a je se sídlem v Irsku.;0.19%;0.19;EUR 13m;13.0;EUR;USD;Ireland;Invesco;10 March 2015;;;Synthetic (Unfunded swap);UCITS;;Equity, Japan;;USD    Currency risk  Currency;1;Akcie;False;Celosvětově;;18.75;69.02;144.9;3.4;1.09;11.96;6.25;21.19;5.39;30.2;33.65;171.51;21.86;21.55;19.53;0.86;0.89;1.0;-21.0;-26.04;-26.04;-32.03;;;;;London Stock Exchange;N4US;1;;;;;;;2025-09-24T02:41:48.423520;success;0;;;;;;;;;;;;;;;;;;;;;;;;;;;;;;;;;;;;;;;;;London Stock Exchange;USD;N4US;N4US LNN4USIN;N4US.L2746INAV.DE;;;;;;;;;;;;;;;;;;;;;;;;;;;;;;;;;;;;;;;;;;;;;;;;;;;;;;;;3;61;17;1;13;10;20
IE00BVXBH163;WisdomTree Europe Equity UCITS ETF USD Hedged;https://www.justetf.com/en/etf-profile.html?isin=IE00BVXBH163;The WisdomTree Europe Equity UCITS ETF USD Hedged seeks to track the WisdomTree Europe Equity (USD Hedged) index. The WisdomTree Europe (USD Hedged) Equity index tracks European stocks. The stocks included are filtered according to ESG criteria (environmental, social and corporate governance). The Index is a fundamentally weighted index. Currency hedged to US-Dollar (USD). The ETF's TER (total expense ratio) amounts to 0.58% p.a.. The WisdomTree Europe Equity UCITS ETF USD Hedged is the only ETF that tracks the WisdomTree Europe Equity (USD Hedged) index. The ETF replicates the performance of the underlying index by full replication (buying all the index constituents). The dividends in the ETF are distributed to the investors (Semi annually). The WisdomTree Europe Equity UCITS ETF USD Hedged is a small ETF with 24m Euro assets under management. The ETF was launched on 18 May 2015 and is domiciled in Ireland.;WisdomTree Europe Equity UCITS ETF USD Hedged se snaží sledovat index WisdomTree Europe Europe (USD Hedged). Index vlastního kapitálu WisdomTree Europe (Hedged USD) sleduje evropské akcie. Zahrnuté akcie jsou filtrovány podle kritérií ESG (environmentální, sociální a správa a společností). Index je zásadně vážený index. Měna byla zajištěna do amerického dolaru (USD). TER (celkový poměr výdajů) ETF činí 0,58% P.A .. Hrpování Evropského kapitálu WisdomTree Europe UCITS ETF je jediným indexem ETF, který sleduje index WisdomTree Europe (USD Hedged). ETF replikuje výkon podkladového indexu plnou replikací (nákup všech složek indexu). dividenday v ETF jsou distribuovány investorům (polo každoročně). WisdomTree Europe Equity UCITS ETF USD Hedged je malý ETF s spravovaným aktivy ETF 24 milionů EUR. ETF byl spuštěn 18. května 2015 a má bydliště v Irsku.;0.58%;0.58;EUR 24m;24.0;EUR;USD;Ireland;WisdomTree;18 May 2015;;Semi annually;Physical;UCITS;;Equity, Europe, Dividend;Yes;USD    Currency risk  Currency;1;Akcie;False;Evropa;121.0;10.33;40.54;86.89;1.64;-3.01;2.94;-4.81;34.06;-4.5;21.3;12.4;111.08;17.71;15.18;15.88;0.58;0.79;0.84;-20.05;-20.05;-20.05;-37.44;;;;;Borsa Italiana;HEDJ;5;2.26%;2.26;EUR 0.54;0.54;EUR;method2_regex;2025-09-24T02:41:56.200055;success;0;Banco Bilbao Vizcaya Argentaria SA;6.71;Deutsche Telekom AG;5.22;Siemens AG;4.56;Sanofi;3.69;Münchener Rückversicherungs-Gesellschaft AG;3.52;LVMH Moët Hennessy Louis Vuitton SE;3.5;L'Oréal SA;3.09;SAP SE;3.03;Schneider Electric SE;2.5;;;Germany;26.81;Other;23.73;France;21.29;Netherlands;8.15;;;Financials;21.7;Industrials;20.53;Consumer Staples;11.06;Consumer Discretionary;10.71;;;gettex;EUR;WTDH;;;;Borsa Italiana;EUR;HEDJ;HEDJ IMHEDJEIV;HEDJ.MI;;London Stock Exchange;USD;HEDJ;HEDJ LNHEDJEIV;HEDJ.L;;SIX Swiss Exchange;USD;HEDJ;HEDJ SWHEDJEIV;HEDJ.S;;XETRA;EUR;WTDH;WTDH GYHEDJEIV;WTDH.DE;;;;;;;;;;;;;;;;;;;;;;;;;;;;;;;;2;45;6;1;13;5;20
