LU1681044480;Amundi MSCI Emerging Markets Asia UCITS ETF EUR (C);https://www.justetf.com/en/etf-profile.html?isin=LU1681044480;The Amundi MSCI Emerging Markets Asia UCITS ETF EUR (C) seeks to track the MSCI Emerging Markets Asia index. The MSCI Emerging Markets Asia index tracks large and mid cap companies from Asian emerging markets. The ETF's TER (total expense ratio) amounts to 0.20% p.a.. The Amundi MSCI Emerging Markets Asia UCITS ETF EUR (C) is the cheapest ETF that tracks the MSCI Emerging Markets Asia index. The ETF replicates the performance of the underlying index synthetically with a swap. The dividends in the ETF are accumulated and reinvested in the ETF. The Amundi MSCI Emerging Markets Asia UCITS ETF EUR (C) is a very large ETF with 1,157m Euro assets under management. The ETF was launched on 28 April 2011 and is domiciled in Luxembourg.;Amundi MSCI Emerging Markets Asia UCITS ETF EUR (C) se snaží sledovat index rozvíjejících se trhů MSCI. Na rozvíjející se trhy MSCI se index Asie sleduje velké a střední společnosti z asijských rozvíjejících se trhů. TER (celkový poměr výdajů) činí 0,20% p.a. Amundi MSCI Emerging Trhy Asia UCITS ETF EUR (C) je nejlevnější ETF, který sleduje index Asie Emerging Markets MSCI. ETF replikuje výkon podkladového indexu synteticky s výměnou. dividenday v ETF jsou akumulovány a reinvestovány do ETF. Amundi MSCI Emerging Markets Asia UCITS ETF EUR (C) je velmi velký ETF s 1,157 milionu euro ve spravování. ETF byla spuštěna 28. dubna 2011 a je bydliště v Lucemburku.;0.20%;0.2;EUR 1157m;1157.0;EUR;EUR;Luxembourg;Amundi ETF;28 April 2011;Accumulating;;Synthetic (Unfunded swap);UCITS;MSCI Emerging Markets;Equity, Asia Pacific;;EUR    Currency risk  Currency;1;Akcie;False;Asie a Pacifik;;19.52;33.49;33.73;11.66;5.53;12.71;11.03;1.8;-16.09;3.94;19.4;142.52;17.56;16.86;17.27;1.11;0.6;0.35;-19.01;-19.01;-33.18;-33.94;;;;;Borsa Italiana;-;7;;;;;;;2025-09-22T01:10:55.930911;success;0;;;;;;;;;;;;;;;;;;;;;;;;;;;;;;;;;;;;;;;;;gettex;EUR;AMEA;;;;Stuttgart Stock Exchange;EUR;AMEA;;;;Borsa Italiana;EUR;AASI;AASI IMIAASI;AASI.MIIAASIINAV.PA;;Borsa Italiana;EUR;-;AASI IMIAASI;AASI.MIIAASI=BNPP;;Euronext Paris;EUR;AASI;AASI FPIAASI;AASI.PAIAASI=BNPP;;SIX Swiss Exchange;EUR;AASI;AASI SWIAASI;AASI.SIAASI=BNPP;;XETRA;EUR;AMEA;AMEA GYIAASI;AMEA.DEIAASI=BNPP;;;;;;;;;;;;;;;;;;;;4.0;73.0;17.0;13.0;13.0;10.0;20.0
LU1681044563;Amundi MSCI Emerging Markets Asia UCITS ETF USD;https://www.justetf.com/en/etf-profile.html?isin=LU1681044563;The Amundi MSCI Emerging Markets Asia UCITS ETF USD seeks to track the MSCI Emerging Markets Asia index. The MSCI Emerging Markets Asia index tracks large and mid cap companies from Asian emerging markets. The ETF's TER (total expense ratio) amounts to 0.20% p.a.. The Amundi MSCI Emerging Markets Asia UCITS ETF USD is the cheapest ETF that tracks the MSCI Emerging Markets Asia index. The ETF replicates the performance of the underlying index synthetically with a swap. The dividends in the ETF are accumulated and reinvested in the ETF. The Amundi MSCI Emerging Markets Asia UCITS ETF USD is a large ETF with 638m Euro assets under management. The ETF was launched on 11 May 2011 and is domiciled in Luxembourg.;Amundi MSCI Emerging Markets Asia UCITS ETF USD se snaží sledovat index Asie rozvíjejících se MSCI. Na rozvíjející se trhy MSCI se index Asie sleduje velké a střední společnosti z asijských rozvíjejících se trhů. TER (celkový poměr výdajů) ETF činí 0,20% P.A .. Amundi MSCI rozvíjející se trhy Asia UCITS ETF USD je nejlevnější ETF, který sleduje index Asia MSCI. ETF replikuje výkon podkladového indexu synteticky s výměnou. dividenday v ETF jsou akumulovány a reinvestovány do ETF. Amundi MSCI Emerging Markets Asia UCITS ETF USD je velký ETF s managementem 638 milionů euro. ETF byl spuštěn 11. května 2011 a je se sídlem v Lucemburku.;0.20%;0.2;EUR 638m;638.0;EUR;USD;Luxembourg;Amundi ETF;11 May 2011;;;Synthetic (Unfunded swap);UCITS;MSCI Emerging Markets;Equity, Asia Pacific;;USD    Currency risk  Currency;1;Akcie;False;Asie a Pacifik;;19.68;33.05;33.29;11.9;5.49;12.66;11.1;2.52;-16.37;3.84;19.04;137.97;17.19;15.98;16.46;1.14;0.62;0.36;-18.96;-18.96;-32.86;-34.19;;;;;Bolsa Mexicana de Valores;-;6;;;;;;;2025-09-22T01:11:03.791655;success;0;;;;;;;;;;;;;;;;;;;;;;;;;;;;;;;;;;;;;;;;;gettex;EUR;XPAM;;;;Bolsa Mexicana de Valores;USD;-;IAASU;IAASUINAV.PA;;Euronext Paris;USD;AASU;AASU FPIAASU;AASU.PAIAASU=BNPP;;London Stock Exchange;GBX;AASG;AASG LNIAASU;AASG.LIAASUINAV.PA;;London Stock Exchange;USD;AASU;AASU LNIAASU;AASU.LIAASU=BNPP;;SIX Swiss Exchange;USD;AASU;AASU SWIAASU;AASU.SIAASU=BNPP;;;;;;;;;;;;;;;;;;;;;;;;;;4.0;70.0;17.0;10.0;13.0;10.0;20.0
LU1681044647;Amundi MSCI Nordic UCITS ETF EUR (C);https://www.justetf.com/en/etf-profile.html?isin=LU1681044647;The Amundi MSCI Nordic UCITS ETF EUR (C) seeks to track the MSCI Nordic Countries index. The MSCI Nordic Countries index tracks leading stocks on the Nordic market, including Denmark, Norway, Finland and Sweden. The ETF's TER (total expense ratio) amounts to 0.25% p.a.. The Amundi MSCI Nordic UCITS ETF EUR (C) is the cheapest ETF that tracks the MSCI Nordic Countries index. The ETF replicates the performance of the underlying index by full replication (buying all the index constituents). The dividends in the ETF are accumulated and reinvested in the ETF. The Amundi MSCI Nordic UCITS ETF EUR (C) has 246m Euro assets under management. The ETF was launched on 16 September 2008 and is domiciled in Luxembourg.;Amundi MSCI Nordic UCITS ETF EUR (C) se snaží sledovat index zemí MSCI. Index zemí MSCI Nordic sleduje přední akcie na severském trhu, včetně Dánska, Norska, Finska a Švédska. TER (celkový poměr výdajů) ETF činí 0,25% p.a. Amundi MSCI Nordic UCITS ETF EUR (C) je nejlevnější ETF, který sleduje index MSCI Nordic zemí. ETF replikuje výkon podkladového indexu plnou replikací (nákup všech složek indexu). dividenday v ETF jsou akumulovány a reinvestovány do ETF. Amundi MSCI Nordic UCITS ETF EUR (C) má ve spravování aktiva 246 milionů EUR. ETF byl spuštěn 16. září 2008 a je bydliště v Lucemburku.;0.25%;0.25;EUR 246m;246.0;EUR;EUR;Luxembourg;Amundi ETF;16 September 2008;Accumulating;;Physical;UCITS;MSCI Nordic  EUR;Equity, Europe;;EUR    Currency risk  Currency;1;Akcie;False;Evropa;80.0;-10.72;26.24;42.8;1.51;1.64;-1.2;-4.57;28.37;-12.05;16.86;-1.52;267.02;18.98;16.21;16.99;-0.57;0.5;0.43;-23.82;-26.49;-26.49;-46.19;;;;;Borsa Italiana;-;8;;;;;;;2025-09-22T01:11:09.321097;success;0;Spotify Technology SA;7.2;Investor AB;3.66;DSV A/S;3.4;Volvo;3.29;Nordea Bank Abp;3.23;Atlas Copco AB;2.95;ASSA ABLOY AB;2.35;Skandinaviska Enskilda Banken AB;1.96;Danske Bank A/S;1.94;;;Other;20.58;;;;;;;;;Industrials;28.36;Financials;18.07;Technology;7.2;Materials;4.94;;;gettex;EUR;CN1G;;;;Stuttgart Stock Exchange;EUR;CN1G;;;;Borsa Italiana;EUR;CN1;CN1 IMINCN1;CN1.MIINCN1INAV.PA;;Borsa Italiana;EUR;-;CN1 IMINCN1;CN1.MIINCN1=BNPP;;Euronext Paris;EUR;CN1;CN1 FPINCN1;CN1.PAINCN1=BNPP;;London Stock Exchange;GBX;CN1;CN1 LNINCN1;CN1.LINCN1INAV.PA;;SIX Swiss Exchange;EUR;CN1;CN1 SWINCN1;CN1.SINCN1=BNPP;;XETRA;EUR;CN1G;CN1G GYINCN1;CN1G.DEINCN1=BNPP;;;;;;;;;;;;;;4.0;66.0;17.0;5.0;15.0;10.0;19.0
LU1681044720;Amundi MSCI Switzerland UCITS ETF EUR (C);https://www.justetf.com/en/etf-profile.html?isin=LU1681044720;The Amundi MSCI Switzerland UCITS ETF EUR (C) seeks to track the MSCI Switzerland index. The MSCI Switzerland index tracks leading stocks on the Swiss market. The ETF's TER (total expense ratio) amounts to 0.25% p.a.. The Amundi MSCI Switzerland UCITS ETF EUR (C) is the cheapest ETF that tracks the MSCI Switzerland index. The ETF replicates the performance of the underlying index synthetically with a swap. The dividends in the ETF are accumulated and reinvested in the ETF. The Amundi MSCI Switzerland UCITS ETF EUR (C) has 190m Euro assets under management. The ETF was launched on 16 September 2008 and is domiciled in Luxembourg.;Amundi MSCI Switzerland UCITS ETF EUR (C) se snaží sledovat index MSCI Švýcarsko. Index Switzerland MSCI sleduje přední akciíy na švýcarském trhu. TER (celkový poměr výdajů) ETF činí 0,25% P.A .. Amundi MSCI Švýcarsko UCITS ETF EUR (C) je nejlevnější ETF, který sleduje index MSCI Švýcarsko. ETF replikuje výkon podkladového indexu synteticky s výměnou. dividenday v ETF jsou akumulovány a reinvestovány do ETF. Amundi MSCI Switzerland UCITS ETF EUR (C) má ve správě aktiv EURO 190M EURO. ETF byl spuštěn 16. září 2008 a je bydliště v Lucemburku.;0.25%;0.25;EUR 190m;190.0;EUR;EUR;Luxembourg;Amundi ETF;16 September 2008;Accumulating;;Synthetic (Unfunded swap);UCITS;MSCI Switzerland  EUR;Equity, Switzerland;;EUR    Currency risk  Currency;1;Akcie;False;Celosvětově;;4.23;23.13;40.38;7.45;0.08;2.69;-2.07;28.03;-13.16;11.65;4.36;317.67;13.68;12.5;12.86;0.31;0.57;0.55;-15.14;-15.14;-17.38;-33.79;;;;;Euronext Paris;CSW;5;;;;;;;2025-09-22T01:11:14.462207;success;0;;;;;;;;;;;;;;;;;;;;;;;;;;;;;;;;;;;;;;;;;gettex;EUR;540J;;;;Stuttgart Stock Exchange;EUR;540J;;;;Euronext Paris;EUR;CSW;CSW FPINCSW;CSW.PAINCSW=BNPP;;SIX Swiss Exchange;EUR;CSWE;CSWE SWINCSW;CSWE.SINCSW=BNPP;;XETRA;EUR;540J;540J GYINCSW;CSW.DEINCSW=BNPP;;;;;;;;;;;;;;;;;;;;;;;;;;;;;;;;4.0;67.0;17.0;5.0;15.0;10.0;20.0
LU1681044993;Amundi MSCI Switzerland UCITS ETF CHF;https://www.justetf.com/en/etf-profile.html?isin=LU1681044993;The Amundi MSCI Switzerland UCITS ETF CHF seeks to track the MSCI Switzerland index. The MSCI Switzerland index tracks leading stocks on the Swiss market. The ETF's TER (total expense ratio) amounts to 0.25% p.a.. The Amundi MSCI Switzerland UCITS ETF CHF is the cheapest and largest ETF that tracks the MSCI Switzerland index. The ETF replicates the performance of the underlying index synthetically with a swap. The dividends in the ETF are accumulated and reinvested in the ETF. The Amundi MSCI Switzerland UCITS ETF CHF has 263m Euro assets under management. The ETF was launched on 17 June 2010 and is domiciled in Luxembourg.;Amundi MSCI Switzerland UCITS ETF CHF se snaží sledovat index MSCI Switzerland. Index Switzerland MSCI sleduje přední akciíy na švýcarském trhu. TER (celkový poměr nákladů) ETF činí 0,25% p.a. Amundi MSCI Švýcarsko UCITS ETF CHF je nejlevnější a největší ETF, který sleduje index MSCI Švýcarsko. ETF replikuje výkon podkladového indexu synteticky s výměnou. dividenday v ETF jsou akumulovány a reinvestovány do ETF. Amundi MSCI Switzerland UCITS ETF CHF má ve správě aktiv 263 milionů euro. ETF byl spuštěn 17. června 2010 a má bydliště v Lucemburku.;0.25%;0.25;EUR 263m;263.0;EUR;CHF;Luxembourg;Amundi ETF;17 June 2010;;;Synthetic (Unfunded swap);UCITS;MSCI Switzerland  CHF;Equity, Switzerland;;CHF    Currency risk  Currency;1;Akcie;False;Celosvětově;;4.14;23.02;40.26;7.36;0.0;2.61;-2.15;28.18;-13.16;11.65;4.36;264.51;14.25;12.82;13.06;0.29;0.56;0.54;-15.14;-15.14;-17.38;-26.0;;;;;gettex;18MN;6;;;;;;;2025-09-22T01:11:20.482828;success;0;;;;;;;;;;;;;;;;;;;;;;;;;;;;;;;;;;;;;;;;;gettex;EUR;18MN;;;;Euronext Paris;CHF;CSWC;CSWC FPICSWC;CSWC.PAICSWC=BNPP;;London Stock Exchange;GBX;CSWG;CSWG LNICSWC;AMCSWG.LICSWCINAV.PA;;London Stock Exchange;USD;CSWU;CSWU LNICSWC;CSWU.LICSWCINAV.PA;;SIX Swiss Exchange;CHF;CSWCHF;CSWCHF SWICSWC;CSWCHF.SICSWC=BNPP;;XETRA;EUR;18MN;18MN GYCNAVC029;18MN.DEC029EURINAV=SOLA;;;;;;;;;;;;;;;;;;;;;;;;;;4.0;67.0;17.0;5.0;15.0;10.0;20.0
LU1681045024;Amundi MSCI Emerging Markets Latin America UCITS ETF EUR (C);https://www.justetf.com/en/etf-profile.html?isin=LU1681045024;The Amundi MSCI Emerging Markets Latin America UCITS ETF EUR (C) seeks to track the MSCI Emerging Markets Latin America index. The MSCI Emerging Markets Latin America index tracks the equity markets of emerging markets in Latin America. The ETF's TER (total expense ratio) amounts to 0.20% p.a.. The Amundi MSCI Emerging Markets Latin America UCITS ETF EUR (C) is the cheapest and largest ETF that tracks the MSCI Emerging Markets Latin America index. The ETF replicates the performance of the underlying index synthetically with a swap. The dividends in the ETF are accumulated and reinvested in the ETF. The Amundi MSCI Emerging Markets Latin America UCITS ETF EUR (C) has 267m Euro assets under management. The ETF was launched on 28 April 2011 and is domiciled in Luxembourg.;Amundi MSCI Emerging Markets Latin America UCITS ETF EUR (C) se snaží sledovat index rozvíjejících se trhů MSCI Latin America. Na rozvíjející se trhy MSCI index Latinská Amerika sleduje akciové trhy na rozvíjejících se trzích v Latinské Americe. TER (celkový poměr výdajů) ETF činí 0,20% P.A .. Amundi MSCI Emerging Markets Latin America UCITS ETF EUR (C) je nejlevnější a největší ETF, který sleduje index rozvíjejících se trhů MSCI Latin America. ETF replikuje výkon podkladového indexu synteticky s výměnou. dividenday v ETF jsou akumulovány a reinvestovány do ETF. Amundi MSCI Emerging Markets Latin America UCITS ETF EUR (C) má 267 milionů euro aktiv. ETF byla spuštěna 28. dubna 2011 a je bydliště v Lucemburku.;0.20%;0.2;EUR 267m;267.0;EUR;EUR;Luxembourg;Amundi ETF;28 April 2011;Accumulating;;Synthetic (Unfunded swap);UCITS;MSCI Emerging Markets;Equity, Latin America;;EUR    Currency risk  Currency;1;Akcie;False;Severní Amerika;;11.19;17.44;73.14;24.72;9.42;9.2;11.86;-1.73;15.89;27.8;-21.58;14.74;17.5;19.07;20.36;0.64;0.29;0.57;-13.06;-22.64;-22.64;-52.87;;;;;Borsa Italiana;-;7;;;;;;;2025-09-22T01:11:27.649888;success;0;;;;;;;;;;;;;;;;;;;;;;;;;;;;;;;;;;;;;;;;;gettex;EUR;AMEL;;;;Stuttgart Stock Exchange;EUR;AMEL;;;;Borsa Italiana;EUR;ALAT;ALAT IMIALAT;ALAT.MIIALATINAV.PA;;Borsa Italiana;EUR;-;ALAT IMLATAMIV;ALAT.MILATAMINAV=SOLA;;Euronext Paris;EUR;ALAT;ALAT FPLATAMIV;ALAT.PALATAMINAV=SOLA;;SIX Swiss Exchange;EUR;ALAT;ALAT SWLATAMIV;ALAT.SLATAMINAV=SOLA;;XETRA;EUR;AMEL;AMEL GYLATAMIV;AMEL.DELATAMINAV=SOLA;;;;;;;;;;;;;;;;;;;;3.0;63.0;17.0;5.0;13.0;10.0;18.0
LU1681045297;Amundi MSCI Emerging Markets Latin America UCITS ETF USD;https://www.justetf.com/en/etf-profile.html?isin=LU1681045297;The Amundi MSCI Emerging Markets Latin America UCITS ETF USD seeks to track the MSCI Emerging Markets Latin America index. The MSCI Emerging Markets Latin America index tracks the equity markets of emerging markets in Latin America. The ETF's TER (total expense ratio) amounts to 0.20% p.a.. The Amundi MSCI Emerging Markets Latin America UCITS ETF USD is the cheapest ETF that tracks the MSCI Emerging Markets Latin America index. The ETF replicates the performance of the underlying index synthetically with a swap. The dividends in the ETF are accumulated and reinvested in the ETF. The Amundi MSCI Emerging Markets Latin America UCITS ETF USD is a small ETF with 68m Euro assets under management. The ETF was launched on 11 May 2011 and is domiciled in Luxembourg.;Amundi MSCI Emerging Markets Latin America UCITS ETF USD se snaží sledovat index rozvíjejících se trhů MSCI Latin America. Na rozvíjející se trhy MSCI index Latinská Amerika sleduje akciové trhy na rozvíjejících se trzích v Latinské Americe. TER (celkový poměr výdajů) činí 0,20% P.A .. Amundi MSCI Emerging Markets Latin America UCITS ETF USD je nejlevnější ETF, který sleduje index MSCI Emerging Markets Latin America. ETF replikuje výkon podkladového indexu synteticky s výměnou. dividenday v ETF jsou akumulovány a reinvestovány do ETF. Amundi MSCI Emerging Markets Latin America UCITS ETF USD je malá ETF s managementem 68 milionů euro. ETF byl spuštěn 11. května 2011 a je se sídlem v Lucemburku.;0.20%;0.2;EUR 68m;68.0;EUR;USD;Luxembourg;Amundi ETF;11 May 2011;;;Synthetic (Unfunded swap);UCITS;MSCI Emerging Markets;Equity, Latin America;;USD    Currency risk  Currency;1;Akcie;False;Severní Amerika;;11.49;17.19;72.59;25.19;9.56;9.34;12.09;-1.04;15.47;27.63;-21.83;15.14;18.71;20.21;21.44;0.61;0.27;0.54;-13.56;-23.17;-23.17;-52.9;;;;;gettex;10AR;5;;;;;;;2025-09-22T01:11:31.876661;success;0;;;;;;;;;;;;;;;;;;;;;;;;;;;;;;;;;;;;;;;;;gettex;EUR;10AR;;;;Euronext Paris;USD;ALAU;ALAU FPIALAU;ALAU.PAIALAU=BNPP;;London Stock Exchange;GBX;ALAG;ALAG LNIALAU;ALAG.LIALAUINAV.PA;;London Stock Exchange;USD;ALAU;ALAU LNIALAU;ALAU.LIALAU=BNPP;;SIX Swiss Exchange;USD;ALAU;ALAU SWIALAU;ALAU.SIALAU=BNPP;;;;;;;;;;;;;;;;;;;;;;;;;;;;;;;;3.0;59.0;17.0;1.0;13.0;10.0;18.0
LU1681045370;Amundi MSCI Emerging Markets Swap UCITS ETF EUR Acc;https://www.justetf.com/en/etf-profile.html?isin=LU1681045370;The Amundi MSCI Emerging Markets Swap UCITS ETF EUR Acc seeks to track the MSCI Emerging Markets index. The MSCI Emerging Markets index tracks stocks from emerging markets worldwide. The ETF's TER (total expense ratio) amounts to 0.20% p.a.. The ETF replicates the performance of the underlying index synthetically with a swap. The dividends in the ETF are accumulated and reinvested in the ETF. The Amundi MSCI Emerging Markets Swap UCITS ETF EUR Acc is a very large ETF with 2,797m Euro assets under management. The ETF was launched on 30 November 2010 and is domiciled in Luxembourg.;Amundi MSCI Emerging Markets Swap UCITS ETF EUR ACC se snaží sledovat index rozvíjejících se trhů MSCI. Index indexu MSCI Emerging Markets sleduje akciíy z rozvíjejících se trhů po celém světě. ETF TER (celkový poměr nákladů) činí 0,20% p.a. ETF replikuje výkon podkladového indexu synteticky s výměnou. dividenday v ETF jsou akumulovány a reinvestovány do ETF. Amundi MSCI Emerging Markets Swap UCITS ETF EUR ACC je velmi velký ETF s managementem 2 797 mil. EUR. ETF byla spuštěna 30. listopadu 2010 a je bydliště v Lucemburku.;0.20%;0.2;EUR 2797m;2797.0;EUR;EUR;Luxembourg;Amundi ETF;30 November 2010;Accumulating;;Synthetic (Unfunded swap);UCITS;MSCI Emerging Markets;Equity, Emerging Markets;;EUR    Currency risk  Currency;1;Akcie;False;Rozvíjející se trhy;;18.22;30.94;37.09;12.31;5.23;12.09;10.4;4.56;-15.08;6.07;14.54;86.58;15.45;14.61;15.17;1.18;0.64;0.43;-17.6;-17.6;-26.41;-34.91;;;;;Borsa Italiana;-;7;;;;;;;2025-09-22T01:11:36.929898;success;0;;;;;;;;;;;;;;;;;;;;;;;;;;;;;;;;;;;;;;;;;gettex;EUR;AMEM;;;;Stuttgart Stock Exchange;EUR;AMEM;;;;Borsa Italiana;EUR;AEEM;AEEM IMIAEEM;AEEM.MIIAEEMINAV.PA;;Borsa Italiana;EUR;-;AEEM IMIAEEM;AEEM.MIIAEEM=BNPP;;Euronext Paris;EUR;AEEM;AEEM FPIAEEM;AEEM.PAIAEEM=BNPP;;SIX Swiss Exchange;EUR;AEEM;AEEM SWIAEEM;AMAEEM.SIAEEM=BNPP;;XETRA;EUR;AMEM;AMEM GYIAEEM;AMEM.DEIAEEM=BNPP;;;;;;;;;;;;;;;;;;;;4.0;73.0;17.0;13.0;13.0;10.0;20.0
LU1681045453;Amundi MSCI Emerging Markets Swap UCITS ETF USD Acc;https://www.justetf.com/en/etf-profile.html?isin=LU1681045453;The Amundi MSCI Emerging Markets Swap UCITS ETF USD Acc seeks to track the MSCI Emerging Markets index. The MSCI Emerging Markets index tracks stocks from emerging markets worldwide. The ETF's TER (total expense ratio) amounts to 0.20% p.a.. The ETF replicates the performance of the underlying index synthetically with a swap. The dividends in the ETF are accumulated and reinvested in the ETF. The Amundi MSCI Emerging Markets Swap UCITS ETF USD Acc is a very large ETF with 1,071m Euro assets under management. The ETF was launched on 21 December 2010 and is domiciled in Luxembourg.;Amundi MSCI Emerging Markets Swap UCITS ETF USD ACC se snaží sledovat index rozvíjejících se trhů MSCI. Index indexu MSCI Emerging Markets sleduje akciíy z rozvíjejících se trhů po celém světě. ETF TER (celkový poměr nákladů) činí 0,20% p.a. ETF replikuje výkon podkladového indexu synteticky s výměnou. dividenday v ETF jsou akumulovány a reinvestovány do ETF. Amundi MSCI Emerging Markets Swap UCITS ETF USD ACC je velmi velký ETF s 1 071 mil. EUR. ETF byl spuštěn 21. prosince 2010 a je bydliště v Lucemburku.;0.20%;0.2;EUR 1071m;1071.0;EUR;USD;Luxembourg;Amundi ETF;21 December 2010;Accumulating;;Synthetic (Unfunded swap);UCITS;MSCI Emerging Markets;Equity, Emerging Markets;;USD    Currency risk  Currency;1;Akcie;False;Rozvíjející se trhy;;18.26;30.72;36.53;12.33;5.05;12.12;10.42;5.2;-15.42;6.07;14.32;80.5;15.54;14.13;14.77;1.17;0.66;0.43;-17.64;-17.64;-25.96;-35.07;;;;;Bolsa Mexicana de Valores;-;7;;;;;;;2025-09-22T01:11:41.242077;success;0;;;;;;;;;;;;;;;;;;;;;;;;;;;;;;;;;;;;;;;;;gettex;EUR;X9I1;;;;Bolsa Mexicana de Valores;MXN;-;AUEMN MM;;;Bolsa Mexicana de Valores;USD;-;IAUEM;IAUEMINAV.PA;;Euronext Paris;USD;AUEM;AUEM FPIAUEM;AUEM.PAIAUEM=BNPP;;London Stock Exchange;GBX;AUEG;AUEG LNIAUEM;AUEG.LIAUEMINAV.PA;;London Stock Exchange;USD;AUEM;AUEM LNIAUEM;AUEM.LIAUEM=BNPP;;SIX Swiss Exchange;USD;AUEM;AUEM SWIAUEM;AUEM.SIAUEM=BNPP;;;;;;;;;;;;;;;;;;;;4.0;73.0;17.0;13.0;13.0;10.0;20.0
LU1681045537;Amundi MSCI World ex Europe UCITS ETF EUR (C);https://www.justetf.com/en/etf-profile.html?isin=LU1681045537;The Amundi MSCI World ex Europe UCITS ETF EUR (C) seeks to track the MSCI World ex Europe index. The MSCI World ex Europe index tracks stocks from 8 developed countries worldwide, excluding Europe. The ETF's TER (total expense ratio) amounts to 0.35% p.a.. The Amundi MSCI World ex Europe UCITS ETF EUR (C) is the only ETF that tracks the MSCI World ex Europe index. The ETF replicates the performance of the underlying index synthetically with a swap. The dividends in the ETF are accumulated and reinvested in the ETF. The Amundi MSCI World ex Europe UCITS ETF EUR (C) is a large ETF with 695m Euro assets under management. The ETF was launched on 16 June 2009 and is domiciled in Luxembourg.;Amundi MSCI World Ex Europe UCITS ETF EUR (C) se snaží sledovat index MSCI World Ex Europe. Index MSCI World Ex Evropy sleduje akcie z 8 rozvinutých zemí po celém světě, s výjimkou Evropy. TER (celkový poměr nákladů) ETF činí 0,35% P.A. Amundi MSCI World Ex Europe UCITS ETF EUR (C) je jediný ETF, který sleduje index MSCI World Ex Europe. ETF replikuje výkon podkladového indexu synteticky s výměnou. dividenday v ETF jsou akumulovány a reinvestovány do ETF. Amundi MSCI World Ex Europe UCITS ETF EUR (C) je velký ETF s managementem 695 milionů euro. ETF byl spuštěn 16. června 2009 a má bydliště v Lucemburku.;0.35%;0.35;EUR 695m;695.0;EUR;EUR;Luxembourg;Amundi ETF;16 June 2009;Accumulating;;Synthetic (Unfunded swap);UCITS;MSCI World;Equity, World;;EUR    Currency risk  Currency;1;Akcie;False;Celosvětově;;11.77;47.37;100.5;1.21;3.02;8.56;9.16;32.2;-13.67;20.22;30.17;712.6;18.08;15.44;15.73;0.65;0.89;0.95;-21.81;-21.81;-21.81;-33.49;;;;;Euronext Paris;CE8;5;;;;;;;2025-09-22T01:11:47.408207;success;0;;;;;;;;;;;;;;;;;;;;;;;;;;;;;;;;;;;;;;;;;gettex;EUR;CE8G;;;;Stuttgart Stock Exchange;EUR;CE8G;;;;Euronext Paris;EUR;CE8;CE8 FPINCE8;CE8.PAINCE8=BNPP;;SIX Swiss Exchange;EUR;CE8E;CE8E SWINCE8;CE8E.SINCE8=BNPP;;XETRA;EUR;CE8G;CE8G GYINCE8;CE8G.DEINCE8=BNPP;;;;;;;;;;;;;;;;;;;;;;;;;;;;;;;;4.0;67.0;12.0;10.0;15.0;10.0;20.0
LU1681046006;Amundi Global Bioenergy UCITS ETF EUR Acc;https://www.justetf.com/en/etf-profile.html?isin=LU1681046006;The Amundi Global Bioenergy UCITS ETF EUR Acc seeks to track the Bloomberg BioEnergy Screened index. The Bloomberg BioEnergy Screened index tracks companies worldwide that are engaged in the production, storage and distribution of ethanol, biodiesel and renewable fuels. The stocks included are filtered according to ESG criteria (environmental, social and corporate governance). The ETF's TER (total expense ratio) amounts to 0.35% p.a.. The Amundi Global Bioenergy UCITS ETF EUR Acc is the cheapest and largest ETF that tracks the Bloomberg BioEnergy Screened index. The ETF replicates the performance of the underlying index by full replication (buying all the index constituents). The dividends in the ETF are accumulated and reinvested in the ETF. The Amundi Global Bioenergy UCITS ETF EUR Acc is a small ETF with 30m Euro assets under management. The ETF was launched on 22 September 2009 and is domiciled in Luxembourg.;Amundi Global Bioenergy UCITS ETF EUR ACC se snaží sledovat index bioenergie Bloomberg Bioenergy. Bloomberg Bioenergy Screened Index sleduje společnosti po celém světě, které se zabývají výrobou, skladováním a distribucí ethanolu, bionafty a obnovitelných paliv. Zahrnuté akcie jsou filtrovány podle kritérií ESG (environmentální, sociální a správa a společností). TER (celkový poměr nákladů) ETF činí 0,35% P.A. ETF replikuje výkon podkladového indexu plnou replikací (nákup všech složek indexu). dividenday v ETF jsou akumulovány a reinvestovány do ETF. Amundi Global Bioenergy UCITS ETF EUR ACC je malý ETF s managementem 30 milionů EUR. ETF byl spuštěn 22. září 2009 a má bydliště v Lucemburku.;0.35%;0.35;EUR 30m;30.0;EUR;EUR;Luxembourg;Amundi ETF;22 September 2009;Accumulating;;Physical;UCITS;;Equity, World, Social/Environmental;Yes;EUR    Currency risk  Currency;1;Akcie;False;Celosvětově;24.0;-3.83;-9.33;128.56;5.25;2.36;4.32;9.35;49.87;55.09;-2.81;-14.72;88.95;15.65;17.49;22.67;-0.24;-0.18;0.79;-25.32;-38.23;-38.23;-63.18;;;;;Extracted (method 1);WDNR;0;;;;;;;2025-09-22T01:11:53.040685;success;0;HF Sinclair;10.16;Eni SpA;9.3;Valero Energy;8.9;Veolia Environnement SA;8.24;Darling Ingredients;8.1;Novonesis (Novozymes A/S);8.02;UPM-Kymmene Oyj;7.91;E.ON SE;4.29;Waste Management;3.99;;;United States;37.85;Other;26.07;France;8.24;;;;;Materials;19.39;Consumer Staples;14.94;Utilities;12.53;Industrials;9.14;Energy;8.9;;;;;;;;;;;;;;;;;;;;;;;;;;;;;;;;;;;;;;;;;;;;;;;;;;;;;;;;;;;;;2.0;46.0;12.0;1.0;15.0;10.0;8.0
