IE00BDD48R20;Vanguard USD Corporate 1-3 Bond UCITS ETF Distributing;https://www.justetf.com/en/etf-profile.html?isin=IE00BDD48R20;The Vanguard USD Corporate 1-3 Bond UCITS ETF Distributing seeks to track the Bloomberg Global Aggregate Corporate USD 1-3 index. The Bloomberg Global Aggregate Corporate USD 1-3 index tracks US dollar denominated bonds issued in emerging and developed markets worldwide. Maturity: 1-3 Years. Rating: Investment Grade. The ETF's TER (total expense ratio) amounts to 0.09% p.a.. The Vanguard USD Corporate 1-3 Bond UCITS ETF Distributing is the cheapest ETF that tracks the Bloomberg Global Aggregate Corporate USD 1-3 index. The ETF replicates the performance of the underlying index by sampling technique (buying a selection of the most relevant index constituents). The interest income (coupons) in the ETF is distributed to the investors (Monthly). The Vanguard USD Corporate 1-3 Bond UCITS ETF Distributing has 329m Euro assets under management. The ETF was launched on 22 May 2018 and is domiciled in Ireland. Show more Show less;Vanguard USD Corporate 1-3 Bond UCITS ETF distribuující se snaží sledovat index Bloomberg Global Corporate USD 1-3.Globální agregát Bloomberg Global Corporate USD 1-3 Index sleduje dluhopisy denominované dolar vydané na rozvíjejících se a rozvíjejících se trzích po celém světě.Zralost: 1-3 roky.Hodnocení: Investiční třída.TER (celkový poměr nákladů) činí 0,09% P.A. Vanguard USD Corporate 1-3 Bond UCITS ETF distribuující je nejlevnější ETF, který sleduje globální agregovaný index USD Bloomberg Global agregát 1-3.ETF replikuje výkon základního indexu technikou vzorkování (nákup výběru nejdůležitějších složek indexu).Úrokové výnosy (kupóny) v ETF jsou distribuovány investorům (měsíčně).Společnost Vanguard USD Corporate 1-3 Bond UCITS ETF Distribution má 329 milionů euro aktiv.ETF byl spuštěn 22. května 2018 a je se sídlem v Irsku.Ukázat více show méně;0.09%;0.09;EUR 329m;329.0;EUR;USD;Ireland;Vanguard;22 May 2018;Distributing;Monthly;Physical;;;;;Dluhopisy;US;1813.0;-1.06;-0.67;13.66;-7.59;8.36;8.07;7.65;;;;-10.93;;;;;;;;Extracted (method 1);VUSC;8;4.91%;4.91;EUR 2.08;2.08;EUR;method2_regex;2025-09-16T22:16:20.478563;success;0;;;;;;;;;;;;;;;;;;;;;United States;54.19;Other;35.72;United Kingdom;3.92;Japan;3.33;Canada;2.84;;;;;;;;;;;London Stock Exchange;GBP;;;;;Frankfurt Stock Exchange;EUR;;;;;Stuttgart Stock Exchange;EUR;;;;;Six Swiss Exchange;CHF;;;;;XETRA;EUR;;;;
IE00BDD48S37;Vanguard EUR Corporate 1-3 Years Bond UCITS ETF EUR Distributing;https://www.justetf.com/en/etf-profile.html?isin=IE00BDD48S37;The Vanguard EUR Corporate 1-3 Years Bond UCITS ETF EUR Distributing seeks to track the Bloomberg Euro Corporate 500 1-3Y index. The Bloomberg Euro Corporate 500 1-3Y index tracks Euro denominated corporate bonds. Rating: Investment grade. Time to maturity: 1-3 years. The ETF's TER (total expense ratio) amounts to 0.09% p.a.. The Vanguard EUR Corporate 1-3 Years Bond UCITS ETF EUR Distributing is the cheapest ETF that tracks the Bloomberg Euro Corporate 500 1-3Y index. The ETF replicates the performance of the underlying index by sampling technique (buying a selection of the most relevant index constituents). The interest income (coupons) in the ETF is distributed to the investors (Monthly). The Vanguard EUR Corporate 1-3 Years Bond UCITS ETF EUR Distributing is a small ETF with 25m Euro assets under management. The ETF was launched on 11 March 2025 and is domiciled in Ireland. Show more Show less;Vanguard EUR Corporate 1-3 roky Bond UCITS ETF EUR distribuující se snaží sledovat index Bloomberg Euro Corporate 500 1-3Y.Bloomberg Euro Corporate 500 1-3Y Index skladby euro denominované firemní dluhopisy.Hodnocení: Investiční třída.Čas do zralosti: 1-3 roky.TER (celkový poměr nákladů) činí 0,09% P.A .. Vanguard Eur Corporate 1-3 roky Bond UCITS ETF EUR distribuující je nejlevnější ETF, který sleduje index Bloomberg Euro Corporate 500 1-3Y.ETF replikuje výkon základního indexu technikou vzorkování (nákup výběru nejdůležitějších složek indexu).Úrokové výnosy (kupóny) v ETF jsou distribuovány investorům (měsíčně).Společnost Vanguard EUR Corporate 1-3 roky Bond UCITS ETF EUR distribuující je malý ETF s managementem 25 milionů EUR.ETF byl spuštěn 11. března 2025 a je sídlem v Irsku.Ukázat více show méně;0.09%;0.09;EUR 25m;25.0;EUR;EUR;Ireland;Vanguard;11 March 2025;Distributing;Monthly;Physical;;;;;Dluhopisy;Globální;493.0;;;;;;;;;;;;;;;;;;;Extracted (method 1);VGCE;5;;;;;;;2025-09-16T22:16:29.988286;success;0;;;;;;;;;;;;;;;;;;;;;Other;100.0;;;;;;;;;;;;;;;;;;;Euronext Amsterdam;EUR;;;;;XETRA;EUR;;;;;Borsa Italiana;EUR;;;;;gettex;EUR;;;;;NASDAQ;EUR;;;;
IE00BDDRDW15;iShares J.P. Morgan Advanced USD EM Bond UCITS ETF USD (Dist);https://www.justetf.com/en/etf-profile.html?isin=IE00BDDRDW15;The iShares J.P. Morgan Advanced USD EM Bond UCITS ETF USD (Dist) seeks to track the JP Morgan ESG EMBI Global Diversified index. The JP Morgan ESG EMBI Global Diversified index tracks US-Dollar denominated emerging market government bonds. Bonds can have any rating and any maturity. Within the index, bonds are weighted according to the social and environmental sustainability of their issuers. The ETF's TER (total expense ratio) amounts to 0.45% p.a.. The ETF replicates the performance of the underlying index by sampling technique (buying a selection of the most relevant index constituents). The interest income (coupons) in the ETF is distributed to the investors (Semi annually). The iShares J.P. Morgan Advanced USD EM Bond UCITS ETF USD (Dist) has 443m Euro assets under management. The ETF was launched on 24 September 2018 and is domiciled in Ireland. Show more Show less;Ishares J.P. Morgan Advanced USD EM Bond UCITS ETF USD (Dist) se snaží sledovat globální diverzifikovaný index JP Morgan ESG EMBI.Globální diverzifikovaný index JP Morgan ESG EMBI sleduje americké denominované dluhopisy vlády na trhu.Dluhopisy mohou mít jakékoli hodnocení a jakoukoli zralost.V rámci indexu jsou dluhopisy váženy podle sociální a environmentální udržitelnosti jejich emitentů.TER (celkový poměr nákladů) ETF činí 0,45% p.a. ETF replikuje výkon základního indexu technikou vzorkování (nákup výběru nejdůležitějších složek indexu).Úrokové výnosy (kupóny) v ETF jsou distribuovány investorům (semifinále každoročně).Ishares J.P. Morgan Advanced USD EM Bond UCITS ETF USD (Dist) má spravování 443 milionů euro.ETF byl spuštěn 24. září 2018 a je se sídlem v Irsku.Ukázat více show méně;0.45%;0.45;EUR 443m;443.0;EUR;USD;Ireland;iShares;24 September 2018;Distributing;Semi annually;Physical;;;;Yes;Dluhopisy;US;826.0;1.99;10.57;5.17;-2.55;9.02;8.83;8.6;0.22;;;-11.86;;;;;;;;Extracted (method 1);36B1;5;5.72%;5.72;EUR 0.22;0.22;EUR;method2_regex;2025-09-16T22:16:37.450090;success;0;;;;;;;;;;;;;;;;;;;;;Other;84.05;;;;;;;;;;;;;;;;;;;London Stock Exchange;GBP;;;;;Stuttgart Stock Exchange;EUR;;;;;XETRA;EUR;;;;;gettex;EUR;;;;;NASDAQ;EUR;;;;
IE00BDDRDY39;JPMorgan USD Emerging Markets Sovereign Bond UCITS ETF - EUR Hedged (acc);https://www.justetf.com/en/etf-profile.html?isin=IE00BDDRDY39;The JPMorgan USD Emerging Markets Sovereign Bond UCITS ETF - EUR Hedged (acc) seeks to track the JP Morgan Emerging Markets Risk-Aware Bond (EUR Hedged) index. The JP Morgan Emerging Markets Risk-Aware Bond (EUR Hedged) index tracks US Dollar denominated government or quasi-government bonds from emerging markets. Constituents can have any rating or no rating at all. All maturities are included. Currency hedged to Euro (EUR). The ETF's TER (total expense ratio) amounts to 0.39% p.a.. The JPMorgan USD Emerging Markets Sovereign Bond UCITS ETF - EUR Hedged (acc) is the only ETF that tracks the JP Morgan Emerging Markets Risk-Aware Bond (EUR Hedged) index. The ETF replicates the performance of the underlying index by sampling technique (buying a selection of the most relevant index constituents). The interest income (coupons) in the ETF is accumulated and reinvested in the ETF. The JPMorgan USD Emerging Markets Sovereign Bond UCITS ETF - EUR Hedged (acc) has 154m Euro assets under management. The ETF was launched on 10 October 2018 and is domiciled in Ireland. Show more Show less;JPMorgan USD Emerging Markets Sovereign Bond UCITS ETF - Eur Hedged (ACC) se snaží sledovat index rozvíjejících se trhů JP Morgan (EUR Hedged).Index indexu JP Morgan Emerging Markets Bond (EUR Hedged) sleduje americký dolar denominovaný vládu nebo kvazi-vládní dluhopisy z rozvíjejících se trhů.Složky mohou mít jakékoli hodnocení nebo žádné hodnocení.Zahrnuty jsou všechna splatností.Měna zajišťovala euro (EUR).TER (celkový poměr výdajů) ETF činí 0,39% P.A .. NA JPMorgan USD Emerging Bond Bond UCITS ETF - EUR Hedged (ACC) je jediný ETF, který sleduje JP Morgan rozvíjející se trhy s rizikovým indexem).ETF replikuje výkon základního indexu technikou vzorkování (nákup výběru nejdůležitějších složek indexu).Úrokové výnosy (kupóny) v ETF se nashromáždí a reinvestují do ETF.Emerging trhy JPMorgan USD Sovereign Bond UCITS ETF - EUR Hedged (ACC) má ve správě aktiv 154 milionů EUR.ETF byl spuštěn 10. října 2018 a má bydliště v Irsku.Ukázat více show méně;0.39%;0.39;EUR 154m;154.0;EUR;EUR;Ireland;JPMorgan;10 October 2018;Accumulating;;Physical;;;;Yes;Dluhopisy;US;348.0;5.64;18.58;-2.29;10.09;7.63;9.28;9.43;0.74;;;-5.92;;;;;;;;Extracted (method 1);JMBE;7;;;;;;;2025-09-16T22:16:45.247059;success;0;;;;;;;;;;;;;;;;;;;;;Other;74.76;;;;;;;;;;;;;;;;;;;Frankfurt Stock Exchange;EUR;;;;;Stuttgart Stock Exchange;EUR;;;;;Six Swiss Exchange;CHF;;;;;XETRA;EUR;;;;;Borsa Italiana;EUR;;;;
IE00BDDRF478;iShares S&P 500 Communication Sector UCITS ETF USD (Acc);https://www.justetf.com/en/etf-profile.html?isin=IE00BDDRF478;The iShares S&P 500 Communication Sector UCITS ETF USD (Acc) seeks to track the S&P 500 Capped 35/20 Communication Services index. The S&P 500 Capped 35/20 Communication Services index tracks the US communications services industry. This sector includes classic telecommunication companies such as AT&T, but also companies formerly associated with the IT sector, such as Facebook. Also included are media companies such as Walt Disney or Netflix. The ETF's TER (total expense ratio) amounts to 0.15% p.a.. The iShares S&P 500 Communication Sector UCITS ETF USD (Acc) is the only ETF that tracks the S&P 500 Capped 35/20 Communication Services index. The ETF replicates the performance of the underlying index by full replication (buying all the index constituents). The dividends in the ETF are accumulated and reinvested in the ETF. The iShares S&P 500 Communication Sector UCITS ETF USD (Acc) is a large ETF with 702m Euro assets under management. The ETF was launched on 17 September 2018 and is domiciled in Ireland. Show more Show less;Komunikační sektor IShares S&P 500 UCITS ETF USD (ACC) se snaží sledovat index komunikačních služeb S&P 500 S&P 500.Index komunikačních služeb S&P 500 spravoval odvětví amerických komunikačních služeb.Tento sektor zahrnuje klasické telekomunikační společnosti, jako je AT&T, ale také společnosti dříve spojené s IT sektorem, jako je Facebook.Zahrnuty jsou také mediální společnosti jako Walt Disney nebo Netflix.TER (celkový poměr nákladů) činí 0,15% P.A .. Komunikační sektor ISSAres S&P 500 UCITS ETF USD (ACC) je jediným ETF, který sleduje index komunikačních služeb S&P 500.ETF replikuje výkon podkladového indexu plnou replikací (nákup všech složek indexu).dividenday v ETF jsou akumulovány a reinvestovány do ETF.Komunikační sektor IShares S&P 500 UCITS ETF USD (ACC) je velký ETF s managementem 702 milionů euro.ETF byl spuštěn 17. září 2018 a je se sídlem v Irsku.Ukázat více show méně;0.15%;0.15;EUR 702m;702.0;EUR;USD;Ireland;iShares;17 September 2018;Accumulating;;Physical;;S&P 500;Equity, United States, Telecommunication;;Akcie;US;25.0;34.89;107.52;117.4;11.04;20.94;21.5;22.23;1.67;;;-23.26;;;;;;;;Extracted (method 1);IU5C;6;;;;;;;2025-09-16T22:16:52.932271;success;0;;;;;;;;;;;;;;;;;;;;;United States;99.17;Other;0.83;;;;;;;Technology;1.17;;;;;;;;;London Stock Exchange;GBP;;;;;Stuttgart Stock Exchange;EUR;;;;;Six Swiss Exchange;CHF;;;;;XETRA;EUR;;;;;gettex;EUR;;;;
IE00BDDRF700;HANetf HAN-GINS Tech Megatrend Equal Weight UCITS ETF;https://www.justetf.com/en/etf-profile.html?isin=IE00BDDRF700;The HANetf HAN-GINS Tech Megatrend Equal Weight UCITS ETF seeks to track the Solactive Innovative Technologies index. The Solactive Innovative Technologies index tracks leading IT companies in sectors including Robotics & Automation, Cloud Computing & Big Data, Cyber Security, Future Cars, Genomics, Social Media, Blockchain and Augmented & Virtual Reality. The ETF's TER (total expense ratio) amounts to 0.59% p.a.. The HANetf HAN-GINS Tech Megatrend Equal Weight UCITS ETF is the only ETF that tracks the Solactive Innovative Technologies index. The ETF replicates the performance of the underlying index by full replication (buying all the index constituents). The dividends in the ETF are accumulated and reinvested in the ETF. The HANetf HAN-GINS Tech Megatrend Equal Weight UCITS ETF is a small ETF with 88m Euro assets under management. The ETF was launched on 5 October 2018 and is domiciled in Ireland. Show more Show less;Hannetf Han-Gins Tech Megatrend stejná hmotnost UCITS ETF se snaží sledovat index solaraktivních inovativních technologií.Index indexu solaraktivních inovativních technologií sleduje vedení IT společností v odvětvích, včetně robotiky a automatizace, cloud computingu a velkých dat, kybernetického zabezpečení, budoucích automobilů, genomiky, sociálních médií, blockchainu a rozšířené a virtuální reality.TER (celkový poměr nákladů) ETF činí 0,59% P.A .. HANTETF Han-Gins Tech Megatrend stejná hmotnost UCITS ETF je jediný ETF, který sleduje index solaraktivních inovativních technologií.ETF replikuje výkon podkladového indexu plnou replikací (nákup všech složek indexu).dividenday v ETF jsou akumulovány a reinvestovány do ETF.Hannetf Han-Gins Tech Megatrend Equal Weight UCITS ETF je malá ETF s managementem 88 milionů euro.ETF byl spuštěn 5. října 2018 a je se sídlem v Irsku.Ukázat více show méně;0.59%;0.59;EUR 88m;88.0;EUR;USD;Ireland;;5 October 2018;;;Physical;;;Equity, World, Technology;;Ostatní;Ostatní;120.0;31.3;53.47;58.24;9.54;30.73;25.85;26.14;1.02;;;-33.38;;;;;;;;Extracted (method 1);T3KE;8;;;;;;;2025-09-16T22:17:00.881369;success;0;;;;;;;;;;;;;;;;;;;;;United States;48.87;Other;28.4;China;11.73;Japan;8.0;Australia;3.0;Technology;39.15;Health Care;9.52;Consumer Discretionary;8.9;;;;;London Stock Exchange;GBP;;;;;Frankfurt Stock Exchange;EUR;;;;;Six Swiss Exchange;CHF;;;;;XETRA;EUR;;;;;Borsa Italiana;EUR;;;;
IE00BDF12W49;WisdomTree Emerging Markets Equity Income UCITS ETF Acc;https://www.justetf.com/en/etf-profile.html?isin=IE00BDF12W49;The WisdomTree Emerging Markets Equity Income UCITS ETF Acc seeks to track the WisdomTree Emerging Markets Equity Income index. The WisdomTree Emerging Markets Equity Income index tracks Emerging Markets stocks with high dividend yields. The stocks included are filtered according to ESG criteria (environmental, social and corporate governance). The index is weighted by fundamental criteria. The ETF's TER (total expense ratio) amounts to 0.46% p.a.. The WisdomTree Emerging Markets Equity Income UCITS ETF Acc is the cheapest ETF that tracks the WisdomTree Emerging Markets Equity Income index. The ETF replicates the performance of the underlying index by sampling technique (buying a selection of the most relevant index constituents). The dividends in the ETF are accumulated and reinvested in the ETF. The WisdomTree Emerging Markets Equity Income UCITS ETF Acc is a small ETF with 26m Euro assets under management. The ETF was launched on 2 November 2016 and is domiciled in Ireland. Show more Show less;WisdomTree Emerging Markets Equity Income UCITS ETF ACC se snaží sledovat index příjmů z příjmů z WisdomTree.Wisdomtree Emerging Markets Markets Equity Income Index skladby na trhu s vysokými dividendaovými výnosy.Zahrnuté akcie jsou filtrovány podle kritérií ESG (environmentální, sociální a správa a společností).Index je vážen podle základních kritérií.TER (celkový poměr výdajů) ETF činí 0,46% p.a. ETF replikuje výkon základního indexu technikou vzorkování (nákup výběru nejdůležitějších složek indexu).dividenday v ETF jsou akumulovány a reinvestovány do ETF.WisdomTree Emerging Markets Equity Income UCITS ETF ACC je malý ETF s managementem 26 milionů euro.ETF byla spuštěna 2. listopadu 2016 a je bydliště v Irsku.Ukázat více show méně;0.46%;0.46;EUR 26m;26.0;EUR;USD;Ireland;WisdomTree;2 November 2016;Accumulating;;Physical;;;Equity, Emerging Markets, Dividend;Yes;Akcie;Rozvíjející se země;489.0;10.87;33.28;70.49;5.55;12.42;12.34;12.36;0.87;;;-15.7;;;;;;;;Extracted (method 1);WTD8;6;;;;;;;2025-09-16T22:17:10.241200;success;0;;;;;;;;;;;;;;;;;;;;;Other;34.75;China;26.43;;;;;;;Financials;27.47;Technology;13.32;Industrials;10.02;Consumer Discretionary;8.61;;;London Stock Exchange;GBP;;;;;Six Swiss Exchange;CHF;;;;;XETRA;EUR;;;;;Borsa Italiana;EUR;;;;;gettex;EUR;;;;
IE00BDF16007;WisdomTree Europe Equity Income UCITS ETF Acc;https://www.justetf.com/en/etf-profile.html?isin=IE00BDF16007;The WisdomTree Europe Equity Income UCITS ETF Acc seeks to track the WisdomTree Europe Equity Income index. The WisdomTree Europe Equity Income index tracks European stocks with high dividend yields. The stocks included are filtered according to ESG criteria (environmental, social and corporate governance). The Index is a fundamentally weighted index. The ETF's TER (total expense ratio) amounts to 0.29% p.a.. The WisdomTree Europe Equity Income UCITS ETF Acc is the only ETF that tracks the WisdomTree Europe Equity Income index. The ETF replicates the performance of the underlying index by full replication (buying all the index constituents). The dividends in the ETF are accumulated and reinvested in the ETF. The WisdomTree Europe Equity Income UCITS ETF Acc is a very small ETF with 7m Euro assets under management. The ETF was launched on 3 November 2016 and is domiciled in Ireland. Show more Show less;WisdomTree Europe Equity Income UCITS ETF ACC se snaží sledovat index příjmů společnosti WisdomTree Europe Europe.Index příjmů společnosti WisdomTree Europe Evropy sleduje evropské akcie s vysokými výnosy z dividenda.Zahrnuté akcie jsou filtrovány podle kritérií ESG (environmentální, sociální a správa a společností).Index je zásadně vážený index.TER (celkový poměr výdajů) ETF činí 0,29% P.A .. WISDOMODTREE EUROPE EURICKÝCH PŘIPRAVENÍ UCITS ETF ACC je jediným ETF, který sleduje index příjmů z příjmů WisdomTree Europe.ETF replikuje výkon podkladového indexu plnou replikací (nákup všech složek indexu).dividenday v ETF jsou akumulovány a reinvestovány do ETF.WisdomTree Europe Equity Income UCITS ETF ACC je velmi malý ETF s managementem 7m euro.ETF byla spuštěna 3. listopadu 2016 a je bydliště v Irsku.Ukázat více show méně;0.29%;0.29;EUR 7m;7.0;EUR;EUR;Ireland;WisdomTree;3 November 2016;Accumulating;;Physical;;;Equity, Europe, Dividend;Yes;Akcie;Evropa;244.0;18.93;48.84;80.83;20.85;12.81;12.4;13.54;1.48;;;-14.05;;;;;;;;Extracted (method 1);EEIP;5;;;;;;;2025-09-16T22:17:16.476401;success;0;;;;;;;;;;;;;;;;;;;;;Other;40.56;United Kingdom;19.23;France;17.98;;;;;Financials;28.75;Utilities;15.66;Industrials;13.19;Energy;11.93;;;London Stock Exchange;GBP;;;;;Six Swiss Exchange;CHF;;;;;Borsa Italiana;EUR;;;;;gettex;EUR;;;;;NASDAQ;EUR;;;;
IE00BDF16114;WisdomTree Europe SmallCap Dividend UCITS ETF Acc;https://www.justetf.com/en/etf-profile.html?isin=IE00BDF16114;The WisdomTree Europe SmallCap Dividend UCITS ETF Acc seeks to track the WisdomTree Europe SmallCap Dividend index. The WisdomTree Europe SmallCap Dividend index tracks European small cap stocks with high dividend yields. The stocks included are filtered according to ESG criteria (environmental, social and corporate governance). The Index is a fundamentally weighted index. The ETF's TER (total expense ratio) amounts to 0.38% p.a.. The WisdomTree Europe SmallCap Dividend UCITS ETF Acc is the cheapest ETF that tracks the WisdomTree Europe SmallCap Dividend index. The ETF replicates the performance of the underlying index by full replication (buying all the index constituents). The dividends in the ETF are accumulated and reinvested in the ETF. The WisdomTree Europe SmallCap Dividend UCITS ETF Acc is a small ETF with 35m Euro assets under management. The ETF was launched on 3 November 2016 and is domiciled in Ireland. Show more Show less;WisdomTree Europe SmallCap dividenda UCITS ETF ACC se snaží sledovat index dividenda WisdomTree Europe Smallcap.Index dividenda Wisdomtree Europe Smallcap sleduje evropské akcie s malými čepičkami s vysokými výnosy dividenda.Zahrnuté akcie jsou filtrovány podle kritérií ESG (environmentální, sociální a správa a společností).Index je zásadně vážený index.TER (celkový poměr nákladů) ETF činí 0,38% p.a. ETF replikuje výkon podkladového indexu plnou replikací (nákup všech složek indexu).dividenday v ETF jsou akumulovány a reinvestovány do ETF.WisdomTree Europe SmallCap dividenda UCITS ETF ACC je malý ETF s managementem 35 milionů euro.ETF byla spuštěna 3. listopadu 2016 a je bydliště v Irsku.Ukázat více show méně;0.38%;0.38;EUR 35m;35.0;EUR;EUR;Ireland;WisdomTree;3 November 2016;Accumulating;;Physical;;;Equity, Europe, Small Cap;Yes;Akcie;Evropa;378.0;12.61;35.56;68.5;13.8;14.14;14.47;15.55;0.89;;;-13.7;;;;;;1.17;;Extracted (method 1);WTD7;6;;;;;;;2025-09-16T22:17:22.001330;success;0;;;;;;;;;;;;;;;;;;;;;Other;46.15;United Kingdom;27.51;;;;;;;Industrials;24.52;Consumer Discretionary;15.76;Financials;11.89;Materials;7.19;Real Estate;1.17;London Stock Exchange;GBP;;;;;Six Swiss Exchange;CHF;;;;;XETRA;EUR;;;;;Borsa Italiana;EUR;;;;;gettex;EUR;;;;
IE00BDFBTQ78;VanEck S&P Global Mining UCITS ETF A;https://www.justetf.com/en/etf-profile.html?isin=IE00BDFBTQ78;The VanEck S&P Global Mining UCITS ETF A seeks to track the S&P Global Mining Reduced Coal index. The S&P Global Mining Reduced Coal index tracks global companies primarily involved in the metal and mineral extraction industries. The index is market capitalisation weighted, free float adjusted and covers both Emerging and Developed Markets. The ETF's TER (total expense ratio) amounts to 0.50% p.a.. The VanEck S&P Global Mining UCITS ETF A is the only ETF that tracks the S&P Global Mining Reduced Coal index. The ETF replicates the performance of the underlying index by full replication (buying all the index constituents). The dividends in the ETF are accumulated and reinvested in the ETF. The VanEck S&P Global Mining UCITS ETF A is a large ETF with 697m Euro assets under management. The ETF was launched on 18 April 2018 and is domiciled in Ireland. Show more Show less;The Vaneck S&P Global Mining UCITS ETF A usiluje o sledování indexu Global těžby S&P Global Reduction Index uhlí.Globální těžba S&P Reduction Reduction Index uhlí sleduje globální společnosti primárně zapojené do průmyslového odvětví extrakce kovů a minerálů.Indexem je vážená tržní kapitalizace, upravena volný plovák a pokrývá rozvíjející se i rozvinuté trhy.TER (celkový poměr výdajů) ETF činí 0,50% P.A.ETF replikuje výkon podkladového indexu plnou replikací (nákup všech složek indexu).dividenday v ETF jsou akumulovány a reinvestovány do ETF.The Vaneck S&P Global Mining UCITS ETF A je velký ETF s managementem s řízením 697 m euro.ETF byl spuštěn 18. dubna 2018 a je se sídlem v Irsku.Ukázat více show méně;0.50%;0.5;EUR 697m;697.0;EUR;USD;Ireland;VanEck;18 April 2018;;;Physical;;;Equity, World, Basic Materials;;Akcie;Globální;125.0;32.02;44.99;83.36;35.62;32.36;25.34;24.69;0.99;;;-20.45;;;;;;;;Extracted (method 1);WMIN;9;;;;;;;2025-09-16T22:17:27.410455;success;0;Meta;0.5;;;;;;;;;;;;;;;;;;;Other;31.52;Canada;26.82;Australia;18.81;United States;16.03;United Kingdom;6.82;Energy;4.57;;;;;;;;;London Stock Exchange;GBP;;;;;Stuttgart Stock Exchange;EUR;;;;;Six Swiss Exchange;CHF;;;;;XETRA;EUR;;;;;Borsa Italiana;EUR;;;;
