IE00B3VWN393;iShares USD Treasury Bond 3-7yr UCITS ETF (Acc);https://www.justetf.com/en/etf-profile.html?isin=IE00B3VWN393;The iShares USD Treasury Bond 3-7yr UCITS ETF (Acc) seeks to track the ICE US Treasury 3-7 Year index. The ICE US Treasury 3-7 Year index tracks US Dollar denominated government bonds issued by the US Treasury. Time to maturity: 3-7 years. The ETF's TER (total expense ratio) amounts to 0.07% p.a.. The iShares USD Treasury Bond 3-7yr UCITS ETF (Acc) is the cheapest and largest ETF that tracks the ICE US Treasury 3-7 Year index. The ETF replicates the performance of the underlying index by sampling technique (buying a selection of the most relevant index constituents). The interest income (coupons) in the ETF is accumulated and reinvested in the ETF. The iShares USD Treasury Bond 3-7yr UCITS ETF (Acc) is a very large ETF with 5,798m Euro assets under management. The ETF was launched on 3 June 2009 and is domiciled in Ireland.;Treasury Bond Ishares USD 3-7yr UCITS ETF (ACC) se snaží sledovat index 3-7 let ICE USA. Index Treasury ICE US Treasury 3-7 let sleduje vládní dluhopisy vydané americkým ministerstvem americké pokladny. Čas do zralosti: 3-7 let. TER (celkový poměr nákladů) činí 0,07% P.A .. ISShares USD Treasury Bond 3-7yr UCITS ETF (ACC) je nejlevnější a největší ETF, který sleduje index 3-7 let ICE USA. ETF replikuje výkon základního indexu technikou vzorkování (nákup výběru nejdůležitějších složek indexu). Úrokové výnosy (kupóny) v ETF se nashromáždí a reinvestují do ETF. IShares USD Treasury Bond 3-7yr UCITS ETF (ACC) je velmi velký ETF s managementem 5 798 mil. EUR. ETF byl spuštěn 3. června 2009 a je bytí v Irsku.;0.07%;0.07;EUR 5798m;5798.0;EUR;USD;Ireland;iShares;3 June 2009;Accumulating;;Physical;;;;;Dluhopisy;False;Globální;90.0;-2.51;-4.94;0.6;-6.27;8.61;9.16;8.78;-0.29;-0.18;0.01;-10.1;-12.9;-12.9;-17.3;;;;;Bolsa Mexicana de Valores;-;10;;;;;;;2025-09-18T16:51:59.730933;success;0;;;;;;;;;;;;;;;;;;;;;United States;63.09;Other;36.91;;;;;;;;;;;;;;;;;London Stock Exchange;GBX;CU71;;;;gettex;EUR;SXRL;;;;Bolsa Mexicana de Valores;MXN;-;CBU7N MM;CBU7N.MX;;Borsa Italiana;EUR;CSBGU7;CSBGU7 IMIXM0131;CSBGU7.MIIXM0131.DE;;Euronext Amsterdam;EUR;CBU7;CBU7 NAIXM0131;CBU7.ASIXM0131.DE;;5.0;75.0;26.0;16.0;15.0;10.0;8.0
IE00BKX55S42;Vanguard FTSE Developed Europe ex UK UCITS ETF (EUR) Distributing;https://www.justetf.com/en/etf-profile.html?isin=IE00BKX55S42;The Vanguard FTSE Developed Europe ex UK UCITS ETF (EUR) Distributing seeks to track the FTSE Developed Europe ex UK index. The FTSE Developed Europe ex UK index tracks large and mid cap stocks from developed countries in Europe excluding the UK. The ETF's TER (total expense ratio) amounts to 0.10% p.a.. The Vanguard FTSE Developed Europe ex UK UCITS ETF (EUR) Distributing is the cheapest and largest ETF that tracks the FTSE Developed Europe ex UK index. The ETF replicates the performance of the underlying index by full replication (buying all the index constituents). The dividends in the ETF are distributed to the investors (Quarterly). The Vanguard FTSE Developed Europe ex UK UCITS ETF (EUR) Distributing is a very large ETF with 3,020m Euro assets under management. The ETF was launched on 30 September 2014 and is domiciled in Ireland.;Vanguard FTSE vyvinula distribuci Europe UK UCITS ETF (EUR), aby sledovala FTSE vyvinutý evropský index UK. FTSE vyvinula Europe Ex Index Index skladby velké a střední kapitálové akciíy z rozvinutých zemí v Evropě s výjimkou Velké Británie. TER (celkový poměr nákladů) činí 0,10% P.A .. Distribuce Vanguard FTSE vyvinula Europe Uk UCITS ETF (EUR) nejlevnější a největší ETF, která sleduje FTSE vyvinul Europe Ex Index. ETF replikuje výkon podkladového indexu plnou replikací (nákup všech složek indexu). dividenday v ETF jsou distribuovány investorům (čtvrtletně). Vanguard FTSE vyvinula distribuci Europe UK UCITS ETF (EUR) je velmi velký ETF s managementem 3 020 milionů euro. ETF byl spuštěn 30. září 2014 a je se sídlem v Irsku.;0.10%;0.1;EUR 3020m;3020.0;EUR;EUR;Ireland;Vanguard;30 September 2014;Distributing;Quarterly;Physical;;FTSE Developed Europe ex UK;Equity, Europe;;Akcie;False;Evropa;422.0;9.33;48.61;65.78;11.67;14.64;13.09;14.52;0.64;1.08;0.73;-16.09;-16.09;-22.96;-34.47;;;;;Bolsa Mexicana de Valores;-;8;2.63%;2.63;EUR 1.12;1.12;EUR;method2_regex;2025-09-18T16:52:07.382883;success;0;ASML Holding NV;2.82;Roche Holding AG;2.27;Nestlé SA;2.26;Novartis AG;2.21;Siemens AG;1.93;Novo Nordisk A/S;1.57;Allianz SE;1.57;Schneider Electric SE;1.45;LVMH Moët Hennessy Louis Vuitton SE;1.41;;;Other;35.53;Germany;19.1;France;18.42;Switzerland;17.28;Netherlands;9.67;Financials;22.67;Industrials;18.8;Health Care;9.67;Technology;9.25;;;Euronext Paris;EUR;VERX;;;;gettex;EUR;VERX;;;;Stuttgart Stock Exchange;EUR;VERX;;;;Bolsa Mexicana de Valores;EUR;-;VERXN MM;VERXN.MX;;Frankfurt Stock Exchange;EUR;-;IVERX;;;5.0;82.0;26.0;13.0;13.0;10.0;20.0
IE000XNILW20;WisdomTree Global Sustainable Equity UCITS ETF USD Unhedged Acc;https://www.justetf.com/en/etf-profile.html?isin=IE000XNILW20;The WisdomTree Global Sustainable Equity UCITS ETF USD Unhedged Acc seeks to track the Solactive WisdomTree Global Sustainable Equity UCITS index. The Solactive WisdomTree Global Sustainable Equity UCITS index tracks stocks from developed markets worldwide which have been screened for sustainable criteria. The securities included are weighted according to their exposure to one or more Sustainable Development Goals. The ETF's TER (total expense ratio) amounts to 0.29% p.a.. The WisdomTree Global Sustainable Equity UCITS ETF USD Unhedged Acc is the only ETF that tracks the Solactive WisdomTree Global Sustainable Equity UCITS index. The ETF replicates the performance of the underlying index by full replication (buying all the index constituents). The dividends in the ETF are accumulated and reinvested in the ETF. The WisdomTree Global Sustainable Equity UCITS ETF USD Unhedged Acc has 333m Euro assets under management. The ETF was launched on 5 June 2024 and is domiciled in Ireland.;WisdomTree Global Sustainable Equity UCITS ETF USD Undred ACC se snaží sledovat solaraktivní index UCITS Global WisdomTree Global Sustainable Equity UCITS. Indexová společnost Solactive WisdomTree Global Sustainable Equity UCITS sleduje akcie z rozvinutých trhů po celém světě, které byly prověřeny na udržitelná kritéria. Zahrnuté cenné papíry jsou váženy podle jejich vystavení jednomu nebo více cílům udržitelného rozvoje. TER (celkový poměr nákladů) ETF činí 0,29% P.A. ETF replikuje výkon podkladového indexu plnou replikací (nákup všech složek indexu). dividenday v ETF jsou akumulovány a reinvestovány do ETF. WisdomTree Global Sustainable Equity UCITS ETF USD Undred ACC má 333 milionů euro aktiv. ETF byl spuštěn 5. června 2024 a je bydliště v Irsku.;0.29%;0.29;EUR 333m;333.0;EUR;USD;Ireland;WisdomTree;5 June 2024;Accumulating;;Physical;;;;Yes;Akcie;False;Globální;118.0;1.58;;;-2.46;15.8;;;0.1;;;-21.57;;;-21.57;;;;;gettex;WSDG;5;;;;;;;2025-09-18T16:52:11.944393;success;0;Microsoft;4.81;Apple;4.2;Tesla;3.23;Cisco Systems, Inc.;2.44;Johnson & Johnson;2.43;Brookfield Corp.;2.33;IBM;2.27;Analog Devices;2.27;Schneider Electric SE;2.23;;;United States;64.12;Other;21.81;Japan;7.14;United Kingdom;3.71;Switzerland;3.22;Technology;34.06;Health Care;19.04;Industrials;16.93;Consumer Discretionary;7.57;;;gettex;EUR;WSDG;;;;Borsa Italiana;EUR;WSDG;WSDG IMWSDGINAV;WSDG.MIWSDGINAV=IHSM;;London Stock Exchange;GBX;WSEQ;WSEQ LN;WSEQ.L;;London Stock Exchange;USD;WSDG;WSDG LN;WSDG.L;;XETRA;EUR;WSDG;WSDG GYWSDGINAV;WSDG.DEWSDGINAV=IHSM;;;;;;;;
IE000ZX8CQG2;iShares EUR Corporate Bond ESG Paris-Aligned Climate UCITS ETF EUR (Dist);https://www.justetf.com/en/etf-profile.html?isin=IE000ZX8CQG2;The iShares EUR Corporate Bond ESG Paris-Aligned Climate UCITS ETF EUR (Dist) seeks to track the Bloomberg MSCI Euro Corporate Climate Paris Aligned ESG Select index. The Bloomberg MSCI Euro Corporate Climate Paris Aligned ESG Select index tracks Euro denominated corporate bonds. Securities are selected and weighted according to sustainability criteria and EU directives on climate protection. Minimum maturity: 1 year. Rating: Investment Grade. The ETF's TER (total expense ratio) amounts to 0.15% p.a.. The iShares EUR Corporate Bond ESG Paris-Aligned Climate UCITS ETF EUR (Dist) is the cheapest and largest ETF that tracks the Bloomberg MSCI Euro Corporate Climate Paris Aligned ESG Select index. The ETF replicates the performance of the underlying index by sampling technique (buying a selection of the most relevant index constituents). The interest income (coupons) in the ETF is distributed to the investors (Semi annually). The iShares EUR Corporate Bond ESG Paris-Aligned Climate UCITS ETF EUR (Dist) is a large ETF with 745m Euro assets under management. The ETF was launched on 9 June 2022 and is domiciled in Ireland.;Ishares EUR Corporate Bond ESG Pařížské klima UCITS ETF EUR (dist) se snaží sledovat index ESG Select Corporate Climate Paříž Bloomberg MSCI Euro. Bloomberg MSCI Euro Corporate Climate Paris Align ESG Select Index stopy euro denominované firemní dluhopisy. Cenné papíry jsou vybírány a váženy podle kritérií udržitelnosti a směrnic EU o ochraně klimatu. Minimální zralost: 1 rok. Hodnocení: Investiční třída. TER (celkový poměr nákladů) činí 0,15% P.A .. Ishares EUR EUR Corporate Bond ESG Pařížské klimatické uCITS ETF EUR (DIST) je nejlevnější a největší ETF, který sleduje Bloomberg MSCI Euro Euro Corporate Climate Paris Alignated ESG Select Index. ETF replikuje výkon základního indexu technikou vzorkování (nákup výběru nejdůležitějších složek indexu). Úrokové výnosy (kupóny) v ETF jsou distribuovány investorům (semifinále každoročně). Ishares EUR Corporate Bond ESG Pařížské klima UCITS ETF EUR (DIST) je velký ETF s managementem 745 milionů euro. ETF byl spuštěn 9. června 2022 a je sídlem v Irsku.;0.15%;0.15;EUR 745m;745.0;EUR;EUR;Ireland;iShares;9 June 2022;Distributing;Semi annually;Physical;;;;Yes;Dluhopisy;False;Globální;1870.0;4.21;14.37;;2.77;3.02;4.19;;1.4;1.09;;-1.76;-4.3;;-9.14;;;;;Extracted (method 1);CBUJ;0;3.52%;3.52;EUR 0.18;0.18;EUR;method2_regex;2025-09-18T16:52:17.738747;success;0;FR0013444551;0.22;XS2613209670;0.22;XS2621539910;0.21;XS2764455619;0.21;XS2459544339;0.2;XS2804565435;0.19;XS2626007939;0.19;;;;;;;Other;52.27;France;16.05;United States;13.92;Netherlands;10.15;Germany;7.61;IT;13.92;;;;;;;;;;;;;;;;;;;;;;;;;;;;;;;;;;;;;;;4.0;66.0;22.0;10.0;6.0;10.0;18.0
IE00BK63RN45;Invesco MSCI Kuwait UCITS ETF Acc;https://www.justetf.com/en/etf-profile.html?isin=IE00BK63RN45;The Invesco MSCI Kuwait UCITS ETF Acc seeks to track the MSCI Kuwait 20/35 index. The MSCI Kuwait 20/35 index tracks large and mid-cap companies of the Kuwait equity market. The weight of the largest group entity is constrained to 35% and the weights of all other entities are constrained to a maximum of 20%. The ETF's TER (total expense ratio) amounts to 0.50% p.a.. The ETF replicates the performance of the underlying index synthetically with a swap. The dividends in the ETF are accumulated and reinvested in the ETF. The Invesco MSCI Kuwait UCITS ETF Acc is a very small ETF with 6m Euro assets under management. The ETF was launched on 24 October 2019 and is domiciled in Ireland.;Invesco MSCI Kuwait UCITS ETF ACC se snaží sledovat index MSCI Kuwait 20/35. Index MSCI Kuwait 20/35 sleduje velké a střední společnosti na trhu s kapitálem Kuvajtu. Hmotnost největší skupinové entity je omezena na 35% a hmotnosti všech ostatních entit jsou omezeny na maximálně 20%. ETF TER (celkový poměr nákladů) činí 0,50% p.a. ETF replikuje výkon podkladového indexu synteticky s výměnou. dividenday v ETF jsou akumulovány a reinvestovány do ETF. Invesco MSCI Kuwait UCITS ETF ACC je velmi malý ETF s managementem 6m euro. ETF byla spuštěna 24. října 2019 a je bydliště v Irsku.;0.50%;0.5;EUR 6m;6.0;EUR;USD;Ireland;Invesco;24 October 2019;Accumulating;;Synthetic (Unfunded swap);;MSCI Kuwait  Acc;Equity, Kuwait;;Akcie;False;Ostatní;;17.89;0.61;71.25;10.05;13.33;13.24;13.47;1.34;0.02;0.84;-9.7;-25.01;-26.7;-37.77;;;;;London Stock Exchange;MKUW;1;;;;;;;2025-09-18T16:52:24.274235;success;0;;;;;;;;;;;;;;;;;;;;;;;;;;;;;;;;;;;;;;;;;London Stock Exchange;USD;MKUW;MKUW LNMKUWIN;MKUW.L3OBEINAV.DE;;;;;;;;;;;;;;;;;;;;;;;;;;2.0;48.0;12.0;1.0;8.0;10.0;17.0
IE0004J6PFL7;iShares Core UK Gilts UCITS ETF USD Hedged (Dist);https://www.justetf.com/en/etf-profile.html?isin=IE0004J6PFL7;The iShares Core UK Gilts UCITS ETF USD Hedged (Dist) seeks to track the FTSE Actuaries UK Conventional Gilts All Stocks (USD Hedged) index. The FTSE Actuaries UK Conventional Gilts All Stocks (USD Hedged) index tracks Sterling denominated UK government bonds (conventional gilts) quoted on the London Stock Exchange, other than index-linked bonds. Currency hedged to US Dollar (USD). The ETF's TER (total expense ratio) amounts to 0.09% p.a.. The ETF replicates the performance of the underlying index by sampling technique (buying a selection of the most relevant index constituents). The interest income (coupons) in the ETF is distributed to the investors (Semi annually). The iShares Core UK Gilts UCITS ETF USD Hedged (Dist) has 499m Euro assets under management. The ETF was launched on 5 October 2022 and is domiciled in Ireland.;Ishares Core UK GILTS UCITS ETF USD Hedged (Dist) se snaží sledovat index FTSE UK UK BILD BILTS ALL (USD Hedged). FTSE Mateřici UK UK konvenční praskliny všechny akcie (USD Hedged) Indexové stopy mincovní denominované vládní dluhopisy (konvenční Gilts) citované na londýnské burze cenných papírů, kromě indexovaných dluhopisů. Měna zajistila americký dolar (USD). TER (celkový poměr nákladů) ETF činí 0,09% p.a. ETF replikuje výkon základního indexu technikou vzorkování (nákup výběru nejdůležitějších složek indexu). Úrokové výnosy (kupóny) v ETF jsou distribuovány investorům (semifinále každoročně). Ishares Core UK Gilts UCITS ETF USD Hedged (dist) má 499 milionů euro aktiv správy. ETF byl spuštěn 5. října 2022 a má bydliště v Irsku.;0.09%;0.09;EUR 499m;499.0;EUR;USD;Ireland;iShares;5 October 2022;Distributing;Semi annually;Physical;;;Bonds, GBP, United Kingdom, Government, All maturities;;Dluhopisy;False;Globální;67.0;-8.36;;;-10.01;9.73;;;-0.86;;;-12.5;;;-20.75;;;;;Extracted (method 1);GLUH;0;4.57%;4.57;EUR 0.19;0.19;EUR;method2_regex;2025-09-18T16:52:31.232591;success;0;GB0004893086;2.41;;;;;;;;;;;;;;;;;;;Other;100.0;;;;;;;;;;;;;;;;;;;;;;;;;;;;;;;;;;;;;;;;;;;;;;;;;;;;;;;
