IE00BZ1GHD37;WisdomTree Enhanced Commodity UCITS ETF USD;https://www.justetf.com/en/etf-profile.html?isin=IE00BZ1GHD37;The WisdomTree Enhanced Commodity UCITS ETF USD seeks to track the Optimised Roll Commodity index. The Optimised Roll Commodity index tracks a broad and diversified commodity exposure, covering the following sectors: energy, agriculture, industrial metals, precious metals and livestock. The ETF's TER (total expense ratio) amounts to 0.35% p.a.. The WisdomTree Enhanced Commodity UCITS ETF USD is the only ETF that tracks the Optimised Roll Commodity index. The ETF replicates the performance of the underlying index synthetically with a swap. The WisdomTree Enhanced Commodity UCITS ETF USD is a small ETF with 78m Euro assets under management. The ETF was launched on 27 April 2016 and is domiciled in Ireland.;WisdomTree Enhanced Commodity UCITS ETF USD se snaží sledovat optimalizovaný index komodit roll. Optimalizovaný index komodit v roli sleduje širokou a diverzifikovanou expozici komodity a pokrývá následující odvětví: energii, zemědělství, průmyslové kovy, drahé kovy a hospodářská zvířata. TER (celkový poměr nákladů) ETF činí 0,35% p.a. ETF replikuje výkon podkladového indexu synteticky s výměnou. WisdomTree Enhanced Commodity UCITS ETF USD je malý ETF s managementem 78 milionů euro. ETF byl spuštěn 27. dubna 2016 a je se sídlem v Irsku.;0.35%;0.35;EUR 78m;78.0;EUR;USD;Ireland;WisdomTree;27 April 2016;;Annually;Synthetic (Unfunded swap);;;Commodities, Broad market;;Komodity;False;Globální;;3.7;-13.45;57.35;-3.96;13.93;13.12;15.17;0.27;-0.36;0.63;-13.19;-22.03;-26.07;-26.07;;;;;London Stock Exchange;WCOG;2;5.09%;5.09;EUR 0.60;0.6;EUR;method2_regex;2025-09-19T10:55:12.694243;success;0;;;;;;;;;;;;;;;;;;;;;;;;;;;;;;;;;;;;;;;;;London Stock Exchange;GBX;WCOG;WCOG LN;WCOG.L;;SIX Swiss Exchange;USD;WCOG;WCOG SW;WCOG.S;;;;;;;;;;;;;;;;;;;;2;37;12;1;11;5;8
IE00BZ1NCS44;iShares Bloomberg Roll Select Commodity Swap UCITS ETF USD;https://www.justetf.com/en/etf-profile.html?isin=IE00BZ1NCS44;The iShares Bloomberg Roll Select Commodity Swap UCITS ETF USD seeks to track the Bloomberg Roll Select Commodity index. The Bloomberg Roll Select Commodity index tracks a broad resource basket. The index aims to reduce the impact of negative roll returns. The ETF's TER (total expense ratio) amounts to 0.28% p.a.. The iShares Bloomberg Roll Select Commodity Swap UCITS ETF USD is the only ETF that tracks the Bloomberg Roll Select Commodity index. The ETF replicates the performance of the underlying index synthetically with a swap. The iShares Bloomberg Roll Select Commodity Swap UCITS ETF USD is a large ETF with 901m Euro assets under management. The ETF was launched on 28 September 2018 and is domiciled in Ireland.;IShares Bloomberg Roll Select Commodity Swap UCITS ETF USD se snaží sledovat komoditní index Bloomberg Roll Select. Bloomberg Roll Select Commodity Index sleduje široký koš zdrojů. Cílem indexu je snížit dopad negativního výnosu role. TER (celkový poměr nákladů) ETF činí 0,28% p.a. ETF replikuje výkon podkladového indexu synteticky s výměnou. Ishares Bloomberg Roll Select Commodity Swap UCITS ETF USD je velký ETF s 901 miliony euro ve spravování. ETF byl spuštěn 28. září 2018 a je se sídlem v Irsku.;0.28%;0.28;EUR 901m;901.0;EUR;USD;Ireland;iShares;28 September 2018;;;Synthetic (Unfunded swap);;Bloomberg Roll Select Commodity Swap  USD;Commodities, Broad market;;Dluhopisy;False;Globální;;5.21;-2.55;77.98;-3.51;16.01;14.73;16.19;0.33;-0.06;0.75;-13.39;-15.78;-20.54;-24.83;;;;;Extracted (method 1);IS39;0;;;;;;;2025-09-19T10:55:21.073458;success;0;;;;;;;;;;;;;;;;;;;;;;;;;;;;;;;;;;;;;;;;;;;;;;;;;;;;;;;;;;;;;;;;;;;;;;;2;48;12;10;8;10;8
IE00BZ2GV965;UBS CMCI ex-Agriculture SF UCITS ETF USD acc;https://www.justetf.com/en/etf-profile.html?isin=IE00BZ2GV965;The UBS CMCI ex-Agriculture SF UCITS ETF USD acc seeks to track the UBS CMCI Ex Agriculture Ex Livestock Capped index. The UBS CMCI Ex Agriculture Ex Livestock Capped index tracks the price of futures contracts on commodities representing the following commodity sectors: energy, precious metals and industrial metals. Excluded are: livestock and agriculture. The index diversifies its futures across the maturity curve and thus offers constant maturities. Therewith, the index tries to minimise the risk of a negative roll yield. The ETF's TER (total expense ratio) amounts to 0.34% p.a.. The UBS CMCI ex-Agriculture SF UCITS ETF USD acc is the only ETF that tracks the UBS CMCI Ex Agriculture Ex Livestock Capped index. The ETF replicates the performance of the underlying index synthetically with a swap. The UBS CMCI ex-Agriculture SF UCITS ETF USD acc has 129m Euro assets under management. The ETF was launched on 24 March 2016 and is domiciled in Ireland.;UBS CMCI Ex-Agriculture SF UCITS ETF USD ACC se snaží sledovat index UBS CMCI Ex Agriculture Ex Agriculture Ex-Liveakcie. UBS CMCI Ex Agriculture Ex -Liveakcie Index sleduje cenu futures kontraktů na komodity představující následující komoditní odvětví: energie, drahé kovy a průmyslové kovy. Vyloučeny jsou: hospodářská zvířata a zemědělství. Index diverzifikuje svou budoucnost přes křivku zralosti a nabízí tak konstantní splatnosti. S tím se index snaží minimalizovat riziko negativního výnosu role. TER (celkový poměr nákladů) ETF činí 0,34% p.a .. UBS CMCI EX-AGRICULTURE SF UCITS ETF USD ACC je jediným ETF, který sleduje index UBS CMCI EX Agriculture EX Index. ETF replikuje výkon podkladového indexu synteticky s výměnou. UBS CMCI Ex-Agriculture SF UCITS ETF USD ACC má 129 milionů euro aktiv. ETF byl spuštěn 24. března 2016 a je se sídlem v Irsku.;0.34%;0.34;EUR 129m;129.0;EUR;USD;Ireland;UBS;24 March 2016;Accumulating;;Synthetic;;;Commodities, Broad market;;Komodity;False;Globální;;3.9;-2.91;83.29;-3.84;14.95;14.51;16.42;0.26;-0.07;0.78;-14.44;-17.45;-22.67;-30.92;;;;;London Stock Exchange;CXAP;6;;;;;;;2025-09-19T10:55:25.842164;success;0;;;;;;;;;;;;;;;;;;;;;;;;;;;;;;;;;;;;;;;;;gettex;EUR;UEQU;;;;Stuttgart Stock Exchange;EUR;UEQU;;;;London Stock Exchange;GBX;CXAP;CXAP LNUETFCXAP;CXAP.LICCXAAGBPINAV=SOLA;;London Stock Exchange;USD;CXAU;CXAU LNUETFCXAU;CXAU.LICCXAAINAV=SOLA;;SIX Swiss Exchange;USD;CCXAA;CCXAA SWUETFCXAU;CCXAA.SICCXAAINAV=SOLA;;2;41;12;5;11;5;8
IE00BZ4BMM98;Invesco EURO STOXX High Dividend Low Volatility UCITS ETF;https://www.justetf.com/en/etf-profile.html?isin=IE00BZ4BMM98;The Invesco EURO STOXX High Dividend Low Volatility UCITS ETF seeks to track the EURO iSTOXX® High Dividend Low Volatility 50 index. The EURO iSTOXX® High Dividend Low Volatility 50 index tracks 50 high dividend yield stocks which also show a low volatility. The ETF's TER (total expense ratio) amounts to 0.30% p.a.. The Invesco EURO STOXX High Dividend Low Volatility UCITS ETF is the only ETF that tracks the EURO iSTOXX® High Dividend Low Volatility 50 index. The ETF replicates the performance of the underlying index by full replication (buying all the index constituents). The dividends in the ETF are distributed to the investors (Quarterly). The Invesco EURO STOXX High Dividend Low Volatility UCITS ETF has 197m Euro assets under management. The ETF was launched on 6 January 2016 and is domiciled in Ireland.;Invesco Euro Stoxx High dividenda s nízkou volatilitou UCITS ETF se snaží sledovat index Euro IStoxx® s vysokou dividendaou s nízkou volatilitou 50. Euro IStoxx® High dividenda Nízká volatilita 50 indexů sleduje 50 vysokých dividendaových výnosů, které také vykazují nízkou volatilitu. TER (celkový poměr nákladů) činí 0,30% P.A .. Invesco Euro Stoxx High dividenda s nízkou volatilitou UCITS ETF je jediný ETF, který sleduje index Euro IStoxx® s vysokou dividendaou nízkou volatilitou 50. ETF replikuje výkon podkladového indexu plnou replikací (nákup všech složek indexu). dividenday v ETF jsou distribuovány investorům (čtvrtletně). Invesco Euro Stoxx High dividenda Nízká volatilita UCITS ETF má 197m euro aktiv ve spravování. ETF byl spuštěn 6. ledna 2016 a je se sídlem v Irsku.;0.30%;0.3;EUR 197m;197.0;EUR;EUR;Ireland;Invesco;6 January 2016;;Quarterly;Physical;;;Equity, Europe, Dividend;;Akcie;False;Evropa;50.0;23.61;65.23;85.43;27.03;12.64;12.55;13.53;1.87;1.45;0.97;-12.88;-12.88;-22.44;-40.51;;;;;London Stock Exchange;-;9;5.24%;5.24;EUR 1.57;1.57;EUR;method2_regex;2025-09-19T10:55:34.481106;success;0;Eni SpA;2.73;Enagás SA;2.71;Cofinimmo SA;2.64;Mercedes-Benz Group AG;2.61;ENGIE SA;2.56;Intesa Sanpaolo SpA;2.49;Azimut Holding SpA;2.48;Nordea Bank Abp;2.45;Covivio SA;2.41;;;Other;45.56;France;15.32;Germany;12.14;;;;;Financials;33.6;Utilities;14.17;Energy;12.47;Real Estate;8.7;;;gettex;EUR;EHDV;;;;Stuttgart Stock Exchange;EUR;EHDV;;;;Borsa Italiana;EUR;EUHD;EUHD IMiEUHD;EUHD.MI3XJ3INAV.DE;;Euronext Paris;EUR;EUHD;EUHD FPiEUHD;EUHD.PA3XJ3INAV.DE;;London Stock Exchange;GBX;EUHD;EUHD LNiEUHD;EUHD.L;;3;58;12;5;11;10;20
IE00BZ56RD98;WisdomTree US Quality Dividend Growth UCITS ETF USD;https://www.justetf.com/en/etf-profile.html?isin=IE00BZ56RD98;The WisdomTree US Quality Dividend Growth UCITS ETF USD seeks to track the WisdomTree US Quality Dividend Growth index. The WisdomTree US Quality Dividend Growth index tracks dividend-paying US stocks with a high quality factor. The stocks included are filtered according to ESG criteria (environmental, social and corporate governance). The Index is a fundamentally weighted index. The ETF's TER (total expense ratio) amounts to 0.33% p.a.. The WisdomTree US Quality Dividend Growth UCITS ETF USD is the only ETF that tracks the WisdomTree US Quality Dividend Growth index. The ETF replicates the performance of the underlying index by sampling technique (buying a selection of the most relevant index constituents). The dividends in the ETF are distributed to the investors (Quarterly). The WisdomTree US Quality Dividend Growth UCITS ETF USD has 139m Euro assets under management. The ETF was launched on 3 November 2016 and is domiciled in Ireland.;Růst dividenda WisdomTree USA UCITS ETF USD se snaží sledovat index růstu dividenda v USA. Index růstu dividenda WisdomTree USA sleduje americké akciíy platící dividenday s vysoce kvalitním faktorem. Zahrnuté akcie jsou filtrovány podle kritérií ESG (environmentální, sociální a správa a společností). Index je zásadně vážený index. TER (celkový poměr nákladů) ETF činí 0,33% p.a. Růst dividenda v dividendaě v USA UCITS ETF je jediný ETF, který sleduje index růstu dividenda v USA. ETF replikuje výkon základního indexu technikou vzorkování (nákup výběru nejdůležitějších složek indexu). dividenday v ETF jsou distribuovány investorům (čtvrtletně). Růst dividenda v dividendaě WisdomTree UCITS ETF USD má 139 milionů euro aktiv. ETF byla spuštěna 3. listopadu 2016 a je bydliště v Irsku.;0.33%;0.33;EUR 139m;139.0;EUR;USD;Ireland;WisdomTree;3 November 2016;;Quarterly;Physical;;;Equity, United States,;Yes;Akcie;False;US;300.0;4.9;37.76;96.24;-2.16;17.64;15.84;16.01;0.28;0.71;0.9;-19.73;-19.73;-19.73;-31.54;;;;;London Stock Exchange;DGRP;3;1.17%;1.17;EUR 0.46;0.46;EUR;method2_regex;2025-09-19T10:55:39.987442;success;0;NVIDIA Corp.;4.36;Apple;4.24;Exxon Mobil Corp.;3.94;The Coca-Cola Co.;3.07;Procter & Gamble Co.;2.75;Home Depot;2.57;Cisco Systems, Inc.;2.36;Walmart, Inc.;2.28;Chevron Corp.;2.19;;;United States;98.0;Other;2.0;;;;;;;Technology;30.2;Consumer Staples;12.56;Industrials;11.31;Consumer Discretionary;9.73;;;London Stock Exchange;GBX;DGRP;DGRP LN;DGRP.L;;London Stock Exchange;USD;DGRW;DGRW LN;DGRW.L;;SIX Swiss Exchange;USD;DGRW;DGRW SW;DGRW.S;;;;;;;;;;;;;;3;53;12;5;11;5;20
IE00BZ56RG20;WisdomTree US Quality Dividend Growth UCITS ETF USD Acc;https://www.justetf.com/en/etf-profile.html?isin=IE00BZ56RG20;The WisdomTree US Quality Dividend Growth UCITS ETF USD Acc seeks to track the WisdomTree US Quality Dividend Growth index. The WisdomTree US Quality Dividend Growth index tracks dividend-paying US stocks with a high quality factor. The stocks included are filtered according to ESG criteria (environmental, social and corporate governance). The Index is a fundamentally weighted index. The ETF's TER (total expense ratio) amounts to 0.33% p.a.. The WisdomTree US Quality Dividend Growth UCITS ETF USD Acc is the only ETF that tracks the WisdomTree US Quality Dividend Growth index. The ETF replicates the performance of the underlying index by sampling technique (buying a selection of the most relevant index constituents). The dividends in the ETF are accumulated and reinvested in the ETF. The WisdomTree US Quality Dividend Growth UCITS ETF USD Acc has 471m Euro assets under management. The ETF was launched on 3 June 2016 and is domiciled in Ireland.;Růst dividenda WisdomTree USA UCITS ETF USD ACC se snaží sledovat index růstu dividenda v kvalitě WisdomTree USA. Index růstu dividenda WisdomTree USA sleduje americké akciíy platící dividenday s vysoce kvalitním faktorem. Zahrnuté akcie jsou filtrovány podle kritérií ESG (environmentální, sociální a správa a společností). Index je zásadně vážený index. TER (celkový poměr nákladů) ETF činí 0,33% p.a. Růst dividenda WisdomTree UCITS ETF USD ACC je jediný ETF, který sleduje index růstu dividenda v USA. ETF replikuje výkon základního indexu technikou vzorkování (nákup výběru nejdůležitějších složek indexu). dividenday v ETF jsou akumulovány a reinvestovány do ETF. Růst dividenda WisdomTree USA UCITS ETF USD ACC má ve spravování 471 milionů euro aktiv. ETF byl spuštěn 3. června 2016 a je se sídlem v Irsku.;0.33%;0.33;EUR 471m;471.0;EUR;USD;Ireland;WisdomTree;3 June 2016;Accumulating;;Physical;;;Equity, United States,;Yes;Akcie;False;US;300.0;4.93;37.84;96.31;-2.13;18.7;16.2;16.24;0.26;0.7;0.89;-19.74;-19.74;-19.74;-31.55;;;;;Euronext Paris;DGRA;8;;;;;;;2025-09-19T10:55:46.131232;success;0;NVIDIA Corp.;4.36;Apple;4.24;Exxon Mobil Corp.;3.94;The Coca-Cola Co.;3.07;Procter & Gamble Co.;2.75;Home Depot;2.57;Cisco Systems, Inc.;2.36;Walmart, Inc.;2.28;Chevron Corp.;2.19;;;United States;98.0;Other;2.0;;;;;;;Technology;30.2;Consumer Staples;12.56;Industrials;11.31;Consumer Discretionary;9.73;;;Euronext Paris;EUR;DGRA;;;;gettex;EUR;WTDM;;;;Borsa Italiana;EUR;DGRA;DGRA IMDGRAEIV;DGRA.MIDGRAINAV.DE;;Euronext Paris;USD;DGRA;DGRA FPDGRAEIV;WTDGRG.PADGRAINAV.DE;;London Stock Exchange;GBX;DGRG;DGRG LNDGRAEIV;WTDGRG.LDGRAINAV.DE;;3;53;12;5;11;5;20
IE00BZ56RN96;WisdomTree Global Quality Dividend Growth UCITS ETF USD;https://www.justetf.com/en/etf-profile.html?isin=IE00BZ56RN96;The WisdomTree Global Quality Dividend Growth UCITS ETF USD seeks to track the WisdomTree Global Developed Quality Dividend Growth index. The WisdomTree Global Developed Quality Dividend Growth index tracks dividend-paying developed markets stocks with growth characteristics. The stocks included are filtered according to ESG criteria (environmental, social and corporate governance). The index is a fundamentally weighted index. The ETF's TER (total expense ratio) amounts to 0.38% p.a.. The WisdomTree Global Quality Dividend Growth UCITS ETF USD is the cheapest ETF that tracks the WisdomTree Global Developed Quality Dividend Growth index. The ETF replicates the performance of the underlying index by sampling technique (buying a selection of the most relevant index constituents). The dividends in the ETF are distributed to the investors (Quarterly). The WisdomTree Global Quality Dividend Growth UCITS ETF USD has 286m Euro assets under management. The ETF was launched on 2 November 2016 and is domiciled in Ireland.;Růst dividenda WisdomTree Global Quality UCITS ETF USD se snaží sledovat index růstu dividenda WisdomTree Global Global. Index růstu dividenda WisdomTree Global vyvinul index růstu kvality dividenda vyplacení rozvinutých trhů s růstovými charakteristikami. Zahrnuté akcie jsou filtrovány podle kritérií ESG (environmentální, sociální a správa a společností). Index je zásadně vážený index. TER (celkový poměr výdajů) ETF činí 0,38% P.A. Globální růst dividenda v WisdomTree UCITS ETF USD je nejlevnější ETF, který sleduje index růstu dividenda WisdomTree Global Během. ETF replikuje výkon základního indexu technikou vzorkování (nákup výběru nejdůležitějších složek indexu). dividenday v ETF jsou distribuovány investorům (čtvrtletně). Růst dividenda WisdomTree Global Quality dividenda UCITS ETF USD má pod správou aktiva 286 milionů EUR. ETF byla spuštěna 2. listopadu 2016 a je bydliště v Irsku.;0.38%;0.38;EUR 286m;286.0;EUR;USD;Ireland;WisdomTree;2 November 2016;;Quarterly;Physical;;;Equity, World,;Yes;Akcie;False;Globální;532.0;2.71;30.15;64.58;-1.05;13.4;12.58;13.08;0.2;0.73;0.8;-18.44;-18.44;-18.44;-31.34;;;;;London Stock Exchange;GGRP;6;1.33%;1.33;EUR 0.43;0.43;EUR;method2_regex;2025-09-19T10:55:52.263528;success;0;Apple;3.34;AbbVie, Inc.;2.55;NVIDIA Corp.;2.18;Procter & Gamble Co.;2.13;Novartis AG;2.11;The Coca-Cola Co.;2.03;Roche Holding AG;2.02;Walmart, Inc.;1.98;Home Depot;1.96;;;United States;58.46;Other;23.88;Switzerland;7.24;Japan;5.74;Germany;4.68;Technology;23.9;Industrials;16.94;Health Care;16.44;Consumer Staples;11.65;;;gettex;EUR;WTEQ;;;;Borsa Italiana;EUR;GGRW;GGRW IM;GGRW.MIWTEQINAV=IHSM;;London Stock Exchange;GBX;GGRP;GGRP LN;GGRP.L;;London Stock Exchange;USD;GGRW;GGRW LN;GGRW.L;;SIX Swiss Exchange;USD;GGRW;GGRW SW;GGRW.S;;3;53;12;5;11;5;20
IE00BZ56SW52;WisdomTree Global Quality Dividend Growth UCITS ETF USD Acc;https://www.justetf.com/en/etf-profile.html?isin=IE00BZ56SW52;The WisdomTree Global Quality Dividend Growth UCITS ETF USD Acc seeks to track the WisdomTree Global Developed Quality Dividend Growth index. The WisdomTree Global Developed Quality Dividend Growth index tracks dividend-paying developed markets stocks with growth characteristics. The stocks included are filtered according to ESG criteria (environmental, social and corporate governance). The index is a fundamentally weighted index. The ETF's TER (total expense ratio) amounts to 0.38% p.a.. The WisdomTree Global Quality Dividend Growth UCITS ETF USD Acc is the cheapest and largest ETF that tracks the WisdomTree Global Developed Quality Dividend Growth index. The ETF replicates the performance of the underlying index by sampling technique (buying a selection of the most relevant index constituents). The dividends in the ETF are accumulated and reinvested in the ETF. The WisdomTree Global Quality Dividend Growth UCITS ETF USD Acc is a large ETF with 638m Euro assets under management. The ETF was launched on 3 June 2016 and is domiciled in Ireland.;Růst dividenda WisdomTree Global Quality dividenda UCITS ETF USD ACC se snaží sledovat index růstu dividenda WisdomTree Global. Index růstu dividenda WisdomTree Global vyvinul index růstu kvality dividenda vyplacení rozvinutých trhů s růstovými charakteristikami. Zahrnuté akcie jsou filtrovány podle kritérií ESG (environmentální, sociální a správa a společností). Index je zásadně vážený index. TER (celkový poměr výdajů) ETF činí 0,38% P.A. Globální růst dividenda WisdomTree UCITS ETF USD ACC je nejlevnější a největší ETF, který sleduje globální index dividenda WisdomTree Global vyvinuté kvality dividenda. ETF replikuje výkon základního indexu technikou vzorkování (nákup výběru nejdůležitějších složek indexu). dividenday v ETF jsou akumulovány a reinvestovány do ETF. Globální růst dividenda WisdomTree Global Quality UCITS ETF USD ACC je velký ETF s řízením 638 milionů euro. ETF byl spuštěn 3. června 2016 a je se sídlem v Irsku.;0.38%;0.38;EUR 638m;638.0;EUR;USD;Ireland;WisdomTree;3 June 2016;Accumulating;;Physical;;;Equity, World,;Yes;Akcie;False;Globální;532.0;2.75;30.22;64.59;-1.02;14.42;12.95;13.31;0.19;0.71;0.79;-18.46;-18.46;-18.46;-31.35;;;;;Euronext Paris;GGRA;8;;;;;;;2025-09-19T10:55:57.401451;success;0;Apple;3.34;AbbVie, Inc.;2.55;NVIDIA Corp.;2.18;Procter & Gamble Co.;2.13;Novartis AG;2.11;The Coca-Cola Co.;2.03;Roche Holding AG;2.02;Walmart, Inc.;1.98;Home Depot;1.96;;;United States;58.46;Other;23.88;Switzerland;7.24;Japan;5.74;Germany;4.68;Technology;23.9;Industrials;16.94;Health Care;16.44;Consumer Staples;11.65;;;Euronext Paris;EUR;GGRA;;;;gettex;EUR;WTEM;;;;Borsa Italiana;EUR;GGRA;GGRA IMGGRAEIV;GGRA.MIGGRAINAV.DE;;Euronext Paris;USD;GGRA;GGRA FPGGRAEIV;GGRG.PAGGRAINAV.DE;;London Stock Exchange;GBX;GGRG;GGRG LNGGRAEIV;GGRG.LGGRAINAV.DE;;3;58;12;10;11;5;20
IE00BZ56SY76;WisdomTree Eurozone Quality Dividend Growth UCITS ETF EUR Dist;https://www.justetf.com/en/etf-profile.html?isin=IE00BZ56SY76;The WisdomTree Eurozone Quality Dividend Growth UCITS ETF EUR Dist seeks to track the WisdomTree Eurozone Quality Dividend Growth index. The WisdomTree Eurozone Quality Dividend Growth index tracks dividend-paying eurozone stocks with a high quality factor. The stocks included are filtered according to ESG criteria (environmental, social and corporate governance). The Index is a fundamentally weighted index. The ETF's TER (total expense ratio) amounts to 0.29% p.a.. The WisdomTree Eurozone Quality Dividend Growth UCITS ETF EUR Dist is the cheapest ETF that tracks the WisdomTree Eurozone Quality Dividend Growth index. The ETF replicates the performance of the underlying index by full replication (buying all the index constituents). The dividends in the ETF are distributed to the investors (Semi annually). The WisdomTree Eurozone Quality Dividend Growth UCITS ETF EUR Dist is a very small ETF with 7m Euro assets under management. The ETF was launched on 3 November 2016 and is domiciled in Ireland.;Růst dividenda WisdomTree Eurozneu UCITS ETF EUR dist se snaží sledovat index růstu dividenda v eurozóně WisdomTree. Index růstu dividenda Wisdomtree Eurozóny sleduje akciíy eurozóny vyplacené dividenday s vysoce kvalitním faktorem. Zahrnuté akcie jsou filtrovány podle kritérií ESG (environmentální, sociální a správa a společností). Index je zásadně vážený index. TER (celkový poměr nákladů) ETF činí 0,29% P.A. Růst dividenda v dividendaě WisdomTree Eurozone UCITS ETF EUR DIST je nejlevnější ETF, který sleduje index dividenda WisdomTree Eurozned. ETF replikuje výkon podkladového indexu plnou replikací (nákup všech složek indexu). dividenday v ETF jsou distribuovány investorům (polo každoročně). Růst dividenda Wisdomtree Eurozne dividenda UCITS ETF EUR DIST je velmi malý ETF s spravováním 7 milionů euro. ETF byla spuštěna 3. listopadu 2016 a je bydliště v Irsku.;0.29%;0.29;EUR 7m;7.0;EUR;EUR;Ireland;WisdomTree;3 November 2016;Distributing;Semi annually;Physical;;;Equity, Europe,;Yes;Akcie;False;Evropa;91.0;3.7;31.28;32.32;5.32;14.57;13.9;16.0;0.25;0.68;0.36;-16.16;-16.16;-30.15;-35.75;;;;;London Stock Exchange;EGRP;4;2.29%;2.29;EUR 0.45;0.45;EUR;method2_regex;2025-09-19T10:56:05.473234;success;0;Deutsche Telekom AG;5.93;L'Oréal SA;5.24;Deutsche Post AG;4.68;Industria de Diseño Textil SA;4.12;Endesa SA;4.01;LVMH Moët Hennessy Louis Vuitton SE;3.97;Schneider Electric SE;3.81;Daimler Truck Holding AG;3.57;Hermès International SCA;3.49;;;Germany;26.61;Other;25.45;France;24.59;Netherlands;11.17;;;Industrials;20.77;Consumer Discretionary;16.23;Technology;14.58;;;;;gettex;EUR;WTIQ;;;;London Stock Exchange;GBX;EGRP;EGRP LN;EGRP.L;;London Stock Exchange;EUR;EGRW;EGRW LN;EGRW.L;;SIX Swiss Exchange;EUR;EGRW;EGRW SW;EGRW.S;;;;;;;;2;49;12;1;11;5;20
