IE00B4QNHZ41;L&G DAX Daily 2x Short UCITS ETF;https://www.justetf.com/en/etf-profile.html?isin=IE00B4QNHZ41;The L&G DAX Daily 2x Short UCITS ETF seeks to track the ShortDAX® Leverage (2x) index. The ShortDAX® Leverage (2x) index tracks the two times leveraged inverse performance of the DAX® index on a daily basis. The DAX® index tracks the 40 largest and most traded German stocks listed on the Prime Standard segment of the Frankfurt Stock Exchange. The ETF's TER (total expense ratio) amounts to 0.60% p.a.. The ETF replicates the performance of the underlying index synthetically with a swap. The dividends in the ETF are accumulated and reinvested in the ETF. The L&G DAX Daily 2x Short UCITS ETF is a small ETF with 29m Euro assets under management. The ETF was launched on 18 June 2009 and is domiciled in Ireland.;L&G DAX Dax Denně 2x Short UCITS ETF se snaží sledovat index pákového efektu ShortDax®. Index ShortDax® páka (2x) sleduje dvakrát využívaný inverzní výkon indexu DAX® denně. Index DAX® sleduje 40 největších a nejvíce obchodovaných německých akcií uvedených v hlavním standardním segmentu frankfurtské burzy. TER (celkový poměr nákladů) ETF činí 0,60% p.a. ETF replikuje výkon podkladového indexu synteticky s výměnou. dividenday v ETF jsou akumulovány a reinvestovány do ETF. L&G DAX Dax Denně 2x Short UCITS ETF je malá ETF s managementem 29m euro. ETF byla spuštěna 18. června 2009 a je bydliště v Irsku.;0.60%;0.6;EUR 29m;29.0;EUR;EUR;Ireland;Legal & General (LGIM);18 June 2009;;;Synthetic (Unfunded swap);UCITS;;Equity, Germany;;EUR    Currency risk  Currency;Short, Leverage    Sustainability  No;Akcie;True;Celosvětově;;-36.63;-69.38;-76.12;-31.18;6.67;-4.48;-5.88;-31.76;8.81;-28.32;-25.0;-99.43;35.94;30.27;34.41;-1.02;-1.08;-0.72;-43.27;-75.31;-82.44;-99.52;;;;;Extracted (method 1);DES2;0;;;;;;;2025-09-21T22:10:34.923586;success;0;;;;;;;;;;;;;;;;;;;;;;;;;;;;;;;;;;;;;;;;;;;;;;;;;;;;;;;;;;;;;;;;;;;;;;;;;;;;;;;;;;;;;;;;;;;;;;;;;;;;;2;35;6;1;15;5;8
IE00B4QNJJ23;L&G FTSE 100 Leveraged (Daily 2x) UCITS ETF;https://www.justetf.com/en/etf-profile.html?isin=IE00B4QNJJ23;The L&G FTSE 100 Leveraged (Daily 2x) UCITS ETF seeks to track the FTSE 100 Leverage (2x) index. The FTSE 100 Leverage (x2) index tracks the two times leveraged performance of FTSE 100 on a daily basis. The FTSE 100 index tracks the 100 largest UK stocks. The ETF's TER (total expense ratio) amounts to 0.50% p.a.. The ETF replicates the performance of the underlying index synthetically with a swap. The dividends in the ETF are accumulated and reinvested in the ETF. The L&G FTSE 100 Leveraged (Daily 2x) UCITS ETF is a very small ETF with 18m Euro assets under management. The ETF was launched on 18 June 2009 and is domiciled in Ireland.;L&G FTSE 100 využívá (denně 2x) UCITS ETF se snaží sledovat index pákového efektu FTSE 100 (2x). Index pákového efektu FTSE 100 (x2) sleduje dvakrát využívaný výkon FTSE 100 denně. Index FTSE 100 sleduje 100 největších britských akcií. ETF TER (celkový poměr nákladů) činí 0,50% p.a. ETF replikuje výkon podkladového indexu synteticky s výměnou. dividenday v ETF jsou akumulovány a reinvestovány do ETF. L&G FTSE 100 využívá (denně 2x) UCITS ETF je velmi malá ETF s managementem 18m euro. ETF byla spuštěna 18. června 2009 a je bydliště v Irsku.;0.50%;0.5;EUR 18m;18.0;EUR;GBP;Ireland;Legal & General (LGIM);18 June 2009;;;Synthetic (Unfunded swap);UCITS;FTSE 100 Leveraged;Equity, United Kingdom;;GBP    Currency risk  Currency;Leverage    Sustainability  No;Akcie;True;Evropa;;15.31;57.69;149.08;19.79;-0.34;7.58;7.34;44.33;-2.45;9.37;15.29;445.31;25.25;22.99;26.67;0.61;0.71;0.75;-28.65;-28.65;-28.65;-61.95;;;;;London Stock Exchange;-;2;;;;;;;2025-09-21T22:10:39.939747;success;0;;;;;;;;;;;;;;;;;;;;;;;;;;;;;;;;;;;;;;;;;London Stock Exchange;GBX;LUK2;LUK2 LNNA;LUK2.LNA;;London Stock Exchange;GBP;-;LUK2 LNNA;LUK2.LNA;;;;;;;;;;;;;;;;;;;;;;;;;;;;;;;;;;;;;;;;;;;;;;;;;;3;53;12;1;15;5;20
IE00B4QNK008;L&G FTSE 100 Super Short Strategy (Daily 2x) UCITS ETF;https://www.justetf.com/en/etf-profile.html?isin=IE00B4QNK008;The L&G FTSE 100 Super Short Strategy (Daily 2x) UCITS ETF seeks to track the FTSE 100 Short Leverage (2x) index. The FTSE 100 Short Leverage (x2) index tracks the two times leveraged inverse performance of FTSE 100 on a daily basis. The FTSE 100 index tracks the largest UK stocks. The ETF's TER (total expense ratio) amounts to 0.60% p.a.. The ETF replicates the performance of the underlying index synthetically with a swap. The dividends in the ETF are accumulated and reinvested in the ETF. The L&G FTSE 100 Super Short Strategy (Daily 2x) UCITS ETF is a very small ETF with 14m Euro assets under management. The ETF was launched on 18 June 2009 and is domiciled in Ireland.;L&G FTSE 100 Super krátká strategie (Daily 2x) UCITS ETF se snaží sledovat index krátkého pákového efektu FTSE 100 (2x). Index krátký pákový efekt FTSE 100 (X2) sleduje dvakrát využívaný inverzní výkon FTSE 100 denně. Index FTSE 100 sleduje největší britské akcie. TER (celkový poměr nákladů) ETF činí 0,60% p.a. ETF replikuje výkon podkladového indexu synteticky s výměnou. dividenday v ETF jsou akumulovány a reinvestovány do ETF. L&G FTSE 100 Super krátká strategie (Daily 2x) UCITS ETF je velmi malá ETF s řízením 14 metrů Euro. ETF byla spuštěna 18. června 2009 a je bydliště v Irsku.;0.60%;0.6;EUR 14m;14.0;EUR;GBP;Ireland;Legal & General (LGIM);18 June 2009;;;Synthetic (Unfunded swap);UCITS;FTSE 100 Super Short Strategy;Equity, United Kingdom;;GBP    Currency risk  Currency;Short, Leverage    Sustainability  No;Akcie;True;Evropa;;-20.65;-36.38;-66.09;-25.89;-1.02;-10.15;-14.87;-28.16;-17.95;-4.94;-2.48;-97.69;23.19;22.94;26.57;-0.89;-0.61;-0.73;-32.86;-44.68;-71.2;-97.87;;;;;London Stock Exchange;-;2;;;;;;;2025-09-21T22:10:46.884254;success;0;;;;;;;;;;;;;;;;;;;;;;;;;;;;;;;;;;;;;;;;;London Stock Exchange;GBX;SUK2;SUK2 LNNA;SUK2.LNA;;London Stock Exchange;GBP;-;SUK2 LNNA;SUK2.LNA;;;;;;;;;;;;;;;;;;;;;;;;;;;;;;;;;;;;;;;;;;;;;;;;;;2;35;6;1;15;5;8
IE00B4WPHX27;L&G Longer Dated All Commodities UCITS ETF;https://www.justetf.com/en/etf-profile.html?isin=IE00B4WPHX27;The L&G Longer Dated All Commodities UCITS ETF seeks to track the Bloomberg Commodity 3 Month Forward index. The Bloomberg Commodity 3 Month Forward index tracks the price of futures contracts on commodities, representing the following commodity sectors: energy, precious metals, industrial metals, livestock and agriculture. The index is a forward index that represents the Bloomberg Commodity index three months in future. The ETF's TER (total expense ratio) amounts to 0.30% p.a.. The L&G Longer Dated All Commodities UCITS ETF is the largest ETF that tracks the Bloomberg Commodity 3 Month Forward index. The ETF replicates the performance of the underlying index synthetically with a swap. The L&G Longer Dated All Commodities UCITS ETF is a large ETF with 687m Euro assets under management. The ETF was launched on 18 March 2010 and is domiciled in Ireland.;L&G delší datované všechny komodity UCITS ETF se snaží sledovat index Bloomberg Commodity 3 měsíců vpřed. Bloomberg Commodity 3měsíční index index sleduje cenu futures kontraktů na komodity, což představuje následující komoditní odvětví: energie, drahé kovy, průmyslové kovy, hospodářská zvířata a zemědělství. Index je dopředný index, který představuje v budoucnu tři měsíce komoditní index Bloomberg. TER (celkový poměr nákladů) činí 0,30% p.a. L&G delší datované všechny komodity UCITS ETF je největší ETF, který sleduje index Bloomberg Commodity 3 měsíce vpřed. ETF replikuje výkon podkladového indexu synteticky s výměnou. L&G déle datoval všechny komodity UCITS ETF je velký ETF s managementem 687 m euro. ETF byl spuštěn 18. března 2010 a je se sídlem v Irsku.;0.30%;0.3;EUR 687m;687.0;EUR;USD;Ireland;Legal & General (LGIM);18 March 2010;;;Synthetic (Unfunded swap);UCITS;;Commodities, Broad market;;USD    Currency risk  Currency;1;Komodity;False;Celosvětově;;4.43;-9.46;81.56;-4.38;3.2;-4.6;-7.66;43.78;26.5;-10.52;12.58;43.73;14.05;13.16;15.25;0.32;-0.25;0.83;-14.84;-18.68;-22.77;-48.28;;;;;Extracted (method 1);ETL2;0;;;;;;;2025-09-21T22:10:50.657880;success;0;;;;;;;;;;;;;;;;;;;;;;;;;;;;;;;;;;;;;;;;;;;;;;;;;;;;;;;;;;;;;;;;;;;;;;;;;;;;;;;;;;;;;;;;;;;;;;;;;;;;;3;50;12;10;15;5;8
IE00B4WXJD03;iShares MSCI Pacific ex-Japan UCITS ETF (Dist);https://www.justetf.com/en/etf-profile.html?isin=IE00B4WXJD03;The iShares MSCI Pacific ex-Japan UCITS ETF (Dist) seeks to track the MSCI Pacific ex Japan index. The MSCI Pacific index tracks the equity markets of the developed markets in the Pacific region excluding Japan (Australia, Hong Kong, Singapore and New Zealand). The ETF's TER (total expense ratio) amounts to 0.60% p.a.. The ETF replicates the performance of the underlying index by full replication (buying all the index constituents). The dividends in the ETF are distributed to the investors (Quarterly). The iShares MSCI Pacific ex-Japan UCITS ETF (Dist) has 202m Euro assets under management. The ETF was launched on 17 April 2009 and is domiciled in Ireland.;Ishares MSCI Pacific Ex-Japan UCITS ETF (dist) se snaží sledovat index japonského indexu MSCI Pacific. Index MSCI Pacific index sleduje akciové trhy rozvinutých trhů v oblasti Pacifiku s výjimkou Japonska (Austrálie, Hongkong, Singapur a Nový Zéland). TER (celkový poměr nákladů) ETF činí 0,60% p.a. ETF replikuje výkon podkladového indexu plnou replikací (nákup všech složek indexu). dividenday v ETF jsou distribuovány investorům (čtvrtletně). Ishares MSCI Pacific Ex-Japan UCITS ETF (DIST) má 202m euro aktiv správy. ETF byla spuštěna 17. dubna 2009 a je bydliště v Irsku.;0.60%;0.6;EUR 202m;202.0;EUR;USD;Ireland;iShares;17 April 2009;Distributing;Quarterly;Physical;UCITS;MSCI Pacific ex-Japan;Equity, Asia Pacific;;USD    Currency risk  Currency;1;Akcie;False;Asie a Pacifik;97.0;7.5;20.27;50.57;5.9;0.92;4.92;9.34;12.83;-0.61;2.21;10.6;300.83;16.11;14.62;14.75;0.47;0.43;0.58;-19.88;-19.88;-19.88;-37.59;;;;;London Stock Exchange;-;8;3.11%;3.11;EUR 1.37;1.37;EUR;method2_regex;2025-09-21T22:10:58.273392;success;0;BHP Group Ltd.;6.2;AIA Group;4.83;CSL Ltd.;4.08;DBS Group Holdings Ltd.;3.8;National Australia Bank Ltd.;3.71;Westpac Banking;3.6;HKEX;3.17;Wesfarmers Ltd.;3.03;Sea Ltd. (Singapore);2.9;;;Australia;9.26;Other;5.54;Japan;0.6;;;;;Financials;42.63;Materials;11.01;Real Estate;7.95;Industrials;7.81;;;London Stock Exchange;GBX;SPXJ;;;;gettex;EUR;EUNJ;;;;Stuttgart Stock Exchange;EUR;EUNJ;;;;Borsa Italiana;EUR;SPXJ;SPXJ IMINAVPXJE;SPXJ.MISPXJEUR.DE;;London Stock Exchange;USD;IPXJ;IPXJ LNINAVPXJU;IPXJ.LSPXJUSD.DE;;London Stock Exchange;GBP;-;SPXJ LNINAVPXJG;SPXJ.LSPXJGBP.DE;;SIX Swiss Exchange;USD;SPXJ;SPXJ SEINAVPXJU;SPXJ.SSPXJUSD.DE;;XETRA;EUR;EUNJ;EUNJ GYINAVPXJU;EUNJ.DESPXJUSD.DE;;;;;;;;;;;;;;3;55;6;5;15;10;19
IE00B4WXJG34;iShares Euro Government Bond 5-7yr UCITS ETF;https://www.justetf.com/en/etf-profile.html?isin=IE00B4WXJG34;The iShares Euro Government Bond 5-7yr UCITS ETF seeks to track the Bloomberg Euro Government Bond 5-7 index. The Bloomberg Euro Government Bond 5-7 index tracks Euro denominated government bonds issued by EMU member states. Time to maturity: 5-7 years. Rating: Investment Grade. The ETF's TER (total expense ratio) amounts to 0.15% p.a.. The iShares Euro Government Bond 5-7yr UCITS ETF is the only ETF that tracks the Bloomberg Euro Government Bond 5-7 index. The ETF replicates the performance of the underlying index by sampling technique (buying a selection of the most relevant index constituents). The interest income (coupons) in the ETF is distributed to the investors (Semi annually). The iShares Euro Government Bond 5-7yr UCITS ETF is a large ETF with 635m Euro assets under management. The ETF was launched on 17 April 2009 and is domiciled in Ireland.;IShares Euro Government dluhopis 5-7yr UCITS ETF se snaží sledovat Bloomberg Euro Government dluhopis 5-7 index. Vládní dluhopis Bloomberg Euro Dluhopis 5-7 indexové sledování euro denominovaných vládních dluhopisů vydaných členskými státy EMU. Čas do zralosti: 5-7 let. Hodnocení: Investiční třída. TER (celkový poměr výdajů) ETF činí 0,15% P.A .. Ishares Euro Government dluhopis 5-7yr UCITS ETF je jediný ETF, který sleduje index vlády Euro Bloomberg Euro 5-7. ETF replikuje výkon základního indexu technikou vzorkování (nákup výběru nejdůležitějších složek indexu). Úrokové výnosy (kupóny) v ETF jsou distribuovány investorům (semifinále každoročně). IShares Euro Government dluhopis 5-7yr UCITS ETF je velký ETF s managementem 635 milionů euro. ETF byla spuštěna 17. dubna 2009 a je bydliště v Irsku.;0.15%;0.15;EUR 635m;635.0;EUR;EUR;Ireland;iShares;17 April 2009;;Semi annually;Physical;UCITS;Government Bond;risk  Long-only    Sustainability  No;;EUR    Currency risk  Currency;1;Dluhopisy;False;Celosvětově;30.0;2.09;7.15;-6.34;1.8;0.18;0.12;2.67;-2.0;-14.91;7.06;2.07;39.95;3.84;5.42;5.19;0.54;0.43;-0.25;-2.89;-5.08;-17.39;-17.39;;;;;Extracted (method 1);EUN9;0;2.68%;2.68;EUR 3.88;3.88;EUR;method2_regex;2025-09-21T22:11:05.703253;success;0;DE0001102507;4.52;DE0001102564;4.14;DE0001102580;3.9;DE0001102531;3.63;;;;;;;;;;;;;France;25.99;Germany;19.62;Other;18.24;Netherlands;4.6;;;IT;16.75;;;;;;;;;;;;;;;;;;;;;;;;;;;;;;;;;;;;;;;;;;;;;;;;;;;;;;;;;;;;;;;;;;;;;4;72;22;10;15;10;15
IE00B4WXJH41;iShares Euro Government Bond 10-15yr UCITS ETF;https://www.justetf.com/en/etf-profile.html?isin=IE00B4WXJH41;The iShares Euro Government Bond 10-15yr UCITS ETF seeks to track the Bloomberg Euro Government Bond 10-15 index. The Bloomberg Euro Government Bond 10-15 index tracks Euro denominated government bonds issued by EMU member states. Time to maturity: 10-15 years. Rating: Investment Grade. The ETF's TER (total expense ratio) amounts to 0.15% p.a.. The iShares Euro Government Bond 10-15yr UCITS ETF is the only ETF that tracks the Bloomberg Euro Government Bond 10-15 index. The ETF replicates the performance of the underlying index by sampling technique (buying a selection of the most relevant index constituents). The interest income (coupons) in the ETF is distributed to the investors (Semi annually). The iShares Euro Government Bond 10-15yr UCITS ETF has 327m Euro assets under management. The ETF was launched on 17 April 2009 and is domiciled in Ireland.;IShares Euro Government dluhopis 10-15yr UCITS ETF se snaží sledovat Bloomberg Euro Government dluhopis 10-15 index. Vládní dluhopis Bloomberg Euro Dluhopis 10-15 indexů sleduje euro denominované vládní dluhopisy vydané členskými státy EMU. Čas do zralosti: 10-15 let. Hodnocení: Investiční třída. TER (celkový poměr nákladů) činí 0,15% P.A .. Ishares Euro Government dluhopis 10-15yr UCITS ETF je jediný ETF, který sleduje index Bloomberg Euro Government dluhopis 10-15. ETF replikuje výkon základního indexu technikou vzorkování (nákup výběru nejdůležitějších složek indexu). Úrokové výnosy (kupóny) v ETF jsou distribuovány investorům (semifinále každoročně). Vládní dluhopis Ishares Euro 10-15yr UCITS ETF má pod správou aktiva 327 milionů euro. ETF byla spuštěna 17. dubna 2009 a je bydliště v Irsku.;0.15%;0.15;EUR 327m;327.0;EUR;EUR;Ireland;iShares;17 April 2009;;Semi annually;Physical;UCITS;Government Bond;risk  Long-only    Sustainability  No;;EUR    Currency risk  Currency;1;Dluhopisy;False;Celosvětově;31.0;-0.4;4.99;-17.87;-0.27;0.19;-0.8;2.64;-4.23;-25.44;10.89;1.6;72.5;6.76;9.58;9.02;-0.06;0.17;-0.43;-6.58;-9.59;-29.67;-29.67;;;;;Extracted (method 1);EUN8;0;3.17%;3.17;EUR 4.70;4.7;EUR;method2_regex;2025-09-21T22:11:13.031544;success;0;IT0003934657;6.03;DE0001135275;5.15;FR0010371401;4.96;IT0004286966;4.83;FR0013234333;4.54;ES0000012932;4.29;DE0001135366;4.16;DE0001102598;3.88;;;;;France;28.25;Germany;15.43;Other;11.74;Netherlands;6.93;;;IT;26.3;;;;;;;;;;;;;;;;;;;;;;;;;;;;;;;;;;;;;;;;;;;;;;;;;;;;;;;;;;;;;;;;;;;;;3;62;22;5;15;10;10
IE00B4WXJJ64;iShares Core Euro Government Bond UCITS ETF (Dist);https://www.justetf.com/en/etf-profile.html?isin=IE00B4WXJJ64;The iShares Core Euro Government Bond UCITS ETF (Dist) seeks to track the Bloomberg Euro Treasury Bond index. The Bloomberg Euro Treasury Bond index tracks Euro denominated government bonds issued by members of the eurozone. All maturities are included. Rating: Investment Grade. The ETF's TER (total expense ratio) amounts to 0.07% p.a.. The iShares Core Euro Government Bond UCITS ETF (Dist) is the cheapest and largest ETF that tracks the Bloomberg Euro Treasury Bond index. The ETF replicates the performance of the underlying index by sampling technique (buying a selection of the most relevant index constituents). The interest income (coupons) in the ETF is distributed to the investors (Semi annually). The iShares Core Euro Government Bond UCITS ETF (Dist) is a very large ETF with 5,125m Euro assets under management. The ETF was launched on 17 April 2009 and is domiciled in Ireland.;IShares Core Euro Government Bond UCITS ETF (DIST) se snaží sledovat index Bloomberg Euro Treasury Bond. Index Bloomberg Euro Treasury Bond sleduje vládní dluhopisy vydané členy eurozóny. Zahrnuty jsou všechna splatností. Hodnocení: Investiční třída. TER (celkový poměr nákladů) činí 0,07% P.A .. Ishares Core Euro Government Bond UCITS ETF (Dist) je nejlevnější a největší ETF, který sleduje index Treasury Bloomberg Euro Treasury Bond. ETF replikuje výkon základního indexu technikou vzorkování (nákup výběru nejdůležitějších složek indexu). Úrokové výnosy (kupóny) v ETF jsou distribuovány investorům (semifinále každoročně). IShares Core Euro Government Bond UCITS ETF (DIST) je velmi velký ETF s 5 125 miliony euro. ETF byla spuštěna 17. dubna 2009 a je bydliště v Irsku.;0.07%;0.07;EUR 5125m;5125.0;EUR;EUR;Ireland;iShares;17 April 2009;Distributing;Semi annually;Physical;UCITS;Government Bond;Bonds, EUR, Europe, Government, All maturities;;EUR    Currency risk  Currency;1;Dluhopisy;False;Evropa;514.0;0.4;4.02;-12.98;0.07;0.1;-0.59;1.73;-3.51;-18.5;7.04;1.75;41.87;4.39;6.35;6.13;0.09;0.21;-0.45;-4.03;-6.87;-22.56;-22.56;;;;;Extracted (method 1);EUNH;0;2.32%;2.32;EUR 2.55;2.55;EUR;method2_regex;2025-09-21T22:11:19.789101;success;0;FR0013286192;0.8;FR0011317783;0.79;FR0012993103;0.78;FR0013341682;0.75;FR0013407236;0.71;;;;;;;;;;;Other;33.16;France;22.02;Germany;14.42;;;;;;;;;;;;;;;;;;;;;;;;;;;;;;;;;;;;;;;;;;;;;;;;;;;;;;;;;;;;;;;;;;;;;;;;;;;5;77;26;16;15;10;10
IE00B4X9L533;HSBC MSCI World UCITS ETF USD;https://www.justetf.com/en/etf-profile.html?isin=IE00B4X9L533;The HSBC MSCI World UCITS ETF USD seeks to track the MSCI World index. The MSCI World index tracks stocks from 23 developed countries worldwide. The ETF's TER (total expense ratio) amounts to 0.15% p.a.. The ETF replicates the performance of the underlying index by sampling technique (buying a selection of the most relevant index constituents). The dividends in the ETF are distributed to the investors (Quarterly). The HSBC MSCI World UCITS ETF USD is a very large ETF with 11,404m Euro assets under management. The ETF was launched on 8 December 2010 and is domiciled in Ireland.;Svět HSBC MSCI World UCITS ETF USD se snaží sledovat světový index MSCI. Světový index MSCI sleduje akcie z 23 rozvinutých zemí po celém světě. TER (celkový poměr výdajů) ETF činí 0,15% p.a. ETF replikuje výkon základního indexu technikou vzorkování (nákup výběru nejdůležitějších složek indexu). dividenday v ETF jsou distribuovány investorům (čtvrtletně). HSBC MSCI World UCITS ETF USD je velmi velký ETF s spravováním 11 404 milionů euro. ETF byl spuštěn 8. prosince 2010 a je bydliště v Irsku.;0.15%;0.15;EUR 11404m;11404.0;EUR;USD;Ireland;HSBC ETF;8 December 2010;;Quarterly;Physical;UCITS;MSCI World;Equity, World;;USD    Currency risk  Currency;1;Akcie;False;Celosvětově;1290.0;11.72;48.41;97.82;3.27;2.55;7.89;8.2;32.31;-13.03;19.81;26.22;406.01;16.92;14.92;15.13;0.69;0.94;0.97;-20.46;-20.46;-20.46;-33.78;;;;;London Stock Exchange;-;9;1.35%;1.35;EUR 0.49;0.49;EUR;method2_regex;2025-09-21T22:11:26.235874;success;0;Microsoft;4.94;Apple;4.09;Amazon.com, Inc.;2.93;Meta Platforms;2.21;Broadcom;1.72;Alphabet, Inc. A;1.47;Alphabet, Inc. C;1.27;Tesla;1.16;JPMorgan Chase & Co.;1.1;;;United States;69.12;Other;19.28;Japan;5.3;United Kingdom;3.51;Canada;2.79;Technology;28.55;Financials;14.6;Industrials;10.52;Consumer Discretionary;10.33;;;London Stock Exchange;GBX;HMWO;;;;gettex;EUR;H4ZJ;;;;Stuttgart Stock Exchange;EUR;H4Z3;;;;Borsa Italiana;EUR;HMWD;HMWD IMHMWOEURI;HMWD.MIHMWOINAVEUR=HSBL;;Euronext Paris;EUR;WRD;WRD FPHMWOEURI;WRD.PAHMWOINAVEUR=HSBL;;London Stock Exchange;USD;HMWD;HMWD LNHMWOUSDI;HMWD.LHMWOINAVUSD=HSBL;;London Stock Exchange;GBP;-;HMWO LNHMWOGBPI;HMWO.LHMWOINAVGBP=HSBL;;SIX Swiss Exchange;USD;HMWO;HMWO SWHMWOUSDI;HMWO.SHMWOINAVUSD=HSBL;;XETRA;EUR;H4ZJ;H4ZJ GYHMWOEURI;H4ZJ.DEHMWOINAVEUR=HSBL;;;;;;;;5;79;22;19;13;5;20
IE00B4YBJ215;SPDR S&P 400 U.S. Mid Cap UCITS ETF USD Unhedged (Acc);https://www.justetf.com/en/etf-profile.html?isin=IE00B4YBJ215;The SPDR S&P 400 U.S. Mid Cap UCITS ETF USD Unhedged (Acc) seeks to track the S&P MidCap 400 index. The S&P MidCap 400 index tracks 400 mid-sized US companies. The ETF's TER (total expense ratio) amounts to 0.30% p.a.. The SPDR S&P 400 U.S. Mid Cap UCITS ETF USD Unhedged (Acc) is the cheapest and largest ETF that tracks the S&P MidCap 400 index. The ETF replicates the performance of the underlying index by full replication (buying all the index constituents). The dividends in the ETF are accumulated and reinvested in the ETF. The SPDR S&P 400 U.S. Mid Cap UCITS ETF USD Unhedged (Acc) is a very large ETF with 3,719m Euro assets under management. The ETF was launched on 30 January 2012 and is domiciled in Ireland.;SPDR S&P 400 US Mid Cap UCITS ETF USD Unredged (ACC) se snaží sledovat index S&P MidCap 400. Index S&P MidCap 400 sleduje 400 středně velkých amerických společností. TER (celkový poměr výdajů) ETF činí 0,30% P.A .. SPDR S&P 400 Mid Cap UCITS ETF USD Unredged (ACC) je nejlevnější a největší ETF, který sleduje index S&P MIDCAP 400. ETF replikuje výkon podkladového indexu plnou replikací (nákup všech složek indexu). dividenday v ETF jsou akumulovány a reinvestovány do ETF. SPDR S&P 400 US Mid Cap UCITS ETF USD Unredged (ACC) je velmi velký ETF s managementem 3 719 milionů euro. ETF byl spuštěn 30. ledna 2012 a je se sídlem v Irsku.;0.30%;0.3;EUR 3719m;3719.0;EUR;USD;Ireland;SPDR ETF;30 January 2012;Accumulating;;Physical;UCITS;;Equity, United States, Mid Cap;;USD    Currency risk  Currency;1;Akcie;False;Severní Amerika;401.0;0.62;19.37;85.67;-6.42;2.47;6.22;2.48;34.46;-8.28;11.76;20.47;346.25;22.58;20.25;20.56;0.03;0.3;0.64;-27.31;-27.31;-27.31;-41.98;;;;;Bolsa Mexicana de Valores;-;9;;;;;;;2025-09-21T22:11:32.214322;success;0;EMCOR Group;0.95;Comfort Systems USA;0.84;RB Global;0.68;Casey's General Stores;0.65;US Foods;0.65;Flex Ltd;0.65;Guidewire Software;0.64;Curtiss-Wright;0.63;Pure Storage;0.62;;;United States;92.21;Other;5.38;United Kingdom;1.31;USA;0.84;;;Industrials;21.38;Financials;16.94;Consumer Discretionary;12.71;Technology;12.61;;;gettex;EUR;SPY4;;;;Stuttgart Stock Exchange;EUR;SPY4;;;;Bolsa Mexicana de Valores;MXN;-;SPY4N MM;SPY4N.MXINSPY4.ivOQ;;Borsa Italiana;EUR;SPY4;SPY4 IMINSPY4E;SPY4.MIINSPY4.ivOQ;;Euronext Paris;EUR;SPY4;SPY4 FPINSPY4E;SPY4.PAINSPY4.ivOQ;;London Stock Exchange;USD;SPY4;SPY4 LNINSPY4;SPY4.LINSPY4.ivOQ;;London Stock Exchange;GBP;SPX4;SPX4 LNINSPY4P;SPX4.L;;SIX Swiss Exchange;CHF;SPY4;SPY4 SEINSPY4C;SPY4.SINSPY4.ivOQ;;XETRA;EUR;SPY4;SPY4 GYINSPY4E;SPY4.DEINSPY4.ivOQ;;;;;;;;4;66;12;13;13;10;18
