IE000LKGEZQ6;Invesco BulletShares 2028 EUR Corporate Bond UCITS ETF Dist;https://www.justetf.com/en/etf-profile.html?isin=IE000LKGEZQ6;The Invesco BulletShares 2028 EUR Corporate Bond UCITS ETF Dist seeks to track the Bloomberg 2028 Maturity EUR Corporate Bond Screened index. The Bloomberg 2028 Maturity EUR Corporate Bond Screened index tracks EUR denominated corporate bonds. The index does not reflect a constant maturity range (as is the case with most other bond indices). Instead, only bonds that mature during the designated year (here: 2028) are included in the index. The index consists of ESG (environmental, social and governance) screened corporate bonds. Rating: Investment Grade. Maturity: December 2028 (the ETF will be closed afterwards). The ETF's TER (total expense ratio) amounts to 0.10% p.a.. The Invesco BulletShares 2028 EUR Corporate Bond UCITS ETF Dist is the cheapest ETF that tracks the Bloomberg 2028 Maturity EUR Corporate Bond Screened index. The ETF replicates the performance of the underlying index by sampling technique (buying a selection of the most relevant index constituents). The interest income (coupons) in the ETF is distributed to the investors (Quarterly). The Invesco BulletShares 2028 EUR Corporate Bond UCITS ETF Dist is a very small ETF with 2m Euro assets under management. The ETF was launched on 18 June 2024 and is domiciled in Ireland.;Invesco Bulletshares 2028 EUR Corporate Bond UCITS ETF Dist se snaží sledovat index Bloomberg 2028 Eur Corporate Bond. Společnost Bloomberg 2028 EUR EUR Corporate Bond prověřila indexové stopy EUR denominované firemní dluhopisy. Index neodráží konstantní rozsah zralosti (jako je tomu u většiny ostatních indexů Bond). Místo toho jsou do indexu zahrnuty pouze vazby, které dozrávají během určeného roku (zde: 2028). Index se skládá z ESG (environmentální, sociální a správa věcí veřejných) promítaných firemních dluhopisů. Hodnocení: Investiční třída. Dospívání: Prosinec 2028 (ETF bude poté uzavřen). TER (celkový poměr nákladů) ETF činí 0,10% P.A .. Invesco Bulletshares 2028 EUR Corporate Bond UCITS ETF DIST je nejlevnější ETF, který sleduje index Screening Corporate Bond Bloomberg 2028 EUR EUR. ETF replikuje výkon základního indexu technikou vzorkování (nákup výběru nejdůležitějších složek indexu). Úrokové výnosy (kupóny) v ETF jsou distribuovány investorům (čtvrtletně). Invesco Bulletshares 2028 EUR Corporate Bond UCITS ETF Dist je velmi malý ETF s managementem 2m euro. ETF byl spuštěn 18. června 2024 a má bydliště v Irsku.;0.10%;0.1;EUR 2m;2.0;EUR;EUR;Ireland;Invesco;18 June 2024;Distributing;Quarterly;Physical;;;;Yes;Dluhopisy;False;Globální;67.0;4.25;;;2.81;2.07;;;2.05;;;-1.25;;;-1.25;;;;;Extracted (method 1);BE28;0;3.22%;3.22;EUR 0.17;0.17;EUR;method2_regex;2025-09-19T07:58:05.123627;success;0;XS2572496623;1.79;XS2713671043;1.77;XS2613658710;1.77;XS2696046460;1.76;XS2621007231;1.73;XS2575952697;1.72;XS2618906585;1.72;;;;;;;Other;100.0;;;;;;;;;IT;2.81;;;;;;;;;;;;;;;;;;;;;;;;;;;;;;;;;;;;;;;;;;;;;
IE000LOSV2D0;Xtrackers USA Biodiversity Focus SRI UCITS ETF 1C 1C;https://www.justetf.com/en/etf-profile.html?isin=IE000LOSV2D0;The Xtrackers USA Biodiversity Focus SRI UCITS ETF 1C 1C seeks to track the ISS STOXX® US Biodiversity Focus SRI index. The ISS STOXX® US Biodiversity Focus SRI index tracks US stocks. Securities are selected according to sustainability criteria with a focus on biodiversity. The ETF's TER (total expense ratio) amounts to 0.30% p.a.. The Xtrackers USA Biodiversity Focus SRI UCITS ETF 1C 1C is the only ETF that tracks the ISS STOXX® US Biodiversity Focus SRI index. The ETF replicates the performance of the underlying index by full replication (buying all the index constituents). The dividends in the ETF are accumulated and reinvested in the ETF. The Xtrackers USA Biodiversity Focus SRI UCITS ETF 1C 1C is a very small ETF with 9m Euro assets under management. The ETF was launched on 26 September 2023 and is domiciled in Ireland.;The Xtrackers USA Biodiversity Focus SRI UCITS ETF 1C 1C se snaží sledovat index ISS Stoxx® US Biodiversity Focus SRI. ISS Stoxx® US Biodiversity Focus SRI Index sleduje americké akciíy. Cenné papíry jsou vybírány podle kritérií udržitelnosti se zaměřením na biologickou rozmanitost. Ter (celkový poměr nákladů) ETF činí 0,30% p.a. Xtrackers USA Biodiversity Focus Sri UCITS ETF 1C 1C je jediný ETF, který sleduje index biologické rozmanitosti ISS Stoxx® US Biodiversity Focus SRI. ETF replikuje výkon podkladového indexu plnou replikací (nákup všech složek indexu). dividenday v ETF jsou akumulovány a reinvestovány do ETF. Biodiverzita Xtrackers USA Focus Sri UCITS ETF 1C 1C je velmi malá ETF s spravováním 9m euro. ETF byl spuštěn 26. září 2023 a je sídlí v Irsku.;0.30%;0.3;EUR 9m;9.0;EUR;USD;Ireland;Xtrackers;26 September 2023;;;Physical;;;;Yes;Ostatní;False;US;254.0;8.82;;;-1.09;19.73;;;0.45;;;-22.42;;;-22.42;;;;;gettex;XBUZ;3;;;;;;;2025-09-19T07:58:10.574727;success;0;Microsoft;8.21;Apple;8.04;JPMorgan Chase & Co.;3.54;Visa;2.55;Netflix;2.1;Mastercard, Inc.;1.94;Eli Lilly & Co.;1.92;Home Depot;1.54;Bank of America Corp.;1.41;;;United States;94.16;Other;3.53;;;;;;;Technology;46.61;Financials;14.17;Health Care;12.56;Consumer Discretionary;8.15;;;gettex;EUR;XBUZ;;;;London Stock Exchange;USD;XBUZ;XBUZ LNXBUZEUIV;XBUZ.LI8NZINAV.DE;;XETRA;EUR;XBUZ;XBUZ GYXBUZCHIV;XBUZ.DEI8N0INAV.DE;;;;;;;;;;;;;;;;;;;;
IE000LRRPK60;WisdomTree Global Quality Dividend Growth UCITS ETF GBP Hedged Dist;https://www.justetf.com/en/etf-profile.html?isin=IE000LRRPK60;The WisdomTree Global Quality Dividend Growth UCITS ETF GBP Hedged Dist seeks to track the WisdomTree Global Developed Quality Dividend Growth (GBP Hedged) index. The WisdomTree Global Developed Quality Dividend Growth (GBP Hedged) index tracks dividend-paying developed markets stocks with growth characteristics. The stocks included are filtered according to ESG criteria (environmental, social and corporate governance). The index is a fundamentally weighted index. Currency hedged to British Pound (GBP). The ETF's TER (total expense ratio) amounts to 0.43% p.a.. The ETF replicates the performance of the underlying index by sampling technique (buying a selection of the most relevant index constituents). The dividends in the ETF are distributed to the investors (Quarterly). The WisdomTree Global Quality Dividend Growth UCITS ETF GBP Hedged Dist is a very small ETF with 2m Euro assets under management. The ETF was launched on 20 March 2023 and is domiciled in Ireland.;Růst dividenda WisdomTree Global Quality dividenda UCITS ETF GBP Hedged Dist se snaží sledovat index dividenda WisdomTree Global Během rozvinutého růstu kvality (GBP Hedged). Indexový indexový růst dividenda WisdomTree Global vyvinul indexový růst kvality dividenda, který vyvinul trhy s růstovými charakteristikami. Zahrnuté akcie jsou filtrovány podle kritérií ESG (environmentální, sociální a správa a společností). Index je zásadně vážený index. Měna zajišťovala britskou libru (GBP). ETF TER (celkový poměr nákladů) činí 0,43% p.a. ETF replikuje výkon základního indexu technikou vzorkování (nákup výběru nejdůležitějších složek indexu). dividenday v ETF jsou distribuovány investorům (čtvrtletně). Růst dividenda WisdomTree Global Quality dividenda UCITS ETF GBP Hedged Dist je velmi malý ETF s managementem 2m euro. ETF byl spuštěn 20. března 2023 a je bydliště v Irsku.;0.43%;0.43;EUR 2m;2.0;EUR;GBP;Ireland;WisdomTree;20 March 2023;Distributing;Quarterly;Physical;;;Equity, World,;Yes;Akcie;False;Globální;532.0;4.45;;;3.21;14.79;;;0.3;;;-18.34;;;-18.34;;;;;London Stock Exchange;GGRB;2;1.24%;1.24;EUR 0.29;0.29;EUR;method2_regex;2025-09-19T07:58:19.576969;success;0;Apple;3.34;AbbVie, Inc.;2.55;NVIDIA Corp.;2.18;Procter & Gamble Co.;2.13;Novartis AG;2.11;The Coca-Cola Co.;2.03;Roche Holding AG;2.02;Walmart, Inc.;1.98;Home Depot;1.96;;;United States;58.46;Other;23.88;Switzerland;7.24;Japan;5.74;Germany;4.68;Technology;23.9;Industrials;16.94;Health Care;16.44;Consumer Staples;11.65;;;London Stock Exchange;GBX;GGRB;;;;London Stock Exchange;GBP;GGRB;GGRB LN;GGRB.L;;;;;;;;;;;;;;;;;;;;;;;;;;
IE000LSFKN16;Janus Henderson Global High Yield Fallen Angels Paris-aligned Climate Core UCITS ETF GBP-Hedged Dist.;https://www.justetf.com/en/etf-profile.html?isin=IE000LSFKN16;The Janus Henderson Global High Yield Fallen Angels Paris-aligned Climate Core UCITS ETF GBP-Hedged Dist. seeks to track the Bloomberg MSCI Global Corporate Fallen Angels Paris-Aligned (GBP Hedged) index. The Bloomberg MSCI Global Corporate Fallen Angels Paris-Aligned (GBP Hedged) index tracks global high yield corporate bonds that have been downgraded from investment grade. The index consists of ESG (environmental, social and governance) screened corporate bonds. The index aims to reduce greenhouse gas intensity by at least 50 percent compared to the investment universe and by an average of at least 7 per cent per year. Rating: Sub-Investment Grade. Currency hedged to British Pound (GBP). The ETF's TER (total expense ratio) amounts to 0.55% p.a.. The ETF replicates the performance of the underlying index by sampling technique (buying a selection of the most relevant index constituents). The interest income (coupons) in the ETF is distributed to the investors (Semi annually). The Janus Henderson Global High Yield Fallen Angels Paris-aligned Climate Core UCITS ETF GBP-Hedged Dist. is a very small ETF with 8m Euro assets under management. The ETF was launched on 25 July 2023 and is domiciled in Ireland.;Janus Henderson Global s vysokým výnosem Fallen Angels Pařížské klimatické jádro UCITS ETF GBP-Hedged Dist. usiluje o sledování indexu Bloomberg MSCI Global Corporate Fallen Angels Paris-vyrovnané (GBP Hedged). Index indexu Bloomberg MSCI Global Fallen Angels Paris-vyrovnaný (GBP Hedged) Globální podnikové dluhopisy s vysokým výnosem, které byly sníženy z investiční třídy. Index se skládá z ESG (environmentální, sociální a správa věcí veřejných) promítaných firemních dluhopisů. Cílem indexu je snížit intenzitu skleníkových plynů nejméně o 50 procent ve srovnání s investičním vesmírem a v průměru nejméně 7 % ročně. Hodnocení: stupeň sub-investice. Měna zajišťovala britskou libru (GBP). TER (celkový poměr nákladů) ETF činí 0,55% p.a. ETF replikuje výkon základního indexu technikou vzorkování (nákup výběru nejdůležitějších složek indexu). Úrokové výnosy (kupóny) v ETF jsou distribuovány investorům (semifinále každoročně). Janus Henderson Global s vysokým výnosem Fallen Angels Pařížské klimatické jádro UCITS ETF GBP-Hedged Dist. je velmi malý ETF s managementem 8m euro. ETF byl spuštěn 25. července 2023 a je sídlem v Irsku.;0.55%;0.55;EUR 8m;8.0;EUR;GBP;Ireland;;25 July 2023;Distributing;Semi annually;Physical;;;;Yes;Dluhopisy;False;Globální;;4.21;;;2.67;8.47;;;0.5;;;-8.25;;;-8.25;;;;;Extracted (method 1);TFGD;0;5.97%;5.97;EUR 0.71;0.71;EUR;method2_regex;2025-09-19T07:58:24.784799;success;0;;;;;;;;;;;;;;;;;;;;;;;;;;;;;;;;;;;;;;;;;;;;;;;;;;;;;;;;;;;;;;;;;;;;;;;;;;;;;
IE000LSRKCB4;Global X S&P 500 Quarterly Buffer UCITS ETF USD Accumulating;https://www.justetf.com/en/etf-profile.html?isin=IE000LSRKCB4;The Global X S&P 500 Quarterly Buffer UCITS ETF USD Accumulating seeks to track the Cboe S&P 500 15% WHT Quarterly 5% Buffer Protect index. The Cboe S&P 500 15% WHT Quarterly 5% Buffer Protect index tracks the performance of the S&P 500 while using put options in an attempt to buffer investors against the first 5% of losses each quarter. The buffer strategy comes with the drawback that possible value gains are capped. The ETF's TER (total expense ratio) amounts to 0.50% p.a.. The Global X S&P 500 Quarterly Buffer UCITS ETF USD Accumulating is the only ETF that tracks the Cboe S&P 500 15% WHT Quarterly 5% Buffer Protect index. The ETF replicates the performance of the underlying index synthetically with a swap. The dividends in the ETF are accumulated and reinvested in the ETF. The Global X S&P 500 Quarterly Buffer UCITS ETF USD Accumulating is a small ETF with 29m Euro assets under management. The ETF was launched on 21 February 2023 and is domiciled in Ireland.;Globální čtvrtletní vyrovnávací paměť X S&P 500 UCITS ETF USD se snaží sledovat index CBOE S&P 500 15% WHT čtvrtletně 5%. Index CBOE S&P 500 15% WHT čtvrtletní 5% index chrání vyrovnávací paměti S&P 500 při pokusu o vyrovnávání investorů proti prvním 5% ztrát v každé čtvrtině. Strategie vyrovnávací paměti přichází s nevýhodou, že jsou omezeny možné zvýšení hodnoty. TER (celkový poměr nákladů) činí 0,50% p.a. ETF replikuje výkon podkladového indexu synteticky s výměnou. dividenday v ETF jsou akumulovány a reinvestovány do ETF. Global X S&P 500 čtvrtletní vyrovnávací paměť UCITS ETF USD akumulace je malý ETF s managementem 29 milionů euro. ETF byl spuštěn 21. února 2023 a má bydliště v Irsku.;0.50%;0.5;EUR 29m;29.0;EUR;USD;Ireland;;21 February 2023;Accumulating;;Synthetic (Unfunded swap);;S&P 500;Equity, United States, Buffer;;Akcie;False;US;;5.98;;;-4.14;13.02;;;0.46;;;-16.13;;;-16.13;;;;;Borsa Italiana;-;7;;;;;;;2025-09-19T07:58:30.389992;success;0;;;;;;;;;;;;;;;;;;;;;;;;;;;;;;;;;;;;;;;;;Borsa Italiana;EUR;SPQB;;;;gettex;EUR;SPQB;;;;Borsa Italiana;EUR;-;SPQBEUIV;SPQB.MI;;London Stock Exchange;USD;SPQB;SPQB LNSPQBUSIV;SPQB.L;;London Stock Exchange;GBP;SQBP;SQBP LNSPQBGBIV;SQBP.L;;;;;;;;
IE000LTA2082;Amundi S&P Global Industrials ESG UCITS ETF DR EUR (A);https://www.justetf.com/en/etf-profile.html?isin=IE000LTA2082;The Amundi S&P Global Industrials ESG UCITS ETF DR EUR (A) seeks to track the S&P Developed Ex-Korea LargeMidCap Sustainability Enhanced Industrials index. The S&P Developed Ex-Korea LargeMidCap Sustainability Enhanced Industrials index tracks the industrials sector. The stocks included are filtered according to ESG criteria (environmental, social and corporate governance). The ETF's TER (total expense ratio) amounts to 0.18% p.a.. The Amundi S&P Global Industrials ESG UCITS ETF DR EUR (A) is the cheapest and largest ETF that tracks the S&P Developed Ex-Korea LargeMidCap Sustainability Enhanced Industrials index. The ETF replicates the performance of the underlying index by full replication (buying all the index constituents). The dividends in the ETF are accumulated and reinvested in the ETF. The Amundi S&P Global Industrials ESG UCITS ETF DR EUR (A) has 342m Euro assets under management. The ETF was launched on 20 September 2022 and is domiciled in Ireland.;Amundi S&P Global Industrials ESG UCITS ETF Dr. EUR (A) se snaží sledovat S&P vyvinutý ex-korea largemidcap udržitelnost vylepšená průmyslová index. S&P vyvinula ex-korea largemidcap udržitelnost vylepšená průmyslová index index sleduje průmyslový sektor. Zahrnuté akcie jsou filtrovány podle kritérií ESG (environmentální, sociální a správa a společností). TER (celkový poměr nákladů) činí 0,18% P.A. ETF replikuje výkon podkladového indexu plnou replikací (nákup všech složek indexu). dividenday v ETF jsou akumulovány a reinvestovány do ETF. Amundi S&P Global Industrials ESG UCITS ETF Dr. EUR (A) má ve správě aktiv 342 mil. EUR. ETF byla zahájena 20. září 2022 a je v Irsku bydliště.;0.18%;0.18;EUR 342m;342.0;EUR;EUR;Ireland;Amundi;20 September 2022;;;Physical;;;;Yes;Akcie;False;Globální;202.0;9.93;;;4.98;15.22;;;0.65;;;-20.04;;;-20.04;;;;;Borsa Italiana;-;6;;;;;;;2025-09-19T07:58:37.572464;success;0;Caterpillar;3.8;Siemens AG;3.53;Uber Technologies, Inc.;3.13;Eaton Corp. Plc;2.58;Schneider Electric SE;2.44;Deere & Co;2.26;Hitachi Ltd.;2.25;Automatic Data Processing;2.21;Union Pacific;2.12;;;United States;43.86;Other;27.8;Japan;15.37;Germany;5.95;;;Technology;3.82;;;;;;;;;Borsa Italiana;EUR;INDGW;;;;gettex;EUR;WELH;;;;Borsa Italiana;EUR;-;INDGW IMIWELH;INDGW.MIIWELHEURINAV=SOLA;;Euronext Paris;EUR;INDW;INDW FPIWELH;LYXINDW.PAIWELHEURINAV=SOLA;;XETRA;USD;WEL0;WEL0 GYWEL0USIV;WELHUSD.DEIWEL0USDINAV=SOLA;;;;;;;;
IE000LUZJNI7;Invesco MSCI Europe Equal Weight UCITS ETF Acc;https://www.justetf.com/en/etf-profile.html?isin=IE000LUZJNI7;The Invesco MSCI Europe Equal Weight UCITS ETF Acc seeks to track the MSCI Europe Equal Weighted index. The MSCI Europe Equal Weighted index tracks European stocks. All constituents are equally weighted. The ETF's TER (total expense ratio) amounts to 0.20% p.a.. The Invesco MSCI Europe Equal Weight UCITS ETF Acc is the cheapest and largest ETF that tracks the MSCI Europe Equal Weighted index. The ETF replicates the performance of the underlying index by full replication (buying all the index constituents). The dividends in the ETF are accumulated and reinvested in the ETF. The Invesco MSCI Europe Equal Weight UCITS ETF Acc has 249m Euro assets under management. The ETF was launched on 4 March 2025 and is domiciled in Ireland.;Invesco MSCI Europe Evropa stejná hmotnost UCITS ETF ACC se snaží sledovat MSCI Evropu stejný vážený index. MSCI Europe Evropa se rovná váženého indexu sleduje evropské akcie. Všechny složky jsou stejně váženy. TER (celkový poměr výdajů) ETF činí 0,20% p.a. Invesco MSCI Europe Evropa stejná hmotnost UCITS ETF ACC je nejlevnější a největší ETF, který sleduje MSCI Evropu stejný vážený index. ETF replikuje výkon podkladového indexu plnou replikací (nákup všech složek indexu). dividenday v ETF jsou akumulovány a reinvestovány do ETF. Invesco MSCI Europe Evropa stejná hmotnost UCITS ETF ACC má ve správě aktiv 249 milionů EUR. ETF byla zahájena 4. března 2025 a je v Irsku bydliště.;0.20%;0.2;EUR 249m;249.0;EUR;EUR;Ireland;Invesco;4 March 2025;Accumulating;;Physical;;MSCI Europe;Equity, Europe, Equal Weighted;;Akcie;False;Evropa;402.0;;;;;;;;;;;;;;-14.17;;;;;Borsa Italiana;MEEQ;4;;;;;;;2025-09-19T07:58:44.708089;success;0;Grifols SA;0.36;Barry Callebaut;0.36;Wärtsilä Oyj Abp;0.34;Entain;0.34;Siemens Energy AG;0.34;Rolls-Royce Holdings;0.33;Evolution AB;0.33;Galderma Group;0.33;Prysmian SpA;0.32;;;Other;48.34;United Kingdom;16.64;France;13.01;Germany;12.17;Switzerland;9.84;Industrials;19.62;Financials;19.48;Consumer Discretionary;8.92;Consumer Staples;8.91;;;Borsa Italiana;EUR;MEEQ;MEEQ IMMEEQEU;MEEQ.MIMEEQEU.ivP;;London Stock Exchange;GBX;MEEQ;MEEQ LNMEEQGBIV;MEEQ.LMEEQGBiv.P;;SIX Swiss Exchange;USD;MEEQ;MEEQ SWMEEQUS;MEEQ.SMEEQUS.ivP;;XETRA;EUR;MEEQ;MEEQ GYMEEQEU;MEEQ.DEMEEQEU.ivP;;;;;;;;;;;;;;
IE000LX17BP9;iShares iBonds Dec 2030 Term EUR Corporate UCITS ETF EUR (Dist);https://www.justetf.com/en/etf-profile.html?isin=IE000LX17BP9;The iShares iBonds Dec 2030 Term EUR Corporate UCITS ETF EUR (Dist) seeks to track the Bloomberg MSCI December 2030 Maturity EUR Corporate ESG Screened index. The Bloomberg MSCI December 2030 Maturity EUR Corporate ESG Screened index tracks EUR denominated corporate bonds. The index does not reflect a constant maturity range (as is the case with most other bond indices). Instead, only bonds that mature during the designated year (here: 2030) are included in the index. The index consists of ESG (environmental, social and governance) screened corporate bonds. Rating: Investment Grade. Maturity: December 2030 (the ETF will be closed afterwards). The ETF's TER (total expense ratio) amounts to 0.12% p.a.. The iShares iBonds Dec 2030 Term EUR Corporate UCITS ETF EUR (Dist) is the cheapest and largest ETF that tracks the Bloomberg MSCI December 2030 Maturity EUR Corporate ESG Screened index. The ETF replicates the performance of the underlying index by sampling technique (buying a selection of the most relevant index constituents). The interest income (coupons) in the ETF is distributed to the investors (Quarterly). The iShares iBonds Dec 2030 Term EUR Corporate UCITS ETF EUR (Dist) has 400m Euro assets under management. The ETF was launched on 9 May 2024 and is domiciled in Ireland.;IBONDS ISHARES IBONDS prosinec 2030 TEMNICE EUR CORPORATE UCITS ETF EUR (DIST) se snaží sledovat Bloomberg MSCI prosinec 2030 splatnost EUR Corporate ESG prověřovaný index. Bloomberg MSCI prosinec 2030 splatnost EUR Corporate ESG prověřovala indexové stopy EUR denominované firemní dluhopisy. Index neodráží konstantní rozsah zralosti (jako je tomu u většiny ostatních indexů Bond). Místo toho jsou do indexu zahrnuty pouze pouta, které dozrávají během určeného roku (zde: 2030). Index se skládá z ESG (environmentální, sociální a správa věcí veřejných) promítaných firemních dluhopisů. Hodnocení: Investiční třída. Dospívání: prosinec 2030 (ETF bude poté uzavřen). TER (celkový poměr nákladů) ETF činí 0,12% P.A. IBONDS IBONDS IBONDS prosinec 2030 EUR EUR UCITS ETF EUR (DIST) je nejlevnější a největší ETF, který sleduje Bloomberg MSCI prosinec 2030 EUR EUR EUR ESG Screening Index. ETF replikuje výkon základního indexu technikou vzorkování (nákup výběru nejdůležitějších složek indexu). Úrokové výnosy (kupóny) v ETF jsou distribuovány investorům (čtvrtletně). IBONDS IBONDS IBONDS VÝSTUP 2030 TEMONICE EUR CORPORATE UCITS ETF EUR (DIST) má 400 mil. EUR. ETF byl spuštěn 9. května 2024 a je sídlem v Irsku.;0.12%;0.12;EUR 400m;400.0;EUR;EUR;Ireland;iShares;9 May 2024;Distributing;Quarterly;Physical;;;;Yes;Dluhopisy;False;Globální;272.0;4.6;;;3.15;3.27;;;1.4;;;-2.27;;;-2.27;;;;;Extracted (method 1);30IG;0;3.12%;3.12;EUR 0.16;0.16;EUR;method2_regex;2025-09-19T07:58:50.625978;success;0;XS1843449395;0.78;XS1909186451;0.77;XS2466350993;0.75;XS2625196352;0.71;XS2550881143;0.71;XS2536941656;0.7;XS2676814499;0.7;XS2572996606;0.68;;;;;Other;100.0;;;;;;;;;IT;3.15;;;;;;;;;;;;;;;;;;;;;;;;;;;;;;;;;;;;;;;;;;;;;
IE000LXEN6X4;iShares EURO STOXX 50 ESG UCITS ETF EUR (Acc);https://www.justetf.com/en/etf-profile.html?isin=IE000LXEN6X4;The iShares EURO STOXX 50 ESG UCITS ETF EUR (Acc) seeks to track the EURO STOXX® 50 ESG index. The EURO STOXX® 50 ESG index tracks companies from Eurozone countries. It excludes companies that do not comply with the principles of the UN Global Compact (controversial weapons, tobacco, consumers and producers of fossil energy sources). The ETF's TER (total expense ratio) amounts to 0.10% p.a.. The iShares EURO STOXX 50 ESG UCITS ETF EUR (Acc) is the cheapest ETF that tracks the EURO STOXX® 50 ESG index. The ETF replicates the performance of the underlying index by full replication (buying all the index constituents). The dividends in the ETF are accumulated and reinvested in the ETF. The iShares EURO STOXX 50 ESG UCITS ETF EUR (Acc) is a small ETF with 60m Euro assets under management. The ETF was launched on 26 July 2023 and is domiciled in Ireland.;Ishares Euro Stoxx 50 ESG UCITS ETF EUR (ACC) se snaží sledovat index EURO STOXX® 50 ESG. Index EURO STOXX® 50 ESG sleduje společnosti ze zemí eurozóny. Vylučuje společnosti, které nesplňují zásady globálního kompaktního (kontroverzních zbraní, tabáku, spotřebitelů a výrobců zdrojů energie). TER (celkový poměr nákladů) ETF činí 0,10% P.A. IShares Euro Stoxx 50 ESG UCITS ETF EUR (ACC) je nejlevnější ETF, který sleduje index Euro Stoxx® 50 ESG. ETF replikuje výkon podkladového indexu plnou replikací (nákup všech složek indexu). dividenday v ETF jsou akumulovány a reinvestovány do ETF. Ishares Euro Stoxx 50 ESG UCITS ETF EUR (ACC) je malá ETF s managementem 60 milionů euro. ETF byl spuštěn 26. července 2023 a je sídlem v Irsku.;0.10%;0.1;EUR 60m;60.0;EUR;EUR;Ireland;iShares;26 July 2023;Accumulating;;Physical;;;;Yes;Akcie;False;Evropa;51.0;17.89;;;16.72;17.11;;;1.05;;;-15.45;;;-15.45;;;;;gettex;ES50;3;;;;;;;2025-09-19T07:58:56.599161;success;0;SAP SE;6.87;Siemens AG;4.53;Allianz SE;4.27;Schneider Electric SE;4.19;Banco Santander SA;3.64;Deutsche Telekom AG;3.61;LVMH Moët Hennessy Louis Vuitton SE;3.23;UniCredit SpA;3.21;Iberdrola SA;2.88;;;Germany;31.79;France;31.7;Netherlands;14.14;Other;11.92;;;Financials;28.87;Industrials;17.88;Technology;16.36;Consumer Discretionary;14.34;;;gettex;EUR;ES50;;;;SIX Swiss Exchange;EUR;ES50;;;;XETRA;EUR;ES50;ES50 GY;;;;;;;;;;;;;;;;;;;;;
