IE00BNRQM384;Invesco Nasdaq-100 Swap UCITS ETF Acc;https://www.justetf.com/en/etf-profile.html?isin=IE00BNRQM384;The Invesco Nasdaq-100 Swap UCITS ETF Acc seeks to track the Nasdaq 100® index. The Nasdaq 100® index tracks a selection of 100 stocks chosen from among non-financial stocks listed on the NASDAQ stock exchange. The ETF's TER (total expense ratio) amounts to 0.20% p.a.. The ETF replicates the performance of the underlying index synthetically with a swap. The dividends in the ETF are accumulated and reinvested in the ETF. The Invesco Nasdaq-100 Swap UCITS ETF Acc is a very large ETF with 1,275m Euro assets under management. The ETF was launched on 22 March 2021 and is domiciled in Ireland. Show more Show less;Invesco NASDAQ-100 SWAP UCITS ETF ACC se snaží sledovat index NASDAQ 100®.Index NASDAQ 100® sleduje výběr 100 akcií vybraných z nefinančních akcií uvedených na burze NASDAQ.ETF TER (celkový poměr nákladů) činí 0,20% p.a. ETF replikuje výkon podkladového indexu synteticky s výměnou.dividenday v ETF jsou akumulovány a reinvestovány do ETF.Invesco NASDAQ-100 SWAP UCITS ETF ACC je velmi velký ETF s spravováním 1 275 milionů euro.ETF byl spuštěn 22. března 2021 a je sídlem v Irsku.Ukázat více show méně;0.20%;0.2;EUR 1275m;1275.0;EUR;USD;Ireland;Invesco;22 March 2021;Accumulating;;Synthetic (Unfunded swap);;;Equity, United States, Technology;;Akcie;US;;17.62;75.89;;2.29;24.37;22.28;;0.72;;;-26.5;;;;;;;;Extracted (method 1);EQQX;0;;;;;;;2025-09-16T23:43:28.048838;success;0;;;;;;;;;;;;;;;;;;;;;;;;;;;;;;;;;;;;;;;;;;;;;;;;;;;;;;;;;;;;;;;;;;;;;;
IE00BNTVVR89;HANetf AuAg ESG Gold Mining UCITS ETF;https://www.justetf.com/en/etf-profile.html?isin=IE00BNTVVR89;The HANetf AuAg ESG Gold Mining UCITS ETF seeks to track the Solactive AuAg ESG Gold Mining index. The Solactive AuAg ESG Gold Mining index tracks companies worldwide that are active in the gold and silver mining industry. Only the top 25 companies in the industry according to ESG criteria (environmental, social and corporate governance) are included in the index. All index constituents are equally weighted. The ETF's TER (total expense ratio) amounts to 0.60% p.a.. The HANetf AuAg ESG Gold Mining UCITS ETF is the only ETF that tracks the Solactive AuAg ESG Gold Mining index. The ETF replicates the performance of the underlying index by full replication (buying all the index constituents). The dividends in the ETF are accumulated and reinvested in the ETF. The HANetf AuAg ESG Gold Mining UCITS ETF is a small ETF with 37m Euro assets under management. The ETF was launched on 2 July 2021 and is domiciled in Ireland. Show more Show less;Hanetf AUAG ESG Gold těžba UCITS ETF se snaží sledovat index Solactive AUAG ESG Gold Index.Index Solactive AUAG ESG Gold Index sleduje společnosti po celém světě, které jsou aktivní v odvětví těžby zlata a stříbra.Do indexu je zařazeno pouze 25 nejlepších společností v oboru podle kritérií ESG (environmentální, sociální a správa věcí veřejných).Všechny složky indexu jsou stejně váženy.TER (celkový poměr nákladů) činí 0,60% p.a. HANETF AUAG ESG Gold těžba UCITS ETF je jediným ETF, který sleduje index těžby zlata AUAG ESG.ETF replikuje výkon podkladového indexu plnou replikací (nákup všech složek indexu).dividenday v ETF jsou akumulovány a reinvestovány do ETF.HANTETF AUAG ESG Gold těžba UCITS ETF je malá ETF s managementem 37M EUR.ETF byl spuštěn 2. července 2021 a má bydliště v Irsku.Ukázat více show méně;0.60%;0.6;EUR 37m;37.0;EUR;USD;Ireland;;2 July 2021;;;Physical;;;;Yes;Komodity;Globální;27.0;76.23;152.28;;87.69;31.61;30.62;;2.41;;;-19.54;;;;;;;;Extracted (method 1);ZSG0;7;;;;;;;2025-09-16T23:43:32.515631;success;0;;;;;;;;;;;;;;;;;;;;;Canada;54.57;Other;16.76;United States;12.77;Australia;7.85;United Kingdom;4.05;;;;;;;;;;;London Stock Exchange;GBP;;;;;Six Swiss Exchange;CHF;;;;;XETRA;EUR;;;;;Borsa Italiana;EUR;;;;;gettex;EUR;;;;
IE00BP2C0316;HSBC MSCI Europe Climate Paris Aligned UCITS ETF EUR Acc;https://www.justetf.com/en/etf-profile.html?isin=IE00BP2C0316;The HSBC MSCI Europe Climate Paris Aligned UCITS ETF EUR Acc seeks to track the MSCI Europe Climate Paris Aligned index. The MSCI Europe Climate Paris Aligned index tracks stocks from Europe. The index aims to give greater weight to companies that benefit from the transition to a lower carbon economy. In addition, EU directives on climate protection are taken into account. The parent index is the MSCI Europe. The ETF's TER (total expense ratio) amounts to 0.15% p.a.. The ETF replicates the performance of the underlying index by full replication (buying all the index constituents). The dividends in the ETF are accumulated and reinvested in the ETF. The HSBC MSCI Europe Climate Paris Aligned UCITS ETF EUR Acc is a small ETF with 33m Euro assets under management. The ETF was launched on 5 August 2021 and is domiciled in Ireland. Show more Show less;HSBC MSCI Europe Climate Paris Ampignted UCITS ETF EUR ACC se snaží sledovat index MSCI Europe Paříž.MSCI Europe Climate Paříž sladí indexové akciíy z Evropy.Cílem indexu je poskytnout větší váhu společnostem, které těží z přechodu na nižší uhlíkovou ekonomiku.Kromě toho se berou v úvahu směrnice EU o ochraně klimatu.Index nadřazení je MSCI Evropa.TER (celkový poměr nákladů) ETF činí 0,15% p.a. ETF replikuje výkon podkladového indexu plnou replikací (nákup všech složek indexu).dividenday v ETF jsou akumulovány a reinvestovány do ETF.HSBC MSCI Europe Climate Paris Ambinované UCITS ETF EUR ACC je malý ETF s managementem 33 milionů euro.ETF byl spuštěn 5. srpna 2021 a je sídlem v Irsku.Ukázat více show méně;0.15%;0.15;EUR 33m;33.0;EUR;EUR;Ireland;HSBC;5 August 2021;Accumulating;;Physical;;MSCI Europe;;Yes;Akcie;Evropa;253.0;6.94;40.75;;9.4;14.09;12.93;;0.49;;;-15.77;;;;;;;;Extracted (method 1);HPAE;6;;;;;;;2025-09-16T23:43:37.590976;success;0;;;;;;;;;;;;;;;;;;;;;Other;37.96;Switzerland;17.29;United Kingdom;17.19;France;14.66;Germany;12.9;Financials;23.53;Industrials;20.14;Health Care;12.05;Technology;8.9;;;London Stock Exchange;GBP;;;;;Six Swiss Exchange;CHF;;;;;XETRA;EUR;;;;;Borsa Italiana;EUR;;;;;gettex;EUR;;;;
IE00BP2C1S34;HSBC MSCI USA Climate Paris Aligned UCITS ETF USD Acc;https://www.justetf.com/en/etf-profile.html?isin=IE00BP2C1S34;The HSBC MSCI USA Climate Paris Aligned UCITS ETF USD Acc seeks to track the MSCI USA Climate Paris Aligned index. The MSCI USA Climate Paris Aligned index tracks US stocks. The index aims to give greater weight to companies that benefit from the transition to a lower carbon economy. In addition, EU directives on climate protection are taken into account. The parent index is the MSCI USA. The ETF's TER (total expense ratio) amounts to 0.12% p.a.. The ETF replicates the performance of the underlying index by full replication (buying all the index constituents). The dividends in the ETF are accumulated and reinvested in the ETF. The HSBC MSCI USA Climate Paris Aligned UCITS ETF USD Acc is a small ETF with 32m Euro assets under management. The ETF was launched on 3 August 2021 and is domiciled in Ireland. Show more Show less;HSBC MSCI USA Climate Paris Alignované UCITS ETF USD ACC se snaží sledovat index MSCI USA v Paříži.Indexová index MSCI USA v Paříži sleduje americké akcie.Cílem indexu je poskytnout větší váhu společnostem, které těží z přechodu na nižší uhlíkovou ekonomiku.Kromě toho se berou v úvahu směrnice EU o ochraně klimatu.Index nadřazení je MSCI USA.TER (celkový poměr nákladů) ETF činí 0,12% p.a. ETF replikuje výkon podkladového indexu plnou replikací (nákup všech složek indexu).dividenday v ETF jsou akumulovány a reinvestovány do ETF.HSBC MSCI USA Climate Paris Alignd UCITS ETF USD ACC je malý ETF s managementem 32 milionů euro.ETF byl spuštěn 3. srpna 2021 a je bydliště v Irsku.Ukázat více show méně;0.12%;0.12;EUR 32m;32.0;EUR;USD;Ireland;HSBC;3 August 2021;Accumulating;;Physical;;MSCI USA Climate Paris Aligned  USD Acc;;Yes;Akcie;US;181.0;8.2;44.79;;-3.13;20.88;18.76;;0.39;;;-24.58;;;;;;;;Extracted (method 1);HPAU;7;;;;;;;2025-09-16T23:43:44.529296;success;0;Nvidia;10.42;Microsoft;8.14;Apple;6.0;Amazon;3.98;Tesla;3.32;Meta;3.25;Mastercard;2.52;Alphabet;2.42;;;;;United States;97.57;Other;2.43;;;;;;;Technology;45.01;Consumer Discretionary;10.84;Health Care;10.15;Financials;9.81;;;London Stock Exchange;GBP;;;;;Six Swiss Exchange;CHF;;;;;XETRA;EUR;;;;;Borsa Italiana;EUR;;;;;gettex;EUR;;;;
IE00BP2C1V62;HSBC MSCI World Climate Paris Aligned UCITS ETF;https://www.justetf.com/en/etf-profile.html?isin=IE00BP2C1V62;The HSBC MSCI World Climate Paris Aligned UCITS ETF seeks to track the MSCI World Climate Paris Aligned index. The MSCI World Climate Paris Aligned index tracks stocks from developed countries worldwide. The index aims to give greater weight to companies that benefit from the transition to a lower carbon economy. In addition, EU directives on climate protection are taken into account. The parent index is the MSCI World. The ETF's TER (total expense ratio) amounts to 0.18% p.a.. The HSBC MSCI World Climate Paris Aligned UCITS ETF is the largest ETF that tracks the MSCI World Climate Paris Aligned index. The ETF replicates the performance of the underlying index by full replication (buying all the index constituents). The dividends in the ETF are accumulated and reinvested in the ETF. The HSBC MSCI World Climate Paris Aligned UCITS ETF is a large ETF with 522m Euro assets under management. The ETF was launched on 7 July 2021 and is domiciled in Ireland. Show more Show less;HSBC MSCI World Climate Paris Alignované UCITS ETF se snaží sledovat index MSCI World Climate Paříž.Světový indexový index MSCI World Climate Paříž sleduje akcie z rozvinutých zemí po celém světě.Cílem indexu je poskytnout větší váhu společnostem, které těží z přechodu na nižší uhlíkovou ekonomiku.Kromě toho se berou v úvahu směrnice EU o ochraně klimatu.Rodičovský index je svět MSCI.TER (celkový poměr nákladů) ETF činí 0,18% P.A .. HSBC MSCI World Climate Pařížské uCITS ETF je největší ETF, který sleduje index MSCI World Climate Paříž.ETF replikuje výkon podkladového indexu plnou replikací (nákup všech složek indexu).dividenday v ETF jsou akumulovány a reinvestovány do ETF.HSBC MSCI World Climate Paris Alignted UCITS ETF je velký ETF s spravováním 522 milionů euro.ETF byl spuštěn 7. července 2021 a je sídlí v Irsku.Ukázat více show méně;0.18%;0.18;EUR 522m;522.0;EUR;USD;Ireland;HSBC;7 July 2021;;;Physical;;MSCI World;;Yes;Akcie;Globální;502.0;9.2;43.79;;1.01;16.85;15.33;;0.55;;;-20.57;;;;;;;;Extracted (method 1);HPAW;6;;;;;;;2025-09-16T23:43:51.380108;success;0;Nvidia;6.51;Microsoft;5.53;Apple;4.31;Amazon;2.99;Meta;2.31;Alphabet;1.83;Tesla;1.53;JPMorgan;1.41;;;;;United States;69.02;Other;19.44;Canada;4.19;Japan;3.91;Switzerland;3.44;Technology;33.49;Financials;15.46;Industrials;9.43;Consumer Discretionary;9.35;;;London Stock Exchange;GBP;;;;;Six Swiss Exchange;CHF;;;;;XETRA;EUR;;;;;Borsa Italiana;EUR;;;;;gettex;EUR;;;;
IE00BP2NF958;JPMorgan Japan Research Enhanced Index Equity (ESG) UCITS ETF USD (acc);https://www.justetf.com/en/etf-profile.html?isin=IE00BP2NF958;The JPMorgan Japan Research Enhanced Index Equity (ESG) UCITS ETF USD (acc) is an actively managed ETF. The JP Morgan Japan Research Enhanced Index Equity (ESG) Strategy invests in companies from Japan. This fund seeks to generate a higher return than the MSCI Japan index. In addition, the fund management avoids companies whose ESG performance has a negative impact on operations or whose business practices do not conform to the fund management's standards. The ETF's TER (total expense ratio) amounts to 0.25% p.a.. The dividends in the ETF are accumulated and reinvested in the ETF. The JPMorgan Japan Research Enhanced Index Equity (ESG) UCITS ETF USD (acc) has 295m Euro assets under management. The ETF was launched on 29 March 2022 and is domiciled in Ireland. Show more Show less;JPMorgan Japan Research Enhanced Index Equity (ESG) UCITS ETF USD (ACC) je aktivně spravovaný ETF.Strategie JP Morgan Japan Research Enstex Equity Equity Equity (ESG) investuje do společností z Japonska.Tento fond se snaží generovat vyšší návratnost než index MSCI Japan.Správa fondů se navíc vyhýbá společnostem, jejichž výkonnost ESG má negativní dopad na provoz nebo jejichž obchodní praktiky neodpovídají standardům správy fondů.TER (celkový poměr nákladů) činí 0,25% p.a. dividenday v ETF se nashromáždí a reinvestují do ETF.JPMorgan Japan Research Research Enhanced Index Equity (ESG) UCITS ETF USD (ACC) má 295 milionů euro aktiv.ETF byl spuštěn 29. března 2022 a má bydliště v Irsku.Ukázat více show méně;0.25%;0.25;EUR 295m;295.0;EUR;USD;Ireland;JPMorgan;29 March 2022;Accumulating;;Physical;;;risk  Actively managed    Sustainability  Yes;Yes;Akcie;US;129.0;10.82;40.8;;5.64;23.53;21.49;;0.46;;;-19.91;;;;;;;;Extracted (method 1);JREJ;7;;;;;;;2025-09-16T23:43:59.117563;success;0;;;;;;;;;;;;;;;;;;;;;Japan;98.9;Other;1.1;;;;;;;Industrials;24.56;Consumer Discretionary;17.76;Financials;16.41;Technology;12.62;;;London Stock Exchange;GBP;;;;;Frankfurt Stock Exchange;EUR;;;;;Six Swiss Exchange;CHF;;;;;XETRA;EUR;;;;;Borsa Italiana;EUR;;;;
IE00BP3QZ601;iShares Edge MSCI World Quality Factor UCITS ETF (Acc);https://www.justetf.com/en/etf-profile.html?isin=IE00BP3QZ601;The iShares Edge MSCI World Quality Factor UCITS ETF (Acc) seeks to track the MSCI World Sector Neutral Quality index. The MSCI World Sector Neutral Quality index tracks stocks with a high quality factor from 23 developed countries worldwide. The constituents are selected by three main equally weighted indicators of whether a company is demonstrating high quality characteristics: high return on equity, low leverage and stable earnings growth. The ETF's TER (total expense ratio) amounts to 0.25% p.a.. The iShares Edge MSCI World Quality Factor UCITS ETF (Acc) is the cheapest and largest ETF that tracks the MSCI World Sector Neutral Quality index. The ETF replicates the performance of the underlying index by sampling technique (buying a selection of the most relevant index constituents). The dividends in the ETF are accumulated and reinvested in the ETF. The iShares Edge MSCI World Quality Factor UCITS ETF (Acc) is a very large ETF with 3,623m Euro assets under management. The ETF was launched on 3 October 2014 and is domiciled in Ireland. Show more Show less;Faktor kvality světových kvality Ishares Edge MSCI UCITS ETF (ACC) se snaží sledovat index neutrální kvality sektoru MSCI.Index neutrální kvality MSCI Světového sektoru sleduje akcie s vysoce kvalitním faktorem z 23 rozvinutých zemí po celém světě.Složky jsou vybírány třemi hlavními stejně váženými ukazateli toho, zda společnost prokazuje vysoce kvalitní vlastnosti: vysoká návratnost vlastního kapitálu, nízký pákový efekt a stabilní růst výdělků.TER (celkový poměr nákladů) činí 0,25% p.a. Faktor kvality světového světa Ishares Edge MSCI UCITS ETF (ACC) je nejlevnější a největší ETF, který sleduje index neutrální kvality sektoru MSCI.ETF replikuje výkon základního indexu technikou vzorkování (nákup výběru nejdůležitějších složek indexu).dividenday v ETF jsou akumulovány a reinvestovány do ETF.Faktor kvality světových kvality Ishares Edge MSCI UCITS ETF (ACC) je velmi velký ETF s managementem 3 623 milionů euro.ETF byl spuštěn 3. října 2014 a je se sídlem v Irsku.Ukázat více show méně;0.25%;0.25;EUR 3623m;3623.0;EUR;USD;Ireland;iShares;3 October 2014;Accumulating;;Physical;;MSCI World;Equity, USD, World,;;Akcie;Globální;298.0;2.86;41.45;79.64;-2.77;15.46;14.66;15.16;0.19;;;-19.85;;;;;;;;Extracted (method 1);IS3Q;7;;;;;;;2025-09-16T23:44:05.012705;success;0;Nvidia;6.58;Microsoft;5.79;Apple;4.99;Visa;3.7;Meta;3.62;Mastercard;1.98;Alphabet;1.87;;;;;;;United States;72.11;Other;17.68;Switzerland;4.03;United Kingdom;3.82;Japan;2.36;Technology;33.61;Consumer Discretionary;9.84;Industrials;9.83;Financials;9.32;;;London Stock Exchange;GBP;;;;;Stuttgart Stock Exchange;EUR;;;;;Six Swiss Exchange;CHF;;;;;XETRA;EUR;;;;;Borsa Italiana;EUR;;;;
IE00BP3QZ825;iShares Edge MSCI World Momentum Factor UCITS ETF (Acc);https://www.justetf.com/en/etf-profile.html?isin=IE00BP3QZ825;The iShares Edge MSCI World Momentum Factor UCITS ETF (Acc) seeks to track the MSCI World Momentum index. The MSCI World Momentum index tracks stocks with a high price momentum from 23 developed countries worldwide. The index consists of titles that have experienced price increases over the past 6 and past 12 months. The ETF's TER (total expense ratio) amounts to 0.25% p.a.. The iShares Edge MSCI World Momentum Factor UCITS ETF (Acc) is the cheapest and largest ETF that tracks the MSCI World Momentum index. The ETF replicates the performance of the underlying index by sampling technique (buying a selection of the most relevant index constituents). The dividends in the ETF are accumulated and reinvested in the ETF. The iShares Edge MSCI World Momentum Factor UCITS ETF (Acc) is a very large ETF with 2,696m Euro assets under management. The ETF was launched on 3 October 2014 and is domiciled in Ireland. Show more Show less;Ishares Edge MSCI World Momentum Factor UCITS ETF (ACC) se snaží sledovat index momentu MSCI World Momentum.Index momentu MSCI World Momentum sleduje akcie s hybností s vysokou cenou z 23 rozvinutých zemí po celém světě.Index se skládá z titulů, které zažily zvýšení cen za posledních 6 a za posledních 12 měsíců.TER (celkový poměr výdajů) ETF činí 0,25% p.a. Ishares Edge MSCI World Momentum Factor UCITS ETF (ACC) je nejlevnější a největší ETF, který sleduje index momentum MSCI.ETF replikuje výkon základního indexu technikou vzorkování (nákup výběru nejdůležitějších složek indexu).dividenday v ETF jsou akumulovány a reinvestovány do ETF.Ishares Edge MSCI World Momentum Factor UCITS ETF (ACC) je velmi velký ETF s managementem 2 696 milionů euro.ETF byl spuštěn 3. října 2014 a je se sídlem v Irsku.Ukázat více show méně;0.25%;0.25;EUR 2696m;2696.0;EUR;USD;Ireland;iShares;3 October 2014;Accumulating;;Physical;;MSCI World;Equity, USD, World, Momentum;;Akcie;Globální;351.0;16.49;55.31;81.9;5.57;18.33;16.48;17.7;0.9;;;-22.16;;;;;;;;Extracted (method 1);IS3R;7;;;;;;;2025-09-16T23:44:09.391185;success;0;Berkshire Hathaway;3.32;JPMorgan;2.84;Visa;2.79;;;;;;;;;;;;;;;United States;57.54;Other;24.69;Germany;7.56;Canada;5.17;Japan;5.04;Financials;26.91;Technology;18.54;Industrials;10.48;Consumer Staples;9.83;;;London Stock Exchange;GBP;;;;;Stuttgart Stock Exchange;EUR;;;;;Six Swiss Exchange;CHF;;;;;XETRA;EUR;;;;;Borsa Italiana;EUR;;;;
IE00BP3QZB59;iShares Edge MSCI World Value Factor UCITS ETF;https://www.justetf.com/en/etf-profile.html?isin=IE00BP3QZB59;The iShares Edge MSCI World Value Factor UCITS ETF seeks to track the MSCI World Enhanced Value index. The MSCI World Enhanced Value index tracks the value stocks from developed countries worldwide. The stock selection is based on the value factor of three variables: price-to-book value, price-to-forward earnings and enterprise value-to-cash flow from operations. The weight of each sector in this index is equated with the weight of that sector in the MSCI World. The ETF's TER (total expense ratio) amounts to 0.25% p.a.. The iShares Edge MSCI World Value Factor UCITS ETF is the cheapest and largest ETF that tracks the MSCI World Enhanced Value index. The ETF replicates the performance of the underlying index by sampling technique (buying a selection of the most relevant index constituents). The dividends in the ETF are accumulated and reinvested in the ETF. The iShares Edge MSCI World Value Factor UCITS ETF is a very large ETF with 3,381m Euro assets under management. The ETF was launched on 3 October 2014 and is domiciled in Ireland. Show more Show less;IShares Edge MSCI World Value Factor UCITS ETF se snaží sledovat index hodnoty MSCI World Enhanced Hodnota.Světový index MSCI World vylepšená hodnota sleduje hodnotové akciíy z rozvinutých zemí po celém světě.Výběr akcií je založen na hodnotovém faktoru tří proměnných: hodnota ceny k knize, výdělky z ceny a podnikového hodnoty z provozu z operací.Hmotnost každého sektoru v tomto indexu je srovnávána s hmotností tohoto sektoru ve světě MSCI.TER (celkový poměr výdajů) ETF činí 0,25% P.A .. Ishares Edge MSCI World Value Factor UCITS ETF je nejlevnější a největší ETF, který sleduje index hodnoty MSCI World.ETF replikuje výkon základního indexu technikou vzorkování (nákup výběru nejdůležitějších složek indexu).dividenday v ETF jsou akumulovány a reinvestovány do ETF.Světová hodnotová hodnota Ishares Edge MSCI UCITS ETF je velmi velká ETF s managementem 3 381 milionů euro.ETF byl spuštěn 3. října 2014 a je se sídlem v Irsku.Ukázat více show méně;0.25%;0.25;EUR 3381m;3381.0;EUR;USD;Ireland;iShares;3 October 2014;;;Physical;;MSCI World;Equity, USD, World, Value;;Akcie;Globální;398.0;16.47;43.34;97.89;11.44;13.72;12.99;13.32;1.2;;;-16.43;;;;;;;;Extracted (method 1);IS3S;7;;;;;;;2025-09-16T23:44:16.236451;success;0;;;;;;;;;;;;;;;;;;;;;United States;36.08;Other;24.98;Japan;22.92;United Kingdom;9.75;France;6.27;Financials;17.43;Industrials;11.18;Consumer Discretionary;10.02;Technology;1.98;;;London Stock Exchange;GBP;;;;;Stuttgart Stock Exchange;EUR;;;;;Six Swiss Exchange;CHF;;;;;XETRA;EUR;;;;;Borsa Italiana;EUR;;;;
IE00BP3QZD73;iShares MSCI World Mid-Cap Equal Weight UCITS ETF USD (Acc);https://www.justetf.com/en/etf-profile.html?isin=IE00BP3QZD73;The iShares MSCI World Mid-Cap Equal Weight UCITS ETF USD (Acc) seeks to track the MSCI World Mid Cap Equal Weighted index. The MSCI World Mid Cap Equal Weighted index tracks mid cap stocks from 23 developed countries worldwide. All constituents in the index are equally weighted. The ETF's TER (total expense ratio) amounts to 0.30% p.a.. The iShares MSCI World Mid-Cap Equal Weight UCITS ETF USD (Acc) is the only ETF that tracks the MSCI World Mid Cap Equal Weighted index. The ETF replicates the performance of the underlying index by sampling technique (buying a selection of the most relevant index constituents). The dividends in the ETF are accumulated and reinvested in the ETF. The iShares MSCI World Mid-Cap Equal Weight UCITS ETF USD (Acc) has 289m Euro assets under management. The ETF was launched on 3 October 2014 and is domiciled in Ireland. Show more Show less;IShares MSCI World Mid-Cap stejná hmotnost UCITS ETF USD (ACC) se snaží sledovat MSCI World Mid Cap stejný vážený index.MSCI World Mid Cap stejná vážená indexová stopy střední kapitálové akciíy z 23 rozvinutých zemí po celém světě.Všechny složky v indexu jsou stejně váženy.TER (celkový poměr nákladů) ETF činí 0,30% p.a. Ishares MSCI World Mid-Cap stejná hmotnost UCITS ETF USD (ACC) je jediným ETF, který sleduje index MSCI World Mid Cap.ETF replikuje výkon základního indexu technikou vzorkování (nákup výběru nejdůležitějších složek indexu).dividenday v ETF jsou akumulovány a reinvestovány do ETF.IShares MSCI World Mid-Cap Equal Weight UCITS ETF USD (ACC) má 289 milionů euro aktiv.ETF byl spuštěn 3. října 2014 a je se sídlem v Irsku.Ukázat více show méně;0.30%;0.3;EUR 289m;289.0;EUR;USD;Ireland;iShares;3 October 2014;Accumulating;;Physical;;MSCI World;Equity, World, Mid Cap;;Akcie;US;764.0;10.07;26.92;58.45;5.06;12.76;12.99;13.31;0.79;;;-16.97;;;;;;;;Extracted (method 1);IS3T;7;;;;;;;2025-09-16T23:44:23.127095;success;0;;;;;;;;;;;;;;;;;;;;;Other;38.62;United States;35.98;Japan;14.87;Canada;5.51;United Kingdom;5.02;Industrials;17.81;Financials;13.44;Technology;10.92;Consumer Discretionary;9.58;;;London Stock Exchange;GBP;;;;;Stuttgart Stock Exchange;EUR;;;;;Six Swiss Exchange;CHF;;;;;XETRA;EUR;;;;;Borsa Italiana;EUR;;;;
