IE00B50XJX92;UBS CMCI Composite SF UCITS ETF hGBP acc;https://www.justetf.com/en/etf-profile.html?isin=IE00B50XJX92;The UBS CMCI Composite SF UCITS ETF hGBP acc seeks to track the UBS CMCI (GBP Hedged) index. The UBS CMCI (GBP Hedged) Index tracks commodities representing sectors including energy, precious metals, base metals, agriculture and livestock. The index diversifies its futures across the maturity curve and thus offers constant maturities. Therewith, the index tries to minimise the risk of a negative roll yield. Currency hedged to British Pound (GBP). The ETF's TER (total expense ratio) amounts to 0.34% p.a.. The UBS CMCI Composite SF UCITS ETF hGBP acc is the only ETF that tracks the UBS CMCI (GBP Hedged) index. The ETF replicates the performance of the underlying index synthetically with a swap. The UBS CMCI Composite SF UCITS ETF hGBP acc is a very small ETF with 12m Euro assets under management. The ETF was launched on 5 March 2015 and is domiciled in Ireland.;UBS CMCI Composite SF UCITS ETF HGBP ACC se snaží sledovat index UBS CMCI (GBP Hedged). Indexové skladby UBS CMCI (GBP Hedged) zastupují komodity představující odvětví včetně energie, drahých kovů, základních kovů, zemědělství a hospodářských zvířat. Index diverzifikuje svou budoucnost přes křivku zralosti a nabízí tak konstantní splatnosti. S tím se index snaží minimalizovat riziko negativního výnosu role. Měna zajišťovala britskou libru (GBP). TER (celkový poměr nákladů) ETF činí 0,34% p.a .. UBS CMCI Composite SF UCITS ETF HGBP ACC je jediný ETF, který sleduje index UBS CMCI (GBP Hedged). ETF replikuje výkon podkladového indexu synteticky s výměnou. UBS CMCI Composite SF UCITS ETF HGBP ACC je velmi malá ETF s správou 12m euro. ETF byl spuštěn 5. března 2015 a je se sídlem v Irsku.;0.34%;0.34;EUR 12m;12.0;EUR;GBP;Ireland;UBS ETF;5 March 2015;Accumulating;;Synthetic;UCITS;;Commodities, Broad market;;GBP    Currency risk  Currency;1;Komodity;False;Celosvětově;;6.32;12.48;93.6;1.67;2.06;-1.71;-1.59;42.63;8.7;-0.71;9.78;19.48;14.06;15.41;18.02;0.45;0.26;0.78;-12.96;-12.96;-23.58;-54.15;;;;;London Stock Exchange;UC90;3;;;;;;;2025-09-21T22:11:38.642652;success;0;;;;;;;;;;;;;;;;;;;;;;;;;;;;;;;;;;;;;;;;;London Stock Exchange;GBX;UC90;UC90 LNICCHGBIV;UC90.LICCHGBASINAV=SOLA;;SIX Swiss Exchange;GBP;CCGBAS;CCGBAS SWICCGBASS;CCGBAS.SCCGBASGBPINAV=SOLA;;XETRA;GBP;UEQ3;UEQ3 GYICCGBASS;UEQ3.DECCGBASGBPINAV=SOLA;;;;;;;;;;;;;;;;;;;;;;;;;;;;;;;;;;;;;;;;;;;;2;47;12;1;13;5;16
IE00B51B7Z02;HSBC MSCI Canada UCITS ETF USD;https://www.justetf.com/en/etf-profile.html?isin=IE00B51B7Z02;The HSBC MSCI Canada UCITS ETF USD seeks to track the MSCI Canada index. The MSCI Canada index tracks the largest and most liquid Canadian stocks. The ETF's TER (total expense ratio) amounts to 0.35% p.a.. The ETF replicates the performance of the underlying index by full replication (buying all the index constituents). The dividends in the ETF are distributed to the investors (Semi annually). The HSBC MSCI Canada UCITS ETF USD is a small ETF with 28m Euro assets under management. The ETF was launched on 23 February 2011 and is domiciled in Ireland.;HSBC MSCI Canada UCITS ETF USD se snaží sledovat index MSCI Canada. Index MSCI Canada sleduje největší a nejvíce kanadské akcie. TER (celkový poměr nákladů) ETF činí 0,35% p.a. ETF replikuje výkon podkladového indexu plnou replikací (nákup všech složek indexu). dividenday v ETF jsou distribuovány investorům (polo každoročně). HSBC MSCI Canada UCITS ETF USD je malý ETF s managementem 28 milionů euro. ETF byl spuštěn 23. února 2011 a je se sídlem v Irsku.;0.35%;0.35;EUR 28m;28.0;EUR;USD;Ireland;HSBC ETF;23 February 2011;;Semi annually;Physical;UCITS;MSCI Canada  USD;Equity, Canada;;USD    Currency risk  Currency;1;Akcie;False;Celosvětově;83.0;18.83;36.81;101.27;11.57;6.57;9.21;14.7;36.2;-7.71;11.85;18.75;141.85;15.76;15.54;15.85;1.2;0.71;0.95;-16.44;-16.44;-17.64;-42.55;;;;;London Stock Exchange;-;8;1.73%;1.73;EUR 0.45;0.45;EUR;method2_regex;2025-09-21T22:11:46.397559;success;0;Shopify, Inc.;6.17;The Toronto-Dominion Bank;5.29;Enbridge;4.09;Brookfield Corp.;3.78;Bank of Montreal;3.31;Constellation Software, Inc.;2.88;The Bank of Nova Scotia;2.88;Canadian Pacific Kansas;2.84;Canadian Imperial Bank of Commerce;2.79;;;Other;14.12;Canada;7.53;;;;;;;Financials;32.9;Energy;16.44;Materials;10.79;Technology;10.54;;;London Stock Exchange;GBX;HCAN;;;;gettex;EUR;H4ZR;;;;Stuttgart Stock Exchange;EUR;H4ZX;;;;Euronext Paris;EUR;HCAN;HCAN FPHCANEURI;HCAN.PAHCANINAVEUR=HSBL;;London Stock Exchange;USD;HCAD;HCAD LNHCANUSDI;HCAD.LHCANINAVUSD=HSBL;;London Stock Exchange;GBP;-;HCAN LNHCANGBPI;HCAN.LHCANINAVGBP=HSBL;;SIX Swiss Exchange;USD;HCAN;HCAN SWHCANUSDI;HCAN.SHCANINAVUSD=HSBL;;SIX Swiss Exchange;CAD;HCAN;HCANCAD SWHCANCADI;HCANCAD.SHCANINAVCAD=HSBL;;;;;;;;;;;;;;3;51;12;1;13;5;20
IE00B52MJD48;iShares Nikkei 225 UCITS ETF (Acc);https://www.justetf.com/en/etf-profile.html?isin=IE00B52MJD48;The iShares Nikkei 225 UCITS ETF (Acc) seeks to track the Nikkei 225® index. The Nikkei 225® index tracks the 225 most actively traded stocks on the first section of the Tokyo Stock Exchange. The ETF's TER (total expense ratio) amounts to 0.48% p.a.. The ETF replicates the performance of the underlying index by full replication (buying all the index constituents). The dividends in the ETF are accumulated and reinvested in the ETF. The iShares Nikkei 225 UCITS ETF (Acc) has 372m Euro assets under management. The ETF was launched on 25 January 2010 and is domiciled in Ireland.;IShares Nikkei 225 UCITS ETF (ACC) se snaží sledovat index Nikkei 225®. Index Nikkei 225® sleduje 225 nejaktivněji obchodovaných akcií na první části Tokio akcie Exchange. ETF TER (celkový poměr nákladů) činí 0,48% p.a. ETF replikuje výkon podkladového indexu plnou replikací (nákup všech složek indexu). dividenday v ETF jsou akumulovány a reinvestovány do ETF. IShares Nikkei 225 UCITS ETF (ACC) má ve spravování aktiva 372 milionů euro. ETF byla spuštěna 25. ledna 2010 a je bydliště v Irsku.;0.48%;0.48;EUR 372m;372.0;EUR;JPY;Ireland;iShares;25 January 2010;Accumulating;;Physical;UCITS;;Equity, Japan;;JPY    Currency risk  Currency;1;Akcie;False;Celosvětově;225.0;12.96;40.29;45.81;6.96;3.07;12.97;13.19;3.01;-15.09;16.98;15.44;281.53;22.62;20.7;19.54;0.57;0.58;0.4;-21.78;-21.78;-22.35;-30.17;;;;;Extracted (method 1);SXRZ;0;;;;;;;2025-09-21T22:11:52.554633;success;0;Advantest Corp.;6.76;Tokyo Electron Ltd.;6.69;SoftBank Group Corp.;5.78;KDDI Corp.;2.43;TDK Corp.;2.27;Recruit Holdings Co., Ltd.;2.22;Chugai Pharmaceutical Co., Ltd.;1.8;Shin-Etsu Chemical Co., Ltd.;1.79;FANUC Corp.;1.74;;;Japan;98.88;Other;1.12;;;;;;;Technology;24.4;Consumer Discretionary;19.87;Industrials;18.7;IT;2.22;;;;;;;;;;;;;;;;;;;;;;;;;;;;;;;;;;;;;;;;;;;;;;;;;;;;;;;;;;;;;;;3;62;12;5;15;10;20
IE00B52MJY50;iShares Core MSCI Pacific ex Japan UCITS ETF (Acc);https://www.justetf.com/en/etf-profile.html?isin=IE00B52MJY50;The iShares Core MSCI Pacific ex Japan UCITS ETF (Acc) seeks to track the MSCI Pacific ex Japan index. The MSCI Pacific index tracks the equity markets of the developed markets in the Pacific region excluding Japan (Australia, Hong Kong, Singapore and New Zealand). The ETF's TER (total expense ratio) amounts to 0.20% p.a.. The iShares Core MSCI Pacific ex Japan UCITS ETF (Acc) is the largest ETF that tracks the MSCI Pacific ex Japan index. The ETF replicates the performance of the underlying index by full replication (buying all the index constituents). The dividends in the ETF are accumulated and reinvested in the ETF. The iShares Core MSCI Pacific ex Japan UCITS ETF (Acc) is a very large ETF with 2,935m Euro assets under management. The ETF was launched on 12 January 2010 and is domiciled in Ireland.;IShares Core MSCI Pacific Ex Japan UCITS ETF (ACC) se snaží sledovat index MSCI Pacific EX Japan. Index MSCI Pacific index sleduje akciové trhy rozvinutých trhů v oblasti Pacifiku s výjimkou Japonska (Austrálie, Hongkong, Singapur a Nový Zéland). TER (celkový poměr výdajů) ETF činí 0,20% p.a. Core iShares Core MSCI Pacific Ex Japan UCITS ETF (ACC) je největší ETF, který sleduje index japonského indexu MSCI Pacific. ETF replikuje výkon podkladového indexu plnou replikací (nákup všech složek indexu). dividenday v ETF jsou akumulovány a reinvestovány do ETF. Ishares Core MSCI Pacific Ex Japan UCITS ETF (ACC) je velmi velký ETF s managementem 2 935 milionů euro. ETF byl spuštěn 12. ledna 2010 a má bydliště v Irsku.;0.20%;0.2;EUR 2935m;2935.0;EUR;USD;Ireland;iShares;12 January 2010;Accumulating;;Physical;UCITS;MSCI Pacific ex Japan;Equity, Asia Pacific;;USD    Currency risk  Currency;1;Akcie;False;Asie a Pacifik;98.0;8.1;21.81;53.73;6.3;1.0;5.11;9.67;13.39;-0.3;2.57;11.09;183.55;16.1;14.65;14.76;0.5;0.46;0.61;-19.87;-19.87;-19.87;-37.54;;;;;Bolsa Mexicana de Valores;-;10;;;;;;;2025-09-21T22:12:00.653299;success;0;BHP Group Ltd.;6.18;AIA Group;4.82;CSL Ltd.;4.07;DBS Group Holdings Ltd.;3.81;National Australia Bank Ltd.;3.7;Westpac Banking;3.59;HKEX;3.14;Wesfarmers Ltd.;3.02;Sea Ltd. (Singapore);2.89;;;Australia;9.23;Other;5.8;;;;;;;Financials;42.53;Materials;10.97;Real Estate;7.93;Industrials;7.8;;;London Stock Exchange;GBX;CPJ1;;;;gettex;EUR;SXR1;;;;Stuttgart Stock Exchange;EUR;SXR1;;;;Bolsa Mexicana de Valores;MXN;-;CPXJN MM;CPXJN.MX;;Borsa Italiana;EUR;CSPXJ;CSPXJ IMIXM0391;CSPXJ.MIIXM0391.DE;;Euronext Amsterdam;EUR;CPXJ;CPXJ NAIXM0391;CPXJ.ASIXM0391.DE;;London Stock Exchange;USD;CPXJ;CPXJ LNIXM039;CPXJ.LIXM039.DE;;London Stock Exchange;GBP;-;CPJ1 LNIXM0392;CPJ1.LIXM0392.DE;;SIX Swiss Exchange;USD;CSPXJ;CSPXJ SEIXM039;CSPXJ.SIXM039.DE;;XETRA;EUR;SXR1;SXR1 GYIXM0391;SXR1.DEIXM0391.DE;;4;74;17;13;15;10;19
IE00B52SF786;iShares MSCI Canada UCITS ETF (Acc);https://www.justetf.com/en/etf-profile.html?isin=IE00B52SF786;The iShares MSCI Canada UCITS ETF (Acc) seeks to track the MSCI Canada index. The MSCI Canada index tracks the largest and most liquid Canadian stocks. The ETF's TER (total expense ratio) amounts to 0.48% p.a.. The iShares MSCI Canada UCITS ETF (Acc) is the largest ETF that tracks the MSCI Canada index. The ETF replicates the performance of the underlying index by full replication (buying all the index constituents). The dividends in the ETF are accumulated and reinvested in the ETF. The iShares MSCI Canada UCITS ETF (Acc) is a very large ETF with 1,282m Euro assets under management. The ETF was launched on 12 January 2010 and is domiciled in Ireland.;Ishares MSCI Canada UCITS ETF (ACC) se snaží sledovat index MSCI Canada. Index MSCI Canada sleduje největší a nejvíce kanadské akcie. TER (celkový poměr nákladů) ETF činí 0,48% p.a. IShares MSCI Canada UCITS ETF (ACC) je největší ETF, který sleduje index MSCI Canada. ETF replikuje výkon podkladového indexu plnou replikací (nákup všech složek indexu). dividenday v ETF jsou akumulovány a reinvestovány do ETF. Ishares MSCI Canada UCITS ETF (ACC) je velmi velký ETF s spravováním 1 282 milionů euro. ETF byl spuštěn 12. ledna 2010 a má bydliště v Irsku.;0.48%;0.48;EUR 1282m;1282.0;EUR;USD;Ireland;iShares;12 January 2010;Accumulating;;Physical;UCITS;MSCI Canada;Equity, Canada;;USD    Currency risk  Currency;1;Akcie;False;Celosvětově;83.0;18.86;36.31;99.66;11.61;6.72;9.36;14.84;36.19;-7.79;11.08;18.65;213.86;15.46;15.32;15.76;1.22;0.71;0.94;-16.47;-16.47;-17.64;-42.51;;;;;Bolsa Mexicana de Valores;-;10;;;;;;;2025-09-21T22:12:06.594294;success;0;Shopify, Inc.;6.14;The Toronto-Dominion Bank;5.27;Enbridge;4.08;Brookfield Corp.;3.77;Bank of Montreal;3.3;Constellation Software, Inc.;2.86;The Bank of Nova Scotia;2.86;Canadian Pacific Kansas;2.82;Canadian Imperial Bank of Commerce;2.77;;;Other;14.53;Canada;7.49;;;;;;;Financials;32.74;Energy;16.37;Materials;10.75;Technology;10.5;;;London Stock Exchange;GBX;CSCA;;;;gettex;EUR;SXR2;;;;Stuttgart Stock Exchange;EUR;SXR2;;;;Bolsa Mexicana de Valores;MXN;-;CCAUN MM;CCAUN.MX;;Borsa Italiana;EUR;CSCA;CSCA IMIXM0401;CSCA.MIIXM0401.DE;;Euronext Amsterdam;EUR;CSCA;CSCA NAIXM0401;CSCA.ASIXM0401.DE;;London Stock Exchange;USD;CCAU;CCAU LN;CCAU.L;;London Stock Exchange;GBP;-;CSCA LNIXM0402;CSCA.LIXM0402.DE;;SIX Swiss Exchange;CAD;CSCA;CSCA SEIXM040;CSCA.SIXM040.DE;;XETRA;EUR;SXR2;SXR2 GYIXM0401;SXR2.DEIXM0401.DE;;4;70;12;13;15;10;20
IE00B52SFT06;iShares MSCI USA UCITS ETF (Acc);https://www.justetf.com/en/etf-profile.html?isin=IE00B52SFT06;The iShares MSCI USA UCITS ETF (Acc) seeks to track the MSCI USA index. The MSCI USA index tracks the leading stocks on the US market. The ETF's TER (total expense ratio) amounts to 0.07% p.a.. The ETF replicates the performance of the underlying index by full replication (buying all the index constituents). The dividends in the ETF are accumulated and reinvested in the ETF. The iShares MSCI USA UCITS ETF (Acc) is a very large ETF with 1,983m Euro assets under management. The ETF was launched on 12 January 2010 and is domiciled in Ireland.;IShares MSCI USA UCITS ETF (ACC) se snaží sledovat index MSCI USA. Index MSCI USA sleduje přední akciíy na americkém trhu. TER (celkový poměr nákladů) ETF činí 0,07% p.a. ETF replikuje výkon podkladového indexu plnou replikací (nákup všech složek indexu). dividenday v ETF jsou akumulovány a reinvestovány do ETF. IShares MSCI USA UCITS ETF (ACC) je velmi velký ETF s spravováním 1 983 milionů euro. ETF byl spuštěn 12. ledna 2010 a má bydliště v Irsku.;0.07%;0.07;EUR 1983m;1983.0;EUR;USD;Ireland;iShares;12 January 2010;Accumulating;;Physical;UCITS;MSCI USA;Equity, United States;;USD    Currency risk  Currency;1;Akcie;False;Severní Amerika;544.0;12.07;52.18;110.72;0.74;3.24;9.1;9.44;36.89;-14.85;22.33;32.69;789.09;20.12;17.76;18.12;0.6;0.85;0.89;-22.97;-22.97;-22.97;-34.06;;;;;Bolsa Mexicana de Valores;-;10;;;;;;;2025-09-21T22:12:12.431266;success;0;Microsoft;6.8;Apple;5.63;Amazon.com, Inc.;4.04;Meta Platforms;3.06;Broadcom;2.37;Alphabet, Inc. A;2.02;Alphabet, Inc. C;1.72;Tesla;1.61;JPMorgan Chase & Co.;1.5;;;United States;95.06;Other;3.39;;;;;;;Technology;36.0;Financials;10.72;Consumer Discretionary;10.72;;;;;London Stock Exchange;GBX;CU1;;;;gettex;EUR;SXR4;;;;Stuttgart Stock Exchange;EUR;SXR4;;;;Bolsa Mexicana de Valores;MXN;-;CSUSN MM;CSUSN.MX;;Borsa Italiana;EUR;CSUS;CSUS IMIXM0421;CSUS.MIIXM0421.DE;;Euronext Amsterdam;EUR;CSUS;CSUS NAIXM0421;CSUS.ASIXM0421.DE;;London Stock Exchange;USD;CSUS;CSUS LNIXM042;CSUS.LIXM042.DE;;London Stock Exchange;GBP;-;CU1 LNIXM0422;CSU1.LIXM0422.DE;;SIX Swiss Exchange;USD;CSUS;CSUS SEIXM042;CSUS.SIXM042.DE;;XETRA;EUR;SXR4;SXR4 GYIXM0421;SXR4.DEIXM0421.DE;;5;84;26;13;15;10;20
IE00B52VJ196;iShares MSCI Europe SRI UCITS ETF (Acc);https://www.justetf.com/en/etf-profile.html?isin=IE00B52VJ196;The iShares MSCI Europe SRI UCITS ETF (Acc) seeks to track the MSCI Europe SRI Select Reduced Fossil Fuels index. The MSCI Europe SRI Select Reduced Fossil Fuels index tracks companies from Europe. Only companies with very high Environmental, Social and Governance (ESG) ratings, relative to their sector peers, are included, while avoiding companies incompatible with values screen or having exposure to fossil fuels through extraction and production activities, power generation activities or reserves ownership. The weight of each company is capped to 5%. The ETF's TER (total expense ratio) amounts to 0.20% p.a.. The iShares MSCI Europe SRI UCITS ETF (Acc) is the cheapest and largest ETF that tracks the MSCI Europe SRI Select Reduced Fossil Fuels index. The ETF replicates the performance of the underlying index by full replication (buying all the index constituents). The dividends in the ETF are accumulated and reinvested in the ETF. The iShares MSCI Europe SRI UCITS ETF (Acc) is a very large ETF with 3,126m Euro assets under management. The ETF was launched on 25 February 2011 and is domiciled in Ireland.;Ishares MSCI Europe Sri UCITS ETF (ACC) se snaží sledovat MSCI Europe Sri Select Reduction Fossil Fuels Index. MSCI Europe SRI vybrala redukované indexové společnosti Fossil Fuels sleduje společnosti z Evropy. Zahrnuty jsou pouze společnosti s velmi vysokým hodnocením environmentálního, sociálního a správy (ESG) ve vztahu k jejich vrstevníkům sektoru, přičemž se vyhýbají společnosti nekompatibilním s obrazovkou hodnot nebo vystavení fosilním palivům prostřednictvím extrakčních a výrobních činností, činností výroby energie nebo si vyhrazují vlastnictví. Hmotnost každé společnosti je omezena na 5%. TER (celkový poměr výdajů) ETF činí 0,20% p.a. Ishares MSCI Europe Sri UCITS ETF (ACC) je nejlevnější a největší ETF, který sleduje MSCI Europe SRI vybraný redukovaný index fosilních paliv. ETF replikuje výkon podkladového indexu plnou replikací (nákup všech složek indexu). dividenday v ETF jsou akumulovány a reinvestovány do ETF. Ishares MSCI Europe Sri UCITS ETF (ACC) je velmi velký ETF s managementem 3 126 milionů euro. ETF byl spuštěn 25. února 2011 a je se sídlem v Irsku.;0.20%;0.2;EUR 3126m;3126.0;EUR;EUR;Ireland;iShares;25 February 2011;Accumulating;;Physical;UCITS;MSCI Europe;Equity, Europe, Social/Environmental;Yes;EUR    Currency risk  Currency;1;Akcie;False;Evropa;118.0;-4.22;28.38;44.15;0.46;-0.48;-0.83;-3.03;26.52;-15.6;17.17;5.81;172.4;13.96;12.85;14.2;-0.3;0.67;0.53;-15.61;-15.8;-23.4;-33.19;;;;;Bolsa Mexicana de Valores;-;10;;;;;;;2025-09-21T22:12:17.855814;success;0;Schneider Electric SE;4.4;L'Oréal SA;3.7;ABB Ltd.;3.59;Zurich Insurance Group AG;3.45;Novo Nordisk A/S;3.44;RELX;3.33;Münchener Rückversicherungs-Gesellschaft AG;3.04;AXA SA;2.98;Hermès International SCA;2.47;;;Other;36.89;Switzerland;19.36;France;17.91;Netherlands;13.53;United Kingdom;12.31;Financials;23.0;IT;19.36;Industrials;18.91;Consumer Staples;10.77;Technology;9.52;London Stock Exchange;GBX;IESG;;;;gettex;EUR;IUSK;;;;Stuttgart Stock Exchange;EUR;IUSK;;;;Bolsa Mexicana de Valores;MXN;-;IUSKN MM;IUSKN.MX;;Borsa Italiana;EUR;IESE;IESE IM;BJYJ9D1;;Euronext Amsterdam;EUR;IESE;IESE NAINAVESUE;IESE.ASIESEEINAV.DE;;London Stock Exchange;GBP;-;IESG LNINAVESUG;IESG.LIESEGINAV.DE;;London Stock Exchange;EUR;IESE;IESE LNINAVESUE;IESE.LIESEEINAV.DE;;SIX Swiss Exchange;EUR;IESE;IESE SEINAVESUE;IESE.SIESEEINAV.DE;;XETRA;EUR;IUSK;IUSK GYINAVESUE;IUSK.DEIESEEINAV.DE;;4;73;17;13;13;10;20
IE00B52XQP83;iShares MSCI South Africa UCITS ETF;https://www.justetf.com/en/etf-profile.html?isin=IE00B52XQP83;The iShares MSCI South Africa UCITS ETF seeks to track the MSCI South Africa Capped index. The MSCI South Africa Capped index tracks large and mid cap South African stocks. The weight of the largest constituent is constrained to 33% and the weights of all other constituents are constrained to a maximum of 18%. The ETF's TER (total expense ratio) amounts to 0.65% p.a.. The iShares MSCI South Africa UCITS ETF is the only ETF that tracks the MSCI South Africa Capped index. The ETF replicates the performance of the underlying index by full replication (buying all the index constituents). The dividends in the ETF are accumulated and reinvested in the ETF. The iShares MSCI South Africa UCITS ETF has 139m Euro assets under management. The ETF was launched on 22 January 2010 and is domiciled in Ireland.;Ishares MSCI Jihoafrická republika UCITS ETF se snaží sledovat index MSCI Jižní Afrika. Indexová index MSCI Jihoafrická republika sleduje velké a střední čepice jihoafrických akcií. Hmotnost největší složky je omezena na 33% a hmotnosti všech ostatních složek jsou omezeny na maximálně 18%. TER (celkový poměr nákladů) ETF činí 0,65% p.a. Ishares MSCI Jihoafrická Afrika UCITS ETF je jediný ETF, který sleduje index MSCI Jihoafrickou republiku. ETF replikuje výkon podkladového indexu plnou replikací (nákup všech složek indexu). dividenday v ETF jsou akumulovány a reinvestovány do ETF. Ishares MSCI Jihoafrická republika UCITS ETF má ve správě 139 milionů euro aktiv. ETF byl spuštěn 22. ledna 2010 a je se sídlem v Irsku.;0.65%;0.65;EUR 139m;139.0;EUR;USD;Ireland;iShares;22 January 2010;;;Physical;UCITS;MSCI South Africa;Equity, South Africa;;USD    Currency risk  Currency;1;Akcie;False;Celosvětově;30.0;31.39;57.48;95.53;33.6;8.77;18.1;20.94;12.63;1.83;-1.86;13.12;152.77;22.15;24.18;24.58;1.42;0.68;0.58;-16.91;-21.6;-29.94;-55.15;;;;;Bolsa Mexicana de Valores;-;9;;;;;;;2025-09-21T22:12:25.127747;success;0;Anglogold Ashanti Plc;8.02;Gold Fields Ltd.;7.61;FirstRand Ltd.;7.55;Standard Bank Group Ltd.;5.97;Capitec Bank Holdings;5.94;MTN Group Ltd.;5.02;Valterra Platinum;3.36;Sanlam Ltd.;3.04;Impala Platinum Holdings Ltd.;3.0;;;Other;28.85;;;;;;;;;Financials;33.99;Materials;18.07;Consumer Staples;7.3;IT;5.94;;;London Stock Exchange;GBX;SRSA;;;;gettex;EUR;IBC4;;;;Stuttgart Stock Exchange;EUR;IBC4;;;;Bolsa Mexicana de Valores;MXN;-;IRSANN MM;IRSANN.MX;;Borsa Italiana;EUR;SRSA;IRSA IMISRINAVE;IRSA.MIISRSINAVEUR.DE;;London Stock Exchange;USD;IRSA;IRSA LNISRINAVU;IRSA.LISRSINAVUSD.DE;;London Stock Exchange;GBP;-;SRSA LNISRINAVG;SRSA.LISRSINAVGBP.DE;;SIX Swiss Exchange;USD;SRSA;SRSA SEISRINAVU;SRSA.SISRSINAVUSD.DE;;XETRA;EUR;IBC4;IBC4 GYISRINAVE;IBC4.DEISRSINAVEUR.DE;;;;;;;;3;56;6;5;15;10;20
IE00B5377D42;iShares MSCI Australia UCITS ETF;https://www.justetf.com/en/etf-profile.html?isin=IE00B5377D42;The iShares MSCI Australia UCITS ETF seeks to track the MSCI Australia index. The MSCI Australia index tracks large and mid cap companies from Australia. The ETF's TER (total expense ratio) amounts to 0.50% p.a.. The iShares MSCI Australia UCITS ETF is the only ETF that tracks the MSCI Australia index. The ETF replicates the performance of the underlying index by full replication (buying all the index constituents). The dividends in the ETF are accumulated and reinvested in the ETF. The iShares MSCI Australia UCITS ETF has 371m Euro assets under management. The ETF was launched on 22 January 2010 and is domiciled in Ireland.;Ishares MSCI Australia UCITS ETF se snaží sledovat index MSCI Australia. Index MSCI Australia sleduje velké a střední společnosti z Austrálie. TER (celkový poměr výdajů) ETF činí 0,50% p.a. IShares MSCI Australia UCITS ETF je jediný ETF, který sleduje index MSCI Australia. ETF replikuje výkon podkladového indexu plnou replikací (nákup všech složek indexu). dividenday v ETF jsou akumulovány a reinvestovány do ETF. IShares MSCI Australia UCITS ETF má ve správě aktiv 371 milionů euro. ETF byl spuštěn 22. ledna 2010 a je se sídlem v Irsku.;0.50%;0.5;EUR 371m;371.0;EUR;USD;Ireland;iShares;22 January 2010;;;Physical;UCITS;MSCI Australia;Equity, Australia;;USD    Currency risk  Currency;1;Akcie;False;Celosvětově;48.0;-1.21;20.17;63.22;1.37;0.48;2.01;8.22;18.09;0.12;10.35;7.22;180.72;18.64;16.99;17.45;-0.06;0.37;0.59;-22.93;-22.93;-22.93;-44.57;;;;;Bolsa Mexicana de Valores;-;9;;;;;;;2025-09-21T22:12:32.062214;success;0;BHP Group Ltd.;9.79;CSL Ltd.;6.44;National Australia Bank Ltd.;5.85;Westpac Banking;5.69;Wesfarmers Ltd.;4.78;ANZ Group Holdings Ltd.;4.48;Macquarie Group Ltd.;3.87;Goodman Group;3.51;Woodside Energy Group;2.48;;;Australia;14.63;Other;1.04;;;;;;;Financials;39.73;Materials;17.38;Health Care;9.65;Consumer Discretionary;7.31;Energy;2.48;London Stock Exchange;GBX;SAUS;;;;gettex;EUR;IBC6;;;;Stuttgart Stock Exchange;EUR;IBC6;;;;Bolsa Mexicana de Valores;MXN;-;IAUSN MM;IAUSN.MX;;Borsa Italiana;EUR;SAUS;SAUS IMIAUINAVE;SAUS.MIIAUSINAVEUR.DE;;London Stock Exchange;USD;IAUS;IAUS LNIAUINAVU;IAUS.LIAUSINAVUSD.DE;;London Stock Exchange;GBP;-;SAUS LNIAUINAVG;SAUS.LIAUSINAVGBP.DE;;SIX Swiss Exchange;AUD;SAUS;SAUS SEIAUINAVG;SAUS.SIAUSINAVGBP.DE;;XETRA;EUR;IBC6;IBC6 GYIAUINAVG;IBC6.DEIAUSINAVGBP.DE;;;;;;;;3;61;12;5;15;10;19
