LU0292100046;Xtrackers MSCI Korea UCITS ETF 1C 1C;https://www.justetf.com/en/etf-profile.html?isin=LU0292100046;The Xtrackers MSCI Korea UCITS ETF 1C 1C seeks to track the MSCI Korea 20/35 Custom index. The MSCI Korea 20/35 Custom index tracks large and mid cap Korean stocks. The weight of the largest constituent is constrained to 35% and the weights of all other constituents are constrained to a maximum of 20%. A buffer of 10% is applied on these limits at each index rebalancing. The ETF's TER (total expense ratio) amounts to 0.45% p.a.. The Xtrackers MSCI Korea UCITS ETF 1C 1C is the only ETF that tracks the MSCI Korea 20/35 Custom index. The ETF replicates the performance of the underlying index by full replication (buying all the index constituents). The dividends in the ETF are accumulated and reinvested in the ETF. The Xtrackers MSCI Korea UCITS ETF 1C 1C is a small ETF with 44m Euro assets under management. The ETF was launched on 5 July 2007 and is domiciled in Luxembourg.;Xtrackers MSCI Korea UCITS ETF 1C 1C se snaží sledovat vlastní index MSCI Korea 20/35. Vlastní index MSCI Korea 20/35 sleduje velké a střední korejské akcie. Hmotnost největší složky je omezena na 35% a hmotnosti všech ostatních složek jsou omezeny na maximálně 20%. Na tyto limity se při každém vyvážení indexu použije vyrovnávací paměť 10%. TER (celkový poměr nákladů) činí 0,45% p.a. Xtrackers MSCI Korea UCITS ETF 1C 1C je jediný ETF, který sleduje vlastní index MSCI 20/35. ETF replikuje výkon podkladového indexu plnou replikací (nákup všech složek indexu). dividenday v ETF jsou akumulovány a reinvestovány do ETF. Xtrackers MSCI Korea UCITS ETF 1C 1C je malý ETF s spravováním 44 milionů euro. ETF byl spuštěn 5. července 2007 a je bydliště v Lucemburku.;0.45%;0.45;EUR 44m;44.0;EUR;USD;Luxembourg;Xtrackers;5 July 2007;;;Physical;;MSCI Korea  1C 1C;Equity, South Korea;;Akcie;False;Asie;81.0;23.12;30.92;28.3;38.94;25.28;24.07;22.89;0.91;0.39;0.22;-23.76;-30.99;-42.25;-67.94;;;;;Hong Kong Stock Exchange;-;10;;;;;;;2025-09-19T11:06:55.552054;success;0;SK hynix, Inc.;10.56;Samsung Electronics Co., Ltd.;3.52;KB Financial Group, Inc.;3.1;HANWHA AEROSPACE Co., Ltd.;2.46;NAVER Corp.;2.45;Hyundai Motor Co., Ltd.;2.23;Shinhan Financial Group Co., Ltd.;2.16;Celltrion, Inc.;2.15;Doosan Enerbility Co., Ltd.;2.1;;;;;;;;;;;;;Technology;43.06;Industrials;16.99;Financials;12.92;Consumer Discretionary;7.97;;;gettex;EUR;DBX8;;;;Borsa Italiana;EUR;XMKO;XMKO IMINXKO;XMKO.MIINXKOINAV.PA;;Hong Kong Stock Exchange;HKD;-;2848 HKXMKOINAV;2848.HKXMKONAV.DE;;London Stock Exchange;GBX;XKS2;XKS2 LNXMKOINVG;XKS2.LXMKOINAVGBP.DE;;London Stock Exchange;USD;XKSD;XKSD LNXMKOINVU;XKSD.LXMKOINAVUSD.DE;;3;57;12;1;15;10;19
LU0292100806;Xtrackers MSCI Europe Materials Screened UCITS ETF 1C 1C;https://www.justetf.com/en/etf-profile.html?isin=LU0292100806;The Xtrackers MSCI Europe Materials Screened UCITS ETF 1C 1C seeks to track the MSCI Europe Materials Screened 20-35 index. The MSCI Europe Materials Screened 20-35 index tracks the European materials sector. The stocks included are filtered according to ESG criteria (environmental, social and corporate governance). Excluded sectors and companies: weapons, tobacco, thermal coal, oil sands, non-compliance with UN Global Compact. The weight of the largest constituent is constrained to 35% and the weights of all other constituents are constrained to a maximum of 20%. The ETF's TER (total expense ratio) amounts to 0.17% p.a.. The Xtrackers MSCI Europe Materials Screened UCITS ETF 1C 1C is the only ETF that tracks the MSCI Europe Materials Screened 20-35 index. The ETF replicates the performance of the underlying index by full replication (buying all the index constituents). The dividends in the ETF are accumulated and reinvested in the ETF. The Xtrackers MSCI Europe Materials Screened UCITS ETF 1C 1C is a small ETF with 41m Euro assets under management. The ETF was launched on 26 June 2007 and is domiciled in Luxembourg.;Materiály XTrackers MSCI Europe Screened UCITS ETF 1C 1C se snaží sledovat materiály MSCI Europe promítané index 20-35. Materiály MSCI Europe promítly 20-35 indexů sleduje evropský sektor materiálů. Zahrnuté akcie jsou filtrovány podle kritérií ESG (environmentální, sociální a správa a společností). Vyloučené odvětví a společnosti: Zbraně, tabák, tepelné uhlí, ropné písky, nedodržování globálního kompaktního oSN. Hmotnost největší složky je omezena na 35% a hmotnosti všech ostatních složek jsou omezeny na maximálně 20%. TER (celkový poměr nákladů) činí 0,17% p.a. Materiály Xtrackers MSCI Europe promítané UCITS ETF 1C 1C je jediným ETF, který sleduje materiály MSCI Europe promítané index 20-35. ETF replikuje výkon podkladového indexu plnou replikací (nákup všech složek indexu). dividenday v ETF jsou akumulovány a reinvestovány do ETF. Materiály XTrackers MSCI Europe Screened UCITS ETF 1C 1C je malá ETF s spravováním 41 milionů euro. ETF byl spuštěn 26. června 2007 a je se sídlem v Lucemburku.;0.17%;0.17;EUR 41m;41.0;EUR;EUR;Luxembourg;Xtrackers;26 June 2007;;;Physical;;MSCI Europe;;Yes;Akcie;False;Evropa;25.0;-2.26;32.24;58.74;3.88;15.27;14.97;18.95;-0.15;0.65;0.51;-17.48;-17.48;-25.92;-73.94;;;;;gettex;DXSC;5;;;;;;;2025-09-19T11:07:04.340348;success;0;Holcim Ltd.;8.97;Givaudan SA;8.12;Sika AG;7.4;Anglo American Plc;6.93;Heidelberg Materials AG;6.64;Novonesis (Novozymes A/S);4.53;DSM-Firmenich AG;3.75;UPM-Kymmene Oyj;3.27;Symrise AG;2.64;;;Other;32.67;Switzerland;26.67;France;25.6;Germany;10.33;;;IT;26.67;;;;;;;;;gettex;EUR;DXSC;;;;Borsa Italiana;EUR;XSPR;XSPR IMXSPRINVG;XSPR.MIXSPRINAVGBP.DE;;London Stock Exchange;GBX;XSPR;XSPR LNXSPRINAV;XSPR.LXSPRNAV.DE;;Stuttgart Stock Exchange;EUR;DXSC;XSPR GS;XSPR.SG;;XETRA;EUR;DXSC;XSPR GY;XSPR.DE;;3;63;17;1;15;10;20
LU0292103222;Xtrackers MSCI Europe Health Care Screened UCITS ETF 1C 1C;https://www.justetf.com/en/etf-profile.html?isin=LU0292103222;The Xtrackers MSCI Europe Health Care Screened UCITS ETF 1C 1C seeks to track the MSCI Europe Health Care Screened 20-35 index. The MSCI Europe Health Care Screened 20-35 index tracks large and mid cap European companies from the health care sector. The stocks included are filtered according to ESG criteria (environmental, social and corporate governance). Excluded sectors and companies: weapons, tobacco, thermal coal, oil sands, non-compliance with UN Global Compact. The weight of the largest constituent is constrained to 35% and the weights of all other constituents are constrained to a maximum of 20%. The ETF's TER (total expense ratio) amounts to 0.17% p.a.. The Xtrackers MSCI Europe Health Care Screened UCITS ETF 1C 1C is the only ETF that tracks the MSCI Europe Health Care Screened 20-35 index. The ETF replicates the performance of the underlying index by full replication (buying all the index constituents). The dividends in the ETF are accumulated and reinvested in the ETF. The Xtrackers MSCI Europe Health Care Screened UCITS ETF 1C 1C has 235m Euro assets under management. The ETF was launched on 26 June 2007 and is domiciled in Luxembourg.;Xtrackers MSCI Europe Health Care Screeked UCITS ETF 1C 1C se snaží sledovat index MSCI Europe Health Care promítán 20-35. Zdravotní péče MSCI Europe promítla 20-35 indexových indexů velkých a středních evropských společností ze zdravotnického sektoru. Zahrnuté akcie jsou filtrovány podle kritérií ESG (environmentální, sociální a správa a společností). Vyloučené odvětví a společnosti: Zbraně, tabák, tepelné uhlí, ropné písky, nedodržování globálního kompaktního oSN. Hmotnost největší složky je omezena na 35% a hmotnosti všech ostatních složek jsou omezeny na maximálně 20%. TER (celkový poměr nákladů) činí 0,17% P.A .. Xtrackers MSCI Europe Health Care Screedate UCITS ETF 1C 1C je jediný ETF, který sleduje index zdravotní péče MSCI Europe 20-35. ETF replikuje výkon podkladového indexu plnou replikací (nákup všech složek indexu). dividenday v ETF jsou akumulovány a reinvestovány do ETF. Xtrackers MSCI Europe Health Care Screeked UCITS ETF 1C 1C má 235 milionů euro aktiv pod správou. ETF byl spuštěn 26. června 2007 a je se sídlem v Lucemburku.;0.17%;0.17;EUR 235m;235.0;EUR;EUR;Luxembourg;Xtrackers;26 June 2007;;;Physical;;MSCI Europe;;Yes;Akcie;False;Evropa;29.0;-15.45;13.84;24.26;-4.74;18.78;15.43;15.16;-0.82;0.29;0.29;-23.93;-27.29;-27.29;-34.62;;;;;gettex;DXSE;5;;;;;;;2025-09-19T11:07:12.006793;success;0;Novartis AG;15.52;Roche Holding AG;14.68;Novo Nordisk A/S;11.44;Sanofi;7.23;EssilorLuxottica SA;5.97;GSK Plc;5.28;Lonza Group AG;3.37;Haleon;2.82;argenx;2.76;;;Switzerland;38.68;United Kingdom;24.19;Other;20.07;France;14.3;Netherlands;2.76;IT;38.68;Consumer Discretionary;5.97;Consumer Staples;2.82;;;;;gettex;EUR;DXSE;;;;Borsa Italiana;EUR;XSDR;XSDR IMXSDRINVG;XSDR.MIXSDRINAVGBP.DE;;London Stock Exchange;GBX;XSDR;XSDR LNXSDRINAV;XSDR.LXSDRNAV.DE;;Stuttgart Stock Exchange;EUR;DXSE;XSDR GS;XSDR.SG;;XETRA;EUR;DXSE;DXSE GY;DXSE.DE;;3;63;17;5;15;10;16
LU0292103651;Xtrackers MSCI Europe Financials Screened UCITS ETF 1C 1C;https://www.justetf.com/en/etf-profile.html?isin=LU0292103651;The Xtrackers MSCI Europe Financials Screened UCITS ETF 1C 1C seeks to track the MSCI Europe Financials Screened 20-35 index. The MSCI Europe Financials Screened 20-35 index tracks large and mid cap European companies from the financial sector. The stocks included are filtered according to ESG criteria (environmental, social and corporate governance). Excluded sectors and companies: weapons, tobacco, thermal coal, oil sands, non-compliance with UN Global Compact. The weight of the largest constituent is constrained to 35% and the weights of all other constituents are constrained to a maximum of 20%. The ETF's TER (total expense ratio) amounts to 0.17% p.a.. The Xtrackers MSCI Europe Financials Screened UCITS ETF 1C 1C is the only ETF that tracks the MSCI Europe Financials Screened 20-35 index. The ETF replicates the performance of the underlying index by full replication (buying all the index constituents). The dividends in the ETF are accumulated and reinvested in the ETF. The Xtrackers MSCI Europe Financials Screened UCITS ETF 1C 1C is a small ETF with 95m Euro assets under management. The ETF was launched on 26 June 2007 and is domiciled in Luxembourg.;Xtrackers MSCI Europe Financials Scheed UCITS ETF 1C 1C se snaží sledovat finanční prostředky MSCI Europe promítané index 20-35. Finanční prostředky MSCI Europe promítly 20-35 indexových indexů velkých a středních evropských společností z finančního sektoru. Zahrnuté akcie jsou filtrovány podle kritérií ESG (environmentální, sociální a správa a společností). Vyloučené odvětví a společnosti: Zbraně, tabák, tepelné uhlí, ropné písky, nedodržování globálního kompaktního oSN. Hmotnost největší složky je omezena na 35% a hmotnosti všech ostatních složek jsou omezeny na maximálně 20%. TER ETF TER (celkový poměr nákladů) činí 0,17% P.A .. Xtrackers MSCI Europe Financials Screened UCITS ETF 1C 1C je jediný ETF, který sleduje finanční prostředky MSCI Europe promítal index 20-35. ETF replikuje výkon podkladového indexu plnou replikací (nákup všech složek indexu). dividenday v ETF jsou akumulovány a reinvestovány do ETF. Xtrackers MSCI Europe Financial Screened UCITS ETF 1C 1C je malá ETF s spravováním 95 milionů euro. ETF byl spuštěn 26. června 2007 a je se sídlem v Lucemburku.;0.17%;0.17;EUR 95m;95.0;EUR;EUR;Luxembourg;Xtrackers;26 June 2007;;;Physical;;MSCI Europe;;Yes;Akcie;False;Evropa;55.0;34.4;103.6;223.88;25.95;17.87;16.14;20.61;1.93;1.66;1.28;-17.19;-17.19;-23.13;-81.65;;;;;Stockholm Stock Exchange;-;6;;;;;;;2025-09-19T11:07:18.609117;success;0;Banco Santander SA;7.44;UBS Group AG;6.82;Zurich Insurance Group AG;5.45;BNP Paribas SA;4.72;AXA SA;4.19;Barclays PLC;3.72;Deutsche Bank AG;3.5;Lloyds Banking Group;3.48;London Stock Exchange Group plc;3.16;;;Other;34.58;United Kingdom;30.9;Switzerland;17.03;France;9.52;;;IT;30.9;Technology;3.2;;;;;;;gettex;EUR;XS7R;;;;Borsa Italiana;EUR;XS7R;XS7R IM;XS7R.MI;;London Stock Exchange;GBX;XS7R;XS7R LNXS7RINAV;XS7R.LXS7RNAV.DE;;Stockholm Stock Exchange;SEK;-;XS7R SS;XS7R.ST;;Stuttgart Stock Exchange;EUR;DXSF;XS7R GS;XS7R.SG;;3;63;17;1;15;10;20
LU0292104030;Xtrackers MSCI Europe Communication Services Screened UCITS ETF 1C 1C;https://www.justetf.com/en/etf-profile.html?isin=LU0292104030;The Xtrackers MSCI Europe Communication Services Screened UCITS ETF 1C 1C seeks to track the MSCI Europe Communication Services Screened 20-35 index. The MSCI Europe Communication Services Screened 20-35 index tracks large and mid cap stocks from Europe. All securities in the index are classified in the Communication Services sector as per the Global Industry Classification Standard (GICS). The stocks included are filtered according to ESG criteria (environmental, social and corporate governance). Excluded sectors and companies: weapons, tobacco, thermal coal, oil sands, non-compliance with UN Global Compact. The weight of the largest constituent is constrained to 35% and the weights of all other constituents are constrained to a maximum of 20%. The ETF's TER (total expense ratio) amounts to 0.17% p.a.. The Xtrackers MSCI Europe Communication Services Screened UCITS ETF 1C 1C is the only ETF that tracks the MSCI Europe Communication Services Screened 20-35 index. The ETF replicates the performance of the underlying index by full replication (buying all the index constituents). The dividends in the ETF are accumulated and reinvested in the ETF. The Xtrackers MSCI Europe Communication Services Screened UCITS ETF 1C 1C is a very small ETF with 7m Euro assets under management. The ETF was launched on 29 June 2007 and is domiciled in Luxembourg.;Komunikační služby XTrackers MSCI Europe Spólované uCITS ETF 1C 1C se snaží sledovat komunikační služby MSCI Europe promítané index 20-35. Komunikační služby MSCI Europe promítly 20-35 indexových skladby velké a střední kapitálové akciíy z Evropy. Všechny cenné papíry v indexu jsou klasifikovány v sektoru komunikačních služeb podle globálního standardu klasifikace průmyslu (GIC). Zahrnuté akcie jsou filtrovány podle kritérií ESG (environmentální, sociální a správa a společností). Vyloučené odvětví a společnosti: Zbraně, tabák, tepelné uhlí, ropné písky, nedodržování globálního kompaktního oSN. Hmotnost největší složky je omezena na 35% a hmotnosti všech ostatních složek jsou omezeny na maximálně 20%. TER (celkový poměr výdajů) činí 0,17% P.A .. Komunikační služby Xtrackers MSCI Europe Spótily UCITS ETF 1C 1C je jediným ETF, který sleduje komunikační služby MSCI Europe promítáno 20-35 index. ETF replikuje výkon podkladového indexu plnou replikací (nákup všech složek indexu). dividenday v ETF jsou akumulovány a reinvestovány do ETF. Komunikační služby Xtrackers MSCI Europe Spólované UCITS ETF 1C 1C je velmi malá ETF s správou 7m euro. ETF byla spuštěna 29. června 2007 a je bydliště v Lucemburku.;0.17%;0.17;EUR 7m;7.0;EUR;EUR;Luxembourg;Xtrackers;29 June 2007;;;Physical;;MSCI Europe;;Yes;Akcie;False;Evropa;14.0;11.83;48.71;65.82;14.14;14.76;12.65;13.5;0.8;1.12;0.79;-8.93;-12.39;-20.44;-47.79;;;;;gettex;DXSG;5;;;;;;;2025-09-19T11:07:25.421501;success;0;Spotify Technology SA;17.0;Swisscom;7.28;Royal KPN NV;6.99;Cellnex Telecom SA;6.79;Informa Plc;5.99;Telenor ASA;3.87;Scout24 SE;3.84;Auto Trader Group;3.72;Tele2 AB;3.61;;;Germany;37.23;Other;28.79;United Kingdom;9.7;Switzerland;7.28;;;Technology;17.0;IT;9.7;;;;;;;gettex;EUR;DXSG;;;;Borsa Italiana;EUR;XSKR;XSKR IMXSKRINVG;XSKR.MIXSKRINAVGBP.DE;;London Stock Exchange;GBX;XSKR;XSKR LNXSKRINAV;XSKR.LXSKRNAV.DE;;Stuttgart Stock Exchange;EUR;DXSG;XSKR GS;XSKR.SG;;XETRA;EUR;DXSG;XSKR GY;XSKR.DE;;3;63;17;1;15;10;20
LU0292104469;Xtrackers MSCI Europe Information Technology Screened UCITS ETF 1C 1C;https://www.justetf.com/en/etf-profile.html?isin=LU0292104469;The Xtrackers MSCI Europe Information Technology Screened UCITS ETF 1C 1C seeks to track the MSCI Europe Information Technology Screened 20-35 index. The MSCI Europe Information Technology Screened 20-35 index tracks large and mid cap European companies from the information technology sector. The stocks included are filtered according to ESG criteria (environmental, social and corporate governance). Excluded sectors and companies: weapons, tobacco, thermal coal, oil sands, non-compliance with UN Global Compact. The weight of the largest constituent is constrained to 35% and the weights of all other constituents are constrained to a maximum of 20%. The ETF's TER (total expense ratio) amounts to 0.17% p.a.. The Xtrackers MSCI Europe Information Technology Screened UCITS ETF 1C 1C is the only ETF that tracks the MSCI Europe Information Technology Screened 20-35 index. The ETF replicates the performance of the underlying index by full replication (buying all the index constituents). The dividends in the ETF are accumulated and reinvested in the ETF. The Xtrackers MSCI Europe Information Technology Screened UCITS ETF 1C 1C is a small ETF with 42m Euro assets under management. The ETF was launched on 29 June 2007 and is domiciled in Luxembourg.;Informační technologie XTrackers MSCI Europe Screened UCITS ETF 1C 1C se snaží sledovat informační technologii MSCI Europe promítané index 20-35. Informační technologie MSCI Europe promítána 20-35 indexů sleduje velké a střední evropské společnosti z sektoru informačních technologií. Zahrnuté akcie jsou filtrovány podle kritérií ESG (environmentální, sociální a správa a společností). Vyloučené odvětví a společnosti: Zbraně, tabák, tepelné uhlí, ropné písky, nedodržování globálního kompaktního oSN. Hmotnost největší složky je omezena na 35% a hmotnosti všech ostatních složek jsou omezeny na maximálně 20%. TER (celkový poměr výdajů) činí 0,17% P.A .. Informační technologie Xtrackers MSCI Europe Screedated UCITS ETF 1C 1C je jediným ETF, který sleduje informační technologii MSCI Europe promítnuté 20-35 index. ETF replikuje výkon podkladového indexu plnou replikací (nákup všech složek indexu). dividenday v ETF jsou akumulovány a reinvestovány do ETF. Informační technologie XTrackers MSCI Europe Screened UCITS ETF 1C 1C je malá ETF s spravováním 42 milionů euro. ETF byla spuštěna 29. června 2007 a je bydliště v Lucemburku.;0.17%;0.17;EUR 42m;42.0;EUR;EUR;Luxembourg;Xtrackers;29 June 2007;;;Physical;;MSCI Europe;;Yes;Akcie;False;Evropa;;-7.49;29.48;26.92;-8.99;24.2;22.81;24.06;-0.31;0.39;0.2;-25.81;-27.7;-38.01;-62.66;;;;;Stuttgart Stock Exchange;DXSH;5;;;;;;;2025-09-19T11:07:31.270832;success;0;Hexagon AB;13.24;Capgemini SE;13.15;ASM International NV;12.67;Dassault Systèmes SE;11.7;The Sage Group;8.15;BE Semiconductor Industries NV;6.46;Nemetschek;4.53;Temenos AG;2.77;;;;;Germany;31.85;France;24.85;Netherlands;19.13;Other;10.93;;;IT;8.99;;;;;;;;;gettex;EUR;XS8R;;;;Borsa Italiana;EUR;XS8R;XS8R IMXS8RINVG;XS8R.MIXS8RINAVGBP.DE;;London Stock Exchange;GBX;XS8R;XS8R LNXS8RINAV;XS8R.LXS8RNAV.DE;;Stuttgart Stock Exchange;EUR;DXSH;XS8R GS;XS8R.SG;;XETRA;EUR;XS8R;XS8R GY;XS8R.DE;;3;62;17;1;15;10;19
LU0292104899;Xtrackers MSCI Europe Utilities Screened UCITS ETF 1C 1C;https://www.justetf.com/en/etf-profile.html?isin=LU0292104899;The Xtrackers MSCI Europe Utilities Screened UCITS ETF 1C 1C seeks to track the MSCI Europe Utilities Screened 20-35 index. The MSCI Europe Utilities Screened 20-35 index tracks European companies active in the utilities sector. The stocks included are filtered according to ESG criteria (environmental, social and corporate governance). Excluded sectors and companies: weapons, tobacco, thermal coal, oil sands, non-compliance with UN Global Compact. The weight of the largest constituent is constrained to 35% and the weights of all other constituents are constrained to a maximum of 20%. The ETF's TER (total expense ratio) amounts to 0.17% p.a.. The Xtrackers MSCI Europe Utilities Screened UCITS ETF 1C 1C is the only ETF that tracks the MSCI Europe Utilities Screened 20-35 index. The ETF replicates the performance of the underlying index by full replication (buying all the index constituents). The dividends in the ETF are accumulated and reinvested in the ETF. The Xtrackers MSCI Europe Utilities Screened UCITS ETF 1C 1C is a small ETF with 43m Euro assets under management. The ETF was launched on 3 July 2007 and is domiciled in Luxembourg.;Utility XTrackers MSCI Europe Screed UCITS ETF 1C 1C se snaží sledovat index MSCI Europe Sheed 20-35. Nástroje MSCI Europe promítly 20-35 indexových stop evropských společností aktivních v odvětví veřejných služeb. Zahrnuté akcie jsou filtrovány podle kritérií ESG (environmentální, sociální a správa a společností). Vyloučené odvětví a společnosti: Zbraně, tabák, tepelné uhlí, ropné písky, nedodržování globálního kompaktního oSN. Hmotnost největší složky je omezena na 35% a hmotnosti všech ostatních složek jsou omezeny na maximálně 20%. Ter (celkový poměr nákladů) ETF činí 0,17% p.a. Nástroje Xtrackers MSCI Europe Sheed UCITS ETF 1C 1C je jediným ETF, který sleduje index Utility MSCI Europe promítnuté 20-35. ETF replikuje výkon podkladového indexu plnou replikací (nákup všech složek indexu). dividenday v ETF jsou akumulovány a reinvestovány do ETF. USCITS ETF 1C 1C pro Scheed UCTITS pro XTrackers MSCI Europe je malý ETF s managementem 43 milionů euro. ETF byl spuštěn 3. července 2007 a je byd v Lucemburku.;0.17%;0.17;EUR 43m;43.0;EUR;EUR;Luxembourg;Xtrackers;3 July 2007;;;Physical;;MSCI Europe;;Yes;Akcie;False;Evropa;20.0;7.51;37.37;50.49;15.7;15.58;14.96;15.9;0.48;0.75;0.54;-10.49;-14.71;-23.88;-51.33;;;;;Stuttgart Stock Exchange;DXSI;5;;;;;;;2025-09-19T11:07:38.741954;success;0;Enel SpA;15.27;National Grid;15.05;E.ON SE;8.94;SSE;5.97;Veolia Environnement SA;4.79;EDP SA;3.01;TERNA Rete Elettrica Nazionale SpA;2.97;SNAM SpA;2.56;United Utilities Group Plc;2.22;;;United Kingdom;25.31;Other;14.79;Germany;8.94;;;;;IT;2.22;;;;;;;;;gettex;EUR;XS6R;;;;Borsa Italiana;EUR;XS6R;XS6R IMXS6RINVG;XS6R.MIXS6RINAVGBP.DE;;London Stock Exchange;GBX;XS6R;XS6R LNXS6RINAV;XS6R.LXS6RNAV.DE;;Stuttgart Stock Exchange;EUR;DXSI;XS6R GS;XS6R.SG;;XETRA;EUR;XS6R;XS6R GY;XS6R.DE;;3;63;17;1;15;10;20
