IE00BG47KF31;Vanguard Global Aggregate Bond UCITS ETF CHF Hedged Accumulating;https://www.justetf.com/en/etf-profile.html?isin=IE00BG47KF31;The Vanguard Global Aggregate Bond UCITS ETF CHF Hedged Accumulating seeks to track the Bloomberg Global Aggregate Float Adjusted and Scaled (CHF Hedged) index. The Bloomberg Global Aggregate Float Adjusted and Scaled (CHF Hedged) index tracks bonds from issuers worldwide. The index contains corporate bonds and government bonds. All maturities are included. Rating: Investment Grade. Currency hedged to Swiss Francs (CHF). The ETF's TER (total expense ratio) amounts to 0.08% p.a.. The ETF replicates the performance of the underlying index by sampling technique (buying a selection of the most relevant index constituents). The interest income (coupons) in the ETF is accumulated and reinvested in the ETF. The Vanguard Global Aggregate Bond UCITS ETF CHF Hedged Accumulating is a small ETF with 26m Euro assets under management. The ETF was launched on 14 September 2021 and is domiciled in Ireland.;Vanguard Global Agregate Bond UCITS ETF CHF zajišťuje akumulační usiluje o sledování globálního agregovaného float Bloomberg upraveného a škálovaného (CHF Hedged). Bloomberg globální agregovaný plovák upravený a upravený (CHF Hedged) Indexové sleduje vazby od emitentů po celém světě. Index obsahuje firemní dluhopisy a vládní dluhopisy. Zahrnuty jsou všechna splatností. Hodnocení: Investiční třída. Měna byla zajištěna švýcarským frankům (CHF). TER (celkový poměr nákladů) ETF činí 0,08% p.a. ETF replikuje výkon podkladového indexu technikou vzorkování (nákup výběru nejdůležitějších složek indexu). Úrokové výnosy (kupóny) v ETF se nashromáždí a reinvestují do ETF. Vanguard Global Agregate Bond UCITS ETF CHF Hedged Akumulace je malý ETF s spravováním 26 milionů euro. ETF byl spuštěn 14. září 2021 a je sídlí v Irsku.;0.08%;0.08;EUR 26m;26.0;EUR;CHF;Ireland;Vanguard;14 September 2021;Accumulating;;Physical;UCITS;;Bonds, World, Aggregate, All maturities;;CHF    Currency risk  Currency;1;Dluhopisy;False;Celosvětově;7967.0;-0.35;1.66;;1.89;1.52;1.48;3.52;;-11.58;8.82;-3.01;-1.52;8.16;10.37;;-0.04;0.05;;-5.82;-9.6;;-14.31;;;;;Extracted (method 1);VAGX;0;;;;;;;2025-09-24T01:25:10.570839;success;0;DE0001102606;0.24;FR0013451507;0.19;FR0013407236;0.19;;;;;;;;;;;;;;;Other;58.3;United States;25.83;Japan;7.52;France;4.77;Germany;3.58;;;;;;;;;;;;;;;;;;;;;;;;;;;;;;;;;;;;;;;;;;;;;;;;;;;;;;;;;;;;;;;;;;;;;;;3;52;26;1;6;10;9
IE00BG47KG48;Vanguard Global Aggregate Bond UCITS ETF GBP Hedged Distributing;https://www.justetf.com/en/etf-profile.html?isin=IE00BG47KG48;The Vanguard Global Aggregate Bond UCITS ETF GBP Hedged Distributing seeks to track the Bloomberg Global Aggregate Float Adjusted and Scaled (GBP Hedged) index. The Bloomberg Global Aggregate Float Adjusted and Scaled (GBP Hedged) index tracks bonds from issuers worldwide. The index contains corporate bonds and government bonds. All maturities are included. Rating: Investment Grade. Currency hedged to British Pound (GBP). The ETF's TER (total expense ratio) amounts to 0.08% p.a.. The ETF replicates the performance of the underlying index by sampling technique (buying a selection of the most relevant index constituents). The interest income (coupons) in the ETF is distributed to the investors (Monthly). The Vanguard Global Aggregate Bond UCITS ETF GBP Hedged Distributing has 142m Euro assets under management. The ETF was launched on 18 June 2019 and is domiciled in Ireland.;Vanguard Global Agregate Bond UCITS ETF GBP HEDGED DISTRIBUTIONS usiluje o sledování globálního agregovaného float Bloomberg upraveného a škálovaného (GBP Hedged). Bloomberg globální agregovaný plovák upravil a upravil (GBP Hedged) Indexové sleduje dluhopisy od emitentů po celém světě. Index obsahuje firemní dluhopisy a vládní dluhopisy. Zahrnuty jsou všechna splatností. Hodnocení: Investiční třída. Měna zajišťovala britskou libru (GBP). TER (celkový poměr nákladů) ETF činí 0,08% p.a. ETF replikuje výkon podkladového indexu technikou vzorkování (nákup výběru nejdůležitějších složek indexu). Úrokové výnosy (kupóny) v ETF jsou distribuovány investorům (měsíčně). Vanguard Global Agregate Bond UCITS ETF GBP Hedged Distribution má 142 milionů euro aktiv pod správou. ETF byl spuštěn 18. června 2019 a je se sídlem v Irsku.;0.08%;0.08;EUR 142m;142.0;EUR;GBP;Ireland;Vanguard;18 June 2019;Distributing;Monthly;Physical;UCITS;;Bonds, World, Aggregate, All maturities;;GBP    Currency risk  Currency;1;Dluhopisy;False;Celosvětově;7967.0;-1.02;12.94;1.47;-0.89;-0.82;-0.23;-0.87;5.04;-18.84;8.61;6.79;4.64;8.74;10.76;10.26;-0.12;0.38;0.03;-6.22;-7.56;-20.88;-20.88;;;;;Extracted (method 1);VAGP;0;3.57%;3.57;EUR 0.93;0.93;EUR;method2_regex;2025-09-24T01:25:17.338085;success;0;DE0001102606;0.24;FR0013451507;0.19;FR0013407236;0.19;;;;;;;;;;;;;;;Other;58.71;United States;25.57;Japan;7.45;France;4.72;Germany;3.55;;;;;;;;;;;;;;;;;;;;;;;;;;;;;;;;;;;;;;;;;;;;;;;;;;;;;;;;;;;;;;;;;;;;;;;4;66;26;5;8;10;17
IE00BG47KH54;Vanguard Global Aggregate Bond UCITS ETF EUR Hedged Accumulating;https://www.justetf.com/en/etf-profile.html?isin=IE00BG47KH54;The Vanguard Global Aggregate Bond UCITS ETF EUR Hedged Accumulating seeks to track the Bloomberg Global Aggregate Float Adjusted and Scaled (EUR Hedged) index. The Bloomberg Global Aggregate Float Adjusted and Scaled (EUR Hedged) index tracks bonds from issuers worldwide. The index contains corporate bonds and government bonds. All maturities are included. Rating: Investment Grade. Currency hedged to Euro (EUR). The ETF's TER (total expense ratio) amounts to 0.08% p.a.. The Vanguard Global Aggregate Bond UCITS ETF EUR Hedged Accumulating is the cheapest and largest ETF that tracks the Bloomberg Global Aggregate Float Adjusted and Scaled (EUR Hedged) index. The ETF replicates the performance of the underlying index by sampling technique (buying a selection of the most relevant index constituents). The interest income (coupons) in the ETF is accumulated and reinvested in the ETF. The Vanguard Global Aggregate Bond UCITS ETF EUR Hedged Accumulating is a very large ETF with 1,557m Euro assets under management. The ETF was launched on 18 June 2019 and is domiciled in Ireland.;Vanguard globální agregovaný dluhopis UCITS ETF EUR EUR akumulační usiluje o sledování globálního agregovaného float Bloomberg upraveného a škálovaného (EUR zajišťovaného). Bloomberg globální agregovaný plovák upravený a zmenšený (EUR zajišťovaný) indexové dluhopisy od emitentů po celém světě. Index obsahuje firemní dluhopisy a vládní dluhopisy. Zahrnuty jsou všechna splatností. Hodnocení: Investiční třída. Měna zajišťovala euro (EUR). TER (celkový poměr nákladů) činí 0,08% p.a. Vanguard globální agregovaný dluhopis UCITS ETF Eur zajišťoval akumulační je nejlevnější a největší ETF, který sleduje globální agregovaný float Bloomberg upravený a upravený (Eur Hedged) index. ETF replikuje výkon základního indexu technikou vzorkování (nákup výběru nejdůležitějších složek indexu). Úrokové výnosy (kupóny) v ETF se nashromáždí a reinvestují do ETF. Vanguard Global Agregate Bond UCITS ETF EUR EUR HORGED AKUMULACE je velmi velký ETF s 1 557 miliony euro ve spravování. ETF byl spuštěn 18. června 2019 a je se sídlem v Irsku.;0.08%;0.08;EUR 1557m;1557.0;EUR;EUR;Ireland;Vanguard;18 June 2019;Accumulating;;Physical;UCITS;;Bonds, USD, World, Aggregate, All maturities;;EUR    Currency risk  Currency;1;Dluhopisy;False;Celosvětově;7967.0;1.07;8.07;-9.81;3.09;-0.29;1.28;2.07;-2.42;-15.3;4.67;0.52;-5.35;6.8;8.73;8.26;0.16;0.3;-0.25;-3.69;-6.17;-19.55;-19.55;;;;;Extracted (method 1);VAGF;0;;;;;;;2025-09-24T01:25:22.244839;success;0;DE0001102606;0.24;FR0013451507;0.19;FR0013407236;0.19;;;;;;;;;;;;;;;Other;58.72;United States;25.57;Japan;7.44;France;4.72;Germany;3.55;;;;;;;;;;;;;;;;;;;;;;;;;;;;;;;;;;;;;;;;;;;;;;;;;;;;;;;;;;;;;;;;;;;;;;;4;71;26;13;8;10;14
IE00BG47KJ78;Vanguard Global Aggregate Bond UCITS ETF USD Hedged Accumulating;https://www.justetf.com/en/etf-profile.html?isin=IE00BG47KJ78;The Vanguard Global Aggregate Bond UCITS ETF USD Hedged Accumulating seeks to track the Bloomberg Global Aggregate Float Adjusted and Scaled (USD Hedged) index. The Bloomberg Global Aggregate Float Adjusted and Scaled (USD Hedged) index tracks bonds from issuers worldwide. The index contains corporate bonds and government bonds. All maturities are included. Rating: Investment Grade. Currency hedged to US-Dollar (USD). The ETF's TER (total expense ratio) amounts to 0.08% p.a.. The ETF replicates the performance of the underlying index by sampling technique (buying a selection of the most relevant index constituents). The interest income (coupons) in the ETF is accumulated and reinvested in the ETF. The Vanguard Global Aggregate Bond UCITS ETF USD Hedged Accumulating has 496m Euro assets under management. The ETF was launched on 18 June 2019 and is domiciled in Ireland.;Vanguard Global Agregate Bond UCITS ETF USD zajišťoval akumulační akumulační usiluje o sledování globálního agregovaného float Bloomberg upraveného a škálovaného (USD Hedged). Bloomberg globální agregovaný plovák upravený a zmenšený (USD zajišťovaný) indexoval dluhopisy od emitentů po celém světě. Index obsahuje firemní dluhopisy a vládní dluhopisy. Zahrnuty jsou všechna splatností. Hodnocení: Investiční třída. Měna byla zajištěna do amerického dolaru (USD). TER (celkový poměr nákladů) ETF činí 0,08% p.a. ETF replikuje výkon podkladového indexu technikou vzorkování (nákup výběru nejdůležitějších složek indexu). Úrokové výnosy (kupóny) v ETF se nashromáždí a reinvestují do ETF. Vanguard Global Agregate Bond UCITS ETF USD Hedged akumulace má 496 milionů euro aktiv ve spravování. ETF byl spuštěn 18. června 2019 a je se sídlem v Irsku.;0.08%;0.08;EUR 496m;496.0;EUR;USD;Ireland;Vanguard;18 June 2019;Accumulating;;Physical;UCITS;;Bonds, World, Aggregate, All maturities;;USD    Currency risk  Currency;1;Dluhopisy;False;Celosvětově;7967.0;-2.37;-3.94;-1.52;-7.89;-0.53;-0.26;-5.11;6.17;-7.55;3.44;9.09;1.43;8.68;8.87;8.6;-0.27;-0.15;-0.04;-10.95;-11.71;-12.29;-12.83;;;;;Extracted (method 1);VAGU;0;;;;;;;2025-09-24T01:25:28.611329;success;0;DE0001102606;0.24;FR0013451507;0.19;FR0013407236;0.19;;;;;;;;;;;;;;;Other;59.52;United States;25.07;Japan;7.3;France;4.63;Germany;3.48;;;;;;;;;;;;;;;;;;;;;;;;;;;;;;;;;;;;;;;;;;;;;;;;;;;;;;;;;;;;;;;;;;;;;;;3;57;26;5;8;10;8
IE00BG482169;Invesco Preferred Shares UCITS ETF A;https://www.justetf.com/en/etf-profile.html?isin=IE00BG482169;The Invesco Preferred Shares UCITS ETF A seeks to track the BofA Merrill Lynch Diversified Core Plus Fixed Rate Preferred Securities index. The BofA Merrill Lynch Diversified Core Plus Fixed Rate Preferred Securities index tracks fixed rate preferred securities. The index contains only securities, which have been issued in the USA and are denominated in US-Dollar. Issuers may come from other countries, but then these countries must hold a rating within the Investment Grade range. Issuers only need a rating of BB- or higher to be eligible for the index. The ETF's TER (total expense ratio) amounts to 0.50% p.a.. The ETF replicates the performance of the underlying index by full replication (buying all the index constituents). The dividends in the ETF are accumulated and reinvested in the ETF. The Invesco Preferred Shares UCITS ETF A is a small ETF with 66m Euro assets under management. The ETF was launched on 7 December 2018 and is domiciled in Ireland.;Preferované akcie Invesco UCITS ETF A usiluje o sledování indexu s diverzifikovaným jádrem BofA Merrill Lynch Diversified Core Plus Preferovaný index cenných papírů. Diverzifikované jádro Merrill Merrill Lynch Plus preferované index cenných papírů sleduje pevné cenné papíry. Index obsahuje pouze cenné papíry, které byly vydány v USA a jsou denominovány v americkém dolaru. Emitenti mohou pocházet z jiných zemí, ale pak tyto země musí mít v rozmezí investiční třídy hodnocení. Emitenti potřebují pouze hodnocení BB- nebo vyšší, aby byli způsobilí pro index. TER (celkový poměr nákladů) ETF činí 0,50% p.a. ETF replikuje výkon podkladového indexu plnou replikací (nákup všech složek indexu). dividenday v ETF jsou akumulovány a reinvestovány do ETF. Preferované akcie Invesco UCITS ETF A je malý ETF s managementem 66 milionů euro. ETF byla spuštěna 7. prosince 2018 a je bydliště v Irsku.;0.50%;0.5;EUR 66m;66.0;EUR;USD;Ireland;Invesco;7 December 2018;;;Physical;UCITS;;Equity, United States, Dividend;;USD    Currency risk  Currency;1;Akcie;False;Severní Amerika;253.0;-5.81;-3.53;1.41;-6.61;0.79;5.62;-3.76;11.18;-16.69;4.83;12.28;16.32;11.16;13.19;12.14;-0.52;-0.09;0.02;-16.0;-19.44;-23.0;-31.13;;;;;London Stock Exchange;PRAC;2;;;;;;;2025-09-24T01:25:35.981343;success;0;JPMorgan Chase & Co.;1.64;Wells Fargo & Co.;1.49;JPMorgan Chase & Co.;1.4;JPMorgan Chase & Co.;1.4;AT&T, Inc.;1.33;Bank of America Corp.;1.31;AT&T, Inc.;1.19;Bank of America Corp.;1.17;Capital One Financial;1.13;;;United States;74.17;Other;22.03;USA;0.5;;;;;Financials;49.76;Real Estate;5.87;;;;;;;London Stock Exchange;USD;PRAC;PRAC LNPRACIN;PRAC.LEQGEINAV.DE;;SIX Swiss Exchange;USD;PRAC;PRAC SWPRACIN;PRAC.SEQGEINAV.DE;;;;;;;;;;;;;;;;;;;;;;;;;;;;;;;;;;;;;;;;;;;;;;;;;;2;39;12;1;8;10;8
IE00BG5QQ390;iShares USD Corporate Bond ESG SRI 0-3yr UCITS ETF EUR Hedged (Acc);https://www.justetf.com/en/etf-profile.html?isin=IE00BG5QQ390;The iShares USD Corporate Bond ESG SRI 0-3yr UCITS ETF EUR Hedged (Acc) seeks to track the Bloomberg MSCI US Corporate 0-3 ESG SRI (EUR Hedged) index. The Bloomberg MSCI US Corporate 0-3 ESG SRI (EUR Hedged) index tracks US dollar-denominated corporate bonds. The index consists of ESG (environmental, social and governance) screened corporate bonds. Rating: Investment Grade. Maturity: 0-3 years. Currency hedged to Euro (EUR). The ETF's TER (total expense ratio) amounts to 0.14% p.a.. The iShares USD Corporate Bond ESG SRI 0-3yr UCITS ETF EUR Hedged (Acc) is the only ETF that tracks the Bloomberg MSCI US Corporate 0-3 ESG SRI (EUR Hedged) index. The ETF replicates the performance of the underlying index by sampling technique (buying a selection of the most relevant index constituents). The interest income (coupons) in the ETF is accumulated and reinvested in the ETF. The iShares USD Corporate Bond ESG SRI 0-3yr UCITS ETF EUR Hedged (Acc) has 273m Euro assets under management. The ETF was launched on 9 January 2019 and is domiciled in Ireland.;IShares USD podnikové dluhopisy ESG SRI 0-3yr UCITS ETF EUR Hedged (ACC) se snaží sledovat index Bloomberg MSCI US Corporate 0-3 ESG SRI (EUR Hedged). Index Bloomberg MSCI US Corporate 0-3 ESG SRI (EUR Hedged) sleduje firemní dluhopisy denominované dolarem. Index se skládá z ESG (environmentální, sociální a správa věcí veřejných) promítaných firemních dluhopisů. Hodnocení: Investiční třída. Dospělost: 0-3 roky. Měna zajišťovala euro (EUR). TER (celkový poměr nákladů) činí 0,14% P.A .. ISShares USD Corporate Bond ESG SRI 0-3yr UCITS ETF EUR (ACC) je jediný ETF, který sleduje index Bloomberg MSCI US Corporate 0-3 Esg Sri (Eur Hedged) Index. ETF replikuje výkon základního indexu technikou vzorkování (nákup výběru nejdůležitějších složek indexu). Úrokové výnosy (kupóny) v ETF se nashromáždí a reinvestují do ETF. IShares USD podnikové dluhopisy ESG SRI 0-3yr UCITS ETF EUR HEDGED (ACC) má pod správou 273 milionů euro aktiv. ETF byl spuštěn 9. ledna 2019 a má bydliště v Irsku.;0.14%;0.14;EUR 273m;273.0;EUR;EUR;Ireland;iShares;9 January 2019;Accumulating;;Physical;UCITS;;risk  Long-only    Sustainability  Yes;Yes;EUR    Currency risk  Currency;1;Dluhopisy;False;Celosvětově;1564.0;2.87;10.49;4.07;2.87;-0.56;0.94;1.7;-0.97;-4.49;3.27;3.37;7.19;6.18;7.01;6.65;0.46;0.48;0.12;-1.48;-2.81;-7.51;-7.51;;;;;Extracted (method 1);IU0E;0;;;;;;;2025-09-24T01:25:41.195453;success;0;;;;;;;;;;;;;;;;;;;;;United States;61.25;Other;27.11;United Kingdom;4.68;Canada;3.95;Japan;3.01;;;;;;;;;;;;;;;;;;;;;;;;;;;;;;;;;;;;;;;;;;;;;;;;;;;;;;;;;;;;;;;;;;;;;;;3;62;22;5;8;10;17
IE00BG7PP820;Invesco Communications S&P US Select Sector UCITS ETF A;https://www.justetf.com/en/etf-profile.html?isin=IE00BG7PP820;The Invesco Communications S&P US Select Sector UCITS ETF A seeks to track the S&P Select Sector Capped 20% Communications index. The S&P Select Sector Capped 20% Communications index tracks the US communications services industry. This sector includes classic telecommunication companies such as AT&T, but also companies formerly associated with the IT sector, such as Facebook. Also included are media companies such as Walt Disney or Netflix. The ETF's TER (total expense ratio) amounts to 0.14% p.a.. The Invesco Communications S&P US Select Sector UCITS ETF A is the only ETF that tracks the S&P Select Sector Capped 20% Communications index. The ETF replicates the performance of the underlying index synthetically with a swap. The dividends in the ETF are accumulated and reinvested in the ETF. The Invesco Communications S&P US Select Sector UCITS ETF A has 138m Euro assets under management. The ETF was launched on 14 September 2018 and is domiciled in Ireland.;Invesco Communications S&P Us Select Sector UCITS ETF A usiluje o sledování sektoru S&P Select zakončené 20% komunikační index. S&P Select Sector zakončené 20% komunikační index sleduje průmysl amerických komunikačních služeb. Tento sektor zahrnuje klasické telekomunikační společnosti, jako je AT&T, ale také společnosti dříve spojené s IT sektorem, jako je Facebook. Zahrnuty jsou také mediální společnosti jako Walt Disney nebo Netflix. TER (celkový poměr nákladů) ETF činí 0,14% p.a. Invesco Communications S&P Us Select Sector UCITS ETF A je jediný ETF, který sleduje sektor S&P Select zakončený 20% komunikační index. ETF replikuje výkon podkladového indexu synteticky s výměnou. dividenday v ETF jsou akumulovány a reinvestovány do ETF. Invesco Communications S&P US Select Sector UCITS ETF A má 138m euro aktiv pod správou. ETF byl spuštěn 14. září 2018 a je se sídlem v Irsku.;0.14%;0.14;EUR 138m;138.0;EUR;USD;Ireland;Invesco;14 September 2018;;;Synthetic (Unfunded swap);UCITS;;Equity, United States, Telecommunication;;USD    Currency risk  Currency;1;Akcie;False;Severní Amerika;;29.86;109.33;99.59;9.8;3.59;10.2;12.76;20.61;-34.94;45.3;46.4;150.79;19.59;19.98;20.96;1.52;1.4;0.71;-21.42;-21.42;-39.76;-39.76;;;;;London Stock Exchange;-;6;;;;;;;2025-09-24T01:25:46.623930;success;0;;;;;;;;;;;;;;;;;;;;;;;;;;;;;;;;;;;;;;;;;London Stock Exchange;GBX;XLCP;;;;gettex;EUR;SMLA;;;;Borsa Italiana;EUR;XLCS;XLCS IMXLCSINE;XLCS.MI18FRINAV.DE;;London Stock Exchange;USD;XLCS;XLCS LNXLCSIN;XLCS.L18FTINAV.DE;;London Stock Exchange;GBP;-;XLCP LNXLCPIN;XLCP.L18FSINAV.DE;;SIX Swiss Exchange;USD;XLCS;XLCS SWXLCSIN;XLCS.S18FTINAV.DE;;;;;;;;;;;;;;;;;;;;;;;;;;4;68;22;5;11;10;20
IE00BG88WG77;WisdomTree Enhanced Commodity UCITS ETF EUR Hedged Acc;https://www.justetf.com/en/etf-profile.html?isin=IE00BG88WG77;The WisdomTree Enhanced Commodity UCITS ETF EUR Hedged Acc seeks to track the Optimized Roll Commodity (EUR Hedged) index. The Optimized Roll Commodity (EUR Hedged) index tracks a broad commodity basket (agriculture, energy, precious metals, industrial metals) by using futures to track the performance of the Bloomberg Commodity index. The Optimized Roll Commodity (EUR Hedged) index also uses a rule based approach to determine the optimal time to renew these futures. This seeks to take full advantage of the return opportunities in a backwardated market, while minimizing losses in contango markets. Currency hedged to Euro (EUR). The ETF's TER (total expense ratio) amounts to 0.35% p.a.. The WisdomTree Enhanced Commodity UCITS ETF EUR Hedged Acc is the only ETF that tracks the Optimized Roll Commodity (EUR Hedged) index. The ETF replicates the performance of the underlying index synthetically with a swap. The WisdomTree Enhanced Commodity UCITS ETF EUR Hedged Acc is a very small ETF with 14m Euro assets under management. The ETF was launched on 14 August 2018 and is domiciled in Ireland.;WisdomTree Enhanced Commodity UCITS ETF EUR HEDGED ACC se snaží sledovat index optimalizované komodity (EUR Hedged). Index optimalizované komodity (EUR Hedged) sleduje široký komoditní koš (zemědělství, energie, drahé kovy, průmyslové kovy) pomocí futures ke sledování výkonu komoditního indexu Bloomberg. Optimalizovaný index komodity (EUR Hedged) také používá přístup založený na pravidlech k určení optimálního času k obnovení těchto budoucností. Snaží se plně využít příležitostí návratu na zaostalém trhu a zároveň minimalizovat ztráty na trzích Contango. Měna zajišťovala euro (EUR). TER (celkový poměr nákladů) ETF činí 0,35% p.a. ETF replikuje výkon podkladového indexu synteticky s výměnou. WisdomTree Enhanced Commodity UCITS ETF EUR Hedged ACC je velmi malý ETF s vedením 14 milionů euro. ETF byl spuštěn 14. srpna 2018 a je se sídlem v Irsku.;0.35%;0.35;EUR 14m;14.0;EUR;EUR;Ireland;WisdomTree;14 August 2018;Accumulating;;Synthetic (Unfunded swap);UCITS;;Commodities, Broad market;;EUR    Currency risk  Currency;1;Komodity;False;Celosvětově;;6.48;-3.32;44.37;7.1;1.1;-1.91;1.18;25.11;9.91;-10.01;1.61;28.2;12.47;13.66;15.47;0.52;-0.08;0.49;-8.82;-17.39;-27.85;-28.64;;;;;Borsa Italiana;WCOE;4;;;;;;;2025-09-24T01:25:52.334960;success;0;;;;;;;;;;;;;;;;;;;;;;;;;;;;;;;;;;;;;;;;;gettex;EUR;WTEH;;;;Borsa Italiana;EUR;WCOE;WCOE IMWCOEEIV;WCOE.MIWCOEINAV.DE;;SIX Swiss Exchange;EUR;WCOE;WCOE SWWCOEEIV;WCOE.SWCOEINAV.DE;;XETRA;EUR;WTEH;WTEH GYWCOEEIV;WTEH.DEWCOEINAV.DE;;;;;;;;;;;;;;;;;;;;;;;;;;;;;;;;;;;;;;2;37;12;1;11;5;8
IE00BG88WH84;WisdomTree Enhanced Commodity UCITS ETF GBP Hedged Acc;https://www.justetf.com/en/etf-profile.html?isin=IE00BG88WH84;The WisdomTree Enhanced Commodity UCITS ETF GBP Hedged Acc seeks to track the WisdomTree Enhanced Commodity (GBP Hedged) index. The WisdomTree Enhanced Commodity (GBP Hedged) index tracks a broad and diversified commodity exposure, covering the following sectors: energy, agriculture, industrial metals and precious metals. Currency hedged to British Pound (GBP). The ETF's TER (total expense ratio) amounts to 0.35% p.a.. The ETF replicates the performance of the underlying index synthetically with a swap. The WisdomTree Enhanced Commodity UCITS ETF GBP Hedged Acc is a small ETF with 42m Euro assets under management. The ETF was launched on 14 August 2018 and is domiciled in Ireland.;WisdomTree Enhanced Commodity UCITS ETF GBP Hedged ACC se snaží sledovat index WisdomTree Enhanced Commodity (GBP Hedged). Index WisdomTree Ensted Commodity (GBP Hedged) sleduje širokou a diverzifikovanou expozici komodity a pokrývá následující odvětví: energie, zemědělství, průmyslové kovy a drahé kovy. Měna zajišťovala britskou libru (GBP). ETF TER (celkový poměr nákladů) činí 0,35% p.a. ETF replikuje výkon podkladového indexu synteticky s výměnou. WisdomTree Enhanced Commodity UCITS ETF GBP Hedged ACC je malý ETF s vedením 42 milionů euro. ETF byl spuštěn 14. srpna 2018 a je se sídlem v Irsku.;0.35%;0.35;EUR 42m;42.0;EUR;GBP;Ireland;WisdomTree;14 August 2018;Accumulating;;Synthetic (Unfunded swap);UCITS;;Commodities, Broad market;;GBP    Currency risk  Currency;1;Komodity;False;Celosvětově;;4.44;1.4;62.23;3.1;0.63;-3.33;-1.66;34.66;5.44;-6.33;8.01;42.68;13.6;15.29;17.24;0.33;0.03;0.59;-11.16;-14.53;-26.53;-31.69;;;;;London Stock Exchange;WCOM;2;;;;;;;2025-09-24T01:25:59.609983;success;0;;;;;;;;;;;;;;;;;;;;;;;;;;;;;;;;;;;;;;;;;London Stock Exchange;GBX;WCOM;WCOM LN;WDWCOM.L;;SIX Swiss Exchange;GBP;WCOM;WCOM SW;WTWCOM.S;;;;;;;;;;;;;;;;;;;;;;;;;;;;;;;;;;;;;;;;;;;;;;;;;;2;38;12;1;11;5;9
