IE000MQ5XEW1;L&G Multi-Strategy Enhanced Commodities ex-Agriculture & Livestock UCITS ETF USD Accumulating;https://www.justetf.com/en/etf-profile.html?isin=IE000MQ5XEW1;The L&G Multi-Strategy Enhanced Commodities ex-Agriculture & Livestock UCITS ETF USD Accumulating seeks to track the Barclays Backwardation Tilt Multi-Strategy Ex-Agriculture & Livestock Capped index. The Barclays Backwardation Tilt Multi-Strategy Ex-Agriculture & Livestock Capped index tracks a investment in a diversified portfolio of commodity futures contracts across the following sectors: Energy, Precious Metals, and Industrial Metals. The ETF's TER (total expense ratio) amounts to 0.30% p.a.. The L&G Multi-Strategy Enhanced Commodities ex-Agriculture & Livestock UCITS ETF USD Accumulating is the only ETF that tracks the Barclays Backwardation Tilt Multi-Strategy Ex-Agriculture & Livestock Capped index. The ETF replicates the performance of the underlying index synthetically with a swap. The L&G Multi-Strategy Enhanced Commodities ex-Agriculture & Livestock UCITS ETF USD Accumulating is a small ETF with 74m Euro assets under management. The ETF was launched on 25 April 2024 and is domiciled in Ireland.;Multi-strategie L&G Enhanced Commodity Ex-Agriculture & Liveakcie UCITS ETF USD akumulační usiluje o sledování barol-backwardation naklápěcí multi-strategie ex-zemědělství a indexe zvířat. Index BARCLAYS TITT naklápěl multi-strategie ex-Agrikultury a hospodářská zvířata, který sleduje investici do diverzifikovaného portfolia komoditních futures kontraktů napříč následujícími odvětvími: energie, drahé kovy a průmyslové kovy. TER (celkový poměr nákladů) ETF činí 0,30% P.A .. Multi-strategické komodity L&G Ex-Agriculture & Liveakcie UCITS ETF USD akumulace je jediným ETF, který sleduje index BARCLAYS TITT naklápění více strategie a Liveakcie Index. ETF replikuje výkon podkladového indexu synteticky s výměnou. Multi-strategie L&G Enhanced Commodits Ex-Agriculture & Liveakcie UCITS ETF USD akumulace USD je malý ETF s managementem 74 milionů euro. ETF byl spuštěn 25. dubna 2024 a je se sídlem v Irsku.;0.30%;0.3;EUR 74m;74.0;EUR;USD;Ireland;;25 April 2024;Accumulating;;Synthetic (Unfunded swap);;;Commodities, Broad market;;Akcie;False;Globální;;6.48;;;-3.16;17.11;;;0.38;;;-13.94;;;-13.94;;;;;Borsa Italiana;XAGZ;5;;;;;;;2025-09-19T08:01:00.279353;success;0;;;;;;;;;;;;;;;;;;;;;;;;;;;;;;;;;;;;;;;;;gettex;EUR;XEXA;;;;Borsa Italiana;EUR;XAGZ;XAGZ IM;XAGZ.MI;;London Stock Exchange;USD;XAGZ;XAGZ LN;XAGZ.L;;SIX Swiss Exchange;USD;XAGZ;XAGZ SW;XAGRI.S;;XETRA;EUR;XEXA;XEXA GY;XEXA.DE;;;;;;;;
IE000MS9DTS9;Global X Uranium UCITS ETF USD Distributing;https://www.justetf.com/en/etf-profile.html?isin=IE000MS9DTS9;The Global X Uranium UCITS ETF USD Distributing seeks to track the Solactive Global Uranium & Nuclear Components index. The Solactive Global Uranium & Nuclear Components index tracks companies worldwide that are engaged in the exploration, mining and/or refining of uranium. The ETF's TER (total expense ratio) amounts to 0.65% p.a.. The Global X Uranium UCITS ETF USD Distributing is the only ETF that tracks the Solactive Global Uranium & Nuclear Components index. The ETF replicates the performance of the underlying index by full replication (buying all the index constituents). The dividends in the ETF are distributed to the investors (Semi annually). The Global X Uranium UCITS ETF USD Distributing is a very small ETF with 2m Euro assets under management. The ETF was launched on 28 October 2022 and is domiciled in Ireland.;Globální distribuce globálního uranu UCITS ETF se snaží sledovat index solaraktivního globálního uranu a jaderných složek. Solaraktivní globální indexové indexy urania a jaderné komponenty sleduje společnosti po celém světě, které se zabývají průzkumem, těžbou a/nebo rafinací uranu. TER (celkový poměr nákladů) činí 0,65% p.a. Globální distribuce globálního uranu UCITS ETF je jediným ETF, který sleduje solaraktivní globální index uranu a jaderných složek. ETF replikuje výkon podkladového indexu plnou replikací (nákup všech složek indexu). dividenday v ETF jsou distribuovány investorům (polo každoročně). Globální distribuce USD Global X uranium UCITS ETF je velmi malý ETF s managementem 2m euro. ETF byl spuštěn 28. října 2022 a má bydliště v Irsku.;0.65%;0.65;EUR 2m;2.0;EUR;USD;Ireland;;28 October 2022;Distributing;Semi annually;Physical;;;Equity, World;;Ostatní;False;Globální;47.0;81.17;;;54.36;36.84;;;2.2;;;-40.68;;;-40.68;;;;;London Stock Exchange;URND;1;;;;;;;2025-09-19T08:01:07.195238;success;0;Oklo;8.84;NuScale Power Corp;8.61;Uranium Energy Corp.;6.02;NexGen Energy Ltd.;5.96;Centrus Energy;5.69;NAC Kazatomprom;4.66;Doosan Enerbility Co., Ltd.;4.33;HYUNDAI ENGINEERING;3.41;Sibanye Stillwater Ltd.;3.39;;;United States;32.82;Canada;27.19;Other;17.76;Australia;7.98;;;Industrials;30.26;Energy;5.69;Materials;5.53;;;;;London Stock Exchange;GBP;URND;URNDGBIV;URND.L;;;;;;;;;;;;;;;;;;;;;;;;;;;;;;;;
IE000MUAJIF4;Invesco EUR Corporate Bond ESG Short Duration Multi-Factor UCITS ETF Dist;https://www.justetf.com/en/etf-profile.html?isin=IE000MUAJIF4;The Invesco EUR Corporate Bond ESG Short Duration Multi-Factor UCITS ETF Dist is an actively managed ETF. The ETF invests in Euro denominated, investment grade rated corporate bonds from issuers worldwide. Title selection is based on sustainability criteria and a quantitative investment model. Maturity: 0-5 years. The ETF's TER (total expense ratio) amounts to 0.15% p.a.. The interest income (coupons) in the ETF is distributed to the investors (Quarterly). The Invesco EUR Corporate Bond ESG Short Duration Multi-Factor UCITS ETF Dist is a small ETF with 24m Euro assets under management. The ETF was launched on 7 September 2022 and is domiciled in Ireland.;Krátké trvání Invesco EUR EUR Corporate Bond Multi-Factor UCITS ETF Dist je aktivně spravované ETF. ETF investuje do euro denominovaných, investiční třídy hodnocené firemní dluhopisy od emitentů po celém světě. Výběr titulu je založen na kritériích udržitelnosti a modelu kvantitativního investice. Dospělost: 0-5 let. TER (celkový poměr nákladů) ETF činí 0,15% P.A .. Úrokový výnos (kupóny) v ETF je distribuován investorům (čtvrtletně). Krátká doba společnosti Invesco EUR EUR Corporate Bond Multi-Factor UCITS ETF Dist je malá ETF s spravováním 24 milionů euro. ETF byl spuštěn 7. září 2022 a je sídlem v Irsku.;0.15%;0.15;EUR 24m;24.0;EUR;EUR;Ireland;Invesco;7 September 2022;Distributing;Quarterly;Physical;;;risk  Actively managed    Sustainability  Yes;Yes;Dluhopisy;False;Globální;193.0;4.09;12.26;;2.78;1.96;2.76;;2.09;1.42;;-0.79;-2.0;;-2.6;;;;;gettex;ECMD;3;3.22%;3.22;EUR 0.16;0.16;EUR;method2_regex;2025-09-19T08:01:13.250448;success;0;XS1966038249;1.75;XS1981054221;1.5;XS1900752814;1.37;CH1251998238;1.23;XS2113889351;1.23;XS2652069480;1.22;XS2746647036;1.2;XS2300292963;1.2;;;;;Other;100.0;;;;;;;;;IT;2.78;;;;;;;;;gettex;EUR;ECMD;;;;Borsa Italiana;EUR;ECMD;ECMD IMECMDIN;ECMD.MIIYJ4INAV.DE;;XETRA;EUR;ECMD;ECMD GYECMDIN;ECMD.DEIYJ4INAV.DE;;;;;;;;;;;;;;3.0;57.0;22.0;1.0;6.0;10.0;18.0
IE000MW6GT38;iShares MSCI Japan Climate Transition Aware UCITS ETF USD (Acc);https://www.justetf.com/en/etf-profile.html?isin=IE000MW6GT38;The iShares MSCI Japan Climate Transition Aware UCITS ETF USD (Acc) seeks to track the MSCI Japan Transition Aware Select index. The MSCI Japan Transition Aware Select index tracks Japanese stocks. The index is designed to represent companies that are contributing to the climate transition. The stocks included are filtered according to ESG criteria (environmental, social and corporate governance). The parent index is the MSCI Japan index. The ETF's TER (total expense ratio) amounts to 0.15% p.a.. The ETF replicates the performance of the underlying index by full replication (buying all the index constituents). The dividends in the ETF are accumulated and reinvested in the ETF. The iShares MSCI Japan Climate Transition Aware UCITS ETF USD (Acc) is a very small ETF with 8m Euro assets under management. The ETF was launched on 11 June 2024 and is domiciled in Ireland.;Ishares MSCI Japan Japan Climate Transition About UCITS ETF USD (ACC) se snaží sledovat index přechodu MSCI Japan About pro přechod. MSCI Japan About About Select Index skladby japonské akcie. Index je navržen tak, aby reprezentoval společnosti, které přispívají k přechodu na klima. Zahrnuté akcie jsou filtrovány podle kritérií ESG (environmentální, sociální a správa a společností). Index nadřazení je index MSCI Japan. TER (celkový poměr nákladů) ETF činí 0,15% p.a. ETF replikuje výkon podkladového indexu plnou replikací (nákup všech složek indexu). dividenday v ETF jsou akumulovány a reinvestovány do ETF. Ishares MSCI Japan Japan Climate Transition About UCITS ETF USD (ACC) je velmi malý ETF s 8m euro ve spravování. ETF byl spuštěn 11. června 2024 a má bydliště v Irsku.;0.15%;0.15;EUR 8m;8.0;EUR;USD;Ireland;iShares;11 June 2024;Accumulating;;Physical;;MSCI Japan Climate Transition Aware  USD;;Yes;Akcie;False;Japonsko;122.0;14.19;;;5.23;23.84;;;0.6;;;-20.51;;;-20.51;;;;;Euronext Amsterdam;JCTA;2;;;;;;;2025-09-19T08:01:21.233596;success;0;Toyota Motor Corp.;5.05;Hitachi Ltd.;4.91;Sony Group Corp.;4.48;Sumitomo Mitsui Financial Group, Inc.;3.42;Recruit Holdings Co., Ltd.;2.92;Mitsubishi Heavy Industries, Ltd.;2.67;Mizuho Financial Group, Inc.;2.58;SoftBank Group Corp.;2.57;Tokyo Electron Ltd.;2.41;;;Japan;99.38;Other;0.62;;;;;;;Industrials;24.92;Consumer Discretionary;18.04;Financials;15.55;Technology;14.17;;;Euronext Amsterdam;USD;JCTA;;;;SIX Swiss Exchange;USD;JCTA;;;;;;;;;;;;;;;;;;;;;;;;;;;;
IE000MWUQBJ0;HSBC Euro Stoxx 50 UCITS ETF EUR (Acc);https://www.justetf.com/en/etf-profile.html?isin=IE000MWUQBJ0;The HSBC Euro Stoxx 50 UCITS ETF EUR (Acc) seeks to track the EURO STOXX® 50 index. The EURO STOXX® 50 index tracks the 50 largest companies in the eurozone. The ETF's TER (total expense ratio) amounts to 0.05% p.a.. The HSBC Euro Stoxx 50 UCITS ETF EUR (Acc) is the cheapest ETF that tracks the EURO STOXX® 50 index. The ETF replicates the performance of the underlying index by full replication (buying all the index constituents). The dividends in the ETF are accumulated and reinvested in the ETF. The HSBC Euro Stoxx 50 UCITS ETF EUR (Acc) has 262m Euro assets under management. The ETF was launched on 28 June 2022 and is domiciled in Ireland.;HSBC Euro Stoxx 50 UCITS ETF EUR (ACC) se snaží sledovat index Euro Stoxx® 50. Index Euro Stoxx® 50 sleduje 50 největších společností v eurozóně. TER (celkový poměr nákladů) ETF činí 0,05% P.A .. HSBC Euro Stoxx 50 UCITS ETF EUR (ACC) je nejlevnější ETF, který sleduje index Euro Stoxx® 50. ETF replikuje výkon podkladového indexu plnou replikací (nákup všech složek indexu). dividenday v ETF jsou akumulovány a reinvestovány do ETF. HSBC EURO STOXX 50 UCITS ETF EUR (ACC) má 262 milionů euro aktiv. ETF byl spuštěn 28. června 2022 a je se sídlem v Irsku.;0.05%;0.05;EUR 262m;262.0;EUR;EUR;Ireland;HSBC;28 June 2022;Accumulating;;Physical;;;Equity, Europe;;Akcie;False;Evropa;50.0;16.3;70.54;;14.42;17.04;15.23;;0.96;1.28;;-16.39;-16.39;;-16.39;;;;;gettex;H4ZZ;4;;;;;;;2025-09-19T08:01:25.844896;success;0;ASML Holding NV;6.41;Siemens AG;4.49;Allianz SE;3.56;Schneider Electric SE;3.49;LVMH Moët Hennessy Louis Vuitton SE;3.2;TotalEnergies SE;3.14;Banco Santander SA;3.03;Deutsche Telekom AG;3.01;Safran SA;2.88;;;France;33.68;Germany;30.09;Netherlands;15.89;Other;11.43;;;Financials;24.06;Industrials;20.77;Technology;16.11;Consumer Discretionary;14.88;IT;3.2;Borsa Italiana;EUR;H50A;;;;gettex;EUR;H4ZZ;;;;London Stock Exchange;GBP;H50A;;;;XETRA;EUR;H4ZZ;;;;;;;;;;4.0;66.0;30.0;5.0;6.0;5.0;20.0
IE000MY0C911;HSBC Global Corporate Bond UCITS ETF C EUR Hedged;https://www.justetf.com/en/etf-profile.html?isin=IE000MY0C911;The HSBC Global Corporate Bond UCITS ETF C EUR Hedged seeks to track the Bloomberg Global Aggregate Corporate (EUR Hedged) index. The Bloomberg Global Aggregate Corporate (EUR Hedged) index tracks corporate bonds issued by companies worldwide. All maturities are included. Rating: Investment Grade. Currency hedged to Euro (EUR). The ETF's TER (total expense ratio) amounts to 0.13% p.a.. The HSBC Global Corporate Bond UCITS ETF C EUR Hedged is the cheapest ETF that tracks the Bloomberg Global Aggregate Corporate (EUR Hedged) index. The ETF replicates the performance of the underlying index by sampling technique (buying a selection of the most relevant index constituents). The interest income (coupons) in the ETF is accumulated and reinvested in the ETF. The HSBC Global Corporate Bond UCITS ETF C EUR Hedged is a very small ETF with 4m Euro assets under management. The ETF was launched on 11 October 2023 and is domiciled in Ireland.;HSBC Global Corporate Bond UCITS ETF C EUR HEDGED se snaží sledovat index Bloomberg Global Agregate Corporate (EUR Hedged). Bloomberg Global Agregate Corporate (EUR Hedged) Index sleduje firemní dluhopisy vydané společnostmi po celém světě. Zahrnuty jsou všechna splatností. Hodnocení: Investiční třída. Měna zajišťovala euro (EUR). TER (celkový poměr výdajů) ETF činí 0,13% P.A. ETF replikuje výkon základního indexu technikou vzorkování (nákup výběru nejdůležitějších složek indexu). Úrokové výnosy (kupóny) v ETF se nashromáždí a reinvestují do ETF. HSBC Global Corporate Bond UCITS ETF C EUR Hedged je velmi malý ETF s spravováním 4 milionů euro. ETF byl spuštěn 11. října 2023 a je sídlem v Irsku.;0.13%;0.13;EUR 4m;4.0;EUR;EUR;Ireland;HSBC;11 October 2023;;;Physical;;;Bonds, World, Corporate, All maturities;;Dluhopisy;False;Globální;3497.0;2.53;;;4.9;7.08;;;0.36;;;-3.87;;;-3.87;;;;;Extracted (method 1);H41R;0;;;;;;;2025-09-19T08:01:33.931103;success;0;XS2948435743;0.16;XS2932831923;0.15;;;;;;;;;;;;;;;;;Other;100.0;;;;;;;;;;;;;;;;;;;;;;;;;;;;;;;;;;;;;;;;;;;;;;;;;;;;;;;
IE000MYCJA42;Amundi MSCI North America ESG Broad Transition UCITS ETF Acc;https://www.justetf.com/en/etf-profile.html?isin=IE000MYCJA42;The Amundi MSCI North America ESG Broad Transition UCITS ETF Acc seeks to track the MSCI North America ESG Broad CTB Select index. The MSCI North America ESG Broad CTB Select index tracks stocks from developed North American countries (Canada and United States). Securities are selected and weighted according to sustainability criteria and EU directives on climate protection. The parent index is the MSCI North America. The ETF's TER (total expense ratio) amounts to 0.15% p.a.. The Amundi MSCI North America ESG Broad Transition UCITS ETF Acc is the cheapest and largest ETF that tracks the MSCI North America ESG Broad CTB Select index. The ETF replicates the performance of the underlying index by full replication (buying all the index constituents). The dividends in the ETF are accumulated and reinvested in the ETF. The Amundi MSCI North America ESG Broad Transition UCITS ETF Acc is a large ETF with 526m Euro assets under management. The ETF was launched on 29 June 2016 and is domiciled in Ireland.;Amundi MSCI North America ESG Broad Transition UCITS ETF ACC se snaží sledovat index MSCI North America ESG Broad CTB Select. MSCI North America ESG Broad CTB Select Index akcie z rozvinutých severoamerických zemí (Kanada a Spojené státy). Cenné papíry jsou vybírány a váženy podle kritérií udržitelnosti a směrnic EU o ochraně klimatu. Rodičovský index je MSCI Severní Amerika. TER (celkový poměr nákladů) ETF činí 0,15% p.a. Amundi MSCI North America ESG Broad Transition UCITS ETF ACC je nejlevnější a největší ETF, který sleduje index MSCI North America ESG Broad CTB Select Index. ETF replikuje výkon podkladového indexu plnou replikací (nákup všech složek indexu). dividenday v ETF jsou akumulovány a reinvestovány do ETF. AMUNDI MSCI North America ESG Broad Transition UCITS ETF ACC je velký ETF s managementem 526 milionů euro. ETF byl spuštěn 29. června 2016 a je se sídlem v Irsku.;0.15%;0.15;EUR 526m;526.0;EUR;EUR;Ireland;Amundi;29 June 2016;Accumulating;;Physical;;MSCI North America ESG Broad Transition  Acc;;Yes;Akcie;False;US;561.0;9.62;43.64;98.01;-1.98;19.81;17.14;17.73;0.49;0.75;0.83;-22.92;-22.92;-22.92;-34.51;;;;;Borsa Italiana;-;5;;;;;;;2025-09-19T08:01:39.663976;success;0;Microsoft;6.12;Apple;5.45;Amazon.com, Inc.;3.88;Alphabet, Inc. C;2.94;Meta Platforms;2.43;Broadcom;2.27;Tesla;1.54;JPMorgan Chase & Co.;1.33;Visa;1.23;;;United States;90.1;Canada;5.12;Other;3.11;;;;;Technology;37.48;Financials;13.19;Consumer Discretionary;10.01;Health Care;9.52;;;Borsa Italiana;EUR;NRAM;;;;gettex;EUR;WEB1;;;;Borsa Italiana;EUR;-;NRAM IMINRAMEIV;NRAM.MIINRAMINAV=SOLA;;Euronext Amsterdam;USD;NAMU;NAMU NA;NRAM.AS;;Euronext Paris;EUR;NRAM;NRAM FPINRAMEIV;NRAM.PAINRAMINAV=SOLA;;4.0;73.0;22.0;10.0;11.0;10.0;20.0
IE000N0TTJQ9;AXA IM USD Credit PAB UCITS ETF USD Acc;https://www.justetf.com/en/etf-profile.html?isin=IE000N0TTJQ9;The AXA IM USD Credit PAB UCITS ETF USD Acc is an actively managed ETF. The ETF invests in USD denominated, investment grade rated corporate bonds. Title selection is based on sustainability criteria and a quantitative investment model. Title selection is based on sustainability criteria and fundamental characteristics. The ETF's TER (total expense ratio) amounts to 0.18% p.a.. The interest income (coupons) in the ETF is accumulated and reinvested in the ETF. The AXA IM USD Credit PAB UCITS ETF USD Acc has 101m Euro assets under management. The ETF was launched on 30 October 2023 and is domiciled in Ireland.;Úvěr AXA IM USD PAB UCITS ETF USD ACC je aktivně spravovaný ETF. ETF investuje do USD denominovaných, investiční třídy hodnocené firemní dluhopisy. Výběr titulu je založen na kritériích udržitelnosti a modelu kvantitativního investice. Výběr titulu je založen na kritériích udržitelnosti a základních charakteristikách. TER (celkový poměr nákladů) ETF činí 0,18% p.a. Úrokový výnosy (kupóny) v ETF se nashromáždí a reinvestují do ETF. Úvěr AXA IM USD PAB UCITS ETF USD ACC má ve správě 101 milionů euro aktiv. ETF byla zahájena 30. října 2023 a je v Irsku bydliště.;0.18%;0.18;EUR 101m;101.0;EUR;USD;Ireland;;30 October 2023;Accumulating;;Physical;;;risk  Actively managed    Sustainability  Yes;Yes;Dluhopisy;False;Globální;172.0;-1.73;;;-5.64;9.08;;;-0.19;;;-10.84;;;-10.84;;;;;gettex;AIPT;6;;;;;;;2025-09-19T08:01:46.533530;success;0;;;;;;;;;;;;;;;;;;;;;Other;100.0;;;;;;;;;;;;;;;;;;;XETRA;USD;AIPU;;;;gettex;EUR;AIPT;;;;Borsa Italiana;EUR;AIPU;;;;Euronext Paris;USD;AIPU;;;;SIX Swiss Exchange;USD;AIPU;;;;;;;;;;
IE000N1ZEIG9;Invesco S&P 500 CTB Net Zero Pathway ESG UCITS ETF Acc;https://www.justetf.com/en/etf-profile.html?isin=IE000N1ZEIG9;The Invesco S&P 500 CTB Net Zero Pathway ESG UCITS ETF Acc seeks to track the S&P 500 Climate Transition Base Pathway-Aligned ESG index. The S&P 500 Climate Transition Base Pathway-Aligned ESG index tracks US securities. Securities are selected and weighted according to sustainability criteria and EU directives on climate protection. The parent index is the S&P 500. The ETF's TER (total expense ratio) amounts to 0.09% p.a.. The Invesco S&P 500 CTB Net Zero Pathway ESG UCITS ETF Acc is the only ETF that tracks the S&P 500 Climate Transition Base Pathway-Aligned ESG index. The ETF replicates the performance of the underlying index by full replication (buying all the index constituents). The dividends in the ETF are accumulated and reinvested in the ETF. The Invesco S&P 500 CTB Net Zero Pathway ESG UCITS ETF Acc is a very small ETF with 2m Euro assets under management. The ETF was launched on 27 January 2025 and is domiciled in Ireland.;Invesco S&P 500 CTB Čistá nulová cesta ESG UCITS ETF ACC se snaží sledovat index ESG zarovnaný S&P 500 Climate Transition Based ESG. Index ESG zarovnaný S&P 500 Climate Transition Based Index sleduje americké cenné papíry. Cenné papíry jsou vybírány a váženy podle kritérií udržitelnosti a směrnic EU o ochraně klimatu. Index nadřazení je S&P 500. TER (celkový poměr nákladů) ETF činí 0,09% p.a. Invex ESG Index ESG ESG Index ESG ESG ESG ESG ESG. ETF replikuje výkon podkladového indexu plnou replikací (nákup všech složek indexu). dividenday v ETF jsou akumulovány a reinvestovány do ETF. Invesco S&P 500 CTB Net Zero Pathway ESG UCITS ETF ACC je velmi malý ETF s managementem 2m euro. ETF byl spuštěn 27. ledna 2025 a má bydliště v Irsku.;0.09%;0.09;EUR 2m;2.0;EUR;USD;Ireland;Invesco;27 January 2025;Accumulating;;Physical;;S&P 500;;Yes;Akcie;False;US;311.0;;;;;;;;;;;;;;-22.63;;;;;London Stock Exchange;-;6;;;;;;;2025-09-19T08:01:53.399938;success;0;Microsoft;7.29;Apple;6.33;Amazon.com, Inc.;3.66;Alphabet, Inc. A;2.86;Visa;2.46;Alphabet, Inc. C;2.32;Tesla;2.06;Mastercard, Inc.;1.86;Walmart, Inc.;1.79;;;United States;95.06;Other;2.69;;;;;;;Technology;39.07;Consumer Discretionary;10.66;Health Care;9.17;;;;;gettex;EUR;CTBA;;;;Borsa Italiana;EUR;SCTB;SCTB IMSCTBEUIV;SCTB.MISCTBEUiv.P;;London Stock Exchange;GBX;-;SCTP LNSCTBGBIV;SCTP.LSCTBGBiv.P;;London Stock Exchange;USD;-;SCTB LNSCTBCHIV;SCTB.LSCTBCHiv.P;;SIX Swiss Exchange;CHF;SCTB;SCTB SWSCTBCHIV;SCTB.SSCTBCHiv.P;;;;;;;;
IE000N42HDP2;Invesco Global Active Defensive ESG Equity UCITS ETF Acc;https://www.justetf.com/en/etf-profile.html?isin=IE000N42HDP2;The Invesco Global Active Defensive ESG Equity UCITS ETF Acc is an actively managed ETF. The ETF invests in a selection of companies worldwide that is optimised according to low volatility and ESG criteria (environmental, social and corporate governance). The ETF's TER (total expense ratio) amounts to 0.25% p.a.. The dividends in the ETF are accumulated and reinvested in the ETF. The Invesco Global Active Defensive ESG Equity UCITS ETF Acc is a very small ETF with 5m Euro assets under management. The ETF was launched on 19 July 2022 and is domiciled in Ireland.;Invesco Global Active Defensive ESG Equity UCITS ETF ACC je aktivně spravovaná ETF. ETF investuje do výběru společností na celém světě, který je optimalizován podle kritérií nízké volatility a ESG (environmentální, sociální a správa a řízení společností). TER (celkový poměr nákladů) činí 0,25% p.a. dividenday v ETF se nashromáždí a reinvestují do ETF. Invesco Global Active Defensive ESG Equity UCITS ETF ACC je velmi malý ETF s managementem 5m euro. ETF byl spuštěn 19. července 2022 a je sídlem v Irsku.;0.25%;0.25;EUR 5m;5.0;EUR;USD;Ireland;Invesco;19 July 2022;Accumulating;;Physical;;;risk  Actively managed    Sustainability  Yes;Yes;Akcie;False;Globální;392.0;8.37;35.25;;1.85;12.73;11.86;;0.66;0.89;;-14.54;-14.54;;-14.54;;;;;gettex;LVLC;6;;;;;;;2025-09-19T08:01:59.444255;success;0;NVIDIA Corp.;4.72;Broadcom;1.47;Visa;1.18;Johnson & Johnson;1.16;Cisco Systems, Inc.;1.12;Novartis AG;1.05;Tesla;0.97;Mastercard, Inc.;0.95;AbbVie, Inc.;0.94;;;United States;63.61;Other;20.44;Japan;8.74;Switzerland;3.92;United Kingdom;3.29;Technology;29.32;Financials;17.25;Health Care;15.19;Industrials;9.73;;;gettex;EUR;LVLC;;;;Borsa Italiana;EUR;LVLC;LVLC IMLVLCEIN;LVLC.MID4L3INAV.DE;;London Stock Exchange;GBX;LVLG;LVLGIN;D4L5INAV.DE;;London Stock Exchange;USD;LVLC;LVLC LNLVLCIN;LVLC.LD4L4INAV.DE;;London Stock Exchange;GBP;LVLG;LVLG LNLVLGIN;LVLG.LD4L5INAV.DE;;3.0;54.0;17.0;1.0;6.0;10.0;20.0
IE000N5JOGS2;HSBC China Government Local Bond UCITS ETF C;https://www.justetf.com/en/etf-profile.html?isin=IE000N5JOGS2;The HSBC China Government Local Bond UCITS ETF C seeks to track the Bloomberg China Treasury + Policy Bank index. The Bloomberg China Treasury + Policy Bank index tracks local currency denominated bonds that have been issued by the Chinese State or state-owned banks. All maturities are included. Rating: Investment Grade. The ETF's TER (total expense ratio) amounts to 0.20% p.a.. The HSBC China Government Local Bond UCITS ETF C is the cheapest ETF that tracks the Bloomberg China Treasury + Policy Bank index. The ETF replicates the performance of the underlying index by sampling technique (buying a selection of the most relevant index constituents). The interest income (coupons) in the ETF is accumulated and reinvested in the ETF. The HSBC China Government Local Bond UCITS ETF C is a very small ETF with 12m Euro assets under management. The ETF was launched on 12 July 2023 and is domiciled in Ireland.;Čínská vláda HSBC Local Bond UCITS ETF C se snaží sledovat index Bloomberg China Treasury + Policy Bank. Index Bloomberg China Treasury + Policy Bank Index sleduje dluhopisy označené místní měnou, které byly vydány čínským státem nebo státními bankami. Zahrnuty jsou všechna splatností. Hodnocení: Investiční třída. TER (celkový poměr nákladů) činí 0,20% P.A. ETF replikuje výkon základního indexu technikou vzorkování (nákup výběru nejdůležitějších složek indexu). Úrokové výnosy (kupóny) v ETF se nashromáždí a reinvestují do ETF. Čínská vláda HSBC Local Bond UCITS ETF C je velmi malá ETF s vedením 12m euro. ETF byl spuštěn 12. července 2023 a je sídlem v Irsku.;0.20%;0.2;EUR 12m;12.0;EUR;USD;Ireland;HSBC;12 July 2023;;;Physical;;;Bonds, CNY, China, Government, All maturities;;Dluhopisy;False;Čína;146.0;-3.88;;;-9.61;8.37;;;-0.46;;;-11.08;;;-11.08;;;;;Extracted (method 1);H41Q;0;;;;;;;2025-09-19T08:02:06.699539;success;0;;;;;;;;;;;;;;;;;;;;;Other;100.0;;;;;;;;;;;;;;;;;;;;;;;;;;;;;;;;;;;;;;;;;;;;;;;;;;;;;;;
