IE000WPH0239;AXA IM US Treasury 25+ Year UCITS ETF USD Dist;https://www.justetf.com/en/etf-profile.html?isin=IE000WPH0239;The AXA IM US Treasury 25+ Year UCITS ETF USD Dist seeks to track the ICE US Treasury 25+ Year Bond index. The ICE US Treasury 25+ Year Bond index tracks US Dollar denominated government bonds issued by the US Treasury. Time to maturity: 25+ years. The ETF's TER (total expense ratio) amounts to 0.07% p.a.. The AXA IM US Treasury 25+ Year UCITS ETF USD Dist is the cheapest ETF that tracks the ICE US Treasury 25+ Year Bond index. The ETF replicates the performance of the underlying index by sampling technique (buying a selection of the most relevant index constituents). The interest income (coupons) in the ETF is distributed to the investors (Semi annually). The AXA IM US Treasury 25+ Year UCITS ETF USD Dist is a very small ETF with 1m Euro assets under management. The ETF was launched on 11 October 2024 and is domiciled in Ireland.;AXA IM US Treasury 25+ Year UCITS ETF USD Dist se snaží sledovat index dluhopisů Ice US Treasury 25+. Index dluhopisů ICE US Treasury 25+ let sleduje vládní dluhopisy vydané americkým ministerstvem americké pokladny. Čas na zralost: 25+ let. TER (celkový poměr nákladů) činí 0,07% p.a. AXA IM US Treasury 25+ Year UCITS ETF USD Dist je nejlevnější ETF, který sleduje index dluhopisů Ice US Treasury 25+ let. ETF replikuje výkon základního indexu technikou vzorkování (nákup výběru nejdůležitějších složek indexu). Úrokové výnosy (kupóny) v ETF jsou distribuovány investorům (semifinále každoročně). AXA IM US Treasury 25+ Year UCITS ETF USD DIST je velmi malý ETF s 1m euro ve spravování. ETF byl spuštěn 11. října 2024 a je sídlem v Irsku.;0.07%;0.07;EUR 1m;1.0;EUR;USD;Ireland;;11 October 2024;Distributing;Semi annually;Physical;;;;;Dluhopisy;False;US;20.0;;;;-6.74;;;;;;;;;;;;;;;gettex;A2DT;3;;;;;;;2025-09-18T14:58:16.214729;success;0;;;;;;;;;;;;;;;;;;;;;Other;100.0;;;;;;;;;IT;6.74;;;;;;;;;XETRA;USD;A2DU;;;;gettex;EUR;A2DT;;;;XETRA;EUR;A2DT;;;;;;;;;;;;;;;;;;;;;;
IE0001AXQAS6;Invesco BulletShares 2026 USD Corporate Bond UCITS ETF GBP Hdg Dist;https://www.justetf.com/en/etf-profile.html?isin=IE0001AXQAS6;The Invesco BulletShares 2026 USD Corporate Bond UCITS ETF GBP Hdg Dist seeks to track the Bloomberg 2026 Maturity USD Corporate Bond Screened (GBP Hedged) index. The Bloomberg 2026 Maturity USD Corporate Bond Screened (GBP Hedged) index tracks US dollar denominated corporate bonds. The index does not reflect a constant maturity range (as is the case with most other bond indices). Instead, only bonds that mature during the designated year (here: 2026) are included in the index. The index consists of ESG (environmental, social and governance) screened corporate bonds. Rating: Investment Grade. Maturity: December 2026 (the ETF will be closed afterwards). Currency hedged to British Pound (GBP). The ETF's TER (total expense ratio) amounts to 0.12% p.a.. The ETF replicates the performance of the underlying index by sampling technique (buying a selection of the most relevant index constituents). The interest income (coupons) in the ETF is distributed to the investors (Quarterly). The Invesco BulletShares 2026 USD Corporate Bond UCITS ETF GBP Hdg Dist is a very small ETF with 1m Euro assets under management. The ETF was launched on 2 July 2024 and is domiciled in Ireland.;Invesco Bulletshares 2026 USD Corporate Bond UCITS ETF GBP HDG DIST se snaží sledovat index společnosti Bloomberg 2026 Screthered (GBP Hedged). Bloomberg 2026 splatnost USD firemní dluhopis Screebed (GBP Hedged) Index sleduje americké dolar denominované firemní dluhopisy. Index neodráží konstantní rozsah zralosti (jako je tomu u většiny ostatních indexů Bond). Místo toho jsou do indexu zahrnuty pouze vazby, které dozrávají během určeného roku (zde: 2026). Index se skládá z ESG (environmentální, sociální a správa věcí veřejných) promítaných firemních dluhopisů. Hodnocení: Investiční třída. Dospívání: prosinec 2026 (ETF bude poté uzavřen). Měna zajišťovala britskou libru (GBP). TER (celkový poměr nákladů) ETF činí 0,12% p.a. ETF replikuje výkon základního indexu technikou vzorkování (nákup výběru nejdůležitějších složek indexu). Úrokové výnosy (kupóny) v ETF jsou distribuovány investorům (čtvrtletně). Společnost Invesco Bulletshares 2026 USD Corporate Bond UCITS ETF GBP HDG DIST je velmi malá ETF s managementem 1m euro. ETF byl spuštěn 2. července 2024 a je bydliště v Irsku.;0.12%;0.12;EUR 1m;1.0;EUR;GBP;Ireland;Invesco;2 July 2024;Distributing;Quarterly;Physical;;;;Yes;Dluhopisy;False;Globální;483.0;1.56;;;-0.85;7.3;;;0.21;;;-4.98;;;;;;;;Extracted (method 1);B26G;0;4.86%;4.86;EUR 0.30;0.3;EUR;method2_regex;2025-09-18T14:58:22.187439;success;0;;;;;;;;;;;;;;;;;;;;;Other;100.0;;;;;;;;;;;;;;;;;;;;;;;;;;;;;;;;;;;;;;;;;;;;;;;;;;;;;;;
IE00BKS8QT65;WisdomTree US Treasuries 10Y 3x Daily Short;https://www.justetf.com/en/etf-profile.html?isin=IE00BKS8QT65;The WisdomTree US Treasuries 10Y 3x Daily Short seeks to track the BNP Paribas US Treasury Note 10Y Rolling Future Short Leverage (-3x) index. The BNP Paribas US Treasury Note 10Y Rolling Future Short Leverage (-3x) index tracks the three times leveraged inverse performance of the BNP Paribas US Treasury Note 10Y Rolling Future index. The BNP Paribas US Treasury Note 10Y Rolling Future index tracks 10-Year US Treasury Note futures, which provide access to US government bonds with a maturity of 6.5-10 years. The ETN's TER (total expense ratio) amounts to 0.30% p.a.. The ETN replicates the performance of the underlying index synthetically with a swap. The interest income (coupons) in the ETN is accumulated and reinvested in the ETF. The WisdomTree US Treasuries 10Y 3x Daily Short is a very small ETN with 1m Euro assets under management. The ETN was launched on 1 August 2014 and is domiciled in Ireland.;Pokladny WisdomTree US Treasuries 10y 3x Daily Short se snaží sledovat index BNP Paribas US Treasury Note 10y Rolling Future Short Leve Everation (-3x). Index BNP Paribas US Treasury Note 10y Rolling Future Short Leverage (-3x) sleduje třikrát využívaný inverzní výkon BNP Paribas US Treasury Treasury Note 10Y Rolling Future Index. Pokladna BNP Paribas US Treasury Note 10y Rolling Future Index sleduje 10leté futures americké státní pokladny, které poskytují přístup k vládním dluhopisům USA se splatností 6,5–10 let. ETN TER (celkový poměr nákladů) činí 0,30% p.a .. ETN replikuje výkon podkladového indexu synteticky s výměnou. Úrokové výnosy (kupóny) v ETN se nashromáždí a reinvestují do ETF. WisdomTree US Treasuries 10y 3x Daily Short je velmi malá ETN s managementem 1m euro. ETN byl spuštěn 1. srpna 2014 a má bydliště v Irsku.;0.30%;0.3;EUR 1m;1.0;EUR;USD;Ireland;WisdomTree;1 August 2014;;;Synthetic;;;risk  Short, Leverage    Sustainability  No;;Ostatní;True;US;;0.41;-1.66;;-22.23;19.18;22.06;;0.02;-0.03;;-26.83;-26.83;;;;;;;Borsa Italiana;3TYS;4;;;;;;;2025-09-18T14:58:27.033987;success;0;;;;;;;;;;;;;;;;;;;;;;;;;;;;;;;;;;;;;;;;;XETRA;EUR;TY3S;;;;gettex;EUR;TY3S;;;;Borsa Italiana;EUR;3TYS;;;;London Stock Exchange;GBX;3TYS;;;;;;;;;;2.0;39.0;12.0;1.0;13.0;5.0;8.0
IE000ZQF1PE1;iShares MSCI Europe Climate Transition Aware UCITS ETF EUR (Dist);https://www.justetf.com/en/etf-profile.html?isin=IE000ZQF1PE1;The iShares MSCI Europe Climate Transition Aware UCITS ETF EUR (Dist) seeks to track the MSCI Europe Transition Aware Select index. The MSCI Europe Transition Aware Select index tracks European stocks. The index is designed to represent companies that are contributing to the climate transition. The stocks included are filtered according to ESG criteria (environmental, social and corporate governance). The parent index is the MSCI Europe index. The ETF's TER (total expense ratio) amounts to 0.12% p.a.. The iShares MSCI Europe Climate Transition Aware UCITS ETF EUR (Dist) is the cheapest ETF that tracks the MSCI Europe Transition Aware Select index. The ETF replicates the performance of the underlying index by full replication (buying all the index constituents). The dividends in the ETF are distributed to the investors (Semi annually). The iShares MSCI Europe Climate Transition Aware UCITS ETF EUR (Dist) is a very small ETF with 1m Euro assets under management. The ETF was launched on 11 June 2024 and is domiciled in Ireland.;Ishares MSCI Europe Climate Transition About UCITS ETF EUR (dist) se snaží sledovat index přechodu MSCI Europe. Přechod MSCI Europe About Select Index skladby evropské akcie. Index je navržen tak, aby reprezentoval společnosti, které přispívají k přechodu na klima. Zahrnuté akcie jsou filtrovány podle kritérií ESG (environmentální, sociální a správa a společností). Index nadřazení je index MSCI Europe. TER (celkový poměr nákladů) činí 0,12% P.A .. Ishares MSCI Europe Climate Transition About UCITS ETF EUR (DIST) je nejlevnější ETF, který sleduje přechod Evropy MSCI Europe About Select Index. ETF replikuje výkon podkladového indexu plnou replikací (nákup všech složek indexu). dividenday v ETF jsou distribuovány investorům (polo každoročně). Ishares MSCI Europe Climate Transition About UCITS ETF EUR (dist) je velmi malý ETF s 1m euro spravovanými aktivy. ETF byl spuštěn 11. června 2024 a má bydliště v Irsku.;0.12%;0.12;EUR 1m;1.0;EUR;EUR;Ireland;iShares;11 June 2024;Distributing;Semi annually;Physical;;MSCI Europe;;Yes;Akcie;False;Evropa;288.0;4.68;;;7.25;13.9;;;0.34;;;-16.45;;;;;;;;gettex;ECTD;2;2.59%;2.59;EUR 0.13;0.13;EUR;method2_regex;2025-09-18T14:58:33.182182;success;0;;;;;;;;;;;;;;;;;;;;;Other;34.42;United Kingdom;19.46;France;16.51;Switzerland;15.19;Germany;14.42;Financials;20.94;Industrials;17.62;Health Care;10.96;Consumer Staples;10.4;;;gettex;EUR;ECTD;;;;XETRA;EUR;ECTD;;;;;;;;;;;;;;;;;;;;;;;;;;;;
IE000S6476U8;UBS S&P USA Dividend Aristocrats ESG Elite UCITS ETF hEUR dis;https://www.justetf.com/en/etf-profile.html?isin=IE000S6476U8;The UBS S&P USA Dividend Aristocrats ESG Elite UCITS ETF hEUR dis seeks to track the S&P ESG Elite High Yield Dividend Aristocrats (EUR Hedged) index. The S&P ESG Elite High Yield Dividend Aristocrats (EUR Hedged) index tracks the stocks of the S&P Composite 1500 index that have increased dividends every year for at least 20 consecutive years. The stocks included are filtered according to ESG criteria (environmental, social and corporate governance). Currency hedged to Euro (EUR). The ETF's TER (total expense ratio) amounts to 0.23% p.a.. The ETF replicates the performance of the underlying index by full replication (buying all the index constituents). The dividends in the ETF are distributed to the investors (Semi annually). The UBS S&P USA Dividend Aristocrats ESG Elite UCITS ETF hEUR dis is a very small ETF with 0m Euro assets under management. The ETF was launched on 26 June 2023 and is domiciled in Ireland.;UBS S&P USA dividenda Aristocrats ESG Elite UCITS ETF HEUR DIS se snaží sledovat index dividenda Aristocrats s vysokým výnosem ESG ESG Elite Elite s vysokým výnosem (Hedged). Aristokraté aristokraté S&P ESG Elite s vysokým výnosem (EUR Hedged) sleduje akcie indexu S&P Composite 1500, které mají každoročně zvýšené dividenday po dobu nejméně 20 po sobě jdoucích let. Zahrnuté akcie jsou filtrovány podle kritérií ESG (environmentální, sociální a správa a společností). Měna zajišťovala euro (EUR). TER (celkový poměr nákladů) ETF činí 0,23% p.a. ETF replikuje výkon podkladového indexu plnou replikací (nákup všech složek indexu). dividenday v ETF jsou distribuovány investorům (polo každoročně). UBS S&P USA dividenda Aristocrats ESG Elite UCITS ETF HEUR DIS je velmi malý ETF s vedením 0m euro. ETF byl spuštěn 26. června 2023 a má bydliště v Irsku.;0.23%;0.23;EUR 0m;0.0;EUR;EUR;Ireland;UBS;26 June 2023;Distributing;Semi annually;Physical;;;Equity, United States, Dividend;Yes;Akcie;False;US;71.0;-4.84;;;2.37;17.15;;;-0.28;;;-18.3;;;;;;;;Borsa Italiana;SPDE;1;2.36%;2.36;EUR 0.08;0.08;EUR;method2_regex;2025-09-18T14:58:40.651793;success;0;;;;;;;;;;;;;;;;;;;;;United States;93.43;Other;1.91;;;;;;;Industrials;18.88;Consumer Staples;16.25;Health Care;12.3;Technology;2.75;Utilities;2.36;Borsa Italiana;EUR;SPDE;SPDE IMSPDEEUIV;SPDE.MISPDEEURINAV=SOLA;;;;;;;;;;;;;;;;;;;;;;;;;;;;;;;;
IE00BN0YSK89;Ossiam Food for Biodiversity UCITS ETF 1A (EUR);https://www.justetf.com/en/etf-profile.html?isin=IE00BN0YSK89;The Ossiam Food for Biodiversity UCITS ETF 1A (EUR) is an actively managed ETF. The ETF invests in companies, primarily from developed markets, which are active in the agriculture and food sectors. Title selection is based on financial, ESG (Environment, Social, Governance) and biodiversity data. The ETF's TER (total expense ratio) amounts to 0.75% p.a.. The dividends in the ETF are accumulated and reinvested in the ETF. The Ossiam Food for Biodiversity UCITS ETF 1A (EUR) is a very small ETF with 1m Euro assets under management. The ETF was launched on 30 December 2020 and is domiciled in Ireland.;Ossiam Food for Biodiversity UCITS ETF 1A (EUR) je aktivně spravovaný ETF. ETF investuje do společností, především z rozvinutých trhů, které jsou aktivní v zemědělství a potravinářském odvětví. Výběr titulu je založen na finančních, ESG (prostředí ESG (Environment, Social, Governance) a Biodiversity. TER (poměr celkových nákladů) činí 0,75% p.a. dividenday v ETF jsou akumulovány a reinvestovány do ETF. Ossiam Food for Biodiversity UCITS ETF 1A (EUR) je velmi malý ETF s spravováním 1 milionu euro. ETF byla zahájena 30. prosince 2020 a je v Irsku bydliště.;0.75%;0.75;EUR 1m;1.0;EUR;EUR;Ireland;;30 December 2020;;;Physical;;;risk  Actively managed    Sustainability  Yes;Yes;Ostatní;False;Ostatní;41.0;-11.94;-1.59;;-12.04;11.43;11.57;;-1.04;-0.05;;-15.11;-15.11;;;;;;;gettex;F4DE;4;;;;;;;2025-09-18T14:58:46.245087;success;0;;;;;;;;;;;;;;;;;;;;;United States;38.4;Other;24.29;United Kingdom;18.72;Japan;11.86;Switzerland;6.73;Consumer Discretionary;32.29;Materials;8.1;Industrials;3.6;;;;;gettex;EUR;F4DE;;;;Borsa Italiana;EUR;F4DE;F4DE IMF4DEIV;;;SIX Swiss Exchange;EUR;F4DE;F4DE SWF4DEIV;;;XETRA;EUR;F4DE;F4DE GYF4DEIV;F4DE.DE;;;;;;;;1.0;26.0;6.0;1.0;6.0;5.0;8.0
LU1481201538;BNP Paribas Easy ESG Momentum Europe UCITS ETF;https://www.justetf.com/en/etf-profile.html?isin=LU1481201538;The BNP Paribas Easy ESG Momentum Europe UCITS ETF seeks to track the BNP Paribas Momentum Europe ESG index. The BNP Paribas Momentum Europe ESG index tracks stocks with a high price momentum from Europe. The stocks included are filtered according to ESG criteria (environmental, social and corporate governance). The ETF's TER (total expense ratio) amounts to 0.31% p.a.. The ETF replicates the performance of the underlying index synthetically with a swap. The dividends in the ETF are distributed to the investors (Annually). The BNP Paribas Easy ESG Momentum Europe UCITS ETF is a very small ETF with 1m Euro assets under management. The ETF was launched on 31 January 2017 and is domiciled in Luxembourg.;BNP Paribas Easy ESG Momentum Europe UCITS ETF se snaží sledovat index ESG momentum BNP Paribas Momentum. BNP Paribas Momentum Europe ESG ESG Index sleduje akcie s hybností s vysokou cenou z Evropy. Zahrnuté akcie jsou filtrovány podle kritérií ESG (environmentální, sociální a správa a společností). ETF TER (celkový poměr nákladů) činí 0,31% p.a. ETF replikuje výkon podkladového indexu synteticky s výměnou. dividenday v ETF jsou distribuovány investorům (každoročně). BNP Paribas Easy ESG Momentum Europe UCITS ETF je velmi malý ETF s 1m euro ve spravování. ETF byl spuštěn 31. ledna 2017 a má bydliště v Lucemburku.;0.31%;0.31;EUR 1m;1.0;EUR;EUR;Luxembourg;BNP Paribas;31 January 2017;;Annually;Synthetic (Unfunded swap);;;Equity, Europe, Momentum;Yes;Akcie;False;Evropa;;15.36;13.54;14.57;;15.36;13.54;14.57;0.79;1.13;0.78;-13.74;-13.74;-24.59;;;;;;gettex;MOED;5;2.59%;2.59;EUR 3.91;3.91;EUR;method2_regex;2025-09-18T14:58:50.290439;success;0;;;;;;;;;;;;;;;;;;;;;;;;;;;;;;;;;;;;;;;;;gettex;EUR;MOED;;;;Stuttgart Stock Exchange;EUR;MOED;;;;Euronext Paris;EUR;MOED;MOED FPIMOED;EAMOED.PAMOEDINAV=IHSM;;SIX Swiss Exchange;EUR;MOED;MOED SEIMOED;EAMOED.SMOEDINAV=IHSM;;XETRA;EUR;MOED;MOED GYIMOED;EAMOED.DEMOEDINAV=IHSM;;2.0;47.0;12.0;1.0;11.0;5.0;18.0
IE000WZU35H0;AXA IM MSCI World Equity PAB UCITS ETF USD Dist;https://www.justetf.com/en/etf-profile.html?isin=IE000WZU35H0;The AXA IM MSCI World Equity PAB UCITS ETF USD Dist seeks to track the MSCI World Climate Paris Aligned index. The MSCI World Climate Paris Aligned index tracks stocks from developed countries worldwide. The index aims to give greater weight to companies that benefit from the transition to a lower carbon economy. In addition, EU directives on climate protection are taken into account. The parent index is the MSCI World. The ETF's TER (total expense ratio) amounts to 0.20% p.a.. The ETF replicates the performance of the underlying index by full replication (buying all the index constituents). The dividends in the ETF are distributed to the investors (Semi annually). The AXA IM MSCI World Equity PAB UCITS ETF USD Dist is a very small ETF with 1m Euro assets under management. The ETF was launched on 16 July 2024 and is domiciled in Ireland.;Světový kapitál AXA IM MSCI PAB UCITS ETF USD Dist se snaží sledovat index MSCI World Climate Paříž. Světový indexový index MSCI World Climate Paříž sleduje akcie z rozvinutých zemí po celém světě. Cílem indexu je poskytnout větší váhu společnostem, které těží z přechodu na nižší uhlíkovou ekonomiku. Kromě toho se berou v úvahu směrnice EU o ochraně klimatu. Rodičovský index je svět MSCI. TER (celkový poměr výdajů) ETF činí 0,20% p.a. ETF replikuje výkon podkladového indexu plnou replikací (nákup všech indexových složek). dividenday v ETF jsou distribuovány investorům (polo každoročně). Světový kapitál AXA IM MSCI PAB UCITS ETF USD DIST je velmi malý ETF s řízením 1 milionu euro. ETF byl spuštěn 16. července 2024 a je se sídlem v Irsku.;0.20%;0.2;EUR 1m;1.0;EUR;USD;Ireland;;16 July 2024;Distributing;Semi annually;Physical;;MSCI World;;Yes;Akcie;False;Globální;466.0;8.37;;;-0.08;16.49;;;0.51;;;-20.65;;;;;;;;gettex;AWST;3;0.64%;0.64;EUR 0.06;0.06;EUR;method2_regex;2025-09-18T14:58:58.517842;success;0;Nvidia;6.48;Microsoft;5.33;Apple;4.46;Amazon;3.0;Meta;2.15;Alphabet;1.85;Tesla;1.63;JPMorgan;1.42;;;;;United States;70.12;Other;19.17;Canada;4.27;Switzerland;3.28;France;3.16;Technology;33.23;Financials;15.37;Consumer Discretionary;9.53;Health Care;9.52;;;XETRA;USD;AWSU;;;;gettex;EUR;AWST;;;;XETRA;EUR;AWST;;;;;;;;;;;;;;;;;;;;;;
