LU1681047236;Amundi Core EURO STOXX 50 UCITS ETF EUR Acc;https://www.justetf.com/en/etf-profile.html?isin=LU1681047236;The Amundi Core EURO STOXX 50 UCITS ETF EUR Acc seeks to track the EURO STOXX® 50 index. The EURO STOXX® 50 index tracks the 50 largest companies in the eurozone. The ETF's TER (total expense ratio) amounts to 0.09% p.a.. The ETF replicates the performance of the underlying index by full replication (buying all the index constituents). The dividends in the ETF are accumulated and reinvested in the ETF. The Amundi Core EURO STOXX 50 UCITS ETF EUR Acc is a very large ETF with 2,658m Euro assets under management. The ETF was launched on 16 September 2008 and is domiciled in Luxembourg.;Amundi Core Euro Stoxx 50 UCITS ETF EUR ACC se snaží sledovat index Euro Stoxx® 50. Index Euro Stoxx® 50 sleduje 50 největších společností v eurozóně. TER (celkový poměr nákladů) ETF činí 0,09% p.a. ETF replikuje výkon podkladového indexu plnou replikací (nákup všech složek indexu). dividenday v ETF jsou akumulovány a reinvestovány do ETF. Amundi Core Euro Stoxx 50 UCITS ETF EUR ACC je velmi velký ETF s managementem 2 658 milionů euro. ETF byl spuštěn 16. září 2008 a je bydliště v Lucemburku.;0.09%;0.09;EUR 2658m;2658.0;EUR;EUR;Luxembourg;Amundi ETF;16 September 2008;Accumulating;;Physical;UCITS;;Equity, Europe;;EUR    Currency risk  Currency;1;Akcie;False;Evropa;56.0;13.81;70.47;91.46;14.47;-0.29;5.41;1.51;23.93;-9.04;22.74;11.55;204.76;17.36;15.4;17.36;0.8;1.26;0.8;-16.41;-16.41;-23.37;-43.9;;;;;Bolsa Mexicana de Valores;-;11;;;;;;;2025-09-22T01:12:52.252971;success;0;ASML Holding NV;6.4;Siemens AG;4.51;Schneider Electric SE;3.63;Allianz SE;3.51;LVMH Moët Hennessy Louis Vuitton SE;3.16;TotalEnergies SE;3.08;Deutsche Telekom AG;3.04;Banco Santander SA;3.03;Airbus SE;2.83;;;France;30.68;Germany;30.26;Netherlands;16.01;Other;14.42;;;Financials;23.34;Industrials;20.95;Technology;15.94;Consumer Discretionary;15.39;IT;3.16;gettex;EUR;V50A;;;;Stuttgart Stock Exchange;EUR;V50A;;;;London Stock Exchange;EUR;0A3A;;;;Bolsa Mexicana de Valores;MXN;-;C50N MM;;;Bolsa Mexicana de Valores;EUR;-;INC50;INC50INAV.PA;;Borsa Italiana;EUR;C50;C50 IMINC50;C50.MIINC50INAV.PA;;Borsa Italiana;EUR;-;C50 IMINC50;C50.MIINC50=BNPP;;Euronext Paris;EUR;C50;C50 FPINC50;C50.PAINC50=BNPP;;London Stock Exchange;GBX;MSED;MSED LN;MSED.L;;SIX Swiss Exchange;EUR;C50;C50 SWINC50;C50.SINC50=BNPP;;5.0;84.0;26.0;13.0;15.0;10.0;20.0
LU1681047319;Amundi Core EURO STOXX 50 UCITS ETF EUR Dist;https://www.justetf.com/en/etf-profile.html?isin=LU1681047319;The Amundi Core EURO STOXX 50 UCITS ETF EUR Dist seeks to track the EURO STOXX® 50 index. The EURO STOXX® 50 index tracks the 50 largest companies in the eurozone. The ETF's TER (total expense ratio) amounts to 0.09% p.a.. The ETF replicates the performance of the underlying index by full replication (buying all the index constituents). The dividends in the ETF are distributed to the investors (Annually). The Amundi Core EURO STOXX 50 UCITS ETF EUR Dist is a large ETF with 773m Euro assets under management. The ETF was launched on 29 June 2010 and is domiciled in Luxembourg.;Amundi Core Euro Stoxx 50 UCITS ETF EUR Dist se snaží sledovat index Euro Stoxx® 50. Index Euro Stoxx® 50 sleduje 50 největších společností v eurozóně. TER (celkový poměr nákladů) ETF činí 0,09% p.a. ETF replikuje výkon podkladového indexu plnou replikací (nákup všech složek indexu). dividenday v ETF jsou distribuovány investorům (každoročně). Amundi Core Euro Stoxx 50 UCITS ETF EUR Dist je velký ETF s managementem 773 milionů EUR. ETF byl spuštěn 29. června 2010 a má bydliště v Lucemburku.;0.09%;0.09;EUR 773m;773.0;EUR;EUR;Luxembourg;Amundi ETF;29 June 2010;Distributing;Annually;Physical;UCITS;;Equity, Europe;;EUR    Currency risk  Currency;1;Akcie;False;Evropa;56.0;13.82;70.59;91.63;14.47;-0.28;5.41;1.52;23.93;-9.04;22.78;11.59;242.94;17.38;15.41;17.36;0.8;1.26;0.8;-16.41;-16.41;-23.37;-38.24;;;;;Euronext Paris;CD5;5;2.47%;2.47;EUR 2.18;2.18;EUR;method2_regex;2025-09-22T01:12:59.115228;success;0;ASML Holding NV;6.4;Siemens AG;4.51;Schneider Electric SE;3.63;Allianz SE;3.51;LVMH Moët Hennessy Louis Vuitton SE;3.16;TotalEnergies SE;3.08;Deutsche Telekom AG;3.04;Banco Santander SA;3.03;Airbus SE;2.83;;;France;30.68;Germany;30.26;Netherlands;16.01;Other;14.42;;;Financials;23.34;Industrials;20.95;Technology;15.94;Consumer Discretionary;15.39;IT;3.16;gettex;EUR;V50D;;;;Stuttgart Stock Exchange;EUR;V50D;;;;Euronext Paris;EUR;CD5;CD5 FPINCD5;CD5.PAINCD5=BNPP;;SIX Swiss Exchange;EUR;CD5E;CD5E SWINCD5;CD5E.SINCD5=BNPP;;XETRA;EUR;V50D;V50D GYINCD5;V50D.DEINCD5=BNPP;;;;;;;;;;;;;;;;;;;;;;;;;;;;;;;;5.0;81.0;26.0;10.0;15.0;10.0;20.0
LU1681047400;Amundi Core EURO STOXX 50 UCITS ETF USD Acc;https://www.justetf.com/en/etf-profile.html?isin=LU1681047400;The Amundi Core EURO STOXX 50 UCITS ETF USD Acc seeks to track the EURO STOXX® 50 index. The EURO STOXX® 50 index tracks the 50 largest companies in the eurozone. The ETF's TER (total expense ratio) amounts to 0.09% p.a.. The ETF replicates the performance of the underlying index by full replication (buying all the index constituents). The dividends in the ETF are accumulated and reinvested in the ETF. The Amundi Core EURO STOXX 50 UCITS ETF USD Acc is a small ETF with 41m Euro assets under management. The ETF was launched on 15 October 2015 and is domiciled in Luxembourg.;Amundi Core Euro Stoxx 50 UCITS ETF USD ACC se snaží sledovat index Euro Stoxx® 50. Index Euro Stoxx® 50 sleduje 50 největších společností v eurozóně. TER (celkový poměr nákladů) ETF činí 0,09% p.a. ETF replikuje výkon podkladového indexu plnou replikací (nákup všech složek indexu). dividenday v ETF jsou akumulovány a reinvestovány do ETF. AMUNDI Core Euro Stoxx 50 UCITS ETF USD ACC je malý ETF s spravováním 41 milionů euro. ETF byl spuštěn 15. října 2015 a je bydliště v Lucemburku.;0.09%;0.09;EUR 41m;41.0;EUR;USD;Luxembourg;Amundi ETF;15 October 2015;Accumulating;;Physical;UCITS;;Equity, Europe;;USD    Currency risk  Currency;1;Akcie;False;Evropa;56.0;13.99;69.94;90.89;14.75;-0.29;5.41;1.62;24.8;-9.36;22.63;11.21;123.26;18.83;17.28;19.03;0.74;1.12;0.72;-16.62;-16.62;-22.95;-38.78;;;;;Euronext Paris;C50U;3;;;;;;;2025-09-22T01:13:04.942802;success;0;ASML Holding NV;6.4;Siemens AG;4.51;Schneider Electric SE;3.63;Allianz SE;3.51;LVMH Moët Hennessy Louis Vuitton SE;3.16;TotalEnergies SE;3.08;Deutsche Telekom AG;3.04;Banco Santander SA;3.03;Airbus SE;2.83;;;France;30.68;Germany;30.26;Netherlands;16.01;Other;14.42;;;Financials;23.34;Industrials;20.95;Technology;15.94;Consumer Discretionary;15.39;IT;3.16;Euronext Paris;USD;C50U;C50U FPINC50U;C50U.PAIC50U=BNPP;;London Stock Exchange;USD;C50U;C50U LNINC50U;AMC50U.LIC50U=BNPP;;SIX Swiss Exchange;USD;C50U;C50U SWINC50U;C50U.SIC50U=BNPP;;;;;;;;;;;;;;;;;;;;;;;;;;;;;;;;;;;;;;;;;;;;4.0;68.0;26.0;1.0;11.0;10.0;20.0
LU1681047665;Amundi ETF JPX Nikkei 400 UCITS ETF Daily Hedged CHF;https://www.justetf.com/en/etf-profile.html?isin=LU1681047665;The Amundi ETF JPX Nikkei 400 UCITS ETF Daily Hedged CHF seeks to track the JPX-Nikkei 400 (CHF Hedged) index. The JPX-Nikkei 400 Daily (CHF Hedged) index tracks 400 Japanese stocks. The stocks are mainly selected by return on equity and cumulative operating profit. Daily Currency hedged to Swiss Francs (CHF). The ETF's TER (total expense ratio) amounts to 0.18% p.a.. The ETF replicates the performance of the underlying index synthetically with a swap. The dividends in the ETF are accumulated and reinvested in the ETF. The Amundi ETF JPX Nikkei 400 UCITS ETF Daily Hedged CHF is a very small ETF with 6m Euro assets under management. The ETF was launched on 29 January 2016 and is domiciled in Luxembourg.;Amundi ETF JPX NIKKEI 400 UCITS ETF Denně zajišťoval CHF se snaží sledovat index JPX-Nikkei 400 (CHF Hedged). Indexové stopy JPX-Nikkei 400 denně (Hedged CHF Hedged) 400 japonských akcií. Akcie jsou vybírány hlavně návratností vlastního kapitálu a kumulativního provozního zisku. Denní měna byla zajištěna švýcarským frankům (CHF). ETF TER (celkový poměr nákladů) činí 0,18% p.a. ETF replikuje výkon podkladového indexu synteticky s výměnou. dividenday v ETF jsou akumulovány a reinvestovány do ETF. Amundi ETF JPX Nikkei 400 UCITS ETF Denně Hedged CHF je velmi malý ETF s managementem 6m euro. ETF byl spuštěn 29. ledna 2016 a je se sídlem v Lucemburku.;0.18%;0.18;EUR 6m;6.0;EUR;CHF;Luxembourg;Amundi ETF;29 January 2016;;;Synthetic (Unfunded swap);UCITS;;Equity, Japan;;CHF    Currency risk  Currency;1;Akcie;False;Celosvětově;;24.07;80.27;140.21;13.5;2.42;12.58;17.91;15.32;0.7;37.47;19.66;181.86;19.1;19.55;18.44;1.26;1.11;1.04;-17.06;-21.27;-21.27;-27.68;;;;;Euronext Paris;JPHC;2;;;;;;;2025-09-22T01:13:10.996421;success;0;;;;;;;;;;;;;;;;;;;;;;;;;;;;;;;;;;;;;;;;;Euronext Paris;CHF;JPHC;JPHC FPIJPHC;JPHC.PAIJPHC=BNPP;;SIX Swiss Exchange;CHF;JPHC;JPHC SWIJPHC;JPHC.SIJPHC=BNPP;;;;;;;;;;;;;;;;;;;;;;;;;;;;;;;;;;;;;;;;;;;;;;;;;;3.0;59.0;17.0;1.0;11.0;10.0;20.0
LU1681048127;Amundi S&P 500 Buyback UCITS ETF EUR (C);https://www.justetf.com/en/etf-profile.html?isin=LU1681048127;The Amundi S&P 500 Buyback UCITS ETF EUR (C) seeks to track the S&P 500 Buyback index. The S&P 500 Buyback index tracks the stocks with the highest buyback ratios in the S&P 500. The ETF's TER (total expense ratio) amounts to 0.15% p.a.. The Amundi S&P 500 Buyback UCITS ETF EUR (C) is the cheapest and largest ETF that tracks the S&P 500 Buyback index. The ETF replicates the performance of the underlying index synthetically with a swap. The dividends in the ETF are accumulated and reinvested in the ETF. The Amundi S&P 500 Buyback UCITS ETF EUR (C) is a small ETF with 52m Euro assets under management. The ETF was launched on 3 February 2015 and is domiciled in Luxembourg.;Amundi S&P 500 Recuckback UCITS ETF EUR (C) se snaží sledovat index zpětného odkupu S&P 500. Index zpětného odkupu S&P 500 sleduje akcie s nejvyššími poměry zpětného odkupu v S&P 500. TER (celkový poměr nákladů) činí 0,15% p.a. Amundi S&P 500 odkupní uCITS ETF EUR (C) je nejlevnější a nejvyšší ETF, který sleduje index S&P 500. ETF replikuje výkon podkladového indexu synteticky s výměnou. dividenday v ETF jsou akumulovány a reinvestovány do ETF. Amundi S&P 500 odkup UCITS ETF EUR (C) je malý ETF s managementem 52 milionů EUR. ETF byl spuštěn 3. února 2015 a je se sídlem v Lucemburku.;0.15%;0.15;EUR 52m;52.0;EUR;EUR;Luxembourg;Amundi ETF;3 February 2015;Accumulating;;Synthetic (Unfunded swap);UCITS;S&P 500;Equity, United States;;EUR    Currency risk  Currency;1;Akcie;False;Severní Amerika;;7.1;31.6;114.36;0.25;1.46;6.37;5.5;43.9;-6.02;11.3;22.17;187.85;19.4;17.2;17.98;0.37;0.56;0.92;-22.06;-22.06;-22.06;-42.32;;;;;Borsa Italiana;-;6;;;;;;;2025-09-22T01:13:18.545804;success;0;;;;;;;;;;;;;;;;;;;;;;;;;;;;;;;;;;;;;;;;;gettex;EUR;B500;;;;Stuttgart Stock Exchange;EUR;B500;;;;Borsa Italiana;EUR;B500;B500 IMIBYBE;B500.MIIBYBEINAV.PA;;Borsa Italiana;EUR;-;B500 IMIBYBE;B500.MIIBYBE=BNPP;;Euronext Paris;EUR;BYBE;BYBE FPIBYBE;BYBE.PAIBYBE=BNPP;;XETRA;EUR;B500;B500 GYIBYBE;B500.DEIBYBE=BNPP;;;;;;;;;;;;;;;;;;;;;;;;;;4.0;66.0;22.0;1.0;13.0;10.0;20.0
LU1681048556;Amundi ETF S&P 500 Buyback UCITS ETF USD;https://www.justetf.com/en/etf-profile.html?isin=LU1681048556;The Amundi ETF S&P 500 Buyback UCITS ETF USD seeks to track the S&P 500 Buyback index. The S&P 500 Buyback index tracks the stocks with the highest buyback ratios in the S&P 500. The ETF's TER (total expense ratio) amounts to 0.15% p.a.. The Amundi ETF S&P 500 Buyback UCITS ETF USD is the cheapest ETF that tracks the S&P 500 Buyback index. The ETF replicates the performance of the underlying index synthetically with a swap. The dividends in the ETF are accumulated and reinvested in the ETF. The Amundi ETF S&P 500 Buyback UCITS ETF USD is a very small ETF with 13m Euro assets under management. The ETF was launched on 3 February 2015 and is domiciled in Luxembourg.;AMUNDI ETF S&P 500 Reducack UCITS ETF USD se snaží sledovat index zpětného odkupu S&P 500. Index zpětného odkupu S&P 500 sleduje akcie s nejvyššími poměry zpětného odkupu v S&P 500. ETF TER (celkový poměr nákladů) činí 0,15% p.a. ETF replikuje výkon podkladového indexu synteticky s výměnou. dividenday v ETF jsou akumulovány a reinvestovány do ETF. AMUNDI ETF S&P 500 odkup UCITS ETF USD je velmi malý ETF s 13 miliony euro. ETF byl spuštěn 3. února 2015 a je se sídlem v Lucemburku.;0.15%;0.15;EUR 13m;13.0;EUR;USD;Luxembourg;Amundi ETF;3 February 2015;;;Synthetic (Unfunded swap);UCITS;S&P 500;Equity, United States;;USD    Currency risk  Currency;1;Akcie;False;Severní Amerika;;7.14;31.04;113.44;0.37;1.33;6.23;5.47;44.89;-6.34;11.2;21.81;183.81;19.72;18.02;18.59;0.36;0.52;0.88;-22.17;-22.17;-22.17;-42.51;;;;;gettex;AFIA;4;;;;;;;2025-09-22T01:13:24.063659;success;0;;;;;;;;;;;;;;;;;;;;;;;;;;;;;;;;;;;;;;;;;gettex;EUR;AFIA;;;;Euronext Paris;USD;BYBU;BYBU FPIBYBU;BYBU.PAIBYBU=BNPP;;London Stock Exchange;GBX;BYBG;BYBG LNIBYBU;BYBG.LIBYBUINAV.PA;;London Stock Exchange;USD;BYBU;BYBU LNIBYBU;BYBU.LIBYBU=BNPP;;;;;;;;;;;;;;;;;;;;;;;;;;;;;;;;;;;;;;4.0;66.0;22.0;1.0;13.0;10.0;20.0
LU1681048630;Amundi Global Luxury UCITS ETF EUR Acc;https://www.justetf.com/en/etf-profile.html?isin=LU1681048630;The Amundi Global Luxury UCITS ETF EUR Acc seeks to track the S&P Global Luxury index. The S&P Global Luxury index tracks the global luxury sector. The ETF's TER (total expense ratio) amounts to 0.25% p.a.. The Amundi Global Luxury UCITS ETF EUR Acc is the cheapest and largest ETF that tracks the S&P Global Luxury index. The ETF replicates the performance of the underlying index synthetically with a swap. The dividends in the ETF are accumulated and reinvested in the ETF. The Amundi Global Luxury UCITS ETF EUR Acc has 381m Euro assets under management. The ETF was launched on 4 December 2008 and is domiciled in Luxembourg.;Amundi Global Luxury UCITS ETF EUR ACC se snaží sledovat globální luxusní index S&P. Globální luxusní index S&P sleduje globální luxusní sektor. TER (celkový poměr nákladů) ETF činí 0,25% P.A. ETF replikuje výkon podkladového indexu synteticky s výměnou. dividenday v ETF jsou akumulovány a reinvestovány do ETF. Globální luxusní luxusní UCITS ETF EUR ACC má 381 mil. EUR. ETF byla spuštěna 4. prosince 2008 a je bydliště v Lucemburku.;0.25%;0.25;EUR 381m;381.0;EUR;EUR;Luxembourg;Amundi ETF;4 December 2008;Accumulating;;Synthetic (Unfunded swap);UCITS;;Equity, World, Consumer Discretionary;;EUR    Currency risk  Currency;1;Akcie;False;Celosvětově;;9.75;10.32;49.14;-1.94;2.56;10.4;4.87;31.7;-18.82;11.56;5.07;451.4;20.35;18.13;19.61;0.48;0.18;0.42;-26.84;-26.84;-30.33;-46.23;;;;;Borsa Italiana;-;7;;;;;;;2025-09-22T01:13:30.534279;success;0;;;;;;;;;;;;;;;;;;;;;;;;;;;;;;;;;;;;;;;;;gettex;EUR;GLUX;;;;Stuttgart Stock Exchange;EUR;GLUX;;;;Borsa Italiana;EUR;GLUX;GLUX IMIGLUX;GLUX.MIIGLUXINAV.PA;;Borsa Italiana;EUR;-;GLUX IMIGLUX;GLUX.MIINGLUX=BNPP;;Euronext Paris;EUR;GLUX;GLUX FPIGLUX;GLUX.PAINGLUX=BNPP;;SIX Swiss Exchange;EUR;GLUX;GLUX SWIGLUX;GLUX.SINGLUX=BNPP;;XETRA;EUR;GLUX;GLUX GYIGLUX;AMGLUX.DEINGLUX=BNPP;;;;;;;;;;;;;;;;;;;;3.0;63.0;17.0;5.0;15.0;10.0;16.0
LU1681048713;Amundi Global Luxury UCITS ETF USD Acc;https://www.justetf.com/en/etf-profile.html?isin=LU1681048713;The Amundi Global Luxury UCITS ETF USD Acc seeks to track the S&P Global Luxury index. The S&P Global Luxury index tracks the global luxury sector. The ETF's TER (total expense ratio) amounts to 0.25% p.a.. The Amundi Global Luxury UCITS ETF USD Acc is the cheapest ETF that tracks the S&P Global Luxury index. The ETF replicates the performance of the underlying index synthetically with a swap. The dividends in the ETF are accumulated and reinvested in the ETF. The Amundi Global Luxury UCITS ETF USD Acc is a small ETF with 45m Euro assets under management. The ETF was launched on 17 February 2014 and is domiciled in Luxembourg.;Globální luxusní luxusní UCITS ETF USD ACC ACC AMD se snaží sledovat globální luxusní index S&P. Globální luxusní index S&P sleduje globální luxusní sektor. TER ETF TER (celkový poměr nákladů) činí 0,25% P.A. ETF replikuje výkon podkladového indexu synteticky s výměnou. dividenday v ETF jsou akumulovány a reinvestovány do ETF. Global Luxury UCITS ETF USD ACC ACC ACC AMD AMUNDI je malý ETF s managementem 45 milionů euro. ETF byl spuštěn 17. února 2014 a je se sídlem v Lucemburku.;0.25%;0.25;EUR 45m;45.0;EUR;USD;Luxembourg;Amundi ETF;17 February 2014;Accumulating;;Synthetic (Unfunded swap);UCITS;;Equity, World, Consumer Discretionary;;USD    Currency risk  Currency;1;Akcie;False;Celosvětově;;9.89;9.94;48.63;-1.72;2.53;10.38;4.95;32.62;-19.09;11.45;4.75;157.12;25.11;20.69;21.51;0.39;0.15;0.38;-27.34;-27.34;-29.92;-42.53;;;;;gettex;AFID;5;;;;;;;2025-09-22T01:13:36.390645;success;0;;;;;;;;;;;;;;;;;;;;;;;;;;;;;;;;;;;;;;;;;gettex;EUR;AFID;;;;Euronext Paris;USD;LUXU;LUXU FPILUXU;LUXU.PAINLUXU=BNPP;;London Stock Exchange;GBX;LUXG;LUXG LNILUXU;LUXG.LILUXUINAV.PA;;London Stock Exchange;USD;LUXU;LUXU LNILUXU;LUXU.LINLUXU=BNPP;;SIX Swiss Exchange;USD;LUXU;LUXU SWILUXU;LUXU.SINLUXU=BNPP;;;;;;;;;;;;;;;;;;;;;;;;;;;;;;;;3.0;55.0;17.0;1.0;13.0;10.0;14.0
LU1681048804;Amundi S&P 500 Swap UCITS ETF EUR Acc;https://www.justetf.com/en/etf-profile.html?isin=LU1681048804;The Amundi S&P 500 Swap UCITS ETF EUR Acc seeks to track the S&P 500® index. The S&P 500® index tracks the 500 largest US stocks. The ETF's TER (total expense ratio) amounts to 0.15% p.a.. The ETF replicates the performance of the underlying index synthetically with a swap. The dividends in the ETF are accumulated and reinvested in the ETF. The Amundi S&P 500 Swap UCITS ETF EUR Acc is a very large ETF with 2,376m Euro assets under management. The ETF was launched on 8 June 2010 and is domiciled in Luxembourg.;Amundi S&P 500 Swap UCITS ETF EUR ACC se snaží sledovat index S&P 500®. Index S&P 500® sleduje 500 největších amerických akcií. ETF TER (celkový poměr nákladů) činí 0,15% p.a. ETF replikuje výkon podkladového indexu synteticky s výměnou. dividenday v ETF jsou akumulovány a reinvestovány do ETF. Amundi S&P 500 Swap UCITS ETF EUR ACC je velmi velký ETF s spravováním 2 376 milionů euro. ETF byl spuštěn 8. června 2010 a má bydliště v Lucemburku.;0.15%;0.15;EUR 2376m;2376.0;EUR;EUR;Luxembourg;Amundi ETF;8 June 2010;Accumulating;;Synthetic (Unfunded swap);UCITS;S&P 500;Equity, United States;;EUR    Currency risk  Currency;1;Akcie;False;Severní Amerika;;11.27;50.82;115.94;0.27;2.96;8.61;8.88;38.38;-12.89;21.8;33.12;705.47;20.05;17.37;17.69;0.56;0.84;0.94;-22.4;-22.4;-22.4;-33.59;;;;;Borsa Italiana;-;7;;;;;;;2025-09-22T01:13:41.483244;success;0;;;;;;;;;;;;;;;;;;;;;;;;;;;;;;;;;;;;;;;;;gettex;EUR;AUM5;;;;Stuttgart Stock Exchange;EUR;AUM5;;;;Borsa Italiana;EUR;A500;A500 IMIN500;A500.MIIN500INAV.PA;;Borsa Italiana;EUR;-;A500 IMIN500;A500.MIIN500=BNPP;;Euronext Paris;EUR;500;500 FPIN500;500.PAIN500=BNPP;;SIX Swiss Exchange;EUR;500E;500E SWIN500;AM500E.SIN500=BNPP;;XETRA;EUR;AUM5;AUM5 GYIN500;AUM5.DEIN500=BNPP;;;;;;;;;;;;;;;;;;;;5.0;80.0;22.0;13.0;15.0;10.0;20.0
LU1681049018;Amundi S&P 500 Swap UCITS ETF USD Acc;https://www.justetf.com/en/etf-profile.html?isin=LU1681049018;The Amundi S&P 500 Swap UCITS ETF USD Acc seeks to track the S&P 500® index. The S&P 500® index tracks the 500 largest US stocks. The ETF's TER (total expense ratio) amounts to 0.15% p.a.. The ETF replicates the performance of the underlying index synthetically with a swap. The dividends in the ETF are accumulated and reinvested in the ETF. The Amundi S&P 500 Swap UCITS ETF USD Acc is a very large ETF with 3,204m Euro assets under management. The ETF was launched on 2 July 2010 and is domiciled in Luxembourg.;Amundi S&P 500 Swap UCITS ETF USD ACC se snaží sledovat index S&P 500®. Index S&P 500® sleduje 500 největších amerických akcií. ETF TER (celkový poměr nákladů) činí 0,15% p.a. ETF replikuje výkon podkladového indexu synteticky s výměnou. dividenday v ETF jsou akumulovány a reinvestovány do ETF. AMUNDI S&P 500 Swap UCITS ETF USD ACC je velmi velký ETF s spravováním 3 204 milionů euro. ETF byl spuštěn 2. července 2010 a má bydliště v Lucemburku.;0.15%;0.15;EUR 3204m;3204.0;EUR;USD;Luxembourg;Amundi ETF;2 July 2010;Accumulating;;Synthetic (Unfunded swap);UCITS;S&P 500;Equity, United States;;USD    Currency risk  Currency;1;Akcie;False;Severní Amerika;;11.43;50.34;115.21;0.5;2.95;8.59;8.97;39.31;-13.18;21.68;32.71;777.24;20.86;18.04;19.74;0.55;0.81;0.84;-23.87;-23.87;-23.87;-33.7;;;;;Bolsa Mexicana de Valores;-;9;;;;;;;2025-09-22T01:13:48.238695;success;0;;;;;;;;;;;;;;;;;;;;;;;;;;;;;;;;;;;;;;;;;gettex;EUR;10AP;;;;Bolsa Mexicana de Valores;MXN;-;500UN MM;;;Bolsa Mexicana de Valores;USD;-;I500U;I500UINAV.PA;;Euronext Amsterdam;USD;-;500E NAI500U;500E.ASI500UINAV.PA;;Euronext Amsterdam;EUR;500E;500E NAI500U;500U.ASI500UINAV.PA;;Euronext Paris;USD;500U;500U FPI500U;500U.PA500U=BNPP;;London Stock Exchange;GBX;500G;500G LNI500U;500G.LI500UINAV.PA;;London Stock Exchange;USD;500U;500U LNI500U;500U.L500U=BNPP;;SIX Swiss Exchange;USD;500USD;500USD SWI500U;500USD.S500U=BNPP;;;;;;;;5.0;80.0;22.0;13.0;15.0;10.0;20.0
LU1681049109;Amundi S&P 500 Swap UCITS ETF EUR Hedged Acc;https://www.justetf.com/en/etf-profile.html?isin=LU1681049109;The Amundi S&P 500 Swap UCITS ETF EUR Hedged Acc seeks to track the S&P 500® (EUR Hedged) index. The S&P 500® (EUR Hedged) index tracks the largest US stocks. Currency hedged to Euro (EUR). The ETF's TER (total expense ratio) amounts to 0.28% p.a.. The ETF replicates the performance of the underlying index synthetically with a swap. The dividends in the ETF are accumulated and reinvested in the ETF. The Amundi S&P 500 Swap UCITS ETF EUR Hedged Acc is a large ETF with 649m Euro assets under management. The ETF was launched on 17 March 2017 and is domiciled in Luxembourg.;Amundi S&P 500 Swap UCITS ETF EUR HEDGED ACC se snaží sledovat index S&P 500® (EUR Hedged). Index S&P 500® (EUR Hedged) sleduje největší americké akcie. Měna zajišťovala euro (EUR). TER (celkový poměr nákladů) ETF činí 0,28% p.a. ETF replikuje výkon podkladového indexu synteticky s výměnou. dividenday v ETF jsou akumulovány a reinvestovány do ETF. Amundi S&P 500 Swap UCITS ETF EUR EUR ACC je velký ETF s řízením 649 milionů euro. ETF byl spuštěn 17. března 2017 a je bydliště v Lucemburku.;0.28%;0.28;EUR 649m;649.0;EUR;EUR;Luxembourg;Amundi ETF;17 March 2017;Accumulating;;Synthetic (Unfunded swap);UCITS;S&P 500;Equity, United States;;EUR    Currency risk  Currency;1;Akcie;False;Severní Amerika;;14.95;63.47;90.89;11.91;3.38;10.31;16.0;27.15;-20.8;22.37;22.31;162.64;18.41;16.82;17.39;0.81;1.06;0.79;-18.63;-18.63;-26.32;-33.89;;;;;Borsa Italiana;-;7;;;;;;;2025-09-22T01:13:53.670500;success;0;;;;;;;;;;;;;;;;;;;;;;;;;;;;;;;;;;;;;;;;;gettex;EUR;H1D5;;;;Stuttgart Stock Exchange;EUR;H1D5;;;;Borsa Italiana;EUR;500H;500H IMI500H;500H.MII500HINAV.PA;;Borsa Italiana;EUR;-;500H IMI500H;500H.MII500H=BNPP;;Euronext Paris;EUR;500H;500H FPI500H;500H.PAI500H=BNPP;;SIX Swiss Exchange;EUR;H500;H500 SWI500H;H500.SI500H=BNPP;;XETRA;EUR;H1D5;H1D5 GYI500H;H1D5.DEI500H=BNPP;;;;;;;;;;;;;;;;;;;;3.0;63.0;12.0;10.0;11.0;10.0;20.0
