IE00BQQPV184;SPDR MSCI Japan Climate Paris Aligned UCITS ETF JPY Unhedged;https://www.justetf.com/en/etf-profile.html?isin=IE00BQQPV184;The SPDR MSCI Japan Climate Paris Aligned UCITS ETF JPY Unhedged seeks to track the MSCI Japan Climate Paris Aligned index. The MSCI Japan Climate Paris Aligned index tracks stocks from Japan. The index aims to give greater weight to companies that benefit from the transition to a lower carbon economy. In addition, EU directives on climate protection are taken into account. The parent index is the MSCI Japan. The ETF's TER (total expense ratio) amounts to 0.12% p.a.. The SPDR MSCI Japan Climate Paris Aligned UCITS ETF JPY Unhedged is the cheapest ETF that tracks the MSCI Japan Climate Paris Aligned index. The ETF replicates the performance of the underlying index by full replication (buying all the index constituents). The dividends in the ETF are accumulated and reinvested in the ETF. The SPDR MSCI Japan Climate Paris Aligned UCITS ETF JPY Unhedged is a very small ETF with 4m Euro assets under management. The ETF was launched on 4 March 2022 and is domiciled in Ireland.;SPDR MSCI Japan Climate Paříž zarovnal UCITS ETF JPY Undredged usiluje o sledování indexu MSCI Japan pro klima Paříž. Společnost MSCI Japan Climate Paříž zarovnala indexové akciíy z Japonska. Cílem indexu je poskytnout větší váhu společnostem, které těží z přechodu na nižší uhlíkovou ekonomiku. Kromě toho se berou v úvahu směrnice EU o ochraně klimatu. Index nadřazení je MSCI Japan. TER (celkový poměr nákladů ETF) činí 0,12% p.a. ETF replikuje výkon podkladového indexu plnou replikací (nákup všech složek indexu). dividenday v ETF jsou akumulovány a reinvestovány do ETF. SPDR MSCI Japan Climate Paris Ambinované UCITS ETF JPY Unredged je velmi malý ETF s spravováním 4m euro. ETF byl spuštěn 4. března 2022 a je bydliště v Irsku.;0.12%;0.12;EUR 4m;4.0;EUR;JPY;Ireland;SPDR ETF;4 March 2022;;;Physical;UCITS;MSCI Japan Climate Paris Aligned  JPY Unhedged;Equity, Japan, Social/Environmental;Yes;JPY    Currency risk  Currency;1;Akcie;False;Celosvětově;53.0;5.77;18.43;;5.26;2.87;9.82;6.69;;;11.52;4.34;10.95;17.4;17.53;;0.33;0.33;;-17.52;-17.52;;-17.52;;;;;gettex;SPF6;2;;;;;;;2025-09-24T02:37:54.669708;success;0;Advantest Corp.;4.77;Recruit Holdings Co., Ltd.;4.57;East Japan Railway Co.;4.38;Central Japan Railway Co.;4.06;Chugai Pharmaceutical Co., Ltd.;3.98;Fast Retailing Co., Ltd.;3.46;Nippon Building Fund;3.44;KEYENCE Corp.;3.32;SoftBank Group Corp.;3.31;;;Japan;98.4;Other;1.6;;;;;;;Industrials;26.5;Technology;23.75;Health Care;17.32;Consumer Discretionary;8.7;;;gettex;EUR;SPF6;;;;XETRA;EUR;SPF6;SPF6 GYINSPF6E;SPF6.DENSPF6Eiv.P;;;;;;;;;;;;;;;;;;;;;;;;;;;;;;;;;;;;;;;;;;;;;;;;;;3;58;22;1;6;10;19
IE00BQT3WG13;iShares MSCI China A UCITS ETF;https://www.justetf.com/en/etf-profile.html?isin=IE00BQT3WG13;The iShares MSCI China A UCITS ETF seeks to track the MSCI China A Inclusion index. The MSCI China A Inclusion index tracks China A-Shares also included in the MSCI Emerging Markets. The ETF's TER (total expense ratio) amounts to 0.40% p.a.. The iShares MSCI China A UCITS ETF is the largest ETF that tracks the MSCI China A Inclusion index. The ETF replicates the performance of the underlying index by full replication (buying all the index constituents). The dividends in the ETF are accumulated and reinvested in the ETF. The iShares MSCI China A UCITS ETF is a very large ETF with 1,844m Euro assets under management. The ETF was launched on 8 April 2015 and is domiciled in Ireland.;IShares MSCI China A UCITS ETF se snaží sledovat index inkluzi MSCI. Index inkluze MSCI Čína Stopy China A-Shares také zahrnula na rozvíjejících se trzích MSCI. TER (celkový poměr nákladů) ETF činí 0,40% p.a. IShares MSCI China A UCITS ETF je největší ETF, který sleduje index inkluzi MSCI. ETF replikuje výkon podkladového indexu plnou replikací (nákup všech složek indexu). dividenday v ETF jsou akumulovány a reinvestovány do ETF. Ishares MSCI China A UCITS ETF je velmi velký ETF s 1 844 milionů euro. ETF byl spuštěn 8. dubna 2015 a má bydliště v Irsku.;0.40%;0.4;EUR 1844m;1844.0;EUR;USD;Ireland;iShares;8 April 2015;;;Physical;UCITS;MSCI China A;Equity, China;;USD    Currency risk  Currency;1;Akcie;False;Celosvětově;394.0;35.06;-1.05;2.84;6.82;2.84;17.79;10.07;11.33;-21.58;-16.78;18.28;-1.05;25.44;20.28;20.25;1.38;-0.02;0.03;-20.25;-31.31;-43.33;-51.81;;;;;Bolsa Mexicana de Valores;-;9;;;;;;;2025-09-24T02:38:04.289452;success;0;Contemporary Amperex Technology Co., Ltd.;2.88;China Merchants Bank Co., Ltd.;2.26;China Yangtze Power Co., Ltd.;1.68;Ping An Insurance (Group) Co. of China Ltd.;1.56;BYD Co., Ltd.;1.41;Agricultural Bank of China Ltd.;1.32;Industrial & Commercial Bank of China Ltd.;1.17;Wuliangye Yibin;1.16;Industrial Bank Co., Ltd.;1.16;;;China;97.68;Other;2.32;;;;;;;Financials;24.69;Technology;15.67;Industrials;14.77;Consumer Staples;10.85;;;London Stock Exchange;GBX;IASH;;;;gettex;EUR;36BZ;;;;Stuttgart Stock Exchange;EUR;36BZ;;;;Bolsa Mexicana de Valores;MXN;-;CNYAN MMINAVASHU;CNYAN.MX0J2NINAV.DE;;Euronext Amsterdam;EUR;CNYA;CNYA NA;;;London Stock Exchange;USD;CNYA;CNYA LNINAVASHU;CNYA.L0J2NINAV.DE;;London Stock Exchange;GBP;-;IASH LNINAVASHG;IASH.L0J2LINAV.DE;;SIX Swiss Exchange;USD;CNYA;CNYA SEINAVASHU;CNYA.S0J2NINAV.DE;;XETRA;EUR;36BZ;36BZ GYINAVASHE;36BZ.DE0J2JINAV.DE;;;;;;;;3;56;12;13;13;10;8
IE00BQWJFQ70;SPDR Morningstar Multi-Asset Global Infrastructure UCITS ETF;https://www.justetf.com/en/etf-profile.html?isin=IE00BQWJFQ70;The SPDR Morningstar Multi-Asset Global Infrastructure UCITS ETF seeks to track the Morningstar Global Multi-Asset Infrastructure index. The Morningstar Global Multi-Asset Infrastructure index tracks global equity and global fixed income securities that, fall within infrastructure related industries. The Index is equally weighted between equities and fixed income (quarterly rebalancing). The ETF's TER (total expense ratio) amounts to 0.40% p.a.. The SPDR Morningstar Multi-Asset Global Infrastructure UCITS ETF is the only ETF that tracks the Morningstar Global Multi-Asset Infrastructure index. The ETF replicates the performance of the underlying index by sampling technique (buying a selection of the most relevant index constituents). The dividends in the ETF are distributed to the investors (Semi annually). The SPDR Morningstar Multi-Asset Global Infrastructure UCITS ETF is a very large ETF with 1,348m Euro assets under management. The ETF was launched on 14 April 2015 and is domiciled in Ireland.;Globální infrastruktura SPDR MorningStar UCITS ETF se snaží sledovat globální index infrastruktury MorningStar Global Global. Globální index infrastruktury MorningStar Global s více aktivami sleduje globální kapitál a celosvětové cenné papíry s pevným výnosem, které spadají do průmyslových odvětví souvisejících s infrastrukturou. Index je stejně vážen mezi akciemi a pevným příjmem (čtvrtletní vyvážení). TER (celkový poměr výdajů) ETF činí 0,40% P.A. ETF replikuje výkon základního indexu technikou vzorkování (nákup výběru nejdůležitějších složek indexu). dividenday v ETF jsou distribuovány investorům (polo každoročně). Globální infrastruktura ETF SPDR Morningstar Global Infrastructure je velmi velká ETF s 1 348 mil. EUR. ETF byl spuštěn 14. dubna 2015 a je se sídlem v Irsku.;0.40%;0.4;EUR 1348m;1348.0;EUR;USD;Ireland;SPDR ETF;14 April 2015;;Semi annually;Physical;focus   Equity, World, Infrastructure;;Equity, World, Infrastructure;;USD    Currency risk  Currency;1;Akcie;False;Celosvětově;2423.0;0.45;7.28;21.74;-1.67;-0.51;1.24;-1.15;15.35;-9.35;4.39;9.7;39.62;9.16;9.76;9.35;0.05;0.24;0.43;-8.91;-8.91;-14.48;-23.88;;;;;London Stock Exchange;GIN;6;2.94%;2.94;EUR 0.92;0.92;EUR;method2_regex;2025-09-24T02:38:11.353946;success;0;Union Pacific;1.47;Iberdrola SA;1.17;The Southern Co.;1.14;Enbridge;1.1;American Tower Corp.;1.08;Duke Energy;1.04;Waste Management;0.93;The Williams Cos;0.8;National Grid;0.78;;;Other;65.14;United States;26.39;Canada;3.84;Japan;2.91;UK;1.04;Utilities;21.22;Industrials;17.13;Health Care;2.02;Energy;1.04;;;gettex;EUR;ZPRI;;;;Stuttgart Stock Exchange;EUR;ZPRI;;;;Borsa Italiana;EUR;MGIN;MGIN IMINZPRIE;MGIN.MIINZPRIEiv.P;;London Stock Exchange;USD;MAGI;MAGI LNINZPRIU;MAGI.L;;London Stock Exchange;GBP;GIN;GIN LNINZPRIP;GIN.L;;XETRA;EUR;ZPRI;ZPRI GYINZPRIE;ZPRI.DE;;;;;;;;;;;;;;;;;;;;;;;;;;3;62;12;13;13;10;14
IE00BQXKVQ19;Xtrackers MSCI GCC Select Swap UCITS ETF 1C;https://www.justetf.com/en/etf-profile.html?isin=IE00BQXKVQ19;The Xtrackers MSCI GCC Select Swap UCITS ETF 1C seeks to track the MSCI GCC Countries ex Select Securities index. The MSCI GCC Countries ex Select Securities index tracks stocks from Bahrain, Kuwait, Oman, Qatar, Saudi Arabia and the United Arab Emirates. The index excludes 4 securities. The ETF's TER (total expense ratio) amounts to 0.65% p.a.. The Xtrackers MSCI GCC Select Swap UCITS ETF 1C is the only ETF that tracks the MSCI GCC Countries ex Select Securities index. The ETF replicates the performance of the underlying index synthetically with a swap. The dividends in the ETF are accumulated and reinvested in the ETF. The Xtrackers MSCI GCC Select Swap UCITS ETF 1C is a small ETF with 24m Euro assets under management. The ETF was launched on 5 February 2015 and is domiciled in Ireland.;XTrackers MSCI GCC Select Swap UCITS ETF 1C se snaží sledovat země MSCI GCC ex Select Index Securities Index. Země MSCI GCC ex vybírají index cenných papírů, které sleduje akcie z Bahrajnu, Kuvajtu, Ománu, Kataru, Saúdské Arábie a Spojených arabských emirátů. Index nezahrnuje 4 cenné papíry. TER (celkový poměr nákladů) ETF činí 0,65% p.a. Xtrackers MSCI GCC Select Swap UCITS ETF 1C je jediný ETF, který sleduje země MSCI GCC ex Select Securities Index. ETF replikuje výkon podkladového indexu synteticky s výměnou. dividenday v ETF jsou akumulovány a reinvestovány do ETF. Xtrackers MSCI GCC Select Swap UCITS ETF 1C je malý ETF s spravováním 24 metrů EUR. ETF byl spuštěn 5. února 2015 a je se sídlem v Irsku.;0.65%;0.65;EUR 24m;24.0;EUR;USD;Ireland;Xtrackers;5 February 2015;;;Synthetic (Unfunded swap);UCITS;MSCI GCC Select Swap  1C;Equity, Emerging Markets;;USD    Currency risk  Currency;1;Akcie;False;Rozvíjející se trhy;;2.37;-9.56;61.0;-5.94;-1.44;6.01;-3.8;49.14;0.87;1.92;10.79;62.34;13.83;13.42;13.78;0.17;-0.25;0.72;-15.42;-23.9;-30.42;-39.52;;;;;gettex;XGLF;4;;;;;;;2025-09-24T02:38:20.154560;success;0;;;;;;;;;;;;;;;;;;;;;;;;;;;;;;;;;;;;;;;;;gettex;EUR;XGLF;;;;Stuttgart Stock Exchange;EUR;XGLF;;;;London Stock Exchange;USD;XGLF;XGLF LNXGLFINVU;XGLF.L274TINAV.DE;;XETRA;EUR;XGLF;XGLF GYXGLFINVE;XGLF.DE274SINAV.DE;;;;;;;;;;;;;;;;;;;;;;;;;;;;;;;;;;;;;;2;38;6;1;13;10;8
IE00BQZJBM26;WisdomTree Emerging Markets SmallCap Dividend UCITS ETF;https://www.justetf.com/en/etf-profile.html?isin=IE00BQZJBM26;The WisdomTree Emerging Markets SmallCap Dividend UCITS ETF seeks to track the WisdomTree Emerging Markets SmallCap Dividend index. The WisdomTree Emerging Markets SmallCap Dividend index tracks small cap stocks with high dividend yields from emerging markets. The stocks included are filtered according to ESG criteria (environmental, social and corporate governance). The Index is a fundamentally weighted index. The ETF's TER (total expense ratio) amounts to 0.54% p.a.. The WisdomTree Emerging Markets SmallCap Dividend UCITS ETF is the only ETF that tracks the WisdomTree Emerging Markets SmallCap Dividend index. The ETF replicates the performance of the underlying index by sampling technique (buying a selection of the most relevant index constituents). The dividends in the ETF are distributed to the investors (Semi annually). The WisdomTree Emerging Markets SmallCap Dividend UCITS ETF is a small ETF with 34m Euro assets under management. The ETF was launched on 14 November 2014 and is domiciled in Ireland.;Rozvíjející se trhy WisdomTree SmallCap dividenda UCITS ETF se snaží sledovat rozvíjející se trhy WisdomTree Smallcap dividenda Index. Index dividenda WisdomTree SmallCap dividenda sleduje malé akciíy s vysokým dividendaou z rozvíjejících se trhů. Zahrnuté akcie jsou filtrovány podle kritérií ESG (environmentální, sociální a správa a společností). Index je zásadně vážený index. TER (celkový poměr nákladů) činí 0,54% p.a. Rozvíjející se trhy WisdomTree SmallCap dividenda UCITS ETF je jediný ETF, který sleduje index dividenda WisdomTree SmallCap. ETF replikuje výkon základního indexu technikou vzorkování (nákup výběru nejdůležitějších složek indexu). dividenday v ETF jsou distribuovány investorům (polo každoročně). Rozvíjející se trhy WisdomTree SmallCap dividenda UCITS ETF je malá ETF s managementem 34 milionů euro. ETF byl spuštěn 14. listopadu 2014 a je se sídlem v Irsku.;0.54%;0.54;EUR 34m;34.0;EUR;USD;Ireland;WisdomTree;14 November 2014;;Semi annually;Physical;UCITS;;Equity, Emerging Markets, Small Cap;Yes;USD    Currency risk  Currency;1;Akcie;False;Rozvíjející se trhy;934.0;5.27;28.99;70.37;3.81;2.29;7.66;7.97;23.87;-6.73;16.46;9.55;109.62;12.93;11.79;11.68;0.41;0.75;0.96;-19.88;-19.88;-19.88;-37.27;;;;;London Stock Exchange;DGSD;6;2.93%;2.93;EUR 0.56;0.56;EUR;method2_regex;2025-09-24T02:38:27.413706;success;0;Growthpoint Properties Ltd.;0.9;Powertech Technology, Inc.;0.83;BNK Financial Group, Inc.;0.78;AVI Ltd.;0.76;Transmissora Alianca;0.75;King Slide Works;0.68;Perusahaan Gas Negara;0.67;Tiger Brands Ltd.;0.66;Asseco Poland SA;0.65;;;Other;41.54;China;10.3;USA;0.67;Poland;0.65;;;Technology;16.36;Industrials;15.89;Financials;11.67;Consumer Discretionary;11.04;;;gettex;EUR;WTED;;;;Borsa Italiana;EUR;DGSE;DGSE IMDGSEEIV;WTDGSE.MI.FTDGSEEIV;;London Stock Exchange;GBX;DGSE;DGSE LNDGSEEIV;WTDGSE.L.FTDGSEEIV;;London Stock Exchange;USD;DGSD;DGSD LNDGSEEIV;DGSD.L.FTDGSEEIV;;SIX Swiss Exchange;CHF;DGSE;DGSE SWDGSEEIV;WTDGSE.S.FTDGSEEIV;;XETRA;EUR;WTED;WTED GYDGSEEIV;WTED.DE.FTDGSEEIV;;;;;;;;;;;;;;;;;;;;;;;;;;2;45;6;1;13;5;20
IE00BQZJBQ63;WisdomTree US Equity Income UCITS ETF;https://www.justetf.com/en/etf-profile.html?isin=IE00BQZJBQ63;The WisdomTree US Equity Income UCITS ETF seeks to track the WisdomTree US Equity Income index. The WisdomTree US Equity Income index tracks US stocks with high dividend yields. The stocks included are filtered according to ESG criteria (environmental, social and corporate governance). The index is a fundamentally weighted index. The ETF's TER (total expense ratio) amounts to 0.29% p.a.. The WisdomTree US Equity Income UCITS ETF is the cheapest ETF that tracks the WisdomTree US Equity Income index. The ETF replicates the performance of the underlying index by full replication (buying all the index constituents). The dividends in the ETF are distributed to the investors (Quarterly). The WisdomTree US Equity Income UCITS ETF is a small ETF with 49m Euro assets under management. The ETF was launched on 21 October 2014 and is domiciled in Ireland.;WisdomTree US Equity Income UCITS ETF se snaží sledovat index příjmů z kapitálu WisdomTree USA. Index příjmů z WisdomTree USA sleduje americké akcie s vysokými výnosy z dividenda. Zahrnuté akcie jsou filtrovány podle kritérií ESG (environmentální, sociální a správa a společností). Index je zásadně vážený index. TER (celkový poměr nákladů) ETF činí 0,29% P.A. ETF replikuje výkon podkladového indexu plnou replikací (nákup všech složek indexu). dividenday v ETF jsou distribuovány investorům (čtvrtletně). Společnost WisdomTree US Equity Income UCITS ETF je malá ETF s spravováním 49m euro. ETF byl spuštěn 21. října 2014 a je se sídlem v Irsku.;0.29%;0.29;EUR 49m;49.0;EUR;USD;Ireland;WisdomTree;21 October 2014;;Quarterly;Physical;UCITS;;Equity, United States, Dividend;Yes;USD    Currency risk  Currency;1;Akcie;False;Severní Amerika;340.0;3.54;11.79;85.12;-5.46;-2.05;5.21;-4.28;33.31;13.61;-4.34;23.58;151.05;17.61;16.65;16.18;0.2;0.23;0.81;-18.87;-19.9;-19.9;-36.88;;;;;Borsa Italiana;DHS;6;3.09%;3.09;EUR 0.69;0.69;EUR;method2_regex;2025-09-24T02:38:35.411834;success;0;AbbVie, Inc.;5.6;Exxon Mobil Corp.;5.1;PepsiCo, Inc.;4.59;AT&T, Inc.;4.36;Chevron Corp.;3.78;Gilead Sciences, Inc.;3.48;IBM;3.33;Merck & Co., Inc.;3.14;Morgan Stanley;2.99;;;United States;98.29;Other;1.71;;;;;;;Financials;24.83;Health Care;23.4;Consumer Staples;11.41;Energy;10.33;;;gettex;EUR;WTEU;;;;Borsa Italiana;EUR;DHS;DHS IMDHSEIV;DHS.MI.FTDHSEIV;;London Stock Exchange;GBX;DHS;DHS LNDHSEIV;DHS.L.FTDHSEIV;;London Stock Exchange;USD;DHSD;DHSD LNDHSEIV;DHSD.L.FTDHSEIV;;SIX Swiss Exchange;CHF;DHS;DHS SWDHSEIV;DHS.S.FTDHSEIV;;XETRA;EUR;WTEU;WTEU GYDHSEIV;WTEU.DE.FTDHSEIV;;;;;;;;;;;;;;;;;;;;;;;;;;2;47;12;1;13;5;16
IE00BQZJBX31;WisdomTree Europe Equity Income UCITS ETF;https://www.justetf.com/en/etf-profile.html?isin=IE00BQZJBX31;The WisdomTree Europe Equity Income UCITS ETF seeks to track the WisdomTree Europe Equity Income index. The WisdomTree Europe Equity Income index tracks European stocks with high dividend yields. The stocks included are filtered according to ESG criteria (environmental, social and corporate governance). The Index is a fundamentally weighted index. The ETF's TER (total expense ratio) amounts to 0.29% p.a.. The WisdomTree Europe Equity Income UCITS ETF is the only ETF that tracks the WisdomTree Europe Equity Income index. The ETF replicates the performance of the underlying index by full replication (buying all the index constituents). The dividends in the ETF are distributed to the investors (Semi annually). The WisdomTree Europe Equity Income UCITS ETF is a small ETF with 71m Euro assets under management. The ETF was launched on 21 October 2014 and is domiciled in Ireland.;WisdomTree Europe Equity Income UCITS ETF se snaží sledovat index příjmů společnosti WisdomTree Europe Europe Europe. Index příjmů společnosti WisdomTree Europe Evropy sleduje evropské akcie s vysokými výnosy z dividenda. Zahrnuté akcie jsou filtrovány podle kritérií ESG (environmentální, sociální a správa a společností). Index je zásadně vážený index. TER (celkový poměr nákladů) ETF činí 0,29% P.A .. Wisdomtree Europe Equity Income UCITS ETF je jediný ETF, který sleduje index kapitálu WisdomTree Europe Europe. ETF replikuje výkon podkladového indexu plnou replikací (nákup všech složek indexu). dividenday v ETF jsou distribuovány investorům (polo každoročně). WisdomTree Europe Equity Income UCITS ETF je malý ETF s spravováním aktiv 71 milionů euro. ETF byl spuštěn 21. října 2014 a je se sídlem v Irsku.;0.29%;0.29;EUR 71m;71.0;EUR;EUR;Ireland;WisdomTree;21 October 2014;;Semi annually;Physical;UCITS;;Equity, Europe, Dividend;Yes;EUR    Currency risk  Currency;1;Akcie;False;Evropa;244.0;17.01;50.26;86.87;19.25;-2.24;3.98;6.91;18.9;-0.5;15.73;2.84;91.77;12.96;12.39;13.45;1.31;1.17;0.99;-14.04;-14.04;-16.56;-39.7;;;;;Borsa Italiana;EEI;6;5.55%;5.55;EUR 0.75;0.75;EUR;method2_regex;2025-09-24T02:38:44.023820;success;0;Enel SpA;3.3;Intesa Sanpaolo SpA;3.27;ENGIE SA;3.12;TotalEnergies SE;3.04;Allianz SE;2.86;Equinor ASA;2.81;Banco Bilbao Vizcaya Argentaria SA;2.25;AXA SA;2.2;Rio Tinto Plc;2.08;;;Other;40.56;United Kingdom;19.23;France;17.98;;;;;Financials;28.75;Utilities;15.66;Industrials;13.19;Energy;11.93;;;gettex;EUR;WTEE;;;;Borsa Italiana;EUR;EEI;EEI IMEEIIV;WTEEI.MI.FTEEIIV;;London Stock Exchange;GBX;EEI;EEI LNEEIIV;WTEEI.L.FTEEIIV;;London Stock Exchange;EUR;EEIE;EEIE LNEEIIV;EEIE.L.FTEEIIV;;SIX Swiss Exchange;CHF;EEI;EEI SWEEIIV;WTEEI.S.FTEEIIV;;XETRA;EUR;WTEE;WTEE GYEEIIV;WTEE.DE.FTEEIIV;;;;;;;;;;;;;;;;;;;;;;;;;;3;51;12;1;13;5;20
IE00BQZJC527;WisdomTree Europe SmallCap Dividend UCITS ETF;https://www.justetf.com/en/etf-profile.html?isin=IE00BQZJC527;The WisdomTree Europe SmallCap Dividend UCITS ETF seeks to track the WisdomTree Europe SmallCap Dividend index. The WisdomTree Europe SmallCap Dividend index tracks European small cap stocks with high dividend yields. The stocks included are filtered according to ESG criteria (environmental, social and corporate governance). The Index is a fundamentally weighted index. The ETF's TER (total expense ratio) amounts to 0.38% p.a.. The WisdomTree Europe SmallCap Dividend UCITS ETF is the cheapest and largest ETF that tracks the WisdomTree Europe SmallCap Dividend index. The ETF replicates the performance of the underlying index by full replication (buying all the index constituents). The dividends in the ETF are distributed to the investors (Semi annually). The WisdomTree Europe SmallCap Dividend UCITS ETF is a small ETF with 38m Euro assets under management. The ETF was launched on 21 October 2014 and is domiciled in Ireland.;dividenda uCITS ETF WisdomTree Europe SmallCap se snaží sledovat index dividenda WisdomTree Smallcap. Index dividenda Wisdomtree Europe Smallcap sleduje evropské akcie s malými čepičkami s vysokými výnosy dividenda. Zahrnuté akcie jsou filtrovány podle kritérií ESG (environmentální, sociální a správa a společností). Index je zásadně vážený index. TER (celkový poměr výdajů) ETF činí 0,38% p.a. ETF replikuje výkon podkladového indexu plnou replikací (nákup všech složek indexu). dividenday v ETF jsou distribuovány investorům (polo každoročně). WisdomTree Europe SmallCap dividenda UCITS ETF je malý ETF s managementem 38 milionů EUR. ETF byl spuštěn 21. října 2014 a je se sídlem v Irsku.;0.38%;0.38;EUR 38m;38.0;EUR;EUR;Ireland;WisdomTree;21 October 2014;;Semi annually;Physical;UCITS;;Equity, Europe, Small Cap;Yes;EUR    Currency risk  Currency;1;Akcie;False;Evropa;378.0;10.77;39.18;70.73;12.12;-2.16;2.64;7.09;27.99;-15.85;10.37;6.99;139.85;13.79;14.26;15.38;0.78;0.82;0.73;-13.74;-14.65;-26.66;-44.42;;;1.17;;Borsa Italiana;DFE;6;4.77%;4.77;EUR 0.95;0.95;EUR;method2_regex;2025-09-24T02:38:56.202545;success;0;BW LPG;1.54;Bilfinger SE;1.5;Coface SA;1.26;Assura;1.2;Valiant Holding;1.17;Sirius Real Estate;1.17;Sonae SGPS SA;1.14;OPmobility SE;1.12;Banca IFIS SpA;1.05;;;Other;46.15;United Kingdom;27.51;;;;;;;Industrials;24.52;Consumer Discretionary;15.76;Financials;11.89;Materials;7.19;Real Estate;1.17;gettex;EUR;WTES;;;;Borsa Italiana;EUR;DFE;DFE IMDFEEIV;DFE.MI.FTDFEIV;;London Stock Exchange;GBX;DFE;DFE LNDFEEIV;DFE.L.FTDFEIV;;London Stock Exchange;EUR;DFEE;DFEE LNDFEEIV;DFEE.L.FTDFEIV;;SIX Swiss Exchange;CHF;DFE;DFE SWDFEEIV;DFE.S.FTDFEIV;;XETRA;EUR;WTES;WTES GYDFEEIV;WTES.DE.FTDFEIV;;;;;;;;;;;;;;;;;;;;;;;;;;3;51;12;1;13;5;20
IE00BRB36B93;Xtrackers MSCI Japan Screened UCITS ETF 3C - EUR Hedged;https://www.justetf.com/en/etf-profile.html?isin=IE00BRB36B93;The Xtrackers MSCI Japan Screened UCITS ETF 3C - EUR Hedged seeks to track the MSCI Japan Select Screened (EUR Hedged) index. The MSCI Japan Select Screened (EUR Hedged) index tracks large and mid-cap securities of the Japanese equity markets. The stocks included are filtered according to ESG criteria (environmental, social and corporate governance). Excluded sectors and companies: weapons, tobacco, thermal coal, oil sands, non-compliance with UN Global Compact. Currency hedged to Euro (EUR). The ETF's TER (total expense ratio) amounts to 0.25% p.a.. The Xtrackers MSCI Japan Screened UCITS ETF 3C - EUR Hedged is the only ETF that tracks the MSCI Japan Select Screened (EUR Hedged) index. The ETF replicates the performance of the underlying index by full replication (buying all the index constituents). The dividends in the ETF are accumulated and reinvested in the ETF. The Xtrackers MSCI Japan Screened UCITS ETF 3C - EUR Hedged is a small ETF with 53m Euro assets under management. The ETF was launched on 31 March 2015 and is domiciled in Ireland.;Xtrackers MSCI Japonsko promítáno UCITS ETF 3C - EUR Hedged se snaží sledovat index MSCI Japan Select Screened (EUR Hedged). Indexové indexové cenné papíry japonských akciových trhů vybírá MSCI Japonsko. Zahrnuté akcie jsou filtrovány podle kritérií ESG (environmentální, sociální a správa a společností). Vyloučené odvětví a společnosti: Zbraně, tabák, tepelné uhlí, ropné písky, nedodržování globálního kompaktního oSN. Měna zajišťovala euro (EUR). TER ETF TER (celkový poměr výdajů) činí 0,25% p.a. ETF replikuje výkon podkladového indexu plnou replikací (nákup všech složek indexu). dividenday v ETF jsou akumulovány a reinvestovány do ETF. Xtrackers MSCI Japonsko promítáno UCITS ETF 3C - EUR Hedged je malý ETF s 53 miliony euro. ETF byl spuštěn 31. března 2015 a má bydliště v Irsku.;0.25%;0.25;EUR 53m;53.0;EUR;EUR;Ireland;Xtrackers;31 March 2015;;;Physical;UCITS;MSCI Japan Screened  3C - EUR Hedged;Equity, Japan, Social/Environmental;Yes;EUR    Currency risk  Currency;1;Akcie;False;Celosvětově;169.0;22.66;82.59;114.84;14.2;2.61;14.12;13.7;11.2;-5.66;30.93;23.12;133.26;21.8;20.85;19.32;1.04;1.06;0.85;-18.31;-25.33;-25.33;-33.73;;;1.691;;gettex;XDNE;4;;;;;;;2025-09-24T02:39:02.452591;success;0;Mitsubishi UFJ Financial Group, Inc.;4.22;Sony Group Corp.;3.95;Hitachi Ltd.;3.71;Sumitomo Mitsui Financial Group, Inc.;2.5;Nintendo Co., Ltd.;2.47;Recruit Holdings Co., Ltd.;2.22;Tokyo Electron Ltd.;2.15;Tokio Marine Holdings, Inc.;1.95;SoftBank Group Corp.;1.94;;;Japan;99.92;;;;;;;;;Industrials;23.42;Financials;17.53;Consumer Discretionary;17.31;Technology;14.14;;;gettex;EUR;XDNE;;;;Stuttgart Stock Exchange;EUR;XDNE;;;;Borsa Italiana;EUR;XDNE;XDNE IMXDNEINVE;XDNE.MI0J9VINAV.DE;;XETRA;EUR;XDNE;XDNE GYXDNEINVJ;XDNE.DE0JH9INAV.DE;;;;;;;;;;;;;;;;;;;;;;;;;;;;;;;;;;;;;;3;61;17;1;13;10;20
