LU0290357176;Xtrackers Eurozone Government Bond 5-7 UCITS ETF 1C;https://www.justetf.com/en/etf-profile.html?isin=LU0290357176;The Xtrackers Eurozone Government Bond 5-7 UCITS ETF 1C seeks to track the iBoxx® EUR Eurozone 5-7 index. The Markit iBoxx® EUR Eurozone 5-7 index tracks Euro denominated government bonds issued by eurozone governments. Time to maturity: 5-7 years. The ETF's TER (total expense ratio) amounts to 0.15% p.a.. The Xtrackers Eurozone Government Bond 5-7 UCITS ETF 1C is the only ETF that tracks the iBoxx® EUR Eurozone 5-7 index. The ETF replicates the performance of the underlying index by sampling technique (buying a selection of the most relevant index constituents). The interest income (coupons) in the ETF is accumulated and reinvested in the ETF. The Xtrackers Eurozone Government Bond 5-7 UCITS ETF 1C is a large ETF with 938m Euro assets under management. The ETF was launched on 30 May 2007 and is domiciled in Luxembourg.;Vládní dluhopis Xtrackers Eurozne 5-7 UCITS ETF 1C se snaží sledovat index IBOXX® EUR EUROZONE 5-7. Index Markit IBOXX® EUR EUROZONE 5-7 sleduje vládní dluhopisy vydané vládami eurozóny. Čas do zralosti: 5-7 let. TER ETF TER (celkový poměr výdajů) činí 0,15% P.A. Vládní dluhopis Eurozóny Xtrackers 5-7 UCITS ETF 1C je jediným ETF, který sleduje index Eurozone 5-7 IBOXX® EUR. ETF replikuje výkon základního indexu technikou vzorkování (nákup výběru nejdůležitějších složek indexu). Úrokové výnosy (kupóny) v ETF se nashromáždí a reinvestují do ETF. Vládní dluhopis Xtrackers Eurozne 5-7 UCITS ETF 1C je velký ETF s managementem 938 milionů euro. ETF byl spuštěn 30. května 2007 a je se sídlem v Lucemburku.;0.15%;0.15;EUR 938m;938.0;EUR;EUR;Luxembourg;Xtrackers;30 May 2007;;;Physical;UCITS;Government Bond;risk  Long-only    Sustainability  No;;EUR    Currency risk  Currency;1;Dluhopisy;False;Celosvětově;33.0;2.13;7.24;-6.1;1.85;0.18;0.13;2.7;-1.99;-14.81;7.1;2.07;65.03;3.78;5.32;5.1;0.56;0.44;-0.24;-2.86;-5.0;-17.23;-17.23;;;;;Stuttgart Stock Exchange;DBXR;4;;;;;;;2025-09-22T00:22:30.493568;success;0;DE0001102507;4.17;DE0001102564;3.89;DE0001102580;3.71;DE0001102531;3.47;;;;;;;;;;;;;France;25.41;Germany;20.06;Other;19.32;Netherlands;4.49;;;IT;16.01;;;;;;;;;gettex;EUR;X57E;;;;Stuttgart Stock Exchange;EUR;DBXR;;;;Borsa Italiana;EUR;X57E;X57E IM;X57E.MIX57ENAV=DBFT;;XETRA;EUR;X57E;X57E GYX57EIV;X57E.DEX57EINAV.SG;;;;;;;;;;;;;;;;;;;;;;;;;;;;;;;;;;;;;;4;72;22;10;15;10;15
LU0290357259;Xtrackers II Eurozone Government Bond 7-10 UCITS ETF 1C;https://www.justetf.com/en/etf-profile.html?isin=LU0290357259;The Xtrackers II Eurozone Government Bond 7-10 UCITS ETF 1C seeks to track the Markit iBoxx® EUR Eurozone 7-10 index. The Markit iBoxx® EUR Eurozone 7-10 index tracks Euro denominated government bonds issued by eurozone governments. Time to maturity: 7-10 years. The ETF's TER (total expense ratio) amounts to 0.15% p.a.. The Xtrackers II Eurozone Government Bond 7-10 UCITS ETF 1C is the only ETF that tracks the Markit iBoxx® EUR Eurozone 7-10 index. The ETF replicates the performance of the underlying index by sampling technique (buying a selection of the most relevant index constituents). The interest income (coupons) in the ETF is accumulated and reinvested in the ETF. The Xtrackers II Eurozone Government Bond 7-10 UCITS ETF 1C is a large ETF with 991m Euro assets under management. The ETF was launched on 30 May 2007 and is domiciled in Luxembourg.;Vládní dluhopis Xtrackers II Eurozne 7-10 UCITS ETF 1C se snaží sledovat index Markit IBOXX® Euro Eurozne 7-10. Index Markit IBOXX® EUR EUROZONE 7-10 sleduje vládní dluhopisy vydané vládami eurozóny. Čas do zralosti: 7-10 let. TER (celkový poměr nákladů) činí 0,15% p.a. ETF replikuje výkon základního indexu technikou vzorkování (nákup výběru nejdůležitějších složek indexu). Úrokové výnosy (kupóny) v ETF se nashromáždí a reinvestují do ETF. Vládní dluhopis Xtrackers II Eurozne 7-10 UCITS ETF 1C je velký ETF s managementem 991 milionů euro. ETF byl spuštěn 30. května 2007 a je se sídlem v Lucemburku.;0.15%;0.15;EUR 991m;991.0;EUR;EUR;Luxembourg;Xtrackers;30 May 2007;;;Physical;UCITS;Government Bond;risk  Long-only    Sustainability  No;;EUR    Currency risk  Currency;1;Dluhopisy;False;Celosvětově;30.0;0.73;5.58;-12.57;1.08;0.23;-0.22;2.67;-3.25;-20.03;9.07;1.13;74.05;4.89;7.35;7.05;0.15;0.25;-0.38;-4.46;-6.87;-23.2;-23.2;;;;;Stuttgart Stock Exchange;DBXB;4;;;;;;;2025-09-22T00:22:36.972609;success;0;;;;;;;;;;;;;;;;;;;;;Other;35.79;Germany;17.62;France;13.39;Netherlands;3.86;;;IT;15.94;;;;;;;;;gettex;EUR;X710;;;;Stuttgart Stock Exchange;EUR;DBXB;;;;Borsa Italiana;EUR;X710;X710 IM;X710.MIX710NAV=DBFT;;XETRA;EUR;X710;X710 GYX710IV;X710.DEX710INAV.SG;;;;;;;;;;;;;;;;;;;;;;;;;;;;;;;;;;;;;;4;69;22;10;15;10;12
LU0290357507;Xtrackers Eurozone Government Bond 15-30 UCITS ETF 1C;https://www.justetf.com/en/etf-profile.html?isin=LU0290357507;The Xtrackers Eurozone Government Bond 15-30 UCITS ETF 1C seeks to track the iBoxx® EUR Eurozone 15-30 index. The Markit iBoxx® EUR Eurozone 15-30 index tracks Euro denominated government bonds issued by eurozone governments. Time to maturity: 15-30 years. The ETF's TER (total expense ratio) amounts to 0.15% p.a.. The Xtrackers Eurozone Government Bond 15-30 UCITS ETF 1C is the only ETF that tracks the iBoxx® EUR Eurozone 15-30 index. The ETF replicates the performance of the underlying index by sampling technique (buying a selection of the most relevant index constituents). The interest income (coupons) in the ETF is accumulated and reinvested in the ETF. The Xtrackers Eurozone Government Bond 15-30 UCITS ETF 1C has 268m Euro assets under management. The ETF was launched on 1 June 2007 and is domiciled in Luxembourg.;Vládní dluhopis Xtrackers Eurozne 15-30 UCITS ETF 1C se snaží sledovat index Eurozóny IBOXX® EUR 15-30. Index Markit IBOXX® EUR EUROZONE 15-30 sleduje vládní dluhopisy vydané vládami eurozóny. Čas do zralosti: 15-30 let. TER ETF TER (celkový poměr nákladů) činí 0,15% P.A. Vládní dluhopis Eurozóny Xtrackers 15-30 UCITS ETF 1C je jediným ETF, který sleduje index IBOXX® EUR EUROZONE 15-30. ETF replikuje výkon základního indexu technikou vzorkování (nákup výběru nejdůležitějších složek indexu). Úrokové výnosy (kupóny) v ETF se nashromáždí a reinvestují do ETF. Vládní dluhopis Xtrackers Eurozne 15-30 UCITS ETF 1C má pod správou aktiva 268 milionů EUR. ETF byl spuštěn 1. června 2007 a je se sídlem v Lucemburku.;0.15%;0.15;EUR 268m;268.0;EUR;EUR;Luxembourg;Xtrackers;1 June 2007;;;Physical;UCITS;Government Bond;risk  Long-only    Sustainability  No;;EUR    Currency risk  Currency;1;Dluhopisy;False;Celosvětově;58.0;-5.56;-6.37;-34.12;-5.51;-0.06;-3.28;0.15;-6.9;-34.47;10.49;-0.46;84.53;9.96;13.86;13.03;-0.56;-0.16;-0.61;-11.5;-18.65;-43.39;-43.39;;;;;gettex;DBXF;4;;;;;;;2025-09-22T00:22:42.478618;success;0;DE0001102341;3.06;DE0001135481;2.95;IT0004532559;2.85;FR0011461037;2.83;DE0001102432;2.67;DE0001135366;2.62;DE0001102614;2.49;;;;;;;France;26.89;Germany;22.86;Netherlands;7.67;Other;5.87;;;IT;21.84;;;;;;;;;gettex;EUR;DBXF;;;;Stuttgart Stock Exchange;EUR;DBXF;;;;Borsa Italiana;EUR;X15E;X15E IM;X15E.MIX15ENAV=DBFT;;XETRA;EUR;DBXF;X15E GYX15EIV;X15E.DEX15EINAV.SG;;;;;;;;;;;;;;;;;;;;;;;;;;;;;;;;;;;;;;3;60;22;5;15;10;8
LU0290357846;Xtrackers Eurozone Government Bond 25+ UCITS ETF 1C;https://www.justetf.com/en/etf-profile.html?isin=LU0290357846;The Xtrackers Eurozone Government Bond 25+ UCITS ETF 1C seeks to track the iBoxx® EUR Eurozone 25+ index. The Markit iBoxx® EUR Eurozone 25+ index tracks Euro denominated government bonds issued by eurozone governments. Time to maturity: minimum 25 years. The ETF's TER (total expense ratio) amounts to 0.15% p.a.. The Xtrackers Eurozone Government Bond 25+ UCITS ETF 1C is the only ETF that tracks the iBoxx® EUR Eurozone 25+ index. The ETF replicates the performance of the underlying index by sampling technique (buying a selection of the most relevant index constituents). The interest income (coupons) in the ETF is accumulated and reinvested in the ETF. The Xtrackers Eurozone Government Bond 25+ UCITS ETF 1C has 124m Euro assets under management. The ETF was launched on 5 June 2007 and is domiciled in Luxembourg.;Vládní dluhopis Xtrackers Eurozne 25+ UCITS ETF 1C se snaží sledovat index IBOXX® EUR EUROZONE 25+. Index Markit IBOXX® EUR Eurozóna 25+ sleduje vládní dluhopisy euro denominované vlády eurozóny. Čas na zralost: Minimálně 25 let. TER ETF TER (celkový poměr nákladů) činí 0,15% P.A. Vládní dluhopis Eurozóny Xtrackers 25+ UCITS ETF 1C je jediným ETF, který sleduje index IBOXX® EUR Euroz 25+. ETF replikuje výkon základního indexu technikou vzorkování (nákup výběru nejdůležitějších složek indexu). Úrokové výnosy (kupóny) v ETF se nashromáždí a reinvestují do ETF. Vládní dluhopis Xtrackers Eurozone 25+ UCITS ETF 1C má ve spravování 124 milionů euro aktiv. ETF byl spuštěn 5. června 2007 a má bydliště v Lucemburku.;0.15%;0.15;EUR 124m;124.0;EUR;EUR;Luxembourg;Xtrackers;5 June 2007;;;Physical;UCITS;Government Bond;risk  Long-only    Sustainability  No;;EUR    Currency risk  Currency;1;Dluhopisy;False;Celosvětově;31.0;-10.13;-15.59;-46.27;-9.54;-0.26;-5.28;-2.43;-10.33;-40.78;10.46;-3.46;61.52;12.63;18.13;17.1;-0.8;-0.3;-0.68;-16.91;-26.47;-53.37;-53.37;;;;;gettex;DBXG;4;;;;;;;2025-09-22T00:22:48.518977;success;0;FR0010171975;5.49;FR0010870956;5.12;DE0001102481;5.12;FR0013480613;3.9;DE0001102572;3.74;;;;;;;;;;;France;39.59;Germany;14.21;Other;13.2;Netherlands;2.18;;;IT;17.29;;;;;;;;;gettex;EUR;DBXG;;;;Stuttgart Stock Exchange;EUR;DBXG;;;;Borsa Italiana;EUR;X25E;X25E IM;X25E.MIX25ENAV=DBFT;;XETRA;EUR;DBXG;X25E GYX25EIV;X25E.DEX25EINAV.SG;;;;;;;;;;;;;;;;;;;;;;;;;;;;;;;;;;;;;;3;60;22;5;15;10;8
LU0290357929;Xtrackers II Global Inflation-Linked Bond UCITS ETF 1C - EUR Hedged;https://www.justetf.com/en/etf-profile.html?isin=LU0290357929;The Xtrackers II Global Inflation-Linked Bond UCITS ETF 1C - EUR Hedged seeks to track the Bloomberg World Government Inflation-Linked Bond (EUR Hedged) index. The Bloomberg World Government Inflation-Linked Bond (EUR Hedged) index tracks developed world government inflation-linked bonds issued in domestic currency. All maturities are included. Rating: Investment Grade. Currency hedged to Euro (EUR). The ETF's TER (total expense ratio) amounts to 0.25% p.a.. The Xtrackers II Global Inflation-Linked Bond UCITS ETF 1C - EUR Hedged is the largest ETF that tracks the Bloomberg World Government Inflation-Linked Bond (EUR Hedged) index. The ETF replicates the performance of the underlying index by sampling technique (buying a selection of the most relevant index constituents). The interest income (coupons) in the ETF is accumulated and reinvested in the ETF. The Xtrackers II Global Inflation-Linked Bond UCITS ETF 1C - EUR Hedged has 407m Euro assets under management. The ETF was launched on 8 June 2007 and is domiciled in Luxembourg.;Globální inflační inflační Bond UCITS ETF 1C-EUR Hedged se snaží sledovat index inflaci Bloomberg World World World World Government Inflation (Hedged). Indexové indexové stopy spojené s inflací Bloomberg World Government Inflation Inflation Bond (EUR Hedged) vyvinuly světové vládní inflační dluhopisy vydané v domácí měně. Zahrnuty jsou všechna splatností. Hodnocení: Investiční třída. Měna zajišťovala euro (EUR). TER (celkový poměr výdajů) ETF činí 0,25% P.A .. Globální inflační inflaci XTrackers II Globální inflační inflaci, která je zajištěna největší ETF, který sleduje index vlády Bloomberg World World Inflation-vazbě (EUR Hedged). ETF replikuje výkon základního indexu technikou vzorkování (nákup výběru nejdůležitějších složek indexu). Úrokové výnosy (kupóny) v ETF se nashromáždí a reinvestují do ETF. Společnost Xtrackers II Global Inflation -Wond Bond UCITS ETF 1C - EUR Hedged má ve správě aktiv 407 milionů EUR. ETF byl spuštěn 8. června 2007 a má bydliště v Lucemburku.;0.25%;0.25;EUR 407m;407.0;EUR;EUR;Luxembourg;Xtrackers;8 June 2007;;;Physical;UCITS;;Bonds, World, Inflation-Linked, All maturities;;EUR    Currency risk  Currency;1;Dluhopisy;False;Celosvětově;154.0;-1.86;-2.14;-13.02;1.92;1.17;0.36;0.73;4.33;-19.04;2.01;-2.22;53.49;4.28;7.05;7.29;-0.44;-0.1;-0.38;-4.99;-8.85;-24.61;-24.61;;;;;Extracted (method 1);XGIN;0;;;;;;;2025-09-22T00:22:55.685985;success;0;;;;;;;;;;;;;;;;;;;;;United States;43.12;United Kingdom;23.35;Other;21.1;France;7.49;;;;;;;;;;;;;;;;;;;;;;;;;;;;;;;;;;;;;;;;;;;;;;;;;;;;;;;;;;;;;;;;;;;;;;;;;3;55;17;5;15;10;8
LU0290358224;Xtrackers Eurozone Inflation-Linked Bond UCITS ETF 1C;https://www.justetf.com/en/etf-profile.html?isin=LU0290358224;The Xtrackers Eurozone Inflation-Linked Bond UCITS ETF 1C seeks to track the Bloomberg Euro Government Inflation-Linked Bond index. The Bloomberg Euro Government Inflation Linked Bond index tracks eurozone government inflation-linked bonds. The ETF's TER (total expense ratio) amounts to 0.15% p.a.. The ETF replicates the performance of the underlying index by sampling technique (buying a selection of the most relevant index constituents). The interest income (coupons) in the ETF is accumulated and reinvested in the ETF. The Xtrackers Eurozone Inflation-Linked Bond UCITS ETF 1C is a large ETF with 512m Euro assets under management. The ETF was launched on 8 June 2007 and is domiciled in Luxembourg.;Inflační dluhopis UCITS ETF 1C s inflací Xtrackers se snaží sledovat index dluhopisů spojeného s inflací Bloomberg Euro. Inflace vlády Bloomberg Euro propojená index dluhopisů sleduje inflační inflaci spojené dluhopisy. TER (celkový poměr výdajů) ETF činí 0,15% p.a. ETF replikuje výkon základního indexu technikou vzorkování (nákup výběru nejdůležitějších složek indexu). Úrokové výnosy (kupóny) v ETF se nashromáždí a reinvestují do ETF. XTrackers Eurozne inflační dluhopis UCITS ETF 1C je velký ETF s 512 miliony euro. ETF byl spuštěn 8. června 2007 a má bydliště v Lucemburku.;0.15%;0.15;EUR 512m;512.0;EUR;EUR;Luxembourg;Xtrackers;8 June 2007;;;Physical;UCITS;;Bonds, EUR, Europe, Inflation-Linked, All maturities;;EUR    Currency risk  Currency;1;Dluhopisy;False;Evropa;38.0;0.44;2.72;4.48;0.43;0.02;-0.93;1.16;6.05;-9.79;5.95;-0.02;66.67;3.73;6.39;6.53;0.12;0.14;0.13;-3.02;-7.38;-15.89;-15.89;;;;;Extracted (method 1);XEIN;0;;;;;;;2025-09-22T00:23:01.428039;success;0;DE0001030559;4.7;FR0013410552;4.58;FR0000188799;4.15;IT0004545890;3.88;FR0010447367;3.81;FR0011982776;3.62;;;;;;;;;Other;100.0;France;41.37;Germany;13.4;;;;;IT;27.28;;;;;;;;;;;;;;;;;;;;;;;;;;;;;;;;;;;;;;;;;;;;;;;;;;;;;;;;;;;;;;;;;;;;;4;67;22;10;15;10;10
LU0290358497;Xtrackers II EUR Overnight Rate Swap UCITS ETF 1C;https://www.justetf.com/en/etf-profile.html?isin=LU0290358497;The Xtrackers II EUR Overnight Rate Swap UCITS ETF 1C seeks to track the Solactive €STR +8.5 Daily index. The Solactive €STR +8.5 Daily index tracks the performance of a deposit earning interest at the Euro short term rate plus 8.5 basis points adjustment. The ETF's TER (total expense ratio) amounts to 0.10% p.a.. The Xtrackers II EUR Overnight Rate Swap UCITS ETF 1C is the cheapest and largest ETF that tracks the Solactive €STR +8.5 Daily index. The ETF replicates the performance of the underlying index synthetically with a swap. The Xtrackers II EUR Overnight Rate Swap UCITS ETF 1C is a very large ETF with 17,239m Euro assets under management. The ETF was launched on 25 May 2007 and is domiciled in Luxembourg.;Sazba Xtrackers II EUR SWAP UCITS ETF 1C se snaží sledovat solaraktivní € STR +8,5 denní index. Index Solactive € STR +8,5 Denní index sleduje výkonnost výdělku v úpravě euro plus úpravy 8,5 bazických bodů. TER (celkový poměr nákladů) činí 0,10% P.A .. Xtrackers II EUR SWAP SWAP UCITS ETF 1C je nejlevnější a největší ETF, který sleduje solaraktivní index € STR +8,5 denně. ETF replikuje výkon podkladového indexu synteticky s výměnou. Sazba Xtrackers II EUR SWAP UCITS ETF 1C je velmi velká ETF s managementem 17 239 milionů euro. ETF byl spuštěn 25. května 2007 a je sídlem v Lucemburku.;0.10%;0.1;EUR 17239m;17239.0;EUR;EUR;Luxembourg;Xtrackers;25 May 2007;;;Synthetic (Unfunded swap);UCITS;;Money Market, EUR, Europe;;EUR    Currency risk  Currency;1;Akcie;False;Evropa;;2.61;9.34;8.13;1.67;0.17;0.5;1.07;-0.58;-0.03;3.27;3.79;17.66;0.11;0.15;0.16;;;9.83;0.0;-0.04;-1.11;-3.7;;;;;Stuttgart Stock Exchange;DBXT;5;;;;;;;2025-09-22T00:23:07.164305;success;0;;;;;;;;;;;;;;;;;;;;;;;;;;;;;;;;;;;;;;;;;gettex;EUR;XEON;;;;Borsa Italiana;EUR;XEON;XEON IM;XEON.MIKV8USDINAV=SOLA;;SIX Swiss Exchange;EUR;XEON;XEON SW;XEON.S;;Stuttgart Stock Exchange;EUR;DBXT;XEON GS;XEON.SG;;XETRA;EUR;XEON;XEON GY;XEON.DE;;;;;;;;;;;;;;;;;;;;;;;;;;;;;;;;5;83;26;19;15;10;13
LU0292095535;Xtrackers Euro Stoxx Quality Dividend UCITS ETF 1D 1D;https://www.justetf.com/en/etf-profile.html?isin=LU0292095535;The Xtrackers Euro Stoxx Quality Dividend UCITS ETF 1D 1D seeks to track the EURO STOXX® Quality Dividend 50 index. The EURO STOXX® Quality Dividend 50 index tracks the top 50 stocks in terms of quality (defined by a set of 3 different factors: 12-month trailing dividend yield, 12-month trailing payout ratio, and 3-year free cash flow yield growth rate) and dividend yield from the EURO STOXX® index. The ETF's TER (total expense ratio) amounts to 0.30% p.a.. The Xtrackers Euro Stoxx Quality Dividend UCITS ETF 1D 1D is the only ETF that tracks the EURO STOXX® Quality Dividend 50 index. The ETF replicates the performance of the underlying index by full replication (buying all the index constituents). The dividends in the ETF are distributed to the investors (Quarterly). The Xtrackers Euro Stoxx Quality Dividend UCITS ETF 1D 1D has 424m Euro assets under management. The ETF was launched on 1 June 2007 and is domiciled in Luxembourg.;Xtrackers Euro Stoxx Quality dividenda UCITS ETF 1D 1D se snaží sledovat index dividenday 50 Euro Stoxx®. Euro Stoxx® dividenda Quality dividenda 50 Index sleduje 50 nejlepších akcií z hlediska kvality (definovaných sadou 3 různých faktorů: 12měsíční koncové dividendaové výnosy, 12měsíční koncový výplatní poměr a míra růstu volného volného peněžního toku) a dividendaový výnos z indexu Euro Stoxx®. TER (celkový poměr nákladů) činí 0,30% P.A .. Xtrackers Euro Stoxx dividenda UCITS ETF 1D 1D je jediný ETF, který sleduje index kvality 50 Euro Stoxx®. ETF replikuje výkon podkladového indexu plnou replikací (nákup všech složek indexu). dividenday v ETF jsou distribuovány investorům (čtvrtletně). Xtrackers Euro Stoxx Quality dividenda UCITS ETF 1D 1D má 424 milionů euro aktiv. ETF byl spuštěn 1. června 2007 a je se sídlem v Lucemburku.;0.30%;0.3;EUR 424m;424.0;EUR;EUR;Luxembourg;Xtrackers;1 June 2007;;Quarterly;Physical;UCITS;;Equity, Europe, Dividend;;EUR    Currency risk  Currency;1;Akcie;False;Evropa;50.0;21.46;67.16;78.95;22.62;-3.1;3.17;4.39;19.28;-10.17;18.33;10.68;50.14;14.48;13.19;14.15;1.48;1.41;0.87;-14.95;-14.95;-23.09;-71.38;;;;;Stockholm Stock Exchange;-;6;5.08%;5.08;EUR 1.30;1.3;EUR;method2_regex;2025-09-22T00:23:13.990875;success;0;Eni SpA;4.25;Assicurazioni Generali SpA;4.14;BNP Paribas SA;4.09;LVMH Moët Hennessy Louis Vuitton SE;4.05;E.ON SE;4.03;AXA SA;4.02;Allianz SE;3.98;ENGIE SA;3.96;Mercedes-Benz Group AG;3.93;;;France;37.31;Germany;14.38;Netherlands;13.16;Other;12.83;;;Financials;32.01;Utilities;20.34;Consumer Discretionary;9.91;Energy;9.8;IT;4.05;gettex;EUR;DXSA;;;;Borsa Italiana;EUR;XD3E;XD3E IMXD3EINVG;XD3E.MIXD3EINAVGBP.DE;;London Stock Exchange;GBX;XD3E;XD3E LNXD3EINVC;XD3E.LXD3EINAVCHF.DE;;Stockholm Stock Exchange;SEK;-;XD3E SSXD3EINVS;XD3E.ST0JH3INAV.DE;;Stuttgart Stock Exchange;EUR;DXSA;XD3E GSINXD3;XD3E.SGINXD3INAV.PA;;XETRA;EUR;DXSA;XD3E GY;XD3E.DE;;;;;;;;;;;;;;;;;;;;;;;;;;3;62;12;5;15;10;20
LU0292096186;Xtrackers STOXX Global Select Dividend 100 Swap UCITS ETF 1D;https://www.justetf.com/en/etf-profile.html?isin=LU0292096186;The Xtrackers STOXX Global Select Dividend 100 Swap UCITS ETF 1D seeks to track the STOXX® Global Select Dividend 100 index. The STOXX® Global Select Dividend 100 index tracks the 100 high dividend-paying global stocks from the STOXX Global 1800 Index. The ETF's TER (total expense ratio) amounts to 0.50% p.a.. The ETF replicates the performance of the underlying index synthetically with a swap. The dividends in the ETF are distributed to the investors (Quarterly). The Xtrackers STOXX Global Select Dividend 100 Swap UCITS ETF 1D is a large ETF with 687m Euro assets under management. The ETF was launched on 1 June 2007 and is domiciled in Luxembourg.;Xtrackers Stoxx Global Select dividenda 100 Swap UCITS ETF 1D se snaží sledovat index Stoxx® Global Select dividenda 100. Index Stoxx® Global Select dividenda 100 sleduje 100 globálních akcií vyplacených dividenda z indexu Stoxx Global 1800. ETF TER (celkový poměr nákladů) činí 0,50% p.a. ETF replikuje výkon podkladového indexu synteticky s výměnou. dividenday v ETF jsou distribuovány investorům (čtvrtletně). Xtrackers Stoxx Global Select dividenda 100 Swap UCITS ETF 1D je velký ETF s managementem 687 m euro. ETF byl spuštěn 1. června 2007 a je se sídlem v Lucemburku.;0.50%;0.5;EUR 687m;687.0;EUR;EUR;Luxembourg;Xtrackers;1 June 2007;;Quarterly;Synthetic (Unfunded swap);UCITS;;Equity, World, Dividend;;EUR    Currency risk  Currency;1;Akcie;False;Celosvětově;;14.73;34.77;88.41;11.24;0.85;7.09;7.52;22.6;-1.42;5.24;14.33;141.02;11.02;10.38;11.2;1.34;1.01;1.2;-13.01;-13.01;-13.01;-64.68;;;;;Singapore Stock Exchange;-;9;4.93%;4.93;EUR 1.53;1.53;EUR;method2_regex;2025-09-22T00:23:20.969513;success;0;;;;;;;;;;;;;;;;;;;;;;;;;;;;;;;;;;;;;;;;;gettex;EUR;XGSD;;;;Borsa Italiana;EUR;XGSD;XGSD IMXGSDINVG;XGSD.MIXGSDINAVGBP.DE;;London Stock Exchange;GBX;XGSD;XGSD LNXGSDINAV;XGSD.LXGSDNAV.DE;;London Stock Exchange;USD;XGDD;XGDD LNXGSDINVC;XGDD.LXGSDINAVCHF.DE;;Singapore Stock Exchange;USD;-;XGSD SPXGSDINVU;DGSD.SIXGSDINAVUSD.DE;;SIX Swiss Exchange;CHF;XGSD;XGSD SW;XGSD.SXGSDUSDINAV=SOLA;;Stockholm Stock Exchange;SEK;-;XGSD SSXGSDINVS;XGSD.ST0JH1INAV.DE;;Stuttgart Stock Exchange;EUR;DXSB;XGSD GSINXGS;XGSD.SGINXGSINAV.PA;;XETRA;EUR;XGSD;XGSD GY;XGSD.DE;;;;;;;;4;67;12;10;15;10;20
LU0292097234;Xtrackers FTSE 100 UCITS ETF Income 1D;https://www.justetf.com/en/etf-profile.html?isin=LU0292097234;The Xtrackers FTSE 100 UCITS ETF Income 1D seeks to track the FTSE 100 index. The FTSE 100 index tracks the 100 largest UK stocks. The ETF's TER (total expense ratio) amounts to 0.09% p.a.. The ETF replicates the performance of the underlying index by full replication (buying all the index constituents). The dividends in the ETF are distributed to the investors (Quarterly). The Xtrackers FTSE 100 UCITS ETF Income 1D is a small ETF with 82m Euro assets under management. The ETF was launched on 5 June 2007 and is domiciled in Luxembourg.;XTrackers FTSE 100 UCITS ETF Income 1D se snaží sledovat index FTSE 100. Index FTSE 100 sleduje 100 největších britských akcií. TER (celkový poměr nákladů) ETF činí 0,09% p.a. ETF replikuje výkon podkladového indexu plnou replikací (nákup všech složek indexu). dividenday v ETF jsou distribuovány investorům (čtvrtletně). Xtrackers FTSE 100 UCITS ETF Income 1D je malý ETF s managementem 82 milionů EUR. ETF byl spuštěn 5. června 2007 a má bydliště v Lucemburku.;0.09%;0.09;EUR 82m;82.0;EUR;GBP;Luxembourg;Xtrackers;5 June 2007;;Quarterly;Physical;UCITS;FTSE 100  Income 1D;Equity, United Kingdom;;GBP    Currency risk  Currency;1;Akcie;False;Evropa;100.0;10.63;43.04;92.54;10.64;-0.14;3.85;4.46;26.69;-0.93;9.89;14.89;108.44;14.07;12.53;14.48;0.76;1.01;0.97;-16.91;-16.91;-16.91;-58.34;;;;;Stuttgart Stock Exchange;DBXX;4;3.28%;3.28;EUR 0.34;0.34;EUR;method2_regex;2025-09-22T00:23:27.602235;success;0;HSBC Holdings Plc;7.33;Shell Plc;7.19;Unilever Plc;4.92;Rolls-Royce Holdings;3.76;British American Tobacco plc;3.46;RELX;3.23;BP Plc;2.9;GSK Plc;2.65;BAE Systems;2.41;;;United Kingdom;91.53;Other;4.77;Switzerland;1.85;;;;;Financials;22.32;Consumer Staples;17.71;Industrials;15.89;Health Care;11.16;IT;3.46;gettex;EUR;XUKX;;;;London Stock Exchange;GBX;XUKX;XUKX LNXUKXINAV;XUKX.LXUKXNAV.DE;;Stuttgart Stock Exchange;EUR;DBXX;XUKX GSXUKXINVG;XUKX.SGXUKXINAVGBP.DE;;XETRA;EUR;XUKX;XUKX GY;XUKX.DE;;;;;;;;;;;;;;;;;;;;;;;;;;;;;;;;;;;;;;4;72;26;1;15;10;20
