IE00BG88WL21;WisdomTree Enhanced Commodity UCITS ETF CHF Hedged Acc;https://www.justetf.com/en/etf-profile.html?isin=IE00BG88WL21;The WisdomTree Enhanced Commodity UCITS ETF CHF Hedged Acc seeks to track the WisdomTree Enhanced Commodity (CHF Hedged) index. The WisdomTree Enhanced Commodity (CHF Hedged) index tracks a broad and diversified commodity exposure, covering the following sectors: energy, agriculture, industrial metals and precious metals. Currency hedged to Swiss Francs (CHF). The ETF's TER (total expense ratio) amounts to 0.70% p.a.. The ETF replicates the performance of the underlying index synthetically with a swap. The WisdomTree Enhanced Commodity UCITS ETF CHF Hedged Acc is a very small ETF with 5m Euro assets under management. The ETF was launched on 6 December 2019 and is domiciled in Ireland.;WisdomTree Enhanced Commodity UCITS ETF CHF Hedged ACC se snaží sledovat index WisdomTree Enhanced Commodity (CHF Hedged). Index WisdomTree Ensted Commodity (CHF Hedged) sleduje širokou a diverzifikovanou expozici komodity a pokrývá následující odvětví: energie, zemědělství, průmyslové kovy a drahé kovy. Měna byla zajištěna švýcarským frankům (CHF). ETF TER (celkový poměr nákladů) činí 0,70% p.a. ETF replikuje výkon podkladového indexu synteticky s výměnou. WisdomTree Enhanced Commodity UCITS ETF CHF Hedged ACC je velmi malý ETF s managementem 5m euro. ETF byl spuštěn 6. prosince 2019 a je se sídlem v Irsku.;0.70%;0.7;EUR 5m;5.0;EUR;CHF;Ireland;WisdomTree;6 December 2019;Accumulating;;Synthetic (Unfunded swap);UCITS;;Commodities, Broad market;;CHF    Currency risk  Currency;1;Komodity;False;Celosvětově;;5.34;-8.17;52.71;5.98;3.91;-1.99;2.6;29.98;15.4;-6.21;-1.81;51.2;12.84;14.16;16.11;0.42;-0.2;0.55;-7.98;-17.21;-23.98;-23.98;;;;;SIX Swiss Exchange;COMS;1;;;;;;;2025-09-24T01:26:06.671412;success;0;;;;;;;;;;;;;;;;;;;;;;;;;;;;;;;;;;;;;;;;;SIX Swiss Exchange;CHF;COMS;COMS SWCOMSEIV;COMS.SCOMSINAV.DE;;;;;;;;;;;;;;;;;;;;;;;;;;;;;;;;;;;;;;;;;;;;;;;;;;;;;;;;1;28;6;1;8;5;8
IE00BG8BCY43;JPMorgan USD Ultra-Short Income UCITS ETF USD (Acc);https://www.justetf.com/en/etf-profile.html?isin=IE00BG8BCY43;The JPMorgan USD Ultra-Short Income UCITS ETF USD (Acc) is an actively managed ETF. The JP Morgan USD Ultra-Short Income Strategy invests primarily in investment grade, US dollar denominated, short term fixed, variable and floating rate debt securities. The strategy will concentrate its investments in the banking industry and, under normal conditions, will invest more than 25 per cent of its Net Asset Value in debt securities issued by companies which are in the banking industry. The benchmark is ICE BofAML US 3-Month Treasury Bill index. The ETF's TER (total expense ratio) amounts to 0.18% p.a.. The interest income (coupons) in the ETF is accumulated and reinvested in the ETF. The JPMorgan USD Ultra-Short Income UCITS ETF USD (Acc) has 481m Euro assets under management. The ETF was launched on 3 April 2019 and is domiciled in Ireland.;Ultra krátký příjem UCITS ETF USD (ACC) JPMorgan USD je aktivně spravovaný ETF. Strategie JP Morgan USD Ultra-krátké příjmy investuje především do investiční třídy, americký dolar denominovaný, krátkodobý pevný, variabilní a plovoucí sazbu dluhových cenných papírů. Strategie soustředí své investice do bankovního průmyslu a za běžných podmínek investuje více než 25 % své čisté hodnoty aktiv do dluhových cenných papírů vydaných společnostmi, které jsou v bankovním průmyslu. Benchmarkem je Ice Bofaml US 3měsíční index pokladny. TER (celkový poměr nákladů) ETF činí 0,18% p.a. Úrokový výnosy (kupóny) v ETF se nashromáždí a reinvestují do ETF. Ultra-krátký příjem UCITS ETF USD (ACC) JPMorgan USD má pod správou aktiva 481 milionů milionů milionů milionů mil míst. ETF byl spuštěn 3. dubna 2019 a je se sídlem v Irsku.;0.18%;0.18;EUR 481m;481.0;EUR;USD;Ireland;J.P. Morgan;3 April 2019;Accumulating;;Physical;UCITS;;risk  Actively managed    Sustainability  No;;USD    Currency risk  Currency;Actively managed    Sustainability  No;Akcie;True;Celosvětově;403.0;-0.54;-2.27;16.47;-8.37;-0.94;-0.74;-5.61;8.45;7.32;1.4;12.28;16.43;8.41;8.0;7.56;-0.06;-0.1;0.41;-11.5;-12.18;-12.18;-12.18;;;;;Frankfurt Stock Exchange;-;7;;;;;;;2025-09-24T01:26:14.252602;success;0;US00084DBA72;1.08;US29449WAU18;1.03;US20259YES63;1.0;US12636CXF21;0.98;US26821LW430;0.95;US808513BR53;0.91;US166754AP65;0.88;US64953BBU17;0.87;US95040QAC87;0.86;;;Other;67.74;United States;24.55;Canada;2.77;Australia;2.48;United Kingdom;2.46;IT;24.55;;;;;;;;;gettex;EUR;JPPA;;;;Borsa Italiana;EUR;JPSA;JPSA IMJPSAEUIV;JPSA.MIJPSAEUiv.P;;Frankfurt Stock Exchange;EUR;-;JPSAEUIV;JPSAEUiv.P;;London Stock Exchange;USD;JPSA;JPSA LNJPSAUSIV;JPSA.LJPSAUSiv.P;;London Stock Exchange;GBP;JPAS;JPAS LNJPASGBIV;JPAS.LJPASGBiv.P;;SIX Swiss Exchange;USD;JPSA;JPSA SWJPSAUSIV;JPSA.SJPSAUSiv.P;;XETRA;EUR;JPPA;JPPA GYJPSAEUIV;JPPA.DEJPSAEUiv.P;;;;;;;;;;;;;;;;;;;;2;43;17;5;8;5;8
IE00BGBN6P67;Invesco CoinShares Global Blockchain UCITS ETF Acc;https://www.justetf.com/en/etf-profile.html?isin=IE00BGBN6P67;The Invesco CoinShares Global Blockchain UCITS ETF Acc seeks to track the CoinShares Blockchain Global Equity index. The CoinShares Blockchain Global Equity index tracks global companies from developed and emerging countries that are or will be part of the blockchain eco system. The ETF's TER (total expense ratio) amounts to 0.65% p.a.. The Invesco CoinShares Global Blockchain UCITS ETF Acc is the only ETF that tracks the CoinShares Blockchain Global Equity index. The ETF replicates the performance of the underlying index by sampling technique (buying a selection of the most relevant index constituents). The dividends in the ETF are accumulated and reinvested in the ETF. The Invesco CoinShares Global Blockchain UCITS ETF Acc is a large ETF with 793m Euro assets under management. The ETF was launched on 11 March 2019 and is domiciled in Ireland.;Invesco Coinshares Global Blockchain UCITS ETF ACC se snaží sledovat index Global Equity Index Coinshares Blockchain. Coinshares Blockchain Global Equity Index sleduje globální společnosti z rozvinutých a rozvíjejících se zemí, které jsou nebo budou součástí ekologického systému blockchain. TER (celkový poměr nákladů) ETF činí 0,65% p.a. ETF replikuje výkon základního indexu technikou vzorkování (nákup výběru nejdůležitějších složek indexu). dividenday v ETF jsou akumulovány a reinvestovány do ETF. Invesco Coinshares Global Blockchain UCITS ETF ACC je velký ETF s řízením 793 milionů euro. ETF byl spuštěn 11. března 2019 a je se sídlem v Irsku.;0.65%;0.65;EUR 793m;793.0;EUR;USD;Ireland;Invesco;11 March 2019;Accumulating;;Physical;UCITS;;Equity, World, Technology;;USD    Currency risk  Currency;1;Akcie;False;Celosvětově;47.0;75.39;126.19;147.94;38.46;12.37;25.3;53.46;35.55;-48.37;51.16;29.45;287.86;37.27;32.51;31.62;2.02;0.96;0.63;-36.92;-36.92;-57.12;-57.12;;;;;London Stock Exchange;-;8;;;;;;;2025-09-24T01:26:19.186862;success;0;Galaxy Digital Inc;6.6;Coinbase Global;5.57;IREN;4.53;Core Scientific;4.38;Robinhood Markets;4.01;Taiwan Semiconductor Manufacturing Co., Ltd.;3.92;SBI Holdings, Inc.;3.85;Riot Platforms, Inc.;3.3;Strategy;3.27;;;United States;42.05;Other;26.25;Japan;21.67;Australia;4.53;;;Technology;40.89;Financials;25.4;Consumer Discretionary;11.31;;;;;London Stock Exchange;GBX;BCHS;;;;gettex;EUR;BNXG;;;;Borsa Italiana;EUR;BCHN;BCHN IMBCHNINE;INBCHN.MI0XUWINAV.DE;;London Stock Exchange;USD;BCHN;BCHN LNBCHNIN;INBCHN.L0XUXINAV.DE;;London Stock Exchange;GBP;-;BCHS LNBCHNINS;BCHS.L0XUYINAV.DE;;SIX Swiss Exchange;USD;BCHE;BCHE SWBCHNINE;BCHE.S0XUWINAV.DE;;SIX Swiss Exchange;CHF;BCHE;BNXS SWBNXSINC;BNXS.SLZMZINAV.DE;;XETRA;EUR;BNXG;BNXG GYBCHNINE;BNXG.DE0XUWINAV.DE;;;;;;;;;;;;;;3;54;6;10;8;10;20
IE00BGCSB447;iShares USD Ultrashort Bond UCITS ETF USD (Acc);https://www.justetf.com/en/etf-profile.html?isin=IE00BGCSB447;The iShares USD Ultrashort Bond UCITS ETF USD (Acc) seeks to track the iBoxx® USD Liquid Investment Grade Ultrashort index. The iBoxx® USD Liquid Investment Grade Ultrashort index tracks US dollar denominated short maturity corporate bonds. Rating: Investment Grade. Time to maturity: 0-1 years (fixed rate) 0-3 years (floating rate). The ETF's TER (total expense ratio) amounts to 0.09% p.a.. The iShares USD Ultrashort Bond UCITS ETF USD (Acc) is the cheapest and largest ETF that tracks the iBoxx® USD Liquid Investment Grade Ultrashort index. The ETF replicates the performance of the underlying index by sampling technique (buying a selection of the most relevant index constituents). The interest income (coupons) in the ETF is accumulated and reinvested in the ETF. The iShares USD Ultrashort Bond UCITS ETF USD (Acc) is a very large ETF with 1,358m Euro assets under management. The ETF was launched on 3 July 2018 and is domiciled in Ireland.;IShares USD Ultrashort Bond UCITS ETF USD (ACC) se snaží sledovat index IBOXX® USD Liquid Investment investiční stupeň Ultrashort. Index INDEX INVESTICT INVESTICT INVESTICT INVESTICT INDUSTICTU INDESTICE SLEDUJE US DOLLAR ODDĚLENÉ KRÁTKÉ KOMPITY SLOUTY. Hodnocení: Investiční třída. Čas do splatnosti: 0-1 let (pevná sazba) 0-3 roky (plovoucí sazba). TER (celkový poměr výdajů) činí 0,09% P.A .. ISShares USD Ultrashort Bond UCITS ETF USD (ACC) je nejlevnější a největší ETF, který sleduje index IBOXX® USD Liquid Investment Ultrashort Index. ETF replikuje výkon základního indexu technikou vzorkování (nákup výběru nejdůležitějších složek indexu). Úrokové výnosy (kupóny) v ETF se nashromáždí a reinvestují do ETF. IShares USD Ultrashort Bond UCITS ETF USD (ACC) je velmi velký ETF s 1 358 miliony EUR. ETF byl spuštěn 3. července 2018 a má bydliště v Irsku.;0.09%;0.09;EUR 1358m;1358.0;EUR;USD;Ireland;iShares;3 July 2018;Accumulating;;Physical;UCITS;;risk  Long-only    Sustainability  No;;USD    Currency risk  Currency;1;Dluhopisy;True;Celosvětově;765.0;-0.57;-2.05;16.89;-8.68;-1.13;-0.94;-5.9;8.35;7.71;1.79;12.5;22.61;8.48;8.04;7.69;-0.07;-0.09;0.41;-11.58;-11.58;-11.58;-11.58;;;;;Bolsa Mexicana de Valores;-;3;;;;;;;2025-09-24T01:26:26.357775;success;0;;;;;;;;;;;;;;;;;;;;;United States;59.85;Other;28.3;Canada;5.13;United Kingdom;3.51;Japan;3.21;;;;;;;;;;;gettex;EUR;OM3G;;;;Bolsa Mexicana de Valores;MXN;-;ERNAN MM;ERNAN.MX;;London Stock Exchange;USD;ERNA;ERNA LNINAVERNU;ERNA.L0X35INAV.DE;;;;;;;;;;;;;;;;;;;;;;;;;;;;;;;;;;;;;;;;;;;;4;68;26;13;11;10;8
IE00BGDPWV87;iShares Asia Property Yield UCITS ETF USD (Acc);https://www.justetf.com/en/etf-profile.html?isin=IE00BGDPWV87;The iShares Asia Property Yield UCITS ETF USD (Acc) seeks to track the FTSE EPRA/NAREIT Developed Asia Dividend+ index. The FTSE EPRA/NAREIT Developed Asia Dividend+ index tracks listed real estate companies and Real Estate Investment Trusts (REITS) from developed Asian countries, which have a one-year forecast dividend yield of 2% or greater. The ETF's TER (total expense ratio) amounts to 0.59% p.a.. The iShares Asia Property Yield UCITS ETF USD (Acc) is the cheapest ETF that tracks the FTSE EPRA/NAREIT Developed Asia Dividend+ index. The ETF replicates the performance of the underlying index by full replication (buying all the index constituents). The dividends in the ETF are accumulated and reinvested in the ETF. The iShares Asia Property Yield UCITS ETF USD (Acc) is a small ETF with 81m Euro assets under management. The ETF was launched on 12 December 2018 and is domiciled in Ireland.;Výnos nemovitosti IShares Asia UCITS ETF USD (ACC) se snaží sledovat index dividenday Asia dividenda+ Asia EPRA/Nareit. FTSE EPRA/Nareit vyvinula Asia dividenda+ Indexové stopy uvedené realitní společnosti a důvěry investic do nemovitostí (REIT) z rozvinutých asijských zemí, které mají jednoletý výnos dividenda ve výši 2% nebo vyšší. TER (celkový poměr nákladů) ETF činí 0,59% p.a .. Výnos vlastnosti IShares Asia UCITS ETF USD (ACC) je nejlevnější ETF, který sleduje index FTSE Epra/Nareit vyvinutý asijskou dividendaou+ index. ETF replikuje výkon podkladového indexu plnou replikací (nákup všech složek indexu). dividenday v ETF jsou akumulovány a reinvestovány do ETF. Výnos nemovitosti IShares Asia UCITS ETF USD (ACC) je malý ETF s managementem 81 milionů euro. ETF byla spuštěna 12. prosince 2018 a je bydliště v Irsku.;0.59%;0.59;EUR 81m;81.0;EUR;USD;Ireland;iShares;12 December 2018;Accumulating;;Physical;UCITS;;Real Estate, Asia Pacific;;USD    Currency risk  Currency;1;Nemovitosti;False;Asie a Pacifik;126.0;6.36;-3.31;16.42;13.59;-0.85;7.59;9.86;13.13;-7.13;-5.48;-4.41;4.46;12.37;12.92;12.43;0.51;-0.09;0.25;-12.33;-19.01;-22.68;-39.33;;;;;gettex;AYEP;3;;;;;;;2025-09-24T01:26:32.808618;success;0;Sun Hung Kai Properties Ltd.;5.32;Link Real Estate Invt;4.63;Scentre Group;4.03;CapitaLand Integrated Commercial Trust;3.09;Stockland;2.68;CapitaLand Ascendas REIT;2.45;Nippon Building Fund;2.29;GPT Group;2.02;Hongkong Land Holdings;2.0;;;Japan;40.7;Australia;20.42;Other;6.83;;;;;IT;2.45;;;;;;;;;gettex;EUR;AYEP;;;;Stuttgart Stock Exchange;EUR;AYEP;;;;XETRA;EUR;AYEP;AYEP GYINAVAYEE;AYEPG.DEEQB2INAV.DE;;;;;;;;;;;;;;;;;;;;;;;;;;;;;;;;;;;;;;;;;;;;1;33;6;1;8;10;8
IE00BGDPWW94;iShares MSCI Europe SRI UCITS ETF EUR (Dist);https://www.justetf.com/en/etf-profile.html?isin=IE00BGDPWW94;The iShares MSCI Europe SRI UCITS ETF EUR (Dist) seeks to track the MSCI Europe SRI Select Reduced Fossil Fuels index. The MSCI Europe SRI Select Reduced Fossil Fuels index tracks companies from Europe. Only companies with very high Environmental, Social and Governance (ESG) ratings, relative to their sector peers, are included, while avoiding companies incompatible with values screen or having exposure to fossil fuels through extraction and production activities, power generation activities or reserves ownership. The weight of each company is capped to 5%. The ETF's TER (total expense ratio) amounts to 0.20% p.a.. The iShares MSCI Europe SRI UCITS ETF EUR (Dist) is the cheapest ETF that tracks the MSCI Europe SRI Select Reduced Fossil Fuels index. The ETF replicates the performance of the underlying index by full replication (buying all the index constituents). The dividends in the ETF are distributed to the investors (Quarterly). The iShares MSCI Europe SRI UCITS ETF EUR (Dist) has 249m Euro assets under management. The ETF was launched on 6 December 2018 and is domiciled in Ireland.;Ishares MSCI Europe Sri UCITS ETF EUR (dist) se snaží sledovat MSCI Europe Sri Select Reduction Fossil Fuels Index. MSCI Europe SRI vybrala redukované indexové společnosti Fossil Fuels sleduje společnosti z Evropy. Zahrnuty jsou pouze společnosti s velmi vysokým hodnocením environmentálního, sociálního a správy (ESG) ve vztahu k jejich vrstevníkům sektoru, přičemž se vyhýbají společnosti nekompatibilním s obrazovkou hodnot nebo vystavení fosilním palivům prostřednictvím extrakčních a výrobních činností, činností výroby energie nebo si vyhrazují vlastnictví. Hmotnost každé společnosti je omezena na 5%. TER (celkový poměr výdajů) ETF činí 0,20% p.a. Ishares MSCI Europe Sri UCITS ETF EUR (DIST) je nejlevnější ETF, který sleduje MSCI Europe SRI Select Reduction Fossil Fuels Index. ETF replikuje výkon podkladového indexu plnou replikací (nákup všech složek indexu). dividenday v ETF jsou distribuovány investorům (čtvrtletně). Ishares MSCI Europe Sri UCITS ETF EUR (DIST) má ve spravování aktiva 249 milionů EUR. ETF byl spuštěn 6. prosince 2018 a je se sídlem v Irsku.;0.20%;0.2;EUR 249m;249.0;EUR;EUR;Ireland;iShares;6 December 2018;Distributing;Quarterly;Physical;UCITS;MSCI Europe;Equity, Europe, Social/Environmental;Yes;EUR    Currency risk  Currency;1;Akcie;False;Evropa;118.0;-2.73;31.71;47.91;0.87;-1.12;-0.99;-2.12;26.7;-15.54;17.22;5.2;75.88;13.84;12.88;14.18;-0.2;0.75;0.57;-15.61;-15.79;-23.41;-33.07;;;;;gettex;36B3;4;2.31%;2.31;EUR 0.17;0.17;EUR;method2_regex;2025-09-24T01:26:40.200997;success;0;Schneider Electric SE;4.4;L'Oréal SA;3.7;ABB Ltd.;3.59;Zurich Insurance Group AG;3.45;Novo Nordisk A/S;3.44;RELX;3.33;Münchener Rückversicherungs-Gesellschaft AG;3.04;AXA SA;2.98;Hermès International SCA;2.47;;;Other;36.89;Switzerland;19.36;France;17.91;Netherlands;13.53;United Kingdom;12.31;Financials;23.0;IT;19.36;Industrials;18.91;Consumer Staples;10.77;Technology;9.52;gettex;EUR;36B3;;;;Stuttgart Stock Exchange;EUR;36B3;;;;Euronext Amsterdam;EUR;ISED;ISED NAIISED;ISED.ASIISEDINAV.PA;;XETRA;EUR;36B3;36B3 GYINAVISEE;36B3.DE0XRLEUR=INAV;;;;;;;;;;;;;;;;;;;;;;;;;;;;;;;;;;;;;;3;60;17;5;8;10;20
IE00BGDQ0L74;iShares European Property Yield UCITS ETF EUR (Acc);https://www.justetf.com/en/etf-profile.html?isin=IE00BGDQ0L74;The iShares European Property Yield UCITS ETF EUR (Acc) seeks to track the FTSE EPRA/NAREIT Developed Europe index. The FTSE EPRA/NAREIT Developed Europe index tracks European listed equity REITS and property companies and offers a diverse representation of the real estate market in developed countries in Europe by both geography and property type. The ETF's TER (total expense ratio) amounts to 0.40% p.a.. The ETF replicates the performance of the underlying index by full replication (buying all the index constituents). The dividends in the ETF are accumulated and reinvested in the ETF. The iShares European Property Yield UCITS ETF EUR (Acc) has 415m Euro assets under management. The ETF was launched on 12 December 2018 and is domiciled in Ireland.;Evropský majetek IShares UCITS ETF EUR (ACC) se snaží sledovat index Evropy FTSE EPRA/Nareit. FTSE EPRA/Nareit vyvinul index Evropy, který sleduje evropské společnosti Equity Reits and Property Companies a nabízí rozmanité zastoupení trhu s nemovitostmi v rozvinutých zemích v Evropě podle geografie i majetku. TER (celkový poměr nákladů) ETF činí 0,40% p.a. ETF replikuje výkon podkladového indexu plnou replikací (nákup všech složek indexu). dividenday v ETF jsou akumulovány a reinvestovány do ETF. Evropský majetek IShares UCITS ETF EUR (ACC) má ve spravování 415 milionů euro aktiv. ETF byla spuštěna 12. prosince 2018 a je bydliště v Irsku.;0.40%;0.4;EUR 415m;415.0;EUR;EUR;Ireland;iShares;12 December 2018;Accumulating;;Physical;UCITS;;Real Estate, Europe;;EUR    Currency risk  Currency;1;Nemovitosti;False;Evropa;51.0;-2.49;29.2;-5.44;6.35;-5.06;-4.67;7.57;8.14;-37.63;18.23;0.0;-7.13;16.79;22.05;21.27;-0.15;0.4;-0.05;-17.24;-25.0;-49.46;-50.31;;;;;gettex;IPRE;3;;;;;;;2025-09-24T01:26:46.005457;success;0;Swiss Prime Site;7.77;Unibail-Rodamco-Westfield;6.76;Klépierre SA;5.76;PSP Swiss Property;5.62;LEG Immobilien;4.3;MERLIN Properties SOCIMI SA;3.79;Gecina SA;3.65;Castellum AB;3.3;Warehouses De Pauw;3.06;;;Other;24.86;Germany;22.61;France;21.98;Switzerland;17.88;;;;;;;;;;;;;gettex;EUR;IPRE;;;;Stuttgart Stock Exchange;EUR;IPRE;;;;XETRA;EUR;IPRE;IPRE GYINAVIPRE;IPRE.DEEQB7INAV.DE;;;;;;;;;;;;;;;;;;;;;;;;;;;;;;;;;;;;;;;;;;;;3;54;12;5;8;10;19
IE00BGDQ0T50;iShares MSCI EM SRI UCITS ETF USD (Dist);https://www.justetf.com/en/etf-profile.html?isin=IE00BGDQ0T50;The iShares MSCI EM SRI UCITS ETF USD (Dist) seeks to track the MSCI Emerging Markets SRI Select Reduced Fossil Fuels index. The MSCI Emerging Markets SRI Select Reduced Fossil Fuels index tracks companies from emerging markets. Only companies with very high Environmental, Social and Governance (ESG) ratings, relative to their sector peers, are included, while avoiding companies incompatible with values screen or having exposure to fossil fuels through extraction and production activities, power generation activities or reserves ownership. The weight of each company is capped to 5%. The ETF's TER (total expense ratio) amounts to 0.25% p.a.. The iShares MSCI EM SRI UCITS ETF USD (Dist) is the cheapest ETF that tracks the MSCI Emerging Markets SRI Select Reduced Fossil Fuels index. The ETF replicates the performance of the underlying index by full replication (buying all the index constituents). The dividends in the ETF are distributed to the investors (Semi annually). The iShares MSCI EM SRI UCITS ETF USD (Dist) has 326m Euro assets under management. The ETF was launched on 6 December 2018 and is domiciled in Ireland.;IShares MSCI EM SRI UCITS ETF USD (dist) se snaží sledovat rozvíjející se trhy MSCI SRI Vybrat redukovaný index fosilních paliv. Rozvíjející se trhy MSCI SRI vybírají snížené indexové indexové fosilní palivy, které sleduje společnosti z rozvíjejících se trhů. Zahrnuty jsou pouze společnosti s velmi vysokým hodnocením environmentálního, sociálního a správy (ESG) ve vztahu k jejich vrstevníkům sektoru, přičemž se vyhýbají společnosti nekompatibilním s obrazovkou hodnot nebo vystavení fosilním palivům prostřednictvím extrakčních a výrobních činností, činností výroby energie nebo si vyhrazují vlastnictví. Hmotnost každé společnosti je omezena na 5%. TER (celkový poměr nákladů) činí 0,25% p.a. ETF replikuje výkon podkladového indexu plnou replikací (nákup všech složek indexu). dividenday v ETF jsou distribuovány investorům (polo každoročně). Ishares MSCI EM Sri UCITS ETF USD (dist) má 326 milionů euro. ETF byl spuštěn 6. prosince 2018 a je se sídlem v Irsku.;0.25%;0.25;EUR 326m;326.0;EUR;USD;Ireland;iShares;6 December 2018;Distributing;Semi annually;Physical;UCITS;MSCI EM SRI  USD;Equity, Emerging Markets, Social/Environmental;Yes;USD    Currency risk  Currency;1;Akcie;False;Rozvíjející se trhy;220.0;12.95;16.45;37.75;9.73;3.29;9.0;12.01;7.11;-12.55;-1.65;12.17;43.86;15.75;14.33;15.31;0.82;0.36;0.43;-19.38;-19.38;-24.52;-36.25;;;;;gettex;36B5;3;2.20%;2.2;EUR 0.12;0.12;EUR;method2_regex;2025-09-24T01:26:51.645292;success;0;Infosys Ltd.;3.25;Delta Electronics, Inc.;2.77;Meituan;2.73;Bharti Airtel Ltd.;2.68;NetEase, Inc.;2.17;BYD Co., Ltd.;1.92;Naspers Ltd.;1.82;KB Financial Group, Inc.;1.42;Mahindra & Mahindra Ltd.;1.21;;;Other;31.67;China;18.01;;;;;;;Financials;25.5;Technology;24.51;Consumer Discretionary;11.26;IT;2.73;;;gettex;EUR;36B5;;;;Euronext Amsterdam;USD;SEMD;SEMD NAISEMD;SEMD.ASISEMDINAV.PA;;XETRA;EUR;36B5;36B5 GYINAVSEME;36B5.DE0XRAEUR=INAV;;;;;;;;;;;;;;;;;;;;;;;;;;;;;;;;;;;;;;;;;;;;3;59;17;5;8;10;19
IE00BGDQ0V72;iShares MSCI Japan SRI UCITS ETF USD (Dist);https://www.justetf.com/en/etf-profile.html?isin=IE00BGDQ0V72;The iShares MSCI Japan SRI UCITS ETF USD (Dist) seeks to track the MSCI Japan SRI Select Reduced Fossil Fuels index. The MSCI Japan SRI Select Reduced Fossil Fuels index tracks Japanese stocks considering only companies with very high Environmental, Social and Governance (ESG) ratings relative to their sector peers, to ensure the inclusion of the best of class companies from an ESG perspective and avoiding companies incompatible with values screen or having exposure to fossil fuels through extraction and production activities, power generation activities or reserves ownership. The weight of each company is capped to 5%. The ETF's TER (total expense ratio) amounts to 0.20% p.a.. The iShares MSCI Japan SRI UCITS ETF USD (Dist) is the cheapest ETF that tracks the MSCI Japan SRI Select Reduced Fossil Fuels index. The ETF replicates the performance of the underlying index by full replication (buying all the index constituents). The dividends in the ETF are distributed to the investors (Annually). The iShares MSCI Japan SRI UCITS ETF USD (Dist) is a small ETF with 92m Euro assets under management. The ETF was launched on 6 December 2018 and is domiciled in Ireland.;Ishares MSCI Japan Sri UCITS ETF USD (dist) se snaží sledovat MSCI Japan Sri Select Reduction Fossil Fuels Index. MSCI Japan SRI vybere redukované index fosilních paliv sleduje japonské akcie s ohledem na pouze společnosti s velmi vysokou environmentální, sociální a správní hodnotou (ESG) hodnocení ve srovnání s jejich vrstevníky sektoru, aby zajistily zahrnutí nejlepších ze třídních společností z perspektivy ESG a vyhýbaly se společnostem nekompatibilním s obrazovkou hodnot nebo se vystavily prostřednictvím extrakcí a výrobních činností nebo složením vlastnictví nebo rezervace. Hmotnost každé společnosti je omezena na 5%. TER (celkový poměr nákladů) činí 0,20% p.a. Ishares MSCI Japan Sri UCITS ETF USD (dist) je nejlevnější ETF, který sleduje MSCI Japan SRI vybraný snížený index fosilních paliv. ETF replikuje výkon podkladového indexu plnou replikací (nákup všech složek indexu). dividenday v ETF jsou distribuovány investorům (každoročně). Ishares MSCI Japan Sri UCITS ETF USD (dist) je malá ETF s spravováním 92 milionů euro. ETF byl spuštěn 6. prosince 2018 a je se sídlem v Irsku.;0.20%;0.2;EUR 92m;92.0;EUR;USD;Ireland;iShares;6 December 2018;Distributing;Annually;Physical;UCITS;MSCI Japan SRI  USD;Equity, Japan, Social/Environmental;Yes;USD    Currency risk  Currency;1;Akcie;False;Celosvětově;39.0;3.77;20.7;32.15;0.85;-1.91;5.62;-0.89;9.86;-13.25;9.12;10.58;46.15;22.58;20.82;19.42;0.17;0.31;0.3;-18.17;-18.17;-22.1;-26.18;;;;;gettex;36B4;3;1.52%;1.52;EUR 0.09;0.09;EUR;method2_regex;2025-09-24T01:26:58.189181;success;0;Sony Group Corp.;6.94;Sumitomo Mitsui Financial Group, Inc.;5.92;Recruit Holdings Co., Ltd.;5.54;Tokyo Electron Ltd.;5.48;Tokio Marine Holdings, Inc.;5.09;KDDI Corp.;4.32;FANUC Corp.;4.27;HOYA Corp.;3.86;Daiichi Sankyo Co., Ltd.;3.73;;;Japan;99.62;;;;;;;;;Industrials;23.59;Consumer Discretionary;15.58;Financials;15.09;Technology;14.91;IT;7.56;gettex;EUR;36B4;;;;Euronext Amsterdam;USD;SUJD;SUJD NAISUJD;SUJD.ASISUJDINAV.PA;;XETRA;EUR;36B4;36B4 GYINAVSUJE;36B4.DE0XRFEUR=INAV;;;;;;;;;;;;;;;;;;;;;;;;;;;;;;;;;;;;;;;;;;;;3;55;17;1;8;10;19
