isin;name;url;description_en;description_cs;ter;ter_numeric;fund_size;fund_size_numeric;fund_size_currency;fund_currency;fund_domicile;fund_provider;inception_date;distribution_policy;distribution_frequency;replication;legal_structure;index_name;investment_focus;sustainability;currency_risk;strategy_risk;category;is_leveraged;region;total_holdings;return_1y;return_3y;return_5y;return_ytd;return_1m;return_3m;return_6m;return_2021;return_2022;return_2023;return_2024;return_inception;volatility_1y;volatility_3y;volatility_5y;return_per_risk_1y;return_per_risk_3y;return_per_risk_5y;max_drawdown_1y;max_drawdown_3y;max_drawdown_5y;max_drawdown_inception;beta;correlation;tracking_error;information_ratio;primary_exchange;primary_ticker;total_exchanges;current_dividend_yield;current_dividend_yield_numeric;dividends_12m;dividends_12m_numeric;dividends_12m_currency;dividend_extraction_method;scraping_date;scraping_status;retry_count;holding_1_name;holding_1_weight;holding_2_name;holding_2_weight;holding_3_name;holding_3_weight;holding_4_name;holding_4_weight;holding_5_name;holding_5_weight;holding_6_name;holding_6_weight;holding_7_name;holding_7_weight;holding_8_name;holding_8_weight;holding_9_name;holding_9_weight;holding_10_name;holding_10_weight;country_1_name;country_1_weight;country_2_name;country_2_weight;country_3_name;country_3_weight;country_4_name;country_4_weight;country_5_name;country_5_weight;sector_1_name;sector_1_weight;sector_2_name;sector_2_weight;sector_3_name;sector_3_weight;sector_4_name;sector_4_weight;sector_5_name;sector_5_weight;exchange_1_name;exchange_1_currency;exchange_1_ticker;exchange_1_bloomberg;exchange_1_reuters;exchange_1_market_maker;exchange_2_name;exchange_2_currency;exchange_2_ticker;exchange_2_bloomberg;exchange_2_reuters;exchange_2_market_maker;exchange_3_name;exchange_3_currency;exchange_3_ticker;exchange_3_bloomberg;exchange_3_reuters;exchange_3_market_maker;exchange_4_name;exchange_4_currency;exchange_4_ticker;exchange_4_bloomberg;exchange_4_reuters;exchange_4_market_maker;exchange_5_name;exchange_5_currency;exchange_5_ticker;exchange_5_bloomberg;exchange_5_reuters;exchange_5_market_maker;exchange_6_name;exchange_6_currency;exchange_6_ticker;exchange_6_bloomberg;exchange_6_reuters;exchange_6_market_maker;exchange_7_name;exchange_7_currency;exchange_7_ticker;exchange_7_bloomberg;exchange_7_reuters;exchange_7_market_maker;exchange_8_name;exchange_8_currency;exchange_8_ticker;exchange_8_bloomberg;exchange_8_reuters;exchange_8_market_maker;exchange_9_name;exchange_9_currency;exchange_9_ticker;exchange_9_bloomberg;exchange_9_reuters;exchange_9_market_maker;exchange_10_name;exchange_10_currency;exchange_10_ticker;exchange_10_bloomberg;exchange_10_reuters;exchange_10_market_maker;rating;rating_score;rating_ter_score;rating_size_score;rating_track_record_score;rating_provider_score;rating_performance_score
IE00BG13YZ23;iShares STOXX USA Equity Multifactor UCITS ETF USD (Dist);https://www.justetf.com/en/etf-profile.html?isin=IE00BG13YZ23;The iShares STOXX USA Equity Multifactor UCITS ETF USD (Dist) seeks to track the STOXX US Equity Factor Screened index. The STOXX US Equity Factor Screened index tracks stocks on the US market. The title selection and weighting is based on 4 style factors: Value, Momentum, Quality and Small Size. The ETF's TER (total expense ratio) amounts to 0.20% p.a.. The iShares STOXX USA Equity Multifactor UCITS ETF USD (Dist) is the cheapest ETF that tracks the STOXX US Equity Factor Screened index. The ETF replicates the performance of the underlying index by sampling technique (buying a selection of the most relevant index constituents). The dividends in the ETF are distributed to the investors (Semi annually). The iShares STOXX USA Equity Multifactor UCITS ETF USD (Dist) is a very small ETF with 2m Euro assets under management. The ETF was launched on 21 February 2018 and is domiciled in Ireland.;Ishares Stoxx USA Equity MultifActor UCITS ETF USD (DIST) se snaží sledovat index Stoxx US Equity Screening. Stoxx americký akciový faktor prověřil indexové akciíy na americkém trhu. Výběr a vážení titulu je založen na 4 faktorech ve stylu: hodnota, hybnost, kvalita a malá velikost. TER (celkový poměr výdajů) ETF činí 0,20% p.a. Ishares Stoxx USA Equity Multifactor UCITS ETF USD (DIST) je nejlevnější ETF, který sleduje index Stoxx US Equity Faktor Screened. ETF replikuje výkon základního indexu technikou vzorkování (nákup výběru nejdůležitějších složek indexu). dividenday v ETF jsou distribuovány investorům (polo každoročně). Ishares Stoxx USA Equity MultifActor UCITS ETF USD (DIST) je velmi malý ETF s managementem 2m euro. ETF byl spuštěn 21. února 2018 a je sídlem v Irsku.;0.20%;0.2;EUR 2m;2.0;EUR;USD;Ireland;iShares;21 February 2018;Distributing;Semi annually;Physical;UCITS;;Equity, United States, Multi-Factor Strategy;Yes;USD    Currency risk  Currency;1;Akcie;False;Severní Amerika;346.0;12.14;44.8;98.9;1.87;2.08;10.19;8.61;34.95;-10.91;13.02;29.78;121.25;19.48;17.43;17.75;0.62;0.75;0.83;-22.11;-22.11;-22.11;-35.62;;;;;gettex;IQQ3;2;0.92%;0.92;EUR 0.08;0.08;EUR;method2_regex;2025-09-24T01:24:13.774283;success;0;Microsoft;7.63;Apple;5.11;Broadcom;4.06;Alphabet, Inc. C;3.52;The Bank of New York Mellon Corp.;2.31;JPMorgan Chase & Co.;2.14;Amazon.com, Inc.;2.03;Arista Networks;1.96;Meta Platforms;1.71;;;United States;89.2;Other;7.88;;;;;;;Technology;37.79;Financials;11.98;Consumer Discretionary;11.31;;;;;gettex;EUR;IQQ3;;;;London Stock Exchange;USD;UFSD;UFSD LNINAVUFSU;UFSD.L0Q7YINAV.DE;;;;;;;;;;;;;;;;;;;;;;;;;;;;;;;;;;;;;;;;;;;;;;;;;;3;59;17;1;11;10;20
IE00BG143G97;Vanguard Germany All Cap UCITS ETF Distributing;https://www.justetf.com/en/etf-profile.html?isin=IE00BG143G97;The Vanguard Germany All Cap UCITS ETF Distributing seeks to track the FTSE Germany All Cap index. The FTSE Germany All Cap index tracks large, mid and small cap securities from Germany. The ETF's TER (total expense ratio) amounts to 0.10% p.a.. The Vanguard Germany All Cap UCITS ETF Distributing is the only ETF that tracks the FTSE Germany All Cap index. The ETF replicates the performance of the underlying index by full replication (buying all the index constituents). The dividends in the ETF are distributed to the investors (Quarterly). The Vanguard Germany All Cap UCITS ETF Distributing has 256m Euro assets under management. The ETF was launched on 17 July 2018 and is domiciled in Ireland.;Vanguard Německo All Cap UCITS ETF distribuující usiluje o sledování indexu FTSE pro všechny Cap Index. Německo FTSE All Cap Index sleduje velké, střední a malé čepice cenných papírů z Německa. TER (celkový poměr nákladů) ETF činí 0,10% p.a. Vanguard Německo All Cap UCITS ETF distribuující je jediným ETF, který sleduje index CAP FTSE Německo. ETF replikuje výkon podkladového indexu plnou replikací (nákup všech složek indexu). dividenday v ETF jsou distribuovány investorům (čtvrtletně). Vanguard Německo All Cap UCITS ETF distribuující má ve správě aktiv 256 milionů EUR. ETF byl spuštěn 17. července 2018 a je se sídlem v Irsku.;0.10%;0.1;EUR 256m;256.0;EUR;EUR;Ireland;Vanguard;17 July 2018;Distributing;Quarterly;Physical;UCITS;;Equity, Germany;;EUR    Currency risk  Currency;1;Akcie;False;Celosvětově;145.0;22.23;78.24;64.74;16.45;-3.99;-0.12;1.48;13.36;-17.57;19.22;16.24;62.79;17.05;14.85;16.67;1.3;1.43;0.63;-15.75;-15.75;-31.17;-38.78;;;;;Bolsa Mexicana de Valores;-;7;2.10%;2.1;EUR 0.70;0.7;EUR;method2_regex;2025-09-24T01:24:24.157330;success;0;Siemens AG;9.4;Allianz SE;7.63;Deutsche Telekom AG;5.9;Münchener Rückversicherungs-Gesellschaft AG;4.28;Rheinmetall AG;4.22;Siemens Energy AG;3.69;Deutsche Bank AG;3.0;Deutsche Börse AG;2.66;Infineon Technologies AG;2.56;;;Germany;97.06;Other;2.94;;;;;;;Industrials;25.45;Financials;20.75;Technology;18.37;Consumer Discretionary;8.26;Energy;3.69;gettex;EUR;VGER;;;;Stuttgart Stock Exchange;EUR;VGER;;;;Bolsa Mexicana de Valores;EUR;-;VGERN MM;VGERN.MX;;Frankfurt Stock Exchange;EUR;-;IVGER;;;London Stock Exchange;GBP;VGER;VGER LNIVGERGBP;VGER.L;;SIX Swiss Exchange;CHF;VGER;VGER SWIVGERCHF;VGER.S;;XETRA;EUR;VGER;VGER GYIVGER;VGER.DE;;;;;;;;;;;;;;;;;;;;4;72;26;5;11;10;20
IE00BG21M733;Invesco Variable Rate Preferred Shares UCITS ETF;https://www.justetf.com/en/etf-profile.html?isin=IE00BG21M733;The Invesco Variable Rate Preferred Shares UCITS ETF seeks to track the Wells Fargo Diversified Hybrid and Preferred Securities Floating and Variable Rate index. The Wells Fargo Diversified Hybrid and Preferred Securities Floating and Variable Rate index tracks the performance of variable and floating rate US dollar denominated preferred securities, as well as certain types of “hybrid securities” that are functionally equivalent to preferred stock, issued in the US domestic market. The ETF's TER (total expense ratio) amounts to 0.50% p.a.. The ETF replicates the performance of the underlying index by full replication (buying all the index constituents). The dividends in the ETF are distributed to the investors (Quarterly). The Invesco Variable Rate Preferred Shares UCITS ETF is a very small ETF with 13m Euro assets under management. The ETF was launched on 3 October 2018 and is domiciled in Ireland.;UCITS ETF usiluje o sledování hybridních a preferovaných cenných papírů plovoucích a variabilních sazeb, které upřednostňují variabilní a variabilní sazbu. Wells Fargo diverzifikoval hybridní a preferované cenné papíry plovoucí a variabilní sazby indexe sleduje výkon proměnné a plovoucí sazby americký dolar denominovaný preferovanými cennými papíry, jakož i určité typy „hybridních cenných papírů“, které jsou funkčně ekvivalentní k preferovaným akcím, vydaným na americkém domácím trhu. TER (celkový poměr nákladů) ETF činí 0,50% p.a. ETF replikuje výkon podkladového indexu plnou replikací (nákup všech indexových složek). dividenday v ETF jsou distribuovány investorům (čtvrtletně). UCITS ETF preferované sazby Invesco je velmi malý ETF s 13 milionu euro. ETF byl spuštěn 3. října 2018 a je se sídlem v Irsku.;0.50%;0.5;EUR 13m;13.0;EUR;USD;Ireland;Invesco;3 October 2018;;Quarterly;Physical;UCITS;;Equity, United States, Dividend;;USD    Currency risk  Currency;1;Akcie;False;Severní Amerika;303.0;1.1;7.23;25.94;-6.44;-0.1;1.1;-3.79;12.29;-4.24;5.35;17.5;35.33;8.64;8.64;8.0;0.13;0.27;0.59;-11.71;-13.22;-13.22;-29.74;;;;;Borsa Italiana;-;4;5.22%;5.22;EUR 1.79;1.79;EUR;method2_regex;2025-09-24T01:24:31.493172;success;0;FXD-FRN PERP USD (SEC REGD) (OO);1.34;FXD-FRN JNR SUB PERP USD (SEC REGD) (OO);1.32;CITIGROUP CAP XIII 7.875% FX/FL TRUST PRF 30/10/40 USD25;1.11;FXD-FRN JNR SUB PERP USD (SEC REGD) (NN);1.11;BP CAP.MKTS 20/UND. FLR;1.06;FXD-FRN JNR SUB PERP USD (SEC REGD) (X);1.02;FXD-FRN JNR SUB 10/03/2055 USD (SEC REGD) (A);1.0;BANK AMERI. 18/UND. FF;1.0;CITIGROUP 21/UND.FLR;0.97;;;Other;90.38;United States;9.62;;;;;;;Financials;7.89;;;;;;;;;Borsa Italiana;EUR;VRPS;;;;Borsa Italiana;USD;-;VRPS IMVRPSINE;VRPS.MI0EXWINAV.DE;;London Stock Exchange;USD;VRPS;VRPS LNVRPSIN;VRPS.L0EXXINAV.DE;;SIX Swiss Exchange;USD;VRPS;VRPS SWVRPSIN;VRPS.S0EXXINAV.DE;;;;;;;;;;;;;;;;;;;;;;;;;;;;;;;;;;;;;;2;45;12;1;8;10;14
IE00BG36TC12;Xtrackers MSCI Japan ESG UCITS ETF 1C;https://www.justetf.com/en/etf-profile.html?isin=IE00BG36TC12;The Xtrackers MSCI Japan ESG UCITS ETF 1C seeks to track the MSCI Japan Low Carbon SRI Selection index. The MSCI Japan Low Carbon SRI Selection index tracks large- and mid-cap securities from Japan. Only companies with low carbon emissions and a high ESG (environmental, social and governance) rating are considered. The parent index is the MSCI Japan. The ETF's TER (total expense ratio) amounts to 0.20% p.a.. The Xtrackers MSCI Japan ESG UCITS ETF 1C is the only ETF that tracks the MSCI Japan Low Carbon SRI Selection index. The ETF replicates the performance of the underlying index by full replication (buying all the index constituents). The dividends in the ETF are accumulated and reinvested in the ETF. The Xtrackers MSCI Japan ESG UCITS ETF 1C is a very large ETF with 2,355m Euro assets under management. The ETF was launched on 24 April 2018 and is domiciled in Ireland.;Xtrackers MSCI Japan ESG UCITS ETF 1C se snaží sledovat index výběru MSCI Japan Low Carbon SRI. Index výběru MSCI Japonsko nízký uhlík SRI sleduje cenné papíry z Japonska velké a střední kapitalizace. Zvažují se pouze společnosti s emisemi s nízkým uhlíkem a vysokým hodnocením ESG (environmentální, sociální a správa věcí veřejných). Index nadřazení je MSCI Japan. TER (celkový poměr nákladů) činí 0,20% p.a. ETF replikuje výkon podkladového indexu plnou replikací (nákup všech složek indexu). dividenday v ETF jsou akumulovány a reinvestovány do ETF. Xtrackers MSCI Japan ESG UCITS ETF 1C je velmi velký ETF s spravováním 2 355 milionů euro. ETF byl spuštěn 24. dubna 2018 a je se sídlem v Irsku.;0.20%;0.2;EUR 2355m;2355.0;EUR;USD;Ireland;Xtrackers;24 April 2018;;;Physical;UCITS;MSCI Japan ESG  1C;Equity, Japan, Social/Environmental;Yes;USD    Currency risk  Currency;1;Akcie;False;Celosvětově;96.0;10.06;39.07;39.99;5.35;-0.26;10.52;5.92;7.27;-15.64;14.13;17.62;57.71;24.16;21.46;19.86;0.42;0.54;0.35;-21.31;-21.31;-22.51;-25.58;;;1.691;;London Stock Exchange;XESJ;8;;;;;;;2025-09-24T01:24:37.913146;success;0;Hitachi Ltd.;6.75;Sumitomo Mitsui Financial Group, Inc.;4.55;Recruit Holdings Co., Ltd.;4.04;Tokio Marine Holdings, Inc.;3.55;SoftBank Group Corp.;3.53;Mizuho Financial Group, Inc.;3.36;Fast Retailing Co., Ltd.;2.84;Shin-Etsu Chemical Co., Ltd.;2.54;Advantest Corp.;2.52;;;Japan;99.85;;;;;;;;;Industrials;21.4;Financials;17.85;Consumer Discretionary;16.95;Technology;13.71;;;gettex;EUR;XZMJ;;;;Stuttgart Stock Exchange;EUR;XZMJ;;;;Borsa Italiana;EUR;XZMJ;XZMJ IMXZMJEUIV;XZMJ.MIXZMJEUINAV=SOLA;;London Stock Exchange;USD;XZMJ;XZMJ LNXZMJUSIV;XZMJ.LXZMJINAV=SOLA;;London Stock Exchange;GBP;XESJ;XESJ LNXZMJEUIV;XESJ.LXZMJEUINAV=SOLA;;SIX Swiss Exchange;USD;XZMJ;;;;SIX Swiss Exchange;JPY;XZMJ;XZMJ SW;XZMJ.S;;XETRA;EUR;XZMJ;XZMJ GY;XZMJ.DE;;;;;;;;;;;;;;4;71;17;13;11;10;20
IE00BG370F43;Xtrackers MSCI Emerging Markets ESG UCITS ETF 1C;https://www.justetf.com/en/etf-profile.html?isin=IE00BG370F43;The Xtrackers MSCI Emerging Markets ESG UCITS ETF 1C seeks to track the MSCI Emerging Markets Low Carbon SRI Selection index. The MSCI Emerging Markets Low Carbon SRI Selection index tracks large- and mid-cap securities from emerging markets worlwide. Only companies with low carbon emissions and a high ESG (environmental, social and governance) rating are considered. The parent index is the MSCI Emerging Markets. The ETF's TER (total expense ratio) amounts to 0.25% p.a.. The Xtrackers MSCI Emerging Markets ESG UCITS ETF 1C is the only ETF that tracks the MSCI Emerging Markets Low Carbon SRI Selection index. The ETF replicates the performance of the underlying index by sampling technique (buying a selection of the most relevant index constituents). The dividends in the ETF are accumulated and reinvested in the ETF. The Xtrackers MSCI Emerging Markets ESG UCITS ETF 1C is a very large ETF with 1,359m Euro assets under management. The ETF was launched on 15 October 2019 and is domiciled in Ireland.;The Xtrackers MSCI Emerging Markets ESG UCITS ETF 1C se snaží sledovat index výběru MSCI s nízkým uhlíkem SRI. Index výběru MSCI s nízkými uhlíkovými SRI indexemi MSCI sleduje cenné papíry s velkými a středními kapitalizací z rozvíjejících se trhů Worlwide. Zvažují se pouze společnosti s emisemi s nízkým uhlíkem a vysokým hodnocením ESG (environmentální, sociální a správa věcí veřejných). Rodičovský index je rozvíjející se trhy MSCI. TER ETF TER (celkový poměr nákladů) činí 0,25% p.a .. Xtrackers MSCI Emerging Markets ESG UCITS ETF 1C je jediný ETF, který sleduje rozvíjející se trhy s nízkým obsahem uhlíku SRI. ETF replikuje výkon základního indexu technikou vzorkování (nákup výběru nejdůležitějších složek indexu). dividenday v ETF jsou akumulovány a reinvestovány do ETF. The Xtrackers MSCI Emerging Markets ESG UCITS ETF 1C je velmi velký ETF s spravováním 1 359 milionů euro. ETF byl spuštěn 15. října 2019 a je se sídlem v Irsku.;0.25%;0.25;EUR 1359m;1359.0;EUR;USD;Ireland;Xtrackers;15 October 2019;;;Physical;UCITS;MSCI Emerging Markets;Equity, Emerging Markets, Social/Environmental;Yes;USD    Currency risk  Currency;1;Akcie;False;Rozvíjející se trhy;336.0;18.88;30.91;19.83;12.79;5.54;11.28;11.11;-1.81;-16.28;0.64;17.92;28.03;16.86;15.72;17.2;1.12;0.6;0.21;-19.1;-19.1;-36.66;-36.66;;;;;SIX Swiss Exchange;-;8;;;;;;;2025-09-24T01:24:43.547810;success;0;Alibaba Group Holding Ltd.;7.22;HDFC Bank Ltd.;3.39;China Construction Bank Corp.;2.51;Meituan;2.07;Infosys Ltd.;1.56;BYD Co., Ltd.;1.5;Naspers Ltd.;1.49;Ping An Insurance (Group) Co. of China Ltd.;1.33;NetEase, Inc.;1.3;;;China;31.79;Other;28.8;;;;;;;Financials;28.59;Technology;20.73;Consumer Discretionary;18.29;;;;;gettex;EUR;XZEM;;;;Borsa Italiana;EUR;XZEM;XZEM IMXZEMEUIV;XZEM.MIXZEMEURINAV=SOLA;;London Stock Exchange;USD;XZEM;XZEM LNXZEMUSIV;XZEM.LXZEMUSDINAV=SOLA;;London Stock Exchange;GBP;XESE;XESE LNXESEGBIV;XESE.LXESEGBPINAV=SOLA;;SIX Swiss Exchange;USD;XZEM;XZEMEUIV;XZEMEURINAV=SOLA;;SIX Swiss Exchange;EUR;-;XZEMEUIV;XZEMEURINAV=SOLA;;SIX Swiss Exchange;CHF;XZEM;XZEM SWXZEMEUIV;XZEM.SXZEMEURINAV=SOLA;;XETRA;EUR;XZEM;XZEM GYXZEMEUIV;XZEM.DEXZEMEURINAV=SOLA;;;;;;;;;;;;;;4;68;17;13;8;10;20
IE00BG47J908;JPMorgan GBP Ultra-Short Income UCITS ETF GBP (Acc);https://www.justetf.com/en/etf-profile.html?isin=IE00BG47J908;The JPMorgan GBP Ultra-Short Income UCITS ETF GBP (Acc) is an actively managed ETF. The JP Morgan GBP Ultra Short Income Strategy invests primarily in investment grade, pound denominated, short term fixed, variable and floating rate debt securities. The strategy will concentrate its investments in the banking industry and, under normal conditions, will invest more than 25 per cent of its Net Asset Value in debt securities issued by companies which are in the banking industry. The benchmark is ICE BofAML Sterling 3-Month Government Bill index. The ETF's TER (total expense ratio) amounts to 0.18% p.a.. The interest income (coupons) in the ETF is accumulated and reinvested in the ETF. The JPMorgan GBP Ultra-Short Income UCITS ETF GBP (Acc) is a small ETF with 65m Euro assets under management. The ETF was launched on 3 April 2019 and is domiciled in Ireland.;JPMorgan GBP Ultra-krátký příjem UCITS ETF GBP (ACC) je aktivně spravovaný ETF. Strategie JP Morgan GBP Ultra s krátkým příjmem investuje především do investiční třídy, denominované libry, krátkodobé pevné, variabilní a pohyblivé dluhové cenné papíry. Strategie soustředí své investice do bankovního průmyslu a za běžných podmínek investuje více než 25 % své čisté hodnoty aktiv do dluhových cenných papírů vydaných společnostmi, které jsou v bankovním průmyslu. Benchmarkem je Ice Bofaml Sterling 3měsíční index vládních zákonů. TER (celkový poměr nákladů) ETF činí 0,18% p.a. Úrokový výnosy (kupóny) v ETF se nashromáždí a reinvestují do ETF. JPMorgan GBP Ultra-krátký příjem UCITS ETF GBP (ACC) je malý ETF s managementem 65 milionů euro. ETF byl spuštěn 3. dubna 2019 a je se sídlem v Irsku.;0.18%;0.18;EUR 65m;65.0;EUR;GBP;Ireland;J.P. Morgan;3 April 2019;Accumulating;;Physical;UCITS;;risk  Actively managed    Sustainability  No;;GBP    Currency risk  Currency;Actively managed    Sustainability  No;Akcie;True;Celosvětově;123.0;0.88;15.4;21.22;-1.54;-0.45;-0.97;-1.58;6.98;-4.8;7.23;10.18;14.7;5.43;5.4;5.79;0.16;0.9;0.68;-4.42;-4.42;-8.96;-11.51;;;;;London Stock Exchange;JGSA;1;;;;;;;2025-09-24T01:24:49.693982;success;0;FR0014002J90;1.72;;;;;;;;;;;;;;;;;;;Other;75.11;United Kingdom;10.53;United States;5.44;Netherlands;5.32;Canada;3.6;IT;10.53;;;;;;;;;London Stock Exchange;GBP;JGSA;JGSA LNJGSAGBIV;JGSA.LJGSAGBiv.P;;;;;;;;;;;;;;;;;;;;;;;;;;;;;;;;;;;;;;;;;;;;;;;;;;;;;;;;3;51;17;1;8;5;20
IE00BG47K971;Vanguard Global Aggregate Bond UCITS ETF GBP Hedged Accumulating;https://www.justetf.com/en/etf-profile.html?isin=IE00BG47K971;The Vanguard Global Aggregate Bond UCITS ETF GBP Hedged Accumulating seeks to track the Bloomberg Global Aggregate Float Adjusted and Scaled (GBP Hedged) index. The Bloomberg Global Aggregate Float Adjusted and Scaled (GBP Hedged) index tracks bonds from issuers worldwide. The index contains corporate bonds and government bonds. All maturities are included. Rating: Investment Grade. Currency hedged to British Pound (GBP). The ETF's TER (total expense ratio) amounts to 0.08% p.a.. The ETF replicates the performance of the underlying index by sampling technique (buying a selection of the most relevant index constituents). The interest income (coupons) in the ETF is accumulated and reinvested in the ETF. The Vanguard Global Aggregate Bond UCITS ETF GBP Hedged Accumulating is a very large ETF with 1,728m Euro assets under management. The ETF was launched on 18 June 2019 and is domiciled in Ireland.;Vanguard Global Agregate Bond UCITS ETF GBP zajišťoval akumulační usiluje o sledování globálního agregovaného float Bloomberg upravený a škálovaný (GBP Hedged). Bloomberg globální agregovaný plovák upravil a upravil (GBP Hedged) Indexové sleduje dluhopisy od emitentů po celém světě. Index obsahuje firemní dluhopisy a vládní dluhopisy. Zahrnuty jsou všechna splatností. Hodnocení: Investiční třída. Měna zajišťovala britskou libru (GBP). TER (celkový poměr nákladů) ETF činí 0,08% p.a. ETF replikuje výkon podkladového indexu technikou vzorkování (nákup výběru nejdůležitějších složek indexu). Úrokové výnosy (kupóny) v ETF se nashromáždí a reinvestují do ETF. Vanguard Global Agregate Bond UCITS ETF GBP Hedged Akumulace je velmi velký ETF s 1 728 mil. EUR. ETF byl spuštěn 18. června 2019 a je se sídlem v Irsku.;0.08%;0.08;EUR 1728m;1728.0;EUR;GBP;Ireland;Vanguard;18 June 2019;Accumulating;;Physical;UCITS;;Bonds, World, Aggregate, All maturities;;GBP    Currency risk  Currency;1;Dluhopisy;False;Celosvětově;7967.0;-0.98;12.99;0.89;-0.88;-0.78;-0.17;-0.85;5.19;-18.91;8.67;6.83;4.86;8.84;10.79;10.24;-0.11;0.38;0.02;-6.2;-7.55;-20.92;-20.92;;;;;Extracted (method 1);VAGS;0;;;;;;;2025-09-24T01:24:57.674183;success;0;DE0001102606;0.24;FR0013451507;0.19;FR0013407236;0.19;;;;;;;;;;;;;;;Other;58.71;United States;25.57;Japan;7.45;France;4.72;Germany;3.55;;;;;;;;;;;;;;;;;;;;;;;;;;;;;;;;;;;;;;;;;;;;;;;;;;;;;;;;;;;;;;;;;;;;;;;4;74;26;13;8;10;17
IE00BG47KB92;Vanguard Global Aggregate Bond UCITS ETF EUR Hedged Distributing;https://www.justetf.com/en/etf-profile.html?isin=IE00BG47KB92;The Vanguard Global Aggregate Bond UCITS ETF EUR Hedged Distributing seeks to track the Bloomberg Global Aggregate Float Adjusted and Scaled (EUR Hedged) index. The Bloomberg Global Aggregate Float Adjusted and Scaled (EUR Hedged) index tracks bonds from issuers worldwide. The index contains corporate bonds and government bonds. All maturities are included. Rating: Investment Grade. Currency hedged to Euro (EUR). The ETF's TER (total expense ratio) amounts to 0.08% p.a.. The Vanguard Global Aggregate Bond UCITS ETF EUR Hedged Distributing is the cheapest ETF that tracks the Bloomberg Global Aggregate Float Adjusted and Scaled (EUR Hedged) index. The ETF replicates the performance of the underlying index by sampling technique (buying a selection of the most relevant index constituents). The interest income (coupons) in the ETF is distributed to the investors (Monthly). The Vanguard Global Aggregate Bond UCITS ETF EUR Hedged Distributing has 105m Euro assets under management. The ETF was launched on 18 June 2019 and is domiciled in Ireland.;Vanguard Global Agregate Bond UCITS ETF EUR HEDGED DISTRIBUTIONS usiluje o sledování globálního agregovaného float Bloomberg upraveného a škálovaného (EUR zajišťovaného). Bloomberg globální agregovaný plovák upravený a zmenšený (EUR zajišťovaný) indexové dluhopisy od emitentů po celém světě. Index obsahuje firemní dluhopisy a vládní dluhopisy. Zahrnuty jsou všechna splatností. Hodnocení: Investiční třída. Měna zajišťovala euro (EUR). TER (celkový poměr nákladů) činí 0,08% p.a. Vanguard globální agregovaný dluhopis UCITS ETF EUR HEDGED HEDGED distribuující je nejlevnější ETF, který sleduje globální agregát Bloomberg upravený a škálovaný (EUR Hedged). ETF replikuje výkon základního indexu technikou vzorkování (nákup výběru nejdůležitějších složek indexu). Úrokové výnosy (kupóny) v ETF jsou distribuovány investorům (měsíčně). Vanguard Global Agregate Bond UCITS ETF EUR HEDGED DISTRIBUTIONS má 105 milionů euro aktiv pod správou. ETF byl spuštěn 18. června 2019 a je se sídlem v Irsku.;0.08%;0.08;EUR 105m;105.0;EUR;EUR;Ireland;Vanguard;18 June 2019;Distributing;Monthly;Physical;UCITS;;Bonds, World, Aggregate, All maturities;;EUR    Currency risk  Currency;1;Dluhopisy;False;Celosvětově;7967.0;1.04;8.04;-9.53;3.02;-0.31;1.25;2.04;-2.13;-15.26;4.67;0.61;-5.09;6.8;8.71;8.35;0.15;0.3;-0.24;-3.73;-6.17;-19.65;-19.66;;;;;Extracted (method 1);VAGE;0;3.48%;3.48;EUR 0.73;0.73;EUR;method2_regex;2025-09-24T01:25:03.518030;success;0;DE0001102606;0.24;FR0013451507;0.19;FR0013407236;0.19;;;;;;;;;;;;;;;Other;58.72;United States;25.57;Japan;7.44;France;4.72;Germany;3.55;;;;;;;;;;;;;;;;;;;;;;;;;;;;;;;;;;;;;;;;;;;;;;;;;;;;;;;;;;;;;;;;;;;;;;;3;63;26;5;8;10;14
