isin;name;url;description_en;description_cs;ter;ter_numeric;fund_size;fund_size_numeric;fund_size_currency;fund_currency;fund_domicile;fund_provider;inception_date;distribution_policy;distribution_frequency;replication;legal_structure;index_name;investment_focus;sustainability;category;is_leveraged;region;total_holdings;return_1y;return_3y;return_5y;return_ytd;volatility_1y;volatility_3y;volatility_5y;return_per_risk_1y;return_per_risk_3y;return_per_risk_5y;max_drawdown_1y;max_drawdown_3y;max_drawdown_5y;max_drawdown_inception;beta;correlation;tracking_error;information_ratio;primary_exchange;primary_ticker;total_exchanges;current_dividend_yield;current_dividend_yield_numeric;dividends_12m;dividends_12m_numeric;dividends_12m_currency;dividend_extraction_method;scraping_date;scraping_status;retry_count;holding_1_name;holding_1_weight;holding_2_name;holding_2_weight;holding_3_name;holding_3_weight;holding_4_name;holding_4_weight;holding_5_name;holding_5_weight;holding_6_name;holding_6_weight;holding_7_name;holding_7_weight;holding_8_name;holding_8_weight;holding_9_name;holding_9_weight;holding_10_name;holding_10_weight;country_1_name;country_1_weight;country_2_name;country_2_weight;country_3_name;country_3_weight;country_4_name;country_4_weight;country_5_name;country_5_weight;sector_1_name;sector_1_weight;sector_2_name;sector_2_weight;sector_3_name;sector_3_weight;sector_4_name;sector_4_weight;sector_5_name;sector_5_weight;exchange_1_name;exchange_1_currency;exchange_1_ticker;exchange_1_bloomberg;exchange_1_reuters;exchange_1_market_maker;exchange_2_name;exchange_2_currency;exchange_2_ticker;exchange_2_bloomberg;exchange_2_reuters;exchange_2_market_maker;exchange_3_name;exchange_3_currency;exchange_3_ticker;exchange_3_bloomberg;exchange_3_reuters;exchange_3_market_maker;exchange_4_name;exchange_4_currency;exchange_4_ticker;exchange_4_bloomberg;exchange_4_reuters;exchange_4_market_maker;exchange_5_name;exchange_5_currency;exchange_5_ticker;exchange_5_bloomberg;exchange_5_reuters;exchange_5_market_maker;rating;rating_score;rating_ter_score;rating_size_score;rating_track_record_score;rating_provider_score;rating_performance_score
IE00BZ0G8B96;SPDR MSCI Japan UCITS ETF;https://www.justetf.com/en/etf-profile.html?isin=IE00BZ0G8B96;The SPDR MSCI Japan UCITS ETF seeks to track the MSCI Japan index. The MSCI Japan index tracks leading Japanese stocks. The ETF's TER (total expense ratio) amounts to 0.12% p.a.. The SPDR MSCI Japan UCITS ETF is the cheapest ETF that tracks the MSCI Japan index. The ETF replicates the performance of the underlying index by sampling technique (buying a selection of the most relevant index constituents). The dividends in the ETF are accumulated and reinvested in the ETF. The SPDR MSCI Japan UCITS ETF is a large ETF with 680m Euro assets under management. The ETF was launched on 30 November 2015 and is domiciled in Ireland.;SPDR MSCI Japan UCITS ETF se snaží sledovat index MSCI Japan. Index MSCI Japan sleduje vedoucí japonské akcie. TER (celkový poměr nákladů) ETF činí 0,12% P.A .. SPDR MSCI Japan UCITS ETF je nejlevnější ETF, který sleduje japonský index MSCI. ETF replikuje výkon základního indexu technikou vzorkování (nákup výběru nejdůležitějších složek indexu). dividenday v ETF jsou akumulovány a reinvestovány do ETF. SPDR MSCI Japan UCITS ETF je velký ETF s managementem 680m euro. ETF byl spuštěn 30. listopadu 2015 a je se sídlem v Irsku.;0.12%;0.12;EUR 680m;680.0;EUR;JPY;Ireland;SPDR;30 November 2015;;;Physical;;MSCI Japan;Equity, Japan;;Akcie;False;Japonsko;183.0;14.29;41.79;51.86;6.91;19.03;19.01;17.73;0.75;0.65;0.49;-16.73;-17.1;-20.45;-26.43;;;;;London Stock Exchange;JPJP;6;;;;;;;2025-09-19T10:53:01.145516;success;0;Mitsubishi UFJ Financial Group, Inc.;3.99;Sony Group Corp.;3.73;Hitachi Ltd.;3.53;Sumitomo Mitsui Financial Group, Inc.;2.34;Nintendo Co., Ltd.;2.3;Recruit Holdings Co., Ltd.;2.1;Tokyo Electron Ltd.;2.02;Mitsubishi Heavy Industries, Ltd.;1.91;SoftBank Group Corp.;1.86;;;Japan;99.92;;;;;;;;;Industrials;24.48;Consumer Discretionary;17.35;Financials;16.56;Technology;13.41;;;gettex;EUR;ZPDJ;;;;Stuttgart Stock Exchange;EUR;ZPDJ;;;;Euronext Paris;JPY;JPJY;JPJY FPINZPDJJ;JPJY.PAINZPDJJ.IV;;London Stock Exchange;GBP;JPJP;JPJP LNINZPDJP;JPJP.LINZPDJPiv.OQ;;SIX Swiss Exchange;JPY;JPJY;JPJY SWINZPDJJ;JPJY.SINZPDJJ.IV;;4;73;22;10;11;10;20
IE00BZ0G8C04;SPDR MSCI Japan EUR Hedged UCITS ETF;https://www.justetf.com/en/etf-profile.html?isin=IE00BZ0G8C04;The SPDR MSCI Japan EUR Hedged UCITS ETF seeks to track the MSCI Japan (EUR Hedged) index. The MSCI Japan (EUR Hedged) index tracks leading stocks on the Japanese market. Currency hedged to Euro (EUR). The ETF's TER (total expense ratio) amounts to 0.17% p.a.. The ETF replicates the performance of the underlying index by sampling technique (buying a selection of the most relevant index constituents). The dividends in the ETF are accumulated and reinvested in the ETF. The SPDR MSCI Japan EUR Hedged UCITS ETF is a small ETF with 26m Euro assets under management. The ETF was launched on 30 November 2015 and is domiciled in Ireland.;SPDR MSCI Japan Eur Hedged UCITS ETF se snaží sledovat index MSCI Japan (EUR Hedged). Indexové indexy MSCI Japonsko (Hedged) sleduje přední akcie na japonském trhu. Měna zajišťovala euro (EUR). ETF TER (celkový poměr nákladů) činí 0,17% p.a. ETF replikuje výkon podkladového indexu technikou vzorkování (nákup výběru nejdůležitějších složek indexu). dividenday v ETF jsou akumulovány a reinvestovány do ETF. SPDR MSCI Japan Eur Hedged UCITS ETF je malý ETF s managementem 26 milionů euro. ETF byl spuštěn 30. listopadu 2015 a je se sídlem v Irsku.;0.17%;0.17;EUR 26m;26.0;EUR;EUR;Ireland;SPDR;30 November 2015;;;Physical;;MSCI Japan EUR Hedged;Equity, Japan;;Akcie;False;Japonsko;183.0;28.87;85.0;126.28;15.83;19.29;20.02;18.73;1.5;1.14;0.95;-16.29;-24.99;-24.99;-32.74;;;;;Borsa Italiana;JPEH;4;;;;;;;2025-09-19T10:53:06.481675;success;0;Mitsubishi UFJ Financial Group, Inc.;3.99;Sony Group Corp.;3.73;Hitachi Ltd.;3.53;Sumitomo Mitsui Financial Group, Inc.;2.34;Nintendo Co., Ltd.;2.3;Recruit Holdings Co., Ltd.;2.1;Tokyo Electron Ltd.;2.02;Mitsubishi Heavy Industries, Ltd.;1.91;SoftBank Group Corp.;1.86;;;Japan;99.92;;;;;;;;;Industrials;24.48;Consumer Discretionary;17.35;Financials;16.56;Technology;13.41;;;gettex;EUR;ZPDW;;;;Stuttgart Stock Exchange;EUR;ZPDW;;;;Borsa Italiana;EUR;JPEH;JPEH IMINZPDWE;JPEH.MIINZPDWEiv.OQ;;XETRA;EUR;ZPDW;ZPDW GYINZPDWE;ZPDW.DEINZPDWEiv.OQ;;;;;;;;3;59;17;1;11;10;20
IE00BZ0PKS76;iShares STOXX USA Equity Multifactor UCITS ETF USD (Acc);https://www.justetf.com/en/etf-profile.html?isin=IE00BZ0PKS76;The iShares STOXX USA Equity Multifactor UCITS ETF USD (Acc) seeks to track the STOXX US Equity Factor Screened index. The STOXX US Equity Factor Screened index tracks stocks on the US market. The title selection and weighting is based on 4 style factors: Value, Momentum, Quality and Small Size. The ETF's TER (total expense ratio) amounts to 0.20% p.a.. The iShares STOXX USA Equity Multifactor UCITS ETF USD (Acc) is the cheapest and largest ETF that tracks the STOXX US Equity Factor Screened index. The ETF replicates the performance of the underlying index by sampling technique (buying a selection of the most relevant index constituents). The dividends in the ETF are accumulated and reinvested in the ETF. The iShares STOXX USA Equity Multifactor UCITS ETF USD (Acc) is a small ETF with 57m Euro assets under management. The ETF was launched on 4 September 2015 and is domiciled in Ireland.;Ishares Stoxx USA Equity Multifaktor UCITS ETF USD (ACC) se snaží sledovat index Stoxx US Equity Screening. Stoxx americký akciový faktor prověřil indexové akciíy na americkém trhu. Výběr a vážení titulu je založen na 4 faktorech ve stylu: hodnota, hybnost, kvalita a malá velikost. TER (celkový poměr výdajů) ETF činí 0,20% p.a. Ishares Stoxx USA Equity Multifactor UCITS ETF USD (ACC) je nejlevnější a největší ETF, který sleduje index Stoxx US Equity Faktor. ETF replikuje výkon základního indexu technikou vzorkování (nákup výběru nejdůležitějších složek indexu). dividenday v ETF jsou akumulovány a reinvestovány do ETF. Ishares Stoxx USA Equity MultifActor UCITS ETF USD (ACC) je malý ETF s managementem 57 milionů euro. ETF byl spuštěn 4. září 2015 a je bytí v Irsku.;0.20%;0.2;EUR 57m;57.0;EUR;USD;Ireland;iShares;4 September 2015;Accumulating;;Physical;;;;Yes;Akcie;False;US;346.0;12.5;40.38;98.28;1.36;19.46;17.4;17.66;0.64;0.69;0.83;-22.11;-22.11;-22.11;-35.67;;;;;Bolsa Mexicana de Valores;-;9;;;;;;;2025-09-19T10:53:13.637091;success;0;Microsoft;7.63;Apple;5.11;Broadcom;4.06;Alphabet, Inc. C;3.52;The Bank of New York Mellon Corp.;2.31;JPMorgan Chase & Co.;2.14;Amazon.com, Inc.;2.03;Arista Networks;1.96;Meta Platforms;1.71;;;United States;89.2;Other;7.88;;;;;;;Technology;37.79;Financials;11.98;Consumer Discretionary;11.31;;;;;London Stock Exchange;GBX;FSUS;;;;gettex;EUR;IBCY;;;;Stuttgart Stock Exchange;EUR;IBCY;;;;Bolsa Mexicana de Valores;MXN;-;IFSUN MM;IFSUN.MX;;Borsa Italiana;EUR;IFSU;IFSU IMINAVFSUE;IFSU.MI0JG7INAV.DE;;3;61;17;1;13;10;20
IE00BZ0PKT83;iShares STOXX World Equity Multifactor UCITS ETF USD (Acc);https://www.justetf.com/en/etf-profile.html?isin=IE00BZ0PKT83;The iShares STOXX World Equity Multifactor UCITS ETF USD (Acc) seeks to track the STOXX Developed World Equity Factor Screened index. The STOXX Developed World Equity Factor Screened index tracks companies in developed equity markets globally. The title selection and weighting is based on 4 style factors: Value, Momentum, Quality and Small Size. The ETF's TER (total expense ratio) amounts to 0.30% p.a.. The iShares STOXX World Equity Multifactor UCITS ETF USD (Acc) is the only ETF that tracks the STOXX Developed World Equity Factor Screened index. The ETF replicates the performance of the underlying index by sampling technique (buying a selection of the most relevant index constituents). The dividends in the ETF are accumulated and reinvested in the ETF. The iShares STOXX World Equity Multifactor UCITS ETF USD (Acc) is a large ETF with 596m Euro assets under management. The ETF was launched on 4 September 2015 and is domiciled in Ireland.;IShares Stoxx World Equity Multifactor UCITS ETF USD (ACC) se snaží sledovat index Stoxx vyvinutý světový equityction index. Stoxx vyvinul World Equity Factor prověřené indexové společnosti sleduje společnosti na rozvinutých akciových trzích po celém světě. Výběr a vážení titulu je založen na 4 faktorech ve stylu: hodnota, hybnost, kvalita a malá velikost. TER (celkový poměr nákladů) ETF činí 0,30% p.a. ETF replikuje výkon základního indexu technikou vzorkování (nákup výběru nejdůležitějších složek indexu). dividenday v ETF jsou akumulovány a reinvestovány do ETF. IShares Stoxx World Equity Multifaktor UCITS ETF USD (ACC) je velký ETF s managementem 596 milionů euro. ETF byl spuštěn 4. září 2015 a je bytí v Irsku.;0.30%;0.3;EUR 596m;596.0;EUR;USD;Ireland;iShares;4 September 2015;Accumulating;;Physical;;;;Yes;Akcie;False;Evropa;264.0;15.03;41.9;89.44;6.59;15.37;14.53;14.85;0.98;0.85;0.92;-19.06;-19.06;-19.06;-34.47;;;;;London Stock Exchange;-;8;;;;;;;2025-09-19T10:53:21.364372;success;0;Microsoft;5.3;Apple;3.52;Broadcom;2.29;UniCredit SpA;1.99;Amazon.com, Inc.;1.97;Alphabet, Inc. C;1.95;Trane Technologies;1.66;Manulife Financial Corp.;1.36;McKesson;1.32;;;United States;58.94;Other;25.49;Japan;8.47;Canada;4.3;;;Technology;28.31;Financials;19.34;Consumer Discretionary;12.97;Industrials;7.1;;;London Stock Exchange;GBX;FSWD;;;;gettex;EUR;IBCZ;;;;Stuttgart Stock Exchange;EUR;IBCZ;;;;Borsa Italiana;EUR;IFSW;IFSW IMINAVFSWE;IFSW.MI0JHCINAV.DE;;London Stock Exchange;USD;IFSW;IFSW LNINAVFSWU;IFSW.L0JHGINAV.DE;;4;65;12;10;13;10;20
IE00BZ0PKV06;iShares STOXX Europe Equity Multifactor UCITS ETF EUR (Acc);https://www.justetf.com/en/etf-profile.html?isin=IE00BZ0PKV06;The iShares STOXX Europe Equity Multifactor UCITS ETF EUR (Acc) seeks to track the STOXX Developed Europe Equity Factor Screened index. The STOXX Developed Europe Equity Factor Screened index tracks stocks from European developed markets. The title selection and weighting is based on 4 style factors: Value, Momentum, Quality and Small Size. The ETF's TER (total expense ratio) amounts to 0.25% p.a.. The iShares STOXX Europe Equity Multifactor UCITS ETF EUR (Acc) is the cheapest and largest ETF that tracks the STOXX Developed Europe Equity Factor Screened index. The ETF replicates the performance of the underlying index by sampling technique (buying a selection of the most relevant index constituents). The dividends in the ETF are accumulated and reinvested in the ETF. The iShares STOXX Europe Equity Multifactor UCITS ETF EUR (Acc) has 284m Euro assets under management. The ETF was launched on 4 September 2015 and is domiciled in Ireland.;Ishares Stoxx Europe Equity Equity Multifaktor UCITS ETF EUR (ACC) se snaží sledovat index Stoxx vyvinutý evropský evropský faktor. Stoxx vyvinul evropský evropský faktor prověřený indexové akciíy akcií z evropských rozvinutých trhů. Výběr a vážení titulu je založen na 4 faktorech ve stylu: hodnota, hybnost, kvalita a malá velikost. TER (celkový poměr výdajů) ETF činí 0,25% P.A .. Ishares Stoxx Europe Equity MultifActor UCITS ETF EUR (ACC) je nejlevnější a největší ETF, který sleduje index evropským evropským evropským faktorem. ETF replikuje výkon základního indexu technikou vzorkování (nákup výběru nejdůležitějších složek indexu). dividenday v ETF jsou akumulovány a reinvestovány do ETF. Ishares Stoxx Europe Equity MultifActor UCITS ETF EUR (ACC) má 284 milionů euro aktiv. ETF byl spuštěn 4. září 2015 a je bytí v Irsku.;0.25%;0.25;EUR 284m;284.0;EUR;EUR;Ireland;iShares;4 September 2015;Accumulating;;Physical;;;;Yes;Akcie;False;Evropa;159.0;11.43;59.52;78.37;12.25;13.75;12.3;13.76;0.83;1.37;0.89;-15.43;-15.43;-24.55;-37.06;;;;;Bolsa Mexicana de Valores;-;10;;;;;;;2025-09-19T10:53:29.769822;success;0;Novartis AG;3.43;Münchener Rückversicherungs-Gesellschaft AG;2.57;ASML Holding NV;2.52;Koninklijke Ahold Delhaize NV;2.3;Crédit Agricole SA;2.24;UBS Group AG;1.94;Banco Bilbao Vizcaya Argentaria SA;1.88;Novo Nordisk A/S;1.86;Pandora AS;1.82;;;Other;43.2;United Kingdom;15.45;France;14.28;Switzerland;14.19;Germany;12.88;Financials;28.73;Industrials;13.44;Consumer Staples;10.72;Health Care;8.39;;;London Stock Exchange;GBX;FSEU;;;;gettex;EUR;IBC0;;;;Stuttgart Stock Exchange;EUR;IBC0;;;;Bolsa Mexicana de Valores;MXN;-;IBC0N MM;IBC0N.MX;;Borsa Italiana;EUR;IFSE;IFSE IMINAVFSEE;IFSE.MI0JHHINAV.DE;;4;65;17;5;13;10;20
IE00BZ0RTB90;UBS MSCI United Kingdom IMI Socially Responsible UCITS ETF hCHF dis;https://www.justetf.com/en/etf-profile.html?isin=IE00BZ0RTB90;The UBS MSCI United Kingdom IMI Socially Responsible UCITS ETF hCHF dis seeks to track the MSCI UK IMI Extended SRI Low Carbon Select 5% Issuer Capped (CHF Hedged) index. The MSCI UK IMI Extended SRI Low Carbon Select 5% Issuer Capped (CHF Hedged) index tracks socially or environmentally responsible UK companies. Currency hedged to Swiss Francs (CHF). The ETF's TER (total expense ratio) amounts to 0.26% p.a.. The ETF replicates the performance of the underlying index by full replication (buying all the index constituents). The dividends in the ETF are distributed to the investors (Semi annually). The UBS MSCI United Kingdom IMI Socially Responsible UCITS ETF hCHF dis is a very small ETF with 11m Euro assets under management. The ETF was launched on 10 November 2015 and is domiciled in Ireland.;UBS MSCI Velká Británie IMI sociálně odpovědné UCITS ETF HCHF DIS se snaží sledovat index MSCI UK IMI prodloužený SRI Low Carbon Select 5% Emitent Limipped (CHF Hedged). MSCI UK IMI prodloužila SRI Low Carbon Select 5% Emitent Limipped (CHF Hedged) Indexové skladby sociálně nebo ekologicky odpovědné britské společnosti. Měna byla zajištěna švýcarským frankům (CHF). TER (celkový poměr nákladů) činí 0,26% p.a. ETF replikuje výkon podkladového indexu plnou replikací (nákup všech složek indexu). dividenday v ETF jsou distribuovány investorům (polo každoročně). UBS MSCI Velká Británie IMI sociálně zodpovědná UCITS ETF HCHF DIS je velmi malá ETF s spravováním 11 metrů euro. ETF byl spuštěn 10. listopadu 2015 a je se sídlem v Irsku.;0.26%;0.26;EUR 11m;11.0;EUR;CHF;Ireland;UBS;10 November 2015;Distributing;Semi annually;Physical;;;;Yes;Akcie;False;Ostatní;143.0;9.42;26.24;51.44;12.37;12.78;13.2;13.85;0.74;0.61;0.62;-12.64;-12.64;-16.53;-30.98;;;;;SIX Swiss Exchange;UKSRT;1;1.77%;1.77;EUR 0.20;0.2;EUR;method2_regex;2025-09-19T10:53:37.005629;success;0;HSBC Holdings Plc;5.1;GSK Plc;4.92;RELX;4.72;Lloyds Banking Group;4.67;Unilever Plc;4.59;Compass Group;4.51;3i Group Plc;4.03;Reckitt Benckiser Group;3.86;Experian;3.67;;;United Kingdom;92.71;Other;2.88;;;;;;;Financials;31.93;Industrials;19.99;Consumer Staples;16.88;Consumer Discretionary;10.48;IT;3.86;SIX Swiss Exchange;CHF;UKSRT;UKSRT SWIUKSRT;UKSRT.SUKSRTCHFINAV=SOLA;;;;;;;;;;;;;;;;;;;;;;;;;;2;49;12;1;11;5;20
IE00BZ0XVF52;WisdomTree AT1 CoCo Bond UCITS ETF;https://www.justetf.com/en/etf-profile.html?isin=IE00BZ0XVF52;The WisdomTree AT1 CoCo Bond UCITS ETF seeks to track the iBoxx® Contingent Convertible Liquid Developed Europe AT1 index. The iBoxx® Contingent Convertible Liquid Developed Europe AT1 index tracks the performance of financial institutions AT1 contingent convertible debt denominated in EUR, USD and GBP. The index rules aim to offer a good coverage of the Cocobond universe, whilst upholding minimum standards of investability and liquidity. The index consists of ESG (environmental, social and governance) screened bonds. The ETF's TER (total expense ratio) amounts to 0.39% p.a.. The WisdomTree AT1 CoCo Bond UCITS ETF is the only ETF that tracks the iBoxx® Contingent Convertible Liquid Developed Europe AT1 index. The ETF replicates the performance of the underlying index by sampling technique (buying a selection of the most relevant index constituents). The interest income (coupons) in the ETF is distributed to the investors (Semi annually). The WisdomTree AT1 CoCo Bond UCITS ETF is a small ETF with 43m Euro assets under management. The ETF was launched on 14 May 2018 and is domiciled in Ireland.;WisdomTree AT1 Coco Bond UCITS ETF se snaží sledovat index konvertibilní kapaliny IBOXX® kontingentní kapaliny AT1. Index konvertibilní kabriolet IBOXX® Contingent Convertible Liquid Sleduje výkon finančních institucí AT1 podmíněných konvertibilních dluhů denominovaných v EUR, USD a GBP. Cílem pravidel indexu je nabídnout dobré pokrytí vesmíru Cocobond a přitom dodržovat minimální standardy investovatelnosti a likvidity. Index se skládá z ESG (environmentální, sociální a správa věcí veřejných) prověřených dluhopisů. TER (celkový poměr nákladů) ETF činí 0,39% p.a. ETF replikuje výkon základního indexu technikou vzorkování (nákup výběru nejdůležitějších složek indexu). Úrokové výnosy (kupóny) v ETF jsou distribuovány investorům (semifinále každoročně). WisdomTree AT1 Coco Bond UCITS ETF je malý ETF s managementem 43 milionů euro. ETF byl spuštěn 14. května 2018 a je se sídlem v Irsku.;0.39%;0.39;EUR 43m;43.0;EUR;USD;Ireland;WisdomTree;14 May 2018;;Semi annually;Physical;;;;Yes;Dluhopisy;False;Globální;154.0;7.24;16.53;24.05;1.08;7.6;10.83;9.46;0.95;0.48;0.47;-8.79;-22.03;-24.61;-30.03;;;;;Borsa Italiana;CCBO;5;6.03%;6.03;EUR 4.72;4.72;EUR;method2_regex;2025-09-19T10:53:47.687137;success;0;XS2591803841;0.99;XS2678939427;0.94;;;;;;;;;;;;;;;;;Other;45.4;United Kingdom;22.47;France;11.64;Switzerland;11.58;;;;;;;;;;;;;gettex;EUR;WTDI;;;;Borsa Italiana;EUR;CCBO;CCBO IMCCBOEIV;CCBO.MICCBOINAV.DE;;London Stock Exchange;USD;CCBO;CCBO LNCCBOEIV;CCBO.LCCBOINAV.DE;;SIX Swiss Exchange;USD;CCBO;CCBO SWCCBOEIV;CCBO.SCCBOINAV.DE;;XETRA;EUR;WTDI;WTDI GYCCBOEIV;WTDI.DECCBOINAV.DE;;2;48;12;1;11;5;19
IE00BZ0XVG69;WisdomTree AT1 CoCo Bond UCITS ETF USD Acc;https://www.justetf.com/en/etf-profile.html?isin=IE00BZ0XVG69;The WisdomTree AT1 CoCo Bond UCITS ETF USD Acc seeks to track the iBoxx® USD Contingent Convertible Liquid Developed Market AT1 index. The iBoxx® USD Contingent Convertible Liquid Developed Market AT1 index tracks USD-denominated contingent convertible bonds issued worldwide by developed-country banks of all maturities. The ETF's TER (total expense ratio) amounts to 0.39% p.a.. The WisdomTree AT1 CoCo Bond UCITS ETF USD Acc is the only ETF that tracks the iBoxx® USD Contingent Convertible Liquid Developed Market AT1 index. The ETF replicates the performance of the underlying index by sampling technique (buying a selection of the most relevant index constituents). The interest income (coupons) in the ETF is accumulated and reinvested in the ETF. The WisdomTree AT1 CoCo Bond UCITS ETF USD Acc is a very small ETF with 19m Euro assets under management. The ETF was launched on 14 May 2018 and is domiciled in Ireland.;WisdomTree AT1 Coco Bond UCITS ETF USD ACC se snaží sledovat index konvertibilní kapalitelné kapaliny IBOXX® USD. Trh s konvertibilní kapaliční kapalinou IXDX® USD vyvinul index AT1, který sleduje kontingentní konvertibilní dluhopisy denominované USD vydané po celém světě rozvinutými zemědělskými bankami všech splatností. TER (celkový poměr nákladů) ETF činí 0,39% p.a. ETF replikuje výkon základního indexu technikou vzorkování (nákup výběru nejdůležitějších složek indexu). Úrokové výnosy (kupóny) v ETF se nashromáždí a reinvestují do ETF. WisdomTree AT1 Coco Bond UCITS ETF USD ACC je velmi malý ETF s managementem 19m euro. ETF byl spuštěn 14. května 2018 a je se sídlem v Irsku.;0.39%;0.39;EUR 19m;19.0;EUR;USD;Ireland;WisdomTree;14 May 2018;Accumulating;;Physical;;;Bonds, EUR, Europe, Convertible Bonds, All maturities;Yes;Dluhopisy;False;Globální;154.0;7.07;16.33;23.84;0.9;7.59;10.81;9.45;0.93;0.48;0.46;-8.8;-22.03;-24.62;-30.03;;;;;London Stock Exchange;COCB;3;;;;;;;2025-09-19T10:53:55.039438;success;0;XS2591803841;0.99;XS2678939427;0.94;;;;;;;;;;;;;;;;;Other;45.4;United Kingdom;22.47;France;11.64;Switzerland;11.58;;;;;;;;;;;;;London Stock Exchange;USD;COCB;COCB LNCOCBEIV;COCB.LCOCIINAV.DE;;SIX Swiss Exchange;USD;COCB;COCB SWCOCBEIV;COCB.SCOCIINAV.DE;;XETRA;EUR;WTIG;WTIG GYCOCBEIV;WTIG.DECOCIINAV.DE;;;;;;;;;;;;;;2;48;12;1;11;5;19
IE00BZ163G84;Vanguard EUR Corporate Bond UCITS ETF (EUR) Distributing;https://www.justetf.com/en/etf-profile.html?isin=IE00BZ163G84;The Vanguard EUR Corporate Bond UCITS ETF (EUR) Distributing seeks to track the Bloomberg Euro Corporate Bond index. The Bloomberg Euro Corporate Bond index tracks euro-denominated corporate bonds from industrial, utility and financial issuers publicly issued in the Eurobond and eurozone domestic markets. Rating: Investment Grade. The ETF's TER (total expense ratio) amounts to 0.07% p.a.. The Vanguard EUR Corporate Bond UCITS ETF (EUR) Distributing is the cheapest ETF that tracks the Bloomberg Euro Corporate Bond index. The ETF replicates the performance of the underlying index by sampling technique (buying a selection of the most relevant index constituents). The interest income (coupons) in the ETF is distributed to the investors (Monthly). The Vanguard EUR Corporate Bond UCITS ETF (EUR) Distributing is a very large ETF with 2,592m Euro assets under management. The ETF was launched on 24 February 2016 and is domiciled in Ireland.;Distribuce Vanguard EUR Corporate Bond UCITS ETF (EUR) se snaží sledovat index Bloomberg Euro Corporate Bond. Index společnosti Bloomberg Euro Corporate Bond sleduje firemní dluhopisy denominované euro z průmyslových, energetických a finančních emitentů veřejně vydaných na domácím trhu Eurobond a Eurozóny. Hodnocení: Investiční třída. TER (celkový poměr nákladů) činí 0,07% P.A .. Distribuce Vanguard EUR Corporate Bond UCITS ETF (EUR) je nejlevnější ETF, který sleduje index Bloomberg Euro Corporate Bond Index. ETF replikuje výkon základního indexu technikou vzorkování (nákup výběru nejdůležitějších složek indexu). Úrokové výnosy (kupóny) v ETF jsou distribuovány investorům (měsíčně). Distribuce společnosti Vanguard EUR Corporate Bond UCITS ETF (EUR) je velmi velká ETF s spravováním aktiv 2 592 mil. EUR. ETF byla spuštěna 24. února 2016 a je bydliště v Irsku.;0.07%;0.07;EUR 2592m;2592.0;EUR;EUR;Ireland;Vanguard;24 February 2016;Distributing;Monthly;Physical;;;Bonds, EUR, World, Corporate, All maturities;;Dluhopisy;False;Globální;3505.0;4.03;14.26;0.58;2.54;2.67;3.94;3.89;1.51;1.15;0.03;-1.8;-3.76;-17.4;-17.4;;;;;Extracted (method 1);VECP;0;3.18%;3.18;EUR 1.56;1.56;EUR;method2_regex;2025-09-19T10:54:02.022393;success;0;XS2461234622;0.12;BE6285455497;0.12;XS2595028536;0.11;XS2717291970;0.11;XS2908735504;0.11;XS2338643740;0.11;XS1843436228;0.11;XS1400169931;0.11;XS1412711217;0.11;;;Other;51.51;France;15.62;United States;15.01;Netherlands;11.88;Germany;5.98;;;;;;;;;;;;;;;;;;;;;;;;;;;;;;;;;;;;;;;;;5;78;26;13;11;10;18
