LU0292109005;Xtrackers MSCI EM Europe, Middle East and Africa ESG Swap UCITS ETF 1C;https://www.justetf.com/en/etf-profile.html?isin=LU0292109005;The Xtrackers MSCI EM Europe, Middle East and Africa ESG Swap UCITS ETF 1C seeks to track the MSCI Emerging Markets EMEA Low Carbon SRI Selection Capped index. The MSCI Emerging Markets EMEA Low Carbon SRI Selection Capped index tracks large and mid cap companies from emerging markets in the EMEA region (Europe, Middle East and Africa). Only companies with low carbon emissions and a high ESG (environmental, social and governance) rating are considered. The ETF's TER (total expense ratio) amounts to 0.65% p.a.. The Xtrackers MSCI EM Europe, Middle East and Africa ESG Swap UCITS ETF 1C is the only ETF that tracks the MSCI Emerging Markets EMEA Low Carbon SRI Selection Capped index. The ETF replicates the performance of the underlying index synthetically with a swap. The dividends in the ETF are accumulated and reinvested in the ETF. The Xtrackers MSCI EM Europe, Middle East and Africa ESG Swap UCITS ETF 1C is a small ETF with 25m Euro assets under management. The ETF was launched on 19 June 2007 and is domiciled in Luxembourg.;Xtrackers MSCI EM Evropa, Střední východ a Afrika ESG SWAP UCITS ETF 1C se snaží sledovat index selekcí MSCI s nízkým uhlíkem SRI. Rozvíjející se trhy MSCI EMEA Low Carbon SRI Selection Limipped Index indexové sleduje velké a střední společnosti z rozvíjejících se trhů v regionu EMEA (Evropa, Střední východ a Afrika). Zvažují se pouze společnosti s emisemi s nízkým uhlíkem a vysokým hodnocením ESG (environmentální, sociální a správa věcí veřejných). TER (celkový poměr nákladů) činí 0,65% p.a. ETF replikuje výkon podkladového indexu synteticky s výměnou. dividenday v ETF jsou akumulovány a reinvestovány do ETF. Xtrackers MSCI EM Evropa, Střední východ a Afrika ESG SWAP UCITS ETF 1C je malý ETF s 25m euro managementu. ETF byl spuštěn 19. června 2007 a má bydliště v Lucemburku.;0.65%;0.65;EUR 25m;25.0;EUR;USD;Luxembourg;Xtrackers;19 June 2007;;;Synthetic (Unfunded swap);UCITS;MSCI EM Europe;Equity, Emerging Markets, Social/Environmental;Yes;USD    Currency risk  Currency;1;Akcie;False;Rozvíjející se trhy;;19.09;41.21;74.13;13.85;-0.35;12.41;8.89;19.64;-4.5;5.16;17.02;55.37;16.06;15.2;15.81;1.19;0.8;0.74;-16.35;-16.35;-22.46;-60.06;;;;;Stuttgart Stock Exchange;DBX4;5;;;;;;;2025-09-22T00:25:25.173812;success;0;;;;;;;;;;;;;;;;;;;;;;;;;;;;;;;;;;;;;;;;;gettex;EUR;XMEA;;;;Borsa Italiana;EUR;XMEA;XMEA IMXMEANAVS;XMEA.MIXMEAINAVSEK.DE;;London Stock Exchange;USD;XMXD;XMXD LNXMEAINAV;XMXD.LXMEANAV.DE;;Stuttgart Stock Exchange;EUR;DBX4;XMEA GSINXEA;XMEA.SGINXEAINAV.PA;;XETRA;EUR;XMEA;XMEA GY;XMEA.DE;;;;;;;;;;;;;;;;;;;;;;;;;;;;;;;;3;52;6;1;15;10;20
LU0292109187;Xtrackers MSCI Taiwan UCITS ETF 1C;https://www.justetf.com/en/etf-profile.html?isin=LU0292109187;The Xtrackers MSCI Taiwan UCITS ETF 1C seeks to track the MSCI Taiwan 20/35 Custom index. The MSCI Taiwan 20/35 Custom index tracks large- and mid-cap companies from Taiwan. The weight of the largest constituent is constrained to 35% and the weights of all other constituents are constrained to a maximum of 20%. A buffer of 10% is applied on these limits at each index rebalancing. The ETF's TER (total expense ratio) amounts to 0.65% p.a.. The Xtrackers MSCI Taiwan UCITS ETF 1C is the largest ETF that tracks the MSCI Taiwan 20/35 Custom index. The ETF replicates the performance of the underlying index by full replication (buying all the index constituents). The dividends in the ETF are accumulated and reinvested in the ETF. The Xtrackers MSCI Taiwan UCITS ETF 1C has 122m Euro assets under management. The ETF was launched on 19 June 2007 and is domiciled in Luxembourg.;Xtrackers MSCI Tchaj -wan UCITS ETF 1C se snaží sledovat vlastní index MSCI Tchaj -wan 20/35. Vlastní index MSCI Tchaj-wan 20/35 sleduje velké a střední společnosti z Tchaj-wanu. Hmotnost největší složky je omezena na 35% a hmotnosti všech ostatních složek jsou omezeny na maximálně 20%. Na tyto limity se při každém vyvážení indexu použije vyrovnávací paměť 10%. TER (celkový poměr nákladů) činí 0,65% p.a. Xtrackers MSCI Tchaj -wan UCITS ETF 1C je největší ETF, který sleduje vlastní index MSCI 20/35. ETF replikuje výkon podkladového indexu plnou replikací (nákup všech složek indexu). dividenday v ETF jsou akumulovány a reinvestovány do ETF. Xtrackers MSCI Tchaj -wan UCITS ETF 1C má pod správou aktiva 122 milionů euro. ETF byl spuštěn 19. června 2007 a má bydliště v Lucemburku.;0.65%;0.65;EUR 122m;122.0;EUR;USD;Luxembourg;Xtrackers;19 June 2007;;;Physical;UCITS;MSCI Taiwan  1C;Equity, Taiwan;;USD    Currency risk  Currency;1;Akcie;False;Celosvětově;85.0;21.56;68.89;114.12;9.72;4.57;13.39;21.71;37.84;-25.19;24.21;31.97;457.23;25.22;22.09;20.89;0.86;0.86;0.79;-31.35;-31.35;-33.31;-55.74;;;;;Hong Kong Stock Exchange;-;10;;;;;;;2025-09-22T00:25:31.927994;success;0;Hon Hai Precision Industry Co., Ltd.;6.12;MediaTek, Inc.;6.03;Delta Electronics, Inc.;2.97;Quanta Computer, Inc.;2.07;CTBC Financial Holding Co., Ltd.;2.01;Fubon Financial Holding Co., Ltd.;1.94;Cathay Financial Holdings Co., Ltd.;1.69;ASE Technology Holding Co., Ltd.;1.47;MEGA FHC ORD;1.46;;;Other;0.92;;;;;;;;;Financials;16.05;Industrials;2.91;Materials;2.79;;;;;gettex;EUR;DBX5;;;;Borsa Italiana;EUR;XMTW;XMTW IMINXTW;XMTW.MIINXTWINAV.PA;;Hong Kong Stock Exchange;HKD;-;3036 HKXMTWINAV;3036.HKXMTWNAV.DE;;London Stock Exchange;GBX;XMTW;XMTW LNXMTWINVU;XMTW.LXMTWINAVUSD.DE;;London Stock Exchange;USD;XMTD;XMTD LNXMTWINVG;XMTD.LXMTWINAVGBP.DE;;Singapore Stock Exchange;USD;-;XMTW SP;DMTW.SIXMTWUSDINAV=SOLA;;SIX Swiss Exchange;CHF;XMTW;XMTW SW;XMTW.S;;SIX Swiss Exchange;USD;XMTW;;;;Stuttgart Stock Exchange;EUR;DBX5;XMTW GS;XMTW.SG;;XETRA;EUR;DBX5;XMTW GY;XMTW.DE;;3;56;6;5;15;10;20
LU0292109344;Xtrackers MSCI Brazil UCITS ETF 1C 1C;https://www.justetf.com/en/etf-profile.html?isin=LU0292109344;The Xtrackers MSCI Brazil UCITS ETF 1C 1C seeks to track the MSCI Brazil index. The MSCI Brazil index tracks the largest and most liquid Brazilian stocks. The ETF's TER (total expense ratio) amounts to 0.25% p.a.. The Xtrackers MSCI Brazil UCITS ETF 1C 1C is the cheapest ETF that tracks the MSCI Brazil index. The ETF replicates the performance of the underlying index by full replication (buying all the index constituents). The dividends in the ETF are accumulated and reinvested in the ETF. The Xtrackers MSCI Brazil UCITS ETF 1C 1C has 116m Euro assets under management. The ETF was launched on 22 June 2007 and is domiciled in Luxembourg.;Xtrackers MSCI Brazil UCITS ETF 1C 1C se snaží sledovat index Brazil MSCI. Index MSCI Brazílie sleduje největší a nejvíce likvidní brazilské akciíy. TER ETF (celkový poměr výdajů) činí 0,25% p.a. Xtrackers MSCI Brazil UCITS ETF 1C 1C je nejlevnější ETF, který sleduje index MSCI Brazil. ETF replikuje výkon podkladového indexu plnou replikací (nákup všech složek indexu). dividenday v ETF jsou akumulovány a reinvestovány do ETF. Xtrackers MSCI Brazil UCITS ETF 1C 1C má spravování aktiv EURO 116 milionů euro. ETF byl spuštěn 22. června 2007 a je se sídlem v Lucemburku.;0.25%;0.25;EUR 116m;116.0;EUR;USD;Luxembourg;Xtrackers;22 June 2007;;;Physical;UCITS;MSCI Brazil  1C 1C;Equity, Brazil;;USD    Currency risk  Currency;1;Akcie;False;Celosvětově;44.0;4.04;7.25;48.91;23.07;11.62;7.5;8.35;-11.12;20.24;27.14;-25.63;24.29;21.77;24.56;26.59;0.19;0.1;0.31;-16.22;-28.51;-28.51;-69.43;;;;;Stockholm Stock Exchange;-;9;;;;;;;2025-09-22T00:25:38.715541;success;0;Vale SA;9.58;Itaú Unibanco Holding SA;9.16;Petróleo Brasileiro SA;7.43;Petróleo Brasileiro SA;6.56;Banco Bradesco SA;4.06;B3 SA-Brasil, Bolsa, Balcão;3.29;Ambev SA;3.05;WEG SA;3.03;Itausa SA;2.94;;;USA;2.94;Other;2.45;;;;;;;Financials;38.77;Energy;16.39;Materials;13.22;Utilities;10.83;IT;9.16;gettex;EUR;XMBR;;;;Borsa Italiana;EUR;XMBR;XMBR IMINXBR;XMBR.MIINXBRINAV.PA;;London Stock Exchange;GBX;XMBR;XMBR LNXMBRINVU;XMBR.LXMBRINAVUSD.DE;;London Stock Exchange;USD;XMBD;XMBD LNXMBRINAV;XMBD.LXMBRNAV.DE;;SIX Swiss Exchange;CHF;XMBR;XMBR SW;XMBR.S;;SIX Swiss Exchange;USD;XMBR;;;;Stockholm Stock Exchange;SEK;-;XMBR SS;XMBR.ST;;Stuttgart Stock Exchange;EUR;DBX6;XMBR GS;XMBR.SG;;XETRA;EUR;XMBR;XMBR GY;XMBR.DE;;;;;;;;3;60;17;5;15;10;13
LU0292109690;Xtrackers Nifty 50 Swap UCITS ETF 1C;https://www.justetf.com/en/etf-profile.html?isin=LU0292109690;The Xtrackers Nifty 50 Swap UCITS ETF 1C seeks to track the Nifty 50 index. The Nifty 50 index tracks 50 stocks from 22 sectors of the Indian economy. The ETF's TER (total expense ratio) amounts to 0.85% p.a.. The Xtrackers Nifty 50 Swap UCITS ETF 1C is the only ETF that tracks the Nifty 50 index. The ETF replicates the performance of the underlying index synthetically with a swap. The dividends in the ETF are accumulated and reinvested in the ETF. The Xtrackers Nifty 50 Swap UCITS ETF 1C has 172m Euro assets under management. The ETF was launched on 5 July 2007 and is domiciled in Luxembourg.;Xtrackers Nifty 50 Swap UCITS ETF 1C se snaží sledovat index Nifty 50. Nifty 50 Index sleduje 50 akcií z 22 sektorů indické ekonomiky. TER (celkový poměr nákladů) činí 0,85% p.a. Xtrackers Nifty 50 Swap UCITS ETF 1C je jediný ETF, který sleduje index Nifty 50. ETF replikuje výkon podkladového indexu synteticky s výměnou. dividenday v ETF jsou akumulovány a reinvestovány do ETF. Xtrackers Nifty 50 Swap UCITS ETF 1C má 172m euro aktiv pod správou. ETF byl spuštěn 5. července 2007 a je bydliště v Lucemburku.;0.85%;0.85;EUR 172m;172.0;EUR;USD;Luxembourg;Xtrackers;5 July 2007;;;Synthetic (Unfunded swap);UCITS;;Equity, India;;USD    Currency risk  Currency;1;Akcie;False;Celosvětově;;-10.32;9.19;81.82;-7.91;-0.48;-1.5;0.77;31.6;-0.68;14.71;12.04;197.8;15.82;14.17;15.68;-0.65;0.21;0.81;-17.4;-17.4;-17.4;-64.11;;;;;Hong Kong Stock Exchange;-;11;;;;;;;2025-09-22T00:25:45.365851;success;0;;;;;;;;;;;;;;;;;;;;;;;;;;;;;;;;;;;;;;;;;gettex;EUR;DBX7;;;;Borsa Italiana;EUR;XNIF;XNIF IMXNIFNAVS;XNIF.MIXNIFINAVSEK.DE;;Hong Kong Stock Exchange;HKD;-;3015 HK3015INAV;3015.HK3015NAV.HK;;London Stock Exchange;GBX;XNIF;XNIF LNXNIFINVU;XNIF.LXNIFINAVUSD.DE;;London Stock Exchange;USD;XNID;XNID LNXNIFINAV;XNID.LXNIFNAV.DE;;Singapore Stock Exchange;USD;-;XNIF SPXNIFINVG;DNIX.SIXNIFINAVGBP.DE;;SIX Swiss Exchange;CHF;XNIF;XNIF SW;XNIF.S3015HKDINAV=SOLA;;SIX Swiss Exchange;USD;XNIF;;3015HKDINAV=SOLA;;Stockholm Stock Exchange;SEK;-;XNIF SSINXNI;XNIF.STINXNIINAV.PA;;Stuttgart Stock Exchange;EUR;DBX7;XNIF GS;XNIF.SGXNIFUSDINAV=SOLA;;2;45;1;5;15;10;14
LU0292109856;Xtrackers MSCI China A UCITS ETF 1C 1C;https://www.justetf.com/en/etf-profile.html?isin=LU0292109856;The Xtrackers MSCI China A UCITS ETF 1C 1C seeks to track the MSCI China A Inclusion index. The MSCI China A Inclusion index tracks China A-Shares also included in the MSCI Emerging Markets. The ETF's TER (total expense ratio) amounts to 0.35% p.a.. The ETF replicates the performance of the underlying index by full replication (buying all the index constituents). The dividends in the ETF are accumulated and reinvested in the ETF. The Xtrackers MSCI China A UCITS ETF 1C 1C has 109m Euro assets under management. The ETF was launched on 19 June 2007 and is domiciled in Luxembourg.;Xtrackers MSCI China A UCITS ETF 1C 1C se snaží sledovat index inkluzi MSCI. Index inkluze MSCI Čína Stopy China A-Shares také zahrnula na rozvíjejících se trzích MSCI. TER (celkový poměr nákladů) ETF činí 0,35% p.a. ETF replikuje výkon podkladového indexu plnou replikací (nákup všech složek indexu). dividenday v ETF jsou akumulovány a reinvestovány do ETF. Xtrackers MSCI China A UCITS ETF 1C 1C má ve správě aktiv 109 milionů euro. ETF byl spuštěn 19. června 2007 a má bydliště v Lucemburku.;0.35%;0.35;EUR 109m;109.0;EUR;USD;Luxembourg;Xtrackers;19 June 2007;;;Physical;UCITS;MSCI China A  1C 1C;Equity, China;;USD    Currency risk  Currency;1;Akcie;False;Celosvětově;394.0;28.35;18.09;-6.2;6.68;7.04;17.83;7.98;-13.91;-15.1;-16.5;35.32;47.64;24.26;26.35;27.76;1.17;0.22;-0.05;-23.97;-35.58;-54.61;-68.45;;;;;Hong Kong Stock Exchange;-;11;;;;;;;2025-09-22T00:25:53.139354;success;0;Contemporary Amperex Technology Co., Ltd.;2.95;China Merchants Bank Co., Ltd.;2.23;China Yangtze Power Co., Ltd.;1.69;Ping An Insurance (Group) Co. of China Ltd.;1.6;BYD Co., Ltd.;1.43;Agricultural Bank of China Ltd.;1.28;Wuliangye Yibin;1.17;Industrial Bank Co., Ltd.;1.14;Industrial & Commercial Bank of China Ltd.;1.14;;;China;97.77;Other;2.23;;;;;;;Financials;24.52;Technology;15.49;Industrials;14.81;Consumer Staples;11.12;IT;6.68;gettex;EUR;DBX9;;;;Borsa Italiana;EUR;XX25;XX25 IMINX25;XX25.MIINX25INAV.PA;;Hong Kong Stock Exchange;HKD;-;3007 HKXX25INAV;3007.HKXX25NAV.DE;;London Stock Exchange;GBX;XX25;XX25 LNXX25INVG;XX25.LXX25INAVGBP.DE;;London Stock Exchange;USD;XX2D;XX2D LNXX25INVU;XX2D.LXX25INAVUSD.DE;;Singapore Stock Exchange;USD;-;XX25 SP;DFXI.SI3007HKDINAV=SOLA;;SIX Swiss Exchange;CHF;XXXI;XXXI SW;XXXI.S;;SIX Swiss Exchange;USD;XXXI;;;;Stockholm Stock Exchange;SEK;-;XX25 SS;XX25.STXX25USDINAV=SOLA;;Stuttgart Stock Exchange;EUR;DBX9;XX25 GS;XX25.SG;;3;60;12;5;15;10;18
LU0321462870;Xtrackers iTraxx Crossover Short Daily Swap UCITS ETF 1C;https://www.justetf.com/en/etf-profile.html?isin=LU0321462870;The Xtrackers iTraxx Crossover Short Daily Swap UCITS ETF 1C seeks to track the iTraxx® Crossover 5y Short index. The iTraxx® Crossover 5 Year Short index tracks the inverse performance of iTraxx® Crossover 5 Year index on a daily basis. The iTraxx® Crossover 5 Year index is a credit index, that tracks 50 credit derivatives on European corporates in the high yield universe. The ETF's TER (total expense ratio) amounts to 0.24% p.a.. The ETF replicates the performance of the underlying index synthetically with a swap. The interest income (coupons) in the ETF is accumulated and reinvested in the ETF. The Xtrackers iTraxx Crossover Short Daily Swap UCITS ETF 1C is a very small ETF with 18m Euro assets under management. The ETF was launched on 7 November 2007 and is domiciled in Luxembourg.;Xtrackers ITRAXX Crossover Krátký denní swap UCITS ETF 1C se snaží sledovat krátký index ITRAXX® Crossover 5y. Krátký index ITRAXX® Crossover 5 let sleduje inverzní výkon 5letého indexu ITRAXX® Crossover denně. 5letý index ITRAXX® Crossover je úvěrový index, který sleduje 50 úvěrových derivátů na evropských podnicích ve vesmíru s vysokým výnosem. TER (celkový poměr nákladů) ETF činí 0,24% p.a. ETF replikuje výkon podkladového indexu synteticky s výměnou. Úrokové výnosy (kupóny) v ETF se nashromáždí a reinvestují do ETF. Xtrackers ITRAXX Crossover Krátký denní swap UCITS ETF 1C je velmi malý ETF s 18m euro spravovanými aktivy. ETF byl spuštěn 7. listopadu 2007 a má bydliště v Lucemburku.;0.24%;0.24;EUR 18m;18.0;EUR;EUR;Luxembourg;Xtrackers;7 November 2007;;;Synthetic (Unfunded swap);Strategy risk  Short    Sustainability  No;;risk  Short    Sustainability  No;;EUR    Currency risk  Currency;Short    Sustainability  No;Akcie;False;Celosvětově;;-4.81;-21.1;-23.97;-4.35;-0.6;-3.13;-4.04;-7.01;2.04;-10.89;-1.71;-71.1;4.75;5.79;6.26;-1.01;-1.31;-0.85;-8.42;-23.12;-26.03;-76.53;;;;;Stuttgart Stock Exchange;DXST;4;;;;;;;2025-09-22T00:25:59.704063;success;0;;;;;;;;;;;;;;;;;;;;;;;;;;;;;;;;;;;;;;;;;gettex;EUR;XTC5;;;;Stuttgart Stock Exchange;EUR;DXST;;;;Borsa Italiana;EUR;XTC5;XTC5 IM;XTC5.MIXTC5NAV=DBFT;;XETRA;EUR;XTC5;XTC5 GY;XTC5.DE;;;;;;;;;;;;;;;;;;;;;;;;;;;;;;;;;;;;;;3;51;17;1;15;10;8
LU0321462953;Xtrackers II J.P. Morgan USD Emerging Markets Bond UCITS ETF 1C - EUR Hedged;https://www.justetf.com/en/etf-profile.html?isin=LU0321462953;The Xtrackers II J.P. Morgan USD Emerging Markets Bond UCITS ETF 1C - EUR Hedged seeks to track the JP Morgan Emerging Markets Bond Index Global Diversified 1Bn Country (EUR Hedged) index. The JP Morgan Emerging Markets Bond Index Global Diversified 1Bn Country (EUR Hedged) index tracks US dollar-denominated bonds issued by public and quasi-sovereign entities in emerging markets. Currency hedged to Euro (EUR). The ETF's TER (total expense ratio) amounts to 0.40% p.a.. The Xtrackers II J.P. Morgan USD Emerging Markets Bond UCITS ETF 1C - EUR Hedged is the cheapest and largest ETF that tracks the JP Morgan Emerging Markets Bond Index Global Diversified 1Bn Country (EUR Hedged) index. The ETF replicates the performance of the underlying index by sampling technique (buying a selection of the most relevant index constituents). The interest income (coupons) in the ETF is accumulated and reinvested in the ETF. The Xtrackers II J.P. Morgan USD Emerging Markets Bond UCITS ETF 1C - EUR Hedged has 168m Euro assets under management. The ETF was launched on 6 May 2008 and is domiciled in Luxembourg.;The Xtrackers II J.P. Morgan USD Emerging Markets Bond UCITS ETF 1C - EUR Hedged se snaží sledovat index Emerging Bond Index JP Morgan Emerging Bond Global Diversified 1bn Country (EUR Hedged). Index indexu JP Morgan Emerging Markets Bond Index Global Diversified 1bn Country (EUR Hedged) Index sleduje americké dluhopisy denominované dolarem vydané veřejnými a kvazi-sovereign subjekty na rozvíjejících se trzích. Měna zajišťovala euro (EUR). TER (celkový poměr výdajů) činí 0,40% P.A .. The Xtrackers II J.P. Morgan USD Emerging Markets Bond UCITS ETF 1C - EUR Hedged je nejlevnější a největší ETF, který sleduje jp Morgan Emerging Markets Index index globální diverzifikované 1BN země (EUR HEDGED) Index. ETF replikuje výkon základního indexu technikou vzorkování (nákup výběru nejdůležitějších složek indexu). Úrokové výnosy (kupóny) v ETF se nashromáždí a reinvestují do ETF. The Xtrackers II J.P. Morgan USD Emerging Markets Bond UCITS ETF 1C - EUR Hedged má pod správou aktiva 168 milionů EUR. ETF byla spuštěna 6. května 2008 a je bydliště v Lucemburku.;0.40%;0.4;EUR 168m;168.0;EUR;EUR;Luxembourg;Xtrackers;6 May 2008;;;Physical;UCITS;;Bonds, USD, Emerging Markets, Government, All maturities;;EUR    Currency risk  Currency;1;Dluhopisy;False;Rozvíjející se trhy;875.0;4.98;23.01;-5.06;8.04;1.52;5.06;6.08;-3.55;-21.49;7.95;4.06;53.51;5.93;8.67;8.93;0.84;0.82;-0.12;-6.06;-8.61;-31.8;-32.12;;;;;Stuttgart Stock Exchange;DXSU;4;;;;;;;2025-09-22T00:26:06.237531;success;0;XS2214238441;0.61;XS2893151287;0.39;XS1750114396;0.36;;;;;;;;;;;;;;;Other;83.42;;;;;;;;;;;;;;;;;;;gettex;EUR;XEMB;;;;Stuttgart Stock Exchange;EUR;DXSU;;;;Borsa Italiana;EUR;XEMB;XEMB IM;XEMB.MIXEMBNAV=DBFT;;XETRA;EUR;XEMB;XEMB GY;XEMB.DE;;;;;;;;;;;;;;;;;;;;;;;;;;;;;;;;;;;;;;3;62;12;5;15;10;20
LU0321463258;Xtrackers Short iBoxx EUR Sovereigns Eurozone Daily Swap UCITS ETF 1C;https://www.justetf.com/en/etf-profile.html?isin=LU0321463258;The Xtrackers Short iBoxx EUR Sovereigns Eurozone Daily Swap UCITS ETF 1C seeks to track the iBoxx® EUR Sovereigns Eurozone Short index. The iBoxx® EUR Sovereigns Eurozone Short index tracks the inverse performance of the iBoxx EUR Sovereigns Eurozone index on a daily basis. The iBoxx EUR Sovereigns Eurozone index tracks all Euro denominated government bonds issued by eurozone governments. The ETF's TER (total expense ratio) amounts to 0.15% p.a.. The ETF replicates the performance of the underlying index synthetically with a swap. The interest income (coupons) in the ETF is accumulated and reinvested in the ETF. The Xtrackers Short iBoxx EUR Sovereigns Eurozone Daily Swap UCITS ETF 1C is a very small ETF with 10m Euro assets under management. The ETF was launched on 6 May 2008 and is domiciled in Luxembourg.;Xtrackers krátký iBoxx EUR Sovereigns Eurozóna Denní swap UCITS ETF 1C se snaží sledovat krátký index eurozóny IBOXX® EUR Sovereigns. Krátký index Eurozóny Eurozóny IBOXX® EUR sleduje inverzní výkon indexu eurozóny IBOXX EUR denně. Index Eurozóny IBOXX EUR STONEIGNS SLEDUJE VLÁDNÍ DOBROVACÍ DOBROVANÝCH DOBRŮ EUR vydaných vládami eurozóny. ETF TER (celkový poměr nákladů) činí 0,15% p.a. ETF replikuje výkon podkladového indexu synteticky s výměnou. Úrokové výnosy (kupóny) v ETF se nashromáždí a reinvestují do ETF. Xtrackers krátký IBOXX EUR Sovereigns Eurozóna denně swap UCITS ETF 1C je velmi malý ETF s spravováním 10 milionů euro. ETF byla spuštěna 6. května 2008 a je bydliště v Lucemburku.;0.15%;0.15;EUR 10m;10.0;EUR;EUR;Luxembourg;Xtrackers;6 May 2008;;;Synthetic (Unfunded swap);Strategy risk  Short    Sustainability  No;;Bonds, EUR, Europe, Government, All maturities;;EUR    Currency risk  Currency;Short    Sustainability  No;Dluhopisy;False;Evropa;;4.04;12.16;28.8;2.65;0.0;1.25;-0.06;1.83;21.15;-1.36;5.23;-28.2;4.34;6.25;6.05;0.93;0.62;0.86;-2.54;-7.0;-7.86;-47.64;;;;;gettex;DXSV;4;;;;;;;2025-09-22T00:26:13.423143;success;0;;;;;;;;;;;;;;;;;;;;;;;;;;;;;;;;;;;;;;;;;gettex;EUR;DXSV;;;;Stuttgart Stock Exchange;EUR;DXSV;;;;Borsa Italiana;EUR;XSGL;XSGL IM;XSGL.MI;;XETRA;EUR;DXSV;XSGL GY;XSGL.DE;;;;;;;;;;;;;;;;;;;;;;;;;;;;;;;;;;;;;;4;66;22;1;15;10;18
LU0321463506;Xtrackers iBoxx Germany Covered Swap UCITS ETF 1C;https://www.justetf.com/en/etf-profile.html?isin=LU0321463506;The Xtrackers iBoxx Germany Covered Swap UCITS ETF 1C seeks to track the iBoxx® EUR Germany Covered index. The iBoxx® EUR Germany Covered index tracks Euro denominated covered bonds of all maturities issued by the German government. The ETF's TER (total expense ratio) amounts to 0.15% p.a.. The Xtrackers iBoxx Germany Covered Swap UCITS ETF 1C is the only ETF that tracks the iBoxx® EUR Germany Covered index. The ETF replicates the performance of the underlying index synthetically with a swap. The interest income (coupons) in the ETF is accumulated and reinvested in the ETF. The Xtrackers iBoxx Germany Covered Swap UCITS ETF 1C is a small ETF with 23m Euro assets under management. The ETF was launched on 10 October 2007 and is domiciled in Luxembourg.;Německo Xtrackers IBOXX Covered Swap UCITS ETF 1C se snaží sledovat index krytýho Německa IBOXX® EUR. Německo IBOXX® EUR zahrnovalo indexové stopy euro denominované kryté dluhopisy všech splatností vydané německou vládou. TER (celkový poměr nákladů) ETF činí 0,15% p.a. Xtrackers Iboxx Německo zakryté Swap UCITS ETF 1C je jediným ETF, který sleduje index krytý německý IBOXX® EUR. ETF replikuje výkon podkladového indexu synteticky s výměnou. Úrokové výnosy (kupóny) v ETF se nashromáždí a reinvestují do ETF. Xtrackers IBOXX Německo zakryté Swap UCITS ETF 1C je malý ETF s managementem 23 milionů euro. ETF byl spuštěn 10. října 2007 a je byd v Lucemburku.;0.15%;0.15;EUR 23m;23.0;EUR;EUR;Luxembourg;Xtrackers;10 October 2007;;;Synthetic (Unfunded swap);UCITS;;Bonds, EUR, Germany, Covered Bonds, All maturities;;EUR    Currency risk  Currency;1;Dluhopisy;False;Celosvětově;;2.72;7.84;-6.17;2.08;0.35;0.61;2.22;-2.07;-13.42;5.3;2.78;34.25;2.14;3.5;3.5;1.27;0.73;-0.36;-1.56;-3.48;-15.97;-16.57;;;;;Stuttgart Stock Exchange;DXSW;3;;;;;;;2025-09-22T00:26:20.666931;success;0;;;;;;;;;;;;;;;;;;;;;;;;;;;;;;;;;;;;;;;;;gettex;EUR;XBCT;;;;Stuttgart Stock Exchange;EUR;DXSW;;;;XETRA;EUR;XBCT;XBCT GYXBCTEUIV;XBCT.DEXBCTINAV=SOLA;;;;;;;;;;;;;;;;;;;;;;;;;;;;;;;;;;;;;;;;;;;;3;64;22;1;15;10;16
LU0321464652;Xtrackers II GBP Overnight Rate Swap UCITS ETF 1D 1D;https://www.justetf.com/en/etf-profile.html?isin=LU0321464652;The Xtrackers II GBP Overnight Rate Swap UCITS ETF 1D 1D seeks to track the Solactive SONIA Daily index. The Solactive SONIA Daily index tracks a daily rolled deposit earning at the SONIA (the Sterling Overnight Index Average) rate, which is the short-term money market reference in the UK. The Sterling Overnight Index Average is the weighted average rate of all unsecured sterling overnight cash transactions brokered in London by WMBA member firms. The ETF's TER (total expense ratio) amounts to 0.10% p.a.. The Xtrackers II GBP Overnight Rate Swap UCITS ETF 1D 1D is the only ETF that tracks the Solactive SONIA Daily index. The ETF replicates the performance of the underlying index synthetically with a swap. The Xtrackers II GBP Overnight Rate Swap UCITS ETF 1D 1D has 148m Euro assets under management. The ETF was launched on 10 October 2007 and is domiciled in Luxembourg.;Xtrackers II GBP přes noc SWAP UCITS ETF 1D 1D se snaží sledovat index Solactive Sonia Daily. Index Solactive Sonia Denní index sleduje denní výdělky v sazbě Sonia (průměr Sterling Overnight), což je krátkodobý odkaz na peněžní trh ve Velké Británii. Průměr indexu Sterling přes noc je vážená průměrná sazba všech nezajištěných Sterlingových přenocových hotovostních transakcí zprostředkovaných v Londýně členskými firmami WMBA. TER (celkový poměr nákladů) činí 0,10% p.a. Xtrackers II GBP přes noc Swap UCITS ETF 1D 1D je jediný ETF, který sleduje solaraktivní index Sonia Daily. ETF replikuje výkon podkladového indexu synteticky s výměnou. Xtrackers II GBP přes noc Swap UCITS ETF 1D 1D má 148m euro aktiv správy. ETF byl spuštěn 10. října 2007 a je byd v Lucemburku.;0.10%;0.1;EUR 148m;148.0;EUR;GBP;Luxembourg;Xtrackers;10 October 2007;;Annually;Synthetic (Unfunded swap);UCITS;;Money Market, GBP, United Kingdom;;GBP    Currency risk  Currency;1;Akcie;False;Celosvětově;;0.68;14.92;20.07;-1.88;-0.5;-0.97;-1.46;6.89;-4.08;6.66;10.19;16.51;5.02;5.44;5.79;0.14;0.87;0.64;-4.34;-4.34;-8.22;-26.71;;;;;gettex;DXS1;5;4.80%;4.8;EUR 9.95;9.95;EUR;method2_regex;2025-09-22T00:26:28.758804;success;0;;;;;;;;;;;;;;;;;;;;;;;;;;;;;;;;;;;;;;;;;gettex;EUR;DXS1;;;;Stuttgart Stock Exchange;EUR;DXS1;;;;Borsa Italiana;EUR;XSTR;XSTR IM;XSTR.MI;;London Stock Exchange;GBX;XSTR;XSTR LNINXST;XSTR.LINXSTINAV.PA;;XETRA;EUR;DXS1;XSTR GY;XSTR.DE;;;;;;;;;;;;;;;;;;;;;;;;;;;;;;;;4;74;26;5;15;10;18
