isin;name;url;description_en;description_cs;ter;ter_numeric;fund_size;fund_size_numeric;fund_size_currency;fund_currency;fund_domicile;fund_provider;inception_date;distribution_policy;distribution_frequency;replication;legal_structure;index_name;investment_focus;sustainability;currency_risk;strategy_risk;category;is_leveraged;region;total_holdings;return_1y;return_3y;return_5y;return_ytd;return_1m;return_3m;return_6m;return_2021;return_2022;return_2023;return_2024;return_inception;volatility_1y;volatility_3y;volatility_5y;return_per_risk_1y;return_per_risk_3y;return_per_risk_5y;max_drawdown_1y;max_drawdown_3y;max_drawdown_5y;max_drawdown_inception;beta;correlation;tracking_error;information_ratio;primary_exchange;primary_ticker;total_exchanges;current_dividend_yield;current_dividend_yield_numeric;dividends_12m;dividends_12m_numeric;dividends_12m_currency;dividend_extraction_method;scraping_date;scraping_status;retry_count;holding_1_name;holding_1_weight;holding_2_name;holding_2_weight;holding_3_name;holding_3_weight;holding_4_name;holding_4_weight;holding_5_name;holding_5_weight;holding_6_name;holding_6_weight;holding_7_name;holding_7_weight;holding_8_name;holding_8_weight;holding_9_name;holding_9_weight;holding_10_name;holding_10_weight;country_1_name;country_1_weight;country_2_name;country_2_weight;country_3_name;country_3_weight;country_4_name;country_4_weight;country_5_name;country_5_weight;sector_1_name;sector_1_weight;sector_2_name;sector_2_weight;sector_3_name;sector_3_weight;sector_4_name;sector_4_weight;sector_5_name;sector_5_weight;exchange_1_name;exchange_1_currency;exchange_1_ticker;exchange_1_bloomberg;exchange_1_reuters;exchange_1_market_maker;exchange_2_name;exchange_2_currency;exchange_2_ticker;exchange_2_bloomberg;exchange_2_reuters;exchange_2_market_maker;exchange_3_name;exchange_3_currency;exchange_3_ticker;exchange_3_bloomberg;exchange_3_reuters;exchange_3_market_maker;exchange_4_name;exchange_4_currency;exchange_4_ticker;exchange_4_bloomberg;exchange_4_reuters;exchange_4_market_maker;exchange_5_name;exchange_5_currency;exchange_5_ticker;exchange_5_bloomberg;exchange_5_reuters;exchange_5_market_maker;exchange_6_name;exchange_6_currency;exchange_6_ticker;exchange_6_bloomberg;exchange_6_reuters;exchange_6_market_maker;exchange_7_name;exchange_7_currency;exchange_7_ticker;exchange_7_bloomberg;exchange_7_reuters;exchange_7_market_maker;exchange_8_name;exchange_8_currency;exchange_8_ticker;exchange_8_bloomberg;exchange_8_reuters;exchange_8_market_maker;exchange_9_name;exchange_9_currency;exchange_9_ticker;exchange_9_bloomberg;exchange_9_reuters;exchange_9_market_maker;exchange_10_name;exchange_10_currency;exchange_10_ticker;exchange_10_bloomberg;exchange_10_reuters;exchange_10_market_maker;rating;rating_score;rating_ter_score;rating_size_score;rating_track_record_score;rating_provider_score;rating_performance_score
IE00B910VR50;SPDR MSCI EMU UCITS ETF;https://www.justetf.com/en/etf-profile.html?isin=IE00B910VR50;The SPDR MSCI EMU UCITS ETF seeks to track the MSCI EMU index. The MSCI EMU index tracks large and mid cap stocks from countries in the European Economic and Monetary Union. The ETF's TER (total expense ratio) amounts to 0.18% p.a.. The ETF replicates the performance of the underlying index by full replication (buying all the index constituents). The dividends in the ETF are accumulated and reinvested in the ETF. The SPDR MSCI EMU UCITS ETF has 270m Euro assets under management. The ETF was launched on 25 January 2013 and is domiciled in Ireland.;SPDR MSCI EMU UCITS ETF se snaží sledovat index MSCI EMU. Index MSCI EMU sleduje velké a střední kapitálové akciíy ze zemí Evropské hospodářské a měnové unie. TER (celkový poměr nákladů) ETF činí 0,18% p.a. ETF replikuje výkon podkladového indexu plnou replikací (nákup všech složek indexu). dividenday v ETF jsou akumulovány a reinvestovány do ETF. SPDR MSCI EMU UCITS ETF má ve správě aktiv 270 milionů EUR. ETF byl spuštěn 25. ledna 2013 a je se sídlem v Irsku.;0.18%;0.18;EUR 270m;270.0;EUR;EUR;Ireland;SPDR ETF;25 January 2013;;;Physical;UCITS;MSCI EMU;Equity, Europe;;EUR    Currency risk  Currency;1;Akcie;False;Evropa;219.0;17.03;66.05;86.85;16.41;-1.14;4.46;4.94;22.51;-12.08;19.11;9.86;188.64;15.54;14.06;15.85;1.1;1.31;0.84;-15.22;-15.22;-24.42;-37.9;;;;;Euronext Paris;EMUE;8;;;;;;;2025-09-24T00:42:12.680588;success;0;ASML Holding NV;4.17;Siemens AG;2.98;Allianz SE;2.32;LVMH Moët Hennessy Louis Vuitton SE;2.25;Schneider Electric SE;2.16;Banco Santander SA;2.0;Deutsche Telekom AG;1.89;TotalEnergies SE;1.84;Safran SA;1.83;;;France;28.64;Germany;28.62;Other;19.37;Netherlands;14.4;;;Financials;23.55;Industrials;20.23;Technology;12.8;Consumer Discretionary;11.51;;;gettex;EUR;ZPRE;;;;Stuttgart Stock Exchange;EUR;ZPRE;;;;Borsa Italiana;EUR;EURO;EURO IMINZPRE;EURO.MIINZPRE.ivOQ;;Euronext Paris;EUR;EMUE;EMUE FPINZPRE;EMUE.PAINZPRE.ivOQ;;London Stock Exchange;EUR;EURO;EURO LNINZPRE;EURO.LINZPRE.ivOQ;;London Stock Exchange;GBP;EMUE;EMUE LNINZPRP;EMUE.LINZPRE.ivOQ;;SIX Swiss Exchange;CHF;EURO;EURO SEINZPRC;EURO.SINZPRE.ivOQ;;XETRA;EUR;ZPRE;ZPRE GYINZPRE;ZPRE.DEINZPRE.ivOQ;;;;;;;;;;;;;;4;65;17;5;13;10;20
IE00B945VV12;Vanguard FTSE Developed Europe UCITS ETF Distributing;https://www.justetf.com/en/etf-profile.html?isin=IE00B945VV12;The Vanguard FTSE Developed Europe UCITS ETF Distributing seeks to track the FTSE Developed Europe index. The FTSE Developed Europe index tracks large and mid cap stocks from developed countries in Europe. The ETF's TER (total expense ratio) amounts to 0.10% p.a.. The Vanguard FTSE Developed Europe UCITS ETF Distributing is the cheapest and largest ETF that tracks the FTSE Developed Europe index. The ETF replicates the performance of the underlying index by full replication (buying all the index constituents). The dividends in the ETF are distributed to the investors (Quarterly). The Vanguard FTSE Developed Europe UCITS ETF Distributing is a very large ETF with 3,796m Euro assets under management. The ETF was launched on 21 May 2013 and is domiciled in Ireland.;Vanguard FTSE vyvinula Europe UCITS ETF distribuující usiluje o sledování indexu vyvinutého Evropy FTSE. FTSE vyvinula index Evropy, které sleduje velké a střední kapitálové akciíy z rozvinutých zemí v Evropě. TER (celkový poměr nákladů) ETF činí 0,10% P.A. Vanguard FTSE vyvinul Europe UCITS ETF distribuující je nejlevnější a největší ETF, který sleduje index Evropy FTSE. ETF replikuje výkon podkladového indexu plnou replikací (nákup všech složek indexu). dividenday v ETF jsou distribuovány investorům (čtvrtletně). Vanguard FTSE vyvinula Europe UCITS ETF distribuující je velmi velký ETF s managementem 3 796 milionů euro. ETF byl spuštěn 21. května 2013 a je se sídlem v Irsku.;0.10%;0.1;EUR 3796m;3796.0;EUR;EUR;Ireland;Vanguard;21 May 2013;Distributing;Quarterly;Physical;UCITS;FTSE Developed Europe  Distributing;Equity, Europe;;EUR    Currency risk  Currency;1;Akcie;False;Evropa;522.0;11.11;51.84;79.96;11.82;-1.06;3.75;2.96;25.2;-9.98;16.51;9.38;151.08;13.97;12.51;13.93;0.8;1.19;0.89;-16.4;-16.4;-20.17;-35.4;;;;;Bolsa Mexicana de Valores;-;11;2.96%;2.96;EUR 1.27;1.27;EUR;method2_regex;2025-09-24T00:42:18.657384;success;0;ASML Holding NV;2.2;AstraZeneca PLC;1.79;Roche Holding AG;1.77;Nestlé SA;1.76;Novartis AG;1.73;HSBC Holdings Plc;1.72;Shell Plc;1.71;Siemens AG;1.5;Novo Nordisk A/S;1.22;;;Other;35.66;United Kingdom;21.2;Germany;14.9;France;14.34;Switzerland;13.9;Financials;22.69;Industrials;18.38;Health Care;10.11;Consumer Staples;9.35;;;Euronext Paris;EUR;VEUR;;;;gettex;EUR;VGEU;;;;Stuttgart Stock Exchange;EUR;VGEU;;;;Bolsa Mexicana de Valores;USD;-;VEUDN MM;VEUDN.MX;;Borsa Italiana;EUR;VEUR;IVEUR;;;Frankfurt Stock Exchange;EUR;-;IVEUR;;;Euronext Amsterdam;EUR;VEUR;VEUR NAIVEUREUR;VEUR.AS;;London Stock Exchange;USD;VEUD;VEUD LNIVEUDUSD;VEUD.L;;London Stock Exchange;GBP;VEUR;VEUR LNIVEURGBP;VEUR.L;;SIX Swiss Exchange;CHF;VEUR;VEUR SWIVEURCHF;VEUR.S;;5;82;26;13;13;10;20
IE00B94ZB998;Invesco Morningstar US Energy Infrastructure MLP UCITS ETF Acc;https://www.justetf.com/en/etf-profile.html?isin=IE00B94ZB998;The Invesco Morningstar US Energy Infrastructure MLP UCITS ETF Acc seeks to track the Morningstar MLP Composite index. The Morningstar MLP Composite index tracks U.S. Master Limited Partnerships (MLPs) which operate in US energy infrastructure. The ETF's TER (total expense ratio) amounts to 0.50% p.a.. The Invesco Morningstar US Energy Infrastructure MLP UCITS ETF Acc is the cheapest ETF that tracks the Morningstar MLP Composite index. The ETF replicates the performance of the underlying index synthetically with a swap. The dividends in the ETF are accumulated and reinvested in the ETF. The Invesco Morningstar US Energy Infrastructure MLP UCITS ETF Acc is a small ETF with 49m Euro assets under management. The ETF was launched on 15 May 2013 and is domiciled in Ireland.;Energetická infrastruktura Invesco Morningstar MLP UCITS ETF ACC se snaží sledovat kompozitní index Morningstar MLP. Indexová index MLINYStar MLP Stojí americké partnerství v USA Master Limited (MLPS), která působí v americké energetické infrastruktuře. TER (celkový poměr nákladů) ETF činí 0,50% P.A .. Invesco Morningstar US Energy Infrastructure MLP UCITS ETF ACC ACC je nejlevnější ETF, který sleduje kompozitní index Morningstar MLP. ETF replikuje výkon podkladového indexu synteticky s výměnou. dividenday v ETF jsou akumulovány a reinvestovány do ETF. Infrastruktura Invesco Morningstar US Energy Infrastructure MLP UCITS ETF ACC je malá ETF s managementem 49 milionů euro. ETF byla spuštěna 15. května 2013 a je v Irsku bydlí.;0.50%;0.5;EUR 49m;49.0;EUR;USD;Ireland;Invesco;15 May 2013;Accumulating;;Synthetic (Unfunded swap);UCITS;;Equity, United States, Energy;;USD    Currency risk  Currency;1;Akcie;False;Severní Amerika;;1.59;28.13;227.57;-10.94;-4.37;-6.4;-15.14;49.63;38.8;14.47;30.78;44.91;21.36;18.67;22.46;0.07;0.46;1.19;-19.8;-19.8;-19.8;-79.4;;;;;London Stock Exchange;-;7;;;;;;;2025-09-24T00:42:25.054444;success;0;;;;;;;;;;;;;;;;;;;;;;;;;;;;;;;;;;;;;;;;;London Stock Exchange;GBX;MLPQ;;;;gettex;EUR;SMLP;;;;Borsa Italiana;EUR;MLPS;MLPS IMINMLPS;MLPS.MI274JINAV.DE;;London Stock Exchange;USD;MLPS;MLPS LNINMLPS;MLPS.L274JINAV.DE;;London Stock Exchange;GBP;-;MLPQ LNINMLPS;MLPQ.L274JINAV.DE;;SIX Swiss Exchange;USD;MLPS;MLPS SWINMLPS;MLPS.S274JINAV.DE;;XETRA;EUR;SMLP;SMLP GYINMLPA;SML2.DE274IINAV.DE;;;;;;;;;;;;;;;;;;;;3;55;12;1;13;10;19
IE00B95PGT31;Vanguard FTSE Japan UCITS ETF Distributing;https://www.justetf.com/en/etf-profile.html?isin=IE00B95PGT31;The Vanguard FTSE Japan UCITS ETF Distributing seeks to track the FTSE Japan index. The FTSE Japan index tracks Japanese large and mid cap stocks. The ETF's TER (total expense ratio) amounts to 0.15% p.a.. The Vanguard FTSE Japan UCITS ETF Distributing is the largest ETF that tracks the FTSE Japan index. The ETF replicates the performance of the underlying index by full replication (buying all the index constituents). The dividends in the ETF are distributed to the investors (Quarterly). The Vanguard FTSE Japan UCITS ETF Distributing is a very large ETF with 2,128m Euro assets under management. The ETF was launched on 21 May 2013 and is domiciled in Ireland.;Distribuce Vanguard FTSE Japan UCITS ETF se snaží sledovat index FTSE Japan. Index FTSE Japan sleduje japonské velké a střední kapitálové akciíy. TER (celkový poměr nákladů) ETF činí 0,15% p.a. Distribuování Vanguard FTSE Japan UCITS je největší ETF, který sleduje index Japan FTSE. ETF replikuje výkon podkladového indexu plnou replikací (nákup všech složek indexu). dividenday v ETF jsou distribuovány investorům (čtvrtletně). Distribuce Vanguard FTSE Japan UCITS ETF je velmi velká ETF s managementem 2 128 milionů euro. ETF byl spuštěn 21. května 2013 a je se sídlem v Irsku.;0.15%;0.15;EUR 2128m;2128.0;EUR;USD;Ireland;Vanguard;21 May 2013;Distributing;Quarterly;Physical;UCITS;FTSE Japan  Distributing;Equity, Japan;;USD    Currency risk  Currency;1;Akcie;False;Evropa;484.0;12.73;40.47;50.51;7.37;0.14;10.56;5.71;9.5;-10.69;15.36;14.49;133.06;22.44;20.92;19.34;0.57;0.57;0.44;-18.88;-18.88;-20.04;-26.79;;;;;Bolsa Mexicana de Valores;-;11;1.86%;1.86;EUR 0.68;0.68;EUR;method2_regex;2025-09-24T00:42:33.069945;success;0;Mitsubishi UFJ Financial Group, Inc.;3.24;Sony Group Corp.;3.06;Hitachi Ltd.;2.85;Sumitomo Mitsui Financial Group, Inc.;1.97;Nintendo Co., Ltd.;1.76;Recruit Holdings Co., Ltd.;1.69;Tokyo Electron Ltd.;1.67;Mitsubishi Heavy Industries, Ltd.;1.61;SoftBank Group Corp.;1.6;;;Japan;98.76;Other;1.24;;;;;;;Industrials;24.62;Consumer Discretionary;17.34;Financials;14.62;Technology;12.48;;;Euronext Paris;EUR;VJPN;;;;gettex;EUR;VJPN;;;;Stuttgart Stock Exchange;EUR;VJPN;;;;Bolsa Mexicana de Valores;USD;-;VDJPN MM;VDJPN.MX;;Borsa Italiana;EUR;VJPN;IVJPN;;;Frankfurt Stock Exchange;EUR;-;IVJPN;;;Euronext Amsterdam;EUR;VJPN;VJPN NAIVJPNEUR;VJPN.AS;;London Stock Exchange;USD;VDJP;VDJP LNIVDJPUSD;VDJP.L;;London Stock Exchange;GBP;VJPN;VJPN LNIVJPNGBP;VJPN.L;;SIX Swiss Exchange;CHF;VJPN;VJPN SWIVJPNCHF;VJPN.S;;5;78;22;13;13;10;20
IE00B979GK47;SPDR S&P U.S. Dividend Aristocrats UCITS ETF EUR Hedged (Dist);https://www.justetf.com/en/etf-profile.html?isin=IE00B979GK47;The SPDR S&P U.S. Dividend Aristocrats UCITS ETF EUR Hedged (Dist) seeks to track the S&P High Yield Dividend Aristocrats (EUR Hedged) index. The S&P High Yield Dividend Aristocrats (EUR Hedged) index tracks the stocks of the S&P Composite 1500 index that have increased dividends every year for at least 20 consecutive years. Currency Hedged to Euro (EUR). The ETF's TER (total expense ratio) amounts to 0.40% p.a.. The SPDR S&P U.S. Dividend Aristocrats UCITS ETF EUR Hedged (Dist) is the only ETF that tracks the S&P High Yield Dividend Aristocrats (EUR Hedged) index. The ETF replicates the performance of the underlying index by full replication (buying all the index constituents). The dividends in the ETF are distributed to the investors (Quarterly). The SPDR S&P U.S. Dividend Aristocrats UCITS ETF EUR Hedged (Dist) is a small ETF with 40m Euro assets under management. The ETF was launched on 14 June 2019 and is domiciled in Ireland.;SPDR S&P US dividenda Aristocrats UCITS ETF EUR HEDGED (DIST) se snaží sledovat index dividenda S&P s vysokým výnosem (EUR Hedged). Aristokraté s vysokým výnosem S&P (EUR Hedged) index sleduje akcie indexu S&P Composite 1500, který každý rok zvyšuje dividenday po dobu nejméně 20 po sobě jdoucích let. Měna zajišťovala euro (EUR). Ter (celkový poměr nákladů) ETF činí 0,40% p.a. SPDR S&P US dividenda Aristocrats UCITS ETF EUR HEDGED (DIST) je jediný ETF, který sleduje index dividenda S&P s vysokým výnosem aristokratů (EUR hedged). ETF replikuje výkon podkladového indexu plnou replikací (nákup všech složek indexu). dividenday v ETF jsou distribuovány investorům (čtvrtletně). SPDR S&P US dividenda Aristocrats UCITS ETF EUR Hedged (Dist) je malý ETF s spravováním 40 milionů euro. ETF byl spuštěn 14. června 2019 a je se sídlem v Irsku.;0.40%;0.4;EUR 40m;40.0;EUR;EUR;Ireland;SPDR ETF;14 June 2019;Distributing;Quarterly;Physical;UCITS;;Equity, United States, Dividend;;EUR    Currency risk  Currency;1;Akcie;False;Severní Amerika;149.0;-1.59;16.3;49.87;4.34;-4.34;3.13;2.94;24.25;-4.5;-1.0;5.65;37.14;15.57;15.91;16.75;-0.1;0.32;0.5;-15.43;-16.51;-18.56;-36.88;;;;;gettex;SPPD;4;2.03%;2.03;EUR 0.17;0.17;EUR;method2_regex;2025-09-24T00:42:41.391186;success;0;Realty Income;2.38;Chevron Corp.;2.04;Target;1.93;PepsiCo, Inc.;1.81;Kimberly-Clark Corp.;1.67;Kenvue;1.64;Exxon Mobil Corp.;1.63;AbbVie, Inc.;1.54;Consolidated Edison;1.51;;;United States;93.36;Other;3.54;United Kingdom;1.51;;;;;Industrials;17.65;Utilities;15.4;Consumer Staples;14.21;Financials;10.12;;;gettex;EUR;SPPD;;;;Stuttgart Stock Exchange;EUR;SPPD;;;;Borsa Italiana;EUR;USDE;USDE IMINSPPD;USDE.MI;;XETRA;EUR;SPPD;SPPD GYINSPPD;SPPD.DE;;;;;;;;;;;;;;;;;;;;;;;;;;;;;;;;;;;;;;3;50;12;1;8;10;19
IE00B988C465;iShares Global High Yield Corp Bond CHF Hedged UCITS ETF (Dist);https://www.justetf.com/en/etf-profile.html?isin=IE00B988C465;The iShares Global High Yield Corp Bond CHF Hedged UCITS ETF (Dist) seeks to track the iBoxx® Global Developed Markets Liquid High Yield Capped (CHF Hedged) index. The iBoxx® Global Developed Markets Liquid High Yield Capped (CHF Hedged) index tracks the most liquid high yield corporate bonds from developed markets. The weight of each issuer is capped at 3%. Currency hedged to Swiss Francs (CHF). The ETF's TER (total expense ratio) amounts to 0.55% p.a.. The iShares Global High Yield Corp Bond CHF Hedged UCITS ETF (Dist) is the only ETF that tracks the iBoxx® Global Developed Markets Liquid High Yield Capped (CHF Hedged) index. The ETF replicates the performance of the underlying index by sampling technique (buying a selection of the most relevant index constituents). The interest income (coupons) in the ETF is distributed to the investors (Semi annually). The iShares Global High Yield Corp Bond CHF Hedged UCITS ETF (Dist) has 165m Euro assets under management. The ETF was launched on 11 April 2014 and is domiciled in Ireland.;Ishares Global High Bearling Corp Bond CHF Hedged UCITS ETF (DIST) se snaží sledovat index Global vyvinutých trhů IBOXX® Global Develop Liquid s vysokým výnosem (CHF Hedged). Indexová indexová indexová společnost IBOXX® Global Develop Liqued s vysokým výnosem (CHF Hedged) nejvíce likvidní firemní dluhopisy s vysokým výnosem z rozvinutých trhů. Hmotnost každého emitenta je omezena na 3%. Měna byla zajištěna švýcarským frankům (CHF). TER (celkový poměr nákladů) činí 0,55% P.A .. Ishares Global High Corp Corp Corp CHF Hedged UCITS ETF (DIST) je jediný ETF, který sleduje index Global vyvinutých trhů IBOXX® Global Develop Limip (CHF Hedged). ETF replikuje výkon základního indexu technikou vzorkování (nákup výběru nejdůležitějších složek indexu). Úrokové výnosy (kupóny) v ETF jsou distribuovány investorům (semifinále každoročně). Ishares Global High Bearling Corp Corp CHF Hedged UCITS ETF (DIST) má ve správě aktiv EURO 165M EUR. ETF byl spuštěn 11. dubna 2014 a je se sídlem v Irsku.;0.55%;0.55;EUR 165m;165.0;EUR;CHF;Ireland;iShares;11 April 2014;Distributing;Semi annually;Physical;UCITS;;Bonds, World, Corporate, All maturities;;CHF    Currency risk  Currency;1;Dluhopisy;False;Celosvětově;1580.0;4.67;18.6;26.28;4.09;1.33;2.52;5.3;7.39;-6.55;14.55;1.5;58.35;5.01;5.95;6.25;0.93;0.98;0.76;-4.18;-6.66;-12.49;-21.65;;;;;gettex;AYEY;2;5.47%;5.47;EUR 4.24;4.24;EUR;method2_regex;2025-09-24T00:42:52.036375;success;0;XS2240463674;0.42;XS2406607171;0.35;XS2811958839;0.34;;;;;;;;;;;;;;;Other;100.0;;;;;;;;;IT;4.09;;;;;;;;;gettex;EUR;AYEY;;;;SIX Swiss Exchange;CHF;GHYC;GHYC SEINAVHYCC;GHYC.SX22LINAV.DE;;;;;;;;;;;;;;;;;;;;;;;;;;;;;;;;;;;;;;;;;;;;;;;;;;3;54;6;5;13;10;20
IE00B99FL386;SPDR Bloomberg U.S. High Yield Corporate Scored UCITS ETF USD Unhedged (Dist);https://www.justetf.com/en/etf-profile.html?isin=IE00B99FL386;The SPDR Bloomberg U.S. High Yield Corporate Scored UCITS ETF USD Unhedged (Dist) seeks to track the Bloomberg SASB US Corporate High Yield ESG Ex-Controversies Select index. The Bloomberg SASB US Corporate High Yield ESG Ex-Controversies Select index tracks ESG (environmental, social and governance) screened, US dollar denominated high yield corporate bonds. All maturities are included. Rating: Sub-Investment Grade. The ETF's TER (total expense ratio) amounts to 0.30% p.a.. The SPDR Bloomberg U.S. High Yield Corporate Scored UCITS ETF USD Unhedged (Dist) is the only ETF that tracks the Bloomberg SASB US Corporate High Yield ESG Ex-Controversies Select index. The ETF replicates the performance of the underlying index by sampling technique (buying a selection of the most relevant index constituents). The interest income (coupons) in the ETF is distributed to the investors (Semi annually). The SPDR Bloomberg U.S. High Yield Corporate Scored UCITS ETF USD Unhedged (Dist) has 167m Euro assets under management. The ETF was launched on 19 September 2013 and is domiciled in Ireland.;Společnost SPDR Bloomberg US High Conform Corporate skóroval UCITS ETF USD Unredged (Dist) se snaží sledovat index Bloomberg SASB USA s vysokým výnosem ESG ESG Select Index. Bloomberg SASB US Corporate s vysokým výnosem ESG ESG Ex-Controversies Select Index sleduje ESG (environmentální, sociální a správa) promítána, americký dolar označil firemní dluhopisy s vysokým výnosem. Zahrnuty jsou všechna splatností. Hodnocení: stupeň sub-investice. Ter (celkový poměr nákladů) ETF činí 0,30% P.A. ETF replikuje výkon základního indexu technikou vzorkování (nákup výběru nejdůležitějších složek indexu). Úrokové výnosy (kupóny) v ETF jsou distribuovány investorům (semifinále každoročně). Společnost SPDR Bloomberg US High Weight Corporate skóroval UCITS ETF USD Unredged (Dist) má ve spravování 167 milionů euro aktiv. ETF byl spuštěn 19. září 2013 a má bydliště v Irsku.;0.30%;0.3;EUR 167m;167.0;EUR;USD;Ireland;SPDR ETF;19 September 2013;Distributing;Semi annually;Physical;UCITS;Bloomberg U;Bonds, USD, World, Corporate, All maturities, Social/Environmental;Yes;USD    Currency risk  Currency;1;Dluhopisy;False;Celosvětově;604.0;2.38;14.02;30.59;-5.37;0.11;1.55;-2.85;13.82;-5.13;8.57;16.79;92.13;9.46;8.49;7.97;0.25;0.53;0.69;-14.41;-14.41;-14.41;-19.35;;;;;Extracted (method 1);SYBK;0;7.75%;7.75;EUR 2.73;2.73;EUR;method2_regex;2025-09-24T00:43:00.014487;success;0;;;;;;;;;;;;;;;;;;;;;United States;53.56;Other;37.7;Canada;2.77;;;;;;;;;;;;;;;;;;;;;;;;;;;;;;;;;;;;;;;;;;;;;;;;;;;;;;;;;;;;;;;;;;;;;;;;;;;3;58;12;5;13;10;18
IE00B9CQXS71;SPDR S&P Global Dividend Aristocrats UCITS ETF;https://www.justetf.com/en/etf-profile.html?isin=IE00B9CQXS71;The SPDR S&P Global Dividend Aristocrats UCITS ETF seeks to track the S&P Global Dividend Aristocrats index. The S&P Global Dividend Aristocrats index tracks high dividend yielding equities globally. The ETF's TER (total expense ratio) amounts to 0.45% p.a.. The SPDR S&P Global Dividend Aristocrats UCITS ETF is the only ETF that tracks the S&P Global Dividend Aristocrats index. The ETF replicates the performance of the underlying index by full replication (buying all the index constituents). The dividends in the ETF are distributed to the investors (Quarterly). The SPDR S&P Global Dividend Aristocrats UCITS ETF is a very large ETF with 1,174m Euro assets under management. The ETF was launched on 14 May 2013 and is domiciled in Ireland.;SPDR S&P Global dividenda Aristocrats UCITS ETF se snaží sledovat index Aristokratů Global dividenda S&P. Index globálních dividenda S&P Global dividenda sleduje celosvětově vysokou dividendau, která poskytuje akcie. TER (celkový poměr nákladů) činí 0,45% p.a. ETF replikuje výkon podkladového indexu plnou replikací (nákup všech složek indexu). dividenday v ETF jsou distribuovány investorům (čtvrtletně). SPDR S&P Global dividenda Aristocrats UCITS ETF je velmi velký ETF s řízením 1 174 milionů euro. ETF byl spuštěn 14. května 2013 a je se sídlem v Irsku.;0.45%;0.45;EUR 1174m;1174.0;EUR;USD;Ireland;SPDR ETF;14 May 2013;;Quarterly;Physical;UCITS;;Equity, World, Dividend;;USD    Currency risk  Currency;1;Akcie;False;Celosvětově;98.0;2.25;12.59;67.61;-0.42;-3.06;3.3;0.46;24.92;-1.2;3.21;14.61;112.14;18.03;15.06;14.37;0.12;0.27;0.76;-18.57;-18.57;-18.83;-42.55;;;;;London Stock Exchange;GBDV;7;4.26%;4.26;EUR 1.29;1.29;EUR;method2_regex;2025-09-24T00:43:09.851843;success;0;Verizon Communications;2.08;CVS Health;1.94;APA Group;1.87;LTC Properties;1.82;The AES Corp.;1.8;Universal Corp;1.79;Highwoods Properties;1.76;LG Uplus Corp.;1.76;Pfizer Inc.;1.62;;;United States;48.12;Other;31.91;Canada;8.49;United Kingdom;5.77;;;Financials;21.43;Utilities;19.33;Real Estate;14.04;Industrials;9.76;;;gettex;EUR;ZPRG;;;;Stuttgart Stock Exchange;EUR;ZPRG;;;;Borsa Italiana;EUR;GLDV;GLDV IMINZPRGE;GLDV.MI;;London Stock Exchange;USD;GLDV;GLDV LNINZPRGU;GLDV.L;;London Stock Exchange;GBP;GBDV;GBDV LNINZPRGP;GBDV.L;;SIX Swiss Exchange;CHF;GLDV;GLDV SEINZPRGC;GLDV.S;;XETRA;EUR;ZPRG;ZPRG GYINZPRGE;ZPRG.DE;;;;;;;;;;;;;;;;;;;;3;64;12;13;13;10;16
