LU0292109344;Xtrackers MSCI Brazil UCITS ETF 1C 1C;https://www.justetf.com/en/etf-profile.html?isin=LU0292109344;The Xtrackers MSCI Brazil UCITS ETF 1C 1C seeks to track the MSCI Brazil index. The MSCI Brazil index tracks the largest and most liquid Brazilian stocks. The ETF's TER (total expense ratio) amounts to 0.25% p.a.. The Xtrackers MSCI Brazil UCITS ETF 1C 1C is the cheapest ETF that tracks the MSCI Brazil index. The ETF replicates the performance of the underlying index by full replication (buying all the index constituents). The dividends in the ETF are accumulated and reinvested in the ETF. The Xtrackers MSCI Brazil UCITS ETF 1C 1C has 116m Euro assets under management. The ETF was launched on 22 June 2007 and is domiciled in Luxembourg.;Xtrackers MSCI Brazil UCITS ETF 1C 1C se snaží sledovat index Brazil MSCI. Index MSCI Brazílie sleduje největší a nejvíce likvidní brazilské akciíy. TER ETF (celkový poměr výdajů) činí 0,25% p.a. Xtrackers MSCI Brazil UCITS ETF 1C 1C je nejlevnější ETF, který sleduje index MSCI Brazílie. ETF replikuje výkon podkladového indexu plnou replikací (nákup všech složek indexu). dividenday v ETF jsou akumulovány a reinvestovány do ETF. Xtrackers MSCI Brazil UCITS ETF 1C 1C má spravování aktiv EURO 116 milionů euro. ETF byl spuštěn 22. června 2007 a je se sídlem v Lucemburku.;0.25%;0.25;EUR 116m;116.0;EUR;USD;Luxembourg;Xtrackers;22 June 2007;;;Physical;;MSCI Brazil  1C 1C;Equity, Brazil;;Akcie;False;Ostatní;44.0;3.96;9.11;48.65;22.85;21.77;24.58;26.61;0.18;0.12;0.31;-16.22;-28.51;-28.51;-69.43;;;;;Stockholm Stock Exchange;-;9;;;;;;;2025-09-19T11:08:56.159561;success;0;Vale SA;9.58;Itaú Unibanco Holding SA;9.16;Petróleo Brasileiro SA;7.43;Petróleo Brasileiro SA;6.56;Banco Bradesco SA;4.06;B3 SA-Brasil, Bolsa, Balcão;3.29;Ambev SA;3.05;WEG SA;3.03;Itausa SA;2.94;;;USA;2.94;Other;2.45;;;;;;;Financials;38.77;Energy;16.39;Materials;13.22;Utilities;10.83;IT;9.16;gettex;EUR;XMBR;;;;Borsa Italiana;EUR;XMBR;XMBR IMINXBR;XMBR.MIINXBRINAV.PA;;London Stock Exchange;GBX;XMBR;XMBR LNXMBRINVU;XMBR.LXMBRINAVUSD.DE;;London Stock Exchange;USD;XMBD;XMBD LNXMBRINAV;XMBD.LXMBRNAV.DE;;SIX Swiss Exchange;CHF;XMBR;XMBR SW;XMBR.S;;3;61;17;5;15;10;14
LU0292109690;Xtrackers Nifty 50 Swap UCITS ETF 1C;https://www.justetf.com/en/etf-profile.html?isin=LU0292109690;The Xtrackers Nifty 50 Swap UCITS ETF 1C seeks to track the Nifty 50 index. The Nifty 50 index tracks 50 stocks from 22 sectors of the Indian economy. The ETF's TER (total expense ratio) amounts to 0.85% p.a.. The Xtrackers Nifty 50 Swap UCITS ETF 1C is the only ETF that tracks the Nifty 50 index. The ETF replicates the performance of the underlying index synthetically with a swap. The dividends in the ETF are accumulated and reinvested in the ETF. The Xtrackers Nifty 50 Swap UCITS ETF 1C has 172m Euro assets under management. The ETF was launched on 5 July 2007 and is domiciled in Luxembourg.;Xtrackers Nifty 50 Swap UCITS ETF 1C se snaží sledovat index Nifty 50. Nifty 50 Index sleduje 50 akcií z 22 sektorů indické ekonomiky. TER ETF (celkový poměr nákladů) činí 0,85% p.a. Xtrackers Nifty 50 Swap UCITS ETF 1C je jediný ETF, který sleduje index Nifty 50. ETF replikuje výkon podkladového indexu synteticky s výměnou. dividenday v ETF jsou akumulovány a reinvestovány do ETF. Xtrackers Nifty 50 Swap UCITS ETF 1C má 172m euro aktiv pod správou. ETF byl spuštěn 5. července 2007 a je bydliště v Lucemburku.;0.85%;0.85;EUR 172m;172.0;EUR;USD;Luxembourg;Xtrackers;5 July 2007;;;Synthetic (Unfunded swap);;;Equity, India;;Ostatní;False;Ostatní;;-10.73;9.21;81.1;-8.27;15.82;14.18;15.68;-0.68;0.21;0.8;-17.4;-17.4;-17.4;-64.11;;;;;Hong Kong Stock Exchange;-;11;;;;;;;2025-09-19T11:09:04.562247;success;0;;;;;;;;;;;;;;;;;;;;;;;;;;;;;;;;;;;;;;;;;gettex;EUR;DBX7;;;;Borsa Italiana;EUR;XNIF;XNIF IMXNIFNAVS;XNIF.MIXNIFINAVSEK.DE;;Hong Kong Stock Exchange;HKD;-;3015 HK3015INAV;3015.HK3015NAV.HK;;London Stock Exchange;GBX;XNIF;XNIF LNXNIFINVU;XNIF.LXNIFINAVUSD.DE;;London Stock Exchange;USD;XNID;XNID LNXNIFINAV;XNID.LXNIFNAV.DE;;2;45;1;5;15;10;14
LU0292109856;Xtrackers MSCI China A UCITS ETF 1C 1C;https://www.justetf.com/en/etf-profile.html?isin=LU0292109856;The Xtrackers MSCI China A UCITS ETF 1C 1C seeks to track the MSCI China A Inclusion index. The MSCI China A Inclusion index tracks China A-Shares also included in the MSCI Emerging Markets. The ETF's TER (total expense ratio) amounts to 0.35% p.a.. The ETF replicates the performance of the underlying index by full replication (buying all the index constituents). The dividends in the ETF are accumulated and reinvested in the ETF. The Xtrackers MSCI China A UCITS ETF 1C 1C has 109m Euro assets under management. The ETF was launched on 19 June 2007 and is domiciled in Luxembourg.;Xtrackers MSCI China A UCITS ETF 1C 1C se snaží sledovat index inkluzi MSCI. Index inkluze MSCI Čína Stopy China A-Shares také zahrnula na rozvíjejících se trzích MSCI. TER (celkový poměr nákladů) ETF činí 0,35% p.a. ETF replikuje výkon podkladového indexu plnou replikací (nákup všech složek indexu). dividenday v ETF jsou akumulovány a reinvestovány do ETF. Xtrackers MSCI China A UCITS ETF 1C 1C má ve správě aktiv 109 milionů euro. ETF byl spuštěn 19. června 2007 a má bydliště v Lucemburku.;0.35%;0.35;EUR 109m;109.0;EUR;USD;Luxembourg;Xtrackers;19 June 2007;;;Physical;;MSCI China A  1C 1C;Equity, China;;Akcie;False;Čína;394.0;30.32;15.79;-6.67;6.15;24.26;26.37;27.76;1.25;0.19;-0.05;-23.97;-35.58;-54.61;-68.45;;;;;Hong Kong Stock Exchange;-;11;;;;;;;2025-09-19T11:09:11.631886;success;0;Contemporary Amperex Technology Co., Ltd.;2.95;China Merchants Bank Co., Ltd.;2.23;China Yangtze Power Co., Ltd.;1.69;Ping An Insurance (Group) Co. of China Ltd.;1.6;BYD Co., Ltd.;1.43;Agricultural Bank of China Ltd.;1.28;Wuliangye Yibin;1.17;Industrial Bank Co., Ltd.;1.14;Industrial & Commercial Bank of China Ltd.;1.14;;;China;97.77;Other;2.23;;;;;;;Financials;24.52;Technology;15.49;Industrials;14.81;Consumer Staples;11.12;IT;6.15;gettex;EUR;DBX9;;;;Borsa Italiana;EUR;XX25;XX25 IMINX25;XX25.MIINX25INAV.PA;;Hong Kong Stock Exchange;HKD;-;3007 HKXX25INAV;3007.HKXX25NAV.DE;;London Stock Exchange;GBX;XX25;XX25 LNXX25INVG;XX25.LXX25INAVGBP.DE;;London Stock Exchange;USD;XX2D;XX2D LNXX25INVU;XX2D.LXX25INAVUSD.DE;;3;60;12;5;15;10;18
LU0321462870;Xtrackers iTraxx Crossover Short Daily Swap UCITS ETF 1C;https://www.justetf.com/en/etf-profile.html?isin=LU0321462870;The Xtrackers iTraxx Crossover Short Daily Swap UCITS ETF 1C seeks to track the iTraxx® Crossover 5y Short index. The iTraxx® Crossover 5 Year Short index tracks the inverse performance of iTraxx® Crossover 5 Year index on a daily basis. The iTraxx® Crossover 5 Year index is a credit index, that tracks 50 credit derivatives on European corporates in the high yield universe. The ETF's TER (total expense ratio) amounts to 0.24% p.a.. The ETF replicates the performance of the underlying index synthetically with a swap. The interest income (coupons) in the ETF is accumulated and reinvested in the ETF. The Xtrackers iTraxx Crossover Short Daily Swap UCITS ETF 1C is a very small ETF with 18m Euro assets under management. The ETF was launched on 7 November 2007 and is domiciled in Luxembourg.;Xtrackers ITRAXX Crossover Krátký denní swap UCITS ETF 1C se snaží sledovat krátký index ITRAXX® Crossover 5y. Krátký index ITRAXX® Crossover 5 let sleduje inverzní výkon 5letého indexu ITRAXX® Crossover denně. 5letý index ITRAXX® Crossover je úvěrový index, který sleduje 50 úvěrových derivátů na evropských podnicích ve vesmíru s vysokým výnosem. TER (celkový poměr nákladů) ETF činí 0,24% p.a. ETF replikuje výkon podkladového indexu synteticky s výměnou. Úrokové výnosy (kupóny) v ETF se nashromáždí a reinvestují do ETF. Xtrackers ITRAXX Crossover Krátký denní swap UCITS ETF 1C je velmi malý ETF s 18m euro spravovanými aktivy. ETF byl spuštěn 7. listopadu 2007 a má bydliště v Lucemburku.;0.24%;0.24;EUR 18m;18.0;EUR;EUR;Luxembourg;Xtrackers;7 November 2007;;;Synthetic (Unfunded swap);Strategy risk  Short    Sustainability  No;;risk  Short    Sustainability  No;;Ostatní;False;Ostatní;;-5.2;-21.2;-23.94;-4.32;4.75;5.8;6.27;-1.09;-1.32;-0.85;-8.39;-23.1;-26.01;-76.53;;;;;Stuttgart Stock Exchange;DXST;4;;;;;;;2025-09-19T11:09:17.667618;success;0;;;;;;;;;;;;;;;;;;;;;;;;;;;;;;;;;;;;;;;;;gettex;EUR;XTC5;;;;Stuttgart Stock Exchange;EUR;DXST;;;;Borsa Italiana;EUR;XTC5;XTC5 IM;XTC5.MIXTC5NAV=DBFT;;XETRA;EUR;XTC5;XTC5 GY;XTC5.DE;;;;;;;;3;51;17;1;15;10;8
LU0321462953;Xtrackers II J.P. Morgan USD Emerging Markets Bond UCITS ETF 1C - EUR Hedged;https://www.justetf.com/en/etf-profile.html?isin=LU0321462953;The Xtrackers II J.P. Morgan USD Emerging Markets Bond UCITS ETF 1C - EUR Hedged seeks to track the JP Morgan Emerging Markets Bond Index Global Diversified 1Bn Country (EUR Hedged) index. The JP Morgan Emerging Markets Bond Index Global Diversified 1Bn Country (EUR Hedged) index tracks US dollar-denominated bonds issued by public and quasi-sovereign entities in emerging markets. Currency hedged to Euro (EUR). The ETF's TER (total expense ratio) amounts to 0.40% p.a.. The Xtrackers II J.P. Morgan USD Emerging Markets Bond UCITS ETF 1C - EUR Hedged is the cheapest and largest ETF that tracks the JP Morgan Emerging Markets Bond Index Global Diversified 1Bn Country (EUR Hedged) index. The ETF replicates the performance of the underlying index by sampling technique (buying a selection of the most relevant index constituents). The interest income (coupons) in the ETF is accumulated and reinvested in the ETF. The Xtrackers II J.P. Morgan USD Emerging Markets Bond UCITS ETF 1C - EUR Hedged has 168m Euro assets under management. The ETF was launched on 6 May 2008 and is domiciled in Luxembourg.;The Xtrackers II J.P. Morgan USD Emerging Markets Bond UCITS ETF 1C - EUR Hedged se snaží sledovat index indexu Bond Index JP Morgan Global Diversified 1bn (EUR Hedged). Index indexu JP Morgan Emerging Markets Bond Index Global Diversified 1bn Country (EUR Hedged) Index sleduje americké dluhopisy denominované dolarem vydané veřejnými a kvazi-sovereign subjekty na rozvíjejících se trzích. Měna zajišťovala euro (EUR). TER (celkový poměr výdajů) činí 0,40% P.A .. The Xtrackers II J.P. Morgan USD Emerging Markets Bond UCITS ETF 1C - EUR Hedged je nejlevnější a největší ETF, který sleduje jp Morgan Emerging Markets Index index globální diverzifikované 1BN země (EUR HEDGED) Index. ETF replikuje výkon základního indexu technikou vzorkování (nákup výběru nejdůležitějších složek indexu). Úrokové výnosy (kupóny) v ETF se nashromáždí a reinvestují do ETF. The Xtrackers II J.P. Morgan USD Emerging Markets Bond UCITS ETF 1C - EUR Hedged má pod správou aktiva 168 milionů EUR. ETF byla spuštěna 6. května 2008 a je bydliště v Lucemburku.;0.40%;0.4;EUR 168m;168.0;EUR;EUR;Luxembourg;Xtrackers;6 May 2008;;;Physical;;;Bonds, USD, Emerging Markets, Government, All maturities;;Dluhopisy;False;Rozvíjející se země;875.0;5.25;22.7;-4.74;8.4;5.92;8.67;8.93;0.89;0.81;-0.11;-6.06;-9.09;-31.8;-32.12;;;;;Stuttgart Stock Exchange;DXSU;4;;;;;;;2025-09-19T11:09:23.786980;success;0;XS2214238441;0.61;XS2893151287;0.39;XS1750114396;0.36;;;;;;;;;;;;;;;Other;83.42;;;;;;;;;;;;;;;;;;;gettex;EUR;XEMB;;;;Stuttgart Stock Exchange;EUR;DXSU;;;;Borsa Italiana;EUR;XEMB;XEMB IM;XEMB.MIXEMBNAV=DBFT;;XETRA;EUR;XEMB;XEMB GY;XEMB.DE;;;;;;;;3;62;12;5;15;10;20
LU0321463258;Xtrackers Short iBoxx EUR Sovereigns Eurozone Daily Swap UCITS ETF 1C;https://www.justetf.com/en/etf-profile.html?isin=LU0321463258;The Xtrackers Short iBoxx EUR Sovereigns Eurozone Daily Swap UCITS ETF 1C seeks to track the iBoxx® EUR Sovereigns Eurozone Short index. The iBoxx® EUR Sovereigns Eurozone Short index tracks the inverse performance of the iBoxx EUR Sovereigns Eurozone index on a daily basis. The iBoxx EUR Sovereigns Eurozone index tracks all Euro denominated government bonds issued by eurozone governments. The ETF's TER (total expense ratio) amounts to 0.15% p.a.. The ETF replicates the performance of the underlying index synthetically with a swap. The interest income (coupons) in the ETF is accumulated and reinvested in the ETF. The Xtrackers Short iBoxx EUR Sovereigns Eurozone Daily Swap UCITS ETF 1C is a very small ETF with 10m Euro assets under management. The ETF was launched on 6 May 2008 and is domiciled in Luxembourg.;Xtrackers krátký iBoxx EUR Sovereigns Eurozóna Denní swap UCITS ETF 1C se snaží sledovat krátký index eurozóny IBOXX® EUR Sovereigns. Krátký index Eurozóny Eurozóny IBOXX® EUR sleduje inverzní výkon indexu eurozóny IBOXX EUR denně. Index Eurozóny IBOXX EUR STONEIGNS SLEDUJE VLÁDNÍ DOBROVACÍ DOBROVANÝCH DOBRŮ EUR vydaných vládami eurozóny. ETF TER (celkový poměr nákladů) činí 0,15% p.a. ETF replikuje výkon podkladového indexu synteticky s výměnou. Úrokové výnosy (kupóny) v ETF se nashromáždí a reinvestují do ETF. Xtrackers krátký IBOXX EUR Sovereigns Eurozóna denně swap UCITS ETF 1C je velmi malý ETF s spravováním 10 milionů euro. ETF byla spuštěna 6. května 2008 a je bydliště v Lucemburku.;0.15%;0.15;EUR 10m;10.0;EUR;EUR;Luxembourg;Xtrackers;6 May 2008;;;Synthetic (Unfunded swap);Strategy risk  Short    Sustainability  No;;Bonds, EUR, Europe, Government, All maturities;;Dluhopisy;False;Evropa;;3.89;11.75;28.54;2.44;4.35;6.26;6.05;0.89;0.6;0.85;-2.54;-7.0;-7.86;-47.64;;;;;gettex;DXSV;4;;;;;;;2025-09-19T11:09:30.018170;success;0;;;;;;;;;;;;;;;;;;;;;;;;;;;;;;;;;;;;;;;;;gettex;EUR;DXSV;;;;Stuttgart Stock Exchange;EUR;DXSV;;;;Borsa Italiana;EUR;XSGL;XSGL IM;XSGL.MI;;XETRA;EUR;DXSV;XSGL GY;XSGL.DE;;;;;;;;4;66;22;1;15;10;18
LU0321463506;Xtrackers iBoxx Germany Covered Swap UCITS ETF 1C;https://www.justetf.com/en/etf-profile.html?isin=LU0321463506;The Xtrackers iBoxx Germany Covered Swap UCITS ETF 1C seeks to track the iBoxx® EUR Germany Covered index. The iBoxx® EUR Germany Covered index tracks Euro denominated covered bonds of all maturities issued by the German government. The ETF's TER (total expense ratio) amounts to 0.15% p.a.. The Xtrackers iBoxx Germany Covered Swap UCITS ETF 1C is the only ETF that tracks the iBoxx® EUR Germany Covered index. The ETF replicates the performance of the underlying index synthetically with a swap. The interest income (coupons) in the ETF is accumulated and reinvested in the ETF. The Xtrackers iBoxx Germany Covered Swap UCITS ETF 1C is a small ETF with 23m Euro assets under management. The ETF was launched on 10 October 2007 and is domiciled in Luxembourg.;Německo Xtrackers IBOXX Covered Swap UCITS ETF 1C se snaží sledovat index krytýho Německa IBOXX® EUR. Německo IBOXX® EUR zahrnovalo indexové stopy euro denominované kryté dluhopisy všech splatností vydané německou vládou. TER (celkový poměr nákladů) ETF činí 0,15% P.A .. Xtrackers Iboxx Německo zakryté Swap UCITS ETF 1C je jediný ETF, který sleduje index krytýho Německa IBOXX® EUR. ETF replikuje výkon podkladového indexu synteticky s výměnou. Úrokové výnosy (kupóny) v ETF se nashromáždí a reinvestují do ETF. Xtrackers IBOXX Německo zakryté Swap UCITS ETF 1C je malý ETF s managementem 23 milionů euro. ETF byl spuštěn 10. října 2007 a je byd v Lucemburku.;0.15%;0.15;EUR 23m;23.0;EUR;EUR;Luxembourg;Xtrackers;10 October 2007;;;Synthetic (Unfunded swap);;;Bonds, EUR, Germany, Covered Bonds, All maturities;;Ostatní;False;Ostatní;;2.96;7.85;-5.97;2.29;2.14;3.51;3.5;1.38;0.73;-0.35;-1.56;-3.48;-15.97;-16.57;;;;;Stuttgart Stock Exchange;DXSW;3;;;;;;;2025-09-19T11:09:37.574255;success;0;;;;;;;;;;;;;;;;;;;;;;;;;;;;;;;;;;;;;;;;;gettex;EUR;XBCT;;;;Stuttgart Stock Exchange;EUR;DXSW;;;;XETRA;EUR;XBCT;XBCT GYXBCTEUIV;XBCT.DEXBCTINAV=SOLA;;;;;;;;;;;;;;3;64;22;1;15;10;16
LU0321464652;Xtrackers II GBP Overnight Rate Swap UCITS ETF 1D 1D;https://www.justetf.com/en/etf-profile.html?isin=LU0321464652;The Xtrackers II GBP Overnight Rate Swap UCITS ETF 1D 1D seeks to track the Solactive SONIA Daily index. The Solactive SONIA Daily index tracks a daily rolled deposit earning at the SONIA (the Sterling Overnight Index Average) rate, which is the short-term money market reference in the UK. The Sterling Overnight Index Average is the weighted average rate of all unsecured sterling overnight cash transactions brokered in London by WMBA member firms. The ETF's TER (total expense ratio) amounts to 0.10% p.a.. The Xtrackers II GBP Overnight Rate Swap UCITS ETF 1D 1D is the only ETF that tracks the Solactive SONIA Daily index. The ETF replicates the performance of the underlying index synthetically with a swap. The Xtrackers II GBP Overnight Rate Swap UCITS ETF 1D 1D has 148m Euro assets under management. The ETF was launched on 10 October 2007 and is domiciled in Luxembourg.;Xtrackers II GBP přes noc SWAP UCITS ETF 1D 1D se snaží sledovat index Solactive Sonia Daily. Index Solactive Sonia Denní index sleduje denní výdělky v sazbě Sonia (průměr Sterling Overnight), což je krátkodobý odkaz na peněžní trh ve Velké Británii. Průměr indexu Sterling přes noc je vážená průměrná sazba všech nezajištěných Sterlingových přenocových hotovostních transakcí zprostředkovaných v Londýně členskými firmami WMBA. TER (celkový poměr nákladů) činí 0,10% p.a. Xtrackers II GBP přes noc Swap UCITS ETF 1D 1D je jediný ETF, který sleduje solaraktivní index Sonia Daily. ETF replikuje výkon podkladového indexu synteticky s výměnou. Xtrackers II GBP přes noc Swap UCITS ETF 1D 1D má 148m euro aktiv správy. ETF byl spuštěn 10. října 2007 a je byd v Lucemburku.;0.10%;0.1;EUR 148m;148.0;EUR;GBP;Luxembourg;Xtrackers;10 October 2007;;Annually;Synthetic (Unfunded swap);;;Money Market, GBP, United Kingdom;;Ostatní;False;Ostatní;;1.21;14.68;20.29;-1.69;5.01;5.45;5.79;0.24;0.86;0.65;-4.34;-4.34;-8.22;-26.71;;;;;gettex;DXS1;5;4.79%;4.79;EUR 9.95;9.95;EUR;method2_regex;2025-09-19T11:09:42.858290;success;0;;;;;;;;;;;;;;;;;;;;;;;;;;;;;;;;;;;;;;;;;gettex;EUR;DXS1;;;;Stuttgart Stock Exchange;EUR;DXS1;;;;Borsa Italiana;EUR;XSTR;XSTR IM;XSTR.MI;;London Stock Exchange;GBX;XSTR;XSTR LNINXST;XSTR.LINXSTINAV.PA;;XETRA;EUR;DXS1;XSTR GY;XSTR.DE;;4;74;26;5;15;10;18
LU0321465469;Xtrackers II USD Overnight Rate Swap UCITS ETF 1C 1C;https://www.justetf.com/en/etf-profile.html?isin=LU0321465469;The Xtrackers II USD Overnight Rate Swap UCITS ETF 1C 1C seeks to track the Solactive FEDL Daily index. The Solactive FEDL Daily index tracks a daily rolling exposure to the Federal Funds Effective Rate, the benchmark short-term money market interest rate in the US. The Federal Funds Rate is set at meetings of the Federal Open Market Committee (FOMC). The ETF's TER (total expense ratio) amounts to 0.10% p.a.. The Xtrackers II USD Overnight Rate Swap UCITS ETF 1C 1C is the only ETF that tracks the Solactive FEDL Daily index. The ETF replicates the performance of the underlying index synthetically with a swap. The Xtrackers II USD Overnight Rate Swap UCITS ETF 1C 1C has 362m Euro assets under management. The ETF was launched on 10 October 2007 and is domiciled in Luxembourg.;Sazba Xtrackers II USD přes noc Swap UCITS ETF 1C 1C se snaží sledovat solaraktivní denní index FEDL. Solactive FEDL Daily Index sleduje denní expozici federálním fondům efektivní sazbu federálních fondů, což je referenční krátkodobá úroková sazba v USA. Sazba federálních fondů je stanovena na schůzkách Federálního výboru pro otevřený trh (FOMC). TER (celkový poměr nákladů) ETF činí 0,10% p.a. Xtrackers II USD přes noc Swap UCITS ETF 1C 1C je jediný ETF, který sleduje solaraktivní denní index FEDL. ETF replikuje výkon podkladového indexu synteticky s výměnou. Xtrackers II USD přes noc Swap UCITS ETF 1C 1C má 362 milionů euro aktiv pod správou. ETF byl spuštěn 10. října 2007 a je byd v Lucemburku.;0.10%;0.1;EUR 362m;362.0;EUR;USD;Luxembourg;Xtrackers;10 October 2007;;;Synthetic (Unfunded swap);;;Money Market, USD, United States;;Ostatní;False;Ostatní;;-1.38;-2.7;16.22;-9.11;8.39;8.01;7.58;-0.16;-0.11;0.4;-11.91;-12.01;-12.01;-19.74;;;;;Stuttgart Stock Exchange;DXSZ;5;;;;;;;2025-09-19T11:09:50.088365;success;0;;;;;;;;;;;;;;;;;;;;;;;;;;;;;;;;;;;;;;;;;gettex;EUR;XFFE;;;;Stuttgart Stock Exchange;EUR;DXSZ;;;;Borsa Italiana;EUR;XFFE;XFFE IMXFFEEIV;XFFE.MIXFFECHFINAV=SOLA;;London Stock Exchange;USD;XFFE;XFFE LNINXFF;XFFE.LINXFFINAV.PA;;XETRA;EUR;XFFE;XFFE GYXFFEUSDIV;XFFE.DEXFFEUSDINAV=SOLA;;3;64;26;5;15;10;8
LU0322248146;Xtrackers SLI UCITS ETF 1D;https://www.justetf.com/en/etf-profile.html?isin=LU0322248146;The Xtrackers SLI UCITS ETF 1D seeks to track the SLI® index. The SLI® index tracks the 30 largest and most liquid stocks of the entire Swiss equity market. The ETF's TER (total expense ratio) amounts to 0.25% p.a.. The Xtrackers SLI UCITS ETF 1D is the cheapest ETF that tracks the SLI® index. The ETF replicates the performance of the underlying index by full replication (buying all the index constituents). The dividends in the ETF are distributed to the investors (Annually). The Xtrackers SLI UCITS ETF 1D has 376m Euro assets under management. The ETF was launched on 25 January 2008 and is domiciled in Luxembourg.;Xtrackers SLISITS ETF 1D se snaží sledovat index SLI®. Index SLI® sleduje 30 největších a nejvíce likvidních akcií celého švýcarského kapitálového trhu. TER (celkový poměr nákladů) ETF činí 0,25% p.a. Xtrackers SLISITS ETF 1D je nejlevnější ETF, který sleduje index SLI®. ETF replikuje výkon podkladového indexu plnou replikací (nákup všech složek indexu). dividenday v ETF jsou distribuovány investorům (každoročně). XTrackers SLI UCITS ETF 1D má ve správě aktiv 376 milionů euro. ETF byl spuštěn 25. ledna 2008 a je bydliště v Lucemburku.;0.25%;0.25;EUR 376m;376.0;EUR;CHF;Luxembourg;Xtrackers;25 January 2008;;Annually;Physical;;;Equity, Switzerland;;Ostatní;False;Ostatní;31.0;4.53;33.87;57.39;6.59;13.99;13.2;13.7;0.32;0.77;0.69;-16.34;-16.34;-20.18;-43.37;;;;;gettex;DXS0;4;1.49%;1.49;EUR 3.31;3.31;EUR;method2_regex;2025-09-19T11:09:56.241971;success;0;Novartis AG;8.82;Roche Holding AG;8.67;Nestlé SA;7.61;ABB Ltd.;5.1;Swiss Re AG;4.82;Lonza Group AG;4.48;Zurich Insurance Group AG;4.47;Alcon AG;4.15;Compagnie Financière Richemont SA;4.03;;;Switzerland;94.01;Other;5.99;;;;;;;Health Care;28.81;Financials;26.86;Industrials;11.34;Materials;10.43;;;gettex;EUR;DXS0;;;;SIX Swiss Exchange;CHF;XSLI;XSLI SWXSLIINAV;XSLI.SXSLIINAV.DE;;Stuttgart Stock Exchange;EUR;DXS0;XSLI GSXSLIINAC;XSLI.SGXSLIINAVC.DE;;XETRA;EUR;DXS0;XSLI GYXSLISWIV;XSLI.DEXSLISWINAV.SG;;;;;;;;4;67;17;5;15;10;20
LU0322250712;Xtrackers LPX MM Private Equity Swap UCITS ETF 1C;https://www.justetf.com/en/etf-profile.html?isin=LU0322250712;The Xtrackers LPX MM Private Equity Swap UCITS ETF 1C seeks to track the LPX Major Market® index. The LPX Major Market® index tracks the 25 global most liquid listed private equity companies covered by LPX. The ETF's TER (total expense ratio) amounts to 0.70% p.a.. The Xtrackers LPX MM Private Equity Swap UCITS ETF 1C is the only ETF that tracks the LPX Major Market® index. The ETF replicates the performance of the underlying index synthetically with a swap. The dividends in the ETF are accumulated and reinvested in the ETF. The Xtrackers LPX MM Private Equity Swap UCITS ETF 1C has 423m Euro assets under management. The ETF was launched on 17 January 2008 and is domiciled in Luxembourg.;Xtrackers LPX MM Private Equity Swap UCITS ETF 1C se snaží sledovat index LPX Major Market®. Index LPX Major Market® sleduje 25 globálních nejvíce likvidních společností se soukromým kapitálem, na které se vztahuje LPX. TER (celkový poměr nákladů) činí 0,70% p.a. ETF replikuje výkon podkladového indexu synteticky s výměnou. dividenday v ETF jsou akumulovány a reinvestovány do ETF. Xtrackers LPX MM Private Equity Swap UCITS ETF 1C má spravování 423 milionů euro. ETF byl spuštěn 17. ledna 2008 a je se sídlem v Lucemburku.;0.70%;0.7;EUR 423m;423.0;EUR;EUR;Luxembourg;Xtrackers;17 January 2008;;;Synthetic (Unfunded swap);;;Equity, World;;Akcie;False;Globální;;5.89;63.8;134.49;-6.42;21.29;20.4;21.41;0.28;0.88;0.87;-28.48;-28.48;-36.76;-76.62;;;;;gettex;DX2D;6;;;;;;;2025-09-19T11:10:03.109351;success;0;;;;;;;;;;;;;;;;;;;;;;;;;;;;;;;;;;;;;;;;;gettex;EUR;DX2D;;;;Borsa Italiana;EUR;XLPE;XLPE IMXLPEINVG;XLPE.MIXLPEINAVG.DE;;London Stock Exchange;GBX;XLPE;XLPE LNXLPEINAV;XLPE.LXLPEINAV.DE;;SIX Swiss Exchange;USD;XLPE;XLPE SW;XLPE.S;;Stuttgart Stock Exchange;EUR;DX2D;XLPE GS;XLPE.SG;;3;56;6;5;15;10;20
