DE000ETFL193;Deka Deutsche Boerse EUROGOV Germany 3-5 UCITS ETF;https://www.justetf.com/en/etf-profile.html?isin=DE000ETFL193;The Deka Deutsche Boerse EUROGOV Germany 3-5 UCITS ETF seeks to track the Deutsche Börse EUROGOV® Germany 3-5 index. The Deutsche Börse EUROGOV® Germany 3-5 index tracks German government bonds. Time to maturity: 3-5 years. Number of constituents: maximum 15. The ETF's TER (total expense ratio) amounts to 0.15% p.a.. The Deka Deutsche Boerse EUROGOV Germany 3-5 UCITS ETF is the only ETF that tracks the Deutsche Börse EUROGOV® Germany 3-5 index. The ETF replicates the performance of the underlying index by full replication (buying all the index constituents). The interest income (coupons) in the ETF is distributed to the investors (Quarterly). The Deka Deutsche Boerse EUROGOV Germany 3-5 UCITS ETF is a small ETF with 68m Euro assets under management. The ETF was launched on 16 March 2009 and is domiciled in Germany.;Deka Deutsche Boerse Eurogov Německo 3-5 UCITS ETF se snaží sledovat index Deutsche Börse Eurogov® Německo 3-5. Deutsche Börse Eurogov® Německo 3-5 indexe sleduje německé vládní dluhopisy. Čas do zralosti: 3-5 let. Počet složek: Maximálně 15. TER (celkový poměr nákladů ETF) činí 0,15% p.a. Deka Deutsche Boerse Eurogov Německo 3-5 UCITS ETF je jediný ETF, který sleduje Deutsche Börse Eurogov® Germany 3-5 Index. ETF replikuje výkon podkladového indexu plnou replikací (nákup všech složek indexu). Úrokové výnosy (kupóny) v ETF jsou distribuovány investorům (čtvrtletně). Deka Deutsche Boerse Eurogov Německo 3-5 UCITS ETF je malá ETF s managementem 68 milionů euro. ETF byl spuštěn 16. března 2009 a je se sídlem v Německu.;0.15%;0.15;EUR 68m;68.0;EUR;EUR;Germany;;16 March 2009;;Quarterly;Physical;Contractual;;;;Ostatní;False;Ostatní;13.0;1.83;4.11;-4.78;1.26;2.49;3.5;3.3;0.74;0.39;-0.3;-1.63;-4.17;-12.63;-13.9;;;;;gettex;EL4T;3;1.33%;1.33;EUR 1.19;1.19;EUR;method2_regex;2025-09-19T06:43:59.491409;success;0;DE000BU25026;8.43;DE000BU25034;8.36;DE000BU25042;8.04;;;;;;;;;;;;;;;Germany;80.91;Other;19.09;;;;;;;IT;1.26;;;;;;;;;gettex;EUR;EL4T;;;;Stuttgart Stock Exchange;EUR;EL4T;;;;XETRA;EUR;EL4T;ETFGS35 GRIGS35;ETFGS35.DEIGS35.DE;;;;;;;;;;;;;;3.0;54.0;22.0;1.0;15.0;5.0;11.0
DE000ETFL201;Deka Deutsche Boerse EUROGOV Germany 5-10 UCITS ETF;https://www.justetf.com/en/etf-profile.html?isin=DE000ETFL201;The Deka Deutsche Boerse EUROGOV Germany 5-10 UCITS ETF seeks to track the Deutsche Börse EUROGOV® Germany 5-10 index. The Deutsche Börse EUROGOV® Germany 5-10 index tracks German government bonds. Time to maturity: 5-10 years. Number of constituents: maximum 15. The ETF's TER (total expense ratio) amounts to 0.15% p.a.. The Deka Deutsche Boerse EUROGOV Germany 5-10 UCITS ETF is the only ETF that tracks the Deutsche Börse EUROGOV® Germany 5-10 index. The ETF replicates the performance of the underlying index by full replication (buying all the index constituents). The interest income (coupons) in the ETF is distributed to the investors (Quarterly). The Deka Deutsche Boerse EUROGOV Germany 5-10 UCITS ETF has 203m Euro assets under management. The ETF was launched on 16 March 2009 and is domiciled in Germany.;Deka Deutsche Boerse Eurogov Německo 5-10 UCITS ETF se snaží sledovat index Deutsche Börse Eurogov® Německo 5-10. Index Deutsche Börse Eurogov® Německo 5-10 sleduje německé vládní dluhopisy. Čas do zralosti: 5-10 let. Počet složek: Maximálně 15. TER (celkový poměr nákladů) činí 0,15% p.a. Deka Deutsche Boerse Eurogov Německo ETF je jediný ETF, který sleduje Deutsche Börse Eurogov® Německo 5-10 Index. ETF replikuje výkon podkladového indexu plnou replikací (nákup všech složek indexu). Úrokové výnosy (kupóny) v ETF jsou distribuovány investorům (čtvrtletně). Deka Deutsche Boerse Eurogov Německo 5-10 UCITS ETF má ve správě aktiv 203 milionů euro. ETF byl spuštěn 16. března 2009 a je se sídlem v Německu.;0.15%;0.15;EUR 203m;203.0;EUR;EUR;Germany;;16 March 2009;;Quarterly;Physical;Contractual;;;;Ostatní;False;Ostatní;15.0;-0.08;1.21;-12.97;0.29;4.48;6.13;5.76;-0.02;0.07;-0.47;-4.39;-6.53;-20.31;-21.64;;;;;gettex;EL4U;3;1.87%;1.87;EUR 1.97;1.97;EUR;method2_regex;2025-09-19T06:44:04.307487;success;0;DE000BU2Z031;8.85;DE000BU2Z023;8.46;DE000BU2Z015;7.73;DE000BU27006;7.05;DE000BU2Z049;6.9;;;;;;;;;;;Germany;79.51;Other;20.49;;;;;;;;;;;;;;;;;gettex;EUR;EL4U;;;;Stuttgart Stock Exchange;EUR;EL4U;;;;XETRA;EUR;EL4U;ETFGS51 GRIGS51;ETFGS51.DEIGS51.DE;;;;;;;;;;;;;;3.0;56.0;22.0;5.0;15.0;5.0;9.0
DE000ETFL219;Deka Deutsche Boerse EUROGOV Germany 10+ UCITS ETF;https://www.justetf.com/en/etf-profile.html?isin=DE000ETFL219;The Deka Deutsche Boerse EUROGOV Germany 10+ UCITS ETF seeks to track the Deutsche Börse EUROGOV® Germany 10+ index. The Deutsche Börse EUROGOV® Germany 10+ index tracks German government bonds. Time to maturity: minimum 10 years. Number of constituents: maximum 15. The ETF's TER (total expense ratio) amounts to 0.15% p.a.. The Deka Deutsche Boerse EUROGOV Germany 10+ UCITS ETF is the only ETF that tracks the Deutsche Börse EUROGOV® Germany 10+ index. The ETF replicates the performance of the underlying index by full replication (buying all the index constituents). The interest income (coupons) in the ETF is distributed to the investors (Quarterly). The Deka Deutsche Boerse EUROGOV Germany 10+ UCITS ETF is a small ETF with 56m Euro assets under management. The ETF was launched on 16 March 2009 and is domiciled in Germany.;Deka Deutsche Boerse Eurogov Německo 10+ UCITS ETF se snaží sledovat index Deutsche Börse Eurogov® Německo 10+. Index Deutsche Börse Eurogov® Německo 10+ sleduje německé vládní dluhopisy. Čas na zralost: Minimálně 10 let. Počet složek: Maximálně 15. TER (celkový poměr nákladů ETF) činí 0,15% p.a. Deka Deutsche Boerse Eurogov Německo 10+ UCITS ETF je jediný ETF, který sleduje Deutsche Börse Eurogov® Germany 10+ Index. ETF replikuje výkon podkladového indexu plnou replikací (nákup všech složek indexu). Úrokové výnosy (kupóny) v ETF jsou distribuovány investorům (čtvrtletně). Deka Deutsche Boerse Eurogov Německo 10+ UCITS ETF je malá ETF s managementem 56 milionů euro. ETF byl spuštěn 16. března 2009 a je se sídlem v Německu.;0.15%;0.15;EUR 56m;56.0;EUR;EUR;Germany;;16 March 2009;;Quarterly;Physical;Contractual;;;;Ostatní;False;Ostatní;15.0;-7.86;-12.45;-36.29;-6.44;9.95;13.31;12.56;-0.79;-0.33;-0.69;-12.45;-18.27;-41.26;-43.62;;;;;gettex;EL4V;3;2.02%;2.02;EUR 2.05;2.05;EUR;method2_regex;2025-09-19T06:44:11.278275;success;0;;;;;;;;;;;;;;;;;;;;;Germany;86.11;Other;13.89;;;;;;;IT;6.44;;;;;;;;;gettex;EUR;EL4V;;;;Stuttgart Stock Exchange;EUR;EL4V;;;;XETRA;EUR;EL4V;ETFGS10 GRIGS10;ETFGS10.DEIGS10.DE;;;;;;;;;;;;;;3.0;51.0;22.0;1.0;15.0;5.0;8.0
DE000ETFL227;Deka Deutsche Boerse EUROGOV Germany Money Market UCITS ETF;https://www.justetf.com/en/etf-profile.html?isin=DE000ETFL227;The Deka Deutsche Boerse EUROGOV Germany Money Market UCITS ETF seeks to track the Deutsche Börse EUROGOV® Germany Money Market index. The Deutsche Börse EUROGOV® Germany Money Market index tracks short term German government bonds. Time to maturity: 2-12 months. Number of constituents: maximum 15. The ETF's TER (total expense ratio) amounts to 0.12% p.a.. The Deka Deutsche Boerse EUROGOV Germany Money Market UCITS ETF is the only ETF that tracks the Deutsche Börse EUROGOV® Germany Money Market index. The ETF replicates the performance of the underlying index by full replication (buying all the index constituents). The interest income (coupons) in the ETF is distributed to the investors (Quarterly). The Deka Deutsche Boerse EUROGOV Germany Money Market UCITS ETF has 399m Euro assets under management. The ETF was launched on 16 March 2009 and is domiciled in Germany.;Money Market UCITS ETF usiluje o sledování indexu Deutsche Börse Eurogov® Německo peněžní trh Deutsche Boerse Eurogov. Index peněžního trhu Deutsche Börse Eurogov® sleduje krátkodobé německé vládní dluhopisy. Čas do zralosti: 2-12 měsíců. Počet složek: Maximálně 15. TER (celkový poměr nákladů ETF) činí 0,12% P.A .. Deka Deutsche Boerse Eurogov Německo peněžní trh ETF je jediný ETF, který sleduje index Deutsche Börse Eurogov® Německo. ETF replikuje výkon podkladového indexu plnou replikací (nákup všech složek indexu). Úrokové výnosy (kupóny) v ETF jsou distribuovány investorům (čtvrtletně). Peněžní trh Deka Deutsche Boerse Eurogov UCITS ETF má 399 milionů euro. ETF byl spuštěn 16. března 2009 a je se sídlem v Německu.;0.12%;0.12;EUR 399m;399.0;EUR;EUR;Germany;;16 March 2009;;Quarterly;Physical;Contractual;;;;Ostatní;False;Ostatní;;2.36;7.21;5.09;1.39;0.27;0.33;0.3;8.74;7.21;3.35;-0.1;-0.29;-2.27;-6.69;;;;;gettex;EL4W;3;3.09%;3.09;EUR 2.14;2.14;EUR;method2_regex;2025-09-19T06:44:16.578057;success;0;DE000BU22031;9.37;DE000BU22049;9.27;DE000BU22056;9.26;DE000BU22023;8.42;;;;;;;;;;;;;Germany;87.47;Other;12.53;;;;;;;;;;;;;;;;;gettex;EUR;EL4W;;;;Stuttgart Stock Exchange;EUR;EL4W;;;;XETRA;EUR;EL4W;ETFGSMM GRIGSMM;ETFGSMM.DEIGSMM.DE;;;;;;;;;;;;;;3.0;63.0;22.0;5.0;15.0;5.0;16.0
DE000ETFL235;Deka DAXplus Maximum Dividend UCITS ETF;https://www.justetf.com/en/etf-profile.html?isin=DE000ETFL235;The Deka DAXplus Maximum Dividend UCITS ETF seeks to track the DAXplus® Maximum Dividend index. The DAXplus® Maximum Dividend index tracks 25 German equities with the highest dividend yield. The ETF's TER (total expense ratio) amounts to 0.30% p.a.. The Deka DAXplus Maximum Dividend UCITS ETF is the only ETF that tracks the DAXplus® Maximum Dividend index. The ETF replicates the performance of the underlying index by full replication (buying all the index constituents). The dividends in the ETF are distributed to the investors (Quarterly). The Deka DAXplus Maximum Dividend UCITS ETF has 248m Euro assets under management. The ETF was launched on 3 April 2009 and is domiciled in Germany.;Maximální dividenda UCITS DEKA DAXPLUS ETF se snaží sledovat maximální dividendaový index DAXPLUS®. Maximální index dividenda DAXPLUS® sleduje 25 německých akcií s nejvyšším dividendaovým výnosem. TER (celkový poměr nákladů) ETF činí 0,30% p.a .. Deka Daxplus Maximální dividenda UCITS ETF je jediný ETF, který sleduje maximální dividendaový index DaxPlus®. ETF replikuje výkon podkladového indexu plnou replikací (nákup všech složek indexu). dividenday v ETF jsou distribuovány investorům (čtvrtletně). Maximální dividenda UCITS DEKA DAXPLUS má ve správě aktiv 248 mil. EUR. ETF byl spuštěn 3. dubna 2009 a je se sídlem v Německu.;0.30%;0.3;EUR 248m;248.0;EUR;EUR;Germany;;3 April 2009;;Quarterly;Physical;Contractual;;Equity, Germany, Dividend;;Akcie;False;Evropa;25.0;12.06;40.62;31.07;11.71;16.64;14.99;16.79;0.72;0.8;0.33;-16.85;-16.85;-34.5;-53.07;;;;;gettex;EL4X;3;5.22%;5.22;EUR 2.85;2.85;EUR;method2_regex;2025-09-19T06:44:22.937286;success;0;Volkswagen AG;9.24;Vonovia SE;6.3;Commerzbank AG;6.25;Deutsche Bank AG;6.04;E.ON SE;5.98;Fresenius Medical Care AG;5.23;KION GROUP AG;5.2;Evonik Industries AG;5.13;LEG Immobilien;4.89;;;Germany;100.0;;;;;;;;;Industrials;26.29;Financials;14.34;Real Estate;13.48;Materials;11.56;;;gettex;EUR;EL4X;;;;Stuttgart Stock Exchange;EUR;EL4X;;;;XETRA;EUR;EL4X;ETFDXMD GRIDXMD;ETFDXMD.DEIDXMD.DE;;;;;;;;;;;;;;3.0;57.0;12.0;5.0;15.0;5.0;20.0
DE000ETFL250;Deka STOXX Europe 50® UCITS ETF;https://www.justetf.com/en/etf-profile.html?isin=DE000ETFL250;The Deka STOXX Europe 50® UCITS ETF seeks to track the STOXX® Europe 50 index. The STOXX® Europe 50 index tracks 50 European large cap stocks. The ETF's TER (total expense ratio) amounts to 0.19% p.a.. The ETF replicates the performance of the underlying index by full replication (buying all the index constituents). The dividends in the ETF are distributed to the investors (Quarterly). The Deka STOXX Europe 50® UCITS ETF has 116m Euro assets under management. The ETF was launched on 8 April 2009 and is domiciled in Germany.;Deka Stoxx Europe 50® UCITS ETF se snaží sledovat index Stoxx® Europe 50. Index Stoxx® Europe 50 sleduje 50 evropských akcií s velkými čepičkami. TER (celkový poměr nákladů) ETF činí 0,19% p.a. ETF replikuje výkon podkladového indexu plnou replikací (nákup všech složek indexu). dividenday v ETF jsou distribuovány investorům (čtvrtletně). DEKA Stoxx Europe 50® UCITS ETF má ve správě aktiva 116 milionů euro. ETF byl spuštěn 8. dubna 2009 a má bydliště v Německu.;0.19%;0.19;EUR 116m;116.0;EUR;EUR;Germany;;8 April 2009;;Quarterly;Physical;Contractual;;Equity, Europe;;Akcie;False;Evropa;50.0;7.06;43.7;75.78;9.13;14.38;12.23;13.62;0.49;1.05;0.88;-17.03;-17.03;-17.03;-32.12;;;;;gettex;EL4Y;3;2.26%;2.26;EUR 1.04;1.04;EUR;method2_regex;2025-09-19T06:44:31.044519;success;0;ASML Holding NV;4.45;AstraZeneca PLC;3.74;Novartis AG;3.64;Nestlé SA;3.63;Roche Holding AG;3.58;HSBC Holdings Plc;3.45;Shell Plc;3.45;Siemens AG;3.11;Novo Nordisk A/S;2.49;;;United Kingdom;25.25;France;21.25;Other;20.79;Switzerland;17.56;Germany;15.15;IT;25.25;Financials;21.56;Industrials;15.92;Health Care;13.91;Consumer Staples;11.5;gettex;EUR;EL4Y;;;;Stuttgart Stock Exchange;EUR;EL4Y;;;;XETRA;EUR;EL4Y;ETFSTX5 GRISTX5;ETFSTX5.DEISX5.DE;;;;;;;;;;;;;;3.0;62.0;17.0;5.0;15.0;5.0;20.0
DE000ETFL268;Deka MSCI USA UCITS ETF;https://www.justetf.com/en/etf-profile.html?isin=DE000ETFL268;The Deka MSCI USA UCITS ETF seeks to track the MSCI USA index. The MSCI USA index tracks the leading stocks on the US market. The ETF's TER (total expense ratio) amounts to 0.30% p.a.. The ETF replicates the performance of the underlying index by full replication (buying all the index constituents). The dividends in the ETF are distributed to the investors (Quarterly). The Deka MSCI USA UCITS ETF has 365m Euro assets under management. The ETF was launched on 8 June 2009 and is domiciled in Germany.;Deka MSCI USA UCITS ETF se snaží sledovat index MSCI USA. Index MSCI USA sleduje přední akciíy na americkém trhu. TER (celkový poměr nákladů) ETF činí 0,30% p.a. ETF replikuje výkon podkladového indexu plnou replikací (nákup všech indexových složek). dividenday v ETF jsou distribuovány investorům (čtvrtletně). DEKA MSCI USA UCITS ETF má 365 milionů euro aktiv. ETF byl spuštěn 8. června 2009 a má bydliště v Německu.;0.30%;0.3;EUR 365m;365.0;EUR;USD;Germany;;8 June 2009;;Quarterly;Physical;Contractual;MSCI USA;Equity, United States;;Akcie;False;US;537.0;12.83;48.79;106.41;-0.18;20.37;17.77;18.15;0.63;0.8;0.86;-23.13;-23.13;-23.13;-33.89;;;;;gettex;EL4Z;3;0.44%;0.44;EUR 0.24;0.24;EUR;method2_regex;2025-09-19T06:44:36.510543;success;0;Microsoft;6.89;Apple;5.7;Amazon.com, Inc.;4.09;Meta Platforms;3.1;Broadcom;2.4;Alphabet, Inc. A;2.05;Alphabet, Inc. C;1.74;Tesla;1.63;JPMorgan Chase & Co.;1.51;;;United States;94.98;Other;3.45;;;;;;;Technology;36.43;Financials;10.87;Consumer Discretionary;10.81;;;;;gettex;EUR;EL4Z;;;;Stuttgart Stock Exchange;EUR;EL4Z;;;;XETRA;EUR;EL4Z;ETFUSAC GRIUSAC;ETFUSAC.DEIUSAC.DE;;;;;;;;;;;;;;3.0;57.0;12.0;5.0;15.0;5.0;20.0
DE000ETFL276;Deka MSCI USA MC UCITS ETF;https://www.justetf.com/en/etf-profile.html?isin=DE000ETFL276;The Deka MSCI USA MC UCITS ETF seeks to track the MSCI USA Mid Cap index. The MSCI USA Mid Cap index tracks US mid cap stocks. The ETF's TER (total expense ratio) amounts to 0.30% p.a.. The Deka MSCI USA MC UCITS ETF is the only ETF that tracks the MSCI USA Mid Cap index. The ETF replicates the performance of the underlying index by full replication (buying all the index constituents). The dividends in the ETF are distributed to the investors (Quarterly). The Deka MSCI USA MC UCITS ETF is a small ETF with 47m Euro assets under management. The ETF was launched on 8 June 2009 and is domiciled in Germany.;Deka MSCI USA MC UCITS ETF se snaží sledovat index MSCI USA Mid Cap. Index MSCI USA Mid Cap Index sleduje akciíy Mid Cap. TER (celkový poměr nákladů) ETF činí 0,30% P.A .. Deka MSCI USA MC UCITS ETF je jediný ETF, který sleduje index MSCI USA Mid Cap. ETF replikuje výkon podkladového indexu plnou replikací (nákup všech složek indexu). dividenday v ETF jsou distribuovány investorům (čtvrtletně). DEKA MSCI USA MC UCITS ETF je malá ETF s managementem 47m euro. ETF byl spuštěn 8. června 2009 a má bydliště v Německu.;0.30%;0.3;EUR 47m;47.0;EUR;USD;Germany;;8 June 2009;;Quarterly;Physical;Contractual;MSCI USA MC;Equity, United States, Mid Cap;;Akcie;False;US;305.0;3.95;19.62;73.76;-4.59;20.17;18.43;18.92;0.2;0.33;0.62;-24.38;-24.38;-24.38;-39.65;;;;;gettex;EL41;3;1.38%;1.38;EUR 0.40;0.4;EUR;method2_regex;2025-09-19T06:44:42.324230;success;0;Roblox;1.05;Vistra;1.01;Howmet Aerospace;0.98;Cloudflare Inc;0.91;Quanta Services;0.85;United Rentals;0.82;Axon Enterprise, Inc.;0.78;Flutter Entertainment;0.76;Fastenal;0.75;;;United States;90.21;Other;6.68;United Kingdom;1.36;;;;;Technology;16.54;Industrials;16.08;Financials;12.45;Health Care;9.75;;;gettex;EUR;EL41;;;;Stuttgart Stock Exchange;EUR;EL41;;;;XETRA;EUR;EL41;ETFUSMC GRIUSMC;ETFUSMC.DEIUSMC.DE;;;;;;;;;;;;;;3.0;52.0;12.0;1.0;15.0;5.0;19.0
DE000ETFL284;Deka MSCI Europe UCITS ETF;https://www.justetf.com/en/etf-profile.html?isin=DE000ETFL284;The Deka MSCI Europe UCITS ETF seeks to track the MSCI Europe index. The MSCI Europe index tracks the leading stocks from 15 European industrial countries. The ETF's TER (total expense ratio) amounts to 0.30% p.a.. The ETF replicates the performance of the underlying index by full replication (buying all the index constituents). The dividends in the ETF are distributed to the investors (Quarterly). The Deka MSCI Europe UCITS ETF is a very large ETF with 1,090m Euro assets under management. The ETF was launched on 9 June 2009 and is domiciled in Germany.;Deka MSCI Europe UCITS ETF se snaží sledovat index MSCI Europe. Index MSCI Europe sleduje přední akciíy z 15 evropských průmyslových zemí. TER (celkový poměr nákladů) ETF činí 0,30% p.a. ETF replikuje výkon podkladového indexu plnou replikací (nákup všech indexových složek). dividenday v ETF jsou distribuovány investorům (čtvrtletně). DEKA MSCI Europe UCITS ETF je velmi velký ETF s 1 090 mil. EUR. ETF byl spuštěn 9. června 2009 a má bydliště v Německu.;0.30%;0.3;EUR 1090m;1090.0;EUR;EUR;Germany;;9 June 2009;;Quarterly;Physical;Contractual;MSCI Europe;Equity, Europe;;Akcie;False;Evropa;402.0;9.96;45.69;71.8;11.71;13.94;12.37;13.82;0.71;1.08;0.83;-16.19;-16.19;-19.23;-35.03;;;;;gettex;EL42;3;1.82%;1.82;EUR 0.34;0.34;EUR;method2_regex;2025-09-19T06:44:47.416084;success;0;ASML Holding NV;2.25;AstraZeneca PLC;1.89;Nestlé SA;1.87;Roche Holding AG;1.81;Novartis AG;1.8;HSBC Holdings Plc;1.76;Shell Plc;1.75;Siemens AG;1.59;Novo Nordisk A/S;1.27;;;Other;34.05;United Kingdom;21.03;Germany;15.39;France;15.39;Switzerland;14.14;Financials;22.27;IT;21.03;Industrials;18.57;Health Care;10.42;Consumer Staples;9.99;gettex;EUR;EL42;;;;Stuttgart Stock Exchange;EUR;EL42;;;;XETRA;EUR;EL42;ETFEUAC GRIEUAC;ETFEUAC.DEIEUAC.DE;;;;;;;;;;;;;;4.0;65.0;12.0;13.0;15.0;5.0;20.0
DE000ETFL292;Deka MSCI Europe MC UCITS ETF;https://www.justetf.com/en/etf-profile.html?isin=DE000ETFL292;The Deka MSCI Europe MC UCITS ETF seeks to track the MSCI Europe Mid Cap index. The MSCI Europe Mid Cap index tracks mid cap stocks from European industrial countries. The ETF's TER (total expense ratio) amounts to 0.30% p.a.. The ETF replicates the performance of the underlying index by full replication (buying all the index constituents). The dividends in the ETF are distributed to the investors (Quarterly). The Deka MSCI Europe MC UCITS ETF is a small ETF with 42m Euro assets under management. The ETF was launched on 9 June 2009 and is domiciled in Germany.;Deka MSCI Europe Europe MC UCITS ETF se snaží sledovat index MSCI Europe Mid Cap Index. Index MSCI Europe Mid Cap sleduje akciíy středních kapitálů z evropských průmyslových zemí. TER (celkový poměr nákladů) ETF činí 0,30% p.a. ETF replikuje výkon podkladového indexu plnou replikací (nákup všech indexových složek). dividenday v ETF jsou distribuovány investorům (čtvrtletně). DEKA MSCI Europe MC UCITS ETF je malá ETF s managementem 42 milionů euro. ETF byl spuštěn 9. června 2009 a má bydliště v Německu.;0.30%;0.3;EUR 42m;42.0;EUR;EUR;Germany;;9 June 2009;;Quarterly;Physical;Contractual;MSCI Europe;Equity, Europe, Mid Cap;;Akcie;False;Evropa;220.0;15.87;48.67;57.54;15.71;13.58;13.55;14.91;1.17;1.04;0.64;-13.79;-13.79;-29.34;-37.81;;;;;gettex;EL43;3;2.21%;2.21;EUR 0.32;0.32;EUR;method2_regex;2025-09-19T06:44:54.687744;success;0;Heidelberg Materials AG;1.46;Swiss Life Holding AG;1.41;Erste Group Bank;1.34;Danske Bank A/S;1.3;Aviva;1.23;Geberit AG;1.21;Sandoz Group;1.13;MTU Aero Engines AG;1.1;Prysmian SpA;1.06;;;Other;54.44;United Kingdom;16.89;Germany;11.49;Switzerland;8.78;France;8.4;Financials;21.82;Industrials;21.06;Consumer Discretionary;8.24;Materials;1.46;;;gettex;EUR;EL43;;;;Stuttgart Stock Exchange;EUR;EL43;;;;XETRA;EUR;EL43;ETFEUMC GRIEUMC;ETFEUMC.DEIEUMC.DE;;;;;;;;;;;;;;3.0;53.0;12.0;1.0;15.0;5.0;20.0
DE000ETFL300;Deka MSCI Japan UCITS ETF;https://www.justetf.com/en/etf-profile.html?isin=DE000ETFL300;The Deka MSCI Japan UCITS ETF seeks to track the MSCI Japan index. The MSCI Japan index tracks leading Japanese stocks. The ETF's TER (total expense ratio) amounts to 0.50% p.a.. The ETF replicates the performance of the underlying index by full replication (buying all the index constituents). The dividends in the ETF are distributed to the investors (Quarterly). The Deka MSCI Japan UCITS ETF is a small ETF with 60m Euro assets under management. The ETF was launched on 9 June 2009 and is domiciled in Germany.;Deka MSCI Japan UCITS ETF se snaží sledovat japonský index MSCI. Index MSCI Japan sleduje vedoucí japonské akcie. TER (celkový poměr nákladů) ETF činí 0,50% p.a. ETF replikuje výkon podkladového indexu plnou replikací (nákup všech indexových složek). dividenday v ETF jsou distribuovány investorům (čtvrtletně). Deka MSCI Japan UCITS ETF je malá ETF s managementem 60 milionů euro. ETF byl spuštěn 9. června 2009 a má bydliště v Německu.;0.50%;0.5;EUR 60m;60.0;EUR;JPY;Germany;;9 June 2009;;Quarterly;Physical;Contractual;MSCI Japan;Equity, Japan;;Akcie;False;Japonsko;183.0;12.87;38.65;47.79;7.25;21.27;19.72;18.24;0.61;0.58;0.45;-18.7;-18.7;-20.55;-26.28;;;;;gettex;EL44;3;1.38%;1.38;EUR 0.15;0.15;EUR;method2_regex;2025-09-19T06:44:59.819412;success;0;Mitsubishi UFJ Financial Group, Inc.;3.95;Sony Group Corp.;3.69;Hitachi Ltd.;3.51;Sumitomo Mitsui Financial Group, Inc.;2.32;Nintendo Co., Ltd.;2.28;Recruit Holdings Co., Ltd.;2.08;Tokyo Electron Ltd.;2.01;Mitsubishi Heavy Industries, Ltd.;1.9;SoftBank Group Corp.;1.84;;;Japan;99.01;Other;0.99;;;;;;;Industrials;24.28;Consumer Discretionary;17.18;Financials;16.4;Technology;13.29;;;gettex;EUR;EL44;;;;Stuttgart Stock Exchange;EUR;EL44;;;;XETRA;EUR;EL44;ETFJPAC GRIJPAC;ETFJPAC.DEIJPAC.DE;;;;;;;;;;;;;;3.0;53.0;12.0;1.0;15.0;5.0;20.0
DE000ETFL318;Deka MSCI Japan Climate Change ESG UCITS ETF;https://www.justetf.com/en/etf-profile.html?isin=DE000ETFL318;The Deka MSCI Japan Climate Change ESG UCITS ETF seeks to track the MSCI Japan Climate Change ESG Select index. The MSCI Japan Climate Change ESG Select index tracks a selection of Japanese companies filtered by ESG criteria (environmental, social and governance). The index weighting scheme takes into account the carbon emissions of the selected companies. The parent index is the MSCI Japan. The ETF's TER (total expense ratio) amounts to 0.25% p.a.. The Deka MSCI Japan Climate Change ESG UCITS ETF is the only ETF that tracks the MSCI Japan Climate Change ESG Select index. The ETF replicates the performance of the underlying index by full replication (buying all the index constituents). The dividends in the ETF are distributed to the investors (Quarterly). The Deka MSCI Japan Climate Change ESG UCITS ETF has 111m Euro assets under management. The ETF was launched on 9 June 2009 and is domiciled in Germany.;Změna klimatu Deka MSCI Japan ESG UCITS ETF se snaží sledovat index změny klimatu MSCI Japan ESG. Změna klimatu MSCI Japan ESG Select Index sleduje výběr japonských společností filtrovaných podle kritérií ESG (environmentální, sociální a správa věcí veřejných). Schéma vážení indexu bere v úvahu emise uhlíku vybraných společností. Index nadřazení je MSCI Japan. TER (celkový poměr výdajů) ETF činí 0,25% p.a. Deka MSCI Japan Climate Change ESG UCITS ETF je jediný ETF, který sleduje index změny klimatu MSCI Japan. ETF replikuje výkon podkladového indexu plnou replikací (nákup všech složek indexu). dividenday v ETF jsou distribuovány investorům (čtvrtletně). Změna klimatu DEKA MSCI Japan ESG UCITS ETF má ve správě 111 milionů euro aktiv. ETF byl spuštěn 9. června 2009 a má bydliště v Německu.;0.25%;0.25;EUR 111m;111.0;EUR;EUR;Germany;;9 June 2009;;Quarterly;Physical;Contractual;MSCI Japan Climate Change ESG;;Yes;Akcie;False;Japonsko;160.0;11.29;33.44;35.92;7.41;21.28;18.34;17.52;0.53;0.55;0.36;-18.68;-18.68;-22.7;-29.37;;;;;gettex;EL45;3;1.30%;1.3;EUR 0.13;0.13;EUR;method2_regex;2025-09-19T06:45:07.613594;success;0;Mitsubishi UFJ Financial Group, Inc.;3.94;Hitachi Ltd.;3.46;KEYENCE Corp.;2.99;East Japan Railway Co.;2.63;FAST RETAILING CO., LTD.;2.43;Central Japan Railway Co.;2.39;Nintendo Co., Ltd.;2.34;Recruit Holdings Co., Ltd.;2.27;Advantest Corp.;2.24;;;Japan;99.2;Other;0.8;;;;;;;Industrials;18.79;Technology;17.94;Consumer Discretionary;17.15;Financials;14.85;;;gettex;EUR;EL45;;;;Stuttgart Stock Exchange;EUR;EL45;;;;XETRA;EUR;EL45;ETFJPMC GRIJPMC;ETFJPMC.DEIJPMC.DE;;;;;;;;;;;;;;3.0;62.0;17.0;5.0;15.0;5.0;20.0
