IE00BZ56TQ67;WisdomTree Eurozone Quality Dividend Growth UCITS ETF EUR Acc;https://www.justetf.com/en/etf-profile.html?isin=IE00BZ56TQ67;The WisdomTree Eurozone Quality Dividend Growth UCITS ETF EUR Acc seeks to track the WisdomTree Eurozone Quality Dividend Growth index. The WisdomTree Eurozone Quality Dividend Growth index tracks dividend-paying eurozone stocks with a high quality factor. The stocks included are filtered according to ESG criteria (environmental, social and corporate governance). The Index is a fundamentally weighted index. The ETF's TER (total expense ratio) amounts to 0.29% p.a.. The WisdomTree Eurozone Quality Dividend Growth UCITS ETF EUR Acc is the cheapest and largest ETF that tracks the WisdomTree Eurozone Quality Dividend Growth index. The ETF replicates the performance of the underlying index by full replication (buying all the index constituents). The dividends in the ETF are accumulated and reinvested in the ETF. The WisdomTree Eurozone Quality Dividend Growth UCITS ETF EUR Acc is a small ETF with 38m Euro assets under management. The ETF was launched on 29 June 2016 and is domiciled in Ireland.;Růst dividenda Wisdomtree Eurozneu uCITS ETF EUR ACC se snaží sledovat index růstu dividenda v eurozóně WisdomTree. Index růstu dividenda Wisdomtree Eurozóny sleduje akciíy eurozóny vyplacené dividenday s vysoce kvalitním faktorem. Zahrnuté akcie jsou filtrovány podle kritérií ESG (environmentální, sociální a správa a společností). Index je zásadně vážený index. TER (celkový poměr nákladů) činí 0,29% P.A .. Růst dividenda WisdomTree Eurozóny UCITS ETF EUR ACC je nejlevnější a největší ETF, který sleduje index růstu dividenda v eurozóně WisdomTree. ETF replikuje výkon podkladového indexu plnou replikací (nákup všech složek indexu). dividenday v ETF jsou akumulovány a reinvestovány do ETF. Růst dividenda WisdomTree Eurozneu dividenda UCITS ETF EUR ACC je malý ETF s managementem 38 milionů euro. ETF byl spuštěn 29. června 2016 a je se sídlem v Irsku.;0.29%;0.29;EUR 38m;38.0;EUR;EUR;Ireland;WisdomTree;29 June 2016;Accumulating;;Physical;;;Equity, Europe,;Yes;Akcie;False;Evropa;91.0;3.6;31.08;32.19;5.26;14.47;13.89;16.0;0.25;0.68;0.36;-16.16;-16.16;-30.17;-35.76;;;;;Borsa Italiana;EGRA;7;;;;;;;2025-09-19T10:56:12.487112;success;0;Deutsche Telekom AG;5.93;L'Oréal SA;5.24;Deutsche Post AG;4.68;Industria de Diseño Textil SA;4.12;Endesa SA;4.01;LVMH Moët Hennessy Louis Vuitton SE;3.97;Schneider Electric SE;3.81;Daimler Truck Holding AG;3.57;Hermès International SCA;3.49;;;Germany;26.61;Other;25.45;France;24.59;Netherlands;11.17;;;Industrials;20.77;Consumer Discretionary;16.23;Technology;14.58;;;;;gettex;EUR;WTIM;;;;Borsa Italiana;EUR;EGRA;EGRA IMEGRAEIV;EGRA.MI;;Euronext Paris;EUR;EGRA;EGRA FPEGRAEIV;EGRG.PA;;London Stock Exchange;GBX;EGRG;EGRG LNEGRAEIV;EGRG.L;;London Stock Exchange;EUR;EGRA;EGRA LNEGRAEIV;EGRA.L;;2;49;12;1;11;5;20
IE00BZ6V7883;iShares US Mortgage Backed Securities UCITS ETF;https://www.justetf.com/en/etf-profile.html?isin=IE00BZ6V7883;The iShares US Mortgage Backed Securities UCITS ETF seeks to track the Bloomberg US Mortgage Backed Securities index. The Bloomberg US Mortgage Backed Securities index tracks U.S. mortgage-backed securities issued by government sponsored enterprises. The ETF's TER (total expense ratio) amounts to 0.28% p.a.. The iShares US Mortgage Backed Securities UCITS ETF is the only ETF that tracks the Bloomberg US Mortgage Backed Securities index. The ETF replicates the performance of the underlying index by sampling technique (buying a selection of the most relevant index constituents). The interest income (coupons) in the ETF is distributed to the investors (Semi annually). The iShares US Mortgage Backed Securities UCITS ETF is a large ETF with 778m Euro assets under management. The ETF was launched on 23 May 2016 and is domiciled in Ireland.;Hypotéka IShares USA podporovaná cennými papíry UCITS ETF se snaží sledovat index cenných papírů Bloomberg USA. Hypotéka Bloomberg USA podporovala index cenných papírů s cennými papíry podporovanými hypotékami USA vydané vládou sponzorovanými podniky. TER (celkový poměr nákladů) ETF činí 0,28% P.A .. ISShares US Hypotéka podporovaná cennými papíry UCITS ETF je jediným ETF, který sleduje index cenných papírů Bloomberg USA. ETF replikuje výkon základního indexu technikou vzorkování (nákup výběru nejdůležitějších složek indexu). Úrokové výnosy (kupóny) v ETF jsou distribuovány investorům (semifinále každoročně). Hypotéka IShares USA podporovaná cennými papíry UCITS ETF je velká ETF s řízením 778 milionů euro. ETF byl spuštěn 23. května 2016 a je se sídlem v Irsku.;0.28%;0.28;EUR 778m;778.0;EUR;USD;Ireland;iShares;23 May 2016;;Semi annually;Physical;;;Bonds, USD, United States, Covered Bonds, All maturities;;Akcie;False;US;33.0;-2.83;-5.54;-1.59;-5.77;9.33;10.56;9.81;-0.3;-0.18;-0.03;-11.4;-13.76;-15.15;-16.76;;;;;Extracted (method 1);QDVP;0;3.75%;3.75;EUR 0.13;0.13;EUR;method2_regex;2025-09-19T10:56:20.578083;success;0;US01F0306526;1.67;US01F0206536;1.31;US01F0226591;1.01;US01F0204556;0.47;US01F0426571;0.32;US01F0326581;0.32;US01F0526560;0.31;US21H0426534;0.26;US21H0306587;0.25;;;Other;81.04;United States;9.91;;;;;;;;;;;;;;;;;;;;;;;;;;;;;;;;;;;;;;;;;;;;;;;3;51;12;10;11;10;8
IE00BZBW4Z27;First Trust US Equity Income UCITS ETF Dist;https://www.justetf.com/en/etf-profile.html?isin=IE00BZBW4Z27;The First Trust US Equity Income UCITS ETF Dist seeks to track the Nasdaq US High Equity Income index. The Nasdaq US High Equity Income index tracks US stocks, which are selected based on factors such as liquidity, dividend yield and other quality screens. The ETF's TER (total expense ratio) amounts to 0.55% p.a.. The First Trust US Equity Income UCITS ETF Dist is the only ETF that tracks the Nasdaq US High Equity Income index. The ETF replicates the performance of the underlying index by full replication (buying all the index constituents). The dividends in the ETF are distributed to the investors (Quarterly). The First Trust US Equity Income UCITS ETF Dist has 332m Euro assets under management. The ETF was launched on 14 April 2016 and is domiciled in Ireland.;První Trust US Equity Income UCITS ETF Dist se snaží sledovat index příjmů s vysokým kapitálem NASDAQ USA. Index příjmů NASDAQ US High Equity Index sleduje americké akcie, které jsou vybírány na základě faktorů, jako je likvidita, dividendaový výnos a další obrazovky kvality. TER (celkový poměr nákladů) ETF činí 0,55% P.A. První důvěryhodné americké kapitálové příjmy UCITS ETF Dist je jediným ETF, který sleduje index příjmů s vysokým kapitálem NASDAQ US. ETF replikuje výkon podkladového indexu plnou replikací (nákup všech složek indexu). dividenday v ETF jsou distribuovány investorům (čtvrtletně). První Trust US Equity Income UCITS ETF Dist má ve správě aktiva 332 mil. EUR. ETF byla spuštěna 14. dubna 2016 a je bydliště v Irsku.;0.55%;0.55;EUR 332m;332.0;EUR;USD;Ireland;;14 April 2016;Distributing;Quarterly;Physical;;;Equity, United States, Dividend;;Akcie;False;US;142.0;-1.37;16.16;106.44;-6.21;27.85;28.6;26.14;-0.05;0.18;0.6;-30.58;-30.58;-30.58;-44.01;;;;;London Stock Exchange;-;3;2.28%;2.28;EUR 0.68;0.68;EUR;method2_regex;2025-09-19T10:56:28.011977;success;0;PNC Financial Services Gp;3.12;Exxon Mobil Corp.;3.0;Chevron Corp.;2.99;Diamondback Energy, Inc.;2.96;Verizon Communications;2.94;PepsiCo, Inc.;2.91;Target;2.84;Comcast Corp.;2.78;CVS Health;2.69;;;United States;96.4;Other;3.6;;;;;;;Financials;27.42;Energy;20.87;Consumer Staples;16.2;Health Care;7.24;Financial Services;3.12;London Stock Exchange;GBX;UINC;UINC LN;;;London Stock Exchange;GBP;-;UINC LNFKUINAV;;;London Stock Exchange;USD;UIND;UIND LN;;;;;;;;;;;;;;;2;45;6;5;11;5;18
IE00BZCQB185;iShares MSCI India UCITS ETF USD (Acc);https://www.justetf.com/en/etf-profile.html?isin=IE00BZCQB185;The iShares MSCI India UCITS ETF USD (Acc) seeks to track the MSCI India index. The MSCI India index tracks the leading Indian stocks. The ETF's TER (total expense ratio) amounts to 0.65% p.a.. The iShares MSCI India UCITS ETF USD (Acc) is the largest ETF that tracks the MSCI India index. The ETF replicates the performance of the underlying index by full replication (buying all the index constituents). The dividends in the ETF are accumulated and reinvested in the ETF. The iShares MSCI India UCITS ETF USD (Acc) is a very large ETF with 4,665m Euro assets under management. The ETF was launched on 24 May 2018 and is domiciled in Ireland.;IShares MSCI India UCITS ETF USD (ACC) se snaží sledovat index MSCI India. Index MSCI India sleduje přední indické akcie. TER (celkový poměr nákladů) ETF činí 0,65% p.a. IShares MSCI India UCITS ETF USD (ACC) je největší ETF, který sleduje index MSCI India. ETF replikuje výkon podkladového indexu plnou replikací (nákup všech složek indexu). dividenday v ETF jsou akumulovány a reinvestovány do ETF. IShares MSCI India UCITS ETF USD (ACC) je velmi velký ETF s spravováním 4 665 milionů euro. ETF byl spuštěn 24. května 2018 a je se sídlem v Irsku.;0.65%;0.65;EUR 4665m;4665.0;EUR;USD;Ireland;iShares;24 May 2018;Accumulating;;Physical;;MSCI India  USD;Equity, India;;Akcie;False;Asie;159.0;-12.3;11.76;83.78;-9.42;17.12;14.91;16.09;-0.72;0.25;0.8;-19.4;-19.6;-20.76;-40.78;;;;;Bolsa Mexicana de Valores;-;8;;;;;;;2025-09-19T10:56:34.360800;success;0;Reliance Industries Ltd.;6.39;ICICI Bank Ltd.;5.89;Infosys Ltd.;3.78;Bharti Airtel Ltd.;3.71;Mahindra & Mahindra Ltd.;2.26;Tata Consultancy Services;2.08;Bajaj Finance Ltd.;1.85;Larsen & Toubro Ltd.;1.85;Axis Bank Ltd.;1.85;;;Other;8.94;;;;;;;;;Financials;25.66;Consumer Discretionary;12.37;Technology;8.81;Energy;8.79;;;gettex;EUR;QDV5;;;;Stuttgart Stock Exchange;EUR;QDV5;;;;Borsa Italiana;EUR;NDIA;;;;Bolsa Mexicana de Valores;MXN;-;NDIAN MM;NDIAN.MX;;Euronext Amsterdam;EUR;NDIA;NDIA NA;NDIA.AS;;3;56;6;13;11;10;16
JE00B1VS2W53;WisdomTree Physical Platinum;https://www.justetf.com/en/etf-profile.html?isin=JE00B1VS2W53;The platinum spot price is the price of platinum in US Dollar. The ETC's TER (total expense ratio) amounts to 0.49% p.a.. The WisdomTree Physical Platinum is the largest ETC that tracks the Platinum index. The ETC replicates the performance of the underlying index with a collateralised debt obligation which is backed by physical holdings of the precious metal. The WisdomTree Physical Platinum has 383m Euro assets under management. The ETC was launched on 24 April 2007 and is domiciled in Jersey.;Platinová bodová cena je cena platiny v americkém dolaru. TER (celkový poměr nákladů) ETC činí 0,49% p.a. Fyzická platina WisdomTree je největší atd., Které sleduje index platiny. ETC replikuje výkon podkladového indexu s zajištěným dluhovým závazkem, který je podporován fyzickými drženími drahého kovu. Fyzická platina WisdomTree má ve správě aktiv 383 milionů euro. ETC bylo zahájeno 24. dubna 2007 a má bydliště v Jersey.;0.49%;0.49;EUR 383m;383.0;EUR;USD;Jersey;WisdomTree;24 April 2007;;;Physical;;;Precious Metals, Platinum;;Komodity;False;Globální;;33.46;29.39;45.11;33.28;22.99;23.02;25.56;1.46;0.39;0.3;-15.27;-22.69;-26.92;-65.54;;;;;Euronext Amsterdam;PHPT;7;;;;;;;2025-09-19T10:56:42.620069;success;0;;;;;;;;;;;;;;;;;;;;;;;;;;;;;;;IT;33.28;;;;;;;;;Euronext Amsterdam;EUR;PHPT;;;;Borsa Italiana;EUR;PHPT;;;;London Stock Exchange;USD;PHPT;;;;Euronext Paris;EUR;PHPT;;;;XETRA;EUR;VZLA;;;;3;56;12;5;15;5;19
JE00B1VS3002;WisdomTree Physical Palladium;https://www.justetf.com/en/etf-profile.html?isin=JE00B1VS3002;The palladium spot price is the price of palladium in US Dollar. The ETC's TER (total expense ratio) amounts to 0.49% p.a.. The WisdomTree Physical Palladium is the largest ETC that tracks the Palladium index. The ETC replicates the performance of the underlying index with a collateralised debt obligation which is backed by physical holdings of the precious metal. The WisdomTree Physical Palladium has 142m Euro assets under management. The ETC was launched on 24 April 2007 and is domiciled in Jersey.;Spolodová cena Palladium je cena palladia v americkém dolaru. TER (celkový poměr nákladů) ETC činí 0,49% p.a. Fyzický palladium WisdomTree je největší atd., Který sleduje index palladia. ETC replikuje výkon podkladového indexu s zajištěným dluhovým závazkem, který je podporován fyzickými drženími drahého kovu. Fyzické palladium WisdomTree má ve spravování aktiva 142 milionů EUR. ETC bylo zahájeno 24. dubna 2007 a má bydliště v Jersey.;0.49%;0.49;EUR 142m;142.0;EUR;USD;Jersey;WisdomTree;24 April 2007;;;Physical;;;Precious Metals, Palladium;;Komodity;False;Globální;;0.1;-53.51;-51.23;12.76;29.65;35.73;38.96;0.0;-0.63;-0.34;-28.36;-67.1;-72.26;-72.26;;;;;Euronext Amsterdam;PHPD;7;;;;;;;2025-09-19T10:56:53.016476;success;0;;;;;;;;;;;;;;;;;;;;;;;;;;;;;;;IT;12.76;;;;;;;;;Euronext Amsterdam;EUR;PHPD;;;;Borsa Italiana;EUR;PHPD;;;;London Stock Exchange;USD;PHPD;;;;Euronext Paris;EUR;PHPD;;;;XETRA;EUR;VZLB;;;;2;45;12;5;15;5;8
JE00B1VS3333;WisdomTree Physical Silver;https://www.justetf.com/en/etf-profile.html?isin=JE00B1VS3333;The product tracks the spot price of silver in US Dollar. The ETC's TER (total expense ratio) amounts to 0.49% p.a.. The ETC replicates the performance of the underlying index with a collateralised debt obligation which is backed by physical holdings of the precious metal. The WisdomTree Physical Silver is a very large ETC with 1,952m Euro assets under management. The ETC was launched on 24 April 2007 and is domiciled in Jersey.;Produkt sleduje spotovou cenu stříbra v americkém dolaru. TER (celkový poměr nákladů) ETC činí 0,49% p.a. ETC replikuje výkon podkladového indexu s kolateralizovaným dluhovým závazkem, který je podporován fyzickým držením drahého kovu. Fyzické stříbro WisdomTree je velmi velké atd. S řízením aktiv 1 952 mil. EUR. ETC bylo zahájeno 24. dubna 2007 a má bydliště v Jersey.;0.49%;0.49;EUR 1952m;1952.0;EUR;USD;Jersey;WisdomTree;24 April 2007;;;Physical;;;Precious Metals, Silver;;Komodity;False;Globální;;27.96;82.65;51.26;26.66;32.27;27.89;27.28;0.87;0.8;0.32;-14.93;-17.72;-26.14;-68.15;;;;;Euronext Amsterdam;PHAG;7;;;;;;;2025-09-19T10:57:00.591901;success;0;;;;;;;;;;;;;;;;;;;;;;;;;;;;;;;IT;26.66;;;;;;;;;Euronext Amsterdam;EUR;PHAG;;;;Borsa Italiana;EUR;PHAG;;;;London Stock Exchange;GBX;PHSP;;;;London Stock Exchange;USD;PHAG;;;;Euronext Paris;EUR;PHAG;;;;4;65;12;13;15;5;20
JE00B1VS3770;WisdomTree Physical Gold;https://www.justetf.com/en/etf-profile.html?isin=JE00B1VS3770;The product tracks the spot price of gold in US Dollar. The ETC's TER (total expense ratio) amounts to 0.39% p.a.. The ETC replicates the performance of the underlying index with a collateralised debt obligation which is backed by physical holdings of the precious metal. The WisdomTree Physical Gold is a very large ETC with 5,614m Euro assets under management. The ETC was launched on 24 April 2007 and is domiciled in Jersey.;Produkt sleduje spotovou cenu zlata v americkém dolaru. TER (celkový poměr výdajů) ETC činí 0,39% p.a. ETC replikuje výkon podkladového indexu s kolateralizovaným dluhovým závazkem, který je podporován fyzickými drženími drahého kovu. Fyzické zlato WisdomTree je velmi velké atd. S managementem 5 614 mil. EUR. ETC bylo zahájeno 24. dubna 2007 a má bydliště v Jersey.;0.39%;0.39;EUR 5614m;5614.0;EUR;USD;Jersey;WisdomTree;24 April 2007;;;Physical;;;Precious Metals, Gold;;Komodity;False;Globální;;33.24;82.64;83.42;22.63;16.4;14.93;15.02;2.03;1.49;0.86;-6.7;-7.55;-14.4;-37.53;;;;;Euronext Amsterdam;PHAU;7;;;;;;;2025-09-19T10:57:07.248038;success;0;;;;;;;;;;;;;;;;;;;;;;;;;;;;;;;IT;22.63;;;;;;;;;Euronext Amsterdam;EUR;PHAU;;;;Borsa Italiana;EUR;PHAU;;;;London Stock Exchange;GBX;PHGP;;;;London Stock Exchange;USD;PHAU;;;;Euronext Paris;EUR;PHAU;;;;4;68;12;16;15;5;20
JE00B1VS3W29;WisdomTree Physical Precious Metals;https://www.justetf.com/en/etf-profile.html?isin=JE00B1VS3W29;The precious metals basket (gold, silver, platinum, palladium) spot price is the price of precious metals in US Dollar according to London Bullion market fixing at any given time. The ETC's TER (total expense ratio) amounts to 0.44% p.a.. The WisdomTree Physical Precious Metals is the only ETC that tracks the Precious Metals Basket index. The ETC replicates the performance of the underlying index with a collateralised debt obligation which is backed by physical holdings of the precious metal. The WisdomTree Physical Precious Metals has 223m Euro assets under management. The ETC was launched on 24 April 2007 and is domiciled in Jersey.;Spotová cena drahých kovů (Gold, Silver, Platinum, Palladium) je cena drahých kovů v americkém dolaru podle oprava londýnského trhu s bullionem v daném okamžiku. Ter (celkový poměr nákladů) ETC činí 0,44% p.a. Fyzické drahé kovy WisdomTree je jediné atd., Které sleduje index košů drahých kovů. ETC replikuje výkon podkladového indexu s zajištěným dluhovým závazkem, který je podporován fyzickými drženími drahého kovu. Fyzické drahé kovy WisdomTree mají pod správou aktiva 223 milionů EUR. ETC bylo zahájeno 24. dubna 2007 a má bydliště v Jersey.;0.44%;0.44;EUR 223m;223.0;EUR;USD;Jersey;WisdomTree;24 April 2007;;;Physical;;;Precious Metals, Precious Metals Basket;;Komodity;False;Globální;;28.55;37.63;37.48;23.04;18.31;17.87;19.45;1.56;0.63;0.34;-8.13;-19.75;-28.94;-38.39;;;;;Euronext Amsterdam;PHPM;7;;;;;;;2025-09-19T10:57:14.867740;success;0;;;;;;;;;;;;;;;;;;;;;;;;;;;;;;;IT;23.04;;;;;;;;;Euronext Amsterdam;EUR;PHPM;;;;Borsa Italiana;EUR;PHPM;;;;London Stock Exchange;GBX;PHPP;;;;London Stock Exchange;USD;PHPM;;;;Euronext Paris;EUR;PHPM;;;;3;57;12;5;15;5;20
JE00B24DK975;WisdomTree WTI Crude Oil 1x Daily Short;https://www.justetf.com/en/etf-profile.html?isin=JE00B24DK975;The WisdomTree WTI Crude Oil 1x Daily Short seeks to track the Bloomberg WTI Crude Oil SL Short index. The Bloomberg WTI Crude Oil SL Short index tracks the inverse performance of futures contracts on WTI Crude Oil. The ETC's TER (total expense ratio) amounts to 0.98% p.a.. The ETC replicates the performance of the underlying index synthetically with a swap. The WisdomTree WTI Crude Oil 1x Daily Short is a very small ETC with 10m Euro assets under management. The ETC was launched on 22 February 2008 and is domiciled in Jersey.;Wisdomtree WTI surový olej 1x denně se snaží sledovat Bloomberg WTI surový olej SL krátký index. Krátký index Bloomberg WTI SUR SL sleduje inverzní výkon futures kontraktů na ropu WTI. TER (celkový poměr nákladů) ETC činí 0,98% p.a .. ETC replikuje výkon podkladového indexu synteticky s výměnou. WisdomTree WTI surová ropa 1x denně je velmi malá atd. S managementem 10m euro. ETC byl spuštěn 22. února 2008 a má bydliště v Jersey.;0.98%;0.98;EUR 10m;10.0;EUR;USD;Jersey;WisdomTree;22 February 2008;;;Synthetic;ETC    Strategy risk  Short    Sustainability  No;;Commodities, Energy, Crude Oil;;Komodity;False;Globální;;-12.59;-26.75;-75.64;-12.85;29.89;31.27;35.44;-0.42;-0.32;-0.69;-25.92;-39.48;-80.09;-91.2;;;;;Extracted (method 1);9GA7;0;;;;;;;2025-09-19T10:57:22.898266;success;0;;;;;;;;;;;;;;;;;;;;;;;;;;;;;;;;;;;;;;;;;;;;;;;;;;;;;;;;;;;;;;;;;;;;;;;1;30;1;1;15;5;8
JE00B24DKC09;WisdomTree Gold 1x Daily Short;https://www.justetf.com/en/etf-profile.html?isin=JE00B24DKC09;The product tracks the inverse performance of futures contracts on gold. The ETC's TER (total expense ratio) amounts to 0.98% p.a.. The ETC replicates the performance of the underlying index synthetically with a swap. The WisdomTree Gold 1x Daily Short is a very small ETC with 4m Euro assets under management. The ETC was launched on 22 February 2008 and is domiciled in Jersey.;Produkt sleduje inverzní výkon futures kontraktů na zlato. TER (celkový poměr nákladů) ETC činí 0,98% p.a .. ETC replikuje výkon podkladového indexu synteticky s výměnou. WisdomTree Gold 1x Daily Short je velmi malá atd. S managementem 4 milionu euro. ETC byl spuštěn 22. února 2008 a má bydliště v Jersey.;0.98%;0.98;EUR 4m;4.0;EUR;USD;Jersey;WisdomTree;22 February 2008;;;Synthetic;ETC    Strategy risk  Short    Sustainability  No;;Precious Metals, Gold Future Short;;Komodity;False;Globální;;-30.2;-54.0;-39.33;-34.3;20.85;18.24;18.02;-1.45;-1.25;-0.53;-36.12;-57.45;-57.45;-84.08;;;;;XETRA;9GA9;5;;;;;;;2025-09-19T10:57:28.617232;success;0;;;;;;;;;;;;;;;;;;;;;;;;;;;;;;;;;;;;;;;;;XETRA;EUR;9GA9;;;;gettex;EUR;9GA9;;;;Euronext Amsterdam;EUR;SBUL;;;;Borsa Italiana;EUR;SBUL;;;;London Stock Exchange;USD;SBUL;;;;1;30;1;1;15;5;8
JE00B24DKH53;WisdomTree Natural Gas 1x Daily Short;https://www.justetf.com/en/etf-profile.html?isin=JE00B24DKH53;The WisdomTree Natural Gas 1x Daily Short seeks to track the Bloomberg Natural Gas SL Short index. The Bloomberg Natural Gas SL Short index tracks the inverse performance of futures contracts on natural gas. The ETC's TER (total expense ratio) amounts to 0.98% p.a.. The ETC replicates the performance of the underlying index synthetically with a swap. The WisdomTree Natural Gas 1x Daily Short is a very small ETC with 4m Euro assets under management. The ETC was launched on 22 February 2008 and is domiciled in Jersey.;Krátký krátký denní plyn WisdomTree 1x se snaží sledovat krátký index Bloomberg zemní plyn SL. Krátký index Bloomberg zemní plyn SL sleduje inverzní výkon futures kontraktů na zemní plyn. TER (celkový poměr nákladů) ETC činí 0,98% p.a .. ETC replikuje výkon podkladového indexu synteticky s výměnou. WisdomTree zemní plyn 1x denně je velmi malý atd. 4m euro aktiv pod správou. ETC byl spuštěn 22. února 2008 a má bydliště v Jersey.;0.98%;0.98;EUR 4m;4.0;EUR;USD;Jersey;WisdomTree;22 February 2008;;;Synthetic;ETC    Strategy risk  Short    Sustainability  No;;Commodities, Energy, Natural Gas;;Komodity;False;Globální;;-18.16;256.98;-15.65;-10.08;52.42;54.71;57.1;-0.35;0.96;-0.06;-50.26;-50.26;-83.9;-87.14;;;;;Extracted (method 1);4RTD;0;;;;;;;2025-09-19T10:57:35.471151;success;0;;;;;;;;;;;;;;;;;;;;;;;;;;;;;;;;;;;;;;;;;;;;;;;;;;;;;;;;;;;;;;;;;;;;;;;2;42;1;1;15;5;20
JE00B24DKJ77;WisdomTree Nickel 1x Daily Short;https://www.justetf.com/en/etf-profile.html?isin=JE00B24DKJ77;The WisdomTree Nickel 1x Daily Short seeks to track the Bloomberg Nickel Short index. The Bloomberg Nickel Short index tracks the inverse performance of futures contracts on nickel. The ETC's TER (total expense ratio) amounts to 0.98% p.a.. The ETC replicates the performance of the underlying index synthetically with a swap. The WisdomTree Nickel 1x Daily Short is a very small ETC with 1m Euro assets under management. The ETC was launched on 22 February 2008 and is domiciled in Jersey.;WisdomTree Nickel 1x Daily Short se snaží sledovat krátký index nikl Bloomberg. Krátký index nikl Bloomberg sleduje inverzní výkon futures kontraktů na niklu. TER (celkový poměr nákladů) ETC činí 0,98% p.a .. ETC replikuje výkon podkladového indexu synteticky s výměnou. WisdomTree Nickel 1x Daily Short je velmi malý atd. S 1m euro aktiv pod správou. ETC byl spuštěn 22. února 2008 a má bydliště v Jersey.;0.98%;0.98;EUR 1m;1.0;EUR;USD;Jersey;WisdomTree;22 February 2008;;;Synthetic;ETC    Strategy risk  Short    Sustainability  No;;Commodities, Industrial Metals, Nickel;;Ostatní;False;Ostatní;;4.63;27.33;-68.29;-8.85;23.12;32.79;49.24;0.2;0.26;-0.42;-14.09;-41.9;-84.63;-96.99;;;;;Extracted (method 1);4RTE;0;;;;;;;2025-09-19T10:57:41.951530;success;0;;;;;;;;;;;;;;;;;;;;;;;;;;;;;;;;;;;;;;;;;;;;;;;;;;;;;;;;;;;;;;;;;;;;;;;2;40;1;1;15;5;18
JE00B24DKK82;WisdomTree Silver 1x Daily Short;https://www.justetf.com/en/etf-profile.html?isin=JE00B24DKK82;The product tracks the inverse performance of futures contracts on silver. The ETC's TER (total expense ratio) amounts to 0.98% p.a.. The ETC replicates the performance of the underlying index synthetically with a swap. The WisdomTree Silver 1x Daily Short is a very small ETC with 2m Euro assets under management. The ETC was launched on 22 February 2008 and is domiciled in Jersey.;Produkt sleduje inverzní výkon futures kontraktů na stříbro. TER (celkový poměr nákladů) ETC činí 0,98% p.a .. ETC replikuje výkon podkladového indexu synteticky s výměnou. WisdomTree Silver 1x Daily Short je velmi malé atd. S managementem 2m euro. ETC byl spuštěn 22. února 2008 a má bydliště v Jersey.;0.98%;0.98;EUR 2m;2.0;EUR;USD;Jersey;WisdomTree;22 February 2008;;;Synthetic;ETC    Strategy risk  Short    Sustainability  No;;Precious Metals, Silver Future Short;;Komodity;False;Globální;;-30.89;-61.49;-48.05;-38.18;29.36;30.61;31.9;-1.05;-0.89;-0.38;-39.78;-65.54;-65.79;-94.51;;;;;XETRA;4RTF;5;;;;;;;2025-09-19T10:57:47.572484;success;0;;;;;;;;;;;;;;;;;;;;;;;;;;;;;;;;;;;;;;;;;XETRA;EUR;4RTF;;;;gettex;EUR;4RTF;;;;Euronext Amsterdam;EUR;SSIL;;;;Borsa Italiana;EUR;SSIL;;;;London Stock Exchange;USD;SSIL;;;;1;30;1;1;15;5;8
