IE00B8JDT196;iShares J.P. Morgan Advanced USD EM Investment Grade Bond UCITS ETF USD (Dist);https://www.justetf.com/en/etf-profile.html?isin=IE00B8JDT196;The iShares J.P. Morgan Advanced USD EM Investment Grade Bond UCITS ETF USD (Dist) seeks to track the J.P. Morgan ESG EMBI Global Diversified Investment Grade index. The JP Morgan ESG EMBI Global Diversified Investment Grade index tracks US-Dollar denominated emerging market government bonds. The bonds included are selected and weighted according to ESG (environmental, social and governance) criteria. All maturities are included. Rating: Investment Grade. The ETF's TER (total expense ratio) amounts to 0.30% p.a.. The ETF replicates the performance of the underlying index by sampling technique (buying a selection of the most relevant index constituents). The interest income (coupons) in the ETF is distributed to the investors (Semi annually). The iShares J.P. Morgan Advanced USD EM Investment Grade Bond UCITS ETF USD (Dist) is a very small ETF with 8m Euro assets under management. The ETF was launched on 25 March 2021 and is domiciled in Ireland.;IShares J.P. Morgan Advanced USD EM investiční stupeň Bond UCITS ETF USD (DIST) se snaží sledovat index J.P. Morgan ESG EMBI Global Diversified investiční stupeň Index. Globální diverzifikovaný investiční index JP Morgan ESG EMBI Global Diversified investiční stupeň sleduje americké denominované dluhopisy vlády na trhu. Zahrnuté dluhopisy jsou vybírány a váženy podle kritérií ESG (environmentální, sociální a správa věcí veřejných). Zahrnuty jsou všechna splatností. Hodnocení: Investiční třída. TER (celkový poměr nákladů) ETF činí 0,30% p.a. ETF replikuje výkon základního indexu technikou vzorkování (nákup výběru nejdůležitějších složek indexu). Úrokové výnosy (kupóny) v ETF jsou distribuovány investorům (semifinále každoročně). Ishares J.P. Morgan Advanced USD EM investiční stupeň Bond UCITS ETF USD (DIST) je velmi malý ETF s managementem 8 milionů euro. ETF byl spuštěn 25. března 2021 a je sídlem v Irsku.;0.30%;0.3;EUR 8m;8.0;EUR;USD;Ireland;iShares;25 March 2021;Distributing;Semi annually;Physical;;;;Yes;Dluhopisy;False;Rozvíjející se země;479.0;9.13;8.87;;;9.13;8.87;;-0.23;-0.09;;-11.03;-11.03;;-17.24;;;;;Euronext Amsterdam;IGEM;1;4.49%;4.49;EUR 0.16;0.16;EUR;method2_regex;2025-09-18T16:51:47.194549;success;0;XS2744128369;0.84;XS2574267188;0.8;XS2908633683;0.76;XS1750114396;0.76;;;;;;;;;;;;;Other;72.5;;;;;;;;;;;;;;;;;;;Euronext Amsterdam;USD;IGEM;IGEM NA;IGEM.AS;;;;;;;;;;;;;;;;;;;;;;;;;;2.0;42.0;12.0;1.0;6.0;10.0;13.0
IE00BDR5H412;UBS Global Gender Equality UCITS ETF hCHF acc;https://www.justetf.com/en/etf-profile.html?isin=IE00BDR5H412;The UBS Global Gender Equality UCITS ETF hCHF acc seeks to track the Solactive Equileap Global Gender Equality 100 (CHF Hedged) index. The Solactive Equileap Global Gender Equality 100 (CHF Hedged) index tracks companies in developed countries that are particularly positive in the area of gender equality. Included stock are weighted equally. Currency hedged to Swiss Francs (CHF). The ETF's TER (total expense ratio) amounts to 0.23% p.a.. The UBS Global Gender Equality UCITS ETF hCHF acc is the only ETF that tracks the Solactive Equileap Global Gender Equality 100 (CHF Hedged) index. The ETF replicates the performance of the underlying index by full replication (buying all the index constituents). The dividends in the ETF are accumulated and reinvested in the ETF. The UBS Global Gender Equality UCITS ETF hCHF acc is a small ETF with 47m Euro assets under management. The ETF was launched on 19 December 2017 and is domiciled in Ireland.;Globální globální rovnost žen a genderu UCITS ETF HCHF ACC se snaží sledovat index globální globální rovnosti rovnosti 100 (CHF Hedged). Indexová indexová rovnost globální rovnosti genderových rovností Solactiveap Equileap Global Gender Rovnost 100 (CHF Hedged) sleduje společnosti v rozvinutých zemích, které jsou obzvláště pozitivní v oblasti rovnosti žen a mužů. Zahrnuté akciíy jsou váženy stejně. Měna byla zajištěna švýcarským frankům (CHF). TER (celkový poměr výdajů) ETF činí 0,23% p.a. Globální rovnost že genderová rovnost UCS ETF HCHF ACC je jediným ETF, který sleduje index solaraktivní rovnosti Global Gender 100 (CHF Hedged). ETF replikuje výkon podkladového indexu plnou replikací (nákup všech složek indexu). dividenday v ETF jsou akumulovány a reinvestovány do ETF. Globální rovnost žen a genderu UCS UCITS ETF HCHF ACC je malá ETF s managementem 47M EUR. ETF byl spuštěn 19. prosince 2017 a je bytí v Irsku.;0.23%;0.23;EUR 47m;47.0;EUR;CHF;Ireland;UBS;19 December 2017;Accumulating;;Physical;;;;Yes;Ostatní;False;Globální;100.0;7.89;37.32;80.08;9.77;12.17;13.34;13.61;0.65;0.83;0.92;-13.86;-13.86;-17.47;-33.78;;;;;gettex;AW1A;2;;;;;;;2025-09-18T16:51:53.954368;success;0;Standard Chartered Plc;1.7;Citigroup, Inc.;1.51;Wells Fargo & Co.;1.41;Meta Platforms;1.35;JPMorgan Chase & Co.;1.34;NN Group NV;1.31;Tele2 AB;1.29;Storebrand ASA;1.27;Orange SA;1.23;;;United States;46.51;Other;24.13;United Kingdom;9.89;France;9.81;Australia;9.66;Financials;25.81;Consumer Staples;11.39;Consumer Discretionary;11.34;;;;;gettex;EUR;AW1A;;;;SIX Swiss Exchange;CHF;GENDES;GENDES SWIGENDES;GENDES.SGENDESCHFINAV=SOLA;;;;;;;;;;;;;;;;;;;;3.0;54.0;17.0;1.0;11.0;5.0;20.0
IE00B3VWN393;iShares USD Treasury Bond 3-7yr UCITS ETF (Acc);https://www.justetf.com/en/etf-profile.html?isin=IE00B3VWN393;The iShares USD Treasury Bond 3-7yr UCITS ETF (Acc) seeks to track the ICE US Treasury 3-7 Year index. The ICE US Treasury 3-7 Year index tracks US Dollar denominated government bonds issued by the US Treasury. Time to maturity: 3-7 years. The ETF's TER (total expense ratio) amounts to 0.07% p.a.. The iShares USD Treasury Bond 3-7yr UCITS ETF (Acc) is the cheapest and largest ETF that tracks the ICE US Treasury 3-7 Year index. The ETF replicates the performance of the underlying index by sampling technique (buying a selection of the most relevant index constituents). The interest income (coupons) in the ETF is accumulated and reinvested in the ETF. The iShares USD Treasury Bond 3-7yr UCITS ETF (Acc) is a very large ETF with 5,798m Euro assets under management. The ETF was launched on 3 June 2009 and is domiciled in Ireland.;Treasury Bond Ishares USD 3-7yr UCITS ETF (ACC) se snaží sledovat index 3-7 let ICE USA. Index Treasury ICE US Treasury 3-7 let sleduje vládní dluhopisy vydané americkým ministerstvem americké pokladny. Čas do zralosti: 3-7 let. TER (celkový poměr nákladů) činí 0,07% P.A .. ISShares USD Treasury Bond 3-7yr UCITS ETF (ACC) je nejlevnější a největší ETF, který sleduje index 3-7 let ICE USA. ETF replikuje výkon základního indexu technikou vzorkování (nákup výběru nejdůležitějších složek indexu). Úrokové výnosy (kupóny) v ETF se nashromáždí a reinvestují do ETF. IShares USD Treasury Bond 3-7yr UCITS ETF (ACC) je velmi velký ETF s managementem 5 798 mil. EUR. ETF byl spuštěn 3. června 2009 a je bytí v Irsku.;0.07%;0.07;EUR 5798m;5798.0;EUR;USD;Ireland;iShares;3 June 2009;Accumulating;;Physical;;;;;Dluhopisy;False;Globální;90.0;-2.51;-4.94;0.6;-6.27;8.61;9.16;8.78;-0.29;-0.18;0.01;-10.1;-12.9;-12.9;-17.3;;;;;Bolsa Mexicana de Valores;-;10;;;;;;;2025-09-18T16:51:59.730933;success;0;;;;;;;;;;;;;;;;;;;;;United States;63.09;Other;36.91;;;;;;;;;;;;;;;;;London Stock Exchange;GBX;CU71;;;;gettex;EUR;SXRL;;;;Bolsa Mexicana de Valores;MXN;-;CBU7N MM;CBU7N.MX;;Borsa Italiana;EUR;CSBGU7;CSBGU7 IMIXM0131;CSBGU7.MIIXM0131.DE;;Euronext Amsterdam;EUR;CBU7;CBU7 NAIXM0131;CBU7.ASIXM0131.DE;;5.0;75.0;26.0;16.0;15.0;10.0;8.0
IE00BKX55S42;Vanguard FTSE Developed Europe ex UK UCITS ETF (EUR) Distributing;https://www.justetf.com/en/etf-profile.html?isin=IE00BKX55S42;The Vanguard FTSE Developed Europe ex UK UCITS ETF (EUR) Distributing seeks to track the FTSE Developed Europe ex UK index. The FTSE Developed Europe ex UK index tracks large and mid cap stocks from developed countries in Europe excluding the UK. The ETF's TER (total expense ratio) amounts to 0.10% p.a.. The Vanguard FTSE Developed Europe ex UK UCITS ETF (EUR) Distributing is the cheapest and largest ETF that tracks the FTSE Developed Europe ex UK index. The ETF replicates the performance of the underlying index by full replication (buying all the index constituents). The dividends in the ETF are distributed to the investors (Quarterly). The Vanguard FTSE Developed Europe ex UK UCITS ETF (EUR) Distributing is a very large ETF with 3,020m Euro assets under management. The ETF was launched on 30 September 2014 and is domiciled in Ireland.;Vanguard FTSE vyvinula distribuci Europe UK UCITS ETF (EUR), aby sledovala FTSE vyvinutý evropský index UK. FTSE vyvinula Europe Ex Index Index skladby velké a střední kapitálové akciíy z rozvinutých zemí v Evropě s výjimkou Velké Británie. TER (celkový poměr nákladů) činí 0,10% P.A .. Distribuce Vanguard FTSE vyvinula Europe Uk UCITS ETF (EUR) nejlevnější a největší ETF, která sleduje FTSE vyvinul Europe Ex Index. ETF replikuje výkon podkladového indexu plnou replikací (nákup všech složek indexu). dividenday v ETF jsou distribuovány investorům (čtvrtletně). Vanguard FTSE vyvinula distribuci Europe UK UCITS ETF (EUR) je velmi velký ETF s managementem 3 020 milionů euro. ETF byl spuštěn 30. září 2014 a je se sídlem v Irsku.;0.10%;0.1;EUR 3020m;3020.0;EUR;EUR;Ireland;Vanguard;30 September 2014;Distributing;Quarterly;Physical;;FTSE Developed Europe ex UK;Equity, Europe;;Akcie;False;Evropa;422.0;9.33;48.61;65.78;11.67;14.64;13.09;14.52;0.64;1.08;0.73;-16.09;-16.09;-22.96;-34.47;;;;;Bolsa Mexicana de Valores;-;8;2.63%;2.63;EUR 1.12;1.12;EUR;method2_regex;2025-09-18T16:52:07.382883;success;0;ASML Holding NV;2.82;Roche Holding AG;2.27;Nestlé SA;2.26;Novartis AG;2.21;Siemens AG;1.93;Novo Nordisk A/S;1.57;Allianz SE;1.57;Schneider Electric SE;1.45;LVMH Moët Hennessy Louis Vuitton SE;1.41;;;Other;35.53;Germany;19.1;France;18.42;Switzerland;17.28;Netherlands;9.67;Financials;22.67;Industrials;18.8;Health Care;9.67;Technology;9.25;;;Euronext Paris;EUR;VERX;;;;gettex;EUR;VERX;;;;Stuttgart Stock Exchange;EUR;VERX;;;;Bolsa Mexicana de Valores;EUR;-;VERXN MM;VERXN.MX;;Frankfurt Stock Exchange;EUR;-;IVERX;;;5.0;82.0;26.0;13.0;13.0;10.0;20.0
IE000XNILW20;WisdomTree Global Sustainable Equity UCITS ETF USD Unhedged Acc;https://www.justetf.com/en/etf-profile.html?isin=IE000XNILW20;The WisdomTree Global Sustainable Equity UCITS ETF USD Unhedged Acc seeks to track the Solactive WisdomTree Global Sustainable Equity UCITS index. The Solactive WisdomTree Global Sustainable Equity UCITS index tracks stocks from developed markets worldwide which have been screened for sustainable criteria. The securities included are weighted according to their exposure to one or more Sustainable Development Goals. The ETF's TER (total expense ratio) amounts to 0.29% p.a.. The WisdomTree Global Sustainable Equity UCITS ETF USD Unhedged Acc is the only ETF that tracks the Solactive WisdomTree Global Sustainable Equity UCITS index. The ETF replicates the performance of the underlying index by full replication (buying all the index constituents). The dividends in the ETF are accumulated and reinvested in the ETF. The WisdomTree Global Sustainable Equity UCITS ETF USD Unhedged Acc has 333m Euro assets under management. The ETF was launched on 5 June 2024 and is domiciled in Ireland.;WisdomTree Global Sustainable Equity UCITS ETF USD Undred ACC se snaží sledovat solaraktivní index UCITS Global WisdomTree Global Sustainable Equity UCITS. Indexová společnost Solactive WisdomTree Global Sustainable Equity UCITS sleduje akcie z rozvinutých trhů po celém světě, které byly prověřeny na udržitelná kritéria. Zahrnuté cenné papíry jsou váženy podle jejich vystavení jednomu nebo více cílům udržitelného rozvoje. TER (celkový poměr nákladů) ETF činí 0,29% P.A. ETF replikuje výkon podkladového indexu plnou replikací (nákup všech složek indexu). dividenday v ETF jsou akumulovány a reinvestovány do ETF. WisdomTree Global Sustainable Equity UCITS ETF USD Undred ACC má 333 milionů euro aktiv. ETF byl spuštěn 5. června 2024 a je bydliště v Irsku.;0.29%;0.29;EUR 333m;333.0;EUR;USD;Ireland;WisdomTree;5 June 2024;Accumulating;;Physical;;;;Yes;Akcie;False;Globální;118.0;1.58;;;-2.46;15.8;;;0.1;;;-21.57;;;-21.57;;;;;gettex;WSDG;5;;;;;;;2025-09-18T16:52:11.944393;success;0;Microsoft;4.81;Apple;4.2;Tesla;3.23;Cisco Systems, Inc.;2.44;Johnson & Johnson;2.43;Brookfield Corp.;2.33;IBM;2.27;Analog Devices;2.27;Schneider Electric SE;2.23;;;United States;64.12;Other;21.81;Japan;7.14;United Kingdom;3.71;Switzerland;3.22;Technology;34.06;Health Care;19.04;Industrials;16.93;Consumer Discretionary;7.57;;;gettex;EUR;WSDG;;;;Borsa Italiana;EUR;WSDG;WSDG IMWSDGINAV;WSDG.MIWSDGINAV=IHSM;;London Stock Exchange;GBX;WSEQ;WSEQ LN;WSEQ.L;;London Stock Exchange;USD;WSDG;WSDG LN;WSDG.L;;XETRA;EUR;WSDG;WSDG GYWSDGINAV;WSDG.DEWSDGINAV=IHSM;;;;;;;;
IE000ZX8CQG2;iShares EUR Corporate Bond ESG Paris-Aligned Climate UCITS ETF EUR (Dist);https://www.justetf.com/en/etf-profile.html?isin=IE000ZX8CQG2;The iShares EUR Corporate Bond ESG Paris-Aligned Climate UCITS ETF EUR (Dist) seeks to track the Bloomberg MSCI Euro Corporate Climate Paris Aligned ESG Select index. The Bloomberg MSCI Euro Corporate Climate Paris Aligned ESG Select index tracks Euro denominated corporate bonds. Securities are selected and weighted according to sustainability criteria and EU directives on climate protection. Minimum maturity: 1 year. Rating: Investment Grade. The ETF's TER (total expense ratio) amounts to 0.15% p.a.. The iShares EUR Corporate Bond ESG Paris-Aligned Climate UCITS ETF EUR (Dist) is the cheapest and largest ETF that tracks the Bloomberg MSCI Euro Corporate Climate Paris Aligned ESG Select index. The ETF replicates the performance of the underlying index by sampling technique (buying a selection of the most relevant index constituents). The interest income (coupons) in the ETF is distributed to the investors (Semi annually). The iShares EUR Corporate Bond ESG Paris-Aligned Climate UCITS ETF EUR (Dist) is a large ETF with 745m Euro assets under management. The ETF was launched on 9 June 2022 and is domiciled in Ireland.;Ishares EUR Corporate Bond ESG Pařížské klima UCITS ETF EUR (dist) se snaží sledovat index ESG Select Corporate Climate Paříž Bloomberg MSCI Euro. Bloomberg MSCI Euro Corporate Climate Paris Align ESG Select Index stopy euro denominované firemní dluhopisy. Cenné papíry jsou vybírány a váženy podle kritérií udržitelnosti a směrnic EU o ochraně klimatu. Minimální zralost: 1 rok. Hodnocení: Investiční třída. TER (celkový poměr nákladů) činí 0,15% P.A .. Ishares EUR EUR Corporate Bond ESG Pařížské klimatické uCITS ETF EUR (DIST) je nejlevnější a největší ETF, který sleduje Bloomberg MSCI Euro Euro Corporate Climate Paris Alignated ESG Select Index. ETF replikuje výkon základního indexu technikou vzorkování (nákup výběru nejdůležitějších složek indexu). Úrokové výnosy (kupóny) v ETF jsou distribuovány investorům (semifinále každoročně). Ishares EUR Corporate Bond ESG Pařížské klima UCITS ETF EUR (DIST) je velký ETF s managementem 745 milionů euro. ETF byl spuštěn 9. června 2022 a je sídlem v Irsku.;0.15%;0.15;EUR 745m;745.0;EUR;EUR;Ireland;iShares;9 June 2022;Distributing;Semi annually;Physical;;;;Yes;Dluhopisy;False;Globální;1870.0;4.21;14.37;;2.77;3.02;4.19;;1.4;1.09;;-1.76;-4.3;;-9.14;;;;;Extracted (method 1);CBUJ;0;3.52%;3.52;EUR 0.18;0.18;EUR;method2_regex;2025-09-18T16:52:17.738747;success;0;FR0013444551;0.22;XS2613209670;0.22;XS2621539910;0.21;XS2764455619;0.21;XS2459544339;0.2;XS2804565435;0.19;XS2626007939;0.19;;;;;;;Other;52.27;France;16.05;United States;13.92;Netherlands;10.15;Germany;7.61;IT;13.92;;;;;;;;;;;;;;;;;;;;;;;;;;;;;;;;;;;;;;;4.0;66.0;22.0;10.0;6.0;10.0;18.0
IE00BK63RN45;Invesco MSCI Kuwait UCITS ETF Acc;https://www.justetf.com/en/etf-profile.html?isin=IE00BK63RN45;The Invesco MSCI Kuwait UCITS ETF Acc seeks to track the MSCI Kuwait 20/35 index. The MSCI Kuwait 20/35 index tracks large and mid-cap companies of the Kuwait equity market. The weight of the largest group entity is constrained to 35% and the weights of all other entities are constrained to a maximum of 20%. The ETF's TER (total expense ratio) amounts to 0.50% p.a.. The ETF replicates the performance of the underlying index synthetically with a swap. The dividends in the ETF are accumulated and reinvested in the ETF. The Invesco MSCI Kuwait UCITS ETF Acc is a very small ETF with 6m Euro assets under management. The ETF was launched on 24 October 2019 and is domiciled in Ireland.;Invesco MSCI Kuwait UCITS ETF ACC se snaží sledovat index MSCI Kuwait 20/35. Index MSCI Kuwait 20/35 sleduje velké a střední společnosti na trhu s kapitálem Kuvajtu. Hmotnost největší skupinové entity je omezena na 35% a hmotnosti všech ostatních entit jsou omezeny na maximálně 20%. ETF TER (celkový poměr nákladů) činí 0,50% p.a. ETF replikuje výkon podkladového indexu synteticky s výměnou. dividenday v ETF jsou akumulovány a reinvestovány do ETF. Invesco MSCI Kuwait UCITS ETF ACC je velmi malý ETF s managementem 6m euro. ETF byla spuštěna 24. října 2019 a je bydliště v Irsku.;0.50%;0.5;EUR 6m;6.0;EUR;USD;Ireland;Invesco;24 October 2019;Accumulating;;Synthetic (Unfunded swap);;MSCI Kuwait  Acc;Equity, Kuwait;;Akcie;False;Ostatní;;17.89;0.61;71.25;10.05;13.33;13.24;13.47;1.34;0.02;0.84;-9.7;-25.01;-26.7;-37.77;;;;;London Stock Exchange;MKUW;1;;;;;;;2025-09-18T16:52:24.274235;success;0;;;;;;;;;;;;;;;;;;;;;;;;;;;;;;;;;;;;;;;;;London Stock Exchange;USD;MKUW;MKUW LNMKUWIN;MKUW.L3OBEINAV.DE;;;;;;;;;;;;;;;;;;;;;;;;;;2.0;48.0;12.0;1.0;8.0;10.0;17.0
IE0004J6PFL7;iShares Core UK Gilts UCITS ETF USD Hedged (Dist);https://www.justetf.com/en/etf-profile.html?isin=IE0004J6PFL7;The iShares Core UK Gilts UCITS ETF USD Hedged (Dist) seeks to track the FTSE Actuaries UK Conventional Gilts All Stocks (USD Hedged) index. The FTSE Actuaries UK Conventional Gilts All Stocks (USD Hedged) index tracks Sterling denominated UK government bonds (conventional gilts) quoted on the London Stock Exchange, other than index-linked bonds. Currency hedged to US Dollar (USD). The ETF's TER (total expense ratio) amounts to 0.09% p.a.. The ETF replicates the performance of the underlying index by sampling technique (buying a selection of the most relevant index constituents). The interest income (coupons) in the ETF is distributed to the investors (Semi annually). The iShares Core UK Gilts UCITS ETF USD Hedged (Dist) has 499m Euro assets under management. The ETF was launched on 5 October 2022 and is domiciled in Ireland.;Ishares Core UK GILTS UCITS ETF USD Hedged (Dist) se snaží sledovat index FTSE UK UK BILD BILTS ALL (USD Hedged). FTSE Mateřici UK UK konvenční praskliny všechny akcie (USD Hedged) Indexové stopy mincovní denominované vládní dluhopisy (konvenční Gilts) citované na londýnské burze cenných papírů, kromě indexovaných dluhopisů. Měna zajistila americký dolar (USD). TER (celkový poměr nákladů) ETF činí 0,09% p.a. ETF replikuje výkon základního indexu technikou vzorkování (nákup výběru nejdůležitějších složek indexu). Úrokové výnosy (kupóny) v ETF jsou distribuovány investorům (semifinále každoročně). Ishares Core UK Gilts UCITS ETF USD Hedged (dist) má 499 milionů euro aktiv správy. ETF byl spuštěn 5. října 2022 a má bydliště v Irsku.;0.09%;0.09;EUR 499m;499.0;EUR;USD;Ireland;iShares;5 October 2022;Distributing;Semi annually;Physical;;;Bonds, GBP, United Kingdom, Government, All maturities;;Dluhopisy;False;Globální;67.0;-8.36;;;-10.01;9.73;;;-0.86;;;-12.5;;;-20.75;;;;;Extracted (method 1);GLUH;0;4.57%;4.57;EUR 0.19;0.19;EUR;method2_regex;2025-09-18T16:52:31.232591;success;0;GB0004893086;2.41;;;;;;;;;;;;;;;;;;;Other;100.0;;;;;;;;;;;;;;;;;;;;;;;;;;;;;;;;;;;;;;;;;;;;;;;;;;;;;;;
IE00BKY58625;HSBC EUROPE EX UK SCREENED EQUITY UCITS ETF EUR (Dist);https://www.justetf.com/en/etf-profile.html?isin=IE00BKY58625;The HSBC EUROPE EX UK SCREENED EQUITY UCITS ETF EUR (Dist) seeks to track the FTSE Developed Europe ex UK ESG Low Carbon Select index. The FTSE Developed Europe ex UK ESG Low Carbon Select index tracks large and mid cap securities from Europe (excluding UK). The index aims to reduce carbon emissions and fossil fuel consumption by 50 percent each and to improve the ESG (environmental, social and governance) rating by 20 percent, compared to its parent index (FTSE Developed Europe index). Excluded sectors and companies: weapons, thermal coal, tobacco, nuclear power, non-compliance with UN Global Compact. The ETF's TER (total expense ratio) amounts to 0.15% p.a.. The ETF replicates the performance of the underlying index by full replication (buying all the index constituents). The dividends in the ETF are distributed to the investors (Semi annually). The HSBC EUROPE EX UK SCREENED EQUITY UCITS ETF EUR (Dist) is a small ETF with 81m Euro assets under management. The ETF was launched on 21 April 2022 and is domiciled in Ireland.;HSBC Europe Ex -UK Screened Equity UCITS ETF EUR (DIST) se snaží sledovat index FTSE vyvinul Europe ESG ESG Nízký uhlík. FTSE vyvinula index Evropské evropské ESG ESG ESG Low Carbon Select Stopy velké a střední čepice cenných papírů z Evropy (s výjimkou Velké Británie). Cílem indexu je snížit emise uhlíku a spotřebu fosilních paliv o 50 procent a zlepšit hodnocení ESG (environmentální, sociální a správa věcí veřejných) o 20 procent ve srovnání s jeho mateřským indexem (FTSE vyvinul index Europe). Vyloučené odvětví a společnosti: Zbraně, tepelné uhlí, tabák, jaderná energie, nedodržování globálního kompaktního OSN. TER (celkový poměr nákladů) ETF činí 0,15% p.a. ETF replikuje výkon podkladového indexu plnou replikací (nákup všech složek indexu). dividenday v ETF jsou distribuovány investorům (polo každoročně). HSBC Europe Exk Screened Equity UCITS ETF EUR (DIST) je malá ETF s managementem 81 milionů euro. ETF byl spuštěn 21. dubna 2022 a je sídlem v Irsku.;0.15%;0.15;EUR 81m;81.0;EUR;EUR;Ireland;HSBC;21 April 2022;Distributing;Semi annually;Physical;;;;Yes;Akcie;False;Evropa;169.0;5.52;43.58;;8.43;14.22;12.94;;0.39;0.99;;-14.22;-14.22;;-14.22;;;;;London Stock Exchange;HSXE;2;2.90%;2.9;EUR 0.47;0.47;EUR;method2_regex;2025-09-18T16:52:37.273337;success;0;Deutsche Börse AG;5.82;Nestlé SA;5.58;L'Oréal SA;5.04;Enel SpA;4.17;UBS Group AG;3.83;Siemens AG;3.32;Swiss Re AG;3.09;Novartis AG;2.97;Iberdrola SA;2.93;;;Other;31.46;France;21.12;Switzerland;19.38;Germany;18.89;Netherlands;9.15;Financials;30.35;Consumer Staples;15.24;Industrials;11.29;Technology;8.73;;;London Stock Exchange;GBP;HSXE;HSXE LN;;;London Stock Exchange;USD;HSXU;HSXU LN;;;;;;;;;;;;;;;;;;;;;3.0;54.0;22.0;1.0;6.0;5.0;20.0
IE000U7LIXH5;Invesco EUR AAA CLO UCITS ETF Dist;https://www.justetf.com/en/etf-profile.html?isin=IE000U7LIXH5;The Invesco EUR AAA CLO UCITS ETF Dist is an actively managed ETF. The ETF invests in EUR-denominated CLO bonds (collateralised loan obligations) with AAA (at least 80 percent) and AA (up to 20 percent) ratings. The ETF's TER (total expense ratio) amounts to 0.25% p.a.. The interest income (coupons) in the ETF is distributed to the investors (Quarterly). The Invesco EUR AAA CLO UCITS ETF Dist is a small ETF with 69m Euro assets under management. The ETF was launched on 10 February 2025 and is domiciled in Ireland.;Invesco EUR AAA Clo UCITS ETF Dist je aktivně spravovaná ETF. ETF investuje do CLO dluhopisů denominovaných na EUR (zajištěné úvěrové závazky) s hodnocením AAA (nejméně 80 procent) a AA (až 20 procent). TER (poměr celkových nákladů) ETF činí 0,25% P.A .. Úrokový výnos (kupóny) v ETF je distribuován investorům (čtvrtletně). Invesco EUR AAA CLO UCITS ETF DIST je malý ETF s managementem 69 milionů euro. ETF byl spuštěn 10. února 2025 a je se sídlem v Irsku.;0.25%;0.25;EUR 69m;69.0;EUR;EUR;Ireland;Invesco;10 February 2025;Distributing;Quarterly;Physical;;;Bonds, EUR, World, Corporate, All maturities, Credit derivatives;;Ostatní;False;Ostatní;49.0;;;;;;;;;;;;;;-0.4;;;;;London Stock Exchange;-;5;;;;;;;2025-09-18T16:52:45.106812;success;0;;;;;;;;;;;;;;;;;;;;;Other;100.0;;;;;;;;;;;;;;;;;;;London Stock Exchange;GBP;CLOD;;;;Borsa Italiana;EUR;CLOD;CLOD IMCLODEUIV;CLOD.MICLODEUiv.P;;London Stock Exchange;GBX;-;CLOD LNCLODGBIV;CLOD.LCLODGBiv.P;;SIX Swiss Exchange;CHF;CLOD;CLOD SWCLODCHIV;CLOD.SCLODCHiv.P;;XETRA;EUR;CLOD;CLOD GYCLODEUIV;CLOD.DECLODEUiv.P;;;;;;;;
